Cites,Authors,Title,Year,Source,Publisher,ArticleURL,CitesURL,GSRank,QueryDate,Type,DOI,ISSN,CitationURL,Volume,Issue,StartPage,EndPage,ECC,CitesPerYear,CitesPerAuthor,AuthorCount,Age,Abstract,FullTextURL,RelatedURL
851,"SL Brunton, JN Kutz","Data-driven science and engineering: Machine learning, dynamical systems, and control",2022,"","books.google.com","https://books.google.com/books?hl=en&lr=&id=rxNkEAAAQBAJ&oi=fnd&pg=PR9&dq=%22robust%22+%22machine+learning%22+%22unknowns%22&ots=kmD006Kw3q&sig=-rgKlexMwwMbk60nUDcg-jSAJdE","https://scholar.google.com/scholar?cites=7212843709067935602&as_sdt=2005&sciodt=2007&hl=en",17,"2022-07-14 10:19:14","BOOK","","","",,,,,851,851.00,426,2,1,"… Topics covered by the monograph include dimension reduction, machine learning, and robust … of the unknowns is updated. The iterative procedure continues through all unknowns and …","https://www.researchgate.net/profile/Steven-Brunton-2/publication/331230334_Singular_Value_Decomposition_SVD/links/5e229cb5299bf1e1fab9fc1a/Singular-Value-Decomposition-SVD.pdf","https://scholar.google.com/scholar?q=related:cr9nWyMrGWQJ:scholar.google.com/&scioq=%22robust%22+%22machine+learning%22+%22unknowns%22&hl=en&as_sdt=2007"
1,"D Schnürer, F Hammelmüller, HJ Holl…","Offline digital twin synchronization using measurement data and machine learning methods",2022,"Materials Today …","Elsevier","https://www.sciencedirect.com/science/article/pii/S2214785322012275?casa_token=WL23gRA88ZUAAAAA:8zKGpbbvF-d5qeIJeTiFFrNMnwI9AzD_nilyOpdRfnirU1x-8qbKNhjMyQbwKF5zQdFJiQEqGew","https://scholar.google.com/scholar?cites=12275089041597349922&as_sdt=2005&sciodt=2007&hl=en",36,"2022-07-14 10:19:14","HTML","","","",,,,,1,1.00,0,4,1,"… This work shows how machine learning tools can be used to … while maintaining interpretable and robust analytical models. … many unknowns that frequently occur in machine learning, …","https://www.sciencedirect.com/science/article/pii/S2214785322012275?casa_token=WL23gRA88ZUAAAAA:8zKGpbbvF-d5qeIJeTiFFrNMnwI9AzD_nilyOpdRfnirU1x-8qbKNhjMyQbwKF5zQdFJiQEqGew","https://scholar.google.com/scholar?q=related:IkCzdnLgWaoJ:scholar.google.com/&scioq=%22robust%22+%22machine+learning%22+%22unknowns%22&hl=en&as_sdt=2007"
3,"W Chen, S Dai, B Zheng, H Lin","An Efficient Evaluation Method for Automobile Shells Design Based on Semi-supervised Machine Learning Strategy",2022,"Journal of Physics: Conference …","iopscience.iop.org","https://iopscience.iop.org/article/10.1088/1742-6596/2171/1/012026/meta","https://scholar.google.com/scholar?cites=7648283557750614992&as_sdt=2005&sciodt=2007&hl=en",45,"2022-07-14 10:19:14","","10.1088/1742-6596/2171/1/012026","","",,,,,3,3.00,1,4,1,"… solid coupling knowledge and machine learning in this article, … to make the evaluation system more robust. The trained model … That is, there are more unknowns in the equations than the …","https://iopscience.iop.org/article/10.1088/1742-6596/2171/1/012026/pdf","https://scholar.google.com/scholar?q=related:0KsvmV8pJGoJ:scholar.google.com/&scioq=%22robust%22+%22machine+learning%22+%22unknowns%22&hl=en&as_sdt=2007"
0,"HR Karimi, N Wang, Z Man","Learning‐based robust control methodologies under information constraints",2022,"International Journal of Robust …","Wiley Online Library","https://onlinelibrary.wiley.com/doi/abs/10.1002/rnc.5973","",56,"2022-07-14 10:19:14","CITATION","10.1002/rnc.5973","","",,,,,0,0.00,0,3,1,"This editorial is dealing with the collection and report of some recent advances in learning-based robust control methodologies under information constraints. Both theoretical and …","https://onlinelibrary.wiley.com/doi/pdf/10.1002/rnc.5973","https://scholar.google.com/scholar?q=related:4iIE09dSuOQJ:scholar.google.com/&scioq=%22robust%22+%22machine+learning%22+%22unknowns%22&hl=en&as_sdt=2007"
11,"M Aliramezani, CR Koch, M Shahbakhti","Modeling, diagnostics, optimization, and control of internal combustion engines via modern machine learning techniques: A review and future directions",2022,"Progress in Energy and …","Elsevier","https://www.sciencedirect.com/science/article/pii/S0360128521000654?casa_token=xywshUgdH3oAAAAA:0CSPypqS3V3PwyCUcvS7Uzq6ik3AlVC6sdb4qUm74mmfc2mHMni_uPHwE2Zsu8cOUML3OS-nURU","https://scholar.google.com/scholar?cites=2977557236158404240&as_sdt=2005&sciodt=2007&hl=en",57,"2022-07-14 10:19:14","HTML","","","",,,,,11,11.00,4,3,1,"… state-of-the-art Machine Learning (ML) solutions for them is … -based models to provide robust and high fidelity solutions for … Meta-learning is the process of finding these unknowns to …","https://www.sciencedirect.com/science/article/pii/S0360128521000654?casa_token=xywshUgdH3oAAAAA:0CSPypqS3V3PwyCUcvS7Uzq6ik3AlVC6sdb4qUm74mmfc2mHMni_uPHwE2Zsu8cOUML3OS-nURU","https://scholar.google.com/scholar?q=related:kJadz4doUikJ:scholar.google.com/&scioq=%22robust%22+%22machine+learning%22+%22unknowns%22&hl=en&as_sdt=2007"
256,"A Fuster, P Goldsmith‐Pinkham…","Predictably unequal? The effects of machine learning on credit markets",2022,"The Journal of …","Wiley Online Library","https://onlinelibrary.wiley.com/doi/abs/10.1111/jofi.13090","https://scholar.google.com/scholar?cites=12394968742636036959&as_sdt=2005&sciodt=2007&hl=en",59,"2022-07-14 10:19:14","","10.1111/jofi.13090","","",,,,,256,256.00,85,3,1,"… Our qualitative conclusions are robust to this change in machine learning technique: when moving to the XGBoost model from the Nonlinear Logit model, there are more winners among …","https://onlinelibrary.wiley.com/doi/pdf/10.1111/jofi.13090","https://scholar.google.com/scholar?q=related:XyPkambGA6wJ:scholar.google.com/&scioq=%22robust%22+%22machine+learning%22+%22unknowns%22&hl=en&as_sdt=2007"
0,"B Hutchinson, N Rostamzadeh, C Greer…","Evaluation Gaps in Machine Learning Practice",2022,"arXiv preprint arXiv …","arxiv.org","https://arxiv.org/abs/2205.05256","",85,"2022-07-14 10:19:14","","","","",,,,,0,0.00,0,4,1,"… for robust accountability and governance practices [136]. … robust interdisciplinary debate and, ultimately, to nudge model evaluation practice away from abundant opaque unknowns. …","https://arxiv.org/pdf/2205.05256","https://scholar.google.com/scholar?q=related:3Qn9xcPdR-sJ:scholar.google.com/&scioq=%22robust%22+%22machine+learning%22+%22unknowns%22&hl=en&as_sdt=2007"
0,"J Chae, S Han, W Jung, M Cho…","Robust Imitation Learning against Variations in Environment Dynamics",2022,"… on Machine Learning","proceedings.mlr.press","https://proceedings.mlr.press/v162/chae22a.html","",87,"2022-07-14 10:19:14","","","","",,,,,0,0.00,0,5,1,"… In this paper, we propose a robust imitation learning (IL) framework that improves the robustness of IL when environment dynamics are perturbed. The existing IL framework trained in a …","https://proceedings.mlr.press/v162/chae22a/chae22a.pdf",""
6,"S van Cranenburgh, S Wang, A Vij, F Pereira…","Choice modelling in the age of machine learning-Discussion paper",2022,"Journal of Choice …","Elsevier","https://www.sciencedirect.com/science/article/pii/S1755534521000725","https://scholar.google.com/scholar?cites=3825661927334996168&as_sdt=2005&sciodt=2007&hl=en",92,"2022-07-14 10:19:14","HTML","","","",,,,,6,6.00,1,5,1,"… , machine learning offers opportunities to develop new ways for mining behaviourally meaningful, statistically robust … Below we try to formulate these unknowns into five major research …","https://www.sciencedirect.com/science/article/pii/S1755534521000725","https://scholar.google.com/scholar?q=related:yOiJ8UB7FzUJ:scholar.google.com/&scioq=%22robust%22+%22machine+learning%22+%22unknowns%22&hl=en&as_sdt=2007"
1,"J Lu, Y Xu, H Li, Z Cheng, Y Niu","Pmal: Open set recognition via robust prototype mining",2022,"… of the AAAI Conference on Artificial …","ojs.aaai.org","https://ojs.aaai.org/index.php/AAAI/article/view/20081","https://scholar.google.com/scholar?cites=13569948154015132538&as_sdt=2005&sciodt=2007&hl=en",100,"2022-07-14 10:19:14","","","","",,,,,1,1.00,0,5,1,"… We directly reject unknowns by thresholding SoftMax probability scores; (2) Distance based Rejection (DR). Unknowns are rejected by thresholding the minimum point-to-set distance, ie…","https://ojs.aaai.org/index.php/AAAI/article/download/20081/19840","https://scholar.google.com/scholar?q=related:eiuKDPMjUrwJ:scholar.google.com/&scioq=%22robust%22+%22machine+learning%22+%22unknowns%22&hl=en&as_sdt=2007"
3,"T Cody, E Lanus, DD Doyle…","Systematic training and testing for machine learning using combinatorial interaction testing",2022,"2022 IEEE International …","ieeexplore.ieee.org","https://ieeexplore.ieee.org/abstract/document/9787955/?casa_token=DPg2fZl5-g4AAAAA:0epVVyl51hZLIJk4tl2GMzody_hMyLPsMZbrigzUFxXh0Fk1E4GybaNnlCYdCH_UErmrfXafHQ","https://scholar.google.com/scholar?cites=13942574880806002822&as_sdt=2005&sciodt=2007&hl=en",103,"2022-07-14 10:19:14","","","","",,,,,3,3.00,1,4,1,"… that stress machine learning model performance, to select training sets that lead to robust model … Because of the unknowns associated with real-world deployment, defining notions of …","https://ieeexplore.ieee.org/iel7/9787917/9787918/09787955.pdf?casa_token=WLJdUnVO7xAAAAAA:sRFmI2Waso7z4LbgfZRmDiWhb7IpoBeL0Hj3v5kY8DCRXTLWnwHCvIG-da-1TlvbfR7TKlypng","https://scholar.google.com/scholar?q=related:huC5sPv5fcEJ:scholar.google.com/&scioq=%22robust%22+%22machine+learning%22+%22unknowns%22&hl=en&as_sdt=2007"
0,"C Dvorkin, S Mishra-Sharma, B Nord, VA Villar…","Machine Learning and Cosmology",2022,"arXiv preprint arXiv …","arxiv.org","https://arxiv.org/abs/2203.08056","",130,"2022-07-14 10:19:14","","","","",,,,,0,0.00,0,5,1,"… Unknowns include the particle nature of dark matter, the … for development of more robust machine learning methods, … for building more robust machine learning methods that will not …","https://arxiv.org/pdf/2203.08056","https://scholar.google.com/scholar?q=related:R8JYqGHOacgJ:scholar.google.com/&scioq=%22robust%22+%22machine+learning%22+%22unknowns%22&hl=en&as_sdt=2007"
0,"AK Bowe, G Lightbody, A Staines, DM Murray","Big data, machine learning, and population health: predicting cognitive outcomes in childhood",2022,"Pediatric Research","nature.com","https://www.nature.com/articles/s41390-022-02137-1","",133,"2022-07-14 10:19:14","HTML","","","",,,,,0,0.00,0,4,1,"… To date, the application of machine learning to address population health challenges in … This review explores the potential role of machine learning and big data analysis in the …","https://www.nature.com/articles/s41390-022-02137-1","https://scholar.google.com/scholar?q=related:gBuH6IaspuwJ:scholar.google.com/&scioq=%22robust%22+%22machine+learning%22+%22unknowns%22&hl=en&as_sdt=2007"
0,"N Escudero, P Costas, MW Hardt…","Machine Learning Based Visual Navigation System Architecture for Aam Operations with A Discussion on its Certifiability",2022,"2022 Integrated …","ieeexplore.ieee.org","https://ieeexplore.ieee.org/abstract/document/9771519/?casa_token=I7-z4ecDH50AAAAA:1KegFeg1B3eKJQvwL5HLwYR0mwYuMuXUS1gr0DMd2_quKQ6GnlTIGikHg3s1s1wpHM_-5pSDIQ","",153,"2022-07-14 10:19:14","","","","",,,,,0,0.00,0,4,1,"… The proposed design not only aims to be compatible with current certification requirements for its further use in real operations, but also to provide an accurate, resilient and robust …","https://ieeexplore.ieee.org/iel7/9771380/9771476/09771519.pdf?casa_token=N5bGbcPnseQAAAAA:fnhPweskvxOx7kBNwwYUA-oou8yBbvvTBWOIzJvJFexgSNt6J7D5O6sSrQ5sr-mgnxDg1Z1p0w","https://scholar.google.com/scholar?q=related:0GAH6RACXHkJ:scholar.google.com/&scioq=%22robust%22+%22machine+learning%22+%22unknowns%22&hl=en&as_sdt=2007"
2,"DH Ross, RP Seguin, AM Krinsky…","High-throughput measurement and machine learning-based prediction of collision cross sections for drugs and drug metabolites",2022,"Journal of the American …","ACS Publications","https://pubs.acs.org/doi/abs/10.1021/jasms.2c00111?casa_token=9ov2d6cxwpkAAAAA:H297xKsjo7fYu43ZyKQS9ebBL6-bvcP5YxEVUWJXb-3-58-nNxFnxqgTt9COqJoZXzCW5yQzNHSyaoC_","https://scholar.google.com/scholar?cites=15946108161791717814&as_sdt=2005&sciodt=2007&hl=en",156,"2022-07-14 10:19:14","","10.1021/jasms.2c00111","","",,,,,2,2.00,1,4,1,"… parameter for identification of unknowns. A current limitation … database to train a machine learning-based CCS prediction … multiple metrics, with robust performance between training and …","https://pubs.acs.org/doi/full/10.1021/jasms.2c00111?casa_token=Yxa0PhucTG4AAAAA:X_B5XFV_2RaR6KOfvEIMAeNdGMmOuFdQTH1nTM3SP-3KN1TVEx44rdDC96SMX-bsPOdhkkjUzR7dSAMW","https://scholar.google.com/scholar?q=related:tnGNFeP0S90J:scholar.google.com/&scioq=%22robust%22+%22machine+learning%22+%22unknowns%22&hl=en&as_sdt=2007"
2,"A Guarino, R Trinchero, F Canavero, G Spagnuolo","A fast fuel cell parametric identification approach based on machine learning inverse models",2022,"Energy","Elsevier","https://www.sciencedirect.com/science/article/pii/S0360544221023884?casa_token=2zpvZXWsXcMAAAAA:mpJ-jC7b872k7PzxVmxqilXQlPEsNiPBbuyDXuVHc2_sEoZ_g9w_jHXzNawLIT_yjn5oIYzOq5o","https://scholar.google.com/scholar?cites=5689293503788649162&as_sdt=2005&sciodt=2007&hl=en",191,"2022-07-14 10:19:14","HTML","","","",,,,,2,2.00,1,4,1,"… The latter requires a robust approach that takes the impedance … Machine learning (ML) has been using more and more in … in which the number of unknowns to be estimated during the …","https://www.sciencedirect.com/science/article/pii/S0360544221023884?casa_token=2zpvZXWsXcMAAAAA:mpJ-jC7b872k7PzxVmxqilXQlPEsNiPBbuyDXuVHc2_sEoZ_g9w_jHXzNawLIT_yjn5oIYzOq5o","https://scholar.google.com/scholar?q=related:yopCbExu9E4J:scholar.google.com/&scioq=%22robust%22+%22machine+learning%22+%22unknowns%22&hl=en&as_sdt=2007"
1,"IR Manchester, M Revay…","Contraction-Based Methods for Stable Identification and Robust Machine Learning: a Tutorial",2021,"2021 60th IEEE …","ieeexplore.ieee.org","https://ieeexplore.ieee.org/abstract/document/9683128/?casa_token=O-KNXksyFikAAAAA:KpXtn6n93IaNKRxRQG-NNz9h3a_ku-AJzaasvUF2ysotf9Ketdy01626FNYuf5OmCeCGOI5Oug","https://scholar.google.com/scholar?cites=17542649710613375515&as_sdt=2005&sciodt=2007&hl=en",2,"2022-07-14 10:19:14","","","","",,,,,1,1.00,0,3,1,"… for robust system identification and machine learning, building upon ideas from robust control [… above condition is now linear in the unknowns V and f. However, there are still two issues: …","https://ieeexplore.ieee.org/iel7/9682670/9682776/09683128.pdf?casa_token=ac_1tUbUQm4AAAAA:7JGiQmWjWu0yGNoivmOXj-u5NvTvg5U_nXX8oPPniocPNSIlXm58x8m-L3D20GWKUmmYDuiCyQ","https://scholar.google.com/scholar?q=related:Gyo4hPcCdPMJ:scholar.google.com/&scioq=%22robust%22+%22machine+learning%22+%22unknowns%22&hl=en&as_sdt=2007"
8,"P Zhao, YJ Zhang, ZH Zhou","Exploratory machine learning with unknown unknowns",2021,"Proceedings of the AAAI Conference on …","ojs.aaai.org","https://ojs.aaai.org/index.php/AAAI/article/view/17313","https://scholar.google.com/scholar?cites=18018087314427594263&as_sdt=2005&sciodt=2007&hl=en",7,"2022-07-14 10:19:14","","","","",,,,,8,8.00,3,3,1,"… machine learning (ExML), which explores more feature information to deal with unknown unknowns … In the context of machine learning, our proposed framework encourages learners to …","https://ojs.aaai.org/index.php/AAAI/article/view/17313/17120","https://scholar.google.com/scholar?q=related:F8Zt1PIaDfoJ:scholar.google.com/&scioq=%22robust%22+%22machine+learning%22+%22unknowns%22&hl=en&as_sdt=2007"
0,"A Raghunathan","Adversarially Robust Machine Learning with Guarantees",2021,"","search.proquest.com","https://search.proquest.com/openview/c00561b7a4ea5121a220d11021e44b74/1?pq-origsite=gscholar&cbl=18750&diss=y","",12,"2022-07-14 10:19:14","BOOK","","","",,,,,0,0.00,0,1,1,"Abstract Machine learning (ML) systems are remarkably successful on a variety of benchmarks across several domains. In these benchmarks, the test data points, though not identical, …","https://stacks.stanford.edu/file/druid:sw855vz6069/aditi-thesis-4-augmented.pdf","https://scholar.google.com/scholar?q=related:xCRgZKIPiKoJ:scholar.google.com/&scioq=%22robust%22+%22machine+learning%22+%22unknowns%22&hl=en&as_sdt=2007"
8,"CW Wang, Y Hao, R Di Gianfilippo, J Sugai, J Li…","Machine learning-assisted immune profiling stratifies peri-implantitis patients with unique microbial colonization and clinical outcomes",2021,"Theranostics","ncbi.nlm.nih.gov","https://www.ncbi.nlm.nih.gov/pmc/articles/PMC8171076/","https://scholar.google.com/scholar?cites=16385523592866484993&as_sdt=2005&sciodt=2007&hl=en",15,"2022-07-14 10:19:14","HTML","","","",,,,,8,8.00,1,6,1,"… Thus, we engineered a robust machine learning pipeline, … To further enhance the rigor of immunoscoring, machine learning-… Several robust methods have been developed to improve …","https://www.ncbi.nlm.nih.gov/pmc/articles/PMC8171076/","https://scholar.google.com/scholar?q=related:AdOWu-QSZeMJ:scholar.google.com/&scioq=%22robust%22+%22machine+learning%22+%22unknowns%22&hl=en&as_sdt=2007"
5,"W Hoffman","AI and the Future of Cyber Competition",2021,"Center for Security and Emerging Technology …","cset.georgetown.edu","https://cset.georgetown.edu/wp-content/uploads/CSET-AI-and-the-Future-of-Cyber-Competition-4.pdf","https://scholar.google.com/scholar?cites=18070021714956268630&as_sdt=2005&sciodt=2007&hl=en",24,"2022-07-14 10:19:14","PDF","","","",,,,,5,5.00,5,1,1,"… Yet even the most robust machine learning cyber defenses could have potentially fatal flaws that … Even with the “known-unknowns,” several imperatives emerge from this forecast: …","https://cset.georgetown.edu/wp-content/uploads/CSET-AI-and-the-Future-of-Cyber-Competition-4.pdf","https://scholar.google.com/scholar?q=related:VjSQuwKdxfoJ:scholar.google.com/&scioq=%22robust%22+%22machine+learning%22+%22unknowns%22&hl=en&as_sdt=2007"
2,"Q Sun, W Ampomah, J You, M Cather, R Balch","Practical CO2—WAG Field Operational Designs Using Hybrid Numerical-Machine-Learning Approaches",2021,"Energies","mdpi.com","https://www.mdpi.com/1002008","https://scholar.google.com/scholar?cites=7540146801264386464&as_sdt=2005&sciodt=2007&hl=en",33,"2022-07-14 10:19:14","","","","",,,,,2,2.00,0,5,1,"… In this article, a robust machine-learning assisted multi-objective optimization workflow is … , and water production rates were considered primary unknowns to calculate the error function. …","https://www.mdpi.com/1996-1073/14/4/1055/pdf","https://scholar.google.com/scholar?q=related:oGGp-5D7o2gJ:scholar.google.com/&scioq=%22robust%22+%22machine+learning%22+%22unknowns%22&hl=en&as_sdt=2007"
0,"V Haller","Ecological models for threat management: Considering the unknowns using numerical analysis and machine learning",2021,"","eprints.qut.edu.au","https://eprints.qut.edu.au/210467/1/Vanessa_Haller_Thesis.pdf","",34,"2022-07-14 10:19:14","PDF","","","",,,,,0,0.00,0,1,1,"… that extends on the traditional scientific method to allow for the thorough investigation of uncertainty in especially data poor system utilising new techniques such as machine learning. …","https://eprints.qut.edu.au/210467/1/Vanessa_Haller_Thesis.pdf","https://scholar.google.com/scholar?q=related:rMbS78HA4hoJ:scholar.google.com/&scioq=%22robust%22+%22machine+learning%22+%22unknowns%22&hl=en&as_sdt=2007"
1,"S Wunsch","Modern machine learning in the presence of systematic uncertainties for robust and optimized multivariate data analysis in high-energy particle physics",2021,"","cds.cern.ch","https://cds.cern.ch/record/2751100","https://scholar.google.com/scholar?cites=9309770824859004602&as_sdt=2005&sciodt=2007&hl=en",35,"2022-07-14 10:19:14","","","","",,,,,1,1.00,1,1,1,"… such a machine learning based … machine learning at this stage of an analysis. To allow for a precise and reliable physics measurement, the application of the chosen machine learning …","https://cds.cern.ch/record/2751100/files/CERN-THESIS-2021-005.pdf","https://scholar.google.com/scholar?q=related:ui4EbD3zMoEJ:scholar.google.com/&scioq=%22robust%22+%22machine+learning%22+%22unknowns%22&hl=en&as_sdt=2007"
47,"P Choudhury, RT Allen…","Machine learning for pattern discovery in management research",2021,"Strategic Management …","Wiley Online Library","https://onlinelibrary.wiley.com/doi/abs/10.1002/smj.3215?casa_token=ceAGC8UXh_kAAAAA:Gxfri4YwkrOJQRE-GhLpWYE-PJei0oJx78sHpt9CiJJO2DuimYMAI8fMfGYZw7nZb2lNWyO1km0y-Xs","https://scholar.google.com/scholar?cites=6564128129831867788&as_sdt=2005&sciodt=2007&hl=en",40,"2022-07-14 10:19:14","","10.1002/smj.3215","","",,,,,47,47.00,16,3,1,"… relationships when there are many unknowns in the data. … supervised machine learning methods for discovering robust patterns … Discovering new and robust empirical patterns can help …","https://onlinelibrary.wiley.com/doi/pdf/10.1002/smj.3215?casa_token=GvPwoH6DIS0AAAAA:AxZqhbhXAyIPeI1o3cVqFtLaJmjj6dYfXamaG7IHcwoSmJypvS262XEBNzosPU8rH6wWmxaQWFV7I2c","https://scholar.google.com/scholar?q=related:jBXHfsF3GFsJ:scholar.google.com/&scioq=%22robust%22+%22machine+learning%22+%22unknowns%22&hl=en&as_sdt=2007"
11,"HA Arief, T Wiktorski, PJ Thomas","A survey on distributed fibre optic sensor data modelling techniques and machine learning algorithms for multiphase fluid flow estimation",2021,"Sensors","mdpi.com","https://www.mdpi.com/1074084","https://scholar.google.com/scholar?cites=3440350662206310000&as_sdt=2005&sciodt=2007&hl=en",46,"2022-07-14 10:19:14","","","","",,,,,11,11.00,4,3,1,"… Data-driven VFMs, however, work by using machine learning … models (lead by machine learning algorithms),without basing … address the unknowns and (eventually) provide robust and …","https://www.mdpi.com/1424-8220/21/8/2801/pdf","https://scholar.google.com/scholar?q=related:cEaWE7OUvi8J:scholar.google.com/&scioq=%22robust%22+%22machine+learning%22+%22unknowns%22&hl=en&as_sdt=2007"
0,"K Madala, H Do","Resolving Confusion of Unknowns in Autonomous Vehicles: Types and Perspectives.",2021,"VEHITS","scitepress.org","https://www.scitepress.org/Papers/2021/104821/104821.pdf","",50,"2022-07-14 10:19:14","PDF","","","",,,,,0,0.00,0,2,1,"… In this example, we can observe that identifying unknowns of a machine learning model helps … If we use algorithms that are robust and not stochastic in the autonomous vehicle software, …","https://www.scitepress.org/Papers/2021/104821/104821.pdf","https://scholar.google.com/scholar?q=related:IewGSvv0UPYJ:scholar.google.com/&scioq=%22robust%22+%22machine+learning%22+%22unknowns%22&hl=en&as_sdt=2007"
17,"A Heinlein, A Klawonn, M Lanser…","Combining machine learning and domain decomposition methods for the solution of partial differential equations—A review",2021,"GAMM‐Mitteilungen","Wiley Online Library","https://onlinelibrary.wiley.com/doi/abs/10.1002/gamm.202100001","https://scholar.google.com/scholar?cites=12381439643219407792&as_sdt=2005&sciodt=2007&hl=en",53,"2022-07-14 10:19:14","","10.1002/gamm.202100001","","",,,,,17,17.00,4,4,1,"… are needed to define a robust coarse space. Additionally, two … approaches which combine machine learning with ideas … and also for the number of unknowns in each subdomain. The …","https://onlinelibrary.wiley.com/doi/pdf/10.1002/gamm.202100001","https://scholar.google.com/scholar?q=related:sDMIfsG106sJ:scholar.google.com/&scioq=%22robust%22+%22machine+learning%22+%22unknowns%22&hl=en&as_sdt=2007"
44,"RJ Chen, MY Lu, TY Chen, DFK Williamson…","Synthetic data in machine learning for medicine and healthcare",2021,"Nature Biomedical …","nature.com","https://www.nature.com/articles/s41551-021-00751-8","https://scholar.google.com/scholar?cites=9156634284682258897&as_sdt=2005&sciodt=2007&hl=en",55,"2022-07-14 10:19:14","HTML","","","",,,,,44,44.00,9,5,1,"… -truth labels, the algorithms are as effective or as robust as the data they are supplied with. … And although there may always exist unknown unknowns during algorithm deployment, …","https://www.nature.com/articles/s41551-021-00751-8","https://scholar.google.com/scholar?q=related:0SmmNF7mEn8J:scholar.google.com/&scioq=%22robust%22+%22machine+learning%22+%22unknowns%22&hl=en&as_sdt=2007"
14,"E Blasch, T Pham, CY Chong, W Koch…","Machine learning/artificial intelligence for sensor data fusion–opportunities and challenges",2021,"IEEE Aerospace and …","ieeexplore.ieee.org","https://ieeexplore.ieee.org/abstract/document/9475913/?casa_token=cqfPjhaGb0MAAAAA:6btPLQDOqcaKULtbvaWTNtpNlJd0BiyTy4KlM4K40O1p4J1R5WbuymbYuubcAPBpZ3WaaqQRlw","https://scholar.google.com/scholar?cites=1642827285937290140&as_sdt=2005&sciodt=2007&hl=en",62,"2022-07-14 10:19:14","","","","",,,,,14,14.00,3,5,1,"… The construction of AI models needs to be insensitive to various “unknowns,” robust to noise, and free from attack. The AI systems require adaptation to operational conditions, graceful …","https://ieeexplore.ieee.org/iel7/62/9475847/09475913.pdf?casa_token=HTTsX9vugYgAAAAA:INgxiPUedreD6fhSl3jTaTqjmbjqLoevSOOaOvZSI-UdsU-FyS-EZNboO1nW_FvVBl2SdyBy0A","https://scholar.google.com/scholar?q=related:nHucZbZ-zBYJ:scholar.google.com/&scioq=%22robust%22+%22machine+learning%22+%22unknowns%22&hl=en&as_sdt=2007"
