Cites,Authors,Title,Year,Source,Publisher,ArticleURL,CitesURL,GSRank,QueryDate,Type,DOI,ISSN,CitationURL,Volume,Issue,StartPage,EndPage,ECC,CitesPerYear,CitesPerAuthor,AuthorCount,Age,Abstract,FullTextURL,RelatedURL
33,"E Hubinger, C van Merwijk, V Mikulik, J Skalse…","Risks from learned optimization in advanced machine learning systems",2019,"arXiv preprint arXiv …","arxiv.org","https://arxiv.org/abs/1906.01820","https://scholar.google.com/scholar?cites=4819626257384789781&as_sdt=2005&sciodt=2007&hl=en",143,"2022-07-14 10:19:14","","","","",,,,,33,11.00,7,5,3,"… It is indeed because of these unknowns that we believe the problem is important to analyze. … To distinguish between the two different paths to robust alignment, we will use the term …","https://arxiv.org/pdf/1906.01820","https://scholar.google.com/scholar?q=related:FdeQrYvA4kIJ:scholar.google.com/&scioq=%22robust%22+%22machine+learning%22+%22unknowns%22&hl=en&as_sdt=2007"
1,"Y Zhu, T Johnson, ZF Zhang, Y Fang…","A preconditioned iterative joint inversion method on unstructured mesh with cross-gradient constraints",2019,"AGU Fall Meeting …","ui.adsabs.harvard.edu","https://ui.adsabs.harvard.edu/abs/2019AGUFM.S53D0491Z/abstract","https://scholar.google.com/scholar?cites=4054681795053381465&as_sdt=2005&sciodt=2007&hl=en",146,"2022-07-14 10:19:14","","","","",,,,,1,0.33,0,5,3,"… instable due to increased number of unknowns and singular Hessian matrix of the cross-… It was demonstrated that the preconditioner of the PIJI was essential to achieve a robust and …","","https://scholar.google.com/scholar?q=related:WWdmJ5wfRTgJ:scholar.google.com/&scioq=%22robust%22+%22machine+learning%22+%22unknowns%22&hl=en&as_sdt=2007"
8,"S Mohseni, A Jagadeesh, Z Wang","Predicting model failure using saliency maps in autonomous driving systems",2019,"arXiv preprint arXiv:1905.07679","arxiv.org","https://arxiv.org/abs/1905.07679","https://scholar.google.com/scholar?cites=13007410945004455752&as_sdt=2005&sciodt=2007&hl=en",160,"2022-07-14 10:19:14","","","","",,,,,8,2.67,3,3,3,"… How can we evaluate machine learning systems for safety … compared to other commercial machine learning products, like … distilled student model is more robust to adversary attacks. …","https://arxiv.org/pdf/1905.07679","https://scholar.google.com/scholar?q=related:SMeEmFabg7QJ:scholar.google.com/&scioq=%22robust%22+%22machine+learning%22+%22unknowns%22&hl=en&as_sdt=2007"
200,"M Yin, J Wortman Vaughan, H Wallach","Understanding the effect of accuracy on trust in machine learning models",2019,"… of the 2019 chi conference on …","dl.acm.org","https://dl.acm.org/doi/abs/10.1145/3290605.3300509?casa_token=Yr684BaEeDoAAAAA:LAy15BWiUL6T-vH7hgOAS2swEnN_rGnKDKKWE7osNiQUX-JxEWHdt4HHSH-O0N-vs5wAHzeXKrCwpA","https://scholar.google.com/scholar?cites=7401251308229638929&as_sdt=2005&sciodt=2007&hl=en",162,"2022-07-14 10:19:14","","10.1145/3290605.3300509","","",,,,,200,66.67,67,3,3,"… Our second experiment consists of two sub-experiments designed to test whether our results are robust to different levels of observed accuracy. In one, the observed accuracy was fixed …","https://dl.acm.org/doi/pdf/10.1145/3290605.3300509?casa_token=9yOrG6RQfKYAAAAA:nLQmDIGmblQCfkVjGN0-nbHYU-MwIklg-DqUsCqvLraM6LGO-LHIhAE-hJa1lIcy7jXM2OAsQF8l9w","https://scholar.google.com/scholar?q=related:ETts8NmGtmYJ:scholar.google.com/&scioq=%22robust%22+%22machine+learning%22+%22unknowns%22&hl=en&as_sdt=2007"
27,"M Boehm, I Antonov, S Baunsgaard, M Dokter…","SystemDS: A declarative machine learning system for the end-to-end data science lifecycle",2019,"arXiv preprint arXiv …","arxiv.org","https://arxiv.org/abs/1909.02976","https://scholar.google.com/scholar?cites=4693829463819527813&as_sdt=2005&sciodt=2007&hl=en",176,"2022-07-14 10:19:14","","","","",,,,,27,9.00,5,5,3,"Machine learning (ML) applications become increasingly common in many domains. ML systems to execute these workloads include numerical computing frameworks and libraries, ML …","https://arxiv.org/pdf/1909.02976","https://scholar.google.com/scholar?q=related:haY5QwfVI0EJ:scholar.google.com/&scioq=%22robust%22+%22machine+learning%22+%22unknowns%22&hl=en&as_sdt=2007"
42,"S Pandit, T Banerjee, I Srivastava, S Nie, D Pan","Machine learning-assisted array-based biomolecular sensing using surface-functionalized carbon dots",2019,"ACS sensors","ACS Publications","https://pubs.acs.org/doi/abs/10.1021/acssensors.9b01227","https://scholar.google.com/scholar?cites=10513993921954355014&as_sdt=2005&sciodt=2007&hl=en",184,"2022-07-14 10:19:14","","10.1021/acssensors.9b01227","","",,,,,42,14.00,8,5,3,"… pattern-recognition method, Machine Learning (ML), enables a … The utility of using machine learning algorithms in pattern … In analyzing the array-based sensing data, Machine Learning …","https://pubs.acs.org/doi/pdf/10.1021/acssensors.9b01227","https://scholar.google.com/scholar?q=related:Rpe0OMQ16ZEJ:scholar.google.com/&scioq=%22robust%22+%22machine+learning%22+%22unknowns%22&hl=en&as_sdt=2007"
65,"C Englert, P Galler, P Harris, M Spannowsky","Machine learning uncertainties with adversarial neural networks",2019,"The European Physical …","Springer","https://link.springer.com/article/10.1140/epjc/s10052-018-6511-8","https://scholar.google.com/scholar?cites=16263172697566344783&as_sdt=2005&sciodt=2007&hl=en",186,"2022-07-14 10:19:14","HTML","10.1140/epjc/s10052-018-6511-8","","",,,,,65,21.67,16,4,3,"… This motivates MVAs as an ideal choice to decide on how to propagate such unknowns to … by the ANN is therefore crucial to obtaining robust and reliable constraints that inform a new …","https://link.springer.com/article/10.1140/epjc/s10052-018-6511-8","https://scholar.google.com/scholar?q=related:T_ZFB2dlsuEJ:scholar.google.com/&scioq=%22robust%22+%22machine+learning%22+%22unknowns%22&hl=en&as_sdt=2007"
9,"D Yeap, PT Hichwa, MY Rajapakse…","Machine vision methods, natural language processing, and machine learning algorithms for automated dispersion plot analysis and chemical identification from …",2019,"Analytical …","ACS Publications","https://pubs.acs.org/doi/abs/10.1021/acs.analchem.9b01428?casa_token=ghUWh-u5ItcAAAAA:jx-4_T290_5SEV0ZIZxpZ5T0G476OMJ3NjxcWtqX-m-jna7meVGij4h3gQ3uoBG45QOulL2fiEL7j8Ol","https://scholar.google.com/scholar?cites=3500739246204265493&as_sdt=2005&sciodt=2007&hl=en",193,"2022-07-14 10:19:14","","10.1021/acs.analchem.9b01428","","",,,,,9,3.00,2,4,3,"… the data, and finally prediction of unknowns using the model. … robust algorithm in predicting the presence of a specific compound. It is worth noting that any supervised machine learning (…","https://pubs.acs.org/doi/full/10.1021/acs.analchem.9b01428?casa_token=RD53B8nDeN8AAAAA:8VrDwe33zKES3wDhlQn_Twf5wgg0P7eCTrA9_2t9QNmZlJWx5ACQt4yNSiqm5vTN0I5RB_DB9dv_CgCg","https://scholar.google.com/scholar?q=related:FSRG9csflTAJ:scholar.google.com/&scioq=%22robust%22+%22machine+learning%22+%22unknowns%22&hl=en&as_sdt=2007"
963,"B Biggio, F Roli","Wild patterns: Ten years after the rise of adversarial machine learning",2018,"Pattern Recognition","Elsevier","https://www.sciencedirect.com/science/article/pii/S0031320318302565?casa_token=SUbZ7NzmbCEAAAAA:0TxSzstMlwFKKZmWRY6KNFxVe-9-SvZcGTY43QVwkfdCWTIS0xXkQpPzQlOuSUSL0a3-f9X_dBM","https://scholar.google.com/scholar?cites=9261985116174637265&as_sdt=2005&sciodt=2007&hl=en",5,"2022-07-14 10:19:14","HTML","","","",,,,,963,240.75,482,2,4,"… , as modeling attacks relies on known unknowns, while unknown unknowns are … Machine learning algorithms should be able to detect unknown unknowns using robust methods for …","https://www.sciencedirect.com/science/article/pii/S0031320318302565?casa_token=SUbZ7NzmbCEAAAAA:0TxSzstMlwFKKZmWRY6KNFxVe-9-SvZcGTY43QVwkfdCWTIS0xXkQpPzQlOuSUSL0a3-f9X_dBM","https://scholar.google.com/scholar?q=related:0ViLHGQuiYAJ:scholar.google.com/&scioq=%22robust%22+%22machine+learning%22+%22unknowns%22&hl=en&as_sdt=2007"
25,"Y Chung, PJ Haas, E Upfal, T Kraska","Unknown examples & machine learning model generalization",2018,"arXiv preprint arXiv:1808.08294","arxiv.org","https://arxiv.org/abs/1808.08294","https://scholar.google.com/scholar?cites=13917496796373744512&as_sdt=2005&sciodt=2007&hl=en",6,"2022-07-14 10:19:14","","","","",,,,,25,6.25,6,4,4,"… unknowns even when there is no covariate shift (p = p ). Moreover, in general, approximating unknown unknowns … , we used datasets from UCI Machine Learning repository1 as base …","https://arxiv.org/pdf/1808.08294","https://scholar.google.com/scholar?q=related:gHt-JpnhJMEJ:scholar.google.com/&scioq=%22robust%22+%22machine+learning%22+%22unknowns%22&hl=en&as_sdt=2007"
0,"D Wishart","Computational Tools for the Identification of Unknowns (Video)",2018,"","sciforum.net","https://sciforum.net/paper/view/conference/5855","",16,"2022-07-14 10:19:14","KEYNOTE","","","",,,,,0,0.00,0,1,4,"… unknowns. While experimental techniques such as suspect screening can lead to the occasional “lucky” hit, a more rapid and robust … combined with machine learning to accurately …","",""
4,"A Preece, D Harborne, R Raghavendra…","Provisioning robust and interpretable AI/ML-based service bundles",2018,"MILCOM 2018-2018 …","ieeexplore.ieee.org","https://ieeexplore.ieee.org/abstract/document/8599838/?casa_token=pHEIs6S5fQIAAAAA:bV4M-dwUXjuKvc9ipvXDEcKgTyzj-fB3-DrAf1S_7I9eVE6zeTRp3j8a2yc34YfvPeCqV9Y9RA","https://scholar.google.com/scholar?cites=12165944937326628741&as_sdt=2005&sciodt=2007&hl=en",20,"2022-07-14 10:19:14","","","","",,,,,4,1.00,1,4,4,"… intelligence (AI) and machine learning (ML) technologies. … services can make a system robust to ‘unknown unknowns’. … intelligence (AI) and machine learning (ML) approaches for tasks …","https://ieeexplore.ieee.org/iel7/8580348/8599678/08599838.pdf?casa_token=oi2fsOays2IAAAAA:L8_0bR4-USikPgsIcTyvx-2ZRnDLjXpFkiJmBTNOTGJJrQPbtU2rCXQQ-AfOYg_JEi7lnBd5Bw","https://scholar.google.com/scholar?q=related:hc9QanYe1qgJ:scholar.google.com/&scioq=%22robust%22+%22machine+learning%22+%22unknowns%22&hl=en&as_sdt=2007"
117,"A Preece, D Harborne, D Braines, R Tomsett…","Stakeholders in explainable AI",2018,"arXiv preprint arXiv …","arxiv.org","https://arxiv.org/abs/1810.00184","https://scholar.google.com/scholar?cites=7849975619225399687&as_sdt=2005&sciodt=2007&hl=en",29,"2022-07-14 10:19:14","","","","",,,,,117,29.25,23,5,4,"… From an epistemological perspective, we can consider the familiar framing in terms of knowns and unknowns: Known knowns: for an AI system based on machine learning, these …","https://arxiv.org/pdf/1810.00184","https://scholar.google.com/scholar?q=related:hzFoFzy38GwJ:scholar.google.com/&scioq=%22robust%22+%22machine+learning%22+%22unknowns%22&hl=en&as_sdt=2007"
809,"AE Maxwell, TA Warner, F Fang","Implementation of machine-learning classification in remote sensing: An applied review",2018,"International Journal of Remote …","Taylor & Francis","https://www.tandfonline.com/doi/abs/10.1080/01431161.2018.1433343","https://scholar.google.com/scholar?cites=16468976420758583782&as_sdt=2005&sciodt=2007&hl=en",37,"2022-07-14 10:19:14","","10.1080/01431161.2018.1433343","","",,,,,809,202.25,270,3,4,"… RF since it has generally been found to be robust to parameter settings. Using the default … data quality is uncertain, an algorithm that is robust to these issues should be used, such as …","https://www.tandfonline.com/doi/pdf/10.1080/01431161.2018.1433343?needAccess=true&","https://scholar.google.com/scholar?q=related:5nmZXcyOjeQJ:scholar.google.com/&scioq=%22robust%22+%22machine+learning%22+%22unknowns%22&hl=en&as_sdt=2007"
121,"D Miller, L Nicholson, F Dayoub…","Dropout sampling for robust object detection in open-set conditions",2018,"… on Robotics and …","ieeexplore.ieee.org","https://ieeexplore.ieee.org/abstract/document/8460700/?casa_token=O8Eq7NvbeJgAAAAA:iz3BDHnFFrgrlcRV1j_UWawWwd57bOS7XipLCqE_ObOPHk-VOYa7z4iaJHTBivyQoO3qgNvulw","https://scholar.google.com/scholar?cites=14714432469954040683&as_sdt=2005&sciodt=2007&hl=en",39,"2022-07-14 10:19:14","","","","",,,,,121,30.25,30,4,4,"… Current attempts at improving open-set performance of machine learning systems have focused on formally accounting for unknown unknowns [4], [5], [15] by identifying and rejecting …","https://ieeexplore.ieee.org/iel7/8449910/8460178/08460700.pdf?casa_token=Go0bo4iJNZEAAAAA:mWefdxbwAgwUlbdHXA2qsXkl9uohRJp9XvWPa2wToSVxHzjezNkW9YUHhXwgk19lXw2WXpJSZw","https://scholar.google.com/scholar?q=related:a5MV-14qNMwJ:scholar.google.com/&scioq=%22robust%22+%22machine+learning%22+%22unknowns%22&hl=en&as_sdt=2007"
28,"CP Ho, M Petrik, W Wiesemann","Fast Bellman updates for robust MDPs",2018,"… on Machine Learning","proceedings.mlr.press","http://proceedings.mlr.press/v80/ho18a.html","https://scholar.google.com/scholar?cites=12071945544730669372&as_sdt=2005&sciodt=2007&hl=en",42,"2022-07-14 10:19:14","","","","",,,,,28,7.00,9,3,4,"… We describe two efficient, and exact, algorithms for computing Bellman updates in robust Markov … The second algorithm uses bisection to compute updates for robust MDPs with s-…","http://proceedings.mlr.press/v80/ho18a/ho18a.pdf","https://scholar.google.com/scholar?q=related:PPGHVYMqiKcJ:scholar.google.com/&scioq=%22robust%22+%22machine+learning%22+%22unknowns%22&hl=en&as_sdt=2007"
50,"R Trinchero, P Manfredi, IS Stievano…","Machine learning for the performance assessment of high-speed links",2018,"IEEE Transactions on …","ieeexplore.ieee.org","https://ieeexplore.ieee.org/abstract/document/8283608/?casa_token=dVxK5VpndPYAAAAA:6Lo7N0dewYGKNnB3DjMoW8-HjVxFDvpE4j-a3_580aaX5ZEmjSKalZnG4EjB6852Toqq6Vm_UQ","https://scholar.google.com/scholar?cites=16419878266304788300&as_sdt=2005&sciodt=2007&hl=en",43,"2022-07-14 10:19:14","","","","",,,,,50,12.50,13,4,4,"… The proposed method relies on a robust and well-established mathematical framework, … samples is greater than the number of unknowns in the polynomial expansion). According to (4), …","https://ieeexplore.ieee.org/iel7/15/8445717/08283608.pdf?casa_token=pZZcAkixG5UAAAAA:fH8PAxIBsfJZsf81v1e3Q4b-OZwjFJ-y4s5O7JdswSzuvzfKDk37TennSJavVfFdpNkBTkuVAw","https://scholar.google.com/scholar?q=related:TPdAdkkg3-MJ:scholar.google.com/&scioq=%22robust%22+%22machine+learning%22+%22unknowns%22&hl=en&as_sdt=2007"
41,"K Manohar, T Hogan, J Buttrick, AG Banerjee…","Predicting shim gaps in aircraft assembly with machine learning and sparse sensing",2018,"Journal of manufacturing …","Elsevier","https://www.sciencedirect.com/science/article/pii/S0278612518300116","https://scholar.google.com/scholar?cites=750994792379867216&as_sdt=2005&sciodt=2007&hl=en",54,"2022-07-14 10:19:14","HTML","","","",,,,,41,10.25,8,5,4,"… The results in this work combine robust dimensionality reduction and sparse sensor … Importantly, it permits a drastic reduction in computation by solving for r ≪ n unknowns. The …","https://www.sciencedirect.com/science/article/pii/S0278612518300116","https://scholar.google.com/scholar?q=related:UGD448gRbAoJ:scholar.google.com/&scioq=%22robust%22+%22machine+learning%22+%22unknowns%22&hl=en&as_sdt=2007"
7,"P Anagha, S Balasundaram…","On robust twin support vector regression in primal using squared pinball loss",2018,"Journal of Intelligent & …","content.iospress.com","https://content.iospress.com/articles/journal-of-intelligent-and-fuzzy-systems/ifs169807","https://scholar.google.com/scholar?cites=17555871500940540614&as_sdt=2005&sciodt=2007&hl=en",102,"2022-07-14 10:19:14","","","","",,,,,7,1.75,2,3,4,"… of robust regression learning models to fit training data corrupted by noise is an important and challenging research problem in machine learning. It is … in the machine learning literature. …","","https://scholar.google.com/scholar?q=related:xvr2dx38ovMJ:scholar.google.com/&scioq=%22robust%22+%22machine+learning%22+%22unknowns%22&hl=en&as_sdt=2007"
21,"JM Faria","Machine learning safety: An overview",2018,"Proceedings of the 26th Safety-Critical Systems …","researchgate.net","https://www.researchgate.net/profile/Jose-Faria-3/publication/320567319_Machine_Learning_Safety_An_Overview/links/59f37efda6fdcc075ec34986/Machine-Learning-Safety-An-Overview.pdf","https://scholar.google.com/scholar?cites=207465266671098045&as_sdt=2005&sciodt=2007&hl=en",126,"2022-07-14 10:19:14","PDF","","","",,,,,21,5.25,21,1,4,"… Machine learning (ML) is a technique that gives computers the ability to learn a task without … This paper provides an overview of the state of the art in machine learning safety. System …","https://www.researchgate.net/profile/Jose-Faria-3/publication/320567319_Machine_Learning_Safety_An_Overview/links/59f37efda6fdcc075ec34986/Machine-Learning-Safety-An-Overview.pdf","https://scholar.google.com/scholar?q=related:vZgpk48Q4QIJ:scholar.google.com/&scioq=%22robust%22+%22machine+learning%22+%22unknowns%22&hl=en&as_sdt=2007"
65,"T Wang, TH Kwok, C Zhou, S Vader","In-situ droplet inspection and closed-loop control system using machine learning for liquid metal jet printing",2018,"Journal of manufacturing systems","Elsevier","https://www.sciencedirect.com/science/article/pii/S0278612518300426?casa_token=bzO3bmYLdN0AAAAA:C1NAzObbsQyJdOUIUKTCxBAKps0bCXqlhe8s7aCH5nLyiGXeCZsaLiFBrncTyklqcQiv1hgAcPs","https://scholar.google.com/scholar?cites=8078046890314300345&as_sdt=2005&sciodt=2007&hl=en",136,"2022-07-14 10:19:14","HTML","","","",,,,,65,16.25,16,4,4,"… Capturing more images is generally more robust, the … ), but there are also unknown unknowns – the ones we do not … To account for the dependent variables and unknown unknowns …","https://www.sciencedirect.com/science/article/pii/S0278612518300426?casa_token=bzO3bmYLdN0AAAAA:C1NAzObbsQyJdOUIUKTCxBAKps0bCXqlhe8s7aCH5nLyiGXeCZsaLiFBrncTyklqcQiv1hgAcPs","https://scholar.google.com/scholar?q=related:ufsh8Nj8GnAJ:scholar.google.com/&scioq=%22robust%22+%22machine+learning%22+%22unknowns%22&hl=en&as_sdt=2007"
59,"Y Chen","Fast waveform detection for microseismic imaging using unsupervised machine learning",2018,"Geophysical Journal International","academic.oup.com","https://academic.oup.com/gji/article-abstract/215/2/1185/5076377","https://scholar.google.com/scholar?cites=15866840287218495139&as_sdt=2005&sciodt=2007&hl=en",167,"2022-07-14 10:19:14","","","","",,,,,59,14.75,59,1,4,"… where two unknowns are the ith cluster C i and the corresponding cluster centroid |$\mathbf … Choosing p = 1 would make the clustering method more robust to abnormal value or outliers …","https://academic.oup.com/gji/article/215/2/1185/5076377","https://scholar.google.com/scholar?q=related:o-6D0yxXMtwJ:scholar.google.com/&scioq=%22robust%22+%22machine+learning%22+%22unknowns%22&hl=en&as_sdt=2007"
4238,"M Mohri, A Rostamizadeh, A Talwalkar","Foundations of machine learning",2018,"","books.google.com","https://books.google.com/books?hl=en&lr=&id=dWB9DwAAQBAJ&oi=fnd&pg=PR5&dq=%22robust%22+%22machine+learning%22+%22unknowns%22&ots=AysW-Vs1l_&sig=_XGkfYsOM2YBdbooxR9lIFFN_nA","https://scholar.google.com/scholar?cites=12992542314861780001&as_sdt=2005&sciodt=2007&hl=en",195,"2022-07-14 10:19:14","BOOK","","","",,,,,4238,1059.50,1413,3,4,"… The main practical objectives of machine learning consist of generating accurate predictions for unseen items and of designing efficient and robust algorithms to produce these …","","https://scholar.google.com/scholar?q=related:IVyR3mXITrQJ:scholar.google.com/&scioq=%22robust%22+%22machine+learning%22+%22unknowns%22&hl=en&as_sdt=2007"
104,"TG Dietterich","Steps toward robust artificial intelligence",2017,"Ai Magazine","ojs.aaai.org","https://ojs.aaai.org/index.php/aimagazine/article/view/2756","https://scholar.google.com/scholar?cites=13332446060891249694&as_sdt=2005&sciodt=2007&hl=en",11,"2022-07-14 10:19:14","","","","",,,,,104,20.80,104,1,5,"… machine-learning algorithms to generalize well. For the case of the linear support vector machine, regularization is equivalent to robust … that are robust both to known unknowns (the …","https://ojs.aaai.org/index.php/aimagazine/article/download/2756/2644","https://scholar.google.com/scholar?q=related:Hpx61g1dBrkJ:scholar.google.com/&scioq=%22robust%22+%22machine+learning%22+%22unknowns%22&hl=en&as_sdt=2007"
364,"P Jain, P Kar","Non-convex optimization for machine learning",2017,"… and Trends® in Machine Learning","nowpublishers.com","https://www.nowpublishers.com/article/Details/MAL-058","https://scholar.google.com/scholar?cites=5270557316974812398&as_sdt=2005&sciodt=2007&hl=en",27,"2022-07-14 10:19:14","","","","",,,,,364,72.80,182,2,5,"… Robust Regression This section will look at a widely studied area of machine learning, namely robust … Algorithms that are robust to (adversarial) corruption in data are sought after in …","https://www.nowpublishers.com/article/DownloadSummary/MAL-058","https://scholar.google.com/scholar?q=related:7pyehvTHJEkJ:scholar.google.com/&scioq=%22robust%22+%22machine+learning%22+%22unknowns%22&hl=en&as_sdt=2007"
0,"TR Lee, WT Wood, J Dale","Estimating Global Seafloor Total Organic Carbon Using a Machine Learning Technique and Its Relevance to Methane Hydrates",2017,"AGU Fall Meeting Abstracts","researchgate.net","https://www.researchgate.net/profile/Taylor_Lee10/publication/323779906_Estimating_Global_Seafloor_Total_Organic_Carbon_Using_a_Machine_Learning_Technique_and_Its_Relevance_to_Methane_Hydrates/links/5aaa7da70f7e9b8826710e23/Estimating-Global-Seafloor-Total-Organic-Carbon-Using-a-Machine-Learning-Technique-and-Its-Relevance-to-Methane-Hydrates.pdf","",31,"2022-07-14 10:19:14","PDF","","","",,,,,0,0.00,0,3,5,"… Recently, machine learning techniques have made advances in predicting geologic … K-nearest neighbor (KNN) is a simple, robust, machine learning algorithm that provides the most …","https://www.researchgate.net/profile/Taylor_Lee10/publication/323779906_Estimating_Global_Seafloor_Total_Organic_Carbon_Using_a_Machine_Learning_Technique_and_Its_Relevance_to_Methane_Hydrates/links/5aaa7da70f7e9b8826710e23/Estimating-Global-Seafloor-Total-Organic-Carbon-Using-a-Machine-Learning-Technique-and-Its-Relevance-to-Methane-Hydrates.pdf",""
109,"S Burton, L Gauerhof, C Heinzemann","Making the case for safety of machine learning in highly automated driving",2017,"International Conference on …","Springer","https://link.springer.com/chapter/10.1007/978-3-319-66284-8_1","https://scholar.google.com/scholar?cites=3573933730505877390&as_sdt=2005&sciodt=2007&hl=en",41,"2022-07-14 10:19:14","","10.1007/978-3-319-66284-8_1","","",,,,,109,21.80,36,3,5,"… discuss different uses of machine learning and their impact on … of safety for a machine learning function cannot be answered … G5: The function is robust against differences between its …","","https://scholar.google.com/scholar?q=related:jueW2copmTEJ:scholar.google.com/&scioq=%22robust%22+%22machine+learning%22+%22unknowns%22&hl=en&as_sdt=2007"
32,"E Baskaya, M Bronz, D Delahaye","Fault detection & diagnosis for small UAVs via machine learning",2017,"2017 IEEE/AIAA 36th Digital …","ieeexplore.ieee.org","https://ieeexplore.ieee.org/abstract/document/8102037/?casa_token=qCsPpddeVhIAAAAA:TFn9IJe8q0ER2lXolcdYWwITdZcm0Rkf0CtcEMduRFy_QXOUXR6SZwmQhaB8Hxtx7CY7Fw5xoA","https://scholar.google.com/scholar?cites=1477731087035047719&as_sdt=2005&sciodt=2007&hl=en",58,"2022-07-14 10:19:14","","","","",,,,,32,6.40,11,3,5,"… considering the unknowns of … robust (alternate) or direct (minimal level of stability augmentation independent of the nature of the fault) mode. Switching from nominal mode to the robust …","https://ieeexplore.ieee.org/iel7/8093739/8101896/08102037.pdf?casa_token=YaW8oJXfvlAAAAAA:1gsqlQfmUuI233CdwZ2gR9GE1ZT3GWlz8NshA93Wo6bs2pRZ_euRYCFics89BQIoNd_NMX098w","https://scholar.google.com/scholar?q=related:J59GJJj0gRQJ:scholar.google.com/&scioq=%22robust%22+%22machine+learning%22+%22unknowns%22&hl=en&as_sdt=2007"
19,"Y Huang, B Benware, R Klingenberg…","Scan chain diagnosis based on unsupervised machine learning",2017,"2017 IEEE 26th …","ieeexplore.ieee.org","https://ieeexplore.ieee.org/abstract/document/8267891/?casa_token=buIjCemdnTkAAAAA:t95qRihGVb_csFCgWDQGobsvLqs7v55596KIv3Qrh86MFbJ6PqnDXyDU6uXZc6plaWwStNJrJQ","https://scholar.google.com/scholar?cites=3338450103991799054&as_sdt=2005&sciodt=2007&hl=en",61,"2022-07-14 10:19:14","","","","",,,,,19,3.80,5,4,5,"… It is known that machine learning based algorithms can handle the unknowns / uncertainties … a new software-based chain diagnosis algorithm by using unsupervised machine learning. …","https://ieeexplore.ieee.org/iel7/8267185/8267840/08267891.pdf?casa_token=Fv2mZvzUl2QAAAAA:OIxcqEFrL8I90w7lu2Vrff7xyMGc2PTQYNdFTBrv_UiHBMXeSFXjq_HlyhTNakp-sTqHDBo3cg","https://scholar.google.com/scholar?q=related:Dg3MhK6OVC4J:scholar.google.com/&scioq=%22robust%22+%22machine+learning%22+%22unknowns%22&hl=en&as_sdt=2007"
163,"KR Varshney, H Alemzadeh","On the safety of machine learning: Cyber-physical systems, decision sciences, and data products",2017,"Big data","liebertpub.com","https://www.liebertpub.com/doi/abs/10.1089/big.2016.0051","https://scholar.google.com/scholar?cites=12026366436921021606&as_sdt=2005&sciodt=2007&hl=en",95,"2022-07-14 10:19:14","","10.1089/big.2016.0051","","",,,,,163,32.60,82,2,5,"… involving machine learning. Heretofore, the definition of safety has not been formalized in a machine learning context. In this article, we do so by defining machine learning safety in …","https://arxiv.org/pdf/1610.01256","https://scholar.google.com/scholar?q=related:ppRbU4485qYJ:scholar.google.com/&scioq=%22robust%22+%22machine+learning%22+%22unknowns%22&hl=en&as_sdt=2007"
