Cites,Authors,Title,Year,Source,Publisher,ArticleURL,CitesURL,GSRank,QueryDate,Type,DOI,ISSN,CitationURL,Volume,Issue,StartPage,EndPage,ECC,CitesPerYear,CitesPerAuthor,AuthorCount,Age,Abstract,FullTextURL,RelatedURL
422,"E Samaniego, C Anitescu, S Goswami…","An energy approach to the solution of partial differential equations in computational mechanics via machine learning: Concepts, implementation and …",2020,"Computer Methods in …","Elsevier","https://www.sciencedirect.com/science/article/pii/S0045782519306826?casa_token=T_IRjtvitLkAAAAA:3wTvD7QyFzAOsSTPdG8-ZheDGVIJ6A3HEWXoChXNHt5WWOQIXvlCfz7u6KxQG-hXlr4EXT4anuc","https://scholar.google.com/scholar?cites=9594363440986743954&as_sdt=2005&sciodt=2007&hl=en",183,"2022-07-14 10:19:14","HTML","","","",,,,,422,211.00,106,4,2,"… The energy of a mechanical system seems to be the natural loss function for a machine learning method to approach a mechanical problem. In order to prove the concepts, we deal with …","https://www.sciencedirect.com/science/article/pii/S0045782519306826?casa_token=T_IRjtvitLkAAAAA:3wTvD7QyFzAOsSTPdG8-ZheDGVIJ6A3HEWXoChXNHt5WWOQIXvlCfz7u6KxQG-hXlr4EXT4anuc","https://scholar.google.com/scholar?q=related:kmQCarcGJoUJ:scholar.google.com/&scioq=%22robust%22+%22machine+learning%22+%22unknowns%22&hl=en&as_sdt=2007"
91,"TJ Struble, JC Alvarez, SP Brown, M Chytil…","Current and future roles of artificial intelligence in medicinal chemistry synthesis",2020,"Journal of medicinal …","ACS Publications","https://pubs.acs.org/doi/abs/10.1021/acs.jmedchem.9b02120","https://scholar.google.com/scholar?cites=2151275914369894661&as_sdt=2005&sciodt=2007&hl=en",185,"2022-07-14 10:19:14","","10.1021/acs.jmedchem.9b02120","","",,,,,91,45.50,18,5,2,"… This article will encompass the topic of machine learning for … a creative route with many unknowns. Identifying routes with … important for more robust machine-learning-based synthetic …","https://pubs.acs.org/doi/full/10.1021/acs.jmedchem.9b02120","https://scholar.google.com/scholar?q=related:BQnf0Qve2h0J:scholar.google.com/&scioq=%22robust%22+%22machine+learning%22+%22unknowns%22&hl=en&as_sdt=2007"
1,"A Sinha","Safety-critical machine learning: development and testing",2020,"","search.proquest.com","https://search.proquest.com/openview/399c8d6359f908df6d78757ae17273dc/1?pq-origsite=gscholar&cbl=44156","https://scholar.google.com/scholar?cites=7439313878729075465&as_sdt=2005&sciodt=2007&hl=en",190,"2022-07-14 10:19:14","BOOK","","","",,,,,1,0.50,1,1,2,"… unknowns, uncertainties that we can model at training time. As we show in Section 1.1 below, building distributionally robust … model sensitivities to unknown unknowns—that is, we …","","https://scholar.google.com/scholar?q=related:CatHuo7APWcJ:scholar.google.com/&scioq=%22robust%22+%22machine+learning%22+%22unknowns%22&hl=en&as_sdt=2007"
5,"U Gadiraju, J Yang","What can crowd computing do for the next generation of AI systems?",2020,"CSW@ NeurIPS","pure.tudelft.nl","https://pure.tudelft.nl/ws/files/86683843/paper2.pdf","https://scholar.google.com/scholar?cites=2086067853375751965&as_sdt=2005&sciodt=2007&hl=en",194,"2022-07-14 10:19:14","PDF","","","",,,,,5,2.50,3,2,2,"… Artificial intelligence techniques and machine learning in … challenges in the quest for robust, interpretable, and hence … Take for example, unknown unknowns of machine learning, …","https://pure.tudelft.nl/ws/files/86683843/paper2.pdf","https://scholar.google.com/scholar?q=related:HcfSAakz8xwJ:scholar.google.com/&scioq=%22robust%22+%22machine+learning%22+%22unknowns%22&hl=en&as_sdt=2007"
40,"S Saria, A Subbaswamy","Tutorial: safe and reliable machine learning",2019,"arXiv preprint arXiv:1904.07204","arxiv.org","https://arxiv.org/abs/1904.07204","https://scholar.google.com/scholar?cites=8269297695335901505&as_sdt=2005&sciodt=2007&hl=en",3,"2022-07-14 10:19:14","","","","",,,,,40,13.33,20,2,3,"… a model’s “unknown unknowns” (predictions for which a model … want to ensure that the machine learning system behaves … direction under the name “robust machine learning.” However, …","https://arxiv.org/pdf/1904.07204","https://scholar.google.com/scholar?q=related:Qelz-HBywnIJ:scholar.google.com/&scioq=%22robust%22+%22machine+learning%22+%22unknowns%22&hl=en&as_sdt=2007"
3,"National Academies of Sciences, Engineering, and …","Robust Machine Learning Algorithms and Systems for Detection and Mitigation of Adversarial Attacks and Anomalies: Proceedings of a Workshop",2019,"","books.google.com","https://books.google.com/books?hl=en&lr=&id=_QCsDwAAQBAJ&oi=fnd&pg=PR1&dq=%22robust%22+%22machine+learning%22+%22unknowns%22&ots=cClOGrZ_vg&sig=Ryhixy6VW3sb4saUB7OCKOcvZBE","https://scholar.google.com/scholar?cites=4148437233522399264&as_sdt=2005&sciodt=2007&hl=en",4,"2022-07-14 10:19:14","BOOK","","","",,,,,3,1.00,1,4,3,"… robust machine learning models, in these cases only noise is perceptible. Athalye described machine learning as not being robust for … to deal with unknowns in the environment. Classic …","","https://scholar.google.com/scholar?q=related:IFgbPa81kjkJ:scholar.google.com/&scioq=%22robust%22+%22machine+learning%22+%22unknowns%22&hl=en&as_sdt=2007"
119,"C Shang, F You","Data analytics and machine learning for smart process manufacturing: recent advances and perspectives in the big data era",2019,"Engineering","Elsevier","https://www.sciencedirect.com/science/article/pii/S2095809918312931","https://scholar.google.com/scholar?cites=6586115262630744563&as_sdt=2005&sciodt=2007&hl=en",13,"2022-07-14 10:19:14","HTML","","","",,,,,119,39.67,60,2,3,"… analytics and machine learning, which show great potential to deal with the unknowns [42]. … control problem can be cast as a classic robust optimization (RO) problem that is easy to …","https://www.sciencedirect.com/science/article/pii/S2095809918312931","https://scholar.google.com/scholar?q=related:81Hixu-UZlsJ:scholar.google.com/&scioq=%22robust%22+%22machine+learning%22+%22unknowns%22&hl=en&as_sdt=2007"
193,"M Alber, A Buganza Tepole, WR Cannon, S De…","Integrating machine learning and multiscale modeling—perspectives, challenges, and opportunities in the biological, biomedical, and behavioral sciences",2019,"NPJ digital …","nature.com","https://www.nature.com/articles/s41746-019-0193-y","https://scholar.google.com/scholar?cites=6317332891636961841&as_sdt=2005&sciodt=2007&hl=en",14,"2022-07-14 10:19:14","HTML","","","",,,,,193,64.33,39,5,3,"… machine learning and multiscale modeling can naturally complement each other to create robust … biomedical data that allow us to systematically discover details about these unknowns. …","https://www.nature.com/articles/s41746-019-0193-y","https://scholar.google.com/scholar?q=related:MZLpVcusq1cJ:scholar.google.com/&scioq=%22robust%22+%22machine+learning%22+%22unknowns%22&hl=en&as_sdt=2007"
0,"F Alesiani, K Gkiotsalitis","Method for robust control of a machine learning system and robust control system",2019,"US Patent 10,522,036","Google Patents","https://patents.google.com/patent/US10522036B2/en","",21,"2022-07-14 10:19:14","","","","",,,,,0,0.00,0,2,3,"… to determining robust solution to machine learning problems where disturbance to the robust solution is bounded. The present invention also relates to determining robust solutions for …","https://patentimages.storage.googleapis.com/fc/ce/a5/3fefb3df0e7f33/US10522036.pdf","https://scholar.google.com/scholar?q=related:jlsFTQjkVK4J:scholar.google.com/&scioq=%22robust%22+%22machine+learning%22+%22unknowns%22&hl=en&as_sdt=2007"
3,"F Pittino, R Diversi, L Benini…","Robust identification of thermal models for in-production High-Performance-Computing clusters with machine learning-based data selection",2019,"IEEE Transactions on …","ieeexplore.ieee.org","https://ieeexplore.ieee.org/abstract/document/8887210/?casa_token=TIkqj2-vNKoAAAAA:GgDb9oPkE1pFBgfBaFdi0eYwU0yiajk5xVbL4HaQoxgy2Ev9QlSLFlEixGvPndCqPQXnHxfF1g","https://scholar.google.com/scholar?cites=14858225304290805869&as_sdt=2005&sciodt=2007&hl=en",26,"2022-07-14 10:19:14","","","","",,,,,3,1.00,1,4,3,"… response of the final device enables more robust and precise thermal control strategies as well … We then propose and validate a set of techniques based on machine learning and deep …","https://ieeexplore.ieee.org/iel7/43/6917053/08887210.pdf?casa_token=mys2_A-sH7UAAAAA:_b4AiRIyO5cjz6meMUip3J3nIoy2qU7mH1hSJfCfq55ZhZuqm1v0nZe_gkWxY-59DbhzqpO8DQ","https://scholar.google.com/scholar?q=related:bUj5JjEFM84J:scholar.google.com/&scioq=%22robust%22+%22machine+learning%22+%22unknowns%22&hl=en&as_sdt=2007"
44,"S Mohseni, M Pitale, V Singh, Z Wang","Practical solutions for machine learning safety in autonomous vehicles",2019,"arXiv preprint arXiv:1912.09630","arxiv.org","https://arxiv.org/abs/1912.09630","https://scholar.google.com/scholar?cites=11775261665330174820&as_sdt=2005&sciodt=2007&hl=en",51,"2022-07-14 10:19:14","","","","",,,,,44,14.67,11,4,3,"… practical machine learning safety techniques that can complement engineering safety for machine learning … Our organization maps safety strategies to state-of-the-art machine learning …","https://arxiv.org/pdf/1912.09630","https://scholar.google.com/scholar?q=related:ZJtHuxgiaqMJ:scholar.google.com/&scioq=%22robust%22+%22machine+learning%22+%22unknowns%22&hl=en&as_sdt=2007"
121,"C Huntingford, ES Jeffers, MB Bonsall…","Machine learning and artificial intelligence to aid climate change research and preparedness",2019,"Environmental …","iopscience.iop.org","https://iopscience.iop.org/article/10.1088/1748-9326/ab4e55/meta","https://scholar.google.com/scholar?cites=16895191723288361&as_sdt=2005&sciodt=2007&hl=en",67,"2022-07-14 10:19:14","HTML","10.1088/1748-9326/ab4e55","","",,,,,121,40.33,30,4,3,"… , predicted changes are assumed robust for at least modest … together' and defining robust interconnections within a complex … is the risk of 'unknown unknowns', generating unwelcome …","https://iopscience.iop.org/article/10.1088/1748-9326/ab4e55/meta","https://scholar.google.com/scholar?q=related:KScUXRYGPAAJ:scholar.google.com/&scioq=%22robust%22+%22machine+learning%22+%22unknowns%22&hl=en&as_sdt=2007"
10,"J Suh, S Ghorashi, G Ramos, NC Chen…","Anchorviz: Facilitating semantic data exploration and concept discovery for interactive machine learning",2019,"ACM Transactions on …","dl.acm.org","https://dl.acm.org/doi/abs/10.1145/3241379?casa_token=Z8z1moXtE_QAAAAA:OFJ-bhX8jEFXlQxpeGBCmcQhi001I5toKk-pHrasVgXb5ZlNSCrKAoRzzGuZMe2c7A9OKkQacIa38w","https://scholar.google.com/scholar?cites=3219453680428539668&as_sdt=2005&sciodt=2007&hl=en",69,"2022-07-14 10:19:14","","10.1145/3241379","","",,,,,10,3.33,2,5,3,"… machine learning (iML), human knowledge about the target class can be a powerful reference to make the classifier robust … errors into known unknowns and unknown unknowns. Known …","https://dl.acm.org/doi/pdf/10.1145/3241379?casa_token=syhP7Uy8HWUAAAAA:lcSmTy-EB168iYfK8NLAobWEE-CcCg6bhNcgUolOyM-lgbIEKPZ5A56iuve4juFUk2EnRI8aULKmbw","https://scholar.google.com/scholar?q=related:FF_EoBDMrSwJ:scholar.google.com/&scioq=%22robust%22+%22machine+learning%22+%22unknowns%22&hl=en&as_sdt=2007"
66,"A Holzinger","Introduction to MAchine Learning & Knowledge Extraction (MAKE).",2019,"Mach. Learn. Knowl. Extr.","e-helvetica.nb.admin.ch","https://www.e-helvetica.nb.admin.ch/api/download/urn%3Anbn%3Ach%3Abel-1328319%3Amake-01-00001-v2.pdf","https://scholar.google.com/scholar?cites=14107474671020555366&as_sdt=2005&sciodt=2007&hl=en",74,"2022-07-14 10:19:14","PDF","","","",,,,,66,22.00,66,1,3,"… Abstract: The grand goal of Machine Learning is to develop … to ensure successful machine learning applications in various … The inverse probability allows to infer unknowns, to learn …","https://www.e-helvetica.nb.admin.ch/api/download/urn%3Anbn%3Ach%3Abel-1328319%3Amake-01-00001-v2.pdf","https://scholar.google.com/scholar?q=related:ZjwA_HfRx8MJ:scholar.google.com/&scioq=%22robust%22+%22machine+learning%22+%22unknowns%22&hl=en&as_sdt=2007"
62,"TE Boult, S Cruz, AR Dhamija, M Gunther…","Learning and the unknown: Surveying steps toward open world recognition",2019,"Proceedings of the …","ojs.aaai.org","https://ojs.aaai.org/index.php/AAAI/article/view/5054","https://scholar.google.com/scholar?cites=5258740077601138514&as_sdt=2005&sciodt=2007&hl=en",75,"2022-07-14 10:19:14","","","","",,,,,62,20.67,12,5,3,"… – uncertain is not unknown, and unknowns need not appear to be … address the unknown in machine learning systems. This … OSR in feature space, it is not clear how to make them robust …","https://ojs.aaai.org/index.php/AAAI/article/download/5054/4927","https://scholar.google.com/scholar?q=related:UqeGEz3M-kgJ:scholar.google.com/&scioq=%22robust%22+%22machine+learning%22+%22unknowns%22&hl=en&as_sdt=2007"
4,"K Maurer, W Bennette","Facility locations utility for uncovering classifier overconfidence",2019,"… Conference On Machine Learning And …","ieeexplore.ieee.org","https://ieeexplore.ieee.org/abstract/document/8999202/?casa_token=KNbiw_jyOwsAAAAA:Z_WUCriNVl0iqGSaUQDvCVKmqjJKjrDd_KlTCZWAwDwm1HSwvaH3nghVQuiBGN59Mkq_l-3EKw","https://scholar.google.com/scholar?cites=6431168422097690877&as_sdt=2005&sciodt=2007&hl=en",77,"2022-07-14 10:19:14","","","","",,,,,4,1.33,2,2,3,"… to search for overconfident unknown unknowns. Through robust empirical experiments we … model outperforms previous methods in discovering overconfident unknown unknowns. …","https://ieeexplore.ieee.org/iel7/8974348/8998966/08999202.pdf?casa_token=2ntXJkK4JZYAAAAA:0r8PmbuKe3vzH3NnFwUXIcEq-AJQ4JwR_Xj2fMU9WL5WOPgLshRdUyyBd-1AR8dDZfRzCgVE8g","https://scholar.google.com/scholar?q=related:_aDXKZsZQFkJ:scholar.google.com/&scioq=%22robust%22+%22machine+learning%22+%22unknowns%22&hl=en&as_sdt=2007"
181,"Z Kang, H Pan, SCH Hoi, Z Xu","Robust graph learning from noisy data",2019,"IEEE transactions on …","ieeexplore.ieee.org","https://ieeexplore.ieee.org/abstract/document/8605364/?casa_token=LS-YqvFN8J4AAAAA:JKhhyX5aGdqsGuNMPLQ-RcOm75FJLuig7i2Yyvxnic0QRTCMX7UnHVKkHFCbf0yZ215m52_3Kg","https://scholar.google.com/scholar?cites=17789505544927594211&as_sdt=2005&sciodt=2007&hl=en",86,"2022-07-14 10:19:14","","","","",,,,,181,60.33,45,4,3,"… In this paper, we propose a novel robust graph learning scheme to learn reliable graphs … also be viewed as a robust version of manifold regularized robust principle component analysis (…","https://ieeexplore.ieee.org/iel7/6221036/6352949/08605364.pdf?casa_token=dP92rJtV9tUAAAAA:9_0BXx8oS33DbUNqvuPeW4XTOhCsrjZ_XqWw4_MRRupdpVdD1pwN_lI5PsGtO-EMdlpfHFQDjw","https://scholar.google.com/scholar?q=related:40ZATwoF4fYJ:scholar.google.com/&scioq=%22robust%22+%22machine+learning%22+%22unknowns%22&hl=en&as_sdt=2007"
5,"N Kshetry, LR Varshney","Safety in the face of unknown unknowns: Algorithm fusion in data-driven engineering systems",2019,"ICASSP 2019-2019 IEEE …","ieeexplore.ieee.org","https://ieeexplore.ieee.org/abstract/document/8683392/?casa_token=gt-AMQBEfe8AAAAA:3jrJ8MCRDMUs1tVcuU8HiWU7CG3y26rVG8szru80kb-IUkc9O24_8v9qbThE4zqO3XzXUG-52g","https://scholar.google.com/scholar?cites=11284805645295449456&as_sdt=2005&sciodt=2007&hl=en",88,"2022-07-14 10:19:14","","","","",,,,,5,1.67,3,2,3,"… system is likely to fail on known unknowns, but are not concerned with quality … unknowns. Physics-guided neural networks aim to overcome the deficiencies of typical machine learning …","https://ieeexplore.ieee.org/iel7/8671773/8682151/08683392.pdf?casa_token=InfXcOMttwAAAAAA:aKVgySv2A5mi3AYruPbOORUBpdhcr_CZOSeGMEnLBbm1HsFDcKtEjvZtfLBQulSI03ZFl8EULQ","https://scholar.google.com/scholar?q=related:cHUo5_Gum5wJ:scholar.google.com/&scioq=%22robust%22+%22machine+learning%22+%22unknowns%22&hl=en&as_sdt=2007"
0,"PC Riley, SV Deshpande","Machine learning based spectral interpretation in chemical detection",2019,"… Intelligence and Machine Learning …","spiedigitallibrary.org","https://www.spiedigitallibrary.org/conference-proceedings-of-spie/11006/110061X/Machine-learning-based-spectral-interpretation-in-chemical-detection/10.1117/12.2518929.short","",99,"2022-07-14 10:19:14","","10.1117/12.2518929.short","","",,,,,0,0.00,0,2,3,"… These algorithms need to be robust enough to prevent false … and utilized in a variety of machine learning (ML) techniques. … to accurately label chemical unknowns given the parameters …","https://scholar.google.com/scholar?output=instlink&q=info:CVvorcwcz-8J:scholar.google.com/&hl=en&as_sdt=2007&scillfp=16856943598704120038&oi=lle","https://scholar.google.com/scholar?q=related:CVvorcwcz-8J:scholar.google.com/&scioq=%22robust%22+%22machine+learning%22+%22unknowns%22&hl=en&as_sdt=2007"
29,"B Kim, T Günther","Robust reference frame extraction from unsteady 2D vector fields with convolutional neural networks",2019,"Computer Graphics Forum","Wiley Online Library","https://onlinelibrary.wiley.com/doi/abs/10.1111/cgf.13689?casa_token=Os8NchVsvTQAAAAA:dwV0QNQVseKlKO0qgS6tAwxIbSYLDFbUeYZ2vPri4iZEk2h0ldmbAvrQayBKomNjHz6JutPbCN6ak7I","https://scholar.google.com/scholar?cites=3996364616969926556&as_sdt=2005&sciodt=2007&hl=en",104,"2022-07-14 10:19:14","","10.1111/cgf.13689","","",,,,,29,9.67,15,2,3,"… of machine learning is that it typically requires a large amount of data to successfully generalize. Since machine learning is … Thus, the only unknowns are the first-order and second-order …","https://onlinelibrary.wiley.com/doi/full/10.1111/cgf.13689?casa_token=Et0KgBMKhhEAAAAA:WiKhiQYDNtFSy_8cVduxLV1cruWiY5FMfcXKGXboLj6iq5IwZgJdZbpn2cfENThE85YfeP_-fztLEdA","https://scholar.google.com/scholar?q=related:nLduC3LwdTcJ:scholar.google.com/&scioq=%22robust%22+%22machine+learning%22+%22unknowns%22&hl=en&as_sdt=2007"
0,"AW Drescher","Leveraging machine learning capabilities for the characterization of irradiated uranium: a case study of prediction methods for nuclear safeguards and nuclear …",2019,"","repositories.lib.utexas.edu","https://repositories.lib.utexas.edu/handle/2152/82834","",108,"2022-07-14 10:19:14","","","","",,,,,0,0.00,0,1,3,"… sense, would be intractable due to the number of unknowns. … Using machine learning to autonomously process and … , and labor burden of a robust nuclear safeguards infrastructure. …","https://repositories.lib.utexas.edu/bitstream/handle/2152/82834/DRESCHER-DISSERTATION-2019.pdf?sequence=1","https://scholar.google.com/scholar?q=related:9bOJrDChlK4J:scholar.google.com/&scioq=%22robust%22+%22machine+learning%22+%22unknowns%22&hl=en&as_sdt=2007"
17,"A Heinlein, A Klawonn, M Lanser, J Weber","Machine learning in adaptive domain decomposition methods---predicting the geometric location of constraints",2019,"SIAM Journal on Scientific …","SIAM","https://epubs.siam.org/doi/abs/10.1137/18M1205364?casa_token=r8r-FZeWr3EAAAAA:NWgnHHJreGw4ZWMx2NOGH6nJlxhD0FximhvUsqvm8X4XS84712d8mQsP-5u6ez7zBq5tHa_bh92k","https://scholar.google.com/scholar?cites=18132165782117079761&as_sdt=2005&sciodt=2007&hl=en",109,"2022-07-14 10:19:14","","10.1137/18M1205364","","",,,,,17,5.67,4,4,3,"… per subdomain and thus for the number of unknowns in each subdomain. The constant C is … As in the diffusion case, we obtain a robust algorithm with no false negative edges when …","https://epubs.siam.org/doi/pdf/10.1137/18M1205364?casa_token=jDKogUMb-Q4AAAAA:LaFA-1Q8ygFBPQfEY6F0KCzHKPtlh_dW9le1jDJbQAVCnHn7xaICoIjbXcHKQOHcLUYSNkPZfEAZ","https://scholar.google.com/scholar?q=related:0dqU47VkovsJ:scholar.google.com/&scioq=%22robust%22+%22machine+learning%22+%22unknowns%22&hl=en&as_sdt=2007"
42,"GA Oguntala, RA Abd-Alhameed, NT Ali, YF Hu…","SmartWall: Novel RFID-enabled ambient human activity recognition using machine learning for unobtrusive health monitoring",2019,"IEEE …","ieeexplore.ieee.org","https://ieeexplore.ieee.org/abstract/document/8716524/","https://scholar.google.com/scholar?cites=14728590626574497619&as_sdt=2005&sciodt=2007&hl=en",124,"2022-07-14 10:19:14","","","","",,,,,42,14.00,8,5,3,"… Accurate manipulation of these metrics using a robust algorithm would define the class of activity performed … To obtain the unknowns, maximum likelihood estimation is formulated as: …","https://ieeexplore.ieee.org/iel7/6287639/6514899/08716524.pdf","https://scholar.google.com/scholar?q=related:U_cesyN3ZswJ:scholar.google.com/&scioq=%22robust%22+%22machine+learning%22+%22unknowns%22&hl=en&as_sdt=2007"
37,"N Guha, Z Wang, M Wytock, A Majumdar","Machine learning for AC optimal power flow",2019,"arXiv preprint arXiv:1910.08842","arxiv.org","https://arxiv.org/abs/1910.08842","https://scholar.google.com/scholar?cites=11548709698508388503&as_sdt=2005&sciodt=2007&hl=en",128,"2022-07-14 10:19:14","","","","",,,,,37,12.33,9,4,3,"… We explore machine learning methods for AC Optimal … We present two formulations of ACOPF as a machine learning … sophisticated (and robust) techniques for enforcing legality. …","https://arxiv.org/pdf/1910.08842","https://scholar.google.com/scholar?q=related:l3izeUhCRaAJ:scholar.google.com/&scioq=%22robust%22+%22machine+learning%22+%22unknowns%22&hl=en&as_sdt=2007"
412,"K Holstein, J Wortman Vaughan, H Daumé III…","Improving fairness in machine learning systems: What do industry practitioners need?",2019,"Proceedings of the …","dl.acm.org","https://dl.acm.org/doi/abs/10.1145/3290605.3300830?casa_token=ensu7XO_DGMAAAAA:NzgAlXKIULydXchEh_sy3NsIQrtP95gqUSzfnyROwqbO5j456kvn4xdNsP8rNeGEfhylHb6rzo0n6Q","https://scholar.google.com/scholar?cites=18047105356912709600&as_sdt=2005&sciodt=2007&hl=en",132,"2022-07-14 10:19:14","","10.1145/3290605.3300830","","",,,,,412,137.33,103,4,3,"… 1 INTRODUCTION Machine learning (ML) systems increasingly influence every facet of our lives, including the quality of healthcare and education we receive [18, 34, 35, 53], which …","https://dl.acm.org/doi/pdf/10.1145/3290605.3300830?casa_token=XMhmHLFs_DcAAAAA:_-HnPPJ7haGGqbfhPXqIxX7dUzr63bqaGQLuU7NaYA8xanuzO5nUDvYnJhhR0piefBv99ly3qRRNLg","https://scholar.google.com/scholar?q=related:4M_UVrQydPoJ:scholar.google.com/&scioq=%22robust%22+%22machine+learning%22+%22unknowns%22&hl=en&as_sdt=2007"
1,"N Noy, Y Wald, G Elidan…","Robust multitask elliptical regression (romer)",2019,"2019 IEEE 8th International …","ieeexplore.ieee.org","https://ieeexplore.ieee.org/abstract/document/9022524/?casa_token=Uh3hLsIx3BcAAAAA:ZvqCRrcrqpsWWfjMJ9LZCl8yk2ndtZ9C4ygKgS49nk4bxZxmcwFhxRN4ggSq6aslvqgUQhlgWQ","https://scholar.google.com/scholar?cites=14062580646007708987&as_sdt=2005&sciodt=2007&hl=en",134,"2022-07-14 10:19:14","","","","",,,,,1,0.33,0,4,3,"… , is a widely studied setting in machine learning [1, 2, 3, 4], … studied method in the machine learning toolbox. Recent … tribution, and reduces the number of unknowns. As can be expected, …","https://ieeexplore.ieee.org/iel7/8993415/9022434/09022524.pdf?casa_token=oxqUQO06T30AAAAA:TjOvzfV4zniNtgqmv_7NnaWhxGKy9GpSKr-pPEPBs-8S7ynBctzsUArGUnYuObBmxDDYM99JJw","https://scholar.google.com/scholar?q=related:O52SPpdSKMMJ:scholar.google.com/&scioq=%22robust%22+%22machine+learning%22+%22unknowns%22&hl=en&as_sdt=2007"
59,"X Domingo-Almenara, C Guijas, E Billings…","The METLIN small molecule dataset for machine learning-based retention time prediction",2019,"Nature …","nature.com","https://www.nature.com/articles/s41467-019-13680-7","https://scholar.google.com/scholar?cites=14671179315026625836&as_sdt=2005&sciodt=2007&hl=en",139,"2022-07-14 10:19:14","HTML","","","",,,,,59,19.67,15,4,3,"… –experimental RT filtering is not a robust approach. Overall prediction error and ranking … 29,50 have been shown to be more robust because the molecules’ RT is not considered in …","https://www.nature.com/articles/s41467-019-13680-7","https://scholar.google.com/scholar?q=related:LIU4FNt_mssJ:scholar.google.com/&scioq=%22robust%22+%22machine+learning%22+%22unknowns%22&hl=en&as_sdt=2007"
166,"R Yoshihashi, W Shao, R Kawakami…","Classification-reconstruction learning for open-set recognition",2019,"Proceedings of the …","openaccess.thecvf.com","http://openaccess.thecvf.com/content_CVPR_2019/html/Yoshihashi_Classification-Reconstruction_Learning_for_Open-Set_Recognition_CVPR_2019_paper.html","https://scholar.google.com/scholar?cites=16941436503044933399&as_sdt=2005&sciodt=2007&hl=en",140,"2022-07-14 10:19:14","","","","",,,,,166,55.33,42,4,3,"… The merit of doing so is that we can test the robustness of the classifiers against a larger diversity of data than in the original datasets. The class labels of the unknowns were not used in …","https://openaccess.thecvf.com/content_CVPR_2019/papers/Yoshihashi_Classification-Reconstruction_Learning_for_Open-Set_Recognition_CVPR_2019_paper.pdf","https://scholar.google.com/scholar?q=related:F0fUbL0SHOsJ:scholar.google.com/&scioq=%22robust%22+%22machine+learning%22+%22unknowns%22&hl=en&as_sdt=2007"
58,"W Wei, O Ramalho, L Malingre, S Sivanantham…","Machine learning and statistical models for predicting indoor air quality",2019,"Indoor …","Wiley Online Library","https://onlinelibrary.wiley.com/doi/abs/10.1111/ina.12580?casa_token=H8pDx6vTj-MAAAAA:YuC0c_SmeYWpKFNcArYCvKN2VmSxF-9flC-JxV95JPeLrJI1rj-CTkjHJ8HDPp0dR8eXzts4BbdSzTw","https://scholar.google.com/scholar?cites=3282379469305562359&as_sdt=2005&sciodt=2007&hl=en",141,"2022-07-14 10:19:14","","10.1111/ina.12580","","",,,,,58,19.33,12,5,3,"… These studies were all published in the past decade, indicating the emergence of the awareness and application of machine learning and statistical modeling in the field of IAQ. The …","https://onlinelibrary.wiley.com/doi/pdf/10.1111/ina.12580?casa_token=5MEWxz9JELcAAAAA:3rfMZC8JyKcrgI5QxeUN9Uhl_xuQCNND7JcQXmVw-HGpPrYllDbtvPfaifDWiT0077J_EQARZGQiJuM","https://scholar.google.com/scholar?q=related:90T-jbxajS0J:scholar.google.com/&scioq=%22robust%22+%22machine+learning%22+%22unknowns%22&hl=en&as_sdt=2007"
