Cites,Authors,Title,Year,Source,Publisher,ArticleURL,CitesURL,GSRank,QueryDate,Type,DOI,ISSN,CitationURL,Volume,Issue,StartPage,EndPage,ECC,CitesPerYear,CitesPerAuthor,AuthorCount,Age,Abstract,FullTextURL,RelatedURL
1,"KR Thórisson","Achieving AGI within My Lifetime: Some Progress and Some Observations",2013,"Biologically Inspired Cognitive Architectures 2012","Springer","https://link.springer.com/chapter/10.1007/978-3-642-34274-5_14","https://scholar.google.com/scholar?cites=8221178478995078091&as_sdt=2005&sciodt=2007&hl=en",65,"2022-07-12 13:42:35","","10.1007/978-3-642-34274-5_14","","",,,,,1,0.11,1,1,9,"… The development of artificial intelligence (AI) systems has to date taken largely a … compare them on, from adaptability to resilience, flexibility to robustness, to applicability. We believe the …","https://scholar.google.com/scholar?output=instlink&q=info:y3uW20R-F3IJ:scholar.google.com/&hl=en&as_sdt=2007&scillfp=3633337616480791547&oi=lle","https://scholar.google.com/scholar?q=related:y3uW20R-F3IJ:scholar.google.com/&scioq=%22robustness%22+%22artificial+intelligence%22+%22resilience%22&hl=en&as_sdt=2007"
0,"C Sample, SL Eggers","Artificial Intelligence for Digital Security and Protections",2020,"","osti.gov","https://www.osti.gov/biblio/1847906","",66,"2022-07-12 13:42:35","","","","",,,,,0,0.00,0,2,2,"… have a repetitive nature that make artificial intelligence (AI) informed by machine learning … resilience techniques to data, algorithms, models, and systems. This kind of system robustness …","https://www.osti.gov/servlets/purl/1847906","https://scholar.google.com/scholar?q=related:L6OTi-tWkO4J:scholar.google.com/&scioq=%22robustness%22+%22artificial+intelligence%22+%22resilience%22&hl=en&as_sdt=2007"
58,"L Lyu, H Yu, X Ma, L Sun, J Zhao, Q Yang…","Privacy and robustness in federated learning: Attacks and defenses",2020,"arXiv preprint arXiv …","arxiv.org","https://arxiv.org/abs/2012.06337","https://scholar.google.com/scholar?cites=18348581269230113106&as_sdt=2005&sciodt=2007&hl=en",67,"2022-07-12 13:42:35","","","","",,,,,58,29.00,8,7,2,"… , the traditional centralized training of artificial intelligence (AI) … data privacy and system robustness. Besides training powerful … , thereby combining the resilience properties of Krum with …","https://arxiv.org/pdf/2012.06337","https://scholar.google.com/scholar?q=related:UtHYDHNBo_4J:scholar.google.com/&scioq=%22robustness%22+%22artificial+intelligence%22+%22resilience%22&hl=en&as_sdt=2007"
4,"E Kouicem, C Raievsky…","Towards a cyber-physical systems resilience approach based on artificial emotions and multi-agent systems",2020,"… and Artificial Intelligence …","hal.archives-ouvertes.fr","https://hal.archives-ouvertes.fr/hal-02495487/","https://scholar.google.com/scholar?cites=446939172482973264&as_sdt=2005&sciodt=2007&hl=en",68,"2022-07-12 13:42:35","","","","",,,,,4,2.00,1,3,2,"… defining resilience in different domains and presents a classification of existing resilience approaches … There is often a confusion in the uses of the terms robustness and resilience. To …","https://hal.archives-ouvertes.fr/hal-02495487/file/Towards%20a%20Cyber-physical%20Systems%20Resilience%20Approach%20based%20on%20Artificial%20Emotions%20and%20Multi-agent%20Systems.pdf","https://scholar.google.com/scholar?q=related:UP4NNM_YMwYJ:scholar.google.com/&scioq=%22robustness%22+%22artificial+intelligence%22+%22resilience%22&hl=en&as_sdt=2007"
0,"LV Massel, AG Massel, DV Pesterev","Integration of Research on Resilience of Energy and Socio-Ecological Systems Using Artificial Intelligence Methods",2021,"International Conference for …","Springer","https://link.springer.com/chapter/10.1007/978-3-030-95494-9_9","",69,"2022-07-12 13:42:35","","10.1007/978-3-030-95494-9_9","","",,,,,0,0.00,0,3,1,"… One of the successful attempts to define resilience was made in [3], we will use this definition: «Resilience is the ability of a system to return to an equilibrium or steady-state after a …","","https://scholar.google.com/scholar?q=related:WyzsC7VGbyEJ:scholar.google.com/&scioq=%22robustness%22+%22artificial+intelligence%22+%22resilience%22&hl=en&as_sdt=2007"
9,"P Radanliev, D De Roure, R Nicolescu, M Huth…","Digital twins: artificial intelligence and the IoT cyber-physical systems in industry 4.0",2022,"International Journal of …","Springer","https://link.springer.com/article/10.1007/s41315-021-00180-5","https://scholar.google.com/scholar?cites=17505449705170102899&as_sdt=2005&sciodt=2007&hl=en",70,"2022-07-12 13:42:35","HTML","10.1007/s41315-021-00180-5","","",,,,,9,9.00,2,5,1,"… , we identified that artificial intelligence improves organisational resilience in industrial … with artificial intelligence, and to design a mechanism for future evolution of artificial intelligence …","https://link.springer.com/article/10.1007/s41315-021-00180-5","https://scholar.google.com/scholar?q=related:c2ohTsLZ7_IJ:scholar.google.com/&scioq=%22robustness%22+%22artificial+intelligence%22+%22resilience%22&hl=en&as_sdt=2007"
124,"RW Scholz, YB Blumer, FS Brand","Risk, vulnerability, robustness, and resilience from a decision-theoretic perspective",2012,"Journal of risk research","Taylor & Francis","https://www.tandfonline.com/doi/abs/10.1080/13669877.2011.634522","https://scholar.google.com/scholar?cites=14893303619874694298&as_sdt=2005&sciodt=2007&hl=en",71,"2022-07-12 13:42:35","","10.1080/13669877.2011.634522","","",,,,,124,12.40,41,3,10,"… Section 2 reviews the cutting-edge research on risk, vulnerability, resilience and robustness, … on the relationship between vulnerability, resilience and robustness and the challenge of …","https://www.tandfonline.com/doi/pdf/10.1080/13669877.2011.634522","https://scholar.google.com/scholar?q=related:mqSr8rukr84J:scholar.google.com/&scioq=%22robustness%22+%22artificial+intelligence%22+%22resilience%22&hl=en&as_sdt=2007"
16,"IY Tyukin, DJ Higham…","On adversarial examples and stealth attacks in artificial intelligence systems",2020,"2020 International Joint …","ieeexplore.ieee.org","https://ieeexplore.ieee.org/abstract/document/9207472/","https://scholar.google.com/scholar?cites=12238185615928916409&as_sdt=2005&sciodt=2007&hl=en",72,"2022-07-12 13:42:35","","","","",,,,,16,8.00,5,3,2,"… malevolent action towards generic Artificial Intelligence (AI) systems… According to our findings, robustness to adversarial … questions around the issues of resilience and trustworthiness of …","https://ieeexplore.ieee.org/iel7/9200848/9206590/09207472.pdf","https://scholar.google.com/scholar?q=related:ufm8HPrE1qkJ:scholar.google.com/&scioq=%22robustness%22+%22artificial+intelligence%22+%22resilience%22&hl=en&as_sdt=2007"
36,"S Sengupta, T Chakraborti, S Kambhampati","Mtdeep: boosting the security of deep neural nets against adversarial attacks with moving target defense",2018,"… on artificial intelligence","aaai.org","https://www.aaai.org/ocs/index.php/WS/AAAIW18/paper/view/16930/0","https://scholar.google.com/scholar?cites=14946156596022485067&as_sdt=2005&sciodt=2007&hl=en",73,"2022-07-12 13:42:35","","","","",,,,,36,9.00,12,3,4,"… Target Defense (MTD) for increasing the robustness of a set of deep networks against such … more resilience to adversarial attacks than those defense mechanisms by themselves. …","https://www.aaai.org/ocs/index.php/WS/AAAIW18/paper/download/16930/15595","https://scholar.google.com/scholar?q=related:SyBIZzxqa88J:scholar.google.com/&scioq=%22robustness%22+%22artificial+intelligence%22+%22resilience%22&hl=en&as_sdt=2007"
4,"A Zhavoronkov, K Kochetov, P Diamandis…","PsychoAge and SubjAge: development of deep markers of psychological and subjective age using artificial intelligence",2020,"Aging (Albany …","ncbi.nlm.nih.gov","https://www.ncbi.nlm.nih.gov/pmc/articles/PMC7762465/","https://scholar.google.com/scholar?cites=2409589887700609340&as_sdt=2005&sciodt=2007&hl=en",74,"2022-07-12 13:42:35","HTML","","","",,,,,4,2.00,1,4,2,"… lower biological age — higher resilience to them. Traditionally, … Recently, advances in artificial intelligence have permitted the … In addition to the robustness of this dataset, we chose …","https://www.ncbi.nlm.nih.gov/pmc/articles/PMC7762465/","https://scholar.google.com/scholar?q=related:PKnEfjyVcCEJ:scholar.google.com/&scioq=%22robustness%22+%22artificial+intelligence%22+%22resilience%22&hl=en&as_sdt=2007"
137,"G Capano, JJ Woo","Resilience and robustness in policy design: A critical appraisal",2017,"Policy Sciences","Springer","https://link.springer.com/article/10.1007/s11077-016-9273-x","https://scholar.google.com/scholar?cites=10755759847813974364&as_sdt=2005&sciodt=2007&hl=en",75,"2022-07-12 13:42:35","HTML","10.1007/s11077-016-9273-x","","",,,,,137,27.40,69,2,5,"… for a policy design approach to resilience and robustness. Rather than focusing on … resilience and robustness factor into ‘real’ policy design. Seen in this light, resilience and robustness …","https://link.springer.com/article/10.1007/s11077-016-9273-x","https://scholar.google.com/scholar?q=related:XIlcWpgiRJUJ:scholar.google.com/&scioq=%22robustness%22+%22artificial+intelligence%22+%22resilience%22&hl=en&as_sdt=2007"
109,"O Ibitoye, O Shafiq, A Matrawy","Analyzing adversarial attacks against deep learning for intrusion detection in IoT networks",2019,"2019 IEEE global …","ieeexplore.ieee.org","https://ieeexplore.ieee.org/abstract/document/9014337/","https://scholar.google.com/scholar?cites=15107932499474962615&as_sdt=2005&sciodt=2007&hl=en",76,"2022-07-12 13:42:35","","","","",,,,,109,36.33,36,3,3,"… robustness, the SNN demonstrates better resilience against … no researcher has evaluated the resilience of Self-normalizing … security of machine learning and artificial intelligence in IoT. …","https://ieeexplore.ieee.org/iel7/8968653/9013108/09014337.pdf","https://scholar.google.com/scholar?q=related:t9jIIZAoqtEJ:scholar.google.com/&scioq=%22robustness%22+%22artificial+intelligence%22+%22resilience%22&hl=en&as_sdt=2007"
0,"K Kratkiewicz, D Staheli, W Streilein, D Ross, M Yee…","Response to the NIST RFI on an Artificial Intelligence Risk Management Framework",,"nist.gov","","https://www.nist.gov/document/ai-rmf-rfi-comments-mit-lincoln-laboratory","",77,"2022-07-12 13:42:35","PDF","","","",,,,,0,0.00,0,6,,"… MIT LL develops techniques, tools, and metrics for assessing AI robustness, resilience, … to robustness testing (adversarial and otherwise), which implies having previously set robustness …","https://www.nist.gov/document/ai-rmf-rfi-comments-mit-lincoln-laboratory","https://scholar.google.com/scholar?q=related:PeZuBDOpQjYJ:scholar.google.com/&scioq=%22robustness%22+%22artificial+intelligence%22+%22resilience%22&hl=en&as_sdt=2007"
3,"W TianXiang, ZL ZHENG…","Aggregation rules based on stochastic gradient descent in byzantine consensus",2019,"… Artificial Intelligence …","ieeexplore.ieee.org","https://ieeexplore.ieee.org/abstract/document/8785560/","https://scholar.google.com/scholar?cites=2990733874226455975&as_sdt=2005&sciodt=2007&hl=en",78,"2022-07-12 13:42:35","","","","",,,,,3,1.00,1,3,3,"… of Byzantine resilience and proves that the aggregation rule satisfies the Byzantine resilience condition, … We will study the robustness of aggregation rules under non-convex conditions …","https://ieeexplore.ieee.org/iel7/8770353/8785424/08785560.pdf","https://scholar.google.com/scholar?q=related:p-X-7pw4gSkJ:scholar.google.com/&scioq=%22robustness%22+%22artificial+intelligence%22+%22resilience%22&hl=en&as_sdt=2007"
0,"PVR de Carvalho, RG Costa…","A Neuro-Fuzzy System to Improve the Resilience in Nuclear Power Plant Operation",2011,"… at the Fourth Resilience …","researchgate.net","https://www.researchgate.net/profile/Erik-Hollnagel/publication/278812591_Proceedings_of_the_fourth_Resilience_Engineering_Symposium/links/5f299e22299bf13404a22ecf/Proceedings-of-the-fourth-Resilience-Engineering-Symposium.pdf#page=95","",79,"2022-07-12 13:42:35","PDF","","","",,,,,0,0.00,0,3,11,"… is an essential issue to improve the resilience in the operation of NPPs, … Artificial intelligence techniques are suitable to identify … To increase the network robustness to deal with the noisy …","https://www.researchgate.net/profile/Erik-Hollnagel/publication/278812591_Proceedings_of_the_fourth_Resilience_Engineering_Symposium/links/5f299e22299bf13404a22ecf/Proceedings-of-the-fourth-Resilience-Engineering-Symposium.pdf#page=95","https://scholar.google.com/scholar?q=related:AilBW38L0iwJ:scholar.google.com/&scioq=%22robustness%22+%22artificial+intelligence%22+%22resilience%22&hl=en&as_sdt=2007"
0,"N Kant, A Prasad","How Cyber Threat Intelligence (CTI) Ensures Cyber Resilience Using Artificial Intelligence and Machine Learning",2022,"… , and Application of Cyber Security Intelligence …","igi-global.com","https://www.igi-global.com/chapter/how-cyber-threat-intelligence-cti-ensures-cyber-resilience-using-artificial-intelligence-and-machine-learning/306860","",80,"2022-07-12 13:42:35","","","","",,,,,0,0.00,0,2,1,"… As a result, the purpose of this chapter is to give an overview of how CTI promotes cyber resilience by utilizing intelligent technologies such as artificial intelligence (AI) and machine …","",""
155,"AN Bhagoji, D Cullina, C Sitawarin…","Enhancing robustness of machine learning systems via data transformations",2018,"2018 52nd Annual …","ieeexplore.ieee.org","https://ieeexplore.ieee.org/abstract/document/8362326/","https://scholar.google.com/scholar?cites=12153399130293984368&as_sdt=2005&sciodt=2007&hl=en",81,"2022-07-12 13:42:35","","","","",,,,,155,38.75,39,4,4,"… We will give some intuition about why dimensionality reduction should improve resilience for SVMs. … of the 2nd ACM workshop on Security and artificial intelligence. ACM, 2009, pp. 1–4. …","https://ieeexplore.ieee.org/iel7/8359988/8362188/08362326.pdf","https://scholar.google.com/scholar?q=related:cNy2Fh6MqagJ:scholar.google.com/&scioq=%22robustness%22+%22artificial+intelligence%22+%22resilience%22&hl=en&as_sdt=2007"
0,"HT Liao, CL Pan","The Role of Resilience and Human Rights in the Green and Digital Transformation of Supply Chain",2021,"2021 IEEE 2nd International Conference on …","ieeexplore.ieee.org","https://ieeexplore.ieee.org/abstract/document/9768730/","",82,"2022-07-12 13:42:35","","","","",,,,,0,0.00,0,2,1,"… of social media, big data, artificial intelligence, and cloud computing, the study conducts a … supply chain resilience and robustness. The approaches to robustness and resilience have …","https://ieeexplore.ieee.org/iel7/9768306/9768311/09768730.pdf","https://scholar.google.com/scholar?q=related:c-JwnxhpYXcJ:scholar.google.com/&scioq=%22robustness%22+%22artificial+intelligence%22+%22resilience%22&hl=en&as_sdt=2007"
0,"M Taddeo, T McCutcheon, L Floridi","Trusting Artificial Intelligence in Cybersecurity Is a Double-Edged Sword",2021,"… , and Policies in Artificial Intelligence","Springer","https://link.springer.com/chapter/10.1007/978-3-030-81907-1_15","",83,"2022-07-12 13:42:35","","10.1007/978-3-030-81907-1_15","","",,,,,0,0.00,0,3,1,"… Artificial intelligence (AI) can lower these figures, and the associate human capital and … the 3R: robustness, response, and resilience). First, AI can improve a system’s robustness, that is, …","","https://scholar.google.com/scholar?q=related:SsW1yONxctsJ:scholar.google.com/&scioq=%22robustness%22+%22artificial+intelligence%22+%22resilience%22&hl=en&as_sdt=2007"
20,"R Movassagh","Cayley path and quantum computational supremacy: A proof of average-case# P-hardness of Random Circuit Sampling with quantified robustness",2020,"American Physical Society (March Meeting)","research.ibm.com","https://research.ibm.com/publications/cayley-path-and-quantum-computational-supremacy-a-proof-of-average-case-p-hardness-of-random-circuit-sampling-with-quantified-robustness","https://scholar.google.com/scholar?cites=4629926971466778418&as_sdt=2005&sciodt=2007&hl=en",84,"2022-07-12 13:42:35","","","","",,,,,20,10.00,20,1,2,"… of the power series representation of the exponential function does not provide practical robustness. Explicit bounds on noise resilience are proved, which on a grid of sqrt(n)xsqrt(n) …","","https://scholar.google.com/scholar?q=related:MgdH1gzOQEAJ:scholar.google.com/&scioq=%22robustness%22+%22artificial+intelligence%22+%22resilience%22&hl=en&as_sdt=2007"
8,"W Liu, Y Xu, D Fan, Y Li, XF Shao, J Zheng","Alleviating corporate environmental pollution threats toward public health and safety: The role of smart city and artificial intelligence",2021,"Safety Science","Elsevier","https://www.sciencedirect.com/science/article/pii/S0925753521002770","https://scholar.google.com/scholar?cites=16764269506280625946&as_sdt=2005&sciodt=2007&hl=en",85,"2022-07-12 13:42:35","HTML","","","",,,,,8,8.00,1,6,1,"… Except for the alternative measure of the dependent variable as shown in Table 2, we also conducted several analyses to test the robustness of our results. First, the dependent variable …","https://www.sciencedirect.com/science/article/pii/S0925753521002770","https://scholar.google.com/scholar?q=related:GhfFiEumpugJ:scholar.google.com/&scioq=%22robustness%22+%22artificial+intelligence%22+%22resilience%22&hl=en&as_sdt=2007"
2,"T Wunderlich, AF Kungl, E Müller, J Schemmel…","Brain-Inspired Hardware for Artificial Intelligence: Accelerated Learning in a Physical-Model Spiking Neural Network",2019,"… Conference on Artificial …","Springer","https://link.springer.com/chapter/10.1007/978-3-030-30487-4_10","https://scholar.google.com/scholar?cites=7740511575386970176&as_sdt=2005&sciodt=2007&hl=en",86,"2022-07-12 13:42:35","","10.1007/978-3-030-30487-4_10","","",,,,,2,0.67,0,5,3,"… Future developments in artificial intelligence will profit from the … learning, high energy efficiency and resilience to noise. … , high energy-efficiency and robustness to noise in a closed-loop …","https://arxiv.org/pdf/1909.11145","https://scholar.google.com/scholar?q=related:QFi9TkTSa2sJ:scholar.google.com/&scioq=%22robustness%22+%22artificial+intelligence%22+%22resilience%22&hl=en&as_sdt=2007"
17,"R Svenningsson","Model-implemented fault injection for robustness assessment",2011,"","diva-portal.org","https://www.diva-portal.org/smash/record.jsf?pid=diva2:460561","https://scholar.google.com/scholar?cites=9952710921675150642&as_sdt=2005&sciodt=2007&hl=en",87,"2022-07-12 13:42:35","HTML","","","",,,,,17,1.55,17,1,11,"… level of robustness. Robustness is in this thesis defined as the resilience of hardware, … One way of performing robustness assessment is to carry out fault injection, also known as …","https://www.diva-portal.org/smash/record.jsf?pid=diva2:460561","https://scholar.google.com/scholar?q=related:MhWZ_tkhH4oJ:scholar.google.com/&scioq=%22robustness%22+%22artificial+intelligence%22+%22resilience%22&hl=en&as_sdt=2007"
2,"M Taddeo","On the Risks of Trusting Artificial Intelligence: The Case of Cybersecurity",2021,"The 2020 Yearbook of the Digital Ethics Lab","Springer","https://link.springer.com/chapter/10.1007/978-3-030-80083-3_10","https://scholar.google.com/scholar?cites=17439623549682253799&as_sdt=2005&sciodt=2007&hl=en",88,"2022-07-12 13:42:35","","10.1007/978-3-030-80083-3_10","","",,,,,2,2.00,2,1,1,"… AI is also increasingly deployed for system resilience, ie for threat … AI can improve system resilience to attacks but this requires … For this reason, the assessment of the robustness of AI …","https://www.researchgate.net/profile/Mariarosaria-Taddeo/publication/345863493_On_The_Risks_of_Trusting_Artificial_Intelligence_The_Case_of_Cybersecurity/links/5fb005cfa6fdcc9ae051599a/On-The-Risks-of-Trusting-Artificial-Intelligence-The-Case-of-Cybersecurity.pdf","https://scholar.google.com/scholar?q=related:5_9YJzj9BfIJ:scholar.google.com/&scioq=%22robustness%22+%22artificial+intelligence%22+%22resilience%22&hl=en&as_sdt=2007"
13,"M Ozatay, L Aygun, H Jia, P Kumar…","Artificial intelligence meets large-scale sensing: Using large-area electronics (LAE) to enable intelligent spaces",2018,"2018 IEEE Custom …","ieeexplore.ieee.org","https://ieeexplore.ieee.org/abstract/document/8357031/","https://scholar.google.com/scholar?cites=11733049251172875489&as_sdt=2005&sciodt=2007&hl=en",89,"2022-07-12 13:42:35","","","","",,,,,13,3.25,3,5,4,"… But real-world data challenges the efficiency and robustness with which AI systems of today can perform, due to the highly dynamic and noisy scenarios they face. While algorithmic …","https://ieeexplore.ieee.org/iel7/8355238/8357004/08357031.pdf","https://scholar.google.com/scholar?q=related:4XxSLCEq1KIJ:scholar.google.com/&scioq=%22robustness%22+%22artificial+intelligence%22+%22resilience%22&hl=en&as_sdt=2007"
0,"R Jayawardene","Artificial Intelligence for Resilience in Smart Grid Operations",2020,"","search.proquest.com","https://search.proquest.com/openview/5af7c49c6a5bdd96740bed905e206e2e/1?pq-origsite=gscholar&cbl=18750&diss=y","",90,"2022-07-12 13:42:35","","","","",,,,,0,0.00,0,1,2,"… these challenges in maintaining resilience in smart grid. In this dissertation, artificial intelligence (AI) based approaches have been developed to enhance resilience in smart grid. …","https://tigerprints.clemson.edu/cgi/viewcontent.cgi?article=3754&context=all_dissertations","https://scholar.google.com/scholar?q=related:nGEMAIPhPlMJ:scholar.google.com/&scioq=%22robustness%22+%22artificial+intelligence%22+%22resilience%22&hl=en&as_sdt=2007"
23,"OA Omitaomu, H Niu","Artificial intelligence techniques in smart grid: A survey",2021,"Smart Cities","mdpi.com","https://www.mdpi.com/article/10.3390/smartcities4020029","https://scholar.google.com/scholar?cites=15833391259261518852&as_sdt=2005&sciodt=2007&hl=en",91,"2022-07-12 13:42:35","","10.3390/smartcities4020029","","",,,,,23,23.00,12,2,1,"… thus, the applications of artificial intelligence (AI) techniques in … improve the reliability and resilience of smart grid systems. … results presented high accuracy and robustness. Kamari et al. […","https://www.mdpi.com/2624-6511/4/2/29/pdf?version=1619083864","https://scholar.google.com/scholar?q=related:BMQOHnaBu9sJ:scholar.google.com/&scioq=%22robustness%22+%22artificial+intelligence%22+%22resilience%22&hl=en&as_sdt=2007"
325,"G Baryannis, S Validi, S Dani…","Supply chain risk management and artificial intelligence: state of the art and future research directions",2019,"International Journal of …","Taylor & Francis","https://www.tandfonline.com/doi/abs/10.1080/00207543.2018.1530476","https://scholar.google.com/scholar?cites=11740761521657556779&as_sdt=2005&sciodt=2007&hl=en",92,"2022-07-12 13:42:35","","10.1080/00207543.2018.1530476","","",,,,,325,108.33,81,4,3,"… OR crisis OR disaster OR catastrophe OR peril OR hazard OR emergency OR opportunity OR resilience OR robustness OR security OR safety OR flexibility OR agility OR sustainability’. …","https://www.tandfonline.com/doi/pdf/10.1080/00207543.2018.1530476","https://scholar.google.com/scholar?q=related:Ky_5EmaQ76IJ:scholar.google.com/&scioq=%22robustness%22+%22artificial+intelligence%22+%22resilience%22&hl=en&as_sdt=2007"
6,"E Manziuk, O Barmak, I Krak, O Mazurets, T Skrypnyk","Formal Model of Trustworthy Artificial Intelligence Based on Standardization.",2021,"IntelITSIS","ceur-ws.org","http://ceur-ws.org/Vol-2853/short18.pdf","https://scholar.google.com/scholar?cites=1015554906849541396&as_sdt=2005&sciodt=2007&hl=en",93,"2022-07-12 13:42:35","PDF","","","",,,,,6,6.00,1,5,1,"… In terms of partial full match and full coverage of content {Reliability, Resilience, Robustness} in the subcategory Reliability completely coincides with partial {Trust}, and in the category {…","http://ceur-ws.org/Vol-2853/short18.pdf","https://scholar.google.com/scholar?q=related:FP2roM75Fw4J:scholar.google.com/&scioq=%22robustness%22+%22artificial+intelligence%22+%22resilience%22&hl=en&as_sdt=2007"
280,"B Inkster, S Sarda, V Subramanian","An empathy-driven, conversational artificial intelligence agent (Wysa) for digital mental well-being: real-world data evaluation mixed-methods study",2018,"JMIR mHealth and uHealth","mhealth.jmir.org","https://mhealth.jmir.org/2018/11/e12106/","https://scholar.google.com/scholar?cites=7862518840722644896&as_sdt=2005&sciodt=2007&hl=en",94,"2022-07-12 13:42:35","HTML","","","",,,,,280,70.00,93,3,4,"… mobile chatbot app aimed at building mental resilience and promoting mental well-being … tools to encourage users to build emotional resilience skills. The Wysa scientific advisory board …","https://mhealth.jmir.org/2018/11/e12106/","https://scholar.google.com/scholar?q=related:oN8WbTpHHW0J:scholar.google.com/&scioq=%22robustness%22+%22artificial+intelligence%22+%22resilience%22&hl=en&as_sdt=2007"
2,"A Koshiyama, E Kazim, P Treleaven","Algorithm auditing: Managing the legal, ethical, and technological risks of artificial intelligence, machine learning, and associated algorithms",2022,"Computer","ieeexplore.ieee.org","https://ieeexplore.ieee.org/abstract/document/9755237/","https://scholar.google.com/scholar?cites=14681197009244840658&as_sdt=2005&sciodt=2007&hl=en",95,"2022-07-12 13:42:35","","","","",,,,,2,2.00,1,3,1,"… with the remit to validate artificial intelligence, machine learning, and associated algorithms. … We can rate an algorithm’s robustness using four key criteria. › Resilience to attack and …","https://ieeexplore.ieee.org/iel7/2/9755210/09755237.pdf","https://scholar.google.com/scholar?q=related:0uKQReUWvssJ:scholar.google.com/&scioq=%22robustness%22+%22artificial+intelligence%22+%22resilience%22&hl=en&as_sdt=2007"
