Cites,Authors,Title,Year,Source,Publisher,ArticleURL,CitesURL,GSRank,QueryDate,Type,DOI,ISSN,CitationURL,Volume,Issue,StartPage,EndPage,ECC,CitesPerYear,CitesPerAuthor,AuthorCount,Age,Abstract,FullTextURL,RelatedURL
0,"LL Pullum","Review of Metrics to Measure the Stability, Robustness and Resilience of Reinforcement Learning",2022,"arXiv preprint arXiv:2203.12048","arxiv.org","https://arxiv.org/abs/2203.12048","",96,"2022-07-12 13:42:35","","","","",,,,,0,0.00,0,1,1,"… We believe that this is the first comprehensive review of stability, robustness and resilience specifically geared towards RL. The remainder of the paper is organized as follows. Section 2 …","https://arxiv.org/pdf/2203.12048","https://scholar.google.com/scholar?q=related:0rVbleDWwsAJ:scholar.google.com/&scioq=%22robustness%22+%22artificial+intelligence%22+%22resilience%22&hl=en&as_sdt=2007"
235,"Q Yu, S Li, N Raviv, SMM Kalan…","Lagrange coded computing: Optimal design for resiliency, security, and privacy",2019,"… Artificial Intelligence …","proceedings.mlr.press","http://proceedings.mlr.press/v89/yu19b.html","https://scholar.google.com/scholar?cites=1591713720166385647&as_sdt=2005&sciodt=2007&hl=en",97,"2022-07-12 13:42:35","","","","",,,,,235,78.33,47,5,3,"… by 1 or increase the robustness to malicious servers by 1/2, … one parity can provide robustness against one erasure or 1/2 … 1 worker can increase its resilience to stragglers by 1 or its …","http://proceedings.mlr.press/v89/yu19b/yu19b.pdf","https://scholar.google.com/scholar?q=related:7wei-jHnFhYJ:scholar.google.com/&scioq=%22robustness%22+%22artificial+intelligence%22+%22resilience%22&hl=en&as_sdt=2007"
6,"S Alemzadeh, H Talebiyan, S Talebi…","Resource Allocation for Infrastructure Resilience using Artificial Neural Networks",2020,"… Artificial Intelligence …","ieeexplore.ieee.org","https://ieeexplore.ieee.org/abstract/document/9288193/","https://scholar.google.com/scholar?cites=6531718251802826722&as_sdt=2005&sciodt=2007&hl=en",98,"2022-07-12 13:42:35","","","","",,,,,6,3.00,2,4,2,"… The impact of infrastructure networks is omnipresent in our daily life, and hence, infrastructure resilience is critical for societal decision-makers at different levels [1], [2]. Infrastructure …","https://ieeexplore.ieee.org/iel7/9288160/9288161/09288193.pdf","https://scholar.google.com/scholar?q=related:4pekuyRTpVoJ:scholar.google.com/&scioq=%22robustness%22+%22artificial+intelligence%22+%22resilience%22&hl=en&as_sdt=2007"
0,"K Abendroth-Dias","… Look Like? A Study Addressing the Public Policy Challenges and Socio-Political Implications of the Development of Artificial Intelligence for NATO Security and …",,"sto.nato.int","","https://www.sto.nato.int/publications/STO%20Meeting%20Proceedings/STO-MP-SAS-OCS-ORA-2020/MP-SAS-OCS-ORA-2020-EDT-01-2.pdf","",99,"2022-07-12 13:42:35","PDF","","","",,,,,0,0.00,0,1,,"… Resilience-building should inform how we design and distribute AI systems, and who … 22 interviews, this project presents an analysis of how resilience building with regard to AI- and ML-…","https://www.sto.nato.int/publications/STO%20Meeting%20Proceedings/STO-MP-SAS-OCS-ORA-2020/MP-SAS-OCS-ORA-2020-EDT-01-2.pdf","https://scholar.google.com/scholar?q=related:dVlEdX4NFcUJ:scholar.google.com/&scioq=%22robustness%22+%22artificial+intelligence%22+%22resilience%22&hl=en&as_sdt=2007"
1,"F Casarosa","Cybersecurity certification of Artificial Intelligence: a missed opportunity to coordinate between the Artificial Intelligence Act and the Cybersecurity Act",2022,"International Cybersecurity Law Review","Springer","https://link.springer.com/article/10.1365/s43439-021-00043-6","https://scholar.google.com/scholar?cites=7484691373600440421&as_sdt=2005&sciodt=2007&hl=en",100,"2022-07-12 13:42:35","","10.1365/s43439-021-00043-6","","",,,,,1,1.00,1,1,1,"… Cybersecurity is an area where certification has been deemed crucial in order to improve the robustness, response and resilience of AI systems against third-party attacks. …","","https://scholar.google.com/scholar?q=related:ZYDiECb33mcJ:scholar.google.com/&scioq=%22robustness%22+%22artificial+intelligence%22+%22resilience%22&hl=en&as_sdt=2007"
41,"I Ilahi, M Usama, J Qadir, MU Janjua…","Challenges and countermeasures for adversarial attacks on deep reinforcement learning",2021,"… Artificial Intelligence","ieeexplore.ieee.org","https://ieeexplore.ieee.org/abstract/document/9536399/","https://scholar.google.com/scholar?cites=2614227555451437652&as_sdt=2005&sciodt=2007&hl=en",101,"2022-07-12 13:42:35","","","","",,,,,41,41.00,8,5,1,"… available benchmarks and metrics for the robustness of DRL. … solution to evaluate the robustness and resilience of DRL policies is … and benchmark the resilience and robustness of DRL …","https://ieeexplore.ieee.org/iel7/9078688/9184921/09536399.pdf","https://scholar.google.com/scholar?q=related:VIK4ZByaRyQJ:scholar.google.com/&scioq=%22robustness%22+%22artificial+intelligence%22+%22resilience%22&hl=en&as_sdt=2007"
0,"M Kang, HK Kim, S Lee, S Han","Resilience against Adversarial Examples: Data-Augmentation Exploiting Generative Adversarial Networks",2021,"KSII Transactions on Internet …","koreascience.or.kr","https://www.koreascience.or.kr/article/JAKO202102565090215.page","",102,"2022-07-12 13:42:35","","","","",,,,,0,0.00,0,4,1,"… due to the rise in popularity of artificial intelligence (AI). DNN-based … been found to lack robustness against malwares that are … a methodology to improve the robustness of DNN-based …","https://www.koreascience.or.kr/article/JAKO202102565090215.pdf","https://scholar.google.com/scholar?q=related:w4J2E3_PEHoJ:scholar.google.com/&scioq=%22robustness%22+%22artificial+intelligence%22+%22resilience%22&hl=en&as_sdt=2007"
0,"C Galnares, AC Martínez-Estudillo…","Revisiting the determinants of sovereign debt ratings in Europe through artificial intelligence techniques",2022,"Applied Economics …","Taylor & Francis","https://www.tandfonline.com/doi/abs/10.1080/13504851.2022.2097171","",103,"2022-07-12 13:42:35","","10.1080/13504851.2022.2097171","","",,,,,0,0.00,0,3,1,"… In papers using artificial intelligence (AI) techniques, little attention has been paid to the … The robustness of this set is supported by the results obtained with different well-known AI …","",""
0,"H Chan","Computational Models of Systems Resilience",,"pdfs.semanticscholar.org","","https://pdfs.semanticscholar.org/f465/8268507c5d550265ed57c5ed607a329ceaea.pdf","",104,"2022-07-12 13:42:35","PDF","","","",,,,,0,0.00,0,1,,"… domains • Analyze computational complexity of several problems related to systems resilience • Develop tools and software for better testing and understanding of systems resilience …","https://pdfs.semanticscholar.org/f465/8268507c5d550265ed57c5ed607a329ceaea.pdf",""
1,"CC Chang, TS Nguyen, CC Lin","A Reversible Database Watermark Scheme for Textual and Numerical Datasets",2021,"… , Artificial Intelligence …","ieeexplore.ieee.org","https://ieeexplore.ieee.org/abstract/document/9704991/","https://scholar.google.com/scholar?cites=18194759208788438728&as_sdt=2005&sciodt=2007&hl=en",105,"2022-07-12 13:42:35","","","","",,,,,1,1.00,0,3,1,"… databases to further improve the robustness of such schemes for … To solve this problem and further improve robustness, in this … Here, results of resilience to an insertion attack by our …","https://ieeexplore.ieee.org/iel7/9704881/9704883/09704991.pdf","https://scholar.google.com/scholar?q=related:yC6atRnFgPwJ:scholar.google.com/&scioq=%22robustness%22+%22artificial+intelligence%22+%22resilience%22&hl=en&as_sdt=2007"
50,"JV Florez, M Lauras, U Okongwu, L Dupont","A decision support system for robust humanitarian facility location",2015,"… of Artificial Intelligence","Elsevier","https://www.sciencedirect.com/science/article/pii/S0952197615001426","https://scholar.google.com/scholar?cites=11692356195234484487&as_sdt=2005&sciodt=2007&hl=en",106,"2022-07-12 13:42:35","HTML","","","",,,,,50,7.14,13,4,7,"… artificial intelligence-based decision-making tool that takes into account the reality on the ground and is capable of guaranteeing resilience … guarantees greater robustness by allowing …","https://www.sciencedirect.com/science/article/pii/S0952197615001426","https://scholar.google.com/scholar?q=related:BxFKxAKYQ6IJ:scholar.google.com/&scioq=%22robustness%22+%22artificial+intelligence%22+%22resilience%22&hl=en&as_sdt=2007"
8,"P Ala-Pietilä, Y Bonnet, U Bergmann, M Bielikova…","The assessment list for trustworthy artificial intelligence (ALTAI)",2020,"","books.google.com","https://books.google.com/books?hl=en&lr=&id=cu8dEAAAQBAJ&oi=fnd&pg=PA1&dq=%22robustness%22+%22artificial+intelligence%22+%22resilience%22&ots=C9_IFle9uU&sig=RoS483oeaeijrM7bFEP3dTV6DmU","https://scholar.google.com/scholar?cites=9852146461998796230&as_sdt=2005&sciodt=2007&hl=en",107,"2022-07-12 13:42:35","BOOK","","","",,,,,8,4.00,2,5,2,"… to deliver services that can justifiably be trusted) and resilience (robustness when facing changes). Technical robustness requires that AI systems are developed with a preventative …","https://books.google.com/books?hl=en&lr=&id=cu8dEAAAQBAJ&oi=fnd&pg=PA1&dq=%22robustness%22+%22artificial+intelligence%22+%22resilience%22&ots=C9_IFle9uU&sig=RoS483oeaeijrM7bFEP3dTV6DmU","https://scholar.google.com/scholar?q=related:xk2PHgLbuYgJ:scholar.google.com/&scioq=%22robustness%22+%22artificial+intelligence%22+%22resilience%22&hl=en&as_sdt=2007"
30,"C Hawes, C Reed","Theoretical steps towards modelling resilience in complex systems",2006,"… Conference on Computational Science and its …","Springer","https://link.springer.com/chapter/10.1007/11751540_68","https://scholar.google.com/scholar?cites=17030412989085308408&as_sdt=2005&sciodt=2007&hl=en",108,"2022-07-12 13:42:35","","10.1007/11751540_68","","",,,,,30,1.88,15,2,16,"… approaches that are consonant with artificial intelligence techniques in multi-agent systems, … as a synonym of robustness or fault tolerance. In neither domain is resilience consistently or …","http://arg-tech.org/people/chris/publications/2006/iwmcs06.pdf","https://scholar.google.com/scholar?q=related:-NWg8GEuWOwJ:scholar.google.com/&scioq=%22robustness%22+%22artificial+intelligence%22+%22resilience%22&hl=en&as_sdt=2007"
21,"E Blasch, S Liu, Z Liu, Y Zheng","Deep learning measures of effectiveness",2018,"NAECON 2018-IEEE National …","ieeexplore.ieee.org","https://ieeexplore.ieee.org/abstract/document/8556808/","https://scholar.google.com/scholar?cites=11414887735959040621&as_sdt=2005&sciodt=2007&hl=en",109,"2022-07-12 13:42:35","","","","",,,,,21,5.25,5,4,4,"… Abstract – The resurgence of interest in artificial intelligence (… we have to test the measures for robustness which relates to … survivability to perturbations, resilience to adversarial attacks (…","https://ieeexplore.ieee.org/iel7/8540799/8556635/08556808.pdf","https://scholar.google.com/scholar?q=related:bTLNzOrTaZ4J:scholar.google.com/&scioq=%22robustness%22+%22artificial+intelligence%22+%22resilience%22&hl=en&as_sdt=2007"
0,"F Tsalakanidou, S Papadopoulos, V Mezaris…","The AI4Media Project: Use of Next-Generation Artificial Intelligence Technologies for Media Sector Applications",2021,"… on Artificial Intelligence …","Springer","https://link.springer.com/chapter/10.1007/978-3-030-79150-6_7","",110,"2022-07-12 13:42:35","","10.1007/978-3-030-79150-6_7","","",,,,,0,0.00,0,4,1,"… To ensure trustworthy AI for media applications, AI robustness, explainability, privacy and fairness are explored. We focus on enhancing system resilience towards adversarial attacks …","https://drive.google.com/file/d/1o7Gnn9BoDQ__XY4yP9Vm7iq5SICDIToH/view","https://scholar.google.com/scholar?q=related:pZNk-t2H288J:scholar.google.com/&scioq=%22robustness%22+%22artificial+intelligence%22+%22resilience%22&hl=en&as_sdt=2007"
7,"JA Erkoyuncu, M Farsi, D Ariansyah","An intelligent agent-based architecture for resilient digital twins in manufacturing",2021,"CIRP annals","Elsevier","https://www.sciencedirect.com/science/article/pii/S0007850621000731","https://scholar.google.com/scholar?cites=1306314891182408529&as_sdt=2005&sciodt=2007&hl=en",111,"2022-07-12 13:42:35","HTML","","","",,,,,7,7.00,2,3,1,"… However, the robustness and resilience of the DT itself remain an issue. Accordingly, this … to improve the robustness (including accuracy of representativeness) and resilience (including …","https://www.sciencedirect.com/science/article/pii/S0007850621000731","https://scholar.google.com/scholar?q=related:UQO77Xj2IBIJ:scholar.google.com/&scioq=%22robustness%22+%22artificial+intelligence%22+%22resilience%22&hl=en&as_sdt=2007"
0,"E Rauch","AI AS AN ENABLER FOR LONG-TERM RESILIENCE IN MANUFACTURING",2021,"","worldmanufacturing.org","https://worldmanufacturing.org/wp-content/uploads/06_Rauch-1.pdf","",112,"2022-07-12 13:42:35","PDF","","","",,,,,0,0.00,0,1,1,"… of Artificial Intelligence has already reported on the potential of AI in manufacturing. AI applications impact the resilience, … Strengthening factory resilience and robustness The ability to …","https://worldmanufacturing.org/wp-content/uploads/06_Rauch-1.pdf","https://scholar.google.com/scholar?q=related:4iUVEC3f7wwJ:scholar.google.com/&scioq=%22robustness%22+%22artificial+intelligence%22+%22resilience%22&hl=en&as_sdt=2007"
8,"S Jain, M Luthra, S Sharma…","Trustworthiness of Artificial Intelligence",2020,"2020 6th International …","ieeexplore.ieee.org","https://ieeexplore.ieee.org/abstract/document/9074237/","https://scholar.google.com/scholar?cites=18268686921490982791&as_sdt=2005&sciodt=2007&hl=en",113,"2022-07-12 13:42:35","","","","",,,,,8,4.00,2,4,2,"… Technical robustness and safety Resilience to attack: Just like any software, AI systems also have the vulnerability of getting attacked by adversaries (eg. hacking). In case an AI system …","https://ieeexplore.ieee.org/iel7/9058619/9074154/09074237.pdf","https://scholar.google.com/scholar?q=related:h2dLpPZph_0J:scholar.google.com/&scioq=%22robustness%22+%22artificial+intelligence%22+%22resilience%22&hl=en&as_sdt=2007"
65,"M Nassar, K Salah, MH ur Rehman…","Blockchain for explainable and trustworthy artificial intelligence",2020,"… Reviews: Data Mining …","Wiley Online Library","https://wires.onlinelibrary.wiley.com/doi/abs/10.1002/widm.1340","https://scholar.google.com/scholar?cites=3930540965058381766&as_sdt=2005&sciodt=2007&hl=en",114,"2022-07-12 13:42:35","","10.1002/widm.1340","","",,,,,65,32.50,16,4,2,"… Blockchain provides decentralization, determinism, immutability, data integrity, and resilience … Resiliency is robustness against tampering attacks. In case a party changes one bit of …","https://wires.onlinelibrary.wiley.com/doi/pdf/10.1002/widm.1340","https://scholar.google.com/scholar?q=related:xgdtzS4WjDYJ:scholar.google.com/&scioq=%22robustness%22+%22artificial+intelligence%22+%22resilience%22&hl=en&as_sdt=2007"
24,"M Ouyang, C Liu, M Xu","Value of resilience-based solutions on critical infrastructure protection: Comparing with robustness-based solutions",2019,"Reliability Engineering & System Safety","Elsevier","https://www.sciencedirect.com/science/article/pii/S0951832018304927","https://scholar.google.com/scholar?cites=8121598285975554155&as_sdt=2005&sciodt=2007&hl=en",115,"2022-07-12 13:42:35","HTML","","","",,,,,24,8.00,8,3,3,"… the optimal robustness-based and resilience-based … robustness-based protection strategy, the value of resilience-based solution is quantified by how much the system resilience …","https://www.sciencedirect.com/science/article/pii/S0951832018304927","https://scholar.google.com/scholar?q=related:a4j-a5y2tXAJ:scholar.google.com/&scioq=%22robustness%22+%22artificial+intelligence%22+%22resilience%22&hl=en&as_sdt=2007"
13,"I Shumailov, Y Zhao, R Mullins…","Towards certifiable adversarial sample detection",2020,"… on Artificial Intelligence …","dl.acm.org","https://dl.acm.org/doi/abs/10.1145/3411508.3421381","https://scholar.google.com/scholar?cites=12136804522491283442&as_sdt=2005&sciodt=2007&hl=en",116,"2022-07-12 13:42:35","","10.1145/3411508.3421381","","",,,,,13,6.50,3,4,2,"… methods that focus purely on improving network robustness. We show that CTT has small … The kind of DNN resilience on offer from adversarial training or certifiable robustness does …","https://dl.acm.org/doi/pdf/10.1145/3411508.3421381","https://scholar.google.com/scholar?q=related:8ody32iXbqgJ:scholar.google.com/&scioq=%22robustness%22+%22artificial+intelligence%22+%22resilience%22&hl=en&as_sdt=2007"
90,"E Neri, F Coppola, V Miele, C Bibbolino, R Grassi","Artificial intelligence: Who is responsible for the diagnosis?",2020,"La radiologia medica","Springer","https://link.springer.com/article/10.1007/s11547-020-01135-9","https://scholar.google.com/scholar?cites=4281046605041721171&as_sdt=2005&sciodt=2007&hl=en",117,"2022-07-12 13:42:35","HTML","10.1007/s11547-020-01135-9","","",,,,,90,45.00,18,5,2,"… should be technically robust and safe, ie, the resilience of software against security attacks and the … Quality measures should relate to software robustness and data security, as well as …","https://link.springer.com/article/10.1007/s11547-020-01135-9","https://scholar.google.com/scholar?q=related:U19nkDRVaTsJ:scholar.google.com/&scioq=%22robustness%22+%22artificial+intelligence%22+%22resilience%22&hl=en&as_sdt=2007"
0,"G Chhipi-Shrestha, V Moudgil, R Ouche…","Enhancing Resilience of Urban Systems Against Climate-Induced Floods Using Advanced Data-Driven and Computing Techniques: A Driver-Pressure-State-Impact …",2021,"","osti.gov","https://www.osti.gov/biblio/1769705","",118,"2022-07-12 13:42:35","","","","",,,,,0,0.00,0,4,1,"… This creates the need to integrate data science and artificial intelligence (AI) in … ) (ii) robustness (limiting damage level) and (iii) recoverability (minimizing recovery time). Flood resilience …","https://www.osti.gov/servlets/purl/1769705",""
6,"JC Bedoya, Y Wang, CC Liu","Distribution System Resilience Under Asynchronous Information Using Deep Reinforcement Learning",2021,"IEEE Transactions on Power …","ieeexplore.ieee.org","https://ieeexplore.ieee.org/abstract/document/9345996/","https://scholar.google.com/scholar?cites=16836546088829848996&as_sdt=2005&sciodt=2007&hl=en",119,"2022-07-12 13:42:35","","","","",,,,,6,6.00,2,3,1,"… On the other hand, artificial intelligence (AI)-based tools have demonstrated efficient results … Algorithms that account for scalability and robustness to asynchronous information are yet to …","https://ieeexplore.ieee.org/iel7/59/4374138/09345996.pdf","https://scholar.google.com/scholar?q=related:pA0yxXZtp-kJ:scholar.google.com/&scioq=%22robustness%22+%22artificial+intelligence%22+%22resilience%22&hl=en&as_sdt=2007"
0,"J Hu, Q Zhu, S Jha","Introduction to the Special Issue on Artificial Intelligence and Cyber-Physical Systems: Part 1",2021,"ACM Transactions on Cyber-Physical Systems …","dl.acm.org","https://dl.acm.org/doi/fullHtml/10.1145/3471164","",120,"2022-07-12 13:42:35","HTML","10.1145/3471164","","",,,,,0,0.00,0,3,1,"… In light of the rapid advancements in artificial intelligence (AI) … ness, resilience, and interpretability of artificial intelligence in its … that they can enhance the robustness of the …","https://dl.acm.org/doi/fullHtml/10.1145/3471164",""
0,"CHH Yang, ITD Hung, Y Ouyang…","Training a Resilient Q-network against Observational Interference",2022,"… on Artificial Intelligence","ojs.aaai.org","https://ojs.aaai.org/index.php/AAAI/article/view/20862","",121,"2022-07-12 13:42:35","","","","",,,,,0,0.00,0,4,1,"… Furthermore, to benchmark the level of resilience of different RL models, we propose a new robustness measure, … We provide more robustness measurements in Appendix A and D. …","https://ojs.aaai.org/index.php/AAAI/article/view/20862/20621",""
18,"M Taddeo","Is cybersecurity a public good?",2019,"Minds and Machines","Springer","https://link.springer.com/article/10.1007/s11023-019-09507-5","https://scholar.google.com/scholar?cites=16737466433419901268&as_sdt=2005&sciodt=2007&hl=en",122,"2022-07-12 13:42:35","HTML","10.1007/s11023-019-09507-5","","",,,,,18,6.00,18,1,3,"… ’s resilience; define system responses to attacks. While I agree that system robustness qualifies as a public good, I argue that this is not the case for system’s resilience and response. …","https://link.springer.com/article/10.1007/s11023-019-09507-5","https://scholar.google.com/scholar?q=related:VHkE1AptR-gJ:scholar.google.com/&scioq=%22robustness%22+%22artificial+intelligence%22+%22resilience%22&hl=en&as_sdt=2007"
10,"ÁA Cabrera, F Hohman, J Lin, DH Chau","Interactive classification for deep learning interpretation",2018,"arXiv preprint arXiv:1806.05660","arxiv.org","https://arxiv.org/abs/1806.05660","https://scholar.google.com/scholar?cites=8423862938992488382&as_sdt=2005&sciodt=2007&hl=en",123,"2022-07-12 13:42:35","","","","",,,,,10,2.50,3,4,4,"… Public trust in artificial intelligence and machine learning is … learning image classifier that exhibits resilience to semantic edits. … users to explore the robustness and sensitivity of deep …","https://arxiv.org/pdf/1806.05660","https://scholar.google.com/scholar?q=related:vq85I7aS53QJ:scholar.google.com/&scioq=%22robustness%22+%22artificial+intelligence%22+%22resilience%22&hl=en&as_sdt=2007"
196,"SA Seshia, D Sadigh, SS Sastry","Towards verified artificial intelligence",2016,"arXiv preprint arXiv:1606.08514","arxiv.org","https://arxiv.org/abs/1606.08514","https://scholar.google.com/scholar?cites=7212734322484115194&as_sdt=2005&sciodt=2007&hl=en",124,"2022-07-12 13:42:35","","","","",,,,,196,32.67,65,3,6,"… properties of AI components such as robustness and fairness in a unified manner? … Therefore, techniques for achieving fault tolerance and error resilience at run time must play a crucial …","https://arxiv.org/pdf/1606.08514","https://scholar.google.com/scholar?q=related:-vbuzqbHGGQJ:scholar.google.com/&scioq=%22robustness%22+%22artificial+intelligence%22+%22resilience%22&hl=en&as_sdt=2007"
1,"M Grau, W Korol, J Lützenberger…","Automated Generation of a Digital Twin of a Process Plant by Using 3D Scan and Artificial Intelligence",2021,"… for Resilience …","ebooks.iospress.nl","https://ebooks.iospress.nl/volumearticle/57761","https://scholar.google.com/scholar?cites=108774647801247182&as_sdt=2005&sciodt=2007&hl=en",125,"2022-07-12 13:42:35","","10.3233/ATDE210087","","",,,,,1,1.00,0,4,1,"… between costs, accuracy, acquisition speed and robustness. A scanner can be used as a … for object recognition with methods of Artificial Intelligence (AI) considering the strict data …","https://ebooks.iospress.nl/pdf/doi/10.3233/ATDE210087","https://scholar.google.com/scholar?q=related:zvXCQvdxggEJ:scholar.google.com/&scioq=%22robustness%22+%22artificial+intelligence%22+%22resilience%22&hl=en&as_sdt=2007"
2,"H Luo","An Emergency Management System for Government Data Security Based on Artificial Intelligence.",2020,"Ingénierie des Systèmes d'Information","search.ebscohost.com","https://search.ebscohost.com/login.aspx?direct=true&profile=ehost&scope=site&authtype=crawler&jrnl=16331311&AN=143603421&h=vVDioKveIZH5VT5f85iofa1TGI6IPgYP09mn0djuMTB21BUOoFH10ggYf82qPOECKRPezt%2F1mvGmffKRUp%2FxxA%3D%3D&crl=c","https://scholar.google.com/scholar?cites=2369270233949760609&as_sdt=2005&sciodt=2007&hl=en",126,"2022-07-12 13:42:35","","","","",,,,,2,1.00,2,1,2,"… artificial intelligence (AI). Firstly, a novel concept was put forward government data resilience … The application in multiagent formation proves that our system guarantees the robustness …","https://scholar.archive.org/work/om5t57blfzftrd5igk552hebo4/access/wayback/http://www.iieta.org/download/file/fid/32512","https://scholar.google.com/scholar?q=related:YWx7j7lW4SAJ:scholar.google.com/&scioq=%22robustness%22+%22artificial+intelligence%22+%22resilience%22&hl=en&as_sdt=2007"
1,"AD Ganesh, P Kalpana","Future of artificial intelligence and its influence on supply chain risk management–A systematic review",2022,"Computers & Industrial Engineering","Elsevier","https://www.sciencedirect.com/science/article/pii/S0360835222002765","https://scholar.google.com/scholar?cites=17131841315296090316&as_sdt=2005&sciodt=2007&hl=en",127,"2022-07-12 13:42:35","HTML","","","",,,,,1,1.00,1,2,1,"… This review includes the components mentioned above to define the objective of SCRM as improving the resilience and robustness and reducing the vulnerability of the SC. Instead of …","https://www.sciencedirect.com/science/article/pii/S0360835222002765","https://scholar.google.com/scholar?q=related:zJiVauiGwO0J:scholar.google.com/&scioq=%22robustness%22+%22artificial+intelligence%22+%22resilience%22&hl=en&as_sdt=2007"
9,"J Viaña, S Ralescu, K Cohen, A Ralescu, V Kreinovich","Extension to multidimensional problems of a fuzzy-based explainable & noise-resilient algorithm",2021,"","scholarworks.utep.edu","https://scholarworks.utep.edu/cs_techrep/1589/","https://scholar.google.com/scholar?cites=1736443608452358560&as_sdt=2005&sciodt=2007&hl=en",128,"2022-07-12 13:42:35","","","","",,,,,9,9.00,2,5,1,"… of interpretability and robustness caused little concern since, … An increasing, widespread use of artificial intelligence and … proved greater noise-resilience and explainability than the …","https://scholarworks.utep.edu/cgi/viewcontent.cgi?article=2576&context=cs_techrep","https://scholar.google.com/scholar?q=related:oOFMBkMWGRgJ:scholar.google.com/&scioq=%22robustness%22+%22artificial+intelligence%22+%22resilience%22&hl=en&as_sdt=2007"
