Cites,Authors,Title,Year,Source,Publisher,ArticleURL,CitesURL,GSRank,QueryDate,Type,DOI,ISSN,CitationURL,Volume,Issue,StartPage,EndPage,ECC,CitesPerYear,CitesPerAuthor,AuthorCount,Age,Abstract,FullTextURL,RelatedURL
52,"Z Allen-Zhu, Y Li","Feature purification: How adversarial training performs robust deep learning",2022,"2021 IEEE 62nd Annual Symposium on …","ieeexplore.ieee.org","https://ieeexplore.ieee.org/abstract/document/9719702/?casa_token=L1k6DOV2KS8AAAAA:Axq_lHxUu_0me2OXktGcB7vUGqnbTKWkJMmhTo7Fht5y9mgYGWaC2jlHa6h1rJ_HOjn1swynMg","https://scholar.google.com/scholar?cites=13399103190324768414&as_sdt=2005&sciodt=2007&hl=en",12,"2022-07-14 12:23:15","","","","",,,,,52,52.00,26,2,1,"… -trained, well-generalizing neural network can still be non-robust to adversarial attacks. Other theories about adversarial examples focus on how adversarial training might require more …","https://ieeexplore.ieee.org/iel7/9719594/9719683/09719702.pdf?casa_token=-fB-A3tZNUYAAAAA:3vNBNzuev6UkTgC8aNzd3ed0DpdcYV_P9nsJxpL9BgaLmhM5ewFTzPIpcMspjAm3eZ7QWH-yag","https://scholar.google.com/scholar?q=related:nm4cMFwt87kJ:scholar.google.com/&scioq=%22robust%22+%22neural+network%22+%22adversarial%22&hl=en&as_sdt=2007"
0,"L Liang, K Xu, X Hu, L Deng, Y Xie","Toward Robust Spiking Neural Network Against Adversarial Perturbation",2022,"arXiv preprint arXiv:2205.01625","arxiv.org","https://arxiv.org/abs/2205.01625","",86,"2022-07-14 12:23:15","","","","",,,,,0,0.00,0,5,1,"… studies on the adversarial attack in SNNs. Finally, we elaborate the robust training via certification in … In this work, we will use the adversarial attack as an assessment tool to evaluate the …","https://arxiv.org/pdf/2205.01625","https://scholar.google.com/scholar?q=related:UOpImzc_6-4J:scholar.google.com/&scioq=%22robust%22+%22neural+network%22+%22adversarial%22&hl=en&as_sdt=2007"
1,"J Ho, BG Lee, DK Kang","Attack-less adversarial training for a robust adversarial defense",2022,"Applied Intelligence","Springer","https://link.springer.com/article/10.1007/s10489-021-02523-y","https://scholar.google.com/scholar?cites=66027258576897508&as_sdt=2005&sciodt=2007&hl=en",93,"2022-07-14 12:23:15","","10.1007/s10489-021-02523-y","","",,,,,1,1.00,0,3,1,"… We also provide the comparison between ALAT and adversarial training that trains a neural network with FGSM by combining with random initialization, namely fast is better than free (…","https://scholar.google.com/scholar?output=instlink&q=info:5AX4HHGT6gAJ:scholar.google.com/&hl=en&as_sdt=2007&scillfp=11659039249023176457&oi=lle","https://scholar.google.com/scholar?q=related:5AX4HHGT6gAJ:scholar.google.com/&scioq=%22robust%22+%22neural+network%22+%22adversarial%22&hl=en&as_sdt=2007"
8,"S Lee, H Kim, J Lee","Graddiv: Adversarial robustness of randomized neural networks via gradient diversity regularization",2022,"IEEE Transactions on Pattern Analysis …","ieeexplore.ieee.org","https://ieeexplore.ieee.org/abstract/document/9761760/?casa_token=adMs16VgyVoAAAAA:HmrYRCtxPwihz1eZ6kvKHhRDI2FZgR7jSQPp__HQPWPB-OGbKcH_CjImEVhCGfpEmfDls0sPVQ","https://scholar.google.com/scholar?cites=14867588415008978694&as_sdt=2005&sciodt=2007&hl=en",95,"2022-07-14 12:23:15","","","","",,,,,8,8.00,3,3,1,"… : ”How can we build a robust randomized neural network against adversarial attacks?” To answer this question, we first investigate the effect of adversarial attacks using proxy gradients …","https://ieeexplore.ieee.org/iel7/34/4359286/09761760.pdf?casa_token=W-Dtgwg0BiwAAAAA:P5nJESw8nIwFqe8dsW6QHAyJ5KvzNUliNaYltBT2GZseeYVtUzCX7ETEXRwGSb4yDO8LbHMOYQ","https://scholar.google.com/scholar?q=related:BrdSP-RIVM4J:scholar.google.com/&scioq=%22robust%22+%22neural+network%22+%22adversarial%22&hl=en&as_sdt=2007"
0,"BG Doan, EM Abbasnejad, JQ Shi…","Bayesian Learning with Information Gain Provably Bounds Risk for a Robust Adversarial Defense",2022,"International …","proceedings.mlr.press","https://proceedings.mlr.press/v162/doan22a.html","",103,"2022-07-14 12:23:15","","","","",,,,,0,0.00,0,4,1,"… neural network model robust against adversarial attacks. Previous algorithms demonstrate an adversarially trained Bayesian Neural Network (… intuition that a robust model should ignore …","https://proceedings.mlr.press/v162/doan22a/doan22a.pdf",""
2,"H Jiang, J Lin, H Kang","FGMD: A robust detector against adversarial attacks in the IoT network",2022,"Future Generation Computer Systems","Elsevier","https://www.sciencedirect.com/science/article/pii/S0167739X22000620?casa_token=BrvIKNj3lfQAAAAA:CgGjwEQ6pwj8uG9WqtQgQ8epL9c9rv-q5i12mSDF0LEkQwXSWy4Vre5FRDnEGtQXa6H5vhh9B8M","https://scholar.google.com/scholar?cites=15578068299292895073&as_sdt=2005&sciodt=2007&hl=en",118,"2022-07-14 12:23:15","HTML","","","",,,,,2,2.00,1,3,1,"… robust detector can defend against adversarial attacks in IoT networks and will not degrade performance in the absence of adversarial … (CNN), and Recurrent Neural Network (RNN). …","https://www.sciencedirect.com/science/article/pii/S0167739X22000620?casa_token=BrvIKNj3lfQAAAAA:CgGjwEQ6pwj8uG9WqtQgQ8epL9c9rv-q5i12mSDF0LEkQwXSWy4Vre5FRDnEGtQXa6H5vhh9B8M","https://scholar.google.com/scholar?q=related:YWcgApVqMNgJ:scholar.google.com/&scioq=%22robust%22+%22neural+network%22+%22adversarial%22&hl=en&as_sdt=2007"
0,"S Dey, P Dasgupta…","SymDNN: Simple & Effective Adversarial Robustness for Embedded Systems",2022,"Proceedings of the IEEE …","openaccess.thecvf.com","https://openaccess.thecvf.com/content/CVPR2022W/EVW/html/Dey_SymDNN_Simple__Effective_Adversarial_Robustness_for_Embedded_Systems_CVPRW_2022_paper.html","",146,"2022-07-14 12:23:15","","","","",,,,,0,0.00,0,3,1,"… We propose SymDNN, a Deep Neural Network (DNN) inference scheme, to segment an … accuracy and enhances adversarial robustness for a limited set of adversarial attacks. However, …","https://openaccess.thecvf.com/content/CVPR2022W/EVW/papers/Dey_SymDNN_Simple__Effective_Adversarial_Robustness_for_Embedded_Systems_CVPRW_2022_paper.pdf","https://scholar.google.com/scholar?q=related:Z44ySlIRHtoJ:scholar.google.com/&scioq=%22robust%22+%22neural+network%22+%22adversarial%22&hl=en&as_sdt=2007"
0,"BK Lee, J Kim, YM Ro","Masking Adversarial Damage: Finding Adversarial Saliency for Robust and Sparse Network",2022,"… of the IEEE/CVF Conference on …","openaccess.thecvf.com","https://openaccess.thecvf.com/content/CVPR2022/html/Lee_Masking_Adversarial_Damage_Finding_Adversarial_Saliency_for_Robust_and_Sparse_CVPR_2022_paper.html","",152,"2022-07-14 12:23:15","","","","",,,,,0,0.00,0,3,1,"… adversarial robustness and model compression, we propose a novel adversarial pruning method, Masking Adversarial … between adversarial attacks and neural network compression. In …","https://openaccess.thecvf.com/content/CVPR2022/papers/Lee_Masking_Adversarial_Damage_Finding_Adversarial_Saliency_for_Robust_and_Sparse_CVPR_2022_paper.pdf","https://scholar.google.com/scholar?q=related:BAyOeKJjf0IJ:scholar.google.com/&scioq=%22robust%22+%22neural+network%22+%22adversarial%22&hl=en&as_sdt=2007"
0,"SH Choi, JM Shin, P Liu, YH Choi","ARGAN: Adversarially Robust Generative Adversarial Networks for Deep Neural Networks Against Adversarial Examples",2022,"IEEE Access","ieeexplore.ieee.org","https://ieeexplore.ieee.org/abstract/document/9737142/","",153,"2022-07-14 12:23:15","","","","",,,,,0,0.00,0,4,1,"… called Adversarially Robust Generative Adversarial Networks… deep neural network model against adversarial examples … target deep neural network model robust against adversarial …","https://ieeexplore.ieee.org/iel7/6287639/9668973/09737142.pdf","https://scholar.google.com/scholar?q=related:VcO5zP8x-MoJ:scholar.google.com/&scioq=%22robust%22+%22neural+network%22+%22adversarial%22&hl=en&as_sdt=2007"
1,"T Osakabe, M Aprilpyone, S Shiota…","Adversarial detector with robust classifier",2022,"2022 IEEE 4th Global …","ieeexplore.ieee.org","https://ieeexplore.ieee.org/abstract/document/9754809/?casa_token=FsIS0F-V8fgAAAAA:eGg_LLCymOAm3PaC7Oi7mFhtZy1rct5CPfdSz0Bn7DHfgM9eCKgUijAinWxjyObcLtr5UKTrsg","https://scholar.google.com/scholar?cites=15970728819458197827&as_sdt=2005&sciodt=2007&hl=en",193,"2022-07-14 12:23:15","","","","",,,,,1,1.00,0,4,1,"… Abstract—Deep neural network (DNN) models are wellknown to easily … , called adversarial examples. In this paper, we propose a novel adversarial detector, which consists of a robust …","https://ieeexplore.ieee.org/iel7/9754591/9754592/09754809.pdf?casa_token=TShvP_a6kzkAAAAA:USHw474C3jxhrCOEFrlO82S93cgX6jppOBW7SrdL95tLdT7xbU29SPV7g_SEmh1_EGRvXW_o1A","https://scholar.google.com/scholar?q=related:Q0nmpz5to90J:scholar.google.com/&scioq=%22robust%22+%22neural+network%22+%22adversarial%22&hl=en&as_sdt=2007"
6,"F Tramer","Detecting adversarial examples is (nearly) as hard as classifying them",2022,"International Conference on Machine Learning","proceedings.mlr.press","https://proceedings.mlr.press/v162/tramer22a.html","https://scholar.google.com/scholar?cites=1438023579795694078&as_sdt=2005&sciodt=2007&hl=en",198,"2022-07-14 12:23:15","","","","",,,,,6,6.00,6,1,1,"… adversarial examples: given a robust detector for attacks at distance ϵ (in some metric), we show how to build a similarly robust (… standard statistical test over a neural network’s features. …","https://proceedings.mlr.press/v162/tramer22a/tramer22a.pdf","https://scholar.google.com/scholar?q=related:_qFbrNPi9BMJ:scholar.google.com/&scioq=%22robust%22+%22neural+network%22+%22adversarial%22&hl=en&as_sdt=2007"
7,"H Hassani, A Javanmard","The curse of overparametrization in adversarial training: Precise analysis of robust generalization for random features regression",2022,"arXiv preprint arXiv:2201.05149","arxiv.org","https://arxiv.org/abs/2201.05149","https://scholar.google.com/scholar?cites=12995298717505794683&as_sdt=2005&sciodt=2007&hl=en",199,"2022-07-14 12:23:15","","","","",,,,,7,7.00,4,2,1,"… often involve training neural network architectures that contain … adversarial perturbations in their inputs. Even when adversarially trained, their performance on perturbed inputs (robust …","https://arxiv.org/pdf/2201.05149","https://scholar.google.com/scholar?q=related:e7IF31STWLQJ:scholar.google.com/&scioq=%22robust%22+%22neural+network%22+%22adversarial%22&hl=en&as_sdt=2007"
14,"J Liu, Y Jin","Multi-objective search of robust neural architectures against multiple types of adversarial attacks",2021,"Neurocomputing","Elsevier","https://www.sciencedirect.com/science/article/pii/S092523122100669X?casa_token=7cNyk-9goBEAAAAA:vOQG41hXS8Y8Io0rPXUXAWUuNTl1vc1F2cex1DQrCvJoDrIfHgiTFe5exro6PGBjlVjR9a9GSB4","https://scholar.google.com/scholar?cites=12127048339188343956&as_sdt=2005&sciodt=2007&hl=en",7,"2022-07-14 12:23:15","HTML","","","",,,,,14,14.00,7,2,1,"… The difference in computational complexity will be dramatic if each evaluation is computationally intensive, such as one adversarial training of a deep neural network on a large dataset. …","https://www.sciencedirect.com/science/article/pii/S092523122100669X?casa_token=7cNyk-9goBEAAAAA:vOQG41hXS8Y8Io0rPXUXAWUuNTl1vc1F2cex1DQrCvJoDrIfHgiTFe5exro6PGBjlVjR9a9GSB4","https://scholar.google.com/scholar?q=related:lORPbzbuS6gJ:scholar.google.com/&scioq=%22robust%22+%22neural+network%22+%22adversarial%22&hl=en&as_sdt=2007"
6,"W Wang, R Wang, L Wang, Z Wang…","Towards a robust deep neural network against adversarial texts: A survey",2021,"ieee transactions on …","ieeexplore.ieee.org","https://ieeexplore.ieee.org/abstract/document/9557814/?casa_token=4H5cn7rF3bYAAAAA:jsTCR4TfyrFxXXdMrrcD0gtFjQ6BIVWpkeuzPHLg8xXy-DURRXSVxFtpI_qnJ9tGIIoxl_DqyQ","https://scholar.google.com/scholar?cites=13536362985847443399&as_sdt=2005&sciodt=2007&hl=en",8,"2022-07-14 12:23:15","","","","",,,,,6,6.00,1,5,1,"… of adversarial texts and build robust models for defense. In presenting the taxonomy of adversarial attacks and defenses in the text domain, we introduce the adversarial techniques from …","https://ieeexplore.ieee.org/iel7/69/4358933/09557814.pdf?casa_token=ttsT8mof1noAAAAA:Oza6c5w9jIMjaDoxDYK1pzd7K-qmQu8pbm4150ne2apfFl5kob6A7vt8VHNAmV8rsYvRI2MxHw","https://scholar.google.com/scholar?q=related:x88uumrS2rsJ:scholar.google.com/&scioq=%22robust%22+%22neural+network%22+%22adversarial%22&hl=en&as_sdt=2007"
6,"L Schwinn, R Raab, A Nguyen, D Zanca…","Exploring misclassifications of robust neural networks to enhance adversarial attacks",2021,"arXiv preprint arXiv …","arxiv.org","https://arxiv.org/abs/2105.10304","https://scholar.google.com/scholar?cites=8565818766315183914&as_sdt=2005&sciodt=2007&hl=en",11,"2022-07-14 12:23:15","","","","",,,,,6,6.00,1,5,1,"… to be robust against adversarial attacks. Our findings suggest that current untargeted adversarial … We focus on models that are trained to be robust to adversarial attacks. Furthermore, all …","https://arxiv.org/pdf/2105.10304","https://scholar.google.com/scholar?q=related:Kl-XyMjm33YJ:scholar.google.com/&scioq=%22robust%22+%22neural+network%22+%22adversarial%22&hl=en&as_sdt=2007"
1,"T Chen, Z Ma","Towards Robust Neural Image Compression: Adversarial Attack and Model Finetuning",2021,"arXiv preprint arXiv:2112.08691","arxiv.org","https://arxiv.org/abs/2112.08691","https://scholar.google.com/scholar?cites=7188435413171502657&as_sdt=2005&sciodt=2007&hl=en",15,"2022-07-14 12:23:15","","","","",,,,,1,1.00,1,2,1,"… adversarial finetuning to refine pretrained models. In each iteration, random source images and adversarial … of deep neural network (DNN) based image coding approaches. These …","https://arxiv.org/pdf/2112.08691","https://scholar.google.com/scholar?q=related:Qf7sHOxzwmMJ:scholar.google.com/&scioq=%22robust%22+%22neural+network%22+%22adversarial%22&hl=en&as_sdt=2007"
19,"H Wang, C Xiao, J Kossaifi, Z Yu…","Augmax: Adversarial composition of random augmentations for robust training",2021,"Advances in neural …","proceedings.neurips.cc","https://proceedings.neurips.cc/paper/2021/hash/01e9565cecc4e989123f9620c1d09c09-Abstract.html","https://scholar.google.com/scholar?cites=405640925261784405&as_sdt=2005&sciodt=2007&hl=en",26,"2022-07-14 12:23:15","","","","",,,,,19,19.00,4,5,1,"… to enhance broader coverage, while adversarial training generates adversarially hard samples … augmentation operators and then learns an adversarial mixture of the selected operators. …","https://proceedings.neurips.cc/paper/2021/file/01e9565cecc4e989123f9620c1d09c09-Paper.pdf","https://scholar.google.com/scholar?q=related:VeWWuEUgoQUJ:scholar.google.com/&scioq=%22robust%22+%22neural+network%22+%22adversarial%22&hl=en&as_sdt=2007"
24,"B Wu, J Chen, D Cai, X He…","Do wider neural networks really help adversarial robustness?",2021,"Advances in Neural …","proceedings.neurips.cc","https://proceedings.neurips.cc/paper/2021/hash/3937230de3c8041e4da6ac3246a888e8-Abstract.html","https://scholar.google.com/scholar?cites=11340118178463211034&as_sdt=2005&sciodt=2007&hl=en",32,"2022-07-14 12:23:15","","","","",,,,,24,24.00,5,5,1,"… in (1.1) during adversarial training, we observe that the value of the robust regularization part … Now suppose our neural network loss function is local Lipschitz, let x be our computed …","https://proceedings.neurips.cc/paper/2021/file/3937230de3c8041e4da6ac3246a888e8-Paper.pdf","https://scholar.google.com/scholar?q=related:Gt4_mmYxYJ0J:scholar.google.com/&scioq=%22robust%22+%22neural+network%22+%22adversarial%22&hl=en&as_sdt=2007"
6,"AS Rakin, L Yang, J Li, F Yao, C Chakrabarti…","Ra-bnn: Constructing robust & accurate binary neural network to simultaneously defend adversarial bit-flip attack and improve accuracy",2021,"arXiv preprint arXiv …","arxiv.org","https://arxiv.org/abs/2103.13813","https://scholar.google.com/scholar?cites=12142873399496461880&as_sdt=2005&sciodt=2007&hl=en",35,"2022-07-14 12:23:15","","","","",,,,,6,6.00,1,6,1,"… Among them, the binary weight neural network [16] has proven to … However, for a binary weight neural network, with a … to construct a robust and accurate binary neural network (with both …","https://arxiv.org/pdf/2103.13813","https://scholar.google.com/scholar?q=related:OM6GaQUnhKgJ:scholar.google.com/&scioq=%22robust%22+%22neural+network%22+%22adversarial%22&hl=en&as_sdt=2007"
3,"JM Springer, M Mitchell, GT Kenyon","Adversarial perturbations are not so weird: Entanglement of robust and non-robust features in neural network classifiers",2021,"arXiv preprint arXiv:2102.05110","arxiv.org","https://arxiv.org/abs/2102.05110","https://scholar.google.com/scholar?cites=11917442575225459702&as_sdt=2005&sciodt=2007&hl=en",41,"2022-07-14 12:23:15","","","","",,,,,3,3.00,1,3,1,"… non-robust and robust features, we argue that nonrobust features may be more interpretable than they appear through the lens of adversarial perturbations. In other words, non-robust …","https://arxiv.org/pdf/2102.05110","https://scholar.google.com/scholar?q=related:9hNuf-FCY6UJ:scholar.google.com/&scioq=%22robust%22+%22neural+network%22+%22adversarial%22&hl=en&as_sdt=2007"
1,"J Zhao, P Wei, W Mao","Robust Neural Text Classification and Entailment via Mixup Regularized Adversarial Training",2021,"Proceedings of the 44th International ACM SIGIR …","dl.acm.org","https://dl.acm.org/doi/abs/10.1145/3404835.3463122","https://scholar.google.com/scholar?cites=10323690265458500605&as_sdt=2005&sciodt=2007&hl=en",48,"2022-07-14 12:23:15","","10.1145/3404835.3463122","","",,,,,1,1.00,0,3,1,"… adversarial examples increase. To address this, we propose mixup regularized adversarial … Our method can utilize multiple adversarial examples to increase model intrinsic robustness …","https://dl.acm.org/doi/pdf/10.1145/3404835.3463122","https://scholar.google.com/scholar?q=related:_ePPY5kdRY8J:scholar.google.com/&scioq=%22robust%22+%22neural+network%22+%22adversarial%22&hl=en&as_sdt=2007"
16,"T Oikarinen, W Zhang, A Megretski…","Robust deep reinforcement learning through adversarial loss",2021,"Advances in …","proceedings.neurips.cc","https://proceedings.neurips.cc/paper/2021/hash/dbb422937d7ff56e049d61da730b3e11-Abstract.html","https://scholar.google.com/scholar?cites=1195067551693981848&as_sdt=2005&sciodt=2007&hl=en",53,"2022-07-14 12:23:15","","","","",,,,,16,16.00,4,4,1,"… for neural network policies under persistent adversarial perturbations in the system. These works study the robustness with fixed neural networks, while our work is focused on training …","https://proceedings.neurips.cc/paper/2021/file/dbb422937d7ff56e049d61da730b3e11-Paper.pdf","https://scholar.google.com/scholar?q=related:mMhQRZu7lRAJ:scholar.google.com/&scioq=%22robust%22+%22neural+network%22+%22adversarial%22&hl=en&as_sdt=2007"
0,"JM Springer, M Mitchell, GT Kenyon","Uncovering Universal Features: How Adversarial Training Improves Adversarial Transferability",2021,"… Workshop on Adversarial …","openreview.net","https://openreview.net/forum?id=tzModtpOW7l","",55,"2022-07-14 12:23:15","","","","",,,,,0,0.00,0,3,1,"… robust neural network may be useful to derive insight about the features of every non-robust … In particular, we show that adversarial examples constructed to attack slightly-robust source …","https://openreview.net/pdf?id=tzModtpOW7l","https://scholar.google.com/scholar?q=related:eQ9M9WmVoAIJ:scholar.google.com/&scioq=%22robust%22+%22neural+network%22+%22adversarial%22&hl=en&as_sdt=2007"
3,"YL Tsai, CY Hsu, CM Yu…","Formalizing generalization and adversarial robustness of neural networks to weight perturbations",2021,"Advances in Neural …","proceedings.neurips.cc","https://proceedings.neurips.cc/paper/2021/hash/a3ab4ff8fa4deed2e3bae3a5077675f0-Abstract.html","https://scholar.google.com/scholar?cites=15264319207512561925&as_sdt=2005&sciodt=2007&hl=en",59,"2022-07-14 12:23:15","","","","",,,,,3,3.00,1,4,1,"… layer in a neural network is subject to weight perturbation. … input and finally the neural network. Explicitly, for an L-layer … Robust accuracy against adversarial weight perturbation We …","https://proceedings.neurips.cc/paper/2021/file/a3ab4ff8fa4deed2e3bae3a5077675f0-Paper.pdf","https://scholar.google.com/scholar?q=related:BVn1BXLB1dMJ:scholar.google.com/&scioq=%22robust%22+%22neural+network%22+%22adversarial%22&hl=en&as_sdt=2007"
9,"X Zhao, Z Zhang, Z Zhang, L Wu, J Jin…","Expressive 1-lipschitz neural networks for robust multiple graph learning against adversarial attacks",2021,"International …","proceedings.mlr.press","http://proceedings.mlr.press/v139/zhao21e.html","https://scholar.google.com/scholar?cites=13407308401883474864&as_sdt=2005&sciodt=2007&hl=en",64,"2022-07-14 12:23:15","","","","",,,,,9,9.00,2,6,1,"… -Lipschitz neural network and regular neural network without … and robust multiple graph learning against adversarial attacks. … that our 1-Lipschitz neural network with Kl-Lipschitz Weibull …","http://proceedings.mlr.press/v139/zhao21e/zhao21e.pdf","https://scholar.google.com/scholar?q=related:sOtf4PRTELoJ:scholar.google.com/&scioq=%22robust%22+%22neural+network%22+%22adversarial%22&hl=en&as_sdt=2007"
44,"T Bai, J Luo, J Zhao, B Wen, Q Wang","Recent advances in adversarial training for adversarial robustness",2021,"arXiv preprint arXiv:2102.01356","arxiv.org","https://arxiv.org/abs/2102.01356","https://scholar.google.com/scholar?cites=7315735051879908421&as_sdt=2005&sciodt=2007&hl=en",80,"2022-07-14 12:23:15","","","","",,,,,44,44.00,9,5,1,"… : the inner maximization problem is finding the worst-case samples for the given model, and the outer minimization problem is to train a model robust to adversarial examples. …","https://arxiv.org/pdf/2102.01356","https://scholar.google.com/scholar?q=related:RQQt7kS2hmUJ:scholar.google.com/&scioq=%22robust%22+%22neural+network%22+%22adversarial%22&hl=en&as_sdt=2007"
31,"H Xu, X Liu, Y Li, A Jain, J Tang","To be robust or to be fair: Towards fairness in adversarial training",2021,"… Conference on Machine …","proceedings.mlr.press","http://proceedings.mlr.press/v139/xu21b.html","https://scholar.google.com/scholar?cites=10942841886932715395&as_sdt=2005&sciodt=2007&hl=en",102,"2022-07-14 12:23:15","","","","",,,,,31,31.00,6,5,1,"… As the first attempt to mitigate the fairness issues from adversarial training, we propose the Fair Robust Learning (FRL) framework. We validate the effectiveness of FRL on benchmark …","http://proceedings.mlr.press/v139/xu21b/xu21b.pdf","https://scholar.google.com/scholar?q=related:g8fj77fI3JcJ:scholar.google.com/&scioq=%22robust%22+%22neural+network%22+%22adversarial%22&hl=en&as_sdt=2007"
27,"A Liu, X Liu, H Yu, C Zhang, Q Liu…","Training robust deep neural networks via adversarial noise propagation",2021,"IEEE Transactions on …","ieeexplore.ieee.org","https://ieeexplore.ieee.org/abstract/document/9462815/?casa_token=bZ6drkqYGYgAAAAA:K51HlE5V2rznAdhcfSCrhM2vBuAfx_37VKWwgbbxN5qNmBzPlHuC9i-BmqQduQ-stXEh1mO6MQ","https://scholar.google.com/scholar?cites=7912860450869562829&as_sdt=2005&sciodt=2007&hl=en",109,"2022-07-14 12:23:15","","","","",,,,,27,27.00,5,6,1,"… robust model, this paper proposes a simple yet powerful training algorithm, named Adversarial … Moreover, our framework can be easily combined with other adversarial training methods …","https://ieeexplore.ieee.org/iel7/83/9263394/09462815.pdf?casa_token=Ts7S_JJ5hP0AAAAA:p1rU7nFA1BycXgBeyeV22qdD75DfVPmeAbBaEyDYJLXxWiHQSZE50PAhwHxE_zs6SwIb9CT_CQ","https://scholar.google.com/scholar?q=related:zU1R66cg0G0J:scholar.google.com/&scioq=%22robust%22+%22neural+network%22+%22adversarial%22&hl=en&as_sdt=2007"
4,"Y Liang, D Huang","Large norms of CNN layers do not hurt adversarial robustness",2021,"Proceedings of the AAAI Conference on Artificial …","ojs.aaai.org","https://ojs.aaai.org/index.php/AAAI/article/view/17039","https://scholar.google.com/scholar?cites=13686864097914619933&as_sdt=2005&sciodt=2007&hl=en",111,"2022-07-14 12:23:15","","","","",,,,,4,4.00,2,2,1,"… robust classifiers can be achieved using neural networks, and an adversarially robust neural network … be neither necessary nor effective in achieving adversarial robustness. The code is …","https://ojs.aaai.org/index.php/AAAI/article/view/17039/16846","https://scholar.google.com/scholar?q=related:HYg_hWGC8b0J:scholar.google.com/&scioq=%22robust%22+%22neural+network%22+%22adversarial%22&hl=en&as_sdt=2007"
6,"E Erdemir, J Bickford, L Melis…","Adversarial robustness with non-uniform perturbations",2021,"Advances in Neural …","proceedings.neurips.cc","https://proceedings.neurips.cc/paper/2021/hash/9fd98f856d3ca2086168f264a117ed7c-Abstract.html","https://scholar.google.com/scholar?cites=18104312853513215625&as_sdt=2005&sciodt=2007&hl=en",116,"2022-07-14 12:23:15","","","","",,,,,6,6.00,2,4,1,"… analysis of robust and non-robust features and their effect on clean and adversarial accuracy… Note that our goal is not to design the best possible neural network but instead compare the …","https://proceedings.neurips.cc/paper/2021/file/9fd98f856d3ca2086168f264a117ed7c-Paper.pdf","https://scholar.google.com/scholar?q=related:iZ4xmJ5wP_sJ:scholar.google.com/&scioq=%22robust%22+%22neural+network%22+%22adversarial%22&hl=en&as_sdt=2007"
