Cites,Authors,Title,Year,Source,Publisher,ArticleURL,CitesURL,GSRank,QueryDate,Type,DOI,ISSN,CitationURL,Volume,Issue,StartPage,EndPage,ECC,CitesPerYear,CitesPerAuthor,AuthorCount,Age,Abstract,FullTextURL,RelatedURL
11,"DD Thang, T Matsui","Image transformation can make neural networks more robust against adversarial examples",2019,"arXiv preprint arXiv:1901.03037","arxiv.org","https://arxiv.org/abs/1901.03037","https://scholar.google.com/scholar?cites=12939849405436461909&as_sdt=2005&sciodt=2007&hl=en",78,"2022-07-14 12:23:15","","","","",,,,,11,3.67,6,2,3,"… generated adversarial examples to neural network recognizer, … Then we rotated the adversarial image and gave them to the … show that neural network recognizes the rotated adversarial …","https://arxiv.org/pdf/1901.03037","https://scholar.google.com/scholar?q=related:VQMX2nmUk7MJ:scholar.google.com/&scioq=%22robust%22+%22neural+network%22+%22adversarial%22&hl=en&as_sdt=2007"
50,"C Song, K He, J Lin, L Wang, JE Hopcroft","Robust local features for improving the generalization of adversarial training",2019,"arXiv preprint arXiv …","arxiv.org","https://arxiv.org/abs/1909.10147","https://scholar.google.com/scholar?cites=11695646506050122270&as_sdt=2005&sciodt=2007&hl=en",79,"2022-07-14 12:23:15","","","","",,,,,50,16.67,10,5,3,"… To learn the robust local features, we develop a Random Block Shuffle (… adversarial examples. We continue to propose a new approach called Robust Local Features for Adversarial …","https://arxiv.org/pdf/1909.10147","https://scholar.google.com/scholar?q=related:HvKn84dIT6IJ:scholar.google.com/&scioq=%22robust%22+%22neural+network%22+%22adversarial%22&hl=en&as_sdt=2007"
77,"J Wang, H Zhang","Bilateral adversarial training: Towards fast training of more robust models against adversarial attacks",2019,"Proceedings of the IEEE/CVF …","openaccess.thecvf.com","http://openaccess.thecvf.com/content_ICCV_2019/html/Wang_Bilateral_Adversarial_Training_Towards_Fast_Training_of_More_Robust_Models_ICCV_2019_paper.html","https://scholar.google.com/scholar?cites=417723595838046858&as_sdt=2005&sciodt=2007&hl=en",83,"2022-07-14 12:23:15","","","","",,,,,77,25.67,39,2,3,"… From the above analyses, we hypothesize that small gradient magnitude directly links to the adversarial robustness. Intuitively speaking, if the loss surface is locally “flat” around the …","http://openaccess.thecvf.com/content_ICCV_2019/papers/Wang_Bilateral_Adversarial_Training_Towards_Fast_Training_of_More_Robust_Models_ICCV_2019_paper.pdf","https://scholar.google.com/scholar?q=related:isI5sGUNzAUJ:scholar.google.com/&scioq=%22robust%22+%22neural+network%22+%22adversarial%22&hl=en&as_sdt=2007"
60,"X Pan, D Seita, Y Gao, J Canny","Risk averse robust adversarial reinforcement learning",2019,"… International Conference on …","ieeexplore.ieee.org","https://ieeexplore.ieee.org/abstract/document/8794293/?casa_token=i20pTFKHjjsAAAAA:XgFiAbODppovR2lW5hljZgheSCkSpxRkdRt3aSASbLKo5ULAwVLeomPBXiYZMmxAT16o_zJmsQ","https://scholar.google.com/scholar?cites=12286590290976677832&as_sdt=2005&sciodt=2007&hl=en",84,"2022-07-14 12:23:15","","","","",,,,,60,20.00,15,4,3,"… Levine, “Epopt: Learning robust neural network policies using model ensembles,” in International Conference on Learning Representations (ICLR), 2017. [33] F. Sadeghi and S. …","https://ieeexplore.ieee.org/iel7/8780387/8793254/08794293.pdf?casa_token=YNdfJgwDX5QAAAAA:cmjsWzMWc8_V0v8QaioWm3cyMI-lov6hgoS-87kXbff2UvTiKiYkvP9JfP0hUevkG_XqQI1Nkw","https://scholar.google.com/scholar?q=related:yJ9twsW8gqoJ:scholar.google.com/&scioq=%22robust%22+%22neural+network%22+%22adversarial%22&hl=en&as_sdt=2007"
20,"A Laugros, A Caplier, M Ospici","Are adversarial robustness and common perturbation robustness independant attributes?",2019,"Proceedings of the IEEE …","openaccess.thecvf.com","http://openaccess.thecvf.com/content_ICCVW_2019/html/RLQ/Laugros_Are_Adversarial_Robustness_and_Common_Perturbation_Robustness_Independant_Attributes__ICCVW_2019_paper.html","https://scholar.google.com/scholar?cites=3164915089623248281&as_sdt=2005&sciodt=2007&hl=en",90,"2022-07-14 12:23:15","","","","",,,,,20,6.67,7,3,3,"… Our results make us believe that neural network robustness should be addressed in a … We wonder if making neural networks more robust to adversarial perturbations could also make …","http://openaccess.thecvf.com/content_ICCVW_2019/papers/RLQ/Laugros_Are_Adversarial_Robustness_and_Common_Perturbation_Robustness_Independant_Attributes__ICCVW_2019_paper.pdf","https://scholar.google.com/scholar?q=related:mW1EbYEJ7CsJ:scholar.google.com/&scioq=%22robust%22+%22neural+network%22+%22adversarial%22&hl=en&as_sdt=2007"
224,"F Tramer, D Boneh","Adversarial training and robustness for multiple perturbations",2019,"Advances in Neural Information …","proceedings.neurips.cc","https://proceedings.neurips.cc/paper/2019/hash/5d4ae76f053f8f2516ad12961ef7fe97-Abstract.html","https://scholar.google.com/scholar?cites=6630235695392252264&as_sdt=2005&sciodt=2007&hl=en",98,"2022-07-14 12:23:15","","","","",,,,,224,74.67,112,2,3,"… We propose new multi-perturbation adversarial training schemes, as well as an efficient … adversarial training with first-order l∞,l1 and l2 attacks on MNIST achieves merely 50% robust …","https://proceedings.neurips.cc/paper/2019/file/5d4ae76f053f8f2516ad12961ef7fe97-Paper.pdf","https://scholar.google.com/scholar?q=related:aGH4iDxUA1wJ:scholar.google.com/&scioq=%22robust%22+%22neural+network%22+%22adversarial%22&hl=en&as_sdt=2007"
20,"M Tonutti, E Ruffaldi, A Cattaneo…","Robust and subject-independent driving manoeuvre anticipation through Domain-Adversarial Recurrent Neural Networks",2019,"Robotics and Autonomous …","Elsevier","https://www.sciencedirect.com/science/article/pii/S0921889018301209?casa_token=FzhrUVTW83gAAAAA:xABL9Pc_WTAts2TqMHgwyWzLcJZZ8ZP4R4Gkkebw0_PD10_uXiY8Gz4rDMgpy-KpGXNdwXJbgDo","https://scholar.google.com/scholar?cites=18239214150776166894&as_sdt=2005&sciodt=2007&hl=en",99,"2022-07-14 12:23:15","HTML","","","",,,,,20,6.67,5,4,3,"… In this paper we proposed and tested a Domain-Adversarial Recurrent Neural Network for adaptive driving manoeuvre anticipation. Trained on a large source dataset of driving …","https://www.sciencedirect.com/science/article/pii/S0921889018301209?casa_token=FzhrUVTW83gAAAAA:xABL9Pc_WTAts2TqMHgwyWzLcJZZ8ZP4R4Gkkebw0_PD10_uXiY8Gz4rDMgpy-KpGXNdwXJbgDo","https://scholar.google.com/scholar?q=related:7plKd6K0Hv0J:scholar.google.com/&scioq=%22robust%22+%22neural+network%22+%22adversarial%22&hl=en&as_sdt=2007"
24,"X Yin, S Kolouri, GK Rohde","Gat: Generative adversarial training for adversarial example detection and robust classification",2019,"International conference on learning …","openreview.net","https://openreview.net/forum?id=SJeQEp4YDH","https://scholar.google.com/scholar?cites=11402188250493503654&as_sdt=2005&sciodt=2007&hl=en",106,"2022-07-14 12:23:15","","","","",,,,,24,8.00,8,3,3,"… networks against adversarial examples … adversarial samples are only valid when the attacker is oblivious to the detection mechanism. In this paper we propose a principled adversarial …","https://openreview.net/pdf?id=SJeQEp4YDH","https://scholar.google.com/scholar?q=related:pkjMbM21PJ4J:scholar.google.com/&scioq=%22robust%22+%22neural+network%22+%22adversarial%22&hl=en&as_sdt=2007"
2,"R Nakano","A Discussion of'Adversarial Examples Are Not Bugs, They Are Features': Adversarially Robust Neural Style Transfer",2019,"Distill","staging.distill.pub","https://staging.distill.pub/2019/advex-bugs-discussion/response-4/","https://scholar.google.com/scholar?cites=7629846478198789399&as_sdt=2005&sciodt=2007&hl=en",110,"2022-07-14 12:23:15","HTML","","","",,,,,2,0.67,2,1,3,"… effect of non-robust features and the utility of robust models for downstream tasks. We’re excited to see what kind of impact robustly trained models will have in neural network art! We …","https://staging.distill.pub/2019/advex-bugs-discussion/response-4/","https://scholar.google.com/scholar?q=related:F9XNf_Ko4mkJ:scholar.google.com/&scioq=%22robust%22+%22neural+network%22+%22adversarial%22&hl=en&as_sdt=2007"
179,"D Pruthi, B Dhingra, ZC Lipton","Combating adversarial misspellings with robust word recognition",2019,"arXiv preprint arXiv:1905.11268","arxiv.org","https://arxiv.org/abs/1905.11268","https://scholar.google.com/scholar?cites=11987384049356380745&as_sdt=2005&sciodt=2007&hl=en",126,"2022-07-14 12:23:15","","","","",,,,,179,59.67,60,3,3,"… To combat adversarial spelling mistakes, we propose placing a word recognition model in … Robsut wrod reocginiton via semi-character recurrent neural network. In Association for the …","https://arxiv.org/pdf/1905.11268","https://scholar.google.com/scholar?q=related:SRoS8Ee-W6YJ:scholar.google.com/&scioq=%22robust%22+%22neural+network%22+%22adversarial%22&hl=en&as_sdt=2007"
39,"J Zhou, T Jiang, L Li, Q Hong…","Training multi-task adversarial network for extracting noise-robust speaker embedding",2019,"ICASSP 2019-2019 …","ieeexplore.ieee.org","https://ieeexplore.ieee.org/abstract/document/8683828/?casa_token=Uu05yB_88LEAAAAA:MnBNeOqHNDjsgv5KtitUzX6qilxCagXeHY7vlkGUgkcJVH17YFHgRK-ZqPSdrLWKUhtDb9OcBg","https://scholar.google.com/scholar?cites=5523427737252520333&as_sdt=2005&sciodt=2007&hl=en",128,"2022-07-14 12:23:15","","","","",,,,,39,13.00,8,5,3,"Under noisy environments, to achieve the robust … of multitask adversarial training for learning a noise-robust speaker … that extracts the noise-robust speaker embeddings; a classifier that …","https://ieeexplore.ieee.org/iel7/8671773/8682151/08683828.pdf?casa_token=tm35odsZsgQAAAAA:mxTPhZjApMWeUu8SmjSfzC78I7jkvo1SIYtKiE7-AeWi1Z1JmGfKsjAFxo6ncYKyLRZeOsEn6w","https://scholar.google.com/scholar?q=related:jeF5PUMop0wJ:scholar.google.com/&scioq=%22robust%22+%22neural+network%22+%22adversarial%22&hl=en&as_sdt=2007"
57,"Z You, J Ye, K Li, Z Xu, P Wang","Adversarial noise layer: Regularize neural network by adding noise",2019,"2019 IEEE International …","ieeexplore.ieee.org","https://ieeexplore.ieee.org/abstract/document/8803055/?casa_token=KmH76QHRRCIAAAAA:7EXMJm5G8ydO1To2y9h5TvyW3LmrfRxmHyDEvZ7o-woS2-Xry74EA8PXTSy-gqSSFWVc2D9BtQ","https://scholar.google.com/scholar?cites=13607658956870905582&as_sdt=2005&sciodt=2007&hl=en",147,"2022-07-14 12:23:15","","","","",,,,,57,19.00,11,5,3,"… In this paper, we introduce a novel regularization method called Adversarial Noise Layer (ANL), … robust to the adversarial examples generated by FGSM than the traditional adversarial …","https://ieeexplore.ieee.org/iel7/8791230/8799366/08803055.pdf?casa_token=M5DGBFyUpasAAAAA:Kg3CgWZsTbypoVAVzluMC061tUpRcQEkFiX5HQRdNcvX4JeDeaomSgMygeqvJg_Ex9ekGrUyow","https://scholar.google.com/scholar?q=related:7u7zjLkd2LwJ:scholar.google.com/&scioq=%22robust%22+%22neural+network%22+%22adversarial%22&hl=en&as_sdt=2007"
76,"L Beggel, M Pfeiffer, B Bischl","Robust anomaly detection in images using adversarial autoencoders",2019,"Joint European Conference on Machine …","Springer","https://link.springer.com/chapter/10.1007/978-3-030-46150-8_13","https://scholar.google.com/scholar?cites=2568270908530995211&as_sdt=2005&sciodt=2007&hl=en",155,"2022-07-14 12:23:15","","10.1007/978-3-030-46150-8_13","","",,,,,76,25.33,25,3,3,"… In order to counteract this effect, an adversarial autoencoder architecture is adapted, which … anomaly detector that is significantly more robust to the presence of outliers during training. …","https://arxiv.org/pdf/1901.06355","https://scholar.google.com/scholar?q=related:C7D1tchUpCMJ:scholar.google.com/&scioq=%22robust%22+%22neural+network%22+%22adversarial%22&hl=en&as_sdt=2007"
28,"ME Khoda, T Imam, J Kamruzzaman…","Robust malware defense in industrial IoT applications using machine learning with selective adversarial samples",2019,"IEEE Transactions …","ieeexplore.ieee.org","https://ieeexplore.ieee.org/abstract/document/8930038/?casa_token=KtGPru6JuDwAAAAA:KNueKSVBYxdRb_-kSJsJI8rokYPjGLX7OMqOaq5QQPfj9YUaVXKMwUjHSiNLzIGd4IfMV23Jvw","https://scholar.google.com/scholar?cites=425980072744620195&as_sdt=2005&sciodt=2007&hl=en",157,"2022-07-14 12:23:15","","","","",,,,,28,9.33,7,4,3,"… respect to adversarial retraining, we additionally assess the impact of such adversarial samples … , the classifier we used (deep neural network), adversarial sample crafting process and …","https://ieeexplore.ieee.org/iel7/28/4957013/08930038.pdf?casa_token=rR6MRq5aMcQAAAAA:j3i5msHQuX24b5f3FDPQkPplXTjZqMQjpRlB6nnlLnO0K_nZUCxGstLj4_6hHx4hIRIoAlDXIw","https://scholar.google.com/scholar?q=related:o5BWhZ5i6QUJ:scholar.google.com/&scioq=%22robust%22+%22neural+network%22+%22adversarial%22&hl=en&as_sdt=2007"
25,"S Hu, X Shang, Z Qin, M Li, Q Wang…","Adversarial examples for automatic speech recognition: Attacks and countermeasures",2019,"IEEE Communications …","ieeexplore.ieee.org","https://ieeexplore.ieee.org/abstract/document/8809565/?casa_token=Zox56Vq8tagAAAAA:R3tRdNqWKuEMIt85d6yVixrV85-7iap51h3JF1FgDncSJuDg7L-yRQpnDps0D4uHLeUfdEX8fw","https://scholar.google.com/scholar?cites=714135476405602179&as_sdt=2005&sciodt=2007&hl=en",160,"2022-07-14 12:23:15","","","","",,,,,25,8.33,4,6,3,"… robust neural network to resist adversarial examples. Currently, we know that training with adversarial … , is able to increase the robustness of deep neural network acoustic models [14]. It …","https://ieeexplore.ieee.org/iel7/35/8875694/08809565.pdf?casa_token=tHnBO1M6p0AAAAAA:WojDbF55pqlsmNDLCZ18FpZORx3sdGzyou3hHe62bTeCQIP3-D9WD_R9Sh5VOrkmj-zZ7MObZw","https://scholar.google.com/scholar?q=related:gwepoG4e6QkJ:scholar.google.com/&scioq=%22robust%22+%22neural+network%22+%22adversarial%22&hl=en&as_sdt=2007"
9,"S Wang, Z Qiao","Robust pervasive detection for adversarial samples of artificial intelligence in IoT environments",2019,"IEEE Access","ieeexplore.ieee.org","https://ieeexplore.ieee.org/abstract/document/8725605/","https://scholar.google.com/scholar?cites=14413972630837727413&as_sdt=2005&sciodt=2007&hl=en",162,"2022-07-14 12:23:15","","","","",,,,,9,3.00,5,2,3,"… can use the same method as the training neural network to calculate the adversarial perturbation. For example, the FGSM adversarial attack seeks to reduce the category confidence by …","https://ieeexplore.ieee.org/iel7/6287639/6514899/08725605.pdf","https://scholar.google.com/scholar?q=related:tRBJP723CMgJ:scholar.google.com/&scioq=%22robust%22+%22neural+network%22+%22adversarial%22&hl=en&as_sdt=2007"
48,"Y Jang, T Zhao, S Hong, H Lee","Adversarial defense via learning to generate diverse attacks",2019,"Proceedings of the IEEE …","openaccess.thecvf.com","http://openaccess.thecvf.com/content_ICCV_2019/html/Jang_Adversarial_Defense_via_Learning_to_Generate_Diverse_Attacks_ICCV_2019_paper.html","https://scholar.google.com/scholar?cites=9623279493861192119&as_sdt=2005&sciodt=2007&hl=en",163,"2022-07-14 12:23:15","","","","",,,,,48,16.00,12,4,3,"… , or a generator, to seek adversarial examples that effectively fool the target neural network. With the … The objective of this paper is to build a classifier robust to adversarial perturbations. …","https://openaccess.thecvf.com/content_ICCV_2019/papers/Jang_Adversarial_Defense_via_Learning_to_Generate_Diverse_Attacks_ICCV_2019_paper.pdf","https://scholar.google.com/scholar?q=related:t7HlnbbBjIUJ:scholar.google.com/&scioq=%22robust%22+%22neural+network%22+%22adversarial%22&hl=en&as_sdt=2007"
93,"C Etmann, S Lunz, P Maass, CB Schönlieb","On the connection between adversarial robustness and saliency map interpretability",2019,"arXiv preprint arXiv …","arxiv.org","https://arxiv.org/abs/1905.04172","https://scholar.google.com/scholar?cites=9006157315043198858&as_sdt=2005&sciodt=2007&hl=en",166,"2022-07-14 12:23:15","","","","",,,,,93,31.00,23,4,3,"… An image of a dog (left), the saliency maps of a highly non-adversarially-robust neural network (middle) and of a more robust network (right). We observe that the robust network gives a …","https://arxiv.org/pdf/1905.04172","https://scholar.google.com/scholar?q=related:iodvglxM_HwJ:scholar.google.com/&scioq=%22robust%22+%22neural+network%22+%22adversarial%22&hl=en&as_sdt=2007"
13,"PM Ferreira, AF Sequeira, D Pernes…","Adversarial learning for a robust iris presentation attack detection method against unseen attack presentations",2019,"… Conference of the …","ieeexplore.ieee.org","https://ieeexplore.ieee.org/abstract/document/8897269/?casa_token=8aD_qu43E5oAAAAA:1Qer6xC0C4aEk7-RleK22PtxjzrIBNy_ekbAvM1nnaMhZyhGW7JYyGGg8yYRPrf2KeL8agyElw","https://scholar.google.com/scholar?cites=9556829537462297546&as_sdt=2005&sciodt=2007&hl=en",169,"2022-07-14 12:23:15","","","","",,,,,13,4.33,3,4,3,"… The proposed methodology combines an artificial neural network (ANN) with an adversarial … To accomplish this purpose, we introduce a deep neural network along with an adversarial …","https://ieeexplore.ieee.org/iel7/8892712/8897213/08897269.pdf?casa_token=KFqZIYTiAfMAAAAA:3DBuzNkLB5H52qrw8jcuGCzhLuAj16frx40b5DklLzzqNpJqUXf4nIXD52LORen8SbbqJUfiZA","https://scholar.google.com/scholar?q=related:yqNmf9StoIQJ:scholar.google.com/&scioq=%22robust%22+%22neural+network%22+%22adversarial%22&hl=en&as_sdt=2007"
25,"H Li, G Li, Y Yu","ROSA: Robust salient object detection against adversarial attacks",2019,"IEEE transactions on cybernetics","ieeexplore.ieee.org","https://ieeexplore.ieee.org/abstract/document/8718038/?casa_token=UXrcz1nfq_0AAAAA:RFXAEZqPFMk4Szpnu9JysHdlodY0eNicgtIAYDDV__PL6N8owTt_i5l-P4eBfx8XrD2eLhMqiw","https://scholar.google.com/scholar?cites=394419518738999782&as_sdt=2005&sciodt=2007&hl=en",170,"2022-07-14 12:23:15","","","","",,,,,25,8.33,8,3,3,"… robust saliency (ROSA) that can take any FCN as a backbone. We first observe that adversarial … N-adv denotes some neural network N tested on adversarial samples. The results tested …","https://ieeexplore.ieee.org/iel7/6221036/6352949/08718038.pdf?casa_token=c6S9wVDKI_kAAAAA:tks-hH_neqzYAUlTYUSAhesVDjEPilXN5RJBoIU0xqnS1eyi7P9sA3EgvGlDxL6YXF2CPKgojA","https://scholar.google.com/scholar?q=related:5inranZCeQUJ:scholar.google.com/&scioq=%22robust%22+%22neural+network%22+%22adversarial%22&hl=en&as_sdt=2007"
4,"GT Pereira, AC de Carvalho","Bringing robustness against adversarial attacks",2019,"Nature Machine Intelligence","nature.com","https://idp.nature.com/authorize/casa?redirect_uri=https://www.nature.com/articles/s42256-019-0116-2&casa_token=cp5pZIwDO8sAAAAA:fMgUdNkD56QnTgKN_nDS98A3iJsIwmyIjrj1eMu46cHS5JivMMdmHzO2xOiVncw5O2tC3_myn8Dn3gj3Jw","https://scholar.google.com/scholar?cites=7896822509391361169&as_sdt=2005&sciodt=2007&hl=en",171,"2022-07-14 12:23:15","HTML","","","",,,,,4,1.33,2,2,3,"… of as adversarial examples for humans. Even though the human visual system is more robust … a silhouette of activations in a neural network output, adversarial explanations work as non-…","https://idp.nature.com/authorize/casa?redirect_uri=https://www.nature.com/articles/s42256-019-0116-2&casa_token=cp5pZIwDO8sAAAAA:fMgUdNkD56QnTgKN_nDS98A3iJsIwmyIjrj1eMu46cHS5JivMMdmHzO2xOiVncw5O2tC3_myn8Dn3gj3Jw","https://scholar.google.com/scholar?q=related:kbSUrjsml20J:scholar.google.com/&scioq=%22robust%22+%22neural+network%22+%22adversarial%22&hl=en&as_sdt=2007"
76,"H Chen, H Zhang, D Boning…","Robust decision trees against adversarial examples",2019,"… Conference on Machine …","proceedings.mlr.press","http://proceedings.mlr.press/v97/chen19m.html?ref=https://githubhelp.com","https://scholar.google.com/scholar?cites=18298482644739407816&as_sdt=2005&sciodt=2007&hl=en",174,"2022-07-14 12:23:15","","","","",,,,,76,25.33,19,4,3,"… In our paper, we shed light on the adversarial robustness of an important class of machine … models under adversarial attacks, and more importantly, we propose a novel robust training …","http://proceedings.mlr.press/v97/chen19m/chen19m.pdf","https://scholar.google.com/scholar?q=related:yL9XEARF8f0J:scholar.google.com/&scioq=%22robust%22+%22neural+network%22+%22adversarial%22&hl=en&as_sdt=2007"
23,"Y Qian, H Hu, T Tan","Data augmentation using generative adversarial networks for robust speech recognition",2019,"Speech Communication","Elsevier","https://www.sciencedirect.com/science/article/pii/S0167639319300044?casa_token=cOH0vqUXGJYAAAAA:fNw5cEN6yVmW8eb4zef893kfrQYrOUfPKdsQvw-oamSRMeRHqCkyLiKE3SX7l5vNAzhx5kB4SJQ","https://scholar.google.com/scholar?cites=13496096631379288340&as_sdt=2005&sciodt=2007&hl=en",178,"2022-07-14 12:23:15","HTML","","","",,,,,23,7.67,8,3,3,"… For noise robust speech recognition, data mismatch between training … , in this work we utilize generative adversarial networks (GAN) for data … Very deep convolutional neural network …","https://www.sciencedirect.com/science/article/pii/S0167639319300044?casa_token=cOH0vqUXGJYAAAAA:fNw5cEN6yVmW8eb4zef893kfrQYrOUfPKdsQvw-oamSRMeRHqCkyLiKE3SX7l5vNAzhx5kB4SJQ","https://scholar.google.com/scholar?q=related:FGG1f2HES7sJ:scholar.google.com/&scioq=%22robust%22+%22neural+network%22+%22adversarial%22&hl=en&as_sdt=2007"
18,"S Wang, Z Chen, J Ni, X Yu, Z Li, H Chen…","Adversarial defense framework for graph neural network",2019,"arXiv preprint arXiv …","arxiv.org","https://arxiv.org/abs/1905.03679","https://scholar.google.com/scholar?cites=1156363253638046014&as_sdt=2005&sciodt=2007&hl=en",183,"2022-07-14 12:23:15","","","","",,,,,18,6.00,3,7,3,"… the adversarial attacks. More formally, given a graph G, our goal is to build a robust GNN … small-scale modification and thus is more robust to adversarial attacks. Therefore, in our GER …","https://arxiv.org/pdf/1905.03679","https://scholar.google.com/scholar?q=related:PiFppEA6DBAJ:scholar.google.com/&scioq=%22robust%22+%22neural+network%22+%22adversarial%22&hl=en&as_sdt=2007"
38,"YB Tang, S Oh, YX Tang, J Xiao…","CT-realistic data augmentation using generative adversarial network for robust lymph node segmentation",2019,"Medical Imaging 2019 …","spiedigitallibrary.org","https://www.spiedigitallibrary.org/conference-proceedings-of-spie/10950/109503V/CT-realistic-data-augmentation-using-generative-adversarial-network-for-robust/10.1117/12.2512004.short","https://scholar.google.com/scholar?cites=16831084091140430168&as_sdt=2005&sciodt=2007&hl=en",185,"2022-07-14 12:23:15","","10.1117/12.2512004.short","","",,,,,38,12.67,8,5,3,"… -nested neural network. … adversarial network is proposed to synthesize a large number of paired lymph node CT images in this work. With the help of these generated images, a robust …","https://scholar.google.com/scholar?output=instlink&q=info:WFknVc4FlOkJ:scholar.google.com/&hl=en&as_sdt=2007&scillfp=11758220161743797373&oi=lle","https://scholar.google.com/scholar?q=related:WFknVc4FlOkJ:scholar.google.com/&scioq=%22robust%22+%22neural+network%22+%22adversarial%22&hl=en&as_sdt=2007"
11,"X Wang, R Yang, T Sun, B Luo","Learning Target-aware Attention for Robust Tracking with Conditional Adversarial Network.",2019,"BMVC","drive.google.com","https://drive.google.com/file/d/1QqBMYXsWw_Z0ls9aQfJ29Ya7iYk0kbSB/view","https://scholar.google.com/scholar?cites=11314918360585972324&as_sdt=2005&sciodt=2007&hl=en",190,"2022-07-14 12:23:15","PDF","","","",,,,,11,3.67,3,4,3,"… the location clues of target object, for accurate and robust tracking. As shown in Fig. 2, the … consecutive frames as input to a 3D convolutional neural network (3D CNN) to capture mo…","https://drive.google.com/file/d/1QqBMYXsWw_Z0ls9aQfJ29Ya7iYk0kbSB/view","https://scholar.google.com/scholar?q=related:ZKpFyUyqBp0J:scholar.google.com/&scioq=%22robust%22+%22neural+network%22+%22adversarial%22&hl=en&as_sdt=2007"
160,"H Zhang, H Chen, C Xiao, S Gowal, R Stanforth…","Towards stable and efficient training of verifiably robust neural networks",2019,"arXiv preprint arXiv …","arxiv.org","https://arxiv.org/abs/1906.06316","https://scholar.google.com/scholar?cites=7372965607005042230&as_sdt=2005&sciodt=2007&hl=en",195,"2022-07-14 12:23:15","","","","",,,,,160,53.33,27,6,3,"… In this paper, we propose a new certified adversarial training method, CROWN-IBP, … robust for any perturbation with l∞ norm less than ϵ. m(xk,ϵ) can be obtained by a neural network …","https://arxiv.org/pdf/1906.06316","https://scholar.google.com/scholar?q=related:Nja16icJUmYJ:scholar.google.com/&scioq=%22robust%22+%22neural+network%22+%22adversarial%22&hl=en&as_sdt=2007"
255,"D Zhang, T Zhang, Y Lu, Z Zhu…","You only propagate once: Accelerating adversarial training via maximal principle",2019,"Advances in Neural …","proceedings.neurips.cc","https://proceedings.neurips.cc/paper/2019/hash/812b4ba287f5ee0bc9d43bbf5bbe87fb-Abstract.html","https://scholar.google.com/scholar?cites=8806301774024240187&as_sdt=2005&sciodt=2007&hl=en",196,"2022-07-14 12:23:15","","","","",,,,,255,85.00,51,5,3,"… In Section 2, we formulate the robust optimization for neural network adversarial training as a differential game and propose the gradient based YOPO. In Section 3, we derive the PMP …","https://proceedings.neurips.cc/paper/2019/file/812b4ba287f5ee0bc9d43bbf5bbe87fb-Paper.pdf","https://scholar.google.com/scholar?q=related:O2ybQc5ENnoJ:scholar.google.com/&scioq=%22robust%22+%22neural+network%22+%22adversarial%22&hl=en&as_sdt=2007"
