Cites,Authors,Title,Year,Source,Publisher,ArticleURL,CitesURL,GSRank,QueryDate,Type,DOI,ISSN,CitationURL,Volume,Issue,StartPage,EndPage,ECC,CitesPerYear,CitesPerAuthor,AuthorCount,Age,Abstract,FullTextURL,RelatedURL
24,"P Agand, MA Shoorehdeli, A Khaki-Sedigh","Adaptive recurrent neural network with Lyapunov stability learning rules for robot dynamic terms identification",2017,"engineering applications of …","Elsevier","https://www.sciencedirect.com/science/article/pii/S0952197617301574","https://scholar.google.com/scholar?cites=1651804435097469392&as_sdt=2005&sciodt=2007&hl=en",56,"2022-07-14 12:30:32","","","","",,,,,24,4.80,8,3,5,"… The projection method, as a robust modification error, is employed in this article to confine network error. The authors in Polycarpou (1996) improves the performance of identifier …","","https://scholar.google.com/scholar?q=related:0EFm0GFj7BYJ:scholar.google.com/&scioq=%22robust%22+%22neural+network%22+%22transparency%22&hl=en&as_sdt=2007"
582,"LM Zintgraf, TS Cohen, T Adel, M Welling","Visualizing deep neural network decisions: Prediction difference analysis",2017,"arXiv preprint arXiv …","arxiv.org","https://arxiv.org/abs/1702.04595","https://scholar.google.com/scholar?cites=13321146675816614452&as_sdt=2005&sciodt=2007&hl=en",77,"2022-07-14 12:30:32","","","","",,,,,582,116.40,146,4,5,"… This lack of transparency is a significant impediment to the adoption of deep learning in … However, we would expect that a neural network is relatively robust to just one feature of a high-…","https://arxiv.org/pdf/1702.04595","https://scholar.google.com/scholar?q=related:NMrsvFI43rgJ:scholar.google.com/&scioq=%22robust%22+%22neural+network%22+%22transparency%22&hl=en&as_sdt=2007"
84,"M Babaee, DT Dinh, G Rigoll","A deep convolutional neural network for background subtraction",2017,"arXiv preprint arXiv:1702.01731","arxiv.org","https://arxiv.org/abs/1702.01731","https://scholar.google.com/scholar?cites=11227350253492869342&as_sdt=2005&sciodt=2007&hl=en",105,"2022-07-14 12:30:32","","","","",,,,,84,16.80,28,3,5,"… that assure robust background … semi-transparency and motion blur will also increase. Figure. 11 shows the comparison between the background model from SuBSENSE and the robust …","https://arxiv.org/pdf/1702.01731","https://scholar.google.com/scholar?q=related:3phVDJKPz5sJ:scholar.google.com/&scioq=%22robust%22+%22neural+network%22+%22transparency%22&hl=en&as_sdt=2007"
42,"A Narayan, KW Hipel","Long short term memory networks for short-term electric load forecasting",2017,"2017 IEEE International Conference on …","ieeexplore.ieee.org","https://ieeexplore.ieee.org/abstract/document/8123012/","https://scholar.google.com/scholar?cites=1494963251825180363&as_sdt=2005&sciodt=2007&hl=en",121,"2022-07-14 12:30:32","","","","",,,,,42,8.40,21,2,5,"… in implementation and lack of transparency in results has been cited as a main challenge. … that deep recurrent neural network with long-short term memory architecture presents a robust …","https://a-narayan.github.io/assets/preprints/narayan2017long.pdf","https://scholar.google.com/scholar?q=related:y35NKSgtvxQJ:scholar.google.com/&scioq=%22robust%22+%22neural+network%22+%22transparency%22&hl=en&as_sdt=2007"
34,"KS Kasiviswanathan, KP Sudheer","Methods used for quantifying the prediction uncertainty of artificial neural network based hydrologic models",2017,"Stochastic environmental research …","Springer","https://link.springer.com/article/10.1007/s00477-016-1369-5","https://scholar.google.com/scholar?cites=6842924694764554352&as_sdt=2005&sciodt=2007&hl=en",146,"2022-07-14 12:30:32","","10.1007/s00477-016-1369-5","","",,,,,34,6.80,17,2,5,"… characteristics, which result in lack of transparency. In addition, it is … the uncertainty of neural network hydrologic models. It is … been reported due to robust estimation of model prediction …","https://scholar.google.com/scholar?output=instlink&q=info:cIgwKMHz9l4J:scholar.google.com/&hl=en&as_sdt=2007&scillfp=12181721085351408601&oi=lle","https://scholar.google.com/scholar?q=related:cIgwKMHz9l4J:scholar.google.com/&scioq=%22robust%22+%22neural+network%22+%22transparency%22&hl=en&as_sdt=2007"
6,"NH Singh, K Thongam","Fuzzy logic-genetic algorithm-neural network for Mobile robot navigation: a survey",2017,"International Research Journal of …","academia.edu","https://www.academia.edu/download/54373856/IRJET-V4I805.pdf","https://scholar.google.com/scholar?cites=8765778545937158407&as_sdt=2005&sciodt=2007&hl=en",154,"2022-07-14 12:30:32","PDF","","","",,,,,6,1.20,3,2,5,"… of the transparency of fuzzy logic with the adaptability of neural network has been proposed. … , multi sensor based motions and robust recurrent neural network control is proposed for …","https://www.academia.edu/download/54373856/IRJET-V4I805.pdf","https://scholar.google.com/scholar?q=related:BxFT-iRNpnkJ:scholar.google.com/&scioq=%22robust%22+%22neural+network%22+%22transparency%22&hl=en&as_sdt=2007"
73,"A Choubineh, H Ghorbani, DA Wood, SR Moosavi…","Improved predictions of wellhead choke liquid critical-flow rates: modelling based on hybrid neural network training learning based optimization",2017,"Fuel","Elsevier","https://www.sciencedirect.com/science/article/pii/S0016236117308451","https://scholar.google.com/scholar?cites=16596833090873647661&as_sdt=2005&sciodt=2007&hl=en",180,"2022-07-14 12:30:32","","","","",,,,,73,14.60,15,5,5,"… Robust models for predicting the liquid critical-flow rates for producing oil wells. … Hybridizing the ANN technique with TLBO improves its transparency, which is beneficial for theoretical …","","https://scholar.google.com/scholar?q=related:LeL4KcPLU-YJ:scholar.google.com/&scioq=%22robust%22+%22neural+network%22+%22transparency%22&hl=en&as_sdt=2007"
9,"RK Movaghar, HK Bizaki","A new approach for digital image watermarking to predict optimal blocks using artificial neural networks",2017,"Turkish Journal of Electrical …","journals.tubitak.gov.tr","https://journals.tubitak.gov.tr/elektrik/vol25/iss1/49/","https://scholar.google.com/scholar?cites=16893906172297396287&as_sdt=2005&sciodt=2007&hl=en",183,"2022-07-14 12:30:32","","","","",,,,,9,1.80,5,2,5,"… inserting a watermark by artificial neural network (ANN), we … In this section our robust watermarking scheme is introduced… function that addresses transparency and robustness issues …","https://journals.tubitak.gov.tr/cgi/viewcontent.cgi?article=2444&context=elektrik","https://scholar.google.com/scholar?q=related:P8CQ7Cc2c-oJ:scholar.google.com/&scioq=%22robust%22+%22neural+network%22+%22transparency%22&hl=en&as_sdt=2007"
109,"Y Guo, T Wang, F Chen, X Sun, X Li, Z Yu, P Wan…","Hierarchical graphene–polyaniline nanocomposite films for high-performance flexible electronic gas sensors",2016,"Nanoscale","pubs.rsc.org","https://pubs.rsc.org/en/content/articlehtml/2016/nr/c6nr02540d","https://scholar.google.com/scholar?cites=6036364834320245443&as_sdt=2005&sciodt=2007&hl=en",54,"2022-07-14 12:30:32","","","","",,,,,109,18.17,14,8,6,"… transparency (90.3% at 550 nm) for the PPANI/rGO-FPANI film (6 h sample), fast response/recovery time (36 s/18 s), and robust … sensor of artificial neural network-like …","","https://scholar.google.com/scholar?q=related:w2JRtNV5xVMJ:scholar.google.com/&scioq=%22robust%22+%22neural+network%22+%22transparency%22&hl=en&as_sdt=2007"
71,"D Sun, F Naghdy, H Du","Neural network-based passivity control of teleoperation system under time-varying delays",2016,"IEEE transactions on cybernetics","ieeexplore.ieee.org","https://ieeexplore.ieee.org/abstract/document/7460115/","https://scholar.google.com/scholar?cites=618155998559522637&as_sdt=2005&sciodt=2007&hl=en",57,"2022-07-14 12:30:32","","","","",,,,,71,11.83,24,3,6,"In this paper, a novel neural network (NN)-based four-channel wave-based time domain passivity approach (TDPA) is proposed for a teleoperation system with time-varying delays. The …","https://www.diva-portal.org/smash/get/diva2:1177017/FULLTEXT02","https://scholar.google.com/scholar?q=related:Tc_qBZshlAgJ:scholar.google.com/&scioq=%22robust%22+%22neural+network%22+%22transparency%22&hl=en&as_sdt=2007"
808,"W Samek, A Binder, G Montavon…","Evaluating the visualization of what a deep neural network has learned",2016,"IEEE transactions on …","ieeexplore.ieee.org","https://ieeexplore.ieee.org/abstract/document/7552539/","https://scholar.google.com/scholar?cites=7349251395468541741&as_sdt=2005&sciodt=2007&hl=en",61,"2022-07-14 12:30:32","","","","",,,,,808,134.67,202,4,6,"… might consider this lack of transparency a drawback in practice… Only recently, the transparency problem has been receiving … for a particular type of neural network, namely, convolutional …","https://arxiv.org/pdf/1509.06321","https://scholar.google.com/scholar?q=related:LT_yxzTJ_WUJ:scholar.google.com/&scioq=%22robust%22+%22neural+network%22+%22transparency%22&hl=en&as_sdt=2007"
93,"RF Turkson, F Yan, MKA Ali, J Hu","Artificial neural network applications in the calibration of spark-ignition engines: An overview",2016,"Engineering science and technology, an …","Elsevier","https://www.sciencedirect.com/science/article/pii/S2215098615302846","https://scholar.google.com/scholar?cites=1758060496929399724&as_sdt=2005&sciodt=2007&hl=en",63,"2022-07-14 12:30:32","HTML","","","",,,,,93,15.50,23,4,6,"… -box models with a transparency level lying between that of … makes an artificial neural network robust to errors resulting … an overview of relevant neural network theory and outline the …","https://www.sciencedirect.com/science/article/pii/S2215098615302846","https://scholar.google.com/scholar?q=related:rKMfFbXiZRgJ:scholar.google.com/&scioq=%22robust%22+%22neural+network%22+%22transparency%22&hl=en&as_sdt=2007"
55,"X Chen, Y Zeng, Y Yin","Improving the transparency of an exoskeleton knee joint based on the understanding of motor intent using energy kernel method of EMG",2016,"IEEE Transactions on Neural Systems …","ieeexplore.ieee.org","https://ieeexplore.ieee.org/abstract/document/7494637/","https://scholar.google.com/scholar?cites=15876422912479193680&as_sdt=2005&sciodt=2007&hl=en",145,"2022-07-14 12:30:32","","","","",,,,,55,9.17,18,3,6,"… robust energy kernel method based on the oscillator model of EMG that we proposed earlier [19]. To realize transparency … using focused time-delay neural network (FTDNN), which is …","","https://scholar.google.com/scholar?q=related:UOoxooViVNwJ:scholar.google.com/&scioq=%22robust%22+%22neural+network%22+%22transparency%22&hl=en&as_sdt=2007"
20,"C Dhaware, KH Wanjale","Survey on image classification methods in image processing",2016,"Int. J. Comput. Sci. Trends Technol","academia.edu","https://www.academia.edu/download/46713343/IJCST-V4I3P40.pdf","https://scholar.google.com/scholar?cites=3236772407011702185&as_sdt=2005&sciodt=2007&hl=en",160,"2022-07-14 12:30:32","PDF","","","",,,,,20,3.33,10,2,6,"… [2] explains, Artificial Neural Network is efficiently handling … [3] also discuss the artificial neural network classification technique. … Each layer of neural network system consists of a set of …","https://www.academia.edu/download/46713343/IJCST-V4I3P40.pdf","https://scholar.google.com/scholar?q=related:qfW34lpT6ywJ:scholar.google.com/&scioq=%22robust%22+%22neural+network%22+%22transparency%22&hl=en&as_sdt=2007"
7,"Ş Öztürk, B Akdemır","Novel BiasFeed cellular neural network model for glass defect inspection",2016,"2016 International Conference on …","ieeexplore.ieee.org","https://ieeexplore.ieee.org/abstract/document/7593590/","https://scholar.google.com/scholar?cites=5832384109779480367&as_sdt=2005&sciodt=2007&hl=en",165,"2022-07-14 12:30:32","","","","",,,,,7,1.17,4,2,6,"… Transparency and reflection properties of the glass surface reduce success of image … reflections and negative effects arising from transparency are decreased. The developed method is …","","https://scholar.google.com/scholar?q=related:L-8JUXLK8FAJ:scholar.google.com/&scioq=%22robust%22+%22neural+network%22+%22transparency%22&hl=en&as_sdt=2007"
7,"B Wang, Y Gao","An image compression scheme based on fuzzy neural network",2015,"… (Telecommunication Computing Electronics …","telkomnika.uad.ac.id","http://telkomnika.uad.ac.id/index.php/TELKOMNIKA/article/view/1270","https://scholar.google.com/scholar?cites=4034027846431381139&as_sdt=2005&sciodt=2007&hl=en",104,"2022-07-14 12:30:32","","","","",,,,,7,1.00,4,2,7,"… transparency of fuzzy neural network. This paper mainly investigates the applications of fuzzy neural network … compression and reconstruction of fuzzy neural network. It is demonstrated …","http://telkomnika.uad.ac.id/index.php/TELKOMNIKA/article/viewFile/1270/1059","https://scholar.google.com/scholar?q=related:k5aTAPS--zcJ:scholar.google.com/&scioq=%22robust%22+%22neural+network%22+%22transparency%22&hl=en&as_sdt=2007"
8,"D Yang, F Chen, Y Zhou","A novel eutrophication assessment models for aquaculture water area via artificial neural networks",2015,"Journal of Computational and …","ingentaconnect.com","https://www.ingentaconnect.com/contentone/asp/jctn/2015/00000012/00000009/art00136","https://scholar.google.com/scholar?cites=11111573298373364844&as_sdt=2005&sciodt=2007&hl=en",188,"2022-07-14 12:30:32","","","","",,,,,8,1.14,3,3,7,"… -propagation neural network (BPNN), our GRNN and MLFN models have more robust and … In our research, we took the transparency, depth of water, temperature of water, chlorophyl A…","","https://scholar.google.com/scholar?q=related:bIxCEQs9NJoJ:scholar.google.com/&scioq=%22robust%22+%22neural+network%22+%22transparency%22&hl=en&as_sdt=2007"
75,"SE Kim, IW Seo","Artificial Neural Network ensemble modeling with conjunctive data clustering for water quality prediction in rivers",2015,"Journal of Hydro-Environment Research","Elsevier","https://www.sciencedirect.com/science/article/pii/S1570644315000192","https://scholar.google.com/scholar?cites=17885247150028927573&as_sdt=2005&sciodt=2007&hl=en",195,"2022-07-14 12:30:32","","","","",,,,,75,10.71,38,2,7,"… In addition to the major criticism that ANNs lack transparency, … set, before training the neural network. Problems with the … As a result, the neural network has difficulty in learning from …","https://www.researchgate.net/profile/Sung-Eun-Kim-4/publication/275721804_Artificial_Neural_Network_ensemble_modeling_with_conjunctive_data_clustering_for_water_quality_prediction_in_rivers/links/5aa6dadaaca272326825f437/Artificial-Neural-Network-ensemble-modeling-with-conjunctive-data-clustering-for-water-quality-prediction-in-rivers.pdf","https://scholar.google.com/scholar?q=related:VbKK2YUpNfgJ:scholar.google.com/&scioq=%22robust%22+%22neural+network%22+%22transparency%22&hl=en&as_sdt=2007"
1,"A Taheri","A New Robust Digital Image Watermarking Based on Statistical Information of Wavelet Coefficients Transform and Back-Propagation Neural Network",2014,"International Journal of Enhanced Research in Science …","researchgate.net","https://www.researchgate.net/profile/Ayoub-Taheri/publication/280516226_A_New_Robust_Digital_Image_Watermarking_Based_on_Statistical_Information_of_Wavelet_Coefficients_Transform_and_Back-Propagation_Neural_Network/links/55b7298908aed621de044f0f/A-New-Robust-Digital-Image-Watermarking-Based-on-Statistical-Information-of-Wavelet-Coefficients-Transform-and-Back-Propagation-Neural-Network.pdf","https://scholar.google.com/scholar?cites=4392047739427874836&as_sdt=2005&sciodt=2007&hl=en",6,"2022-07-14 12:30:32","PDF","","","",,,,,1,0.13,1,1,8,"… alternative techniques, but works well in our method) to receive a high transparency of the watermarked image and the robustness of the watermark. W (k) is the kth watermark bit in the …","https://www.researchgate.net/profile/Ayoub-Taheri/publication/280516226_A_New_Robust_Digital_Image_Watermarking_Based_on_Statistical_Information_of_Wavelet_Coefficients_Transform_and_Back-Propagation_Neural_Network/links/55b7298908aed621de044f0f/A-New-Robust-Digital-Image-Watermarking-Based-on-Statistical-Information-of-Wavelet-Coefficients-Transform-and-Back-Propagation-Neural-Network.pdf","https://scholar.google.com/scholar?q=related:FOgnISaw8zwJ:scholar.google.com/&scioq=%22robust%22+%22neural+network%22+%22transparency%22&hl=en&as_sdt=2007"
35,"Z Li, Y Xia","Adaptive neural network control of bilateral teleoperation with unsymmetrical stochastic delays and unmodeled dynamics",2014,"International Journal of Robust and Nonlinear …","Wiley Online Library","https://onlinelibrary.wiley.com/doi/abs/10.1002/rnc.2950","https://scholar.google.com/scholar?cites=11636799196777064227&as_sdt=2005&sciodt=2007&hl=en",13,"2022-07-14 12:30:32","","10.1002/rnc.2950","","",,,,,35,4.38,18,2,8,"… in communication channel to achieve transparency and robust stability. Compared with previous … The proposed adaptive NN control is robust against motion disturbances, parametric …","https://scholar.google.com/scholar?output=instlink&q=info:I6dyDjc3fqEJ:scholar.google.com/&hl=en&as_sdt=2007&scillfp=10012628375541195665&oi=lle","https://scholar.google.com/scholar?q=related:I6dyDjc3fqEJ:scholar.google.com/&scioq=%22robust%22+%22neural+network%22+%22transparency%22&hl=en&as_sdt=2007"
2,"A Taheri","A Hybrid Digital Image Watermarking based on Discrete Wavelet Transform, Discrete Cosine Transform and General Regression Neural Network",2014,"International Journal of Enhanced Research in Science …","researchgate.net","https://www.researchgate.net/profile/Ayoub-Taheri/publication/280516162_A_Hybrid_Digital_Image_Watermarking_based_on_Discrete_Wavelet_Transform_Discrete_Cosine_Transform_and_General_Regression_Neural_Network/links/55b729ee08aed621de044f2f/A-Hybrid-Digital-Image-Watermarking-based-on-Discrete-Wavelet-Transform-Discrete-Cosine-Transform-and-General-Regression-Neural-Network.pdf","https://scholar.google.com/scholar?cites=4602459309938383655&as_sdt=2005&sciodt=2007&hl=en",37,"2022-07-14 12:30:32","PDF","","","",,,,,2,0.25,2,1,8,"… and the balance between transparency and robustness are … more imperceptible and more robust to common image processing … Neural network technology in the application of digital …","https://www.researchgate.net/profile/Ayoub-Taheri/publication/280516162_A_Hybrid_Digital_Image_Watermarking_based_on_Discrete_Wavelet_Transform_Discrete_Cosine_Transform_and_General_Regression_Neural_Network/links/55b729ee08aed621de044f2f/A-Hybrid-Digital-Image-Watermarking-based-on-Discrete-Wavelet-Transform-Discrete-Cosine-Transform-and-General-Regression-Neural-Network.pdf","https://scholar.google.com/scholar?q=related:JxsRhls43z8J:scholar.google.com/&scioq=%22robust%22+%22neural+network%22+%22transparency%22&hl=en&as_sdt=2007"
2,"A Taheri","An adaptive digital image watermarking based on image features in discrete wavelet transform domain and general regression neural network",2014,"Int J Enhanc Res Sci Technol Eng","researchgate.net","https://www.researchgate.net/profile/Ayoub-Taheri/publication/280516039_An_Adaptive_Digital_Image_Watermarking_Based_on_Image_Features_in_Discrete_Wavelet_Transform_Domain_and_General_Regression_Neural_Network/links/55b729c508ae9289a08bd438/An-Adaptive-Digital-Image-Watermarking-Based-on-Image-Features-in-Discrete-Wavelet-Transform-Domain-and-General-Regression-Neural-Network.pdf","https://scholar.google.com/scholar?cites=17105815578874701992&as_sdt=2005&sciodt=2007&hl=en",59,"2022-07-14 12:30:32","PDF","","","",,,,,2,0.25,2,1,8,"… ABSTRACT: In this paper, a new intelligent, robust and … (HVS) model and general regression neural network (GRNN) is … factor, relative to robustness and transparency of algorithm. The …","https://www.researchgate.net/profile/Ayoub-Taheri/publication/280516039_An_Adaptive_Digital_Image_Watermarking_Based_on_Image_Features_in_Discrete_Wavelet_Transform_Domain_and_General_Regression_Neural_Network/links/55b729c508ae9289a08bd438/An-Adaptive-Digital-Image-Watermarking-Based-on-Image-Features-in-Discrete-Wavelet-Transform-Domain-and-General-Regression-Neural-Network.pdf","https://scholar.google.com/scholar?q=related:qGgrdKMQZO0J:scholar.google.com/&scioq=%22robust%22+%22neural+network%22+%22transparency%22&hl=en&as_sdt=2007"
2,"S Kuri, VB Deshmukh…","Robust digital image watermarking using Pseudo Random Numbers",2014,"… Conference on Circuits …","ieeexplore.ieee.org","https://ieeexplore.ieee.org/abstract/document/7057766/","https://scholar.google.com/scholar?cites=2183963286805099394&as_sdt=2005&sciodt=2007&hl=en",98,"2022-07-14 12:30:32","","","","",,,,,2,0.25,1,3,8,"… robust image watermarking technique in wavelet domain that uses the Pseudo Random Number (PRN) sequence generated using Elman neural network … The neural network generated …","https://www.researchgate.net/profile/Suresh-Kuri/publication/278910999_Robust_Digital_Image_Watermarking_Using_Pseudo_Random_Numbers/links/5587c36f08ae71f6ba916955/Robust-Digital-Image-Watermarking-Using-Pseudo-Random-Numbers.pdf","https://scholar.google.com/scholar?q=related:gjODyAn_Th4J:scholar.google.com/&scioq=%22robust%22+%22neural+network%22+%22transparency%22&hl=en&as_sdt=2007"
49,"MR Senapati, AK Mohanty, S Dash…","Local linear wavelet neural network for breast cancer recognition",2013,"Neural Computing and …","Springer","https://link.springer.com/article/10.1007/s00521-011-0670-y","https://scholar.google.com/scholar?cites=4206375863527760660&as_sdt=2005&sciodt=2007&hl=en",114,"2022-07-14 12:30:32","","10.1007/s00521-011-0670-y","","",,,,,49,5.44,12,4,9,"… is very robust, effective and gives better classification. … neural network, this local capacity provides some advantages such as the learning efficiency and the structure transparency. …","https://scholar.google.com/scholar?output=instlink&q=info:FGNZwY8MYDoJ:scholar.google.com/&hl=en&as_sdt=2007&scillfp=1238628188142372577&oi=lle","https://scholar.google.com/scholar?q=related:FGNZwY8MYDoJ:scholar.google.com/&scioq=%22robust%22+%22neural+network%22+%22transparency%22&hl=en&as_sdt=2007"
29,"MR Senapati, PK Dash","Local linear wavelet neural network based breast tumor classification using firefly algorithm",2013,"Neural Computing and Applications","Springer","https://link.springer.com/article/10.1007/s00521-012-0927-0","https://scholar.google.com/scholar?cites=17494332787257040046&as_sdt=2005&sciodt=2007&hl=en",136,"2022-07-14 12:30:32","","10.1007/s00521-012-0927-0","","",,,,,29,3.22,15,2,9,"… the proposed approach is very robust, effective and gives … neural network, this local capacity provides some advantages such as the learning efficiency and the structure transparency. …","https://scholar.google.com/scholar?output=instlink&q=info:rtzsJvtayPIJ:scholar.google.com/&hl=en&as_sdt=2007&scillfp=5772261420993346052&oi=lle","https://scholar.google.com/scholar?q=related:rtzsJvtayPIJ:scholar.google.com/&scioq=%22robust%22+%22neural+network%22+%22transparency%22&hl=en&as_sdt=2007"
35,"A Odawara, M Gotoh, I Suzuki","Control of neural network patterning using collagen gel photothermal etching",2013,"Lab on a Chip","pubs.rsc.org","https://pubs.rsc.org/en/content/articlehtml/2013/lc/c3lc00036b","https://scholar.google.com/scholar?cites=10929801153112473135&as_sdt=2005&sciodt=2007&hl=en",173,"2022-07-14 12:30:32","","","","",,,,,35,3.89,12,3,9,"… for transplantation or more robust experimental models. We … It was then possible to guide neural network formation under … microscopic imaging due to its transparency. The glass was …","https://scholar.google.com/scholar?output=instlink&q=info:L37sfD10rpcJ:scholar.google.com/&hl=en&as_sdt=2007&scillfp=15222828746351543578&oi=lle","https://scholar.google.com/scholar?q=related:L37sfD10rpcJ:scholar.google.com/&scioq=%22robust%22+%22neural+network%22+%22transparency%22&hl=en&as_sdt=2007"
45,"A Forouzantabar, HA Talebi, AK Sedigh","Adaptive neural network control of bilateral teleoperation with constant time delay",2012,"Nonlinear Dynamics","Springer","https://link.springer.com/article/10.1007/s11071-011-0057-8","https://scholar.google.com/scholar?cites=14896835453146985306&as_sdt=2005&sciodt=2007&hl=en",30,"2022-07-14 12:30:32","","10.1007/s11071-011-0057-8","","",,,,,45,4.50,15,3,10,"… robust stability of the teleoperator, they deteriorate the tracking performance. … link neural network is given. In Sect. 4, a stable adaptive neural network controller to improve transparency …","https://scholar.google.com/scholar?output=instlink&q=info:WnNF9uowvM4J:scholar.google.com/&hl=en&as_sdt=2007&scillfp=17106116473491874009&oi=lle","https://scholar.google.com/scholar?q=related:WnNF9uowvM4J:scholar.google.com/&scioq=%22robust%22+%22neural+network%22+%22transparency%22&hl=en&as_sdt=2007"
286,"RJ Abrahart, F Anctil, P Coulibaly…","Two decades of anarchy? Emerging themes and outstanding challenges for neural network river forecasting",2012,"Progress in …","journals.sagepub.com","https://journals.sagepub.com/doi/abs/10.1177/0309133312444943","https://scholar.google.com/scholar?cites=10633630150123429721&as_sdt=2005&sciodt=2007&hl=en",92,"2022-07-14 12:30:32","","10.1177/0309133312444943","","",,,,,286,28.60,72,4,10,"… This paper traces two decades of neural network rainfall-runoff and … transparency in the benchmarking and reporting of experimental case studies. It is also clear that neural network …","https://citeseerx.ist.psu.edu/viewdoc/download?doi=10.1.1.845.2654&rep=rep1&type=pdf","https://scholar.google.com/scholar?q=related:WZ_9Okg-kpMJ:scholar.google.com/&scioq=%22robust%22+%22neural+network%22+%22transparency%22&hl=en&as_sdt=2007"
