Cites,Authors,Title,Year,Source,Publisher,ArticleURL,CitesURL,GSRank,QueryDate,Type,DOI,ISSN,CitationURL,Volume,Issue,StartPage,EndPage,ECC,CitesPerYear,CitesPerAuthor,AuthorCount,Age,Abstract,FullTextURL,RelatedURL
62,"N Carlini, M Jagielski, I Mironov","Cryptanalytic extraction of neural network models",2020,"Annual International Cryptology …","Springer","https://link.springer.com/chapter/10.1007/978-3-030-56877-1_7","https://scholar.google.com/scholar?cites=5632560181065451975&as_sdt=2005&sciodt=2007&hl=en",161,"2022-07-14 12:30:32","","10.1007/978-3-030-56877-1_7","","",,,,,62,31.00,21,3,2,"… Most of the methods in this paper are built on computing second partial derivatives of the neural network f, and therefore developing a robust method for estimating the gradient is …","https://arxiv.org/pdf/2003.04884","https://scholar.google.com/scholar?q=related:x4lqYKTfKk4J:scholar.google.com/&scioq=%22robust%22+%22neural+network%22+%22transparency%22&hl=en&as_sdt=2007"
5,"M Alshehri","A content-based image retrieval method using neural network-based prediction technique",2020,"Arabian journal for science and engineering","Springer","https://link.springer.com/article/10.1007/s13369-019-04235-5","https://scholar.google.com/scholar?cites=1875005063916384621&as_sdt=2005&sciodt=2007&hl=en",167,"2022-07-14 12:30:32","","10.1007/s13369-019-04235-5","","",,,,,5,2.50,5,1,2,"… , with prediction of information using neural network by applying the fuzzy inference system … invariant feature transform, and speeded up robust features. The experimental results show …","https://scholar.google.com/scholar?output=instlink&q=info:bXHL4itbBRoJ:scholar.google.com/&hl=en&as_sdt=2007&scillfp=904664338421642441&oi=lle","https://scholar.google.com/scholar?q=related:bXHL4itbBRoJ:scholar.google.com/&scioq=%22robust%22+%22neural+network%22+%22transparency%22&hl=en&as_sdt=2007"
4,"Y Yang, Z Zheng","Interpretable neural networks for panel data analysis in economics",2020,"arXiv preprint arXiv:2010.05311","arxiv.org","https://arxiv.org/abs/2010.05311","https://scholar.google.com/scholar?cites=15346872703015283802&as_sdt=2005&sciodt=2007&hl=en",175,"2022-07-14 12:30:32","","","","",,,,,4,2.00,2,2,2,"… The interpretable neural network model we propose satisfies … without sacrificing interpretability and transparency. Second, … The model we propose is robust to data missing or abnormal …","https://arxiv.org/pdf/2010.05311","https://scholar.google.com/scholar?q=related:WmxdhGkL-9QJ:scholar.google.com/&scioq=%22robust%22+%22neural+network%22+%22transparency%22&hl=en&as_sdt=2007"
24,"M Miscuglio, J Meng, O Yesiliurt…","Artificial synapse with mnemonic functionality using GSST-based photonic integrated memory",2020,"2020 international …","ieeexplore.ieee.org","https://ieeexplore.ieee.org/abstract/document/9196183/","https://scholar.google.com/scholar?cites=15235959350537083733&as_sdt=2005&sciodt=2007&hl=en",182,"2022-07-14 12:30:32","","","","",,,,,24,12.00,6,4,2,"… function on a standardized neural network training set we show that the neural network reaches very high level of accuracy (>91%) in the inference phase and sufficiently robust. …","https://arxiv.org/pdf/1912.02221","https://scholar.google.com/scholar?q=related:VdsNRU4AcdMJ:scholar.google.com/&scioq=%22robust%22+%22neural+network%22+%22transparency%22&hl=en&as_sdt=2007"
64,"JV Jeyakumar, J Noor, YH Cheng…","How can i explain this to you? an empirical study of deep neural network explanation methods",2020,"Advances in …","proceedings.neurips.cc","https://proceedings.neurips.cc/paper/2020/hash/2c29d89cc56cdb191c60db2f0bae796b-Abstract.html","https://scholar.google.com/scholar?cites=9018300999055703919&as_sdt=2005&sciodt=2007&hl=en",184,"2022-07-14 12:30:32","","","","",,,,,64,32.00,16,4,2,"Explaining the inner workings of deep neural network models have received considerable attention in recent years. Researchers have attempted to provide human parseable …","https://proceedings.neurips.cc/paper/2020/file/2c29d89cc56cdb191c60db2f0bae796b-Paper.pdf","https://scholar.google.com/scholar?q=related:b_9DRvpwJ30J:scholar.google.com/&scioq=%22robust%22+%22neural+network%22+%22transparency%22&hl=en&as_sdt=2007"
3,"M Bagheri, M Mohrekesh, N Karimi…","Adaptive control of embedding strength in image watermarking using neural networks",2020,"arXiv preprint arXiv …","arxiv.org","https://arxiv.org/abs/2001.03251","https://scholar.google.com/scholar?cites=11071728127769803237&as_sdt=2005&sciodt=2007&hl=en",187,"2022-07-14 12:30:32","","","","",,,,,3,1.50,1,4,2,"… robust against different attacks and has good transparency. … Results in Table 1 show our method is more robust against … a method to use the neural network to find the strength factor of …","https://arxiv.org/pdf/2001.03251","https://scholar.google.com/scholar?q=related:5XlrWRKuppkJ:scholar.google.com/&scioq=%22robust%22+%22neural+network%22+%22transparency%22&hl=en&as_sdt=2007"
24,"G Nikolentzos, M Vazirgiannis","Random walk graph neural networks",2020,"Advances in Neural …","proceedings.neurips.cc","https://proceedings.neurips.cc/paper/2020/hash/ba95d78a7c942571185308775a97a3a0-Abstract.html","https://scholar.google.com/scholar?cites=1340863221401753826&as_sdt=2005&sciodt=2007&hl=en",189,"2022-07-14 12:30:32","","","","",,,,,24,12.00,12,2,2,"… We demonstrate the model’s transparency on synthetic … neural network model, Random Walk Graph Neural Network, … • We demonstrate the model’s high transparency on synthetic …","https://proceedings.neurips.cc/paper/2020/file/ba95d78a7c942571185308775a97a3a0-Paper.pdf","https://scholar.google.com/scholar?q=related:4pgJ5P6zmxIJ:scholar.google.com/&scioq=%22robust%22+%22neural+network%22+%22transparency%22&hl=en&as_sdt=2007"
3,"H Wu, C Wang, R Nock, W Wang, J Yin, K Lu…","Smint: Toward interpretable and robust model sharing for deep neural networks",2020,"ACM Transactions on …","dl.acm.org","https://dl.acm.org/doi/abs/10.1145/3381833","https://scholar.google.com/scholar?cites=908049134289085316&as_sdt=2005&sciodt=2007&hl=en",198,"2022-07-14 12:30:32","","10.1145/3381833","","",,,,,3,1.50,0,7,2,"… model, particularly a deep neural network via prediction APIs, … the lack of interpretability and transparency. Interpreting a shared … We use a convolutional neural network [29] as a base to …","https://www.researchgate.net/profile/Huijun-Wu/publication/341159066_SMINT_Toward_Interpretable_and_Robust_Model_Sharing_for_Deep_Neural_Networks/links/5f7d189d92851c14bcb37265/SMINT-Toward-Interpretable-and-Robust-Model-Sharing-for-Deep-Neural-Networks.pdf","https://scholar.google.com/scholar?q=related:hOPmZ-AJmgwJ:scholar.google.com/&scioq=%22robust%22+%22neural+network%22+%22transparency%22&hl=en&as_sdt=2007"
87,"Z Chen, F Huang, W Sun, J Gu…","RBF-neural-network-based adaptive robust control for nonlinear bilateral teleoperation manipulators with uncertainty and time delay",2019,"IEEE/ASME Transactions …","ieeexplore.ieee.org","https://ieeexplore.ieee.org/abstract/document/8941243/?casa_token=WCzEB37Oj2YAAAAA:QfOP6JidNTbpg_FPoWJ0QVScUa5zMhoWBhBJJ-T50W2G37bNKDgXFpOoull_EbnPX0mr8rDjQg","https://scholar.google.com/scholar?cites=486105075980432363&as_sdt=2005&sciodt=2007&hl=en",1,"2022-07-14 12:30:32","","","","",,,,,87,29.00,17,5,3,"… : The RBF-neural-network-based adaptive robust control design with time-varying delays, various nonlinearities, and uncertainties proposed in this article to enhance the transparency …","https://ieeexplore.ieee.org/iel7/3516/4785241/08941243.pdf?casa_token=Bv3__T3gnbkAAAAA:ICq0xKhJF_hmqj3GnxD8hB8ox7nwulsYJkzbYjauPqQROtjiJvACLtM9Oqal6tF8wA_yhBT2qQ","https://scholar.google.com/scholar?q=related:6_NTuf39vgYJ:scholar.google.com/&scioq=%22robust%22+%22neural+network%22+%22transparency%22&hl=en&as_sdt=2007"
46,"W Wang, R Wang, L Wang, Z Wang, A Ye","Towards a robust deep neural network in texts: A survey",2019,"arXiv preprint arXiv …","arxiv.org","https://arxiv.org/abs/1902.07285","https://scholar.google.com/scholar?cites=17005827233290470113&as_sdt=2005&sciodt=2007&hl=en",5,"2022-07-14 12:30:32","","10.1162/tacl_a_00254%EF%BC%89%E3%80%82","","",,,,,46,15.33,9,5,3,"… More importantly, we hope that our work could inspire future studies to develop more robust … the generation of adversarial texts and build robust models for defense. In presenting the …","https://arxiv.org/pdf/1902.07285.pdf%E5%92%8Chttps://www.mitpressjournals.org/doi/full/10.1162/tacl_a_00254%EF%BC%89%E3%80%82","https://scholar.google.com/scholar?q=related:4ULxl8TVAOwJ:scholar.google.com/&scioq=%22robust%22+%22neural+network%22+%22transparency%22&hl=en&as_sdt=2007"
201,"MH Tahersima, K Kojima, T Koike-Akino, D Jha…","Deep neural network inverse design of integrated photonic power splitters",2019,"Scientific reports","nature.com","https://www.nature.com/articles/s41598-018-37952-2","https://scholar.google.com/scholar?cites=9358847242254433554&as_sdt=2005&sciodt=2007&hl=en",22,"2022-07-14 12:30:32","HTML","","","",,,,,201,67.00,40,5,3,"… for a robust neural network representation of the device structure. It took a desktop computer with a core-i7 CPU with 3.7 GHz clock speed and 64 GB RAM about two weeks to complete …","https://www.nature.com/articles/s41598-018-37952-2","https://scholar.google.com/scholar?q=related:Ej24RftN4YEJ:scholar.google.com/&scioq=%22robust%22+%22neural+network%22+%22transparency%22&hl=en&as_sdt=2007"
0,"K Uchida, M Tanaka, M Okutomi","Extraction of Degradation Parameters for Transparency of an Image Restoration Network",2019,"2019 IEEE 8th Global …","ieeexplore.ieee.org","https://ieeexplore.ieee.org/abstract/document/9015336/","",25,"2022-07-14 12:30:32","","","","",,,,,0,0.00,0,3,3,"… convolutional neural network (CNN) has been proposed because of its high performance. However, it is well known that restoration by these networks is not robust against perturbations …","","https://scholar.google.com/scholar?q=related:x7qSWYxsQPcJ:scholar.google.com/&scioq=%22robust%22+%22neural+network%22+%22transparency%22&hl=en&as_sdt=2007"
15,"H Kuwajima, M Tanaka, M Okutomi","Improving transparency of deep neural inference process",2019,"Progress in Artificial Intelligence","Springer","https://link.springer.com/article/10.1007/s13748-019-00179-x","https://scholar.google.com/scholar?cites=5034547433488823727&as_sdt=2005&sciodt=2007&hl=en",28,"2022-07-14 12:30:32","","10.1007/s13748-019-00179-x","","",,,,,15,5.00,5,3,3,"… On the other hand, the convolutional neural network is robust against deleting randomly … terms of transparency. There must be the essential complexity of deep neural network which …","https://arxiv.org/pdf/1903.05501","https://scholar.google.com/scholar?q=related:r7X0cTdO3kUJ:scholar.google.com/&scioq=%22robust%22+%22neural+network%22+%22transparency%22&hl=en&as_sdt=2007"
4,"GT Pereira, AC de Carvalho","Bringing robustness against adversarial attacks",2019,"Nature Machine Intelligence","nature.com","https://www.nature.com/articles/s42256-019-0116-2","https://scholar.google.com/scholar?cites=7896822509391361169&as_sdt=2005&sciodt=2007&hl=en",32,"2022-07-14 12:30:32","","","","",,,,,4,1.33,2,2,3,"… A main issue is the low transparency of deep neural networks… TREPAN algorithm, used a neural network model as an oracle … Even though the human visual system is more robust than …","https://scholar.google.com/scholar?output=instlink&q=info:kbSUrjsml20J:scholar.google.com/&hl=en&as_sdt=2007&scillfp=14740584849444528239&oi=lle","https://scholar.google.com/scholar?q=related:kbSUrjsml20J:scholar.google.com/&scioq=%22robust%22+%22neural+network%22+%22transparency%22&hl=en&as_sdt=2007"
12,"S Kuutti, R Bowden, H Joshi, R Temple…","Safe deep neural network-driven autonomous vehicles using software safety cages",2019,"… Conference on Intelligent …","Springer","https://link.springer.com/chapter/10.1007/978-3-030-33617-2_17","https://scholar.google.com/scholar?cites=2675763918129994380&as_sdt=2005&sciodt=2007&hl=en",40,"2022-07-14 12:30:32","","10.1007/978-3-030-33617-2_17","","",,,,,12,4.00,2,5,3,"… due to the lack of transparency in deep neural networks and … the control action of the neural network to a safe operational … re-train the network, resulting in a more robust control policy. …","https://openresearch.surrey.ac.uk/esploro/fulltext/conferencePresentation/Safe-Deep-Neural-Network-driven-Autonomous-Vehicles/99512624102346?repId=12138942260002346&mId=13140317620002346&institution=44SUR_INST","https://scholar.google.com/scholar?q=related:jBryUhs5IiUJ:scholar.google.com/&scioq=%22robust%22+%22neural+network%22+%22transparency%22&hl=en&as_sdt=2007"
2,"A Kar, P Kulshreshtha, A Agrawal, S Palakkal…","Annotation-free Quality Estimation of Food Grains using Deep Neural Network.",2019,"BMVC","researchgate.net","https://www.researchgate.net/profile/Prakhar-Kulshreshtha/publication/340261513_Annotation-free_Quality_Estimation_of_Food_Grains_using_Deep_Neural_Network/links/5e80588c299bf1a91b867afd/Annotation-free-Quality-Estimation-of-Food-Grains-using-Deep-Neural-Network.pdf","https://scholar.google.com/scholar?cites=5055457341657039914&as_sdt=2005&sciodt=2007&hl=en",47,"2022-07-14 12:30:32","PDF","","","",,,,,2,0.67,0,5,3,"… We are motivated by an urgent need in India for grain quality estimation to ensure transparency in … Novel augmentation techniques while training make the system robust to illumination …","https://www.researchgate.net/profile/Prakhar-Kulshreshtha/publication/340261513_Annotation-free_Quality_Estimation_of_Food_Grains_using_Deep_Neural_Network/links/5e80588c299bf1a91b867afd/Annotation-free-Quality-Estimation-of-Food-Grains-using-Deep-Neural-Network.pdf","https://scholar.google.com/scholar?q=related:KsSb0qqXKEYJ:scholar.google.com/&scioq=%22robust%22+%22neural+network%22+%22transparency%22&hl=en&as_sdt=2007"
21,"K Roy, SS Chaudhury, M Burman…","A Comparative study of Lung Cancer detection using supervised neural network",2019,"… Conference on Opto …","ieeexplore.ieee.org","https://ieeexplore.ieee.org/abstract/document/8862326/","https://scholar.google.com/scholar?cites=12923692199361722488&as_sdt=2005&sciodt=2007&hl=en",62,"2022-07-14 12:30:32","","","","",,,,,21,7.00,5,4,3,"… Saliency Enhancement has been done and using SURF(Speeded Up Robust Features) algorithm … Alpha, red green, blue are the constituents with Pixels are made , and transparency is …","","https://scholar.google.com/scholar?q=related:eDhxKZUtWrMJ:scholar.google.com/&scioq=%22robust%22+%22neural+network%22+%22transparency%22&hl=en&as_sdt=2007"
163,"S Ma, Y Liu","Nic: Detecting adversarial samples with neural network invariant checking",2019,"Proceedings of the 26th network and distributed system …","par.nsf.gov","https://par.nsf.gov/servlets/purl/10139597","https://scholar.google.com/scholar?cites=12362978451228515816&as_sdt=2005&sciodt=2007&hl=en",73,"2022-07-14 12:30:32","PDF","","","",,,,,163,54.33,82,2,3,"… More importantly, as shown in the evaluation section, our PI and VI methods are complementary, together constituting an effective and robust solution outperforming LID. …","https://par.nsf.gov/servlets/purl/10139597","https://scholar.google.com/scholar?q=related:6N1IR2YfkqsJ:scholar.google.com/&scioq=%22robust%22+%22neural+network%22+%22transparency%22&hl=en&as_sdt=2007"
12,"GH Lee, W Jin, D Alvarez-Melis…","Functional transparency for structured data: a game-theoretic approach",2019,"… on Machine Learning","proceedings.mlr.press","https://proceedings.mlr.press/v97/lee19b.html","https://scholar.google.com/scholar?cites=8825263024474993124&as_sdt=2005&sciodt=2007&hl=en",74,"2022-07-14 12:30:32","","","","",,,,,12,4.00,3,4,3,"… We provide a new approach to training neural models to exhibit transparency in a well-… between an unrestricted predictor such as a neural network, and a set of witnesses chosen from …","http://proceedings.mlr.press/v97/lee19b/lee19b.pdf","https://scholar.google.com/scholar?q=related:5LE4Z_aheXoJ:scholar.google.com/&scioq=%22robust%22+%22neural+network%22+%22transparency%22&hl=en&as_sdt=2007"
15,"B Ghiasi, H Sheikhian, A Zeynolabedin…","Granular computing–neural network model for prediction of longitudinal dispersion coefficients in rivers",2019,"Water Science and …","iwaponline.com","https://iwaponline.com/wst/article-abstract/80/10/1880/71820","https://scholar.google.com/scholar?cites=1646931938096000745&as_sdt=2005&sciodt=2007&hl=en",75,"2022-07-14 12:30:32","","","","",,,,,15,5.00,4,4,3,"… (GRC) approach and an artificial neural network (ANN) model. GRC … However, it suffers from a shortage of transparency and … The proposed method gives an exact and robust prediction, …","","https://scholar.google.com/scholar?q=related:6S51M98T2xYJ:scholar.google.com/&scioq=%22robust%22+%22neural+network%22+%22transparency%22&hl=en&as_sdt=2007"
27,"PV de Campos Souza, LCB Torres, AJ Guimaraes…","Data density-based clustering for regularized fuzzy neural networks based on nullneurons and robust activation function",2019,"Soft Computing","Springer","https://link.springer.com/article/10.1007/s00500-019-03792-z","https://scholar.google.com/scholar?cites=17489740728867693684&as_sdt=2005&sciodt=2007&hl=en",78,"2022-07-14 12:30:32","","10.1007/s00500-019-03792-z","","",,,,,27,9.00,7,4,3,"… neural network, where fuzzy neurons (Pedrycz 1993) replaces classical artificial neurons. Its main characteristic is transparency, … The fuzzy neural network described in this chapter …","https://scholar.google.com/scholar?output=instlink&q=info:dCTXPYcKuPIJ:scholar.google.com/&hl=en&as_sdt=2007&scillfp=1229353287455031545&oi=lle","https://scholar.google.com/scholar?q=related:dCTXPYcKuPIJ:scholar.google.com/&scioq=%22robust%22+%22neural+network%22+%22transparency%22&hl=en&as_sdt=2007"
37,"Y Yang, D Huang, X Dong","Enhanced neural network control of lower limb rehabilitation exoskeleton by add-on repetitive learning",2019,"Neurocomputing","Elsevier","https://www.sciencedirect.com/science/article/pii/S0925231218311731","https://scholar.google.com/scholar?cites=5875470774253442986&as_sdt=2005&sciodt=2007&hl=en",80,"2022-07-14 12:30:32","","","","",,,,,37,12.33,12,3,3,"This paper addresses neural network (NN) control of a lower limb exoskeleton for rehabilitation. Two control schemes are presented for exoskeleton to conduct trajectory tracking tasks, …","","https://scholar.google.com/scholar?q=related:qteQI4rdiVEJ:scholar.google.com/&scioq=%22robust%22+%22neural+network%22+%22transparency%22&hl=en&as_sdt=2007"
23,"Y Ji, D Liu, Y Guo","Adaptive neural network based position tracking control for dual-master/single-slave teleoperation system under communication constant time delays",2019,"ISA transactions","Elsevier","https://www.sciencedirect.com/science/article/pii/S0019057819301387","https://scholar.google.com/scholar?cites=3110915642115532410&as_sdt=2005&sciodt=2007&hl=en",87,"2022-07-14 12:30:32","","","","",,,,,23,7.67,8,3,3,"… The stability and transparency of the proposed teleoperators … Recently, the neural network (NN) have attracted more and … , NN control can be viewed as a robust approach, which can be …","","https://scholar.google.com/scholar?q=related:eqaATksxLCsJ:scholar.google.com/&scioq=%22robust%22+%22neural+network%22+%22transparency%22&hl=en&as_sdt=2007"
163,"Y Zuo, B Li, Y Zhao, Y Jiang, YC Chen, P Chen, GB Jo…","All-optical neural network with nonlinear activation functions",2019,"Optica","opg.optica.org","https://opg.optica.org/abstract.cfm?uri=optica-6-9-1132","https://scholar.google.com/scholar?cites=6875031174448121932&as_sdt=2005&sciodt=2007&hl=en",91,"2022-07-14 12:30:32","","","","",,,,,163,54.33,20,8,3,"… based on electromagnetically induced transparency (EIT) [30,… the supervised training of the neural network has been done … are error-tolerant and robust against small local random errors…","https://opg.optica.org/viewmedia.cfm?uri=optica-6-9-1132&seq=0&html=true","https://scholar.google.com/scholar?q=related:TIi3fG0EaV8J:scholar.google.com/&scioq=%22robust%22+%22neural+network%22+%22transparency%22&hl=en&as_sdt=2007"
616,"W Samek, G Montavon, A Vedaldi, LK Hansen…","Explainable AI: interpreting, explaining and visualizing deep learning",2019,"","books.google.com","https://books.google.com/books?hl=en&lr=&id=j5yuDwAAQBAJ&oi=fnd&pg=PR5&dq=%22robust%22+%22neural+network%22+%22transparency%22&ots=Iq7TWC0JbB&sig=AsYbqvtVBZsly7hBqxPwPDNdoT0","https://scholar.google.com/scholar?cites=18190755247532044678&as_sdt=2005&sciodt=2007&hl=en",96,"2022-07-14 12:30:32","BOOK","","","",,,,,616,205.33,123,5,3,"… are robust, reliable, … transparency, each requiring a different sort of explanation. Furthermore, it points to the possible dangers of transparency and discusses the relation of transparency …","","https://scholar.google.com/scholar?q=related:hnE41YSLcvwJ:scholar.google.com/&scioq=%22robust%22+%22neural+network%22+%22transparency%22&hl=en&as_sdt=2007"
39,"H Su, C Yang, H Mdeihly, A Rizzo, G Ferrigno…","Neural network enhanced robot tool identification and calibration for bilateral teleoperation",2019,"IEEE …","ieeexplore.ieee.org","https://ieeexplore.ieee.org/abstract/document/8805341/","https://scholar.google.com/scholar?cites=6373434039262602370&as_sdt=2005&sciodt=2007&hl=en",101,"2022-07-14 12:30:32","","","","",,,,,39,13.00,7,6,3,"… This paper presents a neural network (NN) enhanced robot tool identification and calibration … Additionally, the transparency of the system was demonstrated using the force and position …","https://ieeexplore.ieee.org/iel7/6287639/8600701/08805341.pdf","https://scholar.google.com/scholar?q=related:gmShpX38clgJ:scholar.google.com/&scioq=%22robust%22+%22neural+network%22+%22transparency%22&hl=en&as_sdt=2007"
64,"S Sharma, J Henderson, J Ghosh","Certifai: Counterfactual explanations for robustness, transparency, interpretability, and fairness of artificial intelligence models",2019,"arXiv preprint arXiv:1905.07857","arxiv.org","https://arxiv.org/abs/1905.07857","https://scholar.google.com/scholar?cites=6390174826079522896&as_sdt=2005&sciodt=2007&hl=en",108,"2022-07-14 12:30:32","","","","",,,,,64,21.33,21,3,3,"… A higher CERScore implies that the model is more robust. Note … We train a 4 layer neural network with an input layer, 2 … We train a 6 layer neural network with an input layer, 4 hidden …","https://arxiv.org/pdf/1905.07857","https://scholar.google.com/scholar?q=related:UBAd0SV2rlgJ:scholar.google.com/&scioq=%22robust%22+%22neural+network%22+%22transparency%22&hl=en&as_sdt=2007"
77,"NA Spielberg, M Brown, NR Kapania, JC Kegelman…","Neural network vehicle models for high-performance automated driving",2019,"Science robotics","science.org","https://www.science.org/doi/abs/10.1126/scirobotics.aaw1975","https://scholar.google.com/scholar?cites=14205907714166292094&as_sdt=2005&sciodt=2007&hl=en",115,"2022-07-14 12:30:32","","10.1126/scirobotics.aaw1975","","",,,,,77,25.67,15,5,3,"… models are useful in their transparency and intuition, they … , we propose a neural network structure using a sequence of … dispersion, which is a robust measure of each driven trajectory’s …","https://scholar.archive.org/work/jrnw7bj2r5gdtibsw4dehpt4ye/access/wayback/https://robotics.sciencemag.org/content/robotics/4/28/eaaw1975.full.pdf","https://scholar.google.com/scholar?q=related:fv7cxsyFJcUJ:scholar.google.com/&scioq=%22robust%22+%22neural+network%22+%22transparency%22&hl=en&as_sdt=2007"
20,"S Tolo, X Tian, N Bausch, V Becerra…","Robust on-line diagnosis tool for the early accident detection in nuclear power plants",2019,"Reliability Engineering & …","Elsevier","https://www.sciencedirect.com/science/article/pii/S0951832018304253","https://scholar.google.com/scholar?cites=15325489774412589067&as_sdt=2005&sciodt=2007&hl=en",117,"2022-07-14 12:30:32","","","","",,,,,20,6.67,4,5,3,"… issues, as the resulting neural network models are not very … for additional break sizes for neural network training. Overall, the … , the lack of transparency associated with their black-box …","https://livrepository.liverpool.ac.uk/3034058/1/robust-line-diagnosis_revised.pdf","https://scholar.google.com/scholar?q=related:C2i-fMATr9QJ:scholar.google.com/&scioq=%22robust%22+%22neural+network%22+%22transparency%22&hl=en&as_sdt=2007"
50,"A Abdalla, H Cen, L Wan, R Rashid, H Weng…","Fine-tuning convolutional neural network with transfer learning for semantic segmentation of ground-level oilseed rape images in a field with high weed pressure",2019,"… and electronics in …","Elsevier","https://www.sciencedirect.com/science/article/pii/S0168169919317107","https://scholar.google.com/scholar?cites=18054518077497912734&as_sdt=2005&sciodt=2007&hl=en",127,"2022-07-14 12:30:32","","","","",,,,,50,16.67,8,6,3,"… We overlaid the predicted results and the original images with a transparency of 0.4. … In summary, all transfer learning methods showed robust performance with the plant images …","","https://scholar.google.com/scholar?q=related:nq0h2IiIjvoJ:scholar.google.com/&scioq=%22robust%22+%22neural+network%22+%22transparency%22&hl=en&as_sdt=2007"
