Cites,Authors,Title,Year,Source,Publisher,ArticleURL,CitesURL,GSRank,QueryDate,Type,DOI,ISSN,CitationURL,Volume,Issue,StartPage,EndPage,ECC,CitesPerYear,CitesPerAuthor,AuthorCount,Age,Abstract,FullTextURL,RelatedURL
24,"F Huang, W Zhang, Z Chen, J Tang, W Song…","RBFNN-based adaptive sliding mode control design for nonlinear bilateral teleoperation system under time-varying delays",2019,"IEEE Access","ieeexplore.ieee.org","https://ieeexplore.ieee.org/abstract/document/8610299/","https://scholar.google.com/scholar?cites=6321204480297308068&as_sdt=2005&sciodt=2007&hl=en",147,"2022-07-14 12:30:32","","","","",,,,,24,8.00,4,6,3,"… and achieve good transparency performance (including … The neural-networkbased passivity control scheme with the … for the implementation of robust control algorithms via mature linear …","https://ieeexplore.ieee.org/iel7/6287639/6514899/08610299.pdf","https://scholar.google.com/scholar?q=related:pI-60PttuVcJ:scholar.google.com/&scioq=%22robust%22+%22neural+network%22+%22transparency%22&hl=en&as_sdt=2007"
11,"HG Han, JM Li, XL Wu, JF Qiao","Cooperative strategy for constructing interval type-2 fuzzy neural network",2019,"Neurocomputing","Elsevier","https://www.sciencedirect.com/science/article/pii/S0925231219308926","https://scholar.google.com/scholar?cites=1844737204415178828&as_sdt=2005&sciodt=2007&hl=en",150,"2022-07-14 12:30:32","","","","",,,,,11,3.67,3,4,3,"… neural network (FNN), combining the semantic transparency of a rule-based fuzzy system with the learning capability of neural network… the interval type-2 fuzzy neural network (IT2FNN), …","","https://scholar.google.com/scholar?q=related:TCgdrbbSmRkJ:scholar.google.com/&scioq=%22robust%22+%22neural+network%22+%22transparency%22&hl=en&as_sdt=2007"
12,"G Lanza, S Treber","Transparency increase in global production networks based on multi-method simulation and metamodeling techniques",2019,"CIRP Annals","Elsevier","https://www.sciencedirect.com/science/article/pii/S0007850619300125","https://scholar.google.com/scholar?cites=13630512023126538687&as_sdt=2005&sciodt=2007&hl=en",163,"2022-07-14 12:30:32","","","","",,,,,12,4.00,6,2,3,"… is no methodology for transparency increase which takes an … for transparency in global production networks which is robust … Artificial neural network proves to be the best prognosis …","","https://scholar.google.com/scholar?q=related:v_klrXdOKb0J:scholar.google.com/&scioq=%22robust%22+%22neural+network%22+%22transparency%22&hl=en&as_sdt=2007"
68,"CJ Wang, CA Hamm, LJ Savic, M Ferrante…","Deep learning for liver tumor diagnosis part II: convolutional neural network interpretation using radiologic imaging features",2019,"European …","Springer","https://link.springer.com/article/10.1007/s00330-019-06214-8","https://scholar.google.com/scholar?cites=5157033029687563249&as_sdt=2005&sciodt=2007&hl=en",168,"2022-07-14 12:30:32","","10.1007/s00330-019-06214-8","","",,,,,68,22.67,14,5,3,"… of all images were used to provide more robust estimates of the probability distributions. As … could provide researchers and clinicians with the transparency to identify when and how a …","https://www.ncbi.nlm.nih.gov/pmc/articles/PMC7243989/","https://scholar.google.com/scholar?q=related:8dN7pTd2kUcJ:scholar.google.com/&scioq=%22robust%22+%22neural+network%22+%22transparency%22&hl=en&as_sdt=2007"
32,"A Goel, A Agarwal, M Vatsa…","DeepRing: Protecting deep neural network with blockchain",2019,"Proceedings of the …","openaccess.thecvf.com","http://openaccess.thecvf.com/content_CVPRW_2019/html/BCMCVAI/Goel_DeepRing_Protecting_Deep_Neural_Network_With_Blockchain_CVPRW_2019_paper.html","https://scholar.google.com/scholar?cites=12720149079620977178&as_sdt=2005&sciodt=2007&hl=en",169,"2022-07-14 12:30:32","","","","",,,,,32,10.67,8,4,3,"… We first propose a model which uses the learned parameters of a typical deep neural network and is secured from external adversaries by cryptography and blockchain technology. As …","http://openaccess.thecvf.com/content_CVPRW_2019/papers/BCMCVAI/Goel_DeepRing_Protecting_Deep_Neural_Network_With_Blockchain_CVPRW_2019_paper.pdf","https://scholar.google.com/scholar?q=related:GgLSlDEMh7AJ:scholar.google.com/&scioq=%22robust%22+%22neural+network%22+%22transparency%22&hl=en&as_sdt=2007"
91,"M Wieland, Y Li, S Martinis","Multi-sensor cloud and cloud shadow segmentation with a convolutional neural network",2019,"Remote Sensing of Environment","Elsevier","https://www.sciencedirect.com/science/article/pii/S0034425719302159","https://scholar.google.com/scholar?cites=1002115851501900269&as_sdt=2005&sciodt=2007&hl=en",170,"2022-07-14 12:30:32","","","","",,,,,91,30.33,30,3,3,"… A more robust metric is Cohen's Kappa coefficient as it takes into account the possibility of … , whereas the SWIR wavelengths show improved atmospheric transparency and can aid in the …","https://elib.dlr.de/127745/1/rse_wieland_manuscript_clean_r1.pdf","https://scholar.google.com/scholar?q=related:7RGPuA476A0J:scholar.google.com/&scioq=%22robust%22+%22neural+network%22+%22transparency%22&hl=en&as_sdt=2007"
15,"A Plebe, M Da Lio, D Bortoluzzi","On reliable neural network sensorimotor control in autonomous vehicles",2019,"IEEE Transactions on …","ieeexplore.ieee.org","https://ieeexplore.ieee.org/abstract/document/8643729/","https://scholar.google.com/scholar?cites=522638001133156196&as_sdt=2005&sciodt=2007&hl=en",172,"2022-07-14 12:30:32","","","","",,,,,15,5.00,5,3,3,"… In particular, we show how to build a deep neural network for … the intelligibility of deep neural network components, we think … Brooks, “A robust layered control system for a mobile robot,” …","https://scholar.google.com/scholar?output=instlink&q=info:ZHepM37IQAcJ:scholar.google.com/&hl=en&as_sdt=2007&scillfp=15522659967100056854&oi=lle","https://scholar.google.com/scholar?q=related:ZHepM37IQAcJ:scholar.google.com/&scioq=%22robust%22+%22neural+network%22+%22transparency%22&hl=en&as_sdt=2007"
3,"TH Nguyen, TN Nguyen","Disease prediction using metagenomic data visualizations based on manifold learning and convolutional neural network",2019,"International Conference on Future Data and …","Springer","https://link.springer.com/chapter/10.1007/978-3-030-35653-8_9","https://scholar.google.com/scholar?cites=1553787216133919150&as_sdt=2005&sciodt=2007&hl=en",177,"2022-07-14 12:30:32","","10.1007/978-3-030-35653-8_9","","",,,,,3,1.00,2,2,3,"… data, many researchers have proposed robust algorithms to visualize features in 2D where … “transparency trick” that suffers from a large amount of overlapped points. The transparency …","","https://scholar.google.com/scholar?q=related:rpE0oj0pkBUJ:scholar.google.com/&scioq=%22robust%22+%22neural+network%22+%22transparency%22&hl=en&as_sdt=2007"
8,"GS Temponeras, SAN Alexandropoulos…","Financial fraudulent statements detection through a deep dense artificial neural network",2019,"2019 10th …","ieeexplore.ieee.org","https://ieeexplore.ieee.org/abstract/document/8900741/","https://scholar.google.com/scholar?cites=16461277543524139743&as_sdt=2005&sciodt=2007&hl=en",178,"2022-07-14 12:30:32","","","","",,,,,8,2.67,3,3,3,"… through a deep dense artificial neural network. Specifically, a … showed that the proposed scheme is robust and promising. … published financial data in order to ensure transparency. It is …","https://www.researchgate.net/profile/Stamatios-Aggelos-Alexandropoulos-2/publication/337501355_Financial_Fraudulent_Statements_Detection_through_a_Deep_Dense_Artificial_Neural_Network/links/5e95c09ea6fdcca7891571d3/Financial-Fraudulent-Statements-Detection-through-a-Deep-Dense-Artificial-Neural-Network.pdf","https://scholar.google.com/scholar?q=related:3wLf0rU0cuQJ:scholar.google.com/&scioq=%22robust%22+%22neural+network%22+%22transparency%22&hl=en&as_sdt=2007"
49,"Y Zhang, C Zhou, F Chang, AC Kot","Multi-resolution attention convolutional neural network for crowd counting",2019,"Neurocomputing","Elsevier","https://www.sciencedirect.com/science/article/pii/S0925231218312542","https://scholar.google.com/scholar?cites=8590081413707678991&as_sdt=2005&sciodt=2007&hl=en",179,"2022-07-14 12:30:32","","","","",,,,,49,16.33,12,4,3,"… This method is robust to variations of crowd density, velocity and direction of line-of-interest(… The transparency is set as 0.7 to display both the score map and the original image clearly. …","","https://scholar.google.com/scholar?q=related:D0W7l4gZNncJ:scholar.google.com/&scioq=%22robust%22+%22neural+network%22+%22transparency%22&hl=en&as_sdt=2007"
11,"N Bahrami, T Retson, K Blansit…","Automated selection of myocardial inversion time with a convolutional neural network: Spatial temporal ensemble myocardium inversion network (STEMI‐NET)",2019,"Magnetic resonance …","Wiley Online Library","https://onlinelibrary.wiley.com/doi/abs/10.1002/mrm.27680","https://scholar.google.com/scholar?cites=10644281594454978749&as_sdt=2005&sciodt=2007&hl=en",194,"2022-07-14 12:30:32","","10.1002/mrm.27680","","",,,,,11,3.67,3,4,3,"… generated to interpret the classification outcome and to increase the model’s transparency. … This network appears to be robust, even in the presence of scar in the myocardium, and …","https://www.ncbi.nlm.nih.gov/pmc/articles/PMC7962153/","https://scholar.google.com/scholar?q=related:vbC33rYVuJMJ:scholar.google.com/&scioq=%22robust%22+%22neural+network%22+%22transparency%22&hl=en&as_sdt=2007"
51,"V Lostanlen, J Salamon, A Farnsworth, S Kelling…","Robust sound event detection in bioacoustic sensor networks",2019,"PloS one","journals.plos.org","https://journals.plos.org/plosone/article?id=10.1371/journal.pone.0214168","https://scholar.google.com/scholar?cites=17381282033040764344&as_sdt=2005&sciodt=2007&hl=en",200,"2022-07-14 12:30:32","HTML","","","",,,,,51,17.00,10,5,3,"… First, we develop a new family of neural network architectures for sound event detection in heterogeneous environments. The commonality among these architectures is that they …","https://journals.plos.org/plosone/article?id=10.1371/journal.pone.0214168","https://scholar.google.com/scholar?q=related:uC1GSOu3NvEJ:scholar.google.com/&scioq=%22robust%22+%22neural+network%22+%22transparency%22&hl=en&as_sdt=2007"
39,"Y Tao, M Xu, Z Lu, Y Zhong","DenseNet-based depth-width double reinforced deep learning neural network for high-resolution remote sensing image per-pixel classification",2018,"Remote Sensing","mdpi.com","https://www.mdpi.com/294634","https://scholar.google.com/scholar?cites=7411921705731591280&as_sdt=2005&sciodt=2007&hl=en",4,"2022-07-14 12:30:32","","","","",,,,,39,9.75,10,4,4,"… neural network (CNN) are not sufficiently discriminative. Therefore, adopting extra classifiers for the hidden layers can increase its transparency [… more robust deep neural network using …","https://www.mdpi.com/2072-4292/10/5/779/pdf","https://scholar.google.com/scholar?q=related:cIwjdYVv3GYJ:scholar.google.com/&scioq=%22robust%22+%22neural+network%22+%22transparency%22&hl=en&as_sdt=2007"
992,"OI Abiodun, A Jantan, AE Omolara, KV Dada…","State-of-the-art in artificial neural network applications: A survey",2018,"Heliyon","Elsevier","https://www.sciencedirect.com/science/article/pii/S2405844018332067","https://scholar.google.com/scholar?cites=10529760063685861174&as_sdt=2005&sciodt=2007&hl=en",19,"2022-07-14 12:30:32","HTML","","","",,,,,992,248.00,198,5,4,"… Including developmental techniques that can improve designing of robust models, improving pattern transparency and allowing useful knowledge from trained ANNs. More also is the …","https://www.sciencedirect.com/science/article/pii/S2405844018332067","https://scholar.google.com/scholar?q=related:Nh8XJv04IZIJ:scholar.google.com/&scioq=%22robust%22+%22neural+network%22+%22transparency%22&hl=en&as_sdt=2007"
29,"PC Kumar, A Mandal","Enhancement of fault interpretation using multi-attribute analysis and artificial neural network (ANN) approach: A case study from Taranaki Basin, New Zealand",2018,"Exploration Geophysics","Taylor & Francis","https://www.tandfonline.com/doi/abs/10.1071/EG16072","https://scholar.google.com/scholar?cites=3160159698886795222&as_sdt=2005&sciodt=2007&hl=en",34,"2022-07-14 12:30:32","","10.1071/EG16072","","",,,,,29,7.25,15,2,4,"… work demonstrates an enhanced and robust workflow of fault … (fault probability cube) using an artificial neural network. A … The attribute is co-rendered by reducing 30% transparency …","","https://scholar.google.com/scholar?q=related:1h-nvYAk2ysJ:scholar.google.com/&scioq=%22robust%22+%22neural+network%22+%22transparency%22&hl=en&as_sdt=2007"
41,"W Xu, JM LeBeau","A deep convolutional neural network to analyze position averaged convergent beam electron diffraction patterns",2018,"Ultramicroscopy","Elsevier","https://www.sciencedirect.com/science/article/pii/S0304399117303340","https://scholar.google.com/scholar?cites=4342385723689704355&as_sdt=2005&sciodt=2007&hl=en",36,"2022-07-14 12:30:32","","","","",,,,,41,10.25,21,2,4,"… A methodology to explore the response of the neural network … the neural network with least squares fitting for even more robust … The crystals were thinned to electron transparency using …","https://www.sciencedirect.com/science/article/am/pii/S0304399117303340","https://scholar.google.com/scholar?q=related:o5tACs9AQzwJ:scholar.google.com/&scioq=%22robust%22+%22neural+network%22+%22transparency%22&hl=en&as_sdt=2007"
74,"K Amarasinghe, K Kenney…","Toward explainable deep neural network based anomaly detection",2018,"2018 11th International …","ieeexplore.ieee.org","https://ieeexplore.ieee.org/abstract/document/8430788/","https://scholar.google.com/scholar?cites=1640828786587330038&as_sdt=2005&sciodt=2007&hl=en",66,"2022-07-14 12:30:32","","","","",,,,,74,18.50,25,3,4,"… Transparency of the model refers to understanding what the … Transparency can be viewed in three parameters: 1) decomposability, 2) simulatability and 3) algorithmic transparency[34]. …","https://par.nsf.gov/servlets/purl/10084128","https://scholar.google.com/scholar?q=related:9uXFgRZlxRYJ:scholar.google.com/&scioq=%22robust%22+%22neural+network%22+%22transparency%22&hl=en&as_sdt=2007"
33,"M Rajchl, N Pawlowski, D Rueckert…","Neuronet: Fast and robust reproduction of multiple brain image segmentation pipelines",2018,"arXiv preprint arXiv …","arxiv.org","https://arxiv.org/abs/1806.04224","https://scholar.google.com/scholar?cites=360947233359919150&as_sdt=2005&sciodt=2007&hl=en",76,"2022-07-14 12:30:32","","","","",,,,,33,8.25,8,4,4,"… NeuroNet is a deep convolutional neural network mimicking multiple popular and state-of-the-art brain segmentation tools including FSL, SPM, and MALPEM. The network is trained on …","https://arxiv.org/pdf/1806.04224)","https://scholar.google.com/scholar?q=related:LvgTq5hXAgUJ:scholar.google.com/&scioq=%22robust%22+%22neural+network%22+%22transparency%22&hl=en&as_sdt=2007"
322,"M Babaee, DT Dinh, G Rigoll","A deep convolutional neural network for video sequence background subtraction",2018,"Pattern Recognition","Elsevier","https://www.sciencedirect.com/science/article/pii/S0031320317303928","https://scholar.google.com/scholar?cites=3020318288665880022&as_sdt=2005&sciodt=2007&hl=en",79,"2022-07-14 12:30:32","","","","",,,,,322,80.50,107,3,4,"… algorithms that assure robust background subtraction under … in the form of semi-transparency and motion blur, which are … moving pixels with semi-transparency and motion blur. In this …","","https://scholar.google.com/scholar?q=related:1qWLMHtT6ikJ:scholar.google.com/&scioq=%22robust%22+%22neural+network%22+%22transparency%22&hl=en&as_sdt=2007"
17,"X Teng, M Yan, AM Ertugrul, YR Lin","Deep into hypersphere: Robust and unsupervised anomaly discovery in dynamic networks",2018,"Proceedings of the Twenty …","par.nsf.gov","https://par.nsf.gov/biblio/10070284","https://scholar.google.com/scholar?cites=2643909413209483965&as_sdt=2005&sciodt=2007&hl=en",84,"2022-07-14 12:30:32","","","","",,,,,17,4.25,4,4,4,"… the systems are neglected (no transparency). More recent works … both the warning and transparency requirements. Secondly, … and therefore severely reduce the neural network’s quality. …","https://par.nsf.gov/servlets/purl/10070284","https://scholar.google.com/scholar?q=related:vaqpcJoNsSQJ:scholar.google.com/&scioq=%22robust%22+%22neural+network%22+%22transparency%22&hl=en&as_sdt=2007"
112,"A Das, A Dantcheva, F Bremond","Mitigating bias in gender, age and ethnicity classification: a multi-task convolution neural network approach",2018,"Proceedings of the …","openaccess.thecvf.com","http://openaccess.thecvf.com/content_eccv_2018_workshops/w5/html/Das_Mitigating_Bias_in_Gender_Age_and_Ethnicity_Classification_a_Multi-Task_ECCVW_2018_paper.html","https://scholar.google.com/scholar?cites=2778580274318282238&as_sdt=2005&sciodt=2007&hl=en",100,"2022-07-14 12:30:32","","","","",,,,,112,28.00,37,3,4,"… systems (ie, face recognition as a robust authentication method) has fueled increasingly the … Motivated by the above, we here propose a Multi-Task Convolution Neural Network (…","http://openaccess.thecvf.com/content_ECCVW_2018/papers/11129/Das_Mitigating_Bias_in_Gender_Age_and_Ethnicity_Classification_a_Multi-Task_ECCVW_2018_paper.pdf","https://scholar.google.com/scholar?q=related:_g2mtgmAjyYJ:scholar.google.com/&scioq=%22robust%22+%22neural+network%22+%22transparency%22&hl=en&as_sdt=2007"
124,"J Zhang, P Liu, F Zhang, Q Song","CloudNet: Ground‐based cloud classification with deep convolutional neural network",2018,"Geophysical Research …","Wiley Online Library","https://agupubs.onlinelibrary.wiley.com/doi/abs/10.1029/2018GL077787","https://scholar.google.com/scholar?cites=3889333333957322640&as_sdt=2005&sciodt=2007&hl=en",106,"2022-07-14 12:30:32","","10.1029/2018GL077787","","",,,,,124,31.00,31,4,4,"… In this letter, we propose a new convolutional neural network model, called CloudNet, for accurate ground‐based meteorological cloud classification. We build a ground‐based cloud …","https://agupubs.onlinelibrary.wiley.com/doi/pdf/10.1029/2018GL077787","https://scholar.google.com/scholar?q=related:kKechw-w-TUJ:scholar.google.com/&scioq=%22robust%22+%22neural+network%22+%22transparency%22&hl=en&as_sdt=2007"
24,"J Zhang, W Liu, L Li, Z Li","The master adaptive impedance control and slave adaptive neural network control in underwater manipulator uncertainty teleoperation",2018,"Ocean Engineering","Elsevier","https://www.sciencedirect.com/science/article/pii/S0029801818313763","https://scholar.google.com/scholar?cites=17699151016098992348&as_sdt=2005&sciodt=2007&hl=en",137,"2022-07-14 12:30:32","","","","",,,,,24,6.00,6,4,4,"… parameters through GL matrix, and robust slide mode control with adaptation law is employed to suppress the approximation error of neural network and the external disturbances. …","","https://scholar.google.com/scholar?q=related:3BCTNBMEoPUJ:scholar.google.com/&scioq=%22robust%22+%22neural+network%22+%22transparency%22&hl=en&as_sdt=2007"
18,"LCB da Silva, JLA Samatelo, MEV Segatto, JP Bazzo…","NARX neural network model for strong resolution improvement in a distributed temperature sensor",2018,"Applied …","opg.optica.org","https://opg.optica.org/abstract.cfm?uri=ao-57-20-5859","https://scholar.google.com/scholar?cites=17523922565130646594&as_sdt=2005&sciodt=2007&hl=en",149,"2022-07-14 12:30:32","","","","",,,,,18,4.50,4,5,4,"… input neural network. The developed model is composed of three steps: extraction of characteristics, regression, and reconstruction of the signal. Such an approach is robust because it …","https://opg.optica.org/AO/fulltext.cfm?uri=ao-57-20-5859","https://scholar.google.com/scholar?q=related:QnQQLrp6MfMJ:scholar.google.com/&scioq=%22robust%22+%22neural+network%22+%22transparency%22&hl=en&as_sdt=2007"
300,"O Li, H Liu, C Chen, C Rudin","Deep learning for case-based reasoning through prototypes: A neural network that explains its predictions",2018,"Proceedings of the AAAI Conference on …","ojs.aaai.org","https://ojs.aaai.org/index.php/AAAI/article/view/11771","https://scholar.google.com/scholar?cites=9109432256601623329&as_sdt=2005&sciodt=2007&hl=en",181,"2022-07-14 12:30:32","","","","",,,,,300,75.00,75,4,4,"… questions, interpretability (transparency) has become a key … problems with accountability and transparency of black box … and help to make the network robust to overfitting. The extent …","https://ojs.aaai.org/index.php/AAAI/article/download/11771/11630","https://scholar.google.com/scholar?q=related:IYs5oF80a34J:scholar.google.com/&scioq=%22robust%22+%22neural+network%22+%22transparency%22&hl=en&as_sdt=2007"
1,"A Mikolajczyk, M Grochowski…","Optimal selection of input features and an acompanying neural network structure for the classification purposes-skin lesions case study",2018,"2018 23rd International …","ieeexplore.ieee.org","https://ieeexplore.ieee.org/abstract/document/8485936/","https://scholar.google.com/scholar?cites=13875749938330105602&as_sdt=2005&sciodt=2007&hl=en",186,"2022-07-14 12:30:32","","","","",,,,,1,0.25,0,3,4,"… From the other hand more features not always imply an improvement in terms of efficiency of the diagnosis and its transparency. Hence, in this paper we survey the kind of features …","https://www.researchgate.net/profile/Agnieszka-Mikolajczyk-3/publication/328246087_Optimal_Selection_of_Input_Features_and_an_Acompanying_Neural_Network_Structure_for_the_Classification_Purposes_-_Skin_Lesions_Case_Study/links/5d5d5689299bf1b97cfc9e7b/Optimal-Selection-of-Input-Features-and-an-Acompanying-Neural-Network-Structure-for-the-Classification-Purposes-Skin-Lesions-Case-Study.pdf","https://scholar.google.com/scholar?q=related:AndQUg2RkMAJ:scholar.google.com/&scioq=%22robust%22+%22neural+network%22+%22transparency%22&hl=en&as_sdt=2007"
0,"X Zhang, Y Zhang, G Qian, H Zhao","Planar Motion Deblurring from Dual Images Using Transparency",2018,"Proceedings of the 2018 …","dl.acm.org","https://dl.acm.org/doi/abs/10.1145/3303714.3303749","",190,"2022-07-14 12:30:32","","10.1145/3303714.3303749","","",,,,,0,0.00,0,4,4,"… a robust cost function which takes two blurred alpha images as input to iteratively optimize the motion parameters. Then, the binary transparency … -scale convolutional neural network to …","","https://scholar.google.com/scholar?q=related:V8dqzXx6aVAJ:scholar.google.com/&scioq=%22robust%22+%22neural+network%22+%22transparency%22&hl=en&as_sdt=2007"
4,"M Esfandiari, S Sadeghnejad…","Robust nonlinear neural network-based control of a haptic interaction with an admittance type virtual environment",2017,"2017 5th RSI …","ieeexplore.ieee.org","https://ieeexplore.ieee.org/abstract/document/8466196/?casa_token=2f_OL7Ov18EAAAAA:lBpVXOFrzAHtoEgfn9a5s-twPAP3fmMzRqcEwZWnnol7XvCe9ZUmhcWahK0Tb0kEiX5gQd_mBA","https://scholar.google.com/scholar?cites=5150010344431575647&as_sdt=2005&sciodt=2007&hl=en",3,"2022-07-14 12:30:32","","","","",,,,,4,0.80,1,3,5,"… Figures that the proposed neural network control scheme has … Lyapunov stability criteria, the transparency, as a conspicuous … we can investigate the system transparency, one can easily …","https://ieeexplore.ieee.org/iel7/8454840/8466131/08466196.pdf?casa_token=WBnGowmXgBkAAAAA:p8C914p7NBLykXBTjyEjfNG5wSmsKbP_0EhPm2aQdwlZpgTuM314TuuyMIe7NyiBz1DUL-Q-nw","https://scholar.google.com/scholar?q=related:X2JuUR-DeEcJ:scholar.google.com/&scioq=%22robust%22+%22neural+network%22+%22transparency%22&hl=en&as_sdt=2007"
13,"JX Liu, X Wen, LM Yuan, HX Xu","A robust approach of watermarking in contourlet domain based on probabilistic neural network",2017,"Multimedia Tools and Applications","Springer","https://idp.springer.com/authorize/casa?redirect_uri=https://link.springer.com/article/10.1007/s11042-016-4178-4&casa_token=A2reB8T3_vEAAAAA:yGOH90xcrdFWhMp05TeCIj9-4R-7z2dWqZhjtdjKqjaM_HRf0zP8qdn1jteTUl9f13ukYOJrxqT0_yWwgw","https://scholar.google.com/scholar?cites=14767699395025465&as_sdt=2005&sciodt=2007&hl=en",7,"2022-07-14 12:30:32","HTML","10.1007/s11042-016-4178-4","","",,,,,13,2.60,3,4,5,"… (CT) has been proposed based on probabilistic neural network(PNN) in this paper. In the … neural network system for training. Fastly, after training, the trained system will be robust for …","https://idp.springer.com/authorize/casa?redirect_uri=https://link.springer.com/article/10.1007/s11042-016-4178-4&casa_token=A2reB8T3_vEAAAAA:yGOH90xcrdFWhMp05TeCIj9-4R-7z2dWqZhjtdjKqjaM_HRf0zP8qdn1jteTUl9f13ukYOJrxqT0_yWwgw","https://scholar.google.com/scholar?q=related:ORqX9CR3NAAJ:scholar.google.com/&scioq=%22robust%22+%22neural+network%22+%22transparency%22&hl=en&as_sdt=2007"
13,"MA Sassi, MJD Otis…","Active stability observer using artificial neural network for intuitive physical human–robot interaction",2017,"International journal of …","journals.sagepub.com","https://journals.sagepub.com/doi/abs/10.1177/1729881417727326","https://scholar.google.com/scholar?cites=10336272991482055745&as_sdt=2005&sciodt=2007&hl=en",50,"2022-07-14 12:30:32","","10.1177/1729881417727326","","",,,,,13,2.60,4,3,5,"… may present an obstacle to transparency and operations’ … using a three-layered neural network controller, a strain … found that the neural network control system was robust against …","https://journals.sagepub.com/doi/pdf/10.1177/1729881417727326","https://scholar.google.com/scholar?q=related:QYzAloXRcY8J:scholar.google.com/&scioq=%22robust%22+%22neural+network%22+%22transparency%22&hl=en&as_sdt=2007"
