Cites,Authors,Title,Year,Source,Publisher,ArticleURL,CitesURL,GSRank,QueryDate,Type,DOI,ISSN,CitationURL,Volume,Issue,StartPage,EndPage,ECC,CitesPerYear,CitesPerAuthor,AuthorCount,Age,Abstract,FullTextURL,RelatedURL
244,"MY Chow, RN Sharpe, JC Hung","On the application and design of artificial neural networks for motor fault detection. II",1993,"IEEE Transactions on …","ieeexplore.ieee.org","https://ieeexplore.ieee.org/abstract/document/222640/","https://scholar.google.com/scholar?cites=404100102212241863&as_sdt=2005&sciodt=2007&hl=en",64,"2022-07-13 13:50:13","","","","",,,,,244,8.41,81,3,29,"… for the neural network to perform fault detection, which helps to increase its robustness to … Fuzzy logic [601-[63] provides a means of transferring heuristic reasoning into mathematics. …","https://repository.lib.ncsu.edu/bitstream/handle/1840.2/646/chow_1993_ieee_transactions_industrial_electronics_189.pdf?sequence=1","https://scholar.google.com/scholar?q=related:x0kP5uammwUJ:scholar.google.com/&scioq=%22robustness%22+%22neural+network%22+%22reasoning%22&hl=en&as_sdt=2007"
7,"THP Jensen, HT Schmidt, ND Bodin…","Parking space verification: improving robustness using a convolutional neural network",2018,"… on Computer Vision …","vbn.aau.dk","https://vbn.aau.dk/en/publications/parking-space-verification-improving-robustness-using-a-convoluti","https://scholar.google.com/scholar?cites=5699969308306318835&as_sdt=2005&sciodt=2007&hl=en",65,"2022-07-13 13:50:13","","","","",,,,,7,1.75,2,4,4,"… The reasoning behind it, is that the exact position of a found feature is not as important, as … Optimization The last part of the network, is the fully connected Neural Network followed by a …","https://vbn.aau.dk/ws/files/244496579/Parking.pdf","https://scholar.google.com/scholar?q=related:8yU63OJbGk8J:scholar.google.com/&scioq=%22robustness%22+%22neural+network%22+%22reasoning%22&hl=en&as_sdt=2007"
826,"E Perez, F Strub, H De Vries, V Dumoulin…","Film: Visual reasoning with a general conditioning layer",2018,"Proceedings of the …","ojs.aaai.org","https://ojs.aaai.org/index.php/AAAI/article/view/11671","https://scholar.google.com/scholar?cites=14710363985853844282&as_sdt=2005&sciodt=2007&hl=en",66,"2022-07-13 13:50:13","","","","",,,,,826,206.50,165,5,4,"… reasoning, FiLM layers enable a Recurrent Neural Network (RNN) over an input question to influence Convolutional Neural Network … , supporting FiLM’s overall robustness. Table 3 also …","https://ojs.aaai.org/index.php/AAAI/article/view/11671/11530","https://scholar.google.com/scholar?q=related:OouENRu2JcwJ:scholar.google.com/&scioq=%22robustness%22+%22neural+network%22+%22reasoning%22&hl=en&as_sdt=2007"
60,"M Han, ZJ Cao","An improved case-based reasoning method and its application in endpoint prediction of basic oxygen furnace",2015,"Neurocomputing","Elsevier","https://www.sciencedirect.com/science/article/pii/S092523121401159X","https://scholar.google.com/scholar?cites=2199761314146776448&as_sdt=2005&sciodt=2007&hl=en",67,"2022-07-13 13:50:13","","","","",,,,,60,8.57,30,2,7,"… , the proposed method in this paper still guarantees a strong learning ability and good robustness. … Her current research interests are neural network and chaos and their applications to …","","https://scholar.google.com/scholar?q=related:gHVdqEIfhx4J:scholar.google.com/&scioq=%22robustness%22+%22neural+network%22+%22reasoning%22&hl=en&as_sdt=2007"
86,"F Wenzel, J Snoek, D Tran…","Hyperparameter ensembles for robustness and uncertainty quantification",2020,"Advances in Neural …","proceedings.neurips.cc","https://proceedings.neurips.cc/paper/2020/hash/481fbfa59da2581098e841b7afc122f1-Abstract.html","https://scholar.google.com/scholar?cites=10557490280160922182&as_sdt=2005&sciodt=2007&hl=en",68,"2022-07-13 13:50:13","","","","",,,,,86,43.00,22,4,2,"… of a neural network, leveraging Markov chain Monte Carlo for inference [37… neural network ensembles within the context of neural architecture search, showing improved robustness for …","https://proceedings.neurips.cc/paper/2020/file/481fbfa59da2581098e841b7afc122f1-Paper.pdf","https://scholar.google.com/scholar?q=related:RoqhTHm9g5IJ:scholar.google.com/&scioq=%22robustness%22+%22neural+network%22+%22reasoning%22&hl=en&as_sdt=2007"
27,"JM Renders, A Goosens, F de Viron…","A prototype neural network to perform early warning in nuclear power plant",1995,"Fuzzy sets and …","Elsevier","https://www.sciencedirect.com/science/article/pii/016501149500015D","https://scholar.google.com/scholar?cites=7007376149521618956&as_sdt=2005&sciodt=2007&hl=en",69,"2022-07-13 13:50:13","","","","",,,,,27,1.00,7,4,27,"… to understand the behaviour (or the reasoning) of the neural network which leads it to draw some … Some open questions remain open after this study: • the robustness of the proposed …","","https://scholar.google.com/scholar?q=related:DNjHN3szP2EJ:scholar.google.com/&scioq=%22robustness%22+%22neural+network%22+%22reasoning%22&hl=en&as_sdt=2007"
25,"TC Wang, YZ Xie, H Yan","Research of multi sensor information fusion technology based on extension neural network",2016,"Mathematical Modelling of Engineering …","iieta.org","https://iieta.org/sites/default/files/Journals/MMEP/03.3_03.pdf","https://scholar.google.com/scholar?cites=18189438548017852211&as_sdt=2005&sciodt=2007&hl=en",70,"2022-07-13 13:50:13","PDF","","","",,,,,25,4.17,8,3,6,"… judgments and improve the system's robustness. This paper proposed a kind of new reasoning method by combining the extension theory and neural network, and established fusion …","https://iieta.org/sites/default/files/Journals/MMEP/03.3_03.pdf","https://scholar.google.com/scholar?q=related:M69m1vzdbfwJ:scholar.google.com/&scioq=%22robustness%22+%22neural+network%22+%22reasoning%22&hl=en&as_sdt=2007"
89,"X Sun, H Khedr, Y Shoukry","Formal verification of neural network controlled autonomous systems",2019,"Proceedings of the 22nd ACM International …","dl.acm.org","https://dl.acm.org/doi/abs/10.1145/3302504.3311802","https://scholar.google.com/scholar?cites=5912594476292631974&as_sdt=2005&sciodt=2007&hl=en",71,"2022-07-13 13:50:13","","10.1145/3302504.3311802","","",,,,,89,29.67,30,3,3,"… focus mainly on the robustness of the learning algorithm with … reasoning about the behavior of the neural network controller. Thanks to the ReLU activation functions in the neural network…","https://dl.acm.org/doi/pdf/10.1145/3302504.3311802","https://scholar.google.com/scholar?q=related:pu1blFnBDVIJ:scholar.google.com/&scioq=%22robustness%22+%22neural+network%22+%22reasoning%22&hl=en&as_sdt=2007"
18,"J Zhang, J Li","Testing and verification of neural-network-based safety-critical control software: A systematic literature review",2020,"Information and Software Technology","Elsevier","https://www.sciencedirect.com/science/article/pii/S0950584920300471","https://scholar.google.com/scholar?cites=16051878710082569144&as_sdt=2005&sciodt=2007&hl=en",72,"2022-07-13 13:50:13","HTML","","","",,,,,18,9.00,9,2,2,"… One high-order theme of the studies is to assure the robustness of NNs. Robustness of an … One interesting work [119] used an additional NN module that is fit for relational reasoning to …","https://www.sciencedirect.com/science/article/pii/S0950584920300471","https://scholar.google.com/scholar?q=related:uIMg7KO6w94J:scholar.google.com/&scioq=%22robustness%22+%22neural+network%22+%22reasoning%22&hl=en&as_sdt=2007"
0,"JYM Cheung, GS Virk","Robustness of Neural Network Model for the Thermal Dynamics in Buildings",1995,"Safety, Reliability and Applications of Emerging …","Elsevier","https://www.sciencedirect.com/science/article/pii/B9780080423746500389","",73,"2022-07-13 13:50:13","","","","",,,,,0,0.00,0,2,27,"… This paper examines the robustness of a neural network (NN) which models a full scale built environmental chamber. The chamber is subject to significant stochastic effects due to …","","https://scholar.google.com/scholar?q=related:n-MA4MBpng8J:scholar.google.com/&scioq=%22robustness%22+%22neural+network%22+%22reasoning%22&hl=en&as_sdt=2007"
105,"D Yu, X Li, C Zhang, T Liu, J Han…","Towards accurate scene text recognition with semantic reasoning networks",2020,"Proceedings of the …","openaccess.thecvf.com","http://openaccess.thecvf.com/content_CVPR_2020/html/Yu_Towards_Accurate_Scene_Text_Recognition_With_Semantic_Reasoning_Networks_CVPR_2020_paper.html","https://scholar.google.com/scholar?cites=11354369544150122788&as_sdt=2005&sciodt=2007&hl=en",74,"2022-07-13 13:50:13","","","","",,,,,105,52.50,18,6,2,"… , where a global semantic reasoning module (GSRM) is … text, verify the effectiveness and robustness of the proposed method. In … An end-to-end trainable neural network for image-based …","https://openaccess.thecvf.com/content_CVPR_2020/papers/Yu_Towards_Accurate_Scene_Text_Recognition_With_Semantic_Reasoning_Networks_CVPR_2020_paper.pdf","https://scholar.google.com/scholar?q=related:JAGVP_HSkp0J:scholar.google.com/&scioq=%22robustness%22+%22neural+network%22+%22reasoning%22&hl=en&as_sdt=2007"
163,"I Donadello, L Serafini, ADA Garcez","Logic tensor networks for semantic image interpretation",2017,"arXiv preprint arXiv:1705.08968","arxiv.org","https://arxiv.org/abs/1705.08968","https://scholar.google.com/scholar?cites=10139831991143783403&as_sdt=2005&sciodt=2007&hl=en",75,"2022-07-13 13:50:13","","","","",,,,,163,32.60,54,3,5,"… have been developed for reasoning under uncertainty and … In [22], a neural network is built integrating visual features … We also evaluate the robustness of our approach with respect …","https://arxiv.org/pdf/1705.08968","https://scholar.google.com/scholar?q=related:61tECnnrt4wJ:scholar.google.com/&scioq=%22robustness%22+%22neural+network%22+%22reasoning%22&hl=en&as_sdt=2007"
1,"N Franco, T Wollschlaeger, N Gao, JM Lorenz…","Quantum Robustness Verification: A Hybrid Quantum-Classical Neural Network Certification Algorithm",2022,"arXiv preprint arXiv …","arxiv.org","https://arxiv.org/abs/2205.00900","https://scholar.google.com/scholar?cites=8025431727335768767&as_sdt=2005&sciodt=2007&hl=en",76,"2022-07-13 13:50:13","","","","",,,,,1,1.00,0,5,1,"… Adversarial Robustness The research field can be divided … verification methods focus on reasoning about the adversarial … where it fails to verify robustness even though the prediction of …","https://arxiv.org/pdf/2205.00900","https://scholar.google.com/scholar?q=related:v4L_rKIPYG8J:scholar.google.com/&scioq=%22robustness%22+%22neural+network%22+%22reasoning%22&hl=en&as_sdt=2007"
1735,"KY Tam, MY Kiang","Managerial applications of neural networks: the case of bank failure predictions",1992,"Management science","pubsonline.informs.org","https://pubsonline.informs.org/doi/abs/10.1287/mnsc.38.7.926","https://scholar.google.com/scholar?cites=8387763785444616850&as_sdt=2005&sciodt=2007&hl=en",77,"2022-07-13 13:50:13","","10.1287/mnsc.38.7.926","","",,,,,1735,57.83,868,2,30,"This paper introduces a neural-net approach to perform discriminant analysis in business research. A neural net represents a nonlinear discriminant function as a pattern of connections …","https://scholar.google.com/scholar?output=instlink&q=info:kupP-7hSZ3QJ:scholar.google.com/&hl=en&as_sdt=2007&scillfp=17252008742510507301&oi=lle","https://scholar.google.com/scholar?q=related:kupP-7hSZ3QJ:scholar.google.com/&scioq=%22robustness%22+%22neural+network%22+%22reasoning%22&hl=en&as_sdt=2007"
0,"D Janke, DV Anderson","Improving Robustness In Analog Neural Networks By Introducing Sparse Connectivity",2021,"2021 55th Asilomar Conference on …","ieeexplore.ieee.org","https://ieeexplore.ieee.org/abstract/document/9723330/","",78,"2022-07-13 13:50:13","","","","",,,,,0,0.00,0,2,1,"… We simulated multiple initializations of a neural network that were trained and pruned using … Our reasoning was that zeroing so many of the dimensions at once would cause the path to …","","https://scholar.google.com/scholar?q=related:E8rDnTNi2yEJ:scholar.google.com/&scioq=%22robustness%22+%22neural+network%22+%22reasoning%22&hl=en&as_sdt=2007"
0,"SA Schober, Y Bahri, C Carbonelli, R Wille","Neural Network Robustness Analysis Using Sensor Simulations for a Graphene-Based Semiconductor Gas Sensor",2022,"Chemosensors","mdpi.com","https://www.mdpi.com/article/10.3390/chemosensors10050152","",79,"2022-07-13 13:50:13","","10.3390/chemosensors10050152","","",,,,,0,0.00,0,4,1,"… In this work, we propose a characterization scheme to analyze the robustness of different machine learning models for a chemiresistive gas sensor based on a sensor simulation model. …","https://www.mdpi.com/2227-9040/10/5/152/pdf?version=1650599899","https://scholar.google.com/scholar?q=related:uITTFGi2QCcJ:scholar.google.com/&scioq=%22robustness%22+%22neural+network%22+%22reasoning%22&hl=en&as_sdt=2007"
0,"JA Marin, CK Ray, J Brockhaus…","Assessing the robustness of neural network classifiers",1998,"SMC'98 Conference …","ieeexplore.ieee.org","https://ieeexplore.ieee.org/abstract/document/727514/","",80,"2022-07-13 13:50:13","","","","",,,,,0,0.00,0,4,24,"… by automated reasoning systems if … for robustness and generalization of neural networks has not been reported in the literature [4]. Similarly, a system involving a trained neural network …","","https://scholar.google.com/scholar?q=related:NErmFw3mJYgJ:scholar.google.com/&scioq=%22robustness%22+%22neural+network%22+%22reasoning%22&hl=en&as_sdt=2007"
78,"KY Cai, L Zhang","Fuzzy reasoning as a control problem",2008,"IEEE Transactions on fuzzy systems","ieeexplore.ieee.org","https://ieeexplore.ieee.org/abstract/document/4374114/","https://scholar.google.com/scholar?cites=1179528882352337784&as_sdt=2005&sciodt=2007&hl=en",81,"2022-07-13 13:50:13","","","","",,,,,78,5.57,39,2,14,"… feedback mechanism to improve the robustness of fuzzy reasoning. The fuzzy rule base … recurrent neural network or the neurons thereof backward to the inputs of the neural network or …","https://scholar.google.com/scholar?output=instlink&q=info:eLPs4kSHXhAJ:scholar.google.com/&hl=en&as_sdt=2007&scillfp=886707765985134350&oi=lle","https://scholar.google.com/scholar?q=related:eLPs4kSHXhAJ:scholar.google.com/&scioq=%22robustness%22+%22neural+network%22+%22reasoning%22&hl=en&as_sdt=2007"
20,"J Zhang, C Song, Y Hu, B Yu","Improving robustness of robotic grasping by fusing multi-sensor",2012,"2012 IEEE International …","researchgate.net","https://www.researchgate.net/profile/Jun-Zhang-166/publication/259823854_2012-MFI-ZhangJun/links/0c96052e07b9de02ce000000/2012-MFI-ZhangJun.pdf","https://scholar.google.com/scholar?cites=2407203258309341412&as_sdt=2005&sciodt=2007&hl=en",82,"2022-07-13 13:50:13","PDF","","","",,,,,20,2.00,5,4,10,"… The second layer, third layer and fourth layer corresponding to fuzzification, fuzzy reasoning and defuzzification process. BP algorithm is used to train the neural network, and the system …","https://www.researchgate.net/profile/Jun-Zhang-166/publication/259823854_2012-MFI-ZhangJun/links/0c96052e07b9de02ce000000/2012-MFI-ZhangJun.pdf","https://scholar.google.com/scholar?q=related:5PCwCZwaaCEJ:scholar.google.com/&scioq=%22robustness%22+%22neural+network%22+%22reasoning%22&hl=en&as_sdt=2007"
10,"A Chan, L Ma, F Juefei-Xu, YS Ong…","Breaking neural reasoning architectures with metamorphic relation-based adversarial examples",2021,"… on Neural Networks …","ieeexplore.ieee.org","https://ieeexplore.ieee.org/abstract/document/9411718/","https://scholar.google.com/scholar?cites=5175821064491577031&as_sdt=2005&sciodt=2007&hl=en",83,"2022-07-13 13:50:13","","","","",,,,,10,10.00,2,5,1,"… methods to improve robustness in other NLP applications. … world, the generality of robustness gained from our method … in modern neural reasoning architectures with adversarial …","https://ink.library.smu.edu.sg/cgi/viewcontent.cgi?article=8053&context=sis_research","https://scholar.google.com/scholar?q=related:xy4B4tU11EcJ:scholar.google.com/&scioq=%22robustness%22+%22neural+network%22+%22reasoning%22&hl=en&as_sdt=2007"
26,"C Quek, RW Zhou","Structure and learning algorithms of a nonsingleton input fuzzy neural network based on the approximate analogical reasoning schema",2006,"Fuzzy sets and systems","Elsevier","https://www.sciencedirect.com/science/article/pii/S0165011405006044","https://scholar.google.com/scholar?cites=18287457646720177827&as_sdt=2005&sciodt=2007&hl=en",84,"2022-07-13 13:50:13","","","","",,,,,26,1.63,13,2,16,"… This gives the proposed nonsingleton fuzzifier POPFNN–AARS greater robustness even in an … In addition, an extensive study of the robustness of the nonsingleton fuzzifier POPFNN–…","https://www.academia.edu/download/68629698/j.fss.2005.12.01020210805-25605-1ulk0hp.pdf","https://scholar.google.com/scholar?q=related:o9bBrdYZyv0J:scholar.google.com/&scioq=%22robustness%22+%22neural+network%22+%22reasoning%22&hl=en&as_sdt=2007"
1,"Z Liuyang, S Yuwen, T Pengcheng…","A fault diagnosis modeling method combined RBF neural network with rough set theory",2009,"2009 ISECS …","ieeexplore.ieee.org","https://ieeexplore.ieee.org/abstract/document/5267479/","https://scholar.google.com/scholar?cites=12229553927932485375&as_sdt=2005&sciodt=2007&hl=en",85,"2022-07-13 13:50:13","","","","",,,,,1,0.08,0,4,13,"… solutions such as logical reasoning, neural network, expert system… The method takes full advantage of the neural network’s … can detect the composed faults while keep good robustness. …","https://scholar.google.com/scholar?output=instlink&q=info:_x7mo4AauKkJ:scholar.google.com/&hl=en&as_sdt=2007&scillfp=4944415806883702105&oi=lle","https://scholar.google.com/scholar?q=related:_x7mo4AauKkJ:scholar.google.com/&scioq=%22robustness%22+%22neural+network%22+%22reasoning%22&hl=en&as_sdt=2007"
0,"SК Kim, HS Oh","Robustness of Predictive Learning Systems under Changes in Regime",,"","","","",86,"2022-07-13 13:50:13","CITATION","","","",,,,,0,0.00,0,2,,"","","https://scholar.google.com/scholar?q=related:LZRd4IrtETAJ:scholar.google.com/&scioq=%22robustness%22+%22neural+network%22+%22reasoning%22&hl=en&as_sdt=2007"
125,"L Xu, S Liu","Study of short-term water quality prediction model based on wavelet neural network",2013,"Mathematical and Computer Modelling","Elsevier","https://www.sciencedirect.com/science/article/pii/S0895717712003676","https://scholar.google.com/scholar?cites=14876978283889030067&as_sdt=2005&sciodt=2007&hl=en",87,"2022-07-13 13:50:13","HTML","","","",,,,,125,13.89,63,2,9,"… wavelet neural network is superior to the BP neural network and the Elman neural network. … , improved predict accuracy, and strong robustness. The model can predict water quality …","https://www.sciencedirect.com/science/article/pii/S0895717712003676","https://scholar.google.com/scholar?q=related:s_Nndu2kdc4J:scholar.google.com/&scioq=%22robustness%22+%22neural+network%22+%22reasoning%22&hl=en&as_sdt=2007"
0,"G Kishan","Probabilistic Robustness Quantification of Neural Networks",2021,"Proceedings of the AAAI Conference on Artificial …","ojs.aaai.org","https://ojs.aaai.org/index.php/AAAI/article/view/17979","",88,"2022-07-13 13:50:13","","","","",,,,,0,0.00,0,1,1,"… Quantification of their robustness against uncertainties is an upcoming area of research. In … Given a trained neural network, we quantify the probability of the model to make errors on a …","https://ojs.aaai.org/index.php/AAAI/article/view/17979/17784","https://scholar.google.com/scholar?q=related:AmuEEmGIXkoJ:scholar.google.com/&scioq=%22robustness%22+%22neural+network%22+%22reasoning%22&hl=en&as_sdt=2007"
14,"F Da","Fuzzy neural network sliding mode control for long delay time systems based on fuzzy prediction",2008,"Neural Computing and Applications","Springer","https://link.springer.com/article/10.1007/s00521-007-0130-x","https://scholar.google.com/scholar?cites=16518090133956942422&as_sdt=2005&sciodt=2007&hl=en",89,"2022-07-13 13:50:13","","10.1007/s00521-007-0130-x","","",,,,,14,1.00,14,1,14,"… neural network sliding mode controller (FNNSMC), which incorporates the fuzzy neural network (… The FNNSMC has more robustness due to the abilities of the learning and reasoning …","https://scholar.google.com/scholar?output=instlink&q=info:Vlpj0nULPOUJ:scholar.google.com/&hl=en&as_sdt=2007&scillfp=3900104385354941946&oi=lle","https://scholar.google.com/scholar?q=related:Vlpj0nULPOUJ:scholar.google.com/&scioq=%22robustness%22+%22neural+network%22+%22reasoning%22&hl=en&as_sdt=2007"
35,"IG Ali, YT Chen","Design quality and robustness with neural networks",1999,"IEEE Transactions on Neural Networks","ieeexplore.ieee.org","https://ieeexplore.ieee.org/abstract/document/809098/","https://scholar.google.com/scholar?cites=852827325289248755&as_sdt=2005&sciodt=2007&hl=en",90,"2022-07-13 13:50:13","","","","",,,,,35,1.52,18,2,23,"… In this section we describe the details of the neural-network … ing data for the neural-network model: normalization, … neural networks and symbolic reasoning models is knowledge-based …","https://citeseerx.ist.psu.edu/viewdoc/download?doi=10.1.1.33.2056&rep=rep1&type=pdf","https://scholar.google.com/scholar?q=related:87ecEu_Z1QsJ:scholar.google.com/&scioq=%22robustness%22+%22neural+network%22+%22reasoning%22&hl=en&as_sdt=2007"
30,"A Bennetot, JL Laurent, R Chatila…","Towards explainable neural-symbolic visual reasoning",2019,"arXiv preprint arXiv …","arxiv.org","https://arxiv.org/abs/1909.09065","https://scholar.google.com/scholar?cites=642569581777205285&as_sdt=2005&sciodt=2007&hl=en",91,"2022-07-13 13:50:13","","","","",,,,,30,10.00,8,4,3,"… , ii) interpretability facilitates the provision of robustness by highlighting potential adversarial … with a neural network can provide explanations close to the functioning of human reasoning …","https://arxiv.org/pdf/1909.09065","https://scholar.google.com/scholar?q=related:JThNUaHd6ggJ:scholar.google.com/&scioq=%22robustness%22+%22neural+network%22+%22reasoning%22&hl=en&as_sdt=2007"
36,"LA Zadeh","The role of fuzzy logic and soft computing in the conception and design of intelligent systems",1993,"Austrian Conference on Fuzzy Logic in Artificial …","Springer","https://link.springer.com/chapter/10.1007/3-540-56920-0_1","https://scholar.google.com/scholar?cites=15495928046442272128&as_sdt=2005&sciodt=2007&hl=en",92,"2022-07-13 13:50:13","","10.1007/3-540-56920-0_1","","",,,,,36,1.24,36,1,29,"… to achieve tractability, robustness and low solution cost. At … (FL), neural network theory (NN) and probabilistic reasoning (PR)… a combination of fuzzy logic and neural network techniques. …","","https://scholar.google.com/scholar?q=related:gFU0EXWYDNcJ:scholar.google.com/&scioq=%22robustness%22+%22neural+network%22+%22reasoning%22&hl=en&as_sdt=2007"
20,"Y Wu, H Dong, R Grosse, J Ba","The scattering compositional learner: Discovering objects, attributes, relationships in analogical reasoning",2020,"arXiv preprint arXiv:2007.04212","arxiv.org","https://arxiv.org/abs/2007.04212","https://scholar.google.com/scholar?cites=3288415279290154305&as_sdt=2005&sciodt=2007&hl=en",93,"2022-07-13 13:50:13","","","","",,,,,20,10.00,5,4,2,"… In this paper, we introduce a novel neural network architecture to learn a compositional … issues again, after observing non-robustness in the systematic generalization of neural networks […","https://arxiv.org/pdf/2007.04212","https://scholar.google.com/scholar?q=related:QX0OFEbMoi0J:scholar.google.com/&scioq=%22robustness%22+%22neural+network%22+%22reasoning%22&hl=en&as_sdt=2007"
133,"A Bianchini, P Bandini","Prediction of pavement performance through neuro‐fuzzy reasoning",2010,"Computer‐Aided Civil and …","Wiley Online Library","https://onlinelibrary.wiley.com/doi/abs/10.1111/j.1467-8667.2009.00615.x","https://scholar.google.com/scholar?cites=10629168725502828049&as_sdt=2005&sciodt=2007&hl=en",94,"2022-07-13 13:50:13","","10.1111/j.1467-8667.2009.00615.x","","",,,,,133,11.08,67,2,12,"… With the inclusion of the fuzzy reasoning into the neural network … The combination of neural networks and fuzzy reasoning aims to … Moreover, robustness and universal approximation …","https://scholar.google.com/scholar?output=instlink&q=info:EZ5J3aNkgpMJ:scholar.google.com/&hl=en&as_sdt=2007&scillfp=2699226731907471931&oi=lle","https://scholar.google.com/scholar?q=related:EZ5J3aNkgpMJ:scholar.google.com/&scioq=%22robustness%22+%22neural+network%22+%22reasoning%22&hl=en&as_sdt=2007"
16,"JAB Tome","Neural activation ratio based fuzzy reasoning",1998,"1998 IEEE International Conference on Fuzzy …","ieeexplore.ieee.org","https://ieeexplore.ieee.org/abstract/document/686292/","https://scholar.google.com/scholar?cites=1628944436671914477&as_sdt=2005&sciodt=2007&hl=en",95,"2022-07-13 13:50:13","","","","",,,,,16,0.67,16,1,24,"… robustness in the neural network, [3], [4], [8], [lo]. Other architectures where both neural nets and fuzzy systems cooperate, more or less independently, have also been proposed in a …","","https://scholar.google.com/scholar?q=related:7aGtqlUsmxYJ:scholar.google.com/&scioq=%22robustness%22+%22neural+network%22+%22reasoning%22&hl=en&as_sdt=2007"
