Cites,Authors,Title,Year,Source,Publisher,ArticleURL,CitesURL,GSRank,QueryDate,Type,DOI,ISSN,CitationURL,Volume,Issue,StartPage,EndPage,ECC,CitesPerYear,CitesPerAuthor,AuthorCount,Age,Abstract,FullTextURL,RelatedURL
4,"Y Liang, D Huang","Large norms of CNN layers do not hurt adversarial robustness",2021,"Proceedings of the AAAI Conference on Artificial …","ojs.aaai.org","https://ojs.aaai.org/index.php/AAAI/article/view/17039","https://scholar.google.com/scholar?cites=13686864097914619933&as_sdt=2005&sciodt=2007&hl=en",96,"2022-07-13 13:50:13","","","","",,,,,4,4.00,2,2,1,"… reasoning of large norms hurting adversarial robustness. The second issue in the reasoning … Our result (Theorem 2) is different from theirs in that we prove that a neural network that can …","https://ojs.aaai.org/index.php/AAAI/article/view/17039/16846","https://scholar.google.com/scholar?q=related:HYg_hWGC8b0J:scholar.google.com/&scioq=%22robustness%22+%22neural+network%22+%22reasoning%22&hl=en&as_sdt=2007"
126,"WR Becraft, PL Lee","An integrated neural network/expert system approach for fault diagnosis",1993,"Computers & chemical engineering","Elsevier","https://www.sciencedirect.com/science/article/pii/009813549380081W","https://scholar.google.com/scholar?cites=15802496608373325390&as_sdt=2005&sciodt=2007&hl=en",97,"2022-07-13 13:50:13","","","","",,,,,126,4.34,63,2,29,"… the neural network module, interpreting the neural network results and performing any necessary post-processing diagnostic reasoning … reveals the actual robustness of the diagnostic …","","https://scholar.google.com/scholar?q=related:Tj5oqvC-TdsJ:scholar.google.com/&scioq=%22robustness%22+%22neural+network%22+%22reasoning%22&hl=en&as_sdt=2007"
27,"N Ramamurthy, DS Varadarajan","Robust digital image watermarking scheme with neural network and fuzzy logic approach",2012,"International Journal of Emerging …","Citeseer","","https://scholar.google.com/scholar?cites=1801458486081690041&as_sdt=2005&sciodt=2007&hl=en",98,"2022-07-13 13:50:13","CITATION","","","",,,,,27,2.70,14,2,10,"","","https://scholar.google.com/scholar?q=related:uRmD1PIQABkJ:scholar.google.com/&scioq=%22robustness%22+%22neural+network%22+%22reasoning%22&hl=en&as_sdt=2007"
305,"A Raghunathan, J Steinhardt…","Semidefinite relaxations for certifying robustness to adversarial examples",2018,"Advances in Neural …","proceedings.neurips.cc","https://proceedings.neurips.cc/paper/2018/hash/29c0605a3bab4229e46723f89cf59d83-Abstract.html","https://scholar.google.com/scholar?cites=2990782721469246862&as_sdt=2005&sciodt=2007&hl=en",99,"2022-07-13 13:50:13","","","","",,,,,305,76.25,102,3,4,"… We present the LP relaxation for a neural network with one hidden layer, where the hidden … When we reason about the relaxation over all feasible points x, the joint reasoning of the SDP …","https://proceedings.neurips.cc/paper/2018/file/29c0605a3bab4229e46723f89cf59d83-Paper.pdf","https://scholar.google.com/scholar?q=related:ju2MEQplgSkJ:scholar.google.com/&scioq=%22robustness%22+%22neural+network%22+%22reasoning%22&hl=en&as_sdt=2007"
0,"M Wegman, H Qian, IM Molloy, T Lee…","Neural Network Robustness through Obfuscation",2022,"US Patent App. 17 …","Google Patents","https://patents.google.com/patent/US20220100847A1/en","",100,"2022-07-13 13:50:13","","","","",,,,,0,0.00,0,5,1,"… to instruction using a variety of reasoning algorithms together with the introduced training function. There may be hundreds or even thousands of reasoning algorithms applied, each of …","https://patentimages.storage.googleapis.com/47/85/de/b4bef0383e9f58/US20220100847A1.pdf",""
493,"R Ehlers","Formal verification of piece-wise linear feed-forward neural networks",2017,"International Symposium on Automated Technology for …","Springer","https://link.springer.com/chapter/10.1007/978-3-319-68167-2_19","https://scholar.google.com/scholar?cites=1921935117158805265&as_sdt=2005&sciodt=2007&hl=en",101,"2022-07-13 13:50:13","","10.1007/978-3-319-68167-2_19","","",,,,,493,98.60,493,1,5,"… that helps with SMT-like reasoning over the network behavior. … We defined a neural network architecture that consists of 40 … robustness of a network for recognizing handwritten digits. …","https://arxiv.org/pdf/1705.01320","https://scholar.google.com/scholar?q=related:EW-ZY84VrBoJ:scholar.google.com/&scioq=%22robustness%22+%22neural+network%22+%22reasoning%22&hl=en&as_sdt=2007"
56,"P Zhou, SW Lu, T Chai","Data-driven soft-sensor modeling for product quality estimation using case-based reasoning and fuzzy-similarity rough sets",2014,"IEEE Transactions on Automation …","ieeexplore.ieee.org","https://ieeexplore.ieee.org/abstract/document/6701237/","https://scholar.google.com/scholar?cites=7599581861254196021&as_sdt=2005&sciodt=2007&hl=en",102,"2022-07-13 13:50:13","","","","",,,,,56,7.00,19,3,8,"… soft-sensor using case-based reasoning (CBR) and fuzzy-… is otherwise required by the neural network based methods to … of soft-sensors lack the robustness and usually have narrow …","https://scholar.google.com/scholar?output=instlink&q=info:NeuOQXAjd2kJ:scholar.google.com/&hl=en&as_sdt=2007&scillfp=5523569003670357805&oi=lle","https://scholar.google.com/scholar?q=related:NeuOQXAjd2kJ:scholar.google.com/&scioq=%22robustness%22+%22neural+network%22+%22reasoning%22&hl=en&as_sdt=2007"
16,"H Mori","Fuzzy neural network applications to power systems",2000,"2000 IEEE Power Engineering Society Winter Meeting …","ieeexplore.ieee.org","https://ieeexplore.ieee.org/abstract/document/850130/","https://scholar.google.com/scholar?cites=7136332941746362286&as_sdt=2005&sciodt=2007&hl=en",103,"2022-07-13 13:50:13","","","","",,,,,16,0.73,16,1,22,"… an artificial neural network with fuzzy logic has been proposed to achieve tractability, robustness, and … of if-then rules while the right-hand side brain deals with the inductive reasoning of …","","https://scholar.google.com/scholar?q=related:rte1JwBZCWMJ:scholar.google.com/&scioq=%22robustness%22+%22neural+network%22+%22reasoning%22&hl=en&as_sdt=2007"
95,"TL Hayes, K Kafle, R Shrestha, M Acharya…","Remind your neural network to prevent catastrophic forgetting",2020,"European Conference on …","Springer","https://link.springer.com/chapter/10.1007/978-3-030-58598-3_28","https://scholar.google.com/scholar?cites=12242659965192476328&as_sdt=2005&sciodt=2007&hl=en",104,"2022-07-13 13:50:13","","10.1007/978-3-030-58598-3_28","","",,,,,95,47.50,19,5,2,"… We probe REMIND’s robustness to data ordering schemes … , complex counting, positional reasoning, and attribute … tests for multi-step compositional reasoning that is very rarely …","https://arxiv.org/pdf/1910.02509","https://scholar.google.com/scholar?q=related:qJYxu1-q5qkJ:scholar.google.com/&scioq=%22robustness%22+%22neural+network%22+%22reasoning%22&hl=en&as_sdt=2007"
12,"H Zhang, M Shinn, A Gupta, A Gurfinkel, N Le…","Verification of recurrent neural networks for cognitive tasks via reachability analysis",2020,"ECAI 2020","ebooks.iospress.nl","https://ebooks.iospress.nl/volumearticle/55076","https://scholar.google.com/scholar?cites=7398509407151544719&as_sdt=2005&sciodt=2007&hl=en",105,"2022-07-13 13:50:13","","10.3233/FAIA200281","","",,,,,12,6.00,2,6,2,"… approximate reasoning about the behaviour of a network. If the approximate reasoning is … Daniel, ‘Efficient neural network robustness certification with general activation functions’, in …","https://ebooks.iospress.nl/pdf/doi/10.3233/FAIA200281","https://scholar.google.com/scholar?q=related:j1mnWBvJrGYJ:scholar.google.com/&scioq=%22robustness%22+%22neural+network%22+%22reasoning%22&hl=en&as_sdt=2007"
14,"T Srinivasan, A Chandrasekhar…","Knowledge discovery in clinical databases with neural network evidence combination",2005,"Proceedings of 2005 …","ieeexplore.ieee.org","https://ieeexplore.ieee.org/abstract/document/1529508/","https://scholar.google.com/scholar?cites=4730124029067926756&as_sdt=2005&sciodt=2007&hl=en",106,"2022-07-13 13:50:13","","","","",,,,,14,0.82,5,3,17,"… two primary advantages: Robustness across multiple data … We then describe the three neural network based classifiers … reasoning. The DST is usually considered as a generalization …","https://citeseerx.ist.psu.edu/viewdoc/download?doi=10.1.1.89.5645&rep=rep1&type=pdf","https://scholar.google.com/scholar?q=related:5BwiQL7GpEEJ:scholar.google.com/&scioq=%22robustness%22+%22neural+network%22+%22reasoning%22&hl=en&as_sdt=2007"
0,"J Shen, Y Lin, M Xu","Research on Quality and Efficiency of the Medical Decision-Making System Based on Robustness Theory",2015,"Proceedings of the 21st International Conference on …","Springer","https://link.springer.com/chapter/10.2991/978-94-6239-102-4_38","",107,"2022-07-13 13:50:13","","10.2991/978-94-6239-102-4_38","","",,,,,0,0.00,0,3,7,"… Though using the neural network for the elimination of case-based reasoning similar … robustness of the system. For medical decision-making system, robustness means that reasoning is …","","https://scholar.google.com/scholar?q=related:YdgFMGjfw78J:scholar.google.com/&scioq=%22robustness%22+%22neural+network%22+%22reasoning%22&hl=en&as_sdt=2007"
35,"S Bubeck, M Sellke","A universal law of robustness via isoperimetry",2021,"Advances in Neural Information …","proceedings.neurips.cc","https://proceedings.neurips.cc/paper/2021/hash/f197002b9a0853eca5e046d9ca4663d5-Abstract.html","https://scholar.google.com/scholar?cites=15758840015672467945&as_sdt=2005&sciodt=2007&hl=en",108,"2022-07-13 13:50:13","","","","",,,,,35,35.00,18,2,1,"… In particular using the same reasoning as for (2.4) we obtain (crucially … of robustness (under the assumptions of Theorem 3) directly states that with high probability, any neural network …","https://proceedings.neurips.cc/paper/2021/file/f197002b9a0853eca5e046d9ca4663d5-Paper.pdf","https://scholar.google.com/scholar?q=related:6WFeFoClstoJ:scholar.google.com/&scioq=%22robustness%22+%22neural+network%22+%22reasoning%22&hl=en&as_sdt=2007"
91,"SY Liong, WH Lim, T Kojiri, T Hori","Advance flood forecasting for flood stricken Bangladesh with a fuzzy reasoning method",2000,"Hydrological processes","Wiley Online Library","https://onlinelibrary.wiley.com/doi/abs/10.1002/(SICI)1099-1085(20000228)14:3%3C431::AID-HYP947%3E3.0.CO;2-0","https://scholar.google.com/scholar?cites=398408679204030718&as_sdt=2005&sciodt=2007&hl=en",109,"2022-07-13 13:50:13","","10.1002/(SICI)1099-1085(20000228)14:3%3C431::AID-HYP947%3E3.0.CO;2-0","","",,,,,91,4.14,23,4,22,"… type is appropriate from the viewpoint of the robustness of the system. For this reason, … of the neural network is, as expected, higher than that of the fuzzy reasoning method, the …","https://www.academia.edu/download/46643661/_28sici_291099-1085_2820000228_2914_3A3_3C431_3A_3Aaid-hyp947_3E3.0.co_3B2-020160620-32222-g02b8i.pdf","https://scholar.google.com/scholar?q=related:_ohjN5VuhwUJ:scholar.google.com/&scioq=%22robustness%22+%22neural+network%22+%22reasoning%22&hl=en&as_sdt=2007"
13,"P Orponen, P Floreen, P Myllymaki…","A neural implementation of conceptual hierarchies with Bayesian reasoning",1990,"… Joint Conference on …","ieeexplore.ieee.org","https://ieeexplore.ieee.org/abstract/document/5726545/","https://scholar.google.com/scholar?cites=8612757551416263374&as_sdt=2005&sciodt=2007&hl=en",110,"2022-07-13 13:50:13","","","","",,,,,13,0.41,3,4,32,"… would provide a basic robustness to the knowledge … network provably performs evidential reasoning according to this … can be realized by a neural network consisting of two layers …","http://cosco.hiit.fi/Articles/ijcnn90.pdf","https://scholar.google.com/scholar?q=related:zsK6VFyphncJ:scholar.google.com/&scioq=%22robustness%22+%22neural+network%22+%22reasoning%22&hl=en&as_sdt=2007"
34,"PL Donti, M Roderick, M Fazlyab, JZ Kolter","Enforcing robust control guarantees within neural network policies",2020,"arXiv preprint arXiv …","arxiv.org","https://arxiv.org/abs/2011.08105","https://scholar.google.com/scholar?cites=18128961654135874405&as_sdt=2005&sciodt=2007&hl=en",111,"2022-07-13 13:50:13","","","","",,,,,34,17.00,9,4,2,"… , if we are given known robustness specifications, we can … nominal neural network to satisfy desired robustness criteria. … SATNet: Bridging deep learning and logical reasoning using …","https://arxiv.org/pdf/2011.08105","https://scholar.google.com/scholar?q=related:ZWNytZICl_sJ:scholar.google.com/&scioq=%22robustness%22+%22neural+network%22+%22reasoning%22&hl=en&as_sdt=2007"
154,"C Xia, C Guo, T Shi","A neural-network-identifier and fuzzy-controller-based algorithm for dynamic decoupling control of permanent-magnet spherical motor",2009,"IEEE Transactions on industrial …","ieeexplore.ieee.org","https://ieeexplore.ieee.org/abstract/document/5332328/","https://scholar.google.com/scholar?cites=10716460361681255696&as_sdt=2005&sciodt=2007&hl=en",112,"2022-07-13 13:50:13","","","","",,,,,154,11.85,51,3,13,"… the control amounts, with the advantages of good robustness and independence of mathematical model [9-10]. Artificial Neural Network (ANN) has very strong ability of approaching, …","","https://scholar.google.com/scholar?q=related:EL2Qs-uDuJQJ:scholar.google.com/&scioq=%22robustness%22+%22neural+network%22+%22reasoning%22&hl=en&as_sdt=2007"
174,"A Van Raan, R Tijssen","The neural net of neural network research: An exercise in bibliometric mapping",1993,"Scientometrics","akjournals.com","https://akjournals.com/view/journals/11192/26/1/article-p169.xml","https://scholar.google.com/scholar?cites=6568640792944668119&as_sdt=2005&sciodt=2007&hl=en",113,"2022-07-13 13:50:13","","","","",,,,,174,6.00,87,2,29,"… Extremely important is the robustness of the neural network system … marks the onset of a revival in neural network research. … and expert systems are reasoning and user interfaces. …","https://www.researchgate.net/profile/Robert-Tijssen/publication/242915784_The_neural_net_of_neural_network_research/links/563b4c5308aeed0531de5636/The-neural-net-of-neural-network-research.pdf","https://scholar.google.com/scholar?q=related:122bwP9_KFsJ:scholar.google.com/&scioq=%22robustness%22+%22neural+network%22+%22reasoning%22&hl=en&as_sdt=2007"
163,"L Zeng, X Xu, B Cai, S Qiu…","Multi-scale convolutional neural networks for crowd counting",2017,"2017 IEEE International …","ieeexplore.ieee.org","https://ieeexplore.ieee.org/abstract/document/8296324/","https://scholar.google.com/scholar?cites=14000380940732626802&as_sdt=2005&sciodt=2007&hl=en",114,"2022-07-13 13:50:13","","","","",,,,,163,32.60,33,5,5,"… To this end, we propose a novel multi-scale convolutional neural network (MSCNN) for single … of-the-art methods on both accuracy and robustness with far less number of parameters. …","https://arxiv.org/pdf/1702.02359.pdf?source=post_page---------------------------","https://scholar.google.com/scholar?q=related:cneE1ElYS8IJ:scholar.google.com/&scioq=%22robustness%22+%22neural+network%22+%22reasoning%22&hl=en&as_sdt=2007"
7,"S Mesbah, G Pang","Fuzzy-neural control with application to a heating system",1999,"… of the 1999 IEEE International Symposium …","ieeexplore.ieee.org","https://ieeexplore.ieee.org/abstract/document/808704/","https://scholar.google.com/scholar?cites=1951980409678273639&as_sdt=2005&sciodt=2007&hl=en",115,"2022-07-13 13:50:13","","","","",,,,,7,0.30,4,2,23,"… of neural network proposed [2]. The idea is to construct a … in the training of the rule reasoning sub-networks and in the … with a discussion on the robustness issue is also given. In this FNN…","https://www.researchgate.net/profile/Grantham-Pang/publication/3826483_Fuzzy-neural_control_with_application_to_a_heating_system/links/0deec5176456298879000000/Fuzzy-neural-control-with-application-to-a-heating-system.pdf","https://scholar.google.com/scholar?q=related:ZxxlL9fTFhsJ:scholar.google.com/&scioq=%22robustness%22+%22neural+network%22+%22reasoning%22&hl=en&as_sdt=2007"
153,"S Mitra, SK Pal","Fuzzy sets in pattern recognition and machine intelligence",2005,"Fuzzy Sets and systems","Elsevier","https://www.sciencedirect.com/science/article/pii/S016501140500285X","https://scholar.google.com/scholar?cites=13449575903406762683&as_sdt=2005&sciodt=2007&hl=en",116,"2022-07-13 13:50:13","","","","",,,,,153,9.00,77,2,17,"… Much of the logic behind human reasoning is not the … into account characteristics like tractability, robustness, low cost, etc., … in two ways: a neural network equipped with the capability of …","http://library.isical.ac.in:8080/jspui/bitstream/10263/2836/1/Binder7.pdf","https://scholar.google.com/scholar?q=related:u6o2dgZ-proJ:scholar.google.com/&scioq=%22robustness%22+%22neural+network%22+%22reasoning%22&hl=en&as_sdt=2007"
14,"Y Shi, Z Wei, H Ling, Z Wang…","Person retrieval in surveillance videos via deep attribute mining and reasoning",2020,"IEEE Transactions on …","ieeexplore.ieee.org","https://ieeexplore.ieee.org/abstract/document/9277642/","https://scholar.google.com/scholar?cites=5218307790922509967&as_sdt=2005&sciodt=2007&hl=en",117,"2022-07-13 13:50:13","","","","",,,,,14,7.00,3,5,2,"… robustness to the retrieval system. In this paper, we propose an Attribute Mining and Reasoning (… recent works are built on the Convolution Neural Network (CNN) and therefore retrieval …","https://drive.google.com/file/d/15JI-cCG8vWCrXxDjPXiCVhty33jWl07R/view","https://scholar.google.com/scholar?q=related:j-6Wvkkna0gJ:scholar.google.com/&scioq=%22robustness%22+%22neural+network%22+%22reasoning%22&hl=en&as_sdt=2007"
11,"M Ebrahimi, MK Sarker, F Bianchi, N Xie…","Reasoning over RDF knowledge bases using deep learning",2018,"arXiv preprint arXiv …","arxiv.org","https://arxiv.org/abs/1811.04132","https://scholar.google.com/scholar?cites=13449304042004574805&as_sdt=2005&sciodt=2007&hl=en",118,"2022-07-13 13:50:13","","","","",,,,,11,2.75,2,5,4,"… cross-knowledge graph deductive reasoning. We also show the robustness of our model to the … Applying a deep learning approach to this, we would like to train a Deep Neural Network (…","https://arxiv.org/pdf/1811.04132","https://scholar.google.com/scholar?q=related:VXLoy8SGpboJ:scholar.google.com/&scioq=%22robustness%22+%22neural+network%22+%22reasoning%22&hl=en&as_sdt=2007"
47,"X Zhao, Q Luo, B Han","Survey on robot multi-sensor information fusion technology",2008,"2008 7th World Congress on Intelligent …","ieeexplore.ieee.org","https://ieeexplore.ieee.org/abstract/document/4593742/","https://scholar.google.com/scholar?cites=18206772098230094525&as_sdt=2005&sciodt=2007&hl=en",119,"2022-07-13 13:50:13","","","","",,,,,47,3.36,16,3,14,"… used fuzzy ARTMAP neural network and Dempster-Shafer evidential reasoning in robots … neural network improves the fuzzy logic’s self-applicability and neural network’s robustness. …","","https://scholar.google.com/scholar?q=related:vYp_fcJyq_wJ:scholar.google.com/&scioq=%22robustness%22+%22neural+network%22+%22reasoning%22&hl=en&as_sdt=2007"
72,"J Zhang, AJ Morris","On-line process fault diagnosis using fuzzy neural networks",1994,"Intelligent Systems Engineering","IET","https://digital-library.theiet.org/content/journals/10.1049/ise.1994.0005","https://scholar.google.com/scholar?cites=17025508228157837485&as_sdt=2005&sciodt=2007&hl=en",120,"2022-07-13 13:50:13","","10.1049/ise.1994.0005","","",,,,,72,2.57,36,2,28,"… The fuzzy neural network considered in this paper is … Robustness of the diagnosis system is enhanced by adopting a … Jang [19] uses an adaptive network to implement fuzzy reasoning …","","https://scholar.google.com/scholar?q=related:rZDWS4fBRuwJ:scholar.google.com/&scioq=%22robustness%22+%22neural+network%22+%22reasoning%22&hl=en&as_sdt=2007"
28,"VN Ghate, SV Dudul","Fault diagnosis of three phase induction motor using neural network techniques",2009,"… on Emerging Trends in Engineering & …","ieeexplore.ieee.org","https://ieeexplore.ieee.org/abstract/document/5395476/","https://scholar.google.com/scholar?cites=4278160793854715730&as_sdt=2005&sciodt=2007&hl=en",121,"2022-07-13 13:50:13","","","","",,,,,28,2.15,14,2,13,"… In this paper simple, reliable and economical Neural Network (… Robustness of classifier to noise is also verified on unseen … “ Case-based reasoning system with Petri nets for induction …","","https://scholar.google.com/scholar?q=related:Uqe2SZMUXzsJ:scholar.google.com/&scioq=%22robustness%22+%22neural+network%22+%22reasoning%22&hl=en&as_sdt=2007"
39,"P Minervini, M Bosnjak, T Rocktäschel…","Towards neural theorem proving at scale",2018,"arXiv preprint arXiv …","arxiv.org","https://arxiv.org/abs/1807.08204","https://scholar.google.com/scholar?cites=3807768624473541974&as_sdt=2005&sciodt=2007&hl=en",122,"2022-07-13 13:50:13","","","","",,,,,39,9.75,10,4,4,"… Neural models combining representation learning and reasoning … with the expressiveness and robustness of neural networks. … proof paths during the construction of the neural network. …","https://arxiv.org/pdf/1807.08204","https://scholar.google.com/scholar?q=related:Vo2fuGPp1zQJ:scholar.google.com/&scioq=%22robustness%22+%22neural+network%22+%22reasoning%22&hl=en&as_sdt=2007"
15,"JH Huang, CD Dao, M Alfadly, CH Yang…","Robustness analysis of visual qa models by basic questions",2017,"arXiv preprint arXiv …","arxiv.org","https://arxiv.org/abs/1709.04625","https://scholar.google.com/scholar?cites=4891979436342771546&as_sdt=2005&sciodt=2007&hl=en",123,"2022-07-13 13:50:13","","","","",,,,,15,3.00,3,5,5,"… the above reasoning, we propose a novel framework for measuring the robustness of VQA … Image question answering using convolutional neural network with dynamic parameter …","https://arxiv.org/pdf/1709.04625","https://scholar.google.com/scholar?q=related:Wv-552DN40MJ:scholar.google.com/&scioq=%22robustness%22+%22neural+network%22+%22reasoning%22&hl=en&as_sdt=2007"
30,"S Lu, Q Li, L Bai, R Wang","Performance predictions of ground source heat pump system based on random forest and back propagation neural network models",2019,"Energy Conversion and Management","Elsevier","https://www.sciencedirect.com/science/article/pii/S0196890419308465","https://scholar.google.com/scholar?cites=1854460041971618937&as_sdt=2005&sciodt=2007&hl=en",124,"2022-07-13 13:50:13","","","","",,,,,30,10.00,8,4,3,"… neural network (BPNN) from robustness, interpretability, and efficiency. First, since GSHP system involving multiple indicators, the robustness, … According to CV-RMSE, robustness of RF …","","https://scholar.google.com/scholar?q=related:edTfM5VdvBkJ:scholar.google.com/&scioq=%22robustness%22+%22neural+network%22+%22reasoning%22&hl=en&as_sdt=2007"
7,"J Liu, Y Chen, K Liu, Y Jia, Z Sheng","How does context matter? On the robustness of event detection with context-selective mask generalization",2020,"Findings of the Association …","aclanthology.org","https://aclanthology.org/2020.findings-emnlp.229/?ref=https://githubhelp.com","https://scholar.google.com/scholar?cites=12207633766320116468&as_sdt=2005&sciodt=2007&hl=en",125,"2022-07-13 13:50:13","","","","",,,,,7,3.50,1,5,2,"… which rarely consider the robustness (and generalization capability… This paper focuses on the robustness aspect of ED models. … such reasoning shortcuts may lead to poor robustness as …","https://aclanthology.org/2020.findings-emnlp.229.pdf","https://scholar.google.com/scholar?q=related:9BKTTTs6aqkJ:scholar.google.com/&scioq=%22robustness%22+%22neural+network%22+%22reasoning%22&hl=en&as_sdt=2007"
46,"N Imasaki, S Kubo, S Nakai…","Elevator group control system tuned by a fuzzy neural network applied method",1995,"Proceedings of 1995 …","ieeexplore.ieee.org","https://ieeexplore.ieee.org/abstract/document/409916/","https://scholar.google.com/scholar?cites=11068125673886683798&as_sdt=2005&sciodt=2007&hl=en",126,"2022-07-13 13:50:13","","","","",,,,,46,1.70,12,4,27,"… The interpolation by fuzzy reasoning provides a robustness against the shortterm changes in … from the reasoning network. The output of the fuzzy neural network is described as follows: …","","https://scholar.google.com/scholar?q=related:lpJlsajhmZkJ:scholar.google.com/&scioq=%22robustness%22+%22neural+network%22+%22reasoning%22&hl=en&as_sdt=2007"
48,"K Wada, E Sucar, S James…","Morefusion: Multi-object reasoning for 6d pose estimation from volumetric fusion",2020,"Proceedings of the …","openaccess.thecvf.com","http://openaccess.thecvf.com/content_CVPR_2020/html/Wada_MoreFusion_Multi-object_Reasoning_for_6D_Pose_Estimation_from_Volumetric_Fusion_CVPR_2020_paper.html","https://scholar.google.com/scholar?cites=12133155819369787007&as_sdt=2005&sciodt=2007&hl=en",127,"2022-07-13 13:50:13","","","","",,,,,48,24.00,12,4,2,"… We verify the accuracy and robustness of our approach experimentally on 2 object datasets: … The initial 6D pose of each object is predicted via a deep neural network (summarized in …","https://openaccess.thecvf.com/content_CVPR_2020/papers/Wada_MoreFusion_Multi-object_Reasoning_for_6D_Pose_Estimation_from_Volumetric_Fusion_CVPR_2020_paper.pdf","https://scholar.google.com/scholar?q=related:f-7_-e6gYagJ:scholar.google.com/&scioq=%22robustness%22+%22neural+network%22+%22reasoning%22&hl=en&as_sdt=2007"
