Cites,Authors,Title,Year,Source,Publisher,ArticleURL,CitesURL,GSRank,QueryDate,Type,DOI,ISSN,CitationURL,Volume,Issue,StartPage,EndPage,ECC,CitesPerYear,CitesPerAuthor,AuthorCount,Age,Abstract,FullTextURL,RelatedURL
57,"CH Lee, YH Lee, CC Teng","A novel robust PID controllers design by fuzzy neural network",2002,"Proceedings of the 2002 American …","ieeexplore.ieee.org","https://ieeexplore.ieee.org/abstract/document/1023244/","https://scholar.google.com/scholar?cites=17368213885285811154&as_sdt=2005&sciodt=2007&hl=en",128,"2022-07-13 13:50:13","","","","",,,,,57,2.85,19,3,20,"… PID tuning method using fuzzy neural network (FNN) based … to have the specified robustness and performance. Simulation … The output where Y , of the fuzzy reasoning can be derived …","","https://scholar.google.com/scholar?q=related:0sN3B4JKCPEJ:scholar.google.com/&scioq=%22robustness%22+%22neural+network%22+%22reasoning%22&hl=en&as_sdt=2007"
14,"Q Wang, Y Hao","ALSTM: An attention-based long short-term memory framework for knowledge base reasoning",2020,"Neurocomputing","Elsevier","https://www.sciencedirect.com/science/article/pii/S0925231220302551","https://scholar.google.com/scholar?cites=18379790397623880640&as_sdt=2005&sciodt=2007&hl=en",129,"2022-07-13 13:50:13","","","","",,,,,14,7.00,7,2,2,"… for knowledge base reasoning tasks because they are … In many cases this interpretability leads to robustness in transfer … based neural network architecture for relational reasoning in …","","https://scholar.google.com/scholar?q=related:wMuBgPwhEv8J:scholar.google.com/&scioq=%22robustness%22+%22neural+network%22+%22reasoning%22&hl=en&as_sdt=2007"
1,"YL Tsai, CY Hsu, CM Yu…","Non-singular adversarial robustness of neural networks",2021,"ICASSP 2021-2021 IEEE …","ieeexplore.ieee.org","https://ieeexplore.ieee.org/abstract/document/9414325/","https://scholar.google.com/scholar?cites=8583341066745952481&as_sdt=2005&sciodt=2007&hl=en",130,"2022-07-13 13:50:13","","","","",,,,,1,1.00,0,4,1,"… only contributes to singular adversarial robustness assessment. For further reasoning, in Section 4 (… • We study non-singular robustness of neural network using the worst-case bound on …","https://arxiv.org/pdf/2102.11935","https://scholar.google.com/scholar?q=related:4ThqRTknHncJ:scholar.google.com/&scioq=%22robustness%22+%22neural+network%22+%22reasoning%22&hl=en&as_sdt=2007"
36,"C Habeck, Y Gazes, Q Razlighi, J Steffener…","The Reference Ability Neural Network Study: Life-time stability of reference-ability neural networks derived from task maps of young adults",2016,"Neuroimage","Elsevier","https://www.sciencedirect.com/science/article/pii/S1053811915010010","https://scholar.google.com/scholar?cites=12045824611572272497&as_sdt=2005&sciodt=2007&hl=en",131,"2022-07-13 13:50:13","","","","",,,,,36,6.00,7,5,6,"… -reasoning network whose network score correlated with performance on the memory and fluid-reasoning … To determine the robustness of RANN voxel-loadings, we performed a semi-…","https://www.ncbi.nlm.nih.gov/pmc/articles/PMC4691438/","https://scholar.google.com/scholar?q=related:cU1sp6ldK6cJ:scholar.google.com/&scioq=%22robustness%22+%22neural+network%22+%22reasoning%22&hl=en&as_sdt=2007"
114,"I Hayashi, H Nomura, H Yamasaki, N Wakami","Construction of fuzzy inference rules by NDF and NDFL",1992,"… of Approximate Reasoning","Elsevier","https://www.sciencedirect.com/science/article/pii/0888613X9290019V","https://scholar.google.com/scholar?cites=15352497177580272501&as_sdt=2005&sciodt=2007&hl=en",132,"2022-07-13 13:50:13","","","","",,,,,114,3.80,29,4,30,"… , while in the consequent parts an amount of reasoning for … this algorithm a neural network driven fuzzy reasoning with … An experimental study of the robustness of control performed …","https://www.sciencedirect.com/science/article/pii/0888613X9290019V/pdf?md5=2995e4342d1cc41a3397fa87dc55b3bb&pid=1-s2.0-0888613X9290019V-main.pdf","https://scholar.google.com/scholar?q=related:dfvbjNcGD9UJ:scholar.google.com/&scioq=%22robustness%22+%22neural+network%22+%22reasoning%22&hl=en&as_sdt=2007"
44,"B Dandil","Fuzzy neural network IP controller for robust position control of induction motor drive",2009,"Expert systems with Applications","Elsevier","https://www.sciencedirect.com/science/article/pii/S0957417408002248","https://scholar.google.com/scholar?cites=10911472319716033867&as_sdt=2005&sciodt=2007&hl=en",133,"2022-07-13 13:50:13","","","","",,,,,44,3.38,44,1,13,"… motor drive and the performance and the robustness of the control system is tested for … fuzzy IF–THEN rule thinking and reasoning. Neural network-based fuzzy systems, which have the …","","https://scholar.google.com/scholar?q=related:S4UuaUNWbZcJ:scholar.google.com/&scioq=%22robustness%22+%22neural+network%22+%22reasoning%22&hl=en&as_sdt=2007"
18,"X Ma, W Liu, Y Li, R Song","LVQ neural network based target differentiation method for mobile robot",2005,"ICAR'05. Proceedings., 12th …","ieeexplore.ieee.org","https://ieeexplore.ieee.org/abstract/document/1507482/","https://scholar.google.com/scholar?cites=5603481918804778032&as_sdt=2005&sciodt=2007&hl=en",134,"2022-07-13 13:50:13","","","","",,,,,18,1.06,5,4,17,"… These data is used as training samples of LVQ neural network. There are … In order to test its robustness of the LVQ neural network to noise, partial removal of the input information and …","","https://scholar.google.com/scholar?q=related:MNyu2x2Rw00J:scholar.google.com/&scioq=%22robustness%22+%22neural+network%22+%22reasoning%22&hl=en&as_sdt=2007"
9,"JC Martínez-Romo, FJ Luna-Rosas…","On-line signature verification based on genetic optimization and neural-network-driven fuzzy reasoning",2009,"… Conference on Artificial …","Springer","https://link.springer.com/chapter/10.1007/978-3-642-05258-3_22","https://scholar.google.com/scholar?cites=3808644479051187418&as_sdt=2005&sciodt=2007&hl=en",135,"2022-07-13 13:50:13","","10.1007/978-3-642-05258-3_22","","",,,,,9,0.69,3,3,13,"… The first one is that the GA gives robustness to the prototype functions against forgeries because, a) in the cost function we embedded knowledge of the class ω1, and b) the cost …","","https://scholar.google.com/scholar?q=related:2kSZgfkF2zQJ:scholar.google.com/&scioq=%22robustness%22+%22neural+network%22+%22reasoning%22&hl=en&as_sdt=2007"
112,"R Qian, B Zhang, Y Yue, Z Wang…","Robust Chinese traffic sign detection and recognition with deep convolutional neural network",2015,"2015 11th International …","ieeexplore.ieee.org","https://ieeexplore.ieee.org/abstract/document/7378092/","https://scholar.google.com/scholar?cites=4997510989550093952&as_sdt=2005&sciodt=2007&hl=en",136,"2022-07-13 13:50:13","","","","",,,,,112,16.00,22,5,7,"… recognition system by applying deep convolutional neural network (CNN), which demonstrates … , with performance confirming its robustness and suitability to real-world applications. …","https://www.researchgate.net/profile/Zhao-Wang-11/publication/304290449_Robust_chinese_traffic_sign_detection_and_recognition_with_deep_convolutional_neural_network/links/5c9dba4545851506d731bc31/Robust-chinese-traffic-sign-detection-and-recognition-with-deep-convolutional-neural-network.pdf","https://scholar.google.com/scholar?q=related:gIY-XcS5WkUJ:scholar.google.com/&scioq=%22robustness%22+%22neural+network%22+%22reasoning%22&hl=en&as_sdt=2007"
20,"W Chen, T Xu, J Liu, M Wang, D Zhao","Picking robot visual servo control based on modified fuzzy neural network sliding mode algorithms",2019,"Electronics","mdpi.com","https://www.mdpi.com/471044","https://scholar.google.com/scholar?cites=9571783793954408990&as_sdt=2005&sciodt=2007&hl=en",137,"2022-07-13 13:50:13","","","","",,,,,20,6.67,4,5,3,"… neural network algorithm so as to improve the robustness and … neural network (FNN) assigns a conventional neural network … neural network structure to implement fuzzy logic reasoning. …","https://www.mdpi.com/2079-9292/8/6/605/htm","https://scholar.google.com/scholar?q=related:Hkp-qaXO1YQJ:scholar.google.com/&scioq=%22robustness%22+%22neural+network%22+%22reasoning%22&hl=en&as_sdt=2007"
26,"L Medsker","Design and development of hybrid neural network and expert systems",1994,"… of 1994 IEEE International Conference on Neural …","ieeexplore.ieee.org","https://ieeexplore.ieee.org/abstract/document/374503/","https://scholar.google.com/scholar?cites=13159999287766891079&as_sdt=2005&sciodt=2007&hl=en",138,"2022-07-13 13:50:13","","","","",,,,,26,0.93,26,1,28,"… for reasoning about changes in signals over time. SCRuFFy uses a backpropagation neural network and … Robustness and performance improvements stem from the dual nature of the …","","https://scholar.google.com/scholar?q=related:Rzq9p6C1obYJ:scholar.google.com/&scioq=%22robustness%22+%22neural+network%22+%22reasoning%22&hl=en&as_sdt=2007"
96,"A Ignatiev, N Narodytska…","Abduction-based explanations for machine learning models",2019,"Proceedings of the AAAI …","ojs.aaai.org","https://ojs.aaai.org/index.php/AAAI/article/view/3964","https://scholar.google.com/scholar?cites=7355960657107994022&as_sdt=2005&sciodt=2007&hl=en",139,"2022-07-13 13:50:13","","","","",,,,,96,32.00,32,3,3,"… Associated with this constraint reasoning system, we assume … This section considers a MILP encoding of a neural network … can raise concerns regarding robustness and scalability. Sev…","https://ojs.aaai.org/index.php/AAAI/article/view/3964/3842","https://scholar.google.com/scholar?q=related:psWrfD6fFWYJ:scholar.google.com/&scioq=%22robustness%22+%22neural+network%22+%22reasoning%22&hl=en&as_sdt=2007"
8,"Y Zhang, M Gong, T Liu, G Niu, X Tian, B Han…","Adversarial robustness through the lens of causality",2021,"arXiv preprint arXiv …","arxiv.org","https://arxiv.org/abs/2106.06196","https://scholar.google.com/scholar?cites=7969934108451189317&as_sdt=2005&sciodt=2007&hl=en",140,"2022-07-13 13:50:13","","","","",,,,,8,8.00,1,7,1,"… Using causal language, causal reasoning can identify causal … In summary, causal reasoning has the instinct for analyzing the … ” means that model g is instantiated with a neural network. …","https://arxiv.org/pdf/2106.06196","https://scholar.google.com/scholar?q=related:RbKAWdjkmm4J:scholar.google.com/&scioq=%22robustness%22+%22neural+network%22+%22reasoning%22&hl=en&as_sdt=2007"
157,"PM Frank, B Köppen-Seliger","Fuzzy logic and neural network applications to fault diagnosis",1997,"… journal of approximate reasoning","Elsevier","https://www.sciencedirect.com/science/article/pii/S0888613X96001168","https://scholar.google.com/scholar?cites=8289702917296221470&as_sdt=2005&sciodt=2007&hl=en",141,"2022-07-13 13:50:13","","","","",,,,,157,6.28,79,2,25,"… Instead of output signals, any symptom can be used, and robustness can be attained by attending only to those symptoms that are not, or not strongly, dependent upon the system …","https://www.sciencedirect.com/science/article/pii/S0888613X96001168/pdf?md5=478e17da3fbd7d9f313ca3728b4b72b4&pid=1-s2.0-S0888613X96001168-main.pdf&_valck=1","https://scholar.google.com/scholar?q=related:Hu317uHwCnMJ:scholar.google.com/&scioq=%22robustness%22+%22neural+network%22+%22reasoning%22&hl=en&as_sdt=2007"
2,"P Henriksen, K Hammernik…","Bias Field Robustness Verification of Large Neural Image Classifiers",2021,"… of the 32nd …","bmvc2021-virtualconference.com","https://www.bmvc2021-virtualconference.com/assets/papers/1291.pdf","https://scholar.google.com/scholar?cites=10851392655326366518&as_sdt=2005&sciodt=2007&hl=en",142,"2022-07-13 13:50:13","PDF","","","",,,,,2,2.00,1,3,1,"… We present a method for verifying the robustness of neural network-based image classifiers … transformations into neural network operations to exploit neural network formal verification …","https://www.bmvc2021-virtualconference.com/assets/papers/1291.pdf","https://scholar.google.com/scholar?q=related:NssCeyDkl5YJ:scholar.google.com/&scioq=%22robustness%22+%22neural+network%22+%22reasoning%22&hl=en&as_sdt=2007"
174,"VN Ghate, SV Dudul","Optimal MLP neural network classifier for fault detection of three phase induction motor",2010,"Expert Systems with Applications","Elsevier","https://www.sciencedirect.com/science/article/pii/S0957417409009075","https://scholar.google.com/scholar?cites=13358071331212253437&as_sdt=2005&sciodt=2007&hl=en",143,"2022-07-13 13:50:13","","","","",,,,,174,14.50,87,2,12,"… Robustness of classifier to noise is verified on unseen data … to develop an alternative neural network based incipient fault-… and so proposed neural network based classifier demonstrates …","http://pdf.xuebalib.com:1262/xuebalib.com.19586.pdf","https://scholar.google.com/scholar?q=related:_Vg8BRpnYbkJ:scholar.google.com/&scioq=%22robustness%22+%22neural+network%22+%22reasoning%22&hl=en&as_sdt=2007"
3,"YL Tsai, CY Hsu, CM Yu…","Formalizing generalization and adversarial robustness of neural networks to weight perturbations",2021,"Advances in Neural …","proceedings.neurips.cc","https://proceedings.neurips.cc/paper/2021/hash/a3ab4ff8fa4deed2e3bae3a5077675f0-Abstract.html","https://scholar.google.com/scholar?cites=15264319207512561925&as_sdt=2005&sciodt=2007&hl=en",144,"2022-07-13 13:50:13","","","","",,,,,3,3.00,1,4,1,"… Here we would like to note that similar reasoning could be … layer in a neural network is subject to weight perturbation. … input and finally the neural network. Explicitly, for an L-layer …","https://proceedings.neurips.cc/paper/2021/file/a3ab4ff8fa4deed2e3bae3a5077675f0-Paper.pdf","https://scholar.google.com/scholar?q=related:BVn1BXLB1dMJ:scholar.google.com/&scioq=%22robustness%22+%22neural+network%22+%22reasoning%22&hl=en&as_sdt=2007"
31,"B Li, Z Sun, Q Li, Y Wu, A Hu","Group-wise deep object co-segmentation with co-attention recurrent neural network",2019,"Proceedings of the IEEE/CVF …","openaccess.thecvf.com","http://openaccess.thecvf.com/content_ICCV_2019/html/Li_Group-Wise_Deep_Object_Co-Segmentation_With_Co-Attention_Recurrent_Neural_Network_ICCV_2019_paper.html","https://scholar.google.com/scholar?cites=15305229939530506448&as_sdt=2005&sciodt=2007&hl=en",145,"2022-07-13 13:50:13","","","","",,,,,31,10.33,6,5,3,"… -segmentation reasoning. Particularly, instead of using conventional recurrent neural network … objects from image pairs has very limited robustness and practical application value when …","http://openaccess.thecvf.com/content_ICCV_2019/papers/Li_Group-Wise_Deep_Object_Co-Segmentation_With_Co-Attention_Recurrent_Neural_Network_ICCV_2019_paper.pdf","https://scholar.google.com/scholar?q=related:0KBjF4oZZ9QJ:scholar.google.com/&scioq=%22robustness%22+%22neural+network%22+%22reasoning%22&hl=en&as_sdt=2007"
11,"X Xia, T Li","A fuzzy control model based on BP neural network arithmetic for optimal control of smart city facilities",2019,"Personal and Ubiquitous Computing","Springer","https://link.springer.com/article/10.1007/s00779-019-01209-0","https://scholar.google.com/scholar?cites=6211246430269209031&as_sdt=2005&sciodt=2007&hl=en",146,"2022-07-13 13:50:13","","10.1007/s00779-019-01209-0","","",,,,,11,3.67,6,2,3,"… based on BP neural network arithmetic, so that the realization process of fuzzy reasoning is … The robustness of the neural network fuzzy controller to the simulation system on different …","https://scholar.google.com/scholar?output=instlink&q=info:x_mbQLjHMlYJ:scholar.google.com/&hl=en&as_sdt=2007&scillfp=15045043938907453068&oi=lle","https://scholar.google.com/scholar?q=related:x_mbQLjHMlYJ:scholar.google.com/&scioq=%22robustness%22+%22neural+network%22+%22reasoning%22&hl=en&as_sdt=2007"
54,"X Liu, JY Lee, H Jin","Learning video representations from correspondence proposals",2019,"… of the IEEE/CVF Conference on …","openaccess.thecvf.com","http://openaccess.thecvf.com/content_CVPR_2019/html/Liu_Learning_Video_Representations_From_Correspondence_Proposals_CVPR_2019_paper.html","https://scholar.google.com/scholar?cites=7665702673430883055&as_sdt=2005&sciodt=2007&hl=en",147,"2022-07-13 13:50:13","","","","",,,,,54,18.00,18,3,3,"… with more a complicated method such as a neural network. … We are curious about CP module’s robustness to wrong … In fact, migrating positional reasoning from the original input …","https://openaccess.thecvf.com/content_CVPR_2019/papers/Liu_Learning_Video_Representations_From_Correspondence_Proposals_CVPR_2019_paper.pdf","https://scholar.google.com/scholar?q=related:7yqcg_cLYmoJ:scholar.google.com/&scioq=%22robustness%22+%22neural+network%22+%22reasoning%22&hl=en&as_sdt=2007"
238,"X Fang, H Luo, J Tang","Structural damage detection using neural network with learning rate improvement",2005,"Computers & structures","Elsevier","https://www.sciencedirect.com/science/article/pii/S004579490500177X","https://scholar.google.com/scholar?cites=12922783529643606380&as_sdt=2005&sciodt=2007&hl=en",148,"2022-07-13 13:50:13","","","","",,,,,238,14.00,79,3,17,"… Following that, fuzzy reasoning is operated to obtain a fuzzy output set under the fuzzified … and robustness without increasing the algorithm complexity. This TSD based neural network is …","","https://scholar.google.com/scholar?q=related:bAGtASfzVrMJ:scholar.google.com/&scioq=%22robustness%22+%22neural+network%22+%22reasoning%22&hl=en&as_sdt=2007"
16,"S Saralajew, L Holdijk, M Rees…","Classification-by-components: probabilistic modeling of reasoning over a set of components",2019,"Advances in Neural …","proceedings.neurips.cc","https://proceedings.neurips.cc/paper/2019/hash/dca5672ff3444c7e997aa9a2c4eb2094-Abstract.html","https://scholar.google.com/scholar?cites=12691103404451941071&as_sdt=2005&sciodt=2007&hl=en",149,"2022-07-13 13:50:13","","","","",,,,,16,5.33,4,4,3,"… neural network. In this work, a network architecture, denoted as Classification-By-Components network (CBC), is proposed. It is restricted to follow an intuitive reasoning … of robustness of …","https://proceedings.neurips.cc/paper/2019/file/dca5672ff3444c7e997aa9a2c4eb2094-Paper.pdf","https://scholar.google.com/scholar?q=related:z8obVk7bH7AJ:scholar.google.com/&scioq=%22robustness%22+%22neural+network%22+%22reasoning%22&hl=en&as_sdt=2007"
15,"Y Ling, X Xu, L Shen, J Liu","Multi sensor data fusion method based on fuzzy neural network",2008,"IEEE 6th IEEE International Conference …","server3.eca.ir","http://server3.eca.ir/isi/forum/Multi_sensor_data_fusion_method_based_on_fuzzy_neural_network.pdf","https://scholar.google.com/scholar?cites=17937438192843872671&as_sdt=2005&sciodt=2007&hl=en",150,"2022-07-13 13:50:13","PDF","","","",,,,,15,1.07,4,4,14,"… It is also good in fault-tolerant and robustness [1]. The multi sensor network model … neural network, fuzzy reasoning, expert system, genetic algorithm and etc. Artificial neural network is …","http://server3.eca.ir/isi/forum/Multi_sensor_data_fusion_method_based_on_fuzzy_neural_network.pdf","https://scholar.google.com/scholar?q=related:n9n78P-U7vgJ:scholar.google.com/&scioq=%22robustness%22+%22neural+network%22+%22reasoning%22&hl=en&as_sdt=2007"
27,"A Mishra, P Choudhary","Artificial neural network based controller for speed control of an induction motor (IM) using indirect vector control method",2012,"International Journal of Power …","search.proquest.com","https://search.proquest.com/openview/f5b061e4cc544f90dcea3de2acab95ed/1?pq-origsite=gscholar&cbl=1686343","https://scholar.google.com/scholar?cites=4975189940082827004&as_sdt=2005&sciodt=2007&hl=en",151,"2022-07-13 13:50:13","","","","",,,,,27,2.70,14,2,10,"… installation cost and mechanical robustness .The neural network based controller is found … method to handle in exact information as basis reasoning. With fuzzy logic it is possible to …","","https://scholar.google.com/scholar?q=related:_N67DORsC0UJ:scholar.google.com/&scioq=%22robustness%22+%22neural+network%22+%22reasoning%22&hl=en&as_sdt=2007"
2,"J Lan, Y Zheng, A Lomuscio","Tight neural network verification via semidefinite relaxations and linear reformulations",2022,"Proceedings of the AAAI Conference on …","ojs.aaai.org","https://ojs.aaai.org/index.php/AAAI/article/view/20689","https://scholar.google.com/scholar?cites=8915491120134209055&as_sdt=2005&sciodt=2007&hl=en",152,"2022-07-13 13:50:13","","","","",,,,,2,2.00,1,3,1,"… In this paper we put forward a novel SDP relaxation for achieving tight and efficient neural network robustness verification. We did so by combining the layerwise SDP relaxation with …","https://ojs.aaai.org/index.php/AAAI/article/view/20689/20448","https://scholar.google.com/scholar?q=related:H76__e8vunsJ:scholar.google.com/&scioq=%22robustness%22+%22neural+network%22+%22reasoning%22&hl=en&as_sdt=2007"
15,"XZ Wang, AB Musa","Advances in neural network based learning",2014,"International Journal of Machine Learning and …","Springer","https://link.springer.com/article/10.1007/s13042-013-0220-2","https://scholar.google.com/scholar?cites=12023239247842062186&as_sdt=2005&sciodt=2007&hl=en",153,"2022-07-13 13:50:13","HTML","10.1007/s13042-013-0220-2","","",,,,,15,1.88,8,2,8,"… data, a feed-forwarded neural network (NN) has shown more … structure selection, overtraining, robustness and capability of … in the areas of learning and reasoning. As a result, these …","https://link.springer.com/article/10.1007/s13042-013-0220-2","https://scholar.google.com/scholar?q=related:ai8p4WQg26YJ:scholar.google.com/&scioq=%22robustness%22+%22neural+network%22+%22reasoning%22&hl=en&as_sdt=2007"
2,"B Ghani, S Hallerberg","A randomized bag-of-birds approach to study robustness of automated audio based bird species classification",2021,"Applied Sciences","mdpi.com","https://www.mdpi.com/2076-3417/11/19/9226","https://scholar.google.com/scholar?cites=810040848930314983&as_sdt=2005&sciodt=2007&hl=en",154,"2022-07-13 13:50:13","","","","",,,,,2,2.00,1,2,1,"… an artificial neural network fed with pre-computed sound features to study the robustness of … to understand the numerical results by analytic reasoning. Consider, eg, the precision P ( n ) …","https://www.mdpi.com/2076-3417/11/19/9226/pdf","https://scholar.google.com/scholar?q=related:5xoMPtzXPQsJ:scholar.google.com/&scioq=%22robustness%22+%22neural+network%22+%22reasoning%22&hl=en&as_sdt=2007"
54,"K Fang, TL Wu, D Yang…","Demo2vec: Reasoning object affordances from online videos",2018,"Proceedings of the …","openaccess.thecvf.com","http://openaccess.thecvf.com/content_cvpr_2018/html/Fang_Demo2Vec_Reasoning_Object_CVPR_2018_paper.html","https://scholar.google.com/scholar?cites=1765878811571368789&as_sdt=2005&sciodt=2007&hl=en",155,"2022-07-13 13:50:13","","","","",,,,,54,13.50,14,4,4,"… For the transposed convolution layers in the fully convolutional neural network, we use a … Viewpoint Robustness: In our dataset, the same video clip may be associated with multiple …","http://openaccess.thecvf.com/content_cvpr_2018/papers/Fang_Demo2Vec_Reasoning_Object_CVPR_2018_paper.pdf","https://scholar.google.com/scholar?q=related:VbMZUGypgRgJ:scholar.google.com/&scioq=%22robustness%22+%22neural+network%22+%22reasoning%22&hl=en&as_sdt=2007"
18,"H Wang, J Duan, M Wang, J Zhao…","Research on robot path planning based on fuzzy neural network algorithm",2018,"2018 IEEE 3rd …","ieeexplore.ieee.org","https://ieeexplore.ieee.org/abstract/document/8577599/","https://scholar.google.com/scholar?cites=10390505749174436882&as_sdt=2005&sciodt=2007&hl=en",156,"2022-07-13 13:50:13","","","","",,,,,18,4.50,4,5,4,"… neural network has good learning function and robustness,it … and neural network algorithm, this paper puts forward a fuzzy … membership function or the reasoning process.The fuzzy or …","","https://scholar.google.com/scholar?q=related:EkQyeO19MpAJ:scholar.google.com/&scioq=%22robustness%22+%22neural+network%22+%22reasoning%22&hl=en&as_sdt=2007"
12,"G Cazenavette, C Murdock…","Architectural adversarial robustness: The case for deep pursuit",2021,"Proceedings of the IEEE …","openaccess.thecvf.com","http://openaccess.thecvf.com/content/CVPR2021/html/Cazenavette_Architectural_Adversarial_Robustness_The_Case_for_Deep_Pursuit_CVPR_2021_paper.html","https://scholar.google.com/scholar?cites=11634446153637411181&as_sdt=2005&sciodt=2007&hl=en",157,"2022-07-13 13:50:13","","","","",,,,,12,12.00,4,3,1,"… By adapting this theory towards a global view of a deep neural network as a single … inducing adversarial robustness in modern neural networks and provide theoretical reasoning for its …","http://openaccess.thecvf.com/content/CVPR2021/papers/Cazenavette_Architectural_Adversarial_Robustness_The_Case_for_Deep_Pursuit_CVPR_2021_paper.pdf","https://scholar.google.com/scholar?q=related:bbn3gSLbdaEJ:scholar.google.com/&scioq=%22robustness%22+%22neural+network%22+%22reasoning%22&hl=en&as_sdt=2007"
18,"T Furuhashi","Advances in Fuzzy Logic, Neural Networks and Genetic Algorithms IEEE/Nagoya-University World Wisepersons Workshop Nagoya, Japan, August 9–10, 1994 …",1994,"Conference proceedings WWW","Springer","https://link.springer.com/978-3-540-60607-9","https://scholar.google.com/scholar?cites=11599305755411040994&as_sdt=2005&sciodt=2007&hl=en",158,"2022-07-13 13:50:13","","","","",,,,,18,0.64,18,1,28,"This book presents 14 rigorously reviewed revised papers selected from more than 50 submissions for the 1994 IEEE/Nagoya-University World Wisepersons Workshop, WWW'94, held …","","https://scholar.google.com/scholar?q=related:4kpr-CAD-aAJ:scholar.google.com/&scioq=%22robustness%22+%22neural+network%22+%22reasoning%22&hl=en&as_sdt=2007"
