Cites,Authors,Title,Year,Source,Publisher,ArticleURL,CitesURL,GSRank,QueryDate,Type,DOI,ISSN,CitationURL,Volume,Issue,StartPage,EndPage,ECC,CitesPerYear,CitesPerAuthor,AuthorCount,Age,Abstract,FullTextURL,RelatedURL
9,"F Aghaeipoor, MM Javidi…","IFC-BD: an interpretable fuzzy classifier for boosting explainable artificial intelligence in big data",2021,"IEEE Transactions on …","ieeexplore.ieee.org","https://ieeexplore.ieee.org/abstract/document/9316882/?casa_token=IsrJXT-UbFkAAAAA:n4O0SdQYVY_JApCsnvOPZqdlo4A1W5liVTzQ-TuPQg8tz4S1XYrYI_iHddOBoWS-8TrPhJACIQ","https://scholar.google.com/scholar?cites=5847449566127064961&as_sdt=2005&sciodt=2007&hl=en",118,"2022-07-13 15:27:39","","","","",,,,,9,9.00,3,3,1,"… Explainability mostly refers to understanding the internal … ], was developed showing a robust predictive performance with … robust yet scalable solutions specifically for Big Data scenarios. …","https://ieeexplore.ieee.org/iel7/91/4358784/09316882.pdf?casa_token=Vxgo--C5xEQAAAAA:xGBih-29qXP_BEr-G3hZcBr6Ua_OPehUVcSGsMa4jaUSDkptsyUjM1VXKaV7o4WwWqqxNek3gA","https://scholar.google.com/scholar?q=related:gQcEN2ZQJlEJ:scholar.google.com/&scioq=%22robust%22+%22artificial+intelligence%22+%22explainability%22&hl=en&as_sdt=2007"
36,"A Asatiani, P Malo, PR Nagbøl, E Penttinen…","Sociotechnical envelopment of artificial intelligence: An approach to organizational deployment of inscrutable artificial intelligence systems",2021,"Journal of the …","aisel.aisnet.org","https://aisel.aisnet.org/jais/vol22/iss2/8/","https://scholar.google.com/scholar?cites=5373569757989729782&as_sdt=2005&sciodt=2007&hl=en",121,"2022-07-13 15:27:39","","","","",,,,,36,36.00,7,5,1,"… Writings on AI explainability often employ the interrelated concepts of transparency, interpretability, and explainability in efforts to disentangle the threads of this problem. Transparency …","https://www.researchgate.net/profile/Aleksandre-Asatiani/publication/349945409_Sociotechnical_Envelopment_of_Artificial_Intelligence_An_Approach_to_Organizational_Deployment_of_Inscrutable_Artificial_Intelligence_Systems/links/6048803e299bf1e07869d407/Sociotechnical-Envelopment-of-Artificial-Intelligence-An-Approach-to-Organizational-Deployment-of-Inscrutable-Artificial-Intelligence-Systems.pdf","https://scholar.google.com/scholar?q=related:9nXCeDnBkkoJ:scholar.google.com/&scioq=%22robust%22+%22artificial+intelligence%22+%22explainability%22&hl=en&as_sdt=2007"
2,"A Papadopoulos, J Salinas…","… modeling approaches to characterize risk and achieve safe, effective, and trusted designs in the development of artificial intelligence and autonomous closed-loop …",2021,"Artificial Intelligence and …","spiedigitallibrary.org","https://www.spiedigitallibrary.org/conference-proceedings-of-spie/11746/1174623/Computational-modeling-approaches-to-characterize-risk-and-achieve-safe-effective/10.1117/12.2586101.short","https://scholar.google.com/scholar?cites=1195330875983210929&as_sdt=2005&sciodt=2007&hl=en",122,"2022-07-13 15:27:39","","10.1117/12.2586101.short","","",,,,,2,2.00,1,3,1,"… While software using artificial intelligence and … robust parameter estimates. Bayesian machine learning approaches to model uncertainty may improve the transparency, explainability, …","https://scholar.google.com/scholar?output=instlink&q=info:sSkJPBmrlhAJ:scholar.google.com/&hl=en&as_sdt=2007&scillfp=1042677444159888628&oi=lle","https://scholar.google.com/scholar?q=related:sSkJPBmrlhAJ:scholar.google.com/&scioq=%22robust%22+%22artificial+intelligence%22+%22explainability%22&hl=en&as_sdt=2007"
40,"S El-Sappagh, JM Alonso, SM Islam, AM Sultan…","A multilayer multimodal detection and prediction model based on explainable artificial intelligence for Alzheimer's disease",2021,"Scientific reports","nature.com","https://www.nature.com/articles/s41598-021-82098-3","https://scholar.google.com/scholar?cites=366486912333310398&as_sdt=2005&sciodt=2007&hl=en",123,"2022-07-13 15:27:39","HTML","","","",,,,,40,40.00,8,5,1,"… and explainability are in apparent conflict- ie, the search for a good performance-explainability … , transparent, actionable, or explainable Artificial Intelligence (AI), or just XAI for short. …","https://www.nature.com/articles/s41598-021-82098-3","https://scholar.google.com/scholar?q=related:vul0sOcFFgUJ:scholar.google.com/&scioq=%22robust%22+%22artificial+intelligence%22+%22explainability%22&hl=en&as_sdt=2007"
7,"AKM Nor, SR Pedapati, M Muhammad, V Leiva","Overview of explainable artificial intelligence for prognostic and health management of industrial assets based on preferred reporting items for systematic reviews and …",2021,"Sensors","mdpi.com","https://www.mdpi.com/1385012","https://scholar.google.com/scholar?cites=16033960639772896612&as_sdt=2005&sciodt=2007&hl=en",124,"2022-07-13 15:27:39","","","","",,,,,7,7.00,2,4,1,"… notions of interpretability and explainability. On the one hand, … On the other hand, explainability describes an external proxy … a broader connotation where explainability is accented as a …","https://www.mdpi.com/1424-8220/21/23/8020/pdf","https://scholar.google.com/scholar?q=related:ZC1CFEAShN4J:scholar.google.com/&scioq=%22robust%22+%22artificial+intelligence%22+%22explainability%22&hl=en&as_sdt=2007"
0,"P Rokade, BKR Alluri","Towards Quantification of Explainability Algorithms",2021,"… Conference on Advances in Artificial Intelligence …","dl.acm.org","https://dl.acm.org/doi/abs/10.1145/3505711.3505716?casa_token=XFx4RjC1FeAAAAAA:fuyjeGdEgm_sAbFwKQZIHJTme2g_dzNuEJH42afx5umXsr_bZB-HM7WJlcqYLHfPMVaICbFRk9tVrA","",128,"2022-07-13 15:27:39","","10.1145/3505711.3505716","","",,,,,0,0.00,0,2,1,"… Explainable Artificial Intelligence (XAI) algorithms work on building the trust in such models … endorsement from the domain expert to justify the explainability. In this paper, we propose an …","https://dl.acm.org/doi/pdf/10.1145/3505711.3505716?casa_token=w4Fo3uiTWPAAAAAA:l6p7wCzAYDa3a2CcCCsi0OKt_zvRC4WUTmsa_8Eylhh1_37ve9ZpZ1Gab8_RWbyaFuO17gVrdRwPJg","https://scholar.google.com/scholar?q=related:Fh8cReM9cGkJ:scholar.google.com/&scioq=%22robust%22+%22artificial+intelligence%22+%22explainability%22&hl=en&as_sdt=2007"
10,"PM Maloca, PL Müller, AY Lee, A Tufail…","Unraveling the deep learning gearbox in optical coherence tomography image segmentation towards explainable artificial intelligence",2021,"Communications …","nature.com","https://www.nature.com/articles/s42003-021-01697-y","https://scholar.google.com/scholar?cites=10241265242483533747&as_sdt=2005&sciodt=2007&hl=en",130,"2022-07-13 15:27:39","HTML","","","",,,,,10,10.00,2,5,1,"… explainability with a post hoc XAI technique, which we suggest terming Traceable Relevance Explainability (… as a form of learning a kind of robust average among all the human graders. …","https://www.nature.com/articles/s42003-021-01697-y","https://scholar.google.com/scholar?q=related:syfJPHpIII4J:scholar.google.com/&scioq=%22robust%22+%22artificial+intelligence%22+%22explainability%22&hl=en&as_sdt=2007"
24,"M Mann, C Kumar, WF Zeng, MT Strauss","Artificial intelligence for proteomics and biomarker discovery",2021,"Cell systems","Elsevier","https://www.sciencedirect.com/science/article/pii/S2405471221002507?casa_token=vYalaWGqJlMAAAAA:IbSx0mU0mLyZ956Mn598SxJmzrpXycNtuUqX5BXScIyvF09JeZV66bPjKcXGimQ3dkwm61gefQs","https://scholar.google.com/scholar?cites=6057475146071657733&as_sdt=2005&sciodt=2007&hl=en",131,"2022-07-13 15:27:39","HTML","","","",,,,,24,24.00,6,4,1,"… integration as well as data interpretation by artificial intelligence technologies. Here, we focus on … Finally, we discuss model transparency and explainability and data privacy that are …","https://www.sciencedirect.com/science/article/pii/S2405471221002507?casa_token=vYalaWGqJlMAAAAA:IbSx0mU0mLyZ956Mn598SxJmzrpXycNtuUqX5BXScIyvF09JeZV66bPjKcXGimQ3dkwm61gefQs","https://scholar.google.com/scholar?q=related:Bc1bLY15EFQJ:scholar.google.com/&scioq=%22robust%22+%22artificial+intelligence%22+%22explainability%22&hl=en&as_sdt=2007"
0,"A Brandusescu, A Chan, F Diaz, A Ferraro…","Comments on the Toronto Police Services Board Proposed Policy on AI Technologies-Montréal Society and Artificial Intelligence Collective (MoSAIC)",2021,"Available at …","papers.ssrn.com","https://papers.ssrn.com/sol3/papers.cfm?abstract_id=3987388","",141,"2022-07-13 15:27:39","","","","",,,,,0,0.00,0,5,1,"… of artificial intelligence (AI). The proposed policy and consultation is long overdue. Before addressing our specific recommendations focused on evaluation, explainability and … robust. …","",""
0,"U Kamath, J Liu","Introduction to Interpretability and Explainability",2021,"Explainable Artificial Intelligence: An Introduction to …","Springer","https://link.springer.com/chapter/10.1007/978-3-030-83356-5_1","",142,"2022-07-13 15:27:39","","10.1007/978-3-030-83356-5_1","","",,,,,0,0.00,0,2,1,"… of machine learning and artificial intelligence applications. … today: the interpretability and explainability of models. As algorithms … or robust a model will operate under various conditions. …","","https://scholar.google.com/scholar?q=related:UkwZ363Iuq0J:scholar.google.com/&scioq=%22robust%22+%22artificial+intelligence%22+%22explainability%22&hl=en&as_sdt=2007"
1,"J Chen, V Storchan","Seven challenges for harmonizing explainability requirements",2021,"arXiv preprint arXiv:2108.05390","arxiv.org","https://arxiv.org/abs/2108.05390","https://scholar.google.com/scholar?cites=9046853232323011469&as_sdt=2005&sciodt=2007&hl=en",149,"2022-07-13 15:27:39","","","","",,,,,1,1.00,1,2,1,"… that are robust against such manipulation [5, 29]. Initial research in this direction around robust optimization are … Explanation in artificial intelligence: Insights from the social sciences…","https://arxiv.org/pdf/2108.05390","https://scholar.google.com/scholar?q=related:jSO1HxXhjH0J:scholar.google.com/&scioq=%22robust%22+%22artificial+intelligence%22+%22explainability%22&hl=en&as_sdt=2007"
1,"BJM Webb-Robertson","Explainable artificial intelligence in endocrinological medical research",2021,"The Journal of Clinical Endocrinology & …","academic.oup.com","https://academic.oup.com/jcem/article-abstract/106/7/e2809/6261062","https://scholar.google.com/scholar?cites=13812109888254201213&as_sdt=2005&sciodt=2007&hl=en",150,"2022-07-13 15:27:39","","","","",,,,,1,1.00,1,1,1,"… work focused on interpretability and explainability, which focus on … (8), demonstrate that their model is robust to both where and how … The explainability of the model is based on feature …","https://academic.oup.com/jcem/article/106/7/e2809/6261062","https://scholar.google.com/scholar?q=related:fU0NgMN4rr8J:scholar.google.com/&scioq=%22robust%22+%22artificial+intelligence%22+%22explainability%22&hl=en&as_sdt=2007"
14,"E Blasch, T Pham, CY Chong, W Koch…","Machine learning/artificial intelligence for sensor data fusion–opportunities and challenges",2021,"IEEE Aerospace and …","ieeexplore.ieee.org","https://ieeexplore.ieee.org/abstract/document/9475913/?casa_token=WTez9Axz-SQAAAAA:GSu5q05heOWu-TnYY3eJ5FI1q3b-KPVF5dodVGfZpAkvqxQImah68s9IXH0u0G0Pf7b5q22Kmg","https://scholar.google.com/scholar?cites=1642827285937290140&as_sdt=2005&sciodt=2007&hl=en",151,"2022-07-13 15:27:39","","","","",,,,,14,14.00,3,5,1,"… There are opportunities to resolve explainability by combing AI/ML … multiple hypothesis methods for situation explainability. … Methods of robust evaluation for verification and validation …","https://ieeexplore.ieee.org/iel7/62/9475847/09475913.pdf?casa_token=mHBdp8vPtPoAAAAA:h065-q6gFBDkN_8ul0OEptJaeBaHj_9p2HSN9XtN5_7qMxePvV97WZHMqy3hBL2rTatwF2EnRw","https://scholar.google.com/scholar?q=related:nHucZbZ-zBYJ:scholar.google.com/&scioq=%22robust%22+%22artificial+intelligence%22+%22explainability%22&hl=en&as_sdt=2007"
0,"J Doese, T Weis","Towards Explainability of non-Convolutional Neural Networks",2021,"Adjunct Proceedings of the 2021 ACM International …","dl.acm.org","https://dl.acm.org/doi/abs/10.1145/3460418.3479313?casa_token=xKXn9H7WAREAAAAA:xx2jSl3XtLk4mQtXiG5h0GipfUXkrRlA21_fKgXKz7aML0oEuZyS24C1f0PMpPtmSNM4D94S0miAgw","",159,"2022-07-13 15:27:39","","10.1145/3460418.3479313","","",,,,,0,0.00,0,2,1,"… retrain this part instead of recreating the artificial intelligence. … of evolving applications with artificial intelligence in our life. … data is processed in an artificial intelligence. In the terms of …","https://dl.acm.org/doi/pdf/10.1145/3460418.3479313?casa_token=WWWhUdXtcPYAAAAA:Dxyl3lSzNHE7K7_PGK7b4JZiHKhOkzO1yEVpIpbrYL_F6hHw4ho9GZAqG9fqal7jqeyuWReI9YjeIw","https://scholar.google.com/scholar?q=related:SMd_S7MNWfoJ:scholar.google.com/&scioq=%22robust%22+%22artificial+intelligence%22+%22explainability%22&hl=en&as_sdt=2007"
9,"R Shad, JP Cunningham, EA Ashley…","Designing clinically translatable artificial intelligence systems for high-dimensional medical imaging",2021,"Nature Machine …","nature.com","https://www.nature.com/articles/s42256-021-00399-8","https://scholar.google.com/scholar?cites=15192561796298494450&as_sdt=2005&sciodt=2007&hl=en",160,"2022-07-13 15:27:39","HTML","","","",,,,,9,9.00,2,4,1,"… architectures and explainable artificial intelligence algorithms are still … that attempt to address explainability, uncertainty and bias … These architectures are remarkably robust even in the …","https://www.nature.com/articles/s42256-021-00399-8","https://scholar.google.com/scholar?q=related:8tGKyHXS1tIJ:scholar.google.com/&scioq=%22robust%22+%22artificial+intelligence%22+%22explainability%22&hl=en&as_sdt=2007"
3,"R Geada, T Teofili, R Vieira, R Whitworth…","TrustyAI Explainability Toolkit",2021,"arXiv preprint arXiv …","arxiv.org","https://arxiv.org/abs/2104.12717","https://scholar.google.com/scholar?cites=18316933571453086542&as_sdt=2005&sciodt=2007&hl=en",162,"2022-07-13 15:27:39","","","","",,,,,3,3.00,1,5,1,"… Artificial intelligence (AI) is becoming increasingly more … initiative which looks into explainable artificial intelligence (XAI) … [RSG16] to make it robust in scenarios where either training …","https://arxiv.org/pdf/2104.12717","https://scholar.google.com/scholar?q=related:TmvjNAnSMv4J:scholar.google.com/&scioq=%22robust%22+%22artificial+intelligence%22+%22explainability%22&hl=en&as_sdt=2007"
0,"D Lyu, F Yang, H Kwon, B Liu, W Dong…","Explainable Neuro-Symbolic Hierarchical Reinforcement Learning",2021,"… Artificial Intelligence …","books.google.com","https://books.google.com/books?hl=en&lr=&id=uFtcEAAAQBAJ&oi=fnd&pg=PA235&dq=%22robust%22+%22artificial+intelligence%22+%22explainability%22&ots=s7KA2yzB2a&sig=FXhQ7PpZh9faQ8pVP7NGoDkCxfk","",163,"2022-07-13 15:27:39","","","","",,,,,0,0.00,0,6,1,"… This also enables the decision-making process to be robust and flexible when facing … The success ratio with respect to explainability is the key to our plan evaluation mechanism. …","","https://scholar.google.com/scholar?q=related:PEei1Bl1jWcJ:scholar.google.com/&scioq=%22robust%22+%22artificial+intelligence%22+%22explainability%22&hl=en&as_sdt=2007"
14,"M Komatsu, A Sakai, A Dozen, K Shozu, S Yasutomi…","Towards clinical application of artificial intelligence in ultrasound imaging",2021,"Biomedicines","mdpi.com","https://www.mdpi.com/1161590","https://scholar.google.com/scholar?cites=1487012258482470363&as_sdt=2005&sciodt=2007&hl=en",164,"2022-07-13 15:27:39","","","","",,,,,14,14.00,2,6,1,"… data quality and to accumulate robust technologies, including … a popular technique for AI explainability, which enables the … useful in terms of AI explainability when we detected cardiac …","https://www.mdpi.com/2227-9059/9/7/720/pdf","https://scholar.google.com/scholar?q=related:271_Q8XtohQJ:scholar.google.com/&scioq=%22robust%22+%22artificial+intelligence%22+%22explainability%22&hl=en&as_sdt=2007"
0,"ZU Islam","Software Engineering Methods for Responsible Artificial Intelligence",2021,"Proceedings of the 20th International Conference on …","ifaamas.org","https://www.ifaamas.org/Proceedings/aamas2021/pdfs/p1814.pdf","",169,"2022-07-13 15:27:39","PDF","","","",,,,,0,0.00,0,1,1,"… The task of designing robust and reliable autonomous … efficient development of robust Artificial Intelligence (AI) systems. … These approaches are required for the explainability of opaque …","https://www.ifaamas.org/Proceedings/aamas2021/pdfs/p1814.pdf","https://scholar.google.com/scholar?q=related:QZTod1KFyvIJ:scholar.google.com/&scioq=%22robust%22+%22artificial+intelligence%22+%22explainability%22&hl=en&as_sdt=2007"
9,"K Fiok, W Karwowski, E Gutierrez…","Analysis of sentiment in tweets addressed to a single domain-specific Twitter account: Comparison of model performance and explainability of predictions",2021,"Expert Systems with …","Elsevier","https://www.sciencedirect.com/science/article/pii/S0957417421011428?casa_token=6Km5jLgTc2cAAAAA:UzLsDV2Sc9Gaq3oXq-x2-pH6CGh_rXKeT_yXjzORAazZESbqcC7x3GnFP8WjSzs-MxHusk3KKKA","https://scholar.google.com/scholar?cites=2048225978693951882&as_sdt=2005&sciodt=2007&hl=en",171,"2022-07-13 15:27:39","HTML","","","",,,,,9,9.00,2,4,1,"… We also demonstrated how a recent explainable artificial intelligence technique can be … However, we believe one has to restrain from drawing any more robust conclusions in this …","https://www.sciencedirect.com/science/article/pii/S0957417421011428?casa_token=6Km5jLgTc2cAAAAA:UzLsDV2Sc9Gaq3oXq-x2-pH6CGh_rXKeT_yXjzORAazZESbqcC7x3GnFP8WjSzs-MxHusk3KKKA","https://scholar.google.com/scholar?q=related:iqHH96zCbBwJ:scholar.google.com/&scioq=%22robust%22+%22artificial+intelligence%22+%22explainability%22&hl=en&as_sdt=2007"
9,"W Walter, C Haferlach, N Nadarajah, I Schmidts…","How artificial intelligence might disrupt diagnostics in hematology in the near future",2021,"Oncogene","nature.com","https://www.nature.com/articles/s41388-021-01861-y","https://scholar.google.com/scholar?cites=2795919019147735579&as_sdt=2005&sciodt=2007&hl=en",179,"2022-07-13 15:27:39","HTML","","","",,,,,9,9.00,2,5,1,"Artificial intelligence (AI) is about to make itself indispensable in the health care sector. Examples of successful applications or promising approaches range from the application of …","https://www.nature.com/articles/s41388-021-01861-y","https://scholar.google.com/scholar?q=related:GzIP1YgZzSYJ:scholar.google.com/&scioq=%22robust%22+%22artificial+intelligence%22+%22explainability%22&hl=en&as_sdt=2007"
5,"QV Dang","Improving the performance of the intrusion detection systems by the machine learning explainability",2021,"International Journal of Web Information Systems","emerald.com","https://www.emerald.com/insight/content/doi/10.1108/IJWIS-03-2021-0022/full/html?casa_token=Vapyz06DdLAAAAAA:mkwM9m9VWvkKFqJYJOXdEuF_JHlL7SxaiFWXeV4o2KhVGHQBNucJN6WIjucSjEC85kOl9gLdhqacd0AXhDxBZN1dydinGlbK9Z4neke3sjWiIEmUbNaO","https://scholar.google.com/scholar?cites=18065158984034829343&as_sdt=2005&sciodt=2007&hl=en",181,"2022-07-13 15:27:39","HTML","10.1108/IJWIS-03-2021-0022","","",,,,,5,5.00,5,1,1,"… The authors confirm our hypothesis above and claim that by forcing the explainability, the model becomes more robust, requires less computational power but achieves a better …","https://www.emerald.com/insight/content/doi/10.1108/IJWIS-03-2021-0022/full/html?casa_token=Vapyz06DdLAAAAAA:mkwM9m9VWvkKFqJYJOXdEuF_JHlL7SxaiFWXeV4o2KhVGHQBNucJN6WIjucSjEC85kOl9gLdhqacd0AXhDxBZN1dydinGlbK9Z4neke3sjWiIEmUbNaO","https://scholar.google.com/scholar?q=related:H0Ra9mFWtPoJ:scholar.google.com/&scioq=%22robust%22+%22artificial+intelligence%22+%22explainability%22&hl=en&as_sdt=2007"
20,"D Slack, A Hilgard, S Singh…","Reliable post hoc explanations: Modeling uncertainty in explainability",2021,"Advances in Neural …","proceedings.neurips.cc","https://proceedings.neurips.cc/paper/2021/hash/4e246a381baf2ce038b3b0f82c7d6fb4-Abstract.html","https://scholar.google.com/scholar?cites=10830394422218988645&as_sdt=2005&sciodt=2007&hl=en",184,"2022-07-13 15:27:39","","","","",,,,,20,20.00,5,4,1,"… However, our explanations seem to be robust to hyperparameter choices in general. … In Artificial Intelligence and Machine Learning for Multi-Domain Operations Applications, volume …","https://proceedings.neurips.cc/paper/2021/file/4e246a381baf2ce038b3b0f82c7d6fb4-Paper.pdf","https://scholar.google.com/scholar?q=related:ZRy8WVhKTZYJ:scholar.google.com/&scioq=%22robust%22+%22artificial+intelligence%22+%22explainability%22&hl=en&as_sdt=2007"
5,"D Kaur, S Uslu, A Durresi, S Badve…","Trustworthy explainability acceptance: A new metric to measure the trustworthiness of interpretable AI medical diagnostic systems",2021,"Conference on Complex …","Springer","https://link.springer.com/chapter/10.1007/978-3-030-79725-6_4","https://scholar.google.com/scholar?cites=1075970497145752793&as_sdt=2005&sciodt=2007&hl=en",188,"2022-07-13 15:27:39","","10.1007/978-3-030-79725-6_4","","",,,,,5,5.00,1,5,1,"We propose, Trustworthy Explainability Acceptance metric to evaluate explainable AI systems using expert-in-the-loop. Our metric calculates acceptance by quantifying the distance …","https://cs.iupui.edu/~adurresi/papers/W_Explainability_Metrics_Final.pdf","https://scholar.google.com/scholar?q=related:2UwsZ3ed7g4J:scholar.google.com/&scioq=%22robust%22+%22artificial+intelligence%22+%22explainability%22&hl=en&as_sdt=2007"
3,"D Franco, L Oneto, N Navarin, D Anguita","Toward learning trustworthily from data combining privacy, fairness, and explainability: an application to face recognition",2021,"Entropy","mdpi.com","https://www.mdpi.com/1228840","https://scholar.google.com/scholar?cites=4791080638337095879&as_sdt=2005&sciodt=2007&hl=en",190,"2022-07-13 15:27:39","","","","",,,,,3,3.00,1,4,1,"… healthcare and policing, the use of artificial intelligence coupled with the ability to learn from … trustworthiness by delivering privacy, fairness, and explainability by design. In particular, we …","https://www.mdpi.com/1099-4300/23/8/1047/pdf","https://scholar.google.com/scholar?q=related:x5hV0nRWfUIJ:scholar.google.com/&scioq=%22robust%22+%22artificial+intelligence%22+%22explainability%22&hl=en&as_sdt=2007"
4,"T Ozrazgat-Baslanti, TJ Loftus, Y Ren…","Advances in artificial intelligence and deep learning systems in ICU-related acute kidney injury",2021,"Current Opinion in …","ingentaconnect.com","https://www.ingentaconnect.com/content/wk/cocca/2021/00000027/00000006/art00004","https://scholar.google.com/scholar?cites=4692249291321030698&as_sdt=2005&sciodt=2007&hl=en",192,"2022-07-13 15:27:39","","","","",,,,,4,4.00,1,4,1,"… The lack of interpretability, explainability, fairness and transparency of artificial intelligence models hinder their entrustment and clinical implementation; compliance with standardized …","https://scholar.google.com/scholar?output=instlink&q=info:KrjErt43HkEJ:scholar.google.com/&hl=en&as_sdt=2007&scillfp=14734893538482752921&oi=lle","https://scholar.google.com/scholar?q=related:KrjErt43HkEJ:scholar.google.com/&scioq=%22robust%22+%22artificial+intelligence%22+%22explainability%22&hl=en&as_sdt=2007"
7,"H Liu, C Zhong, A Alnusair, SR Islam","FAIXID: a framework for enhancing ai explainability of intrusion detection results using data cleaning techniques",2021,"Journal of Network and Systems …","Springer","https://link.springer.com/article/10.1007/s10922-021-09606-8","https://scholar.google.com/scholar?cites=1541539038136154885&as_sdt=2005&sciodt=2007&hl=en",193,"2022-07-13 15:27:39","","10.1007/s10922-021-09606-8","","",,,,,7,7.00,2,4,1,"… Artificial Intelligence (XAI) and data cleaning methods for improving the explainability and … We identified five functional modules in FAIXID: (1) the pre-modeling explainability module …","https://awny.sitehost.iu.edu/publications/jons_2021.pdf","https://scholar.google.com/scholar?q=related:BbuAd5alZBUJ:scholar.google.com/&scioq=%22robust%22+%22artificial+intelligence%22+%22explainability%22&hl=en&as_sdt=2007"
19,"L Chazette, W Brunotte, T Speith","Exploring explainability: a definition, a model, and a knowledge catalogue",2021,"2021 IEEE 29th international …","ieeexplore.ieee.org","https://ieeexplore.ieee.org/abstract/document/9604587/?casa_token=jw1en8VTZHkAAAAA:fd0ba2VoZ7QiddD5CS-VYun2jn_8lu8hVvcad7jItvHYR7s0imdhcE2k6NwZCI6zkDS5Ir7qyQ","https://scholar.google.com/scholar?cites=7982499423853252319&as_sdt=2005&sciodt=2007&hl=en",197,"2022-07-13 15:27:39","","","","",,,,,19,19.00,6,3,1,"… INTRODUCTION We live in the age of artificial intelligence (AI). Software decision-making has … In general, explainability supports the development of more robust systems for critical …","https://ieeexplore.ieee.org/iel7/9604522/9604523/09604587.pdf?casa_token=G5oxBP3mWxAAAAAA:O9B5Cx1bqKo7XqAZuoo04MgRn3RI5X96QXME_Z40EXMvYxDKiLICuxVptelyFhSF6ePdLfVaPQ","https://scholar.google.com/scholar?q=related:346I0u6Ix24J:scholar.google.com/&scioq=%22robust%22+%22artificial+intelligence%22+%22explainability%22&hl=en&as_sdt=2007"
