Cites,Authors,Title,Year,Source,Publisher,ArticleURL,CitesURL,GSRank,QueryDate,Type,DOI,ISSN,CitationURL,Volume,Issue,StartPage,EndPage,ECC,CitesPerYear,CitesPerAuthor,AuthorCount,Age,Abstract,FullTextURL,RelatedURL
43,"Y Yang, Y Zhuang, Y Pan","Multiple knowledge representation for big data artificial intelligence: framework, applications, and case studies",2021,"Frontiers of Information Technology & …","Springer","https://link.springer.com/article/10.1631/FITEE.2100463","https://scholar.google.com/scholar?cites=10446383365365301054&as_sdt=2005&sciodt=2007&hl=en",199,"2022-07-13 15:27:39","","10.1631/FITEE.2100463","","",,,,,43,43.00,14,3,1,"… We discuss several recently attainable changes for better generalization and explainability. First, we show that the AI research methodology could be changed by MKR. Then we …","https://scholar.google.com/scholar?output=instlink&q=info:Pv8l0FIC-ZAJ:scholar.google.com/&hl=en&as_sdt=2007&scillfp=13226714714096958033&oi=lle","https://scholar.google.com/scholar?q=related:Pv8l0FIC-ZAJ:scholar.google.com/&scioq=%22robust%22+%22artificial+intelligence%22+%22explainability%22&hl=en&as_sdt=2007"
77,"R Hamon, H Junklewitz…","Robustness and explainability of artificial intelligence",2020,"… Office of the …","publications.jrc.ec.europa.eu","https://publications.jrc.ec.europa.eu/repository/bitstream/JRC119336/dpad_report.pdf?ref=https://githubhelp.com","https://scholar.google.com/scholar?cites=15582154415013018397&as_sdt=2005&sciodt=2007&hl=en",1,"2022-07-13 15:27:39","PDF","","","",,,,,77,38.50,26,3,2,"… In the light of the recent advances in artificial intelligence (AI), the challenges posed by its … has introduced a set of rights that relate to the explainability of AI and, in particular, that provide …","https://publications.jrc.ec.europa.eu/repository/bitstream/JRC119336/dpad_report.pdf?ref=https://githubhelp.com","https://scholar.google.com/scholar?q=related:Hbsi9uHuPtgJ:scholar.google.com/&scioq=%22robust%22+%22artificial+intelligence%22+%22explainability%22&hl=en&as_sdt=2007"
191,"G Marcus","The next decade in ai: four steps towards robust artificial intelligence",2020,"arXiv preprint arXiv:2002.06177","arxiv.org","https://arxiv.org/abs/2002.06177","https://scholar.google.com/scholar?cites=10762068228089742706&as_sdt=2005&sciodt=2007&hl=en",2,"2022-07-13 15:27:39","","","","",,,,,191,95.50,191,1,2,"Recent research in artificial intelligence and machine learning has largely emphasized general-… , that could provide the substrate for a richer, more robust AI than is currently possible. …","https://arxiv.org/pdf/2002.06177","https://scholar.google.com/scholar?q=related:coXOlwiMWpUJ:scholar.google.com/&scioq=%22robust%22+%22artificial+intelligence%22+%22explainability%22&hl=en&as_sdt=2007"
2,"A Burke","Robust artificial intelligence for active cyber defence",2020,"Alan Turing Institute, Tech. Rep","turing.ac.uk","https://www.turing.ac.uk/sites/default/files/2020-08/public_ai_acd_techreport_final.pdf","https://scholar.google.com/scholar?cites=6807251483799172971&as_sdt=2005&sciodt=2007&hl=en",8,"2022-07-13 15:27:39","PDF","","","",,,,,2,1.00,2,1,2,"The global environment for artificial intelligence (AI) research, technology and talent is highly competitive. The United States (US) and China are competing for global AI dominance, and …","https://www.turing.ac.uk/sites/default/files/2020-08/public_ai_acd_techreport_final.pdf","https://scholar.google.com/scholar?q=related:a7eZfCg3eF4J:scholar.google.com/&scioq=%22robust%22+%22artificial+intelligence%22+%22explainability%22&hl=en&as_sdt=2007"
38,"LG McCoy, S Nagaraj, F Morgado, V Harish…","What do medical students actually need to know about artificial intelligence?",2020,"NPJ digital …","nature.com","https://www.nature.com/articles/s41746-020-0294-7","https://scholar.google.com/scholar?cites=8501801655952161443&as_sdt=2005&sciodt=2007&hl=en",15,"2022-07-13 15:27:39","HTML","","","",,,,,38,19.00,8,5,2,"… With emerging innovations in artificial intelligence (AI) poised to … explainability, health equity, and data security 3,4,5 . We advocate for a dual-focused approach: combining robust, …","https://www.nature.com/articles/s41746-020-0294-7","https://scholar.google.com/scholar?q=related:ozrbxY93_HUJ:scholar.google.com/&scioq=%22robust%22+%22artificial+intelligence%22+%22explainability%22&hl=en&as_sdt=2007"
28,"A Kuppa, NA Le-Khac","Black box attacks on explainable artificial intelligence (XAI) methods in cyber security",2020,"2020 International Joint Conference on …","ieeexplore.ieee.org","https://ieeexplore.ieee.org/abstract/document/9206780/?casa_token=YVdoFW5pIJ4AAAAA:FKRzVC4Bdi_UqCK4IViygYSbWfROvQzxBJQ6rSFqQJdYZ0kTTzC2ymNUucL1mITcd0Xjgc56sg","https://scholar.google.com/scholar?cites=428996155042412787&as_sdt=2005&sciodt=2007&hl=en",20,"2022-07-13 15:27:39","","","","",,,,,28,14.00,14,2,2,"… demand for transparency and explainability is increasing from … : (a) creating and improving explainability methods which help … and can help in designing secure and robust XAI methods. …","https://ieeexplore.ieee.org/iel7/9200848/9206590/09206780.pdf?casa_token=2MYIV0KQTJgAAAAA:dEOXLRreWS_u--S_ix2HwFoY_0jpYjDisQnJrQcilpMAzrVI2Mv_wjE5abihgtbuNbFwiR-fMw","https://scholar.google.com/scholar?q=related:87hP57oZ9AUJ:scholar.google.com/&scioq=%22robust%22+%22artificial+intelligence%22+%22explainability%22&hl=en&as_sdt=2007"
2451,"AB Arrieta, N Díaz-Rodríguez, J Del Ser, A Bennetot…","Explainable Artificial Intelligence (XAI): Concepts, taxonomies, opportunities and challenges toward responsible AI",2020,"Information fusion","Elsevier","https://www.sciencedirect.com/science/article/pii/S1566253519308103?casa_token=baDphZvNdsgAAAAA:sInFBjAA7de8PynpYn6wD1lw6hsIy-RQS9aHFZ60h3AxpffFthA9n083LuUCmhsLtUc1CvW8i8k","https://scholar.google.com/scholar?cites=315312605783825658&as_sdt=2005&sciodt=2007&hl=en",21,"2022-07-13 15:27:39","HTML","","","",,,,,2451,1225.50,490,5,2,"… to define explainability in Machine … explainability is sought. Departing from this definition, we propose and discuss about a taxonomy of recent contributions related to the explainability of …","https://www.sciencedirect.com/science/article/pii/S1566253519308103?casa_token=baDphZvNdsgAAAAA:sInFBjAA7de8PynpYn6wD1lw6hsIy-RQS9aHFZ60h3AxpffFthA9n083LuUCmhsLtUc1CvW8i8k","https://scholar.google.com/scholar?q=related:-pzy9CQ3YAQJ:scholar.google.com/&scioq=%22robust%22+%22artificial+intelligence%22+%22explainability%22&hl=en&as_sdt=2007"
82,"W Guo","Explainable artificial intelligence for 6G: Improving trust between human and machine",2020,"IEEE Communications Magazine","ieeexplore.ieee.org","https://ieeexplore.ieee.org/abstract/document/9141213/?casa_token=AArOrqYFPz0AAAAA:f2RDUSSnWzVNsFqzpgIf-im2rZ5_PzwuQUqP0MUwAm39d8aN7u_jTfypgj9J9Mu31aDi5J61uA","https://scholar.google.com/scholar?cites=6352746903257944416&as_sdt=2005&sciodt=2007&hl=en",28,"2022-07-13 15:27:39","","","","",,,,,82,41.00,82,1,2,"… This loss of model explainability means we are vulnerable to … the core methods of explainable artificial intelligence (XAI) in … to empower traditional RL with robust and high-efficiency …","https://ieeexplore.ieee.org/iel7/35/9141177/09141213.pdf?casa_token=nrYQyD72cU8AAAAA:zSevxHHhcsPG2akmunzdkdfgtg-XxqsBCuJUXoJkfTaNAND20kmtC0EhTSH2dg1k-zEkd5oftw","https://scholar.google.com/scholar?q=related:YBGndKZ9KVgJ:scholar.google.com/&scioq=%22robust%22+%22artificial+intelligence%22+%22explainability%22&hl=en&as_sdt=2007"
55,"L Longo, R Goebel, F Lecue, P Kieseberg…","Explainable artificial intelligence: Concepts, applications, research challenges and visions",2020,"… -Domain Conference for …","Springer","https://link.springer.com/chapter/10.1007/978-3-030-57321-8_1","https://scholar.google.com/scholar?cites=18178203051147574827&as_sdt=2005&sciodt=2007&hl=en",40,"2022-07-13 15:27:39","","10.1007/978-3-030-57321-8_1","","",,,,,55,27.50,11,5,2,"… More precisely, most of the existing learning algorithms can often lead to robust and … of the topic of explainability [68], by now referred to as Explainable Artificial Intelligence (XAI) [54], it …","https://www.researchgate.net/profile/Peter-Kieseberg/publication/343751247_Explainable_Artificial_Intelligence_Concepts_Applications_Research_Challenges_and_Visions/links/5f45149992851cd302296018/Explainable-Artificial-Intelligence-Concepts-Applications-Research-Challenges-and-Visions.pdf","https://scholar.google.com/scholar?q=related:K76S3lzzRfwJ:scholar.google.com/&scioq=%22robust%22+%22artificial+intelligence%22+%22explainability%22&hl=en&as_sdt=2007"
38,"S Sharma, J Henderson, J Ghosh","Certifai: A common framework to provide explanations and analyse the fairness and robustness of black-box models",2020,"… of the AAAI/ACM Conference on AI …","dl.acm.org","https://dl.acm.org/doi/abs/10.1145/3375627.3375812?casa_token=9-dJUh2irf8AAAAA:nNDCRN1EUaGjVOeOXB1nOGP7WGHmhVvoLznV0kTPH6Ev9u73mfD7HN-uR2B-xLHxY9shm00pzkjDBw","https://scholar.google.com/scholar?cites=7380127540338932584&as_sdt=2005&sciodt=2007&hl=en",41,"2022-07-13 15:27:39","","10.1145/3375627.3375812","","",,,,,38,19.00,13,3,2,"… of explainability, robustness, and fairness. Often, issues in … as well as provide explainability, this paper introduces a … pretability, and Fairness of Artificial Intelligence models (CERTIFAI). …","https://dl.acm.org/doi/pdf/10.1145/3375627.3375812?casa_token=N8YCXj-hXbEAAAAA:g4IzA25IkvX-yL-_VoYcKJPbLmEOLLtVk2-JggT164g-9F5aKJQ7H8KS5KnmOGvoI3ErLRjCBNYq1g","https://scholar.google.com/scholar?q=related:aLv6duV6a2YJ:scholar.google.com/&scioq=%22robust%22+%22artificial+intelligence%22+%22explainability%22&hl=en&as_sdt=2007"
64,"E Zihni, VI Madai, M Livne, I Galinovic, AA Khalil…","Opening the black box of artificial intelligence for clinical decision support: A study predicting stroke outcome",2020,"Plos one","journals.plos.org","https://journals.plos.org/plosone/article?id=10.1371/journal.pone.0231166","https://scholar.google.com/scholar?cites=5602039521824319808&as_sdt=2005&sciodt=2007&hl=en",45,"2022-07-13 15:27:39","HTML","","","",,,,,64,32.00,11,6,2,"… To our knowledge, we present in this work the first explainability … learning methods can provide explainability which is compatible … and further testing of different explainability methods. …","https://journals.plos.org/plosone/article?id=10.1371/journal.pone.0231166","https://scholar.google.com/scholar?q=related:QKkJpENxvk0J:scholar.google.com/&scioq=%22robust%22+%22artificial+intelligence%22+%22explainability%22&hl=en&as_sdt=2007"
15,"XV Nguyen, MA Oztek, DD Nelakurti…","Applying artificial intelligence to mitigate effects of patient motion or other complicating factors on image quality",2020,"Topics in Magnetic …","journals.lww.com","https://journals.lww.com/topicsinmri/Fulltext/2020/08000/Applying_Artificial_Intelligence_to_Mitigate.3.aspx?casa_token=1rHdVeeWQ8gAAAAA:Il0fr7cZ00rVryWVqtxb4z_tUSL8wHy4QAEHpzgFVgyQRPEeu8mwojwfYbZLtJc1l7YM0Ziibxnj3lGb-5d4MbCTDZs","https://scholar.google.com/scholar?cites=18311894113100329571&as_sdt=2005&sciodt=2007&hl=en",46,"2022-07-13 15:27:39","HTML","","","",,,,,15,7.50,4,4,2,"… artificial intelligence approaches often have limitations, such as problems with generalizability or explainability, … and was found to achieve robust denoising performance. Analogous …","https://journals.lww.com/topicsinmri/Fulltext/2020/08000/Applying_Artificial_Intelligence_to_Mitigate.3.aspx?casa_token=1rHdVeeWQ8gAAAAA:Il0fr7cZ00rVryWVqtxb4z_tUSL8wHy4QAEHpzgFVgyQRPEeu8mwojwfYbZLtJc1l7YM0Ziibxnj3lGb-5d4MbCTDZs","https://scholar.google.com/scholar?q=related:Y3Lp36zqIP4J:scholar.google.com/&scioq=%22robust%22+%22artificial+intelligence%22+%22explainability%22&hl=en&as_sdt=2007"
15,"R Shafik, A Wheeldon…","Explainability and dependability analysis of learning automata based AI hardware",2020,"… -Line Testing and Robust …","ieeexplore.ieee.org","https://ieeexplore.ieee.org/abstract/document/9159725/?casa_token=2zBHl56H1CMAAAAA:7bIGb4Lo6kwlwtlileekuEq_dsmW3WYaHXKKaCxlpdI6XfAEPacbGjlpqkwdP2-_6Wi46_0jIw","https://scholar.google.com/scholar?cites=5669819736668225411&as_sdt=2005&sciodt=2007&hl=en",47,"2022-07-13 15:27:39","","","","",,,,,15,7.50,5,3,2,"… Explainability remains the holy grail in designing the next-generation pervasive artificial intelligence (… In this paper, we study explainability and dependability using reachability analysis …","https://ieeexplore.ieee.org/iel7/9151097/9159702/09159725.pdf?casa_token=L_iKgpHQYRMAAAAA:S77uwp7h5JKILL1RlDLKib4DkcEXA7YZgvnUc-SHkybPeBnQKD6Knr4FB79oELDzVRhHhycbow","https://scholar.google.com/scholar?q=related:g7-bsAI_r04J:scholar.google.com/&scioq=%22robust%22+%22artificial+intelligence%22+%22explainability%22&hl=en&as_sdt=2007"
19,"M Szczepański, M Choraś, M Pawlicki…","Achieving explainability of intrusion detection system by hybrid oracle-explainer approach",2020,"… Joint Conference on …","ieeexplore.ieee.org","https://ieeexplore.ieee.org/abstract/document/9207199/?casa_token=u7aIZ0M3GvMAAAAA:qrjq_-7UDtbbNV5wbhn3yDkFhSVQN9656nXMsA1bg6ufwCxN9F8YviNzJ5XrpB6BfCnTxHfiWA","https://scholar.google.com/scholar?cites=3177650382402654263&as_sdt=2005&sciodt=2007&hl=en",49,"2022-07-13 15:27:39","","","","",,,,,19,9.50,5,4,2,"… Principles of Explainable Artificial Intelligence The need for understanding the decision-making process of an Artificial Intelligence system is not a truly new concept. In fact, it has been …","https://ieeexplore.ieee.org/iel7/9200848/9206590/09207199.pdf?casa_token=qTXdH_nuX9cAAAAA:_nV0tJTACietzczr6TtuW6sH4EysVWzofrCcaj8TVbcC1bguTGTW1lLMaK4neJo2d1dku9ijKg","https://scholar.google.com/scholar?q=related:N5B-1y9IGSwJ:scholar.google.com/&scioq=%22robust%22+%22artificial+intelligence%22+%22explainability%22&hl=en&as_sdt=2007"
33,"V Arya, RKE Bellamy, PY Chen, A Dhurandhar…","AI Explainability 360: An Extensible Toolkit for Understanding Data and Machine Learning Models.",2020,"J. Mach. Learn. Res …","jmlr.org","https://www.jmlr.org/papers/volume21/19-1035/19-1035.pdf","https://scholar.google.com/scholar?cites=15085629325766779273&as_sdt=2005&sciodt=2007&hl=en",52,"2022-07-13 15:27:39","PDF","","","",,,,,33,16.50,7,5,2,"… As artificial intelligence algorithms make further inroads in high-stakes societal … Explainability 360, an open-source Python toolkit featuring ten diverse and state-of-the-art explainability …","https://www.jmlr.org/papers/volume21/19-1035/19-1035.pdf","https://scholar.google.com/scholar?q=related:iWGL1_HrWtEJ:scholar.google.com/&scioq=%22robust%22+%22artificial+intelligence%22+%22explainability%22&hl=en&as_sdt=2007"
59,"G Fidel, R Bitton, A Shabtai","When explainability meets adversarial learning: Detecting adversarial examples using shap signatures",2020,"2020 international joint …","ieeexplore.ieee.org","https://ieeexplore.ieee.org/abstract/document/9207637/?casa_token=kriYI0mx7hEAAAAA:zUXiFqeoWuyzAXHIRQ8uuyepc3noZ6-GEVglrdsQaIsZZtv6fq8pLjK4CIpHgy1aOKF3m7gYrQ","https://scholar.google.com/scholar?cites=3628462130672925726&as_sdt=2005&sciodt=2007&hl=en",56,"2022-07-13 15:27:39","","","","",,,,,59,29.50,20,3,2,"… in the field of explainable artificial intelligence (XAI) to improve … exists between model explainability and adversarial … aligned with the notion of robust and non-robust features: The two …","https://ieeexplore.ieee.org/iel7/9200848/9206590/09207637.pdf?casa_token=a3sbGb7hm_EAAAAA:1lLS1zc36kZY_J_AFNgIdEsJSvpdRYP0gE3Rhvw77lJpIpaCv8gHBYeoZvyJdz7pQEtcMEUU1Q","https://scholar.google.com/scholar?q=related:Hny3WxXjWjIJ:scholar.google.com/&scioq=%22robust%22+%22artificial+intelligence%22+%22explainability%22&hl=en&as_sdt=2007"
72,"AA Garcez, LC Lamb","Neurosymbolic AI: the 3rd wave",2020,"arXiv preprint arXiv:2012.05876","arxiv.org","https://arxiv.org/abs/2012.05876","https://scholar.google.com/scholar?cites=10235431405813526433&as_sdt=2005&sciodt=2007&hl=en",76,"2022-07-13 15:27:39","","","","",,,,,72,36.00,36,2,2,"… learning in neural networks with reasoning and explainability via symbolic representations … to robust intelligence. Instead, I will propose that in order to get to robust artificial intelligence, …","https://arxiv.org/pdf/2012.05876","https://scholar.google.com/scholar?q=related:oW9kSqKOC44J:scholar.google.com/&scioq=%22robust%22+%22artificial+intelligence%22+%22explainability%22&hl=en&as_sdt=2007"
4,"OC Jenkins, D Lopresti, M Mitchell","Next Wave Artificial Intelligence: Robust, Explainable, Adaptable, Ethical, and Accountable",2020,"arXiv preprint arXiv:2012.06058","arxiv.org","https://arxiv.org/abs/2012.06058","https://scholar.google.com/scholar?cites=8590702538497924277&as_sdt=2005&sciodt=2007&hl=en",83,"2022-07-13 15:27:39","","","","",,,,,4,2.00,1,3,2,"… This new wave will coalesce the speed and recall power of today’s data-driven AI with the robustness and explainability of traditional symbolic, logic-based AI, along with new ideas …","https://arxiv.org/pdf/2012.06058","https://scholar.google.com/scholar?q=related:tRw3enFOOHcJ:scholar.google.com/&scioq=%22robust%22+%22artificial+intelligence%22+%22explainability%22&hl=en&as_sdt=2007"
124,"G Vilone, L Longo","Explainable artificial intelligence: a systematic review",2020,"arXiv preprint arXiv:2006.00093","arxiv.org","https://arxiv.org/abs/2006.00093","https://scholar.google.com/scholar?cites=407375393189127147&as_sdt=2005&sciodt=2007&hl=en",89,"2022-07-13 15:27:39","","","","",,,,,124,62.00,62,2,2,"… papers discussing explainability were searched by using Google Scholar and the following terms: ‘explainable artificial intelligence’, ‘explainable machine learning’, ‘interpretable …","https://arxiv.org/pdf/2006.00093","https://scholar.google.com/scholar?q=related:6-NFAcNJpwUJ:scholar.google.com/&scioq=%22robust%22+%22artificial+intelligence%22+%22explainability%22&hl=en&as_sdt=2007"
22,"E Dağlarli","Explainable artificial intelligence (xAI) approaches and deep meta-learning models",2020,"Advances and applications in deep learning","books.google.com","https://books.google.com/books?hl=en&lr=&id=7a4tEAAAQBAJ&oi=fnd&pg=PA79&dq=%22robust%22+%22artificial+intelligence%22+%22explainability%22&ots=jqyzQsc9y3&sig=cdbwMYKxeQpDyYDZb7X9Z6-CUWA","https://scholar.google.com/scholar?cites=1514500745824295156&as_sdt=2005&sciodt=2007&hl=en",98,"2022-07-13 15:27:39","","","","",,,,,22,11.00,22,1,2,"… good explainability but not advantageous in terms of performance and accuracy. At this point, … artificial intelligence (xAI), which is targeted to be at the highest level of both explainability …","https://www.intechopen.com/chapters/72398","https://scholar.google.com/scholar?q=related:9NjrdmeWBBUJ:scholar.google.com/&scioq=%22robust%22+%22artificial+intelligence%22+%22explainability%22&hl=en&as_sdt=2007"
1,"K Sokol, A Hepburn, R Santos-Rodriguez, P Flach","What and How of Machine Learning Transparency: Building Bespoke Explainability Tools with Interoperable Algorithmic Components",2020,"Hands-on Tutorial at The …","","","https://scholar.google.com/scholar?cites=937272786754671683&as_sdt=2005&sciodt=2007&hl=en",101,"2022-07-13 15:27:39","CITATION","","","",,,,,1,0.50,0,4,2,"","","https://scholar.google.com/scholar?q=related:QxQnOKLcAQ0J:scholar.google.com/&scioq=%22robust%22+%22artificial+intelligence%22+%22explainability%22&hl=en&as_sdt=2007"
30,"M Augustin, A Meinke, M Hein","Adversarial robustness on in-and out-distribution improves explainability",2020,"European Conference on Computer …","Springer","https://link.springer.com/chapter/10.1007/978-3-030-58574-7_14","https://scholar.google.com/scholar?cites=2575047789396912819&as_sdt=2005&sciodt=2007&hl=en",103,"2022-07-13 15:27:39","","10.1007/978-3-030-58574-7_14","","",,,,,30,15.00,10,3,2,"… Adversarial training (AT) [34] leads to models robust against … However, ACET models typically are significantly less robust … In summary, RATIO achieves high clean accuracy, is robust, …","https://arxiv.org/pdf/2003.09461","https://scholar.google.com/scholar?q=related:s2qoPlJovCMJ:scholar.google.com/&scioq=%22robust%22+%22artificial+intelligence%22+%22explainability%22&hl=en&as_sdt=2007"
1,"S Reddy, S Allan, S Coghlan, P Cooper","AI in global healthcare: Need for robust governance frameworks",2020,"","osf.io","https://osf.io/preprints/sgy87/","https://scholar.google.com/scholar?cites=2841946260824079995&as_sdt=2005&sciodt=2007&hl=en",110,"2022-07-13 15:27:39","","","","",,,,,1,0.50,0,4,2,"… robust governance frameworks. Also, while ethical challenges of medical artificial intelligence … (6) Some major IT software vendors have not signed up to AI principles like explainability …","https://osf.io/sgy87/download","https://scholar.google.com/scholar?q=related:ez4rIxGfcCcJ:scholar.google.com/&scioq=%22robust%22+%22artificial+intelligence%22+%22explainability%22&hl=en&as_sdt=2007"
67,"H Yuan, H Yu, S Gui, S Ji","Explainability in graph neural networks: A taxonomic survey",2020,"arXiv preprint arXiv:2012.15445","arxiv.org","https://arxiv.org/abs/2012.15445","https://scholar.google.com/scholar?cites=8816778670089511251&as_sdt=2005&sciodt=2007&hl=en",112,"2022-07-13 15:27:39","","","","",,,,,67,33.50,17,4,2,"… ever-increasing performance on many artificial intelligence tasks. A major limitation of deep … , giving rise to the area of explainability. Recently, explainability of deep models on images …","https://arxiv.org/pdf/2012.15445","https://scholar.google.com/scholar?q=related:UyHttXx9W3oJ:scholar.google.com/&scioq=%22robust%22+%22artificial+intelligence%22+%22explainability%22&hl=en&as_sdt=2007"
0,"AA Garcez, LC Lamb","Neurosymbolic AI: The 3гd Wave",2020,"arXiv preprint arXiv:2012.05876","","","",115,"2022-07-13 15:27:39","CITATION","","","",,,,,0,0.00,0,2,2,"","","https://scholar.google.com/scholar?q=related:fBJ-McwWEdIJ:scholar.google.com/&scioq=%22robust%22+%22artificial+intelligence%22+%22explainability%22&hl=en&as_sdt=2007"
8,"A Terra, R Inam, S Baskaran, P Batista…","Explainability methods for identifying root-cause of sla violation prediction in 5G network",2020,"… 2020-2020 IEEE …","ieeexplore.ieee.org","https://ieeexplore.ieee.org/abstract/document/9322496/?casa_token=5A-joQG4tpAAAAAA:SqXFqV8lhrFZgbmOcIo2w77a1Ccfk0lQXOR0R09Q12Mr8ijFD07mKW16QH_1KDxSG30zQ-dVWA","https://scholar.google.com/scholar?cites=7928035054562093703&as_sdt=2005&sciodt=2007&hl=en",125,"2022-07-13 15:27:39","","","","",,,,,8,4.00,2,5,2,"… Abstract—Artificial Intelligence (AI) is implemented in various … robust to avoid SLA violation but it has low explainability. However, our main focus is on the local and global explainability …","https://ieeexplore.ieee.org/iel7/9322055/9321973/09322496.pdf?casa_token=ioxx0L4KWmwAAAAA:UjlCEP46Gcbe7oalMGZoRS_soFBohNPyR3eC8skIzjLE4oK73H-B_mRuvUmwf8wqtuQIIEbWXQ","https://scholar.google.com/scholar?q=related:h6oEquAJBm4J:scholar.google.com/&scioq=%22robust%22+%22artificial+intelligence%22+%22explainability%22&hl=en&as_sdt=2007"
63,"D Shin","User perceptions of algorithmic decisions in the personalized AI system: perceptual evaluation of fairness, accountability, transparency, and explainability",2020,"Journal of Broadcasting & Electronic Media","Taylor & Francis","https://www.tandfonline.com/doi/abs/10.1080/08838151.2020.1843357?casa_token=zXMTWyoV4XEAAAAA:7O-IMZZgCV_SDqpCh14757QDUA-PDu4wd20S7czWTZaCgU437iR6ORVmlyPLLzmyhAo4HNIidXa-_A","https://scholar.google.com/scholar?cites=16933771227860989690&as_sdt=2005&sciodt=2007&hl=en",127,"2022-07-13 15:27:39","","10.1080/08838151.2020.1843357","","",,,,,63,31.50,63,1,2,"… With the growing presence of algorithms and their far-reaching effects, artificial intelligence (… Without this trust factor, overall paths remain significant but less robust with lower CR values…","https://www.tandfonline.com/doi/pdf/10.1080/08838151.2020.1843357?casa_token=_Y7ObVP0P6QAAAAA:sB2rKCufm-Xwgri2B8nbrUq3Xo8wuacDBXhO8lz6LGF8R0u9tw_T6YgzDIQjVAKaf-pTBPLOx1NxOw","https://scholar.google.com/scholar?q=related:-nZieDbXAOsJ:scholar.google.com/&scioq=%22robust%22+%22artificial+intelligence%22+%22explainability%22&hl=en&as_sdt=2007"
38,"V Beaudouin, I Bloch, D Bounie, S Clémençon…","Flexible and context-specific AI explainability: A multidisciplinary approach",2020,"arXiv preprint arXiv …","arxiv.org","https://arxiv.org/abs/2003.07703","https://scholar.google.com/scholar?cites=11607586469869352548&as_sdt=2005&sciodt=2007&hl=en",129,"2022-07-13 15:27:39","","","","",,,,,38,19.00,8,5,2,"… 1 Contextual factors drive explainability The recent enthusiasm for artificial intelligence (AI) … ments: how to make systems more robust and safe through explainability? The use of hybrid …","https://arxiv.org/pdf/2003.07703","https://scholar.google.com/scholar?q=related:ZHYxDGVuFqEJ:scholar.google.com/&scioq=%22robust%22+%22artificial+intelligence%22+%22explainability%22&hl=en&as_sdt=2007"
81,"SN Payrovnaziri, Z Chen…","Explainable artificial intelligence models using real-world electronic health record data: a systematic scoping review",2020,"Journal of the …","academic.oup.com","https://academic.oup.com/jamia/article-abstract/27/7/1173/5838471","https://scholar.google.com/scholar?cites=436608213692394341&as_sdt=2005&sciodt=2007&hl=en",135,"2022-07-13 15:27:39","","","","",,,,,81,40.50,27,3,2,"… MEDLINE and Web of Science (via Covidence software) (explainable OR explainability OR … ) AND (machine learning OR artificial intelligence OR prediction model OR predictive model …","https://academic.oup.com/jamia/article/27/7/1173/5838471?casa_token=P7YFmht_3bgAAAAA:8l0KYnlzA1n8lFk0bTaYevDfcIvO7yeWAD91bemOmmXR9ssQktuSgVmm8daouMJ0SlHhJVsZhPI3f9M","https://scholar.google.com/scholar?q=related:ZSsna9skDwYJ:scholar.google.com/&scioq=%22robust%22+%22artificial+intelligence%22+%22explainability%22&hl=en&as_sdt=2007"
