Cites,Authors,Title,Year,Source,Publisher,ArticleURL,CitesURL,GSRank,QueryDate,Type,DOI,ISSN,CitationURL,Volume,Issue,StartPage,EndPage,ECC,CitesPerYear,CitesPerAuthor,AuthorCount,Age,Abstract,FullTextURL,RelatedURL
4,"T. Schmid","Deconstructing the Final Frontier of Artificial Intelligence: Five Theses for a Constructivist Machine Learning",2019,"","","","",151,"2022-07-13 09:39:06","","","","",,,,,4,1.33,4,1,3,"Ambiguity and diversity in human cognition can be regarded a final frontier in developing equivalent systems of artificial intelligence. Despite astonishing accomplishments, modern machine learning algorithms are still hardly more than adaptive systems. Deep neural networks, for example, represent complexity through complex connectivity but are not able to allow for abstraction and differentiation of interpretable knowledge, i.e., for key mechanisms of human cognition. Like support vector machines, random forests and other statistically motivated algorithms, they do neither reflect nor yield structures and strategies of human thinking. Therefore, we suggest to realign the use of existing machine learning tools with respect to the philosophical paradigm of constructivism, which currently is the key concept in human learning and professional teaching. Based on the idea that learning units like classifiers can be considered models with limited validity, we formulate five principles to guide a constructivist machine learning. We describe how to define such models and model limitations, how to relate them and how relationships allow to abstract and differentiate models. To this end, we propose the use of meta data for classifiers and other models. Moreover, we argue that such meta data-based machine learning results in a knowledge base that is both created by the means of automation and interpretable for humans. Over the last decade, it has become widely accepted to address computational systems intelligent. Not only journalists, but also scientists have adapted this habit in their publications. In fact, many classical engineering tasks like monitoring or regulating have profited from the employment of machine learning (Abellan-Nebot and Romero Subirón 2010; Mohanraj, Jayaraj, and Muraleedharan 2012). The same holds true for pattern recognition, most prominently in automated image and video analysis (Zafeiriou, Zhang, and Zhang 2015; Yang et al. 2011). And even though ultimate challenges like the infamous Turing test are left unsatisfied (You 2015), some exceptional results in specialized tasks like playing the game of go (Silver et al. 2016) make current learning machines look intelligent on a human level. Copyright held by the author(s). In A. Martin, K. Hinkelmann, A. Gerber, D. Lenat, F. van Harmelen, P. Clark (Eds.), Proceedings of the AAAI 2019 Spring Symposium on Combining Machine Learning with Knowledge Engineering (AAAI-MAKE 2019). Stanford University, Palo Alto, California, USA, March 25-27, 2019. A final frontier for learning systems, however, is the variety of alternative cognitive functions observable in a diverse set of individuals or from ambiguous stimuli (Kornmeier and Bach 2012). While philosophy has acknowledged and embraced the subjectivity and limitations of human cognition during the last decades (Prawat and Floden 1994), current learning systems regard cognition a complex, yet technical task to be solved. In particular, established algorithms do neither provide convincing answers to the challenges provided by an ambiguous environment; nor do they offer concepts that explicitly allow for contradictory judgements comparable to differences in social perception. The main reason for this shortcoming is that so far both algorithms and researchers have failed to incorporate a constructivist point of view. Constructivism implies not only cognition to be a highly individual phenomenon, but also humans to take an active role in their perception of the world – and that there is no such thing as a human-independent reality (Reich 2009). Yet algorithms and applications aiming to predict things other than laws of nature are implicitly founded on exactly this outdated asumption. In the following, we introduce axioms that allow machine learning to follow constructivist principles. Key features of this approach are the use of modern tools from empirical sciences, model-oriented learning, the ability to handle ambiguity, the ability to integrate supervised and unsupervised learning into a unified framework, the ability to create an individual knowledge base and the ability to abstract, differentiate or discard learned knowledge automatically. 1. The key component of cognitive functionality is a model. Since the introduction of artificial neural networks as a theoretical concept (McCulloch and Pitts 1943), many mathematicians and computer scientists have considered neurons the key component of learning systems. In education and psychology, however, cognitive functions are often seen as certain skills or abilities acquired and exposed by an individual human and described in terms like the concept of competence, which, e.g., is widely used in the modern European education system (Méhaut and Winch 2012). Functionalistic psychology explains cognitive functions of humans by the concept of mental models (Rouse and Morris 1986). Initially, mental models have been used to understand motor control, e.g., of hand movements (Veldhuyzen and Stassen 1977). In a more general sense, however, mental models are described as “hypothetical constructs” (Wickens 2000) that can be ordered hierarchically (Rasmussen 1979) and allow a human to make predictions about his physical and social environment (Oatley 1985). It has also been postulated that such models cannot be of static nature but rather underlay continuous modifications (Oatley 1985). Philosophers, too, consider models an important tool in human knowledge acquisition (Klaus 1967, p. 412) or even the only tool, respectively (Stachowiak 1973, p. 56). While varying and concurring theoretical definitions exist, most model concepts assume an image, an origin of the image and a relationship between them. This definition is, e.g., matched by the idea of mathematical modeling as proposed by Heinrich Hertz and others (Hertz 1894; Hamilton 1982). With the rise of robotics and artificial intelligence, engineers have adapted and extended this idea by postulating the concept of a cybernetic model, which involves a generalized subject and an object of the model (Rose 2009). Cybernetics, however, did neither reflect time-related aspects nor issues involved with individual model subjects. This matter was adressed by Herbert Stachowiak, who was influenced by cybernetics when developing his General Model Theory (Hof 2018). He postulated any model to be limited to specific subjects, specific temporal ranges and specific purposes (Stachowiak 1973, p. 133). Limitations, to this end, are considered a matter of fact rather than a matter of definition. Thus, such models circumvent ambiguity by viewing an otherwise ambiguous model with unknown validity limits as a number of models of limited validity. 2. Learning constitutes from constructing, reconstructing or deconstructing models. Modern education is dominated by the ideas of constructivism and constructivist learning (Fox 2001). At its heart, this approach is based on the assumption that humans acquire knowledge and competences actively and individually through processes called construction, reconstruction and deconstruction (Duffy and Jonassen 1992). Construction is associated with creation, innovation and production and implies searching for variations, combinations or transfers of knowledge (Reich 2004, p. 145). Analogously, reconstruction is associated with application, repetition or imitation and implies searching for order, patterns or models (Reich 2004, p. 145). Deconstruction is in the context of constructivism associated with reconsideration, doubt and modification and implies searching for omissions, additions and defective parts of acquired knowledge (Reich 2004, p. 145). Learning algorithms have been used for half a century to transform sample data into models in a mathematical sense, that is: into generalized mathematical relationships between image and origin. The two major approaches or objectives, known as supervised and unsupervised learning, either do or do not require a given target parameter. Artificial neural networks and their relatives are among the most popular and prominent algorithms for learning with a given target parameter (Singh, Thakur, and Sharma 2016), but statistically motivated approaches like support vector machines (Cristianini and Shawe-Taylor 2000) or random forests (Breiman 2001) are also widely used for supervised learning; a specialized field of supervised learning is reinforcement learning, which is popular in robotics (Kober and Peters 2012) and adaptive control (Lewis, Vrabie, and Vamvoudakis 2012). For unsupervised learning, too, biologically inspired approaches like self-organizing maps (Kohonen 2001) as well as statistically motivated approaches like k-means (Jain 2010) are employed. To some extent, machine learning parallels modern education concepts. A construction process in the constructivist sense may be matched by an unsupervised learning, i.e., identifying clusterings or dimensionality reduction, and can, e.g., be implemented with self-organizing maps, kmeans, autoencoders or feature clustering (Schmid 2018). A reconstruction process in the constructivist sense may be matched by a supervised learning, i.e., classification or regression tasks, and can, e.g., be implemented with artificial neural networks or random forests (Schmid 2018). Few researchers, however, have discussed a constructivist approach to machine learning (Drescher 1989; Quartz 1993), and even less how to design a deconstruction process. While domainspecific applications with manual re-engineering options exist (Herbst and Karagiannis 2000), to the best of our knowledge, there is currently only one working implementation of an algorithmic deconstruction process (Schmid 2018). 3. Deconstructing models computationally requires model-based meta data. In order to automate and implement a deconstruction process, successfully learned models must be held available for comparison or re-training. More over, possible matchings with n","",""
3,"Minsung Hong, R. Akerkar","Analytics and Evolving Landscape of Machine Learning for Emergency Response",2019,"","","","",152,"2022-07-13 09:39:06","","10.1007/978-3-030-15628-2_11","","",,,,,3,1.00,2,2,3,"","",""
4,"Mohammed Ali Khan, A. Haque, V. S. B. Kurukuru","Machine Learning Based Islanding Detection for Grid Connected Photovoltaic System",2019,"","","","",153,"2022-07-13 09:39:06","","10.1109/ICPECA47973.2019.8975614","","",,,,,4,1.33,1,3,3,"This paper focus on developing a new islanding detection method with the help of machine learning and signal processing technique. The islanding detection method make sure that there is a proper remote monitoring of the grid integrated photovoltaic (PV) system. In case of grid fault or maintained of the grid, a proper informed signal is provided to various distributed generation (DG) networks so that they can disconnect with the grid and operate in isolated mode. A simulation of 1kW grid connected PV system is performed. The signal such as voltage, current and frequency are recorded at point of common coupling (PCC). The feature of recorded signals are extracted using wavelet transformation. The extracted features are used to form a islanding scenarios matrix. The matrix is further utilized to train a classifier using machine learning algorithm. From the result it can be observed that the trained classifier depicted 97.9% training accuracy with a training time of 16.9 sec which is better when compared with the literature. Further the trained classifier is subjected to test with an unknown islanding condition to observe the robustness of the classifier.","",""
3,"Kyemyung Park, T. Prüstel, Yong Lu, J. Tsang","Machine learning of stochastic gene network phenotypes",2019,"","","","",154,"2022-07-13 09:39:06","","10.1101/825943","","",,,,,3,1.00,1,4,3,"A recurrent challenge in biology is the development of predictive quantitative models because most molecular and cellular parameters have unknown values and realistic models are analytically intractable. While the dynamics of the system can be analyzed via computer simulations, substantial computational resources are often required given uncertain parameter values resulting in large numbers of parameter combinations, especially when realistic biological features are included. Simulation alone also often does not yield the kinds of intuitive insights from analytical solutions. Here we introduce a general framework combining stochastic/mechanistic simulation of reaction systems and machine learning of the simulation data to generate computationally efficient predictive models and interpretable parameter-phenotype maps. We applied our approach to investigate stochastic gene expression propagation in biological networks, which is a contemporary challenge in the quantitative modeling of single-cell heterogeneity. We found that accurate, predictive machine-learning models of stochastic simulation results can be constructed. Even in the simplest networks existing analytical schemes generated significantly less accurate predictions than our approach, which revealed interesting insights when applied to more complex circuits, including the extensive tunability of information propagation enabled by feedforward circuits and how even single negative feedbacks can utilize stochastic fluctuations to generate robust oscillations. Our approach is applicable beyond biology and opens up a new avenue for exploring complex dynamical systems.","",""
0,"","Runtime Verification for Critical Machine Learning Applications",2019,"","","","",155,"2022-07-13 09:39:06","","","","",,,,,0,0.00,0,0,3,"In the last decade, the application of Machine Learning (ML) has encountered an increasing interest in various applicative domains, especially for a wide panel of complex tasks (e.g. image-based pedestrian detection) classically performed by human operators (e.g. the driver). In ML, the objective is to synthesize an intended function (e.g., detect a pedestrian on an image) through a set of examples (images of road). The massive usage of such techniques has demonstrated its effectiveness way beyond other classical methods. Obviously, the designers of critical systems would like to benefit from the effectiveness of ML-based models mainly for complex image processing and model reduction. But, above effectiveness, the designers of critical systems must demonstrate that the obtained models are reasonably safe. Providing elements demonstrating the safety of a system is a classical issue addressed by various techniques tailored to the nature of the system, and covered by many safety standards (DO178C in aeronautics, ISO26262 in automative, IEC61508 in electronics, etc.). Nevertheless, the specificities of ML-based software disclose new safety threats that are not addressed by classical techniques. Despite very good results during training and testing of a ML software, it is not possible to provide sufficient guarantees that the training data set would be sufficient for expected real life situations, that during operational life the system may not face adversary situations (situation slightly different from training ones, but which lead to a complete different result of the ML, also called adversaries attacks), or that the distribution of situations may be different from the ones during training (distribution shift). All these threats are a major brake to ML deployment in safety critical applications. Most of works are focusing on the training data quality in order to increase robustness of the ML algorithm. However, to avoid overfitting, it is accepted that developing the dataset is limited, and a promising approach is to monitor the system at runtime, during operational life, in order to keep the system in a safe state, despite errors of the ML. A first approach inspired from fault tolerance and close to safety monitoring [3], is to adapt the simplex architecture to the monitoring of a neural controller, using a decision block able to detect an error and to switch from the neural controller to a high assurance controller (but less performant) [4]. Some works as [1] may be used to monitor the distance of input/ouput distribution during the exploitation vs the one observed during the learning phase and raise an alert when a “significant gap” is observed. Other works like [2], dedicated to Neural Networks, propose to collect neuron activation patterns during the learning phase and, thanks to an online monitoring, detect the occurrence of an unknown activation pattern that may indicate an erroneous prediction. All these works are ongoing, with very preliminary results, and actually no safety model is integrated in such proposals. We propose in this post-doc to specify, implement and verify a new runtime verification approach for ML, an adversarial runtime monitor. This approach is based on adversaries generated at runtime, and used to assess if the ML maybe fooled in an unsafe state. This might lead the monitor to detect if the ML is in a potential unsafe erroneous state, or in a potential erroneous state but safe. Once such a monitor would be designed, we also plan to use formal methods (verification) to prove the correctness of the monitor. This work will be applied to a case study, a ML software for drone collision avoidance studied and deployed in the context of the Delta project.","",""
1,"Andreas Wunsch, T. Liesch, S. Broda","Uncover Similarities of Groundwater Dynamics with Machine Learning based Hydrograph Clustering (Oral Talk IN43A-07)",2019,"","","","",156,"2022-07-13 09:39:06","","","","",,,,,1,0.33,0,3,3,"Understanding and characterizing groundwater system properties is of great importance to develop sustainable groundwater management strategies. For this purpose, groundwater hydrographs are a valuable source of knowledge, since they contain information about system properties (e.g. aquifer type), artificial (e.g. withdrawal/infiltration) and natural environmental factors (e.g. groundwater-streamflow interaction). Such factors interact and superimpose temporally and spatially, which makes determining the individual contributions a challenging task. However, understanding spatial dynamics patterns is a precious source of information for this purpose. Generally, in many regions, large amounts of groundwater data with high resolution in time and space are available but lack an adequate set of tools for analysis. Data driven models are possibly suited to fill in this gap. We developed a machine learning based ensemble-modelling approach to characterize and cluster groundwater hydrographs on regional scale according to their dynamics. We apply feature-based clustering to reduce data quality requirements and to improve exploitation of heterogeneous datasets. Such features describe hydrograph dynamics and serve as surrogates for clustering based on Self-Organizing-Maps and DS2L-SOM-enrichment for cluster determination. Ensemble modeling assures highly robust cluster results, even for real world observational networks undergoing changes. The test area of the method is the Upper Rhine Graben in Germany/France, using more than 1800 weekly sampled hydrographs in the period of 1986 to 2016. The majority shows lengths of almost 30 years, minimum length is six years. Results show that our approach is capable to identify homogeneous groups of hydrograph dynamics. The resulting clusters showed both known and unknown patterns, of which some correspond to certain environmental factors. However, we also discovered new patterns with unknown origin, which need further examination. Possible application of the found groundwater patterns could be for example regional groundwater forecasting by selecting and predicting representative group members. By adapting the describing features, this data-driven method is easily transferrable to other time-series-clustering frameworks.","",""
1,"Vincent Dangla, Christian Soize, Guilherme Cunha, M. Kassem, A. Mosson, B. V. D. Nieuwenhof","A probabilistic learning on manifolds as a new tool in machine learning and data science with applications in computational mechanics",2019,"","","","",157,"2022-07-13 09:39:06","","","","",,,,,1,0.33,0,6,3,"In Machine Learning (generally devoted to big-data case), the predictive learning (or the supervised learning) approach consists in identifying/learning a random mapping F: w↦ q = F(w), in which the parameters vector w (input) is modelled by a random vector W with known probability distribution Pw(dw) and where the vector of quantities of interest q (outputs) is the non-Gaussian random variable Q = F(W) = f(W,U) whose probability distribution is unknown, given an initial dataset (or training set) DN = {(wj,qj), j=1,…N} of N independent realizations of random vector (W,Q). The measurable mapping f is deterministic and U is a random vector whose probability distribution is known. The approach of probabilistic learning on manifold (recently introduced) will be presented, which allows for constructing a generator of an estimation of the joint probability distribution PW,Q(dw,dq; N) using only DN, which completely characterizes random mapping F. In this framework, novel computational statistical tools will be presented for the small-data challenge for which N is relatively small and consequently, is not sufficient large for constructing converged statistical estimates. In particular, we will present (1) the identification of the optimal independent component partition of the non-Gaussian random vector, (2) the learning from DN for which additional information is available based either on a nonparametric Bayesian approach or on Information Theory. Several applications will be presented such as, the identification of non-Gaussian random fields for random media, the Bayes inference with probabilistic learning, the robust design of an implant in a biological tissue at mesoscale, the nonparametric model-form uncertainties (i) in nonlinear solid dynamics applied a to MEMS and (ii) in nonlinear computational fluid dynamics applied to a Scramjet, nonconvex optimization under uncertainties.    [1] C. Soize, R. Ghanem, Data-driven probability concentration and sampling on manifold, Journal of Computational Physics, 321, 242-258 (2016).  [2] C. Soize, Optimal partition in terms of independent random vectors of any non-Gaussian vector defined by a set of realizations, SIAM/ASA Journal on Uncertainty Quantification, 5(1), 176-211 (2017).  [3] R. Ghanem, C. Soize, Probabilistic nonconvex constrained optimization with fixed number of function evaluations, International Journal for Numerical Methods in Engineering, 113(4), 719-741 (2018).  [4] C. Soize, Design optimization under uncertainties of a mesoscale implant in biological tissues using a probabilistic learning algorithm, Computational Mechanics, 62(3), 477-497 (2018).  [5] C. Soize, C. Farhat, Probabilistic learning for model-form uncertainties in nonlinear computational mechanics, International Journal for Numerical Methods in Engineering, Accepted 24 October 2018.  [6] C. Soize, R. Ghanem, C. Safta, X. Huan, Z.P. Vane, J. Oefelein, G. Lacaze, H.N. Najm, Enhancing model predictability for a scramjet using probabilistic learning on manifold, AIAA Journal, Accepted 13 September 2018.","",""
28,"K. Javed, R. Gouriveau, N. Zerhouni, R. Zemouri, Xiang Li","Robust, reliable and applicable tool wear monitoring and prognostic: Approach based on an improved-extreme learning machine",2012,"","","","",158,"2022-07-13 09:39:06","","10.1109/ICPHM.2012.6299516","","",,,,,28,2.80,6,5,10,"Although efforts in this field are significant around the world, real prognostics systems are still scarce in industry. Indeed, it is hard to provide efficient approaches that are able to handle with the inherent uncertainty of prognostics and nobody is able to a priori ensure that an accurate prognostic model can be built. As for an example of remaining problems, consider data-driven prognostics approaches: how to ensure that a model will be able to face with inputs variation with respect to those ones that have been learned, how to ensure that a learned-model will face with unknown data, how to ensure convergence of algorithms, etc. In other words, robustness, reliability and applicability of a prognostic approach are still open areas. Following that, the aim of this paper is to address these challenges by proposing a new neural network (structure and algorithm) that enhances reliability of RUL estimates while improving applicability of the approach. Robustness, reliability and applicability aspects are first discussed and defined according to literature. On this basis, a new connexionist system is proposed for prognostics: the Improved-Extreme Learning machine (Imp-ELM). This neural network, based on complex activation functions, enables to reduce the influence of human choices and initial parameterization, while improving accuracy of estimates and speeding the learning phase. The whole proposition is illustrated by performing tests on a real industrial case of cutting tools from a Computer Numerical Control (CNC) machine. This is achieved by predicting tool condition (wear) in terms of remaining cuts successfully made. Thorough comparisons with adaptive neuro fuzzy inference system (ANFIS) and existing ELM algorithm are also given. Results show improved robustness, reliability and applicability performances.","",""
