Cites,Authors,Title,Year,Source,Publisher,ArticleURL,CitesURL,GSRank,QueryDate,Type,DOI,ISSN,CitationURL,Volume,Issue,StartPage,EndPage,ECC,CitesPerYear,CitesPerAuthor,AuthorCount,Age,Abstract,FullTextURL,RelatedURL
0,"Maroun Touma, Shalisha Witherspoon, S. Witherspoon, Isabelle Crawford-Eng","A practical approach for applying Machine Learning in the detection and classification of network devices used in building management",2020,"","","","",1,"2022-07-13 09:39:06","","10.22541/au.160689781.19054555/v1","","",,,,,0,0.00,0,4,2,"With the increasing deployment of smart buildings and infrastructure, Supervisory Control and Data Acquisition (SCADA) devices and the underlying IT network have become essential elements for the proper operations of these highly complex systems. Of course, with the increase in automation and the proliferation of SCADA devices, a corresponding increase in surface area of attack on critical infrastructure has increased. Understanding device behaviors in terms of known and understood or potentially qualified activities versus unknown and potentially nefarious activities in near-real time is a key component of any security solution. In this paper, we investigate the challenges with building robust machine learning models to identify unknowns purely from network traffic both inside and outside firewalls, starting with missing or inconsistent labels across sites, feature engineering and learning, temporal dependencies and analysis, and training data quality (including small sample sizes) for both shallow and deep learning methods. To demonstrate these challenges and the capabilities we have developed, we focus on Building Automation and Control networks (BACnet) from a private commercial building system. Our results show that ”Model Zoo” built from binary classifiers based on each device or behavior combined with an ensemble classifier integrating information from all classifiers provides a reliable methodology to identify unknown devices as well as determining specific known devices when the device type is in the training set. The capability of the Model Zoo framework is shown to be directly linked to feature engineering and learning, and the dependency of the feature selection varies depending on both the binary and ensemble classifiers as well.","",""
37,"P. Athamanolap, V. Parekh, S. I. Fraley, Vatsal Agarwal, D. J. Shin, M. Jacobs, Tza-Huei Wang, Samuel Yang","Trainable High Resolution Melt Curve Machine Learning Classifier for Large-Scale Reliable Genotyping of Sequence Variants",2014,"","","","",2,"2022-07-13 09:39:06","","10.1371/journal.pone.0109094","","",,,,,37,4.63,5,8,8,"High resolution melt (HRM) is gaining considerable popularity as a simple and robust method for genotyping sequence variants. However, accurate genotyping of an unknown sample for which a large number of possible variants may exist will require an automated HRM curve identification method capable of comparing unknowns against a large cohort of known sequence variants. Herein, we describe a new method for automated HRM curve classification based on machine learning methods and learned tolerance for reaction condition deviations. We tested this method in silico through multiple cross-validations using curves generated from 9 different simulated experimental conditions to classify 92 known serotypes of Streptococcus pneumoniae and demonstrated over 99% accuracy with 8 training curves per serotype. In vitro verification of the algorithm was tested using sequence variants of a cancer-related gene and demonstrated 100% accuracy with 3 training curves per sequence variant. The machine learning algorithm enabled reliable, scalable, and automated HRM genotyping analysis with broad potential clinical and epidemiological applications.","",""
0,"Hamdah Alotaibi, Fawaz Alsolami, Ehab A. Abozinadah, R. Mehmood","TAWSEEM: A Deep-Learning-Based Tool for Estimating the Number of Unknown Contributors in DNA Profiling",2022,"","","","",3,"2022-07-13 09:39:06","","10.3390/electronics11040548","","",,,,,0,0.00,0,4,1,"DNA profiling involves the analysis of sequences of an individual or mixed DNA profiles to identify the persons that these profiles belong to. A critically important application of DNA profiling is in forensic science to identify criminals by finding a match between their blood samples and the DNA profile found on the crime scene. Other applications include paternity tests, disaster victim identification, missing person investigations, and mapping genetic diseases. A crucial task in DNA profiling is the determination of the number of contributors in a DNA mixture profile, which is challenging due to issues that include allele dropout, stutter, blobs, and noise in DNA profiles; these issues negatively affect the estimation accuracy and the computational complexity. Machine-learning-based methods have been applied for estimating the number of unknowns; however, there is limited work in this area and many more efforts are required to develop robust models and their training on large and diverse datasets. In this paper, we propose and develop a software tool called TAWSEEM that employs a multilayer perceptron (MLP) neural network deep learning model for estimating the number of unknown contributors in DNA mixture profiles using PROVEDIt, the largest publicly available dataset. We investigate the performance of our developed deep learning model using four performance metrics, namely accuracy, F1-score, recall, and precision. The novelty of our tool is evident in the fact that it provides the highest accuracy (97%) compared to any existing work on the most diverse dataset (in terms of the profiles, loci, multiplexes, etc.). We also provide a detailed background on the DNA profiling and literature review, and a detailed account of the deep learning tool development and the performance investigation of the deep learning method.","",""
3,"A. Preece, Daniel Harborne, R. Raghavendra, Richard J. Tomsett, Dave Braines","Provisioning Robust and Interpretable AI/ML-Based Service Bundles",2018,"","","","",4,"2022-07-13 09:39:06","","10.1109/MILCOM.2018.8599838","","",,,,,3,0.75,1,5,4,"Coalition operations environments are characterised by the need to share intelligence, surveillance and reconnaissance services. Increasingly, such services are based on artificial intelligence (AI)and machine learning (ML)technologies. Two key issues in the exploitation of AI/ML services are robustness and interpretability. Employing a diverse portfolio of services can make a system robust to ‘unknown unknowns’. Interpretability - the need for services to offer explanation facilities to engender user trust - can be addressed by a variety of methods to generate either transparent or post hoc explanations according to users' requirements. This paper shows how a service-provisioning framework for coalition operations can be extended to address specific requirements for robustness and interpretability, allowing automatic selection of service bundles for intelligence, surveillance and reconnaissance tasks. The approach is demonstrated in a case study on traffic monitoring featuring a diverse set of AI/ML services based on deep neural networks and heuristic reasoning approaches.","",""
1,"K. Hidenori","A new neural computation scheme of unsupervised learning with applications to robot biped locomotion",2008,"","","","",5,"2022-07-13 09:39:06","","10.1109/CHICC.2008.4604874","","",,,,,1,0.07,1,1,14,"A new neural computational scheme of unsupervised learning is proposed to construct a machine intelligence that is capable of overcoming unpredictable uncertainties and unknowns through proper interactions with environment. Our scheme consists of homogeneous neuron distributions which form layered clusters of computational circuit. Each neuron is very simple and of classical McCulloch-Pitts type equipped with Hebb-type plasticity for their interconnections. The novelty of our neuron lies in its ability to change its threshold according to its firing situation, which makes our scheme stable and configurable. Each cluster of neurons represents the numerical values by the number of firing neurons just like enumerations by fingers. This nonsymbolic nature of computations is shown to be very robust. It is shown that our configuration can act as a type of adaptive control which exhibits brain-like functions in its learning behaviors. Our scheme is shown to be successfully implemented to a biped robot that can walk under unstructured environment.","",""
0,"Shelby Heinecke","Resilient Structures and Robust Machine Learning Algorithms",2020,"","","","",6,"2022-07-13 09:39:06","","10.25417/UIC.13474959.V1","","",,,,,0,0.00,0,1,2,"Networks and learning algorithms are key themes in artificial intelligence (AI). Networks can be used to model the connections of a vast community of internet-of-things (IoT) devices, the internet, and distributed databases, among other important computing contexts for AI. Learning algorithms, which generate trained models, can be strategically designed to learn from a variety of data-rich networks, such as sensor networks, device networks, or even networks of humans working on crowdsourcing tasks. In real-world settings, noise generated from sources such as device inaccuracy or human error are unavoidable. Likewise, attacks in real-world networks, such as the injection of malware, are inevitable due to their ever-evolving sophistication. In this thesis, we study the intrusions of noise and malicious attacks on networks and learning from networks. We devise structural and algorithmic solutions for mitigating the effects of these unwanted intrusions. We first we consider viral propagation under the independent cascade model of infection spread on half-regular bipartite networks and characterize the most resilient structures. Then, we study learning and generalizing from a network of crowd workers, where crowd workers provide erroneous labels to unlabelled data at fixed, unknown error rates. In this setting, we develop a three-step probably approximately correct (PAC) algorithm that incorporates majority voting, pure-exploration bandits, and noisy-PAC learning and demonstrate our algorithm’s improvement over baseline approaches. Finally, we study learning from a network of participants, each with their own distribution on the unlabelled data in the presence of noise. We develop collaborative PAC algorithms robust to classification noise and prove sample complexity bounds. We also study the communication complexity of collaborative PAC learning, with and without classification noise, and develop communication efficient algorithms in both settings.","",""
0,"Alekh Agarwal, Tong Zhang","Minimax Regret Optimization for Robust Machine Learning under Distribution Shift",2022,"","","","",7,"2022-07-13 09:39:06","","","","",,,,,0,0.00,0,2,1,"In this paper, we consider learning scenarios where the learned model is evaluated under an unknown test distribution which potentially differs from the training distribution (i.e. distribution shift). The learner has access to a family of weight functions such that the test distribution is a reweighting of the training distribution under one of these functions, a setting typically studied under the name of Distributionally Robust Optimization (DRO). We consider the problem of deriving regret bounds in the classical learning theory setting, and require that the resulting regret bounds hold uniformly for all potential test distributions. We show that the DRO formulation does not guarantee uniformly small regret under distribution shift. We instead propose an alternative method called Minimax Regret Optimization (MRO), and show that under suitable conditions this method achieves uniformly low regret across all test distributions. We also adapt our technique to have stronger guarantees when the test distributions are heterogeneous in their similarity to the training data. Given the widespead optimization of worst case risks in current approaches to robust machine learning, we believe that MRO can be a strong alternative to address distribution shift scenarios.","",""
3,"É. Chouzenoux, Henri G'erard, J. Pesquet","General risk measures for robust machine learning",2019,"","","","",8,"2022-07-13 09:39:06","","10.3934/fods.2019011","","",,,,,3,1.00,1,3,3,"A wide array of machine learning problems are formulated as the minimization of the expectation of a convex loss function on some parameter space. Since the probability distribution of the data of interest is usually unknown, it is is often estimated from training sets, which may lead to poor out-of-sample performance. In this work, we bring new insights in this problem by using the framework which has been developed in quantitative finance for risk measures. We show that the original min-max problem can be recast as a convex minimization problem under suitable assumptions. We discuss several important examples of robust formulations, in particular by defining ambiguity sets based on $\varphi$-divergences and the Wasserstein metric.We also propose an efficient algorithm for solving the corresponding convex optimization problems involving complex convex constraints. Through simulation examples, we demonstrate that this algorithm scales well on real data sets.","",""
5,"Tao Chen, M. Ludkovski","A Machine Learning Approach to Adaptive Robust Utility Maximization and Hedging",2019,"","","","",9,"2022-07-13 09:39:06","","10.1137/20m1336023","","",,,,,5,1.67,3,2,3,"We investigate the adaptive robust control framework for portfolio optimization and loss-based hedging under drift and volatility uncertainty. Adaptive robust problems offer many advantages but require handling a double optimization problem (infimum over market measures, supremum over the control) at each instance. Moreover, the underlying Bellman equations are intrinsically multi-dimensional. We propose a novel machine learning approach that solves for the local saddle-point at a chosen set of inputs and then uses a nonparametric (Gaussian process) regression to obtain a functional representation of the value function. Our algorithm resembles control randomization and regression Monte Carlo techniques but also brings multiple innovations, including adaptive experimental design, separate surrogates for optimal control and the local worst-case measure, and computational speed-ups for the sup-inf optimization. Thanks to the new scheme we are able to consider settings that have been previously computationally intractable and provide several new financial insights about learning and optimal trading under unknown market parameters. In particular, we demonstrate the financial advantages of adaptive robust framework compared to adaptive and static robust alternatives.","",""
0,"M. Rostami, O. Saarela, M. Escobar, D. Lana","Doubly Robust Estimation with Machine Learning Predictions",2021,"","","","",10,"2022-07-13 09:39:06","","","","",,,,,0,0.00,0,4,1,"The estimation of Average Treatment Effect (ATE) as a causal parameter is carried out in two steps, where in the first step, the treatment and outcome are modeled to incorporate the potential confounders, and in the second step, the predictions are inserted into the ATE estimators such as the Augmented Inverse Probability Weighting (AIPW) estimator. Due to the concerns regarding the nonlinear or unknown relationships between confounders and the treatment and outcome, there has been an interest in applying non-parametric methods such as Machine Learning (ML) algorithms instead. Farrell et al. (2018) proposed to use two separate Neural Networks (NNs) where there’s no regularization on the network’s parameters except the Stochastic Gradient Descent (SGD) in the NN’s optimization. Our simulations indicate that the AIPW estimator suffers extensively if no regularization is utilized. We propose the normalization of AIPW (referred to as nAIPW) which can be helpful in some scenarios. nAIPW, provably, has the same properties as AIPW, that is double-robustness and orthogonality (Chernozhukov et al., 2018). Further, if the first step algorithms converge fast enough, under regulatory conditions (Chernozhukov et al., 2018), nAIPW will be asymptotically normal. We also compare the performance of AIPW and nAIPW in terms of the bias and variance when small to moderate L1 regularization is imposed on the NNs.","",""
101,"G. Lecu'e, M. Lerasle","Robust machine learning by median-of-means: Theory and practice",2017,"","","","",11,"2022-07-13 09:39:06","","10.1214/19-AOS1828","","",,,,,101,20.20,51,2,5,"We introduce new estimators for robust machine learning based on median-of-means (MOM) estimators of the mean of real valued random variables. These estimators achieve optimal rates of convergence under minimal assumptions on the dataset. The dataset may also have been corrupted by outliers on which no assumption is granted. We also analyze these new estimators with standard tools from robust statistics. In particular, we revisit the concept of breakdown point. We modify the original definition by studying the number of outliers that a dataset can contain without deteriorating the estimation properties of a given estimator. This new notion of breakdown number, that takes into account the statistical performances of the estimators, is non-asymptotic in nature and adapted for machine learning purposes. We proved that the breakdown number of our estimator is of the order of (number of observations)*(rate of convergence). For instance, the breakdown number of our estimators for the problem of estimation of a d-dimensional vector with a noise variance sigma^2 is sigma^2d and it becomes sigma^2 s log(d/s) when this vector has only s non-zero component. Beyond this breakdown point, we proved that the rate of convergence achieved by our estimator is (number of outliers) divided by (number of observation).  Besides these theoretical guarantees, the major improvement brought by these new estimators is that they are easily computable in practice. In fact, basically any algorithm used to approximate the standard Empirical Risk Minimizer (or its regularized versions) has a robust version approximating our estimators. As a proof of concept, we study many algorithms for the classical LASSO estimator. A byproduct of the MOM algorithms is a measure of depth of data that can be used to detect outliers.","",""
34,"Muhammad Abdullah Hanif, Faiq Khalid, Rachmad Vidya Wicaksana Putra, Semeen Rehman, M. Shafique","Robust Machine Learning Systems: Reliability and Security for Deep Neural Networks",2018,"","","","",12,"2022-07-13 09:39:06","","10.1109/IOLTS.2018.8474192","","",,,,,34,8.50,7,5,4,"Machine learning is commonly being used in almost all the areas that involve advanced data analytics and intelligent control. From applications like Natural Language Processing (NLP) to autonomous driving are based upon machine learning algorithms. An increasing trend is observed in the use of Deep Neural Networks (DNNs) for such applications. While the slight inaccuracy in applications like NLP does not have any severe consequences, it is not the same for other safety-critical applications, like autonomous driving and smart healthcare, where a small error can lead to catastrophic effects. Apart from high-accuracy DNN algorithms, there is a significant need for robust machine learning systems and hardware architectures that can generate reliable and trustworthy results in the presence of hardware-level faults while also preserving security and privacy. This paper provides an overview of the challenges being faced in ensuring reliable and secure execution of DNNs. To address the challenges, we present several techniques for analyzing and mitigating the reliability and security threats in machine learning systems.","",""
189,"Matthias Feurer, Aaron Klein, Katharina Eggensperger, Jost Tobias Springenberg, Manuel Blum, F. Hutter","Auto-sklearn: Efficient and Robust Automated Machine Learning",2019,"","","","",13,"2022-07-13 09:39:06","","10.1007/978-3-030-05318-5_6","","",,,,,189,63.00,32,6,3,"","",""
9,"Ruben F. Kranenburg, J. Verduin, Y. Weesepoel, M. Alewijn, Marcel Heerschop, G. Koomen, P. Keizers, Frank Bakker, Fionn Wallace, Annette van Esch, Annemieke Hulsbergen, A. V. van Asten","Rapid and robust on‐scene detection of cocaine in street samples using a handheld near‐infrared spectrometer and machine learning algorithms",2020,"","","","",14,"2022-07-13 09:39:06","","10.1002/dta.2895","","",,,,,9,4.50,1,12,2,"Abstract On‐scene drug detection is an increasingly significant challenge due to the fast‐changing drug market as well as the risk of exposure to potent drug substances. Conventional colorimetric cocaine tests involve handling of the unknown material and are prone to false‐positive reactions on common pharmaceuticals used as cutting agents. This study demonstrates the novel application of 740–1070 nm small‐wavelength‐range near‐infrared (NIR) spectroscopy to confidently detect cocaine in case samples. Multistage machine learning algorithms are used to exploit the limited spectral features and predict not only the presence of cocaine but also the concentration and sample composition. A model based on more than 10,000 spectra from case samples yielded 97% true‐positive and 98% true‐negative results. The practical applicability is shown in more than 100 case samples not included in the model design. One of the most exciting aspects of this on‐scene approach is that the model can almost instantly adapt to changes in the illicit‐drug market by updating metadata with results from subsequent confirmatory laboratory analyses. These results demonstrate that advanced machine learning strategies applied on limited‐range NIR spectra from economic handheld sensors can be a valuable procedure for rapid on‐site detection of illicit substances by investigating officers. In addition to forensics, this interesting approach could be beneficial for screening and classification applications in the pharmaceutical, food‐safety, and environmental domains.","",""
3,"Willem Raes, Nicolas Knudde, Jorik De Bruycker, T. Dhaene, N. Stevens","Experimental Evaluation of Machine Learning Methods for Robust Received Signal Strength-Based Visible Light Positioning",2020,"","","","",15,"2022-07-13 09:39:06","","10.3390/s20216109","","",,,,,3,1.50,1,5,2,"In this work, the use of Machine Learning methods for robust Received Signal Strength (RSS)-based Visible Light Positioning (VLP) is experimentally evaluated. The performance of Multilayer Perceptron (MLP) models and Gaussian processes (GP) is investigated when using relative RSS input features. The experimental set-up for the RSS-based VLP technology uses light-emitting diodes (LEDs) transmitting intensity modulated light and a single photodiode (PD) as a receiver. The experiments focus on achieving robustness to cope with unknown received signal strength modifications over time. Therefore, several datasets were collected, where per dataset either the LEDs transmitting power is modified or the PD aperture is partly obfuscated by dust particles. Two relative RSS schemes are investigated. The first scheme uses the maximum received light intensity to normalize the received RSS vector, while the second approach obtains RSS ratios by combining all possible unique pairs of received intensities. The Machine Learning (ML) methods are compared to a relative multilateration implementation. It is demonstrated that the adopted MLP and GP models exhibit superior performance and higher robustness when compared to the multilateration strategies. Furthermore, when comparing the investigated ML models, the GP model is proven to be more robust than the MLP for the considered scenarios.","",""
