Cites,Authors,Title,Year,Source,Publisher,ArticleURL,CitesURL,GSRank,QueryDate,Type,DOI,ISSN,CitationURL,Volume,Issue,StartPage,EndPage,ECC,CitesPerYear,CitesPerAuthor,AuthorCount,Age,Abstract,FullTextURL,RelatedURL
0,"Kriti Srivastava, N. Shekokar","Design of Machine Learning and Rule Based Access Control System with Respect to Adaptability and Genuineness of the Requester",2020,"","","","",49,"2022-07-13 09:39:06","","10.4108/EAI.24-9-2020.166359","","",,,,,0,0.00,0,2,2,"INTRODUCTION: Access control system (ACS) plays a major role in data security. It becomes more challenging for the system to provide accurate ACS, if data is huge and data requesters are not fixed. This is very predominant in the era of big data where new data are adding to the system very frequently. The main issue here is to justify adaptability in ACS.    OBJECTIVE: The objective of this research is to have a comparative analysis of machine learning based access control methods with Rule based access control methods. Propose the most suitable method in detail.    METHODS: Role based access control methods are highly robust and works effectively under known scenarios. We need additional methods to handle unknown scenarios. A decision-making method is used to identify the certainty of the rules and Mamdani fuzzy model is used to evaluate the situation based on current environmental factors. For machine learning based access control method Random Forest is used.    RESULTS: Limitations of machine learning methods are discussed with respect to imbalanced data and bias in the algorithm. The proof of concept for rule-based access control method is tested for all the three modules involved in the framework. Certainty of the rules were accessed with the help of domain experts and accuracy of fuzzy rules were evaluated. Under critical conditions our framework was found to be accurate.    CONCLUSIONS: Machine learning systems are not suitable for access control if they suffer with imbalance data problem. Rule based system are consistent and highly adaptable to unknown situations. Rule based systems have evaluated the genuineness of the requester based on sensitivity of information, time, location, previous history and emergency parameters.","",""
0,"A. Chakrabarty, K. Berntorp, S. D. Cairano","Learning-based Parameter-Adaptive Reference Governors /Author=Chakrabarty, Ankush; Berntorp, Karl; Di Cairano, Stefano /CreationDate=July 3, 2020 /Subject=Control, Machine Learning",2020,"","","","",50,"2022-07-13 09:39:06","","","","",,,,,0,0.00,0,3,2,"Reference governors (RGs) provide an effective method for ensuring safety via constraint enforcement in closedloop control systems. When the parameters of the underlying systems are unknown, but constant or slowly-varying, robust formulations of RGs that consider only the worst-case effect may be overly conservative and exhibit poor performance. This paper proposes a parameter-adaptive reference governor (PARG) architecture that is capable of generating safe trajectories in spite of parameter uncertainties without being as conservative as robust RGs. The proposed approach leverages on-line data to inform algorithms for robust parameter estimation. Subsequently, confidence bounds around parameter estimates are fed to supervised machine learners for approximating robust constraint admissible sets leveraged by the PARG. While initially, due to the absence of on-line data, the PARG may be as conservative as a robust RG, as more data is gathered and the confidence bounds become tighter, such conservativeness reduces, as demonstrated in a simulation example. American Control Conference (ACC) This work may not be copied or reproduced in whole or in part for any commercial purpose. Permission to copy in whole or in part without payment of fee is granted for nonprofit educational and research purposes provided that all such whole or partial copies include the following: a notice that such copying is by permission of Mitsubishi Electric Research Laboratories, Inc.; an acknowledgment of the authors and individual contributions to the work; and all applicable portions of the copyright notice. Copying, reproduction, or republishing for any other purpose shall require a license with payment of fee to Mitsubishi Electric Research Laboratories, Inc. All rights reserved. Copyright c © Mitsubishi Electric Research Laboratories, Inc., 2020 201 Broadway, Cambridge, Massachusetts 02139 Learning-based Parameter-Adaptive Reference Governors Ankush Chakrabarty†, Karl Berntorp, Stefano Di Cairano Abstract—Reference governors (RGs) provide an effective method for ensuring safety via constraint enforcement in closedloop control systems. When the parameters of the underlying systems are unknown, but constant or slowly-varying, robust formulations of RGs that consider only the worst-case effect may be overly conservative and exhibit poor performance. This paper proposes a parameter-adaptive reference governor (PARG) architecture that is capable of generating safe trajectories in spite of parameter uncertainties without being as conservative as robust RGs. The proposed approach leverages on-line data to inform algorithms for robust parameter estimation. Subsequently, confidence bounds around parameter estimates are fed to supervised machine learners for approximating robust constraint admissible sets leveraged by the PARG. While initially, due to the absence of on-line data, the PARG may be as conservative as a robust RG, as more data is gathered and the confidence bounds become tighter, such conservativeness reduces, as demonstrated in a simulation example.","",""
6,"P. Nicholas, Gabriella Rossi, Ella Williams, Michael Bennett, T. Schork","Integrating real-time multi-resolution scanning and machine learning for Conformal Robotic 3D Printing in Architecture",2020,"","","","",51,"2022-07-13 09:39:06","","10.1177/1478077120948203","","",,,,,6,3.00,1,5,2,"Robotic 3D printing applications are rapidly growing in architecture, where they enable the introduction of new materials and bespoke geometries. However, current approaches remain limited to printing on top of a flat build bed. This limits robotic 3D printing’s impact as a sustainable technology: opportunities to customize or enhance existing elements, or to utilize complex material behaviour are missed. This paper addresses the potentials of conformal 3D printing and presents a novel and robust workflow for printing onto unknown and arbitrarily shaped 3D substrates. The workflow combines dual-resolution Robotic Scanning, Neural Network prediction and printing of PETG plastic. This integrated approach offers the advantage of responding directly to unknown geometries through automated performance design customization. This paper firstly contextualizes the work within the current state of the art of conformal printing. We then describe our methodology and the design experiment we have used to test it. We lastly describe the key findings, potentials and limitations of the work, as well as the next steps in this research.","",""
2,"Jacques Janse Van Vuuren, Liqiong Tang, I. Al-Bahadly, K. Arif","A 3-Stage Machine Learning-Based Novel Object Grasping Methodology",2020,"","","","",52,"2022-07-13 09:39:06","","10.1109/ACCESS.2020.2987341","","",,,,,2,1.00,1,4,2,"The automatic grasping of objects previously unseen by a robotic system is a difficult task—of which there is currently no robust solution. The research presented in this article improves upon previous works that employ depth data and learning techniques to generate and select from a pool of hypothesised grasps by focusing on the pruning and selection process. In this work, a vision-based, sampling methodology that generates candidate grasps through a convolutional neural network is proposed. Each candidate grasp is assessed using scores derived from the candidate itself and other related input modalities—such as the centre of gravity of the object. The final selection is determined by a learning algorithm. To overcome human bias, objective measures of grasp performance are established that comprehensively measure the error introduced by the grasp trial itself. The proposed metrics are empirically demonstrated to quantify grasp quality, offer useful criteria for network training and provide better descriptive power than traditional measures of grasp outcome. Experimentation showed that the proposed methodology can generate a meaningful, final grasp within 1.3 seconds. Trials quantitatively demonstrate a small-object-in-isolation performance of 99%. For unknown objects, this equates to a 10% improvement relative to other similar methodologies. Testing also showed that grasp performance was improved by 5% when implementing the proposed metrics—compared to the baseline.","",""
1920,"A. Kurakin, Ian J. Goodfellow, Samy Bengio","Adversarial Machine Learning at Scale",2016,"","","","",53,"2022-07-13 09:39:06","","","","",,,,,1920,320.00,640,3,6,"Adversarial examples are malicious inputs designed to fool machine learning models. They often transfer from one model to another, allowing attackers to mount black box attacks without knowledge of the target model's parameters. Adversarial training is the process of explicitly training a model on adversarial examples, in order to make it more robust to attack or to reduce its test error on clean inputs. So far, adversarial training has primarily been applied to small problems. In this research, we apply adversarial training to ImageNet. Our contributions include: (1) recommendations for how to succesfully scale adversarial training to large models and datasets, (2) the observation that adversarial training confers robustness to single-step attack methods, (3) the finding that multi-step attack methods are somewhat less transferable than single-step attack methods, so single-step attacks are the best for mounting black-box attacks, and (4) resolution of a ""label leaking"" effect that causes adversarially trained models to perform better on adversarial examples than on clean examples, because the adversarial example construction process uses the true label and the model can learn to exploit regularities in the construction process.","",""
2,"S. Siltanen, Takanori Ide","Electrical Impedance Tomography, Enclosure Method and Machine Learning",2020,"","","","",54,"2022-07-13 09:39:06","","10.1109/MLSP49062.2020.9231717","","",,,,,2,1.00,1,2,2,"Electrical impedance tomography (EIT) is a non-destructive imaging method, where a physical body is probed with electric measurements at the boundary, and information about the internal conductivity is extracted from the data. The enclosure method of Ikehata [J. Inv. III-Posed Prob. 8(2000)] recovers the convex hull of an inclusion of unknown conductivity embedded in known background conductivity. Practical implementations of the enclosure method are based on least-squares (LS) fitting of lines to noise-robust values of the so-called indicator function. It is shown how a convolutional neural network instead of LS fitting improves the accuracy of the enclosure method significantly while retaining interpretability.","",""
0,"C. Calad, Fernando Gutiérrez, Paola Pastor, P. Sarma","Combining Machine Learning with Traditional Reservoir Physics for Predictive Modeling and Optimization of a Large Mature Waterflood Project in the Gulf of San Jorge Basin in Argentina",2020,"","","","",55,"2022-07-13 09:39:06","","10.2118/199048-ms","","",,,,,0,0.00,0,4,2,"  A novel technology that combines the benefits of speed of data sciences with the predictivity capabilities of traditional simulation is being applied to model two blocks of a large waterflood project in the Gulf of San Jorge basin in southern Argentina. The tool is being used to provide a prescription of injection water redistribution that optimizes production and reserves development and reduces injection cost.  The technology used is called DataPhysics* and combines the robustness of reservoir physics with the speed of data sciences techniques. The process solves a limited number of unknowns in a continuous scale making it several orders of magnitude faster than traditional numeric simulation. The reservoir model is created from raw (uninterpreted) data and is updated continuously allowing for close loop reservoir optimization in real time. Long term predictivity is enabled by the fact that the tool honors the reservoir physics.  At the time of writing this paper the recommendations of the predictive model have been implemented in the pilot sector of the field and early positive results have been observed.","",""
26,"Theja Tulabandhula, C. Rudin","Robust Optimization using Machine Learning for Uncertainty Sets",2014,"","","","",56,"2022-07-13 09:39:06","","","","",,,,,26,3.25,13,2,8,"Our goal is to build robust optimization problems for making decisions based on complex data from the past. In robust optimization (RO) generally, the goal is to create a policy for decision-making that is robust to our uncertainty about the future. In particular, we want our policy to best handle the the worst possible situation that could arise, out of an uncertainty set of possible situations. Classically, the uncertainty set is simply chosen by the user, or it might be estimated in overly simplistic ways with strong assumptions; whereas in this work, we learn the uncertainty set from data collected in the past. The past data are drawn randomly from an (unknown) possibly complicated high-dimensional distribution. We propose a new uncertainty set design and show how tools from statistical learning theory can be employed to provide probabilistic guarantees on the robustness of the policy.","",""
1,"M. Jessell, Jiateng Guo, Yunqiang Li, M. Lindsay, R. Scalzo, J. Giraud, G. Pirot, E. Cripps, V. Ogarko","Into the Noddyverse: a massive data store of 3D geological models for machine learning and inversion applications",2022,"","","","",57,"2022-07-13 09:39:06","","10.5194/essd-14-381-2022","","",,,,,1,1.00,0,9,1,"Abstract. Unlike some other well-known challenges such as facial recognition, where machine learning and inversion algorithms are widely developed, the geosciences suffer from a lack of large, labelled data sets that can be used to validate or train robust machine learning and inversion schemes. Publicly available 3D geological models are far too restricted in both number and the range of geological scenarios to serve these purposes. With reference to inverting geophysical data this problem is further exacerbated as in most cases real geophysical observations result from unknown 3D geology, and synthetic test data sets are often not particularly geological or geologically diverse. To overcome these limitations, we have used the Noddy modelling platform to generate 1 million models, which represent the first publicly accessible massive training set for 3D geology and resulting gravity and magnetic data sets (https://doi.org/10.5281/zenodo.4589883, Jessell, 2021). This model suite can be used to train machine learning systems and to provide comprehensive test suites for geophysical inversion. We describe the methodology for producing the model suite and discuss the opportunities such a model suite affords, as well as its limitations, and how we can grow and access this resource. ","",""
6,"Rudrasis Chakraborty, Liu Yang, Søren Hauberg, B. Vemuri","Intrinsic Grassmann Averages for Online Linear, Robust and Nonlinear Subspace Learning",2017,"","","","",58,"2022-07-13 09:39:06","","10.1109/tpami.2020.2992392","","",,,,,6,1.20,2,4,5,"Principal component analysis (PCA) and Kernel principal component analysis (KPCA) are fundamental methods in machine learning for dimensionality reduction. The former is a technique for finding this approximation in finite dimensions and the latter is often in an infinite dimensional reproducing Kernel Hilbert-space (RKHS). In this paper, we present a geometric framework for computing the principal linear subspaces in both (finite and infinite) situations as well as for the robust PCA case, that amounts to computing the intrinsic average on the space of all subspaces: the Grassmann manifold. Points on this manifold are defined as the subspaces spanned by <inline-formula><tex-math notation=""LaTeX"">$K$</tex-math><alternatives><mml:math><mml:mi>K</mml:mi></mml:math><inline-graphic xlink:href=""chakraborty-ieq1-2992392.gif""/></alternatives></inline-formula>-tuples of observations. The intrinsic Grassmann average of these subspaces are shown to coincide with the principal components of the observations when they are drawn from a Gaussian distribution. We show similar results in the RKHS case and provide an efficient algorithm for computing the projection onto the this average subspace. The result is a method akin to KPCA which is substantially faster. Further, we present a novel online version of the KPCA using our geometric framework. Competitive performance of all our algorithms are demonstrated on a variety of real and synthetic data sets.","",""
16,"A. Moawad, A. Silge, T. Bocklitz, K. Fischer, P. Rösch, U. Roesler, M. Elschner, J. Popp, H. Neubauer","A Machine Learning-Based Raman Spectroscopic Assay for the Identification of Burkholderia mallei and Related Species",2019,"","","","",59,"2022-07-13 09:39:06","","10.3390/molecules24244516","","",,,,,16,5.33,2,9,3,"Burkholderia (B.) mallei, the causative agent of glanders, and B. pseudomallei, the causative agent of melioidosis in humans and animals, are genetically closely related. The high infectious potential of both organisms, their serological cross-reactivity, and similar clinical symptoms in human and animals make the differentiation from each other and other Burkholderia species challenging. The increased resistance against many antibiotics implies the need for fast and robust identification methods. The use of Raman microspectroscopy in microbial diagnostic has the potential for rapid and reliable identification. Single bacterial cells are directly probed and a broad range of phenotypic information is recorded, which is subsequently analyzed by machine learning methods. Burkholderia were handled under biosafety level 1 (BSL 1) conditions after heat inactivation. The clusters of the spectral phenotypes and the diagnostic relevance of the Burkholderia spp. were considered for an advanced hierarchical machine learning approach. The strain panel for training involved 12 B. mallei, 13 B. pseudomallei and 11 other Burkholderia spp. type strains. The combination of top- and sub-level classifier identified the mallei-complex with high sensitivities (>95%). The reliable identification of unknown B. mallei and B. pseudomallei strains highlighted the robustness of the machine learning-based Raman spectroscopic assay.","",""
2,"Jiyuan Tu, Weidong Liu, Xiaojun Mao","Byzantine-robust distributed sparse learning for M-estimation",2021,"","","","",60,"2022-07-13 09:39:06","","10.1007/S10994-021-06001-X","","",,,,,2,2.00,1,3,1,"","",""
2,"Alex Bauerle, Ángel Alexander Cabrera, Fred Hohman, Megan Maher, David Koski, Xavier Suau, Titus Barik, Dominik Moritz","Symphony: Composing Interactive Interfaces for Machine Learning",2022,"","","","",61,"2022-07-13 09:39:06","","10.1145/3491102.3502102","","",,,,,2,2.00,0,8,1,"Interfaces for machine learning (ML), information and visualizations about models or data, can help practitioners build robust and responsible ML systems. Despite their benefits, recent studies of ML teams and our interviews with practitioners (n=9) showed that ML interfaces have limited adoption in practice. While existing ML interfaces are effective for specific tasks, they are not designed to be reused, explored, and shared by multiple stakeholders in cross-functional teams. To enable analysis and communication between different ML practitioners, we designed and implemented Symphony, a framework for composing interactive ML interfaces with task-specific, data-driven components that can be used across platforms such as computational notebooks and web dashboards. We developed Symphony through participatory design sessions with 10 teams (n=31), and discuss our findings from deploying Symphony to 3 production ML projects at Apple. Symphony helped ML practitioners discover previously unknown issues like data duplicates and blind spots in models while enabling them to share insights with other stakeholders.","",""
1,"L. Merte, M. K. Bisbo, I. Sokolović, M. Setvín, Benjamin Hagman, M. Shipilin, M. Schmid, U. Diebold, E. Lundgren, B. Hammer","Structure of an Ultrathin Oxide on Pt3Sn(111) Solved by Machine Learning Enhanced Global Optimization.",2022,"","","","",62,"2022-07-13 09:39:06","","10.1002/anie.202204244","","",,,,,1,1.00,0,10,1,"Determination of the atomic structure of solid surfaces typically depends on comparison of measured properties with simulations based on hypothesized structural models. For simple structures, the models may be guessed, but for more complex structures there is a need for reliable theory-based search algorithms. So far, such methods have been limited by the combinatorial complexity and computational expense of sufficiently accurate energy estimation for surfaces. However, the introduction of machine learning methods has the potential to change this radically. Here, we demonstrate how an evolutionary algorithm, utilizing machine learning for accelerated energy estimation and diverse population generation, can be used to solve an unknown surface structure-the (4×4) surface oxide on Pt3Sn(111)-based on limited experimental input. The algorithm is efficient and robust, and should be broadly applicable in surface studies, where it can replace manual, intuition based model generation.","",""
0,"J. Steck, N. Thompson, E. Behrman","Programming Quantum Hardware via Levenberg Marquardt Machine Learning",2022,"","","","",63,"2022-07-13 09:39:06","","","","",,,,,0,0.00,0,3,1,"Significant challenges remain with the development of macroscopic quantum computing: hardware problems of noise, decoherence, and scaling; software problems of error correction; and, most important, algorithm construction. Finding truly quantum algorithms is quite difficult, and many quantum algorithms, like Shor’s prime factoring or phase estimation, require extremely long circuit depth for any practical application, necessitating error correction. Machine learning can be used as a systematic method to non-algorithmically “program” quantum computers. Quantum machine learning enables us to perform computations without breaking down an algorithm into its gate “building blocks”, eliminating that difficult step and potentially reducing unnecessary complexity. In addition, we have shown that our machine learning approach is robust to both noise and to decoherence, which is ideal for running on inherently noisy NISQ devices which are limited in the number of qubits available for error correction. We demonstrated this using a fundamentally non-classical calculation: experimentally estimating the entanglement of an unknown quantum state. Results from this have been successfully ported to the IBM hardware and trained using a powerful hybrid reinforcement learning technique which is a modified Levenberg-Marquardt (LM) method. The LM method is ideally suited to quantum machine learning as it only requires knowledge of the final measured output of the quantum computation, not intermediate quantum states which are generally not accessible. Since it processes all the learning data simultaneously, it also requires significantly fewer hits on the quantum hardware. Machine learning is demonstrated with results from simulations and runs on the IBM Qiskit hardware","",""
