Cites,Authors,Title,Year,Source,Publisher,ArticleURL,CitesURL,GSRank,QueryDate,Type,DOI,ISSN,CitationURL,Volume,Issue,StartPage,EndPage,ECC,CitesPerYear,CitesPerAuthor,AuthorCount,Age,Abstract,FullTextURL,RelatedURL
1,"Linghua Meng, Huanjun Liu, S. Ustin, Xinle Zhang","Predicting Maize Yield at the Plot Scale of Different Fertilizer Systems by Multi-Source Data and Machine Learning Methods",2021,"","","","",91,"2022-07-13 09:39:06","","10.3390/rs13183760","","",,,,,1,1.00,0,4,1,"Timely and reliable maize yield prediction is essential for the agricultural supply chain and food security. Previous studies using either climate or satellite data or both to build empirical or statistical models have prevailed for decades. However, to what extent climate and satellite data can improve yield prediction is still unknown. In addition, fertilizer information may also improve crop yield prediction, especially in regions with different fertilizer systems, such as cover crop, mineral fertilizer, or compost. Machine learning (ML) has been widely and successfully applied in crop yield prediction. Here, we attempted to predict maize yield from 1994 to 2007 at the plot scale by integrating multi-source data, including monthly climate data, satellite data (i.e., vegetation indices (VIs)), fertilizer data, and soil data to explore the accuracy of different inputs to yield prediction. The results show that incorporating all of the datasets using random forests (RF) and AB (adaptive boosting) can achieve better performances in yield prediction (R2: 0.85~0.98). In addition, the combination of VIs, climate data, and soil data (VCS) can predict maize yield more effectively than other combinations (e.g., combinations of all data and combinations of VIs and soil data). Furthermore, we also found that including different fertilizer systems had different prediction accuracies. This paper aggregates data from multiple sources and distinguishes the effects of different fertilization scenarios on crop yield predictions. In addition, the effects of different data on crop yield were analyzed in this study. Our study provides a paradigm that can be used to improve yield predictions for other crops and is an important effort that combines multi-source remotely sensed and environmental data for maize yield prediction at the plot scale and develops timely and robust methods for maize yield prediction grown under different fertilizing systems.","",""
1,"Soha Mohamed, M. S. Fayed","Modelling of Received Signals in Molecular Communication Systems based machine learning: Comparison of azure machine learning and Python tools",2021,"","","","",92,"2022-07-13 09:39:06","","","","",,,,,1,1.00,1,2,1,"Molecular communication (MC) implemented on Nano networks has extremely attractive characteristics in terms of energy efficiency, dependability, and robustness. Even though, the impact of incredibly slow molecule diffusion and high variability environments remains unknown. Analysis and designs of communication systems usually rely on developing mathematical models that describe the communication channel. However, the underlying channel models are unknown in some systems, such as MC systems, where chemical signals are used to transfer information. In these cases, a new method to analyze and design is needed. In this paper, we concentrate on one critical aspect of the MC system, modelling MC received signal until time t , and demonstrate that using tools from ML makes it promising to train detectors that can be executed well without any information about the channel model. Machine learning (ML) is one of the intelligent methodologies that has shown promising results in the domain. This paper applies Azure Machine Learning (Azure ML) for flexible pavement maintenance regressions problems and solutions. For prediction, four parameters are used as inputs: the receiver radius, transmitter radius, distance between receiver and transmitter, and diffusion coefficient, while the output is mAP (mean average precision) of the received signal. Azure ML enables algorithms that can learn from data and experiences and accomplish tasks without having to be coded. In the established Azure ML, the regression algorithms such as, boost decision tree regression, Bayesian linear regression, neural network, and decision forest regression are selected. The best performance is chosen as an optimality criterion. Finally, a comparison that shows the potential benefits of Azure ML tool over programmed based tool (Python), used by developers on local PCs, is demonstrated.","",""
1,"C. Knaak, M. Kröger, F. Schulze, P. Abels, A. Gillner","Deep Learning and Conventional Machine Learning for Image-Based in-Situ Fault Detection During Laser Welding: A Comparative Study",2021,"","","","",93,"2022-07-13 09:39:06","","10.20944/PREPRINTS202105.0272.V1","","",,,,,1,1.00,0,5,1,"An effective process monitoring strategy is a requirement for meeting the challenges posed by increasingly complex products and manufacturing processes. To address these needs, this study investigates a comprehensive scheme based on classical machine learning methods, deep learning algorithms, and feature extraction and selection techniques. In a first step, a novel deep learning architecture based on convolutional neural networks (CNN) and gated recurrent units (GRU) is introduced to predict the local weld quality based on mid-wave infrared (MWIR) and near-infrared (NIR) image data. The developed technology is used to discover critical welding defects including lack of fusion (false friends), sagging and lack of penetration, and geometric deviations of the weld seam. Additional work is conducted to investigate the significance of various geometrical, statistical, and spatio-temporal features extracted from the keyhole and weld pool regions. Furthermore, the performance of the proposed deep learning architecture is compared to that of classical supervised machine learning algorithms, such as multi-layer perceptron (MLP), logistic regression (LogReg), support vector machines (SVM), decision trees (DT), random forest (RF) and k-Nearest Neighbors (kNN). Optimal hyperparameters for each algorithm are determined by an extensive grid search. Ultimately, the three best classification models are combined into an ensemble classifier that yields the highest detection rates and achieves the most robust estimation of welding defects among all classifiers studied, which is validated on previously unknown welding trials.","",""
0,"C. Knaak, M. Kröger, F. Schulze, P. Abels, A. Gillner","Deep learning and conventional machine learning for image- based in-situ fault detection during laser welding: A compara- tive study",2021,"","","","",94,"2022-07-13 09:39:06","","","","",,,,,0,0.00,0,5,1,"An effective process monitoring strategy is a requirement for meeting the challenges posed by increasingly complex products and manufacturing processes. To address these needs, this study investigates a comprehensive scheme based on classical machine learning methods, deep learning algorithms, and feature extraction and selection techniques. In a first step, a novel deep learning architecture based on convolutional neural networks (CNN) and gated recurrent units (GRU) is introduced to predict the local weld quality based on mid-wave infrared (MWIR) and nearinfrared (NIR) image data. The developed technology is used to discover critical welding defects including lack of fusion (false friends), sagging and lack of penetration, and geometric deviations of the weld seam. Additional work is conducted to investigate the significance of various geometrical, statistical, and spatio-temporal features extracted from the keyhole and weld pool regions. Furthermore, the performance of the proposed deep learning architecture is compared to that of classical supervised machine learning algorithms, such as multi-layer perceptron (MLP), logistic regression (LogReg), support vector machines (SVM), decision trees (DT), random forest (RF) and k-Nearest Neighbors (kNN). Optimal hyperparameters for each algorithm are determined by an extensive grid search. Ultimately, the three best classification models are combined into an ensemble classifier that yields the highest detection rates and achieves the most robust estimation of welding defects among all classifiers studied, which is validated on previously unknown welding trials.","",""
3,"Wei Huang, Jing Zhao, Guokuan Yu, P. Wong","Intelligent Vibration Control for Semiactive Suspension Systems Without Prior Knowledge of Dynamical Nonlinear Damper Behaviors Based on Improved Extreme Learning Machine",2020,"","","","",95,"2022-07-13 09:39:06","","10.1109/tmech.2020.3031840","","",,,,,3,1.50,1,4,2,"Aiming at enhancing the vehicle comfort and handling performances, this article concerns with the development of the vibration control method for the semiactive suspension systems installed with electrohydraulic dampers. To reject the external disturbances induced by the irregular road profile, sliding mode was intensively investigated for vibration control owing to its robust feature of insensitivity to the parametric uncertainty and external disturbances. However, the unknown nonlinearity of damper behaviors leads to model mismatch to cause the high-frequency switching of sliding-mode controllers. Consequently, the severe chattering phenomenon produces. Although saturated function is available to alleviate the chattering problem of sliding-mode control, there is always a tradeoff problem between tracking accuracy and chattering suppression. To solve this problem, this study provides a new intelligent robust control method for simultaneous improvements of tracking accuracy and chattering suppression. Given the computational efficiency, an improved extreme learning machine (ELM) is proposed to intelligently approximate and compensate the unmodeled dynamics with unknown nonlinearity to restrain the chattering problem, where a new adaptive learning law is designed in the premise of Lyapunov stability. To validate the effectiveness and efficiency of the proposed ELM-based robust control, a quarter-car test rig was set up for the hardware-in-the-loop test. Experimental results show that the proposed controller outperforms the sliding-mode controller with saturated function in depressing the sprung mass acceleration and tire deflection, showing its significance in both control performance enhancement and chattering elimination.","",""
8,"Mustafa Anil Koçak, David Ramirez, E. Erkip, D. Shasha","SafePredict: A Meta-Algorithm for Machine Learning That Uses Refusals to Guarantee Correctness",2017,"","","","",96,"2022-07-13 09:39:06","","10.1109/TPAMI.2019.2932415","","",,,,,8,1.60,2,4,5,"<italic>SafePredict</italic> is a novel meta-algorithm that works with any base prediction algorithm for online data to guarantee an arbitrarily chosen correctness rate, <inline-formula><tex-math notation=""LaTeX"">$1-\epsilon$</tex-math><alternatives><mml:math><mml:mrow><mml:mn>1</mml:mn><mml:mo>-</mml:mo><mml:mi>ε</mml:mi></mml:mrow></mml:math><inline-graphic xlink:href=""kocak-ieq1-2932415.gif""/></alternatives></inline-formula>, by allowing refusals. Allowing refusals means that the meta-algorithm may refuse to emit a prediction produced by the base algorithm so that the error rate on non-refused predictions does not exceed <inline-formula><tex-math notation=""LaTeX"">$\epsilon$</tex-math><alternatives><mml:math><mml:mi>ε</mml:mi></mml:math><inline-graphic xlink:href=""kocak-ieq2-2932415.gif""/></alternatives></inline-formula>. The SafePredict error bound does not rely on any assumptions on the data distribution or the base predictor. When the base predictor happens not to exceed the target error rate <inline-formula><tex-math notation=""LaTeX"">$\epsilon$</tex-math><alternatives><mml:math><mml:mi>ε</mml:mi></mml:math><inline-graphic xlink:href=""kocak-ieq3-2932415.gif""/></alternatives></inline-formula>, SafePredict refuses only a finite number of times. When the error rate of the base predictor changes through time SafePredict makes use of a weight-shifting heuristic that adapts to these changes without knowing when the changes occur yet still maintains the correctness guarantee. Empirical results show that (i) SafePredict compares favorably with state-of-the-art confidence-based refusal mechanisms which fail to offer robust error guarantees; and (ii) combining SafePredict with such refusal mechanisms can in many cases further reduce the number of refusals. Our software is included in the supplementary material, which can be found on the Computer Society Digital Library at <uri>http://doi.ieeecomputersociety.org/10.1109/TPAMI.2019.2932415</uri>.","",""
20,"D. Grana, L. Azevedo, Mingliang Liu","A comparison of deep machine learning and Monte Carlo methods for facies classification from seismic data",2020,"","","","",97,"2022-07-13 09:39:06","","10.1190/geo2019-0405.1","","",,,,,20,10.00,7,3,2,"Among the large variety of mathematical and computational methods for estimating reservoir properties such as facies and petrophysical variables from geophysical data, deep machine-learning algorithms have gained significant popularity for their ability to obtain accurate solutions for geophysical inverse problems in which the physical models are partially unknown. Solutions of classification and inversion problems are generally not unique, and uncertainty quantification studies are required to quantify the uncertainty in the model predictions and determine the precision of the results. Probabilistic methods, such as Monte Carlo approaches, provide a reliable approach for capturing the variability of the set of possible models that match the measured data. Here, we focused on the classification of facies from seismic data and benchmarked the performance of three different algorithms: recurrent neural network, Monte Carlo acceptance/rejection sampling, and Markov chain Monte Carlo. We tested and validated these approaches at the well locations by comparing classification predictions to the reference facies profile. The accuracy of the classification results is defined as the mismatch between the predictions and the log facies profile. Our study found that when the training data set of the neural network is large enough and the prior information about the transition probabilities of the facies in the Monte Carlo approach is not informative, machine-learning methods lead to more accurate solutions; however, the uncertainty of the solution might be underestimated. When some prior knowledge of the facies model is available, for example, from nearby wells, Monte Carlo methods provide solutions with similar accuracy to the neural network and allow a more robust quantification of the uncertainty, of the solution.","",""
21,"Christopher Culley, S. Vijayakumar, Guido Zampieri, C. Angione","A mechanism-aware and multiomic machine-learning pipeline characterizes yeast cell growth",2020,"","","","",98,"2022-07-13 09:39:06","","10.1073/pnas.2002959117","","",,,,,21,10.50,5,4,2,"Significance Linking genotype and phenotype is a fundamental problem in biology, key to several biomedical and biotechnological applications. Cell growth is a central phenotypic trait, resulting from interactions between environment, gene regulation, and metabolism, yet its functional bases are still not completely understood. We propose and test a machine-learning approach that integrates large-scale gene expression profiles and mechanistic metabolic models, for characterizing cell growth and understanding its driving mechanisms in Saccharomyces cerevisiae. At its core, a custom-built multimodal learning method merges experimentally generated and model-generated data. We show that our approach can leverage the advantages of both machine learning and metabolic modeling, revealing unknown interactions between biological domains, incorporating mechanistic knowledge, and therefore overcoming black-box limitations of conventional data-driven approaches. Metabolic modeling and machine learning are key components in the emerging next generation of systems and synthetic biology tools, targeting the genotype–phenotype–environment relationship. Rather than being used in isolation, it is becoming clear that their value is maximized when they are combined. However, the potential of integrating these two frameworks for omic data augmentation and integration is largely unexplored. We propose, rigorously assess, and compare machine-learning–based data integration techniques, combining gene expression profiles with computationally generated metabolic flux data to predict yeast cell growth. To this end, we create strain-specific metabolic models for 1,143 Saccharomyces cerevisiae mutants and we test 27 machine-learning methods, incorporating state-of-the-art feature selection and multiview learning approaches. We propose a multiview neural network using fluxomic and transcriptomic data, showing that the former increases the predictive accuracy of the latter and reveals functional patterns that are not directly deducible from gene expression alone. We test the proposed neural network on a further 86 strains generated in a different experiment, therefore verifying its robustness to an additional independent dataset. Finally, we show that introducing mechanistic flux features improves the predictions also for knockout strains whose genes were not modeled in the metabolic reconstruction. Our results thus demonstrate that fusing experimental cues with in silico models, based on known biochemistry, can contribute with disjoint information toward biologically informed and interpretable machine learning. Overall, this study provides tools for understanding and manipulating complex phenotypes, increasing both the prediction accuracy and the extent of discernible mechanistic biological insights.","",""
94,"Qiang Zhu, A. Samanta, Bingxi Li, R. Rudd, T. Frolov","Predicting phase behavior of grain boundaries with evolutionary search and machine learning",2017,"","","","",99,"2022-07-13 09:39:06","","10.1038/s41467-018-02937-2","","",,,,,94,18.80,19,5,5,"","",""
3,"Xi Chen, Yining Wang","Robust Dynamic Pricing with Demand Learning in the Presence of Outlier Customers",2020,"","","","",100,"2022-07-13 09:39:06","","10.2139/ssrn.3650656","","",,,,,3,1.50,2,2,2,"Dynamic pricing is a core problem in revenue management. Most existing literature assumes that the demand follows a probabilistic model, with an unknown demand curve as the mean. However, in practice, customers may not always behave according to such a model. In “Robust Dynamic Pricing with Demand Learning in the Presence of Outlier Customers,” Chen and Wang study the dynamic pricing problem under model misspecification. To characterize the behavior of outlier customers, an ε-contamination model—the most fundamental model in robust statistics and machine learning, is adopted. The challenges brought by the presence of outlier customers are mainly due to the fact that arrivals of outliers and their exhibited demand behaviors are completely arbitrary. To address these challenges, the authors propose robust dynamic pricing policies that can handle any outlier arrival and demand patterns. The proposed policies are fully adaptive without requiring prior knowledge of the outlier proportion parameter.","",""
4,"Himaghna Bhattacharjee, Nikolaos Anesiadis, D. Vlachos","Regularized machine learning on molecular graph model explains systematic error in DFT enthalpies",2021,"","","","",101,"2022-07-13 09:39:06","","10.1038/s41598-021-93854-w","","",,,,,4,4.00,1,3,1,"","",""
33,"Ved P. Kafle, Y. Fukushima, P. Martinez-Julia, T. Miyazawa","Consideration On Automation of 5G Network Slicing with Machine Learning",2018,"","","","",102,"2022-07-13 09:39:06","","10.23919/ITU-WT.2018.8597639","","",,,,,33,8.25,8,4,4,"Machine learning has the capability to provide simpler solutions to complex problems by analyzing a huge volume of data in a short time, learning for adapting its functionality to dynamically changing environments, and predicting near future events with reasonably good accuracy. The 5G communication networks are getting complex due to emergence of unprecedentedly huge number of new connected devices and new types of services. Moreover, the requirements of creating virtual network slices suitable to provide optimal services for diverse users and applications are posing challenges to the efficient management of network resources, processing information about a huge volume of traffic, staying robust against all potential security threats, and adaptively adjustment of network functionality for time-varying workload. In this paper, we introduce about the envisioned 5G network slicing and elaborate the necessity of automation of network functions for the design, construction, deployment, operation, control and management of network slices. We then revisit the machine learning techniques that can be applied for the automation of network functions. We also discuss the status of artificial intelligence and machine learning related activities being progressed in standards development organizations and industrial forums.","",""
2,"Siddhant Agarwal, N. Tosi, P. Kessel, S. Padovan, D. Breuer, G. Montavon","Towards constraining Mars' thermal evolution using machine learning",2021,"","","","",103,"2022-07-13 09:39:06","","10.5194/EGUSPHERE-EGU21-4044","","",,,,,2,2.00,0,6,1,"<p>The thermal evolution of terrestrial planets depends strongly on several parameters and initial conditions that are poorly constrained. Often, direct or indirect observables from planetary missions such as elastic lithospheric thickness, crustal thickness and duration of volcanism are inverted to infer the unknown parameter values and initial conditions. The non-uniqueness and non-linearity of this inversion necessitates a probabilistic inversion framework. However, due to the expensive nature of forward dynamic simulations of thermal convection , Markov Chain Monte Carlo methods are rarely used. To address this shortcoming, some studies have recently shown the effectiveness of Mixture Density Networks (MDN) (Bishop 1995) in being able to approximate the posterior probability using only the dataset of simulations run prior to the inversion (Meier et al. 2007, de Wit et al. 2013, K&#228;ufl et al. 2016, Atkins et al. 2016).</p><p>Using MDNs, we systematically isolate the degree to which a parameter can be constrained using different &#8220;present-day&#8221; synthetic observables from 6130 simulations for a Mars-like planet. The dataset &#8211; generated using the mantle convection code GAIA (H&#252;ttig et al. 2013)- is the same as that used by Agarwal et al. (2020) for a surrogate modelling study.</p><p>The loss function used to optimize the MDN (log-likelihood) provides a single robust quantity that can be used to measure how well a parameter can be constrained. We test different numbers and combinations of observables (heat flux at the surface and core-mantle boundary, radial contraction, melt produced, elastic lithospheric thickness, and duration of volcanism) to constrain the following parameters: reference viscosity, activation energy and activation volume of the diffusion creep rheology, an enrichment factor for radiogenic elements in the crust, and initial mantle temperature. If all observables are available, reference viscosity can be constrained to within 32% of its entire range (10<sup>19</sup>&#8722;10<sup>22</sup> Pa s), crustal enrichment factor (1&#8722;50) to within 15%, activation energy (10<sup>5</sup>&#8722;5&#215;10<sup>5</sup> J mol-1 ) to within 80%, and initial mantle temperature (1600&#8722;1800K) to within 39%. The additional availability of the full present-day temperature profile or parts of it as an observable tightens the constraints further. The activation volume (4&#215;10<sup>-6</sup> &#8722;10&#215;10<sup>-6</sup>&#160; m<sup>3</sup> mol<sup>-1</sup>) cannot be constrained and requires research into new observables in space and time, as well as fields other than just temperature. Testing different levels of uncertainty (simulated using Gaussian noise) in the observables, we found that constraints on different parameters loosen at different rates, with initial temperature being the most sensitive. Finally, we present how the marginal MDN proposed by Bishop (1995) can be modified to model the joint probability for all parameters, so that&#160; the inter-parameter correlations and the associated degeneracy can be capture, thereby providing a more comprehensive picture of all the evolution scenarios that fit given observational constraints.</p>","",""
