Cites,Authors,Title,Year,Source,Publisher,ArticleURL,CitesURL,GSRank,QueryDate,Type,DOI,ISSN,CitationURL,Volume,Issue,StartPage,EndPage,ECC,CitesPerYear,CitesPerAuthor,AuthorCount,Age,Abstract,FullTextURL,RelatedURL
94,"Young Jin Kim, Sun Choi, Simon Briceno, D. Mavris","A deep learning approach to flight delay prediction",2016,"","","","",154,"2022-07-13 09:40:19","","10.1109/DASC.2016.7778092","","",,,,,94,15.67,24,4,6,"Deep learning has achieved significant improvement in various machine learning tasks including image recognition, speech recognition, machine translation and etc. Inspired by the huge success of the paradigm, there have been lots of tries to apply deep learning algorithms to data analytics problems with big data including traffic flow prediction. However, there has been no attempt to apply the deep learning algorithms to the analysis of air traffic data. This paper investigates the effectiveness of the deep learning models in the air traffic delay prediction tasks. By combining multiple models based on the deep learning paradigm, an accurate and robust prediction model has been built which enables an elaborate analysis of the patterns in air traffic delays. In particular, Recurrent Neural Networks (RNN) has shown its great accuracy in modeling sequential data. Day-to-day sequences of the departure and arrival flight delays of an individual airport have been modeled by the Long Short-Term Memory RNN architecture. It has been shown that the accuracy of RNN improves with deeper architectures. In this study, four different ways of building deep RNN architecture are also discussed. Finally, the accuracy of the proposed prediction model was measured, analyzed and compared with previous prediction methods. It shows best accuracy compared with all other methods.","",""
88,"Jingfeng Zhang, Jianing Zhu, Gang Niu, Bo Han, M. Sugiyama, M. Kankanhalli","Geometry-aware Instance-reweighted Adversarial Training",2020,"","","","",155,"2022-07-13 09:40:19","","","","",,,,,88,44.00,15,6,2,"In adversarial machine learning, there was a common belief that robustness and accuracy hurt each other. The belief was challenged by recent studies where we can maintain the robustness and improve the accuracy. However, the other direction, whether we can keep the accuracy while improving the robustness, is conceptually and practically more interesting, since robust accuracy should be lower than standard accuracy for any model. In this paper, we show this direction is also promising. Firstly, we find even over-parameterized deep networks may still have insufficient model capacity, because adversarial training has an overwhelming smoothing effect. Secondly, given limited model capacity, we argue adversarial data should have unequal importance: geometrically speaking, a natural data point closer to/farther from the class boundary is less/more robust, and the corresponding adversarial data point should be assigned with larger/smaller weight. Finally, to implement the idea, we propose geometry-aware instance-reweighted adversarial training, where the weights are based on how difficult it is to attack a natural data point. Experiments show that our proposal boosts the robustness of standard adversarial training; combining two directions, we improve both robustness and accuracy of standard adversarial training.","",""
24,"Mojtaba Heidarysafa, Kamran Kowsari, Donald E. Brown, K. Meimandi, Laura E. Barnes","An Improvement of Data Classification Using Random Multimodel Deep Learning (RMDL)",2018,"","","","",156,"2022-07-13 09:40:19","","10.18178/ijmlc.2018.8.4.703","","",,,,,24,6.00,5,5,4,"The exponential growth in the number of complex datasets every year requires more enhancement in machine learning methods to provide robust and accurate data classification. Lately, deep learning approaches have achieved surpassing results in comparison to previous machine learning algorithms. However, finding the suitable structure for these models has been a challenge for researchers. This paper introduces Random Multimodel Deep Learning (RMDL): a new ensemble, deep learning approach for classification. RMDL solves the problem of finding the best deep learning structure and architecture while simultaneously improving robustness and accuracy through ensembles of deep learning architectures. In short, RMDL trains multiple randomly generated models of Deep Neural Network (DNN), Convolutional Neural Network (CNN) and Recurrent Neural Network (RNN) in parallel and combines their results to produce better result of any of those models individually. In this paper, we describe RMDL model and compare the results for image and text classification as well as face recognition. We used MNIST and CIFAR-10 datasets as ground truth datasets for image classification and WOS, Reuters, IMDB, and 20newsgroup datasets for text classification. Lastly, we used ORL dataset to compare the model performance on face recognition task.","",""
28,"F. Hoseini, A. Shahbahrami, P. Bayat","AdaptAhead Optimization Algorithm for Learning Deep CNN Applied to MRI Segmentation",2018,"","","","",157,"2022-07-13 09:40:19","","10.1007/s10278-018-0107-6","","",,,,,28,7.00,9,3,4,"","",""
39,"Yingjie Yin, De Xu, Xingang Wang, Mingran Bai","Online State-Based Structured SVM Combined With Incremental PCA for Robust Visual Tracking",2015,"","","","",158,"2022-07-13 09:40:19","","10.1109/TCYB.2014.2363078","","",,,,,39,5.57,10,4,7,"In this paper, we propose a robust state-based structured support vector machine (SVM) tracking algorithm combined with incremental principal component analysis (PCA). Different from the current structured SVM for tracking, our method directly learns and predicts the object's states and not the 2-D translation transformation during tracking. We define the object's virtual state to combine the state-based structured SVM and incremental PCA. The virtual state is considered as the most confident state of the object in every frame. The incremental PCA is used to update the virtual feature vector corresponding to the virtual state and the principal subspace of the object's feature vectors. In order to improve the accuracy of the prediction, all the feature vectors are projected onto the principal subspace in the learning and prediction process of the state-based structured SVM. Experimental results on several challenging video sequences validate the effectiveness and robustness of our approach.","",""
87,"R. J. Oentaryo, Ee-Peng Lim, Jia-Wei Low, D. Lo, Michael Finegold","Predicting response in mobile advertising with hierarchical importance-aware factorization machine",2014,"","","","",159,"2022-07-13 09:40:19","","10.1145/2556195.2556240","","",,,,,87,10.88,17,5,8,"Mobile advertising has recently seen dramatic growth, fueled by the global proliferation of mobile phones and devices. The task of predicting ad response is thus crucial for maximizing business revenue. However, ad response data change dynamically over time, and are subject to cold-start situations in which limited history hinders reliable prediction. There is also a need for a robust regression estimation for high prediction accuracy, and good ranking to distinguish the impacts of different ads. To this end, we develop a Hierarchical Importance-aware Factorization Machine (HIFM), which provides an effective generic latent factor framework that incorporates importance weights and hierarchical learning. Comprehensive empirical studies on a real-world mobile advertising dataset show that HIFM outperforms the contemporary temporal latent factor models. The results also demonstrate the efficacy of the HIFM's importance-aware and hierarchical learning in improving the overall prediction and prediction in cold-start scenarios, respectively.","",""
307,"T. Jabid, Md. Hasanul Kabir, O. Chae","Robust Facial Expression Recognition Based on Local Directional Pattern",2010,"","","","",160,"2022-07-13 09:40:19","","10.4218/etrij.10.1510.0132","","",,,,,307,25.58,102,3,12,"Automatic facial expression recognition has many potential applications in different areas of human computer interaction. However, they are not yet fully realized due to the lack of an effective facial feature descriptor. In this paper, we present a new appearance‐based feature descriptor, the local directional pattern (LDP), to represent facial geometry and analyze its performance in expression recognition. An LDP feature is obtained by computing the edge response values in 8 directions at each pixel and encoding them into an 8 bit binary number using the relative strength of these edge responses. The LDP descriptor, a distribution of LDP codes within an image or image patch, is used to describe each expression image. The effectiveness of dimensionality reduction techniques, such as principal component analysis and AdaBoost, is also analyzed in terms of computational cost saving and classification accuracy. Two well‐known machine learning methods, template matching and support vector machine, are used for classification using the Cohn‐Kanade and Japanese female facial expression databases. Better classification accuracy shows the superiority of LDP descriptor against other appearance‐based feature descriptors.","",""
88,"Yicong Zhou, Yantao Wei","Learning Hierarchical Spectral–Spatial Features for Hyperspectral Image Classification",2016,"","","","",161,"2022-07-13 09:40:19","","10.1109/TCYB.2015.2453359","","",,,,,88,14.67,44,2,6,"This paper proposes a spectral-spatial feature learning (SSFL) method to obtain robust features of hyperspectral images (HSIs). It combines the spectral feature learning and spatial feature learning in a hierarchical fashion. Stacking a set of SSFL units, a deep hierarchical model called the spectral-spatial networks (SSN) is further proposed for HSI classification. SSN can exploit both discriminative spectral and spatial information simultaneously. Specifically, SSN learns useful high-level features by alternating between spectral and spatial feature learning operations. Then, kernel-based extreme learning machine (KELM), a shallow neural network, is embedded in SSN to classify image pixels. Extensive experiments are performed on two benchmark HSI datasets to verify the effectiveness of SSN. Compared with state-of-the-art methods, SSN with a deep hierarchical architecture obtains higher classification accuracy in terms of the overall accuracy, average accuracy, and kappa (κ) coefficient of agreement, especially when the number of the training samples is small.","",""
29,"S. Latif, R. Rana, Sara Khalifa, R. Jurdak, J. Epps, Björn W. Schuller","Multi-Task Semi-Supervised Adversarial Autoencoding for Speech Emotion Recognition",2019,"","","","",162,"2022-07-13 09:40:19","","10.1109/taffc.2020.2983669","","",,,,,29,9.67,5,6,3,"Inspite the emerging importance of Speech Emotion Recognition (SER), the state-of-the-art accuracy is quite low and needs improvement to make commercial applications of SER viable. A key underlying reason for the low accuracy is the scarcity of emotion datasets, which is a challenge for developing any robust machine learning model in general. In this article, we propose a solution to this problem: a multi-task learning framework that uses auxiliary tasks for which data is abundantly available. We show that utilisation of this additional data can improve the primary task of SER for which only limited labelled data is available. In particular, we use gender identifications and speaker recognition as auxiliary tasks, which allow the use of very large datasets, e. g., speaker classification datasets. To maximise the benefit of multi-task learning, we further use an adversarial autoencoder (AAE) within our framework, which has a strong capability to learn powerful and discriminative features. Furthermore, the unsupervised AAE in combination with the supervised classification networks enables semi-supervised learning which incorporates a discriminative component in the AAE unsupervised training pipeline. This semi-supervised learning essentially helps to improve generalisation of our framework and thus leads to improvements in SER performance. The proposed model is rigorously evaluated for categorical and dimensional emotion, and cross-corpus scenarios. Experimental results demonstrate that the proposed model achieves state-of-the-art performance on two publicly available datasets.","",""
142,"Kaihua Zhang, Lei Zhang, Ming-Hsuan Yang, David Zhang","Fast Tracking via Spatio-Temporal Context Learning",2013,"","","","",163,"2022-07-13 09:40:19","","","","",,,,,142,15.78,36,4,9,"In this paper, we present a simple yet fast and robust algorithm which exploits the spatio-temporal context for visual tracking. Our approach formulates the spatio-temporal relationships between the object of interest and its local context based on a Bayesian framework, which models the statistical correlation between the low-level features (i.e., image intensity and position) from the target and its surrounding regions. The tracking problem is posed by computing a confidence map, and obtaining the best target location by maximizing an object location likelihood function. The Fast Fourier Transform is adopted for fast learning and detection in this work. Implemented in MATLAB without code optimization, the proposed tracker runs at 350 frames per second on an i7 machine. Extensive experimental results show that the proposed algorithm performs favorably against state-of-the-art methods in terms of efficiency, accuracy and robustness.","",""
67,"Byunghan Lee, Jung-un Baek, Seunghyun Park, Sungroh Yoon","deepTarget: End-to-end Learning Framework for microRNA Target Prediction using Deep Recurrent Neural Networks",2016,"","","","",164,"2022-07-13 09:40:19","","10.1145/2975167.2975212","","",,,,,67,11.17,17,4,6,"MicroRNAs (miRNAs) are short sequences of ribonucleic acids that control the expression of target messenger RNAs (mRNAs) by binding them. Robust prediction of miRNA-mRNA pairs is of utmost importance in deciphering gene regulation but has been challenging because of high false positive rates, despite a deluge of computational tools that normally require laborious manual feature extraction. This paper presents an end-to-end machine learning framework for miRNA target prediction. Leveraged by deep recurrent neural networks-based auto-encoding and sequence-sequence interaction learning, our approach not only delivers an unprecedented level of accuracy but also eliminates the need for manual feature extraction. The performance gap between the proposed method and existing alternatives is substantial (over 25% increase in F-measure), and deepTarget delivers a quantum leap in the longstanding challenge of robust miRNA target prediction. [availability: http://data.snu.ac.kr/pub/deepTarget]","",""
7,"Shashanka Ubaru, Kesheng Wu, K. Bouchard","UoI-NMF Cluster: A Robust Nonnegative Matrix Factorization Algorithm for Improved Parts-Based Decomposition and Reconstruction of Noisy Data",2017,"","","","",165,"2022-07-13 09:40:19","","10.1109/ICMLA.2017.0-152","","",,,,,7,1.40,2,3,5,"With the ever growing collection of large volumes of scientific data, development of interpretable machine learning tools to analyze such data is becoming more important. However, robust, interpretable machine learning tools are lacking, threatening extraction of scientific insight and discovery. Nonnegative Matrix Factorization (NMF) algorithms decompose an m × n nonnegative data matrix A into a k × n basis matrix H and an m × k weight matrix W, such that A ≈ WH, where k is the desired rank. In this paper, we present a novel two stage algorithm, UoI-NMF_cluster for NMF, which is based on three innovations: (i) completely separate bases learning from weight estimation, (ii) learn bases by clustering NMF results across bootstrap resamples of the data, and (iii) use the recently introduced Union of Intersections (UoI) framework to estimate ultra-sparse weights that maximize data reconstruction accuracy. We deploy our algorithm on various synthetic and scientific data to illustrate its performance, with a focus on neuroscience data. Compared to other NMF algorithms, UoI-NMF_cluster yields: a) more accurate parts-based decompositions of noisy data, b) a sparse and accurate weight matrix, and c) high accuracy reconstructions of the de-noised data. Together, these improvements enhance the performance and interpretability of NMF application to noisy data, and suggest similar approaches may benefit other matrix decomposition algorithms.","",""
139,"G. Widmer","Machine Discoveries: A Few Simple, Robust Local Expression Principles",2002,"","","","",166,"2022-07-13 09:40:19","","10.1076/jnmr.31.1.37.8103","","",,,,,139,6.95,139,1,20,"The paper presents a new approach to discovering general rules of expressive music performance from real performance data via inductive machine learning. A new learning algorithm is briefly presented, and then an experiment with a very large data set (performances of 13 Mozart piano sonatas) is described. The new learning algorithm succeeds in discovering some extremely simple and general principles of musical performance (at the level of individual notes), in the form of categorical prediction rules. These rules turn out to be very robust and general: when tested on performances by a different pianist and even on music of a different style (Chopin), they exhibit a surprisingly high degree of predictive accuracy.","",""
15,"Saadullah Amin, A. Kamboh","A robust approach towards epileptic seizure detection",2016,"","","","",167,"2022-07-13 09:40:19","","10.1109/MLSP.2016.7738825","","",,,,,15,2.50,8,2,6,"In this paper we present the application of ensemble learning to epileptic seizure detection problem. We propose a robust learning framework to mitigate class imbalance in large CHB-MIT (982 hrs) scalp EEG dataset. The algorithm being used is RUSBoost which is a hybrid data sampling and boosting technique designed especially for skewed classes. The data that is being used in this study has severe class imbalance, with average representation of 0.38% of seizure class to that of 99.62% of non-seizure class. The proposed approach shows the power of RUSBoost in terms of robustness and generalization. We compared our method with the most successful Support Vector Machine (SVM) based approach and report competitive results of 97% seizure detection accuracy, mean detection delay of 2.7s and false detection rate of 0.08 seizure/hr. We also report fast training times of just under three minutes on average for average training data of 21 hrs.","",""
30,"S. Bazrafkan, Tudor Nedelcu, P. Filipczuk, P. Corcoran","Deep learning for facial expression recognition: A step closer to a smartphone that knows your moods",2017,"","","","",168,"2022-07-13 09:40:19","","10.1109/ICCE.2017.7889290","","",,,,,30,6.00,8,4,5,"By growing the capacity and processing power of the handheld devices nowadays, a wide range of capabilities can be implemented in these devices to make them more intelligent and user friendly. Determining the mood of the user can be used in order to provide suitable reactions from the device in different conditions. One of the most studied ways of mood detection is by using facial expressions, which is still one of the challenging fields in pattern recognition and machine learning science. Deep Neural Networks (DNN) have been widely used in order to overcome the difficulties in facial expression classification. In this paper it is shown that the classification accuracy is significantly lower when the network is trained with one database and tested with a different database. A solution for obtaining a general and robust network is given as well.","",""
35,"M. Salucci, J. Vrba, I. Merunka, A. Massa","Real‐time brain stroke detection through a learning‐by‐examples technique—An experimental assessment",2017,"","","","",169,"2022-07-13 09:40:19","","10.1002/mop.30821","","",,,,,35,7.00,9,4,5,"The real‐time detection of brain strokes is addressed within the Learning‐by‐Examples (LBE) framework. Starting from scattering measurements at microwave regime, a support vector machine (SVM) is exploited to build a robust decision function able to infer in real‐time whether a stroke is present or not in the patient head. The proposed approach is validated in a laboratory‐controlled environment by considering experimental measurements for both training and testing SVM phases. The obtained results prove that a very high detection accuracy can be yielded even though using a limited amount of training data.","",""
21,"P. Xanthopoulos, M. Guarracino, P. Pardalos","Robust generalized eigenvalue classifier with ellipsoidal uncertainty",2014,"","","","",170,"2022-07-13 09:40:19","","10.1007/s10479-012-1303-2","","",,,,,21,2.63,7,3,8,"","",""
13,"T. Kärkkäinen, Mirka Saarela","Robust Principal Component Analysis of Data with Missing Values",2015,"","","","",171,"2022-07-13 09:40:19","","10.1007/978-3-319-21024-7_10","","",,,,,13,1.86,7,2,7,"","",""
109,"Zhuohan Li, Eric Wallace, Sheng Shen, Kevin Lin, K. Keutzer, D. Klein, Joseph Gonzalez","Train Large, Then Compress: Rethinking Model Size for Efficient Training and Inference of Transformers",2020,"","","","",172,"2022-07-13 09:40:19","","","","",,,,,109,54.50,16,7,2,"Since hardware resources are limited, the objective of training deep learning models is typically to maximize accuracy subject to the time and memory constraints of training and inference. We study the impact of model size in this setting, focusing on Transformer models for NLP tasks that are limited by compute: self-supervised pretraining and high-resource machine translation. We first show that even though smaller Transformer models execute faster per iteration, wider and deeper models converge in significantly fewer steps. Moreover, this acceleration in convergence typically outpaces the additional computational overhead of using larger models. Therefore, the most compute-efficient training strategy is to counterintuitively train extremely large models but stop after a small number of iterations.  This leads to an apparent trade-off between the training efficiency of large Transformer models and the inference efficiency of small Transformer models. However, we show that large models are more robust to compression techniques such as quantization and pruning than small models. Consequently, one can get the best of both worlds: heavily compressed, large models achieve higher accuracy than lightly compressed, small models.","",""
65,"Kokil Jaidka, Salvatore Giorgi, H. A. Schwartz, Margaret L. Kern, L. Ungar, J. Eichstaedt","Estimating geographic subjective well-being from Twitter: A comparison of dictionary and data-driven language methods",2020,"","","","",173,"2022-07-13 09:40:19","","10.1073/pnas.1906364117","","",,,,,65,32.50,11,6,2,"Significance Spatial aggregation of Twitter language may make it possible to monitor the subjective well-being of populations on a large scale. Text analysis methods need to yield robust estimates to be dependable. On the one hand, we find that data-driven machine learning-based methods offer accurate and robust measurements of regional well-being across the United States when evaluated against gold-standard Gallup survey measures. On the other hand, we find that standard English word-level methods (such as Linguistic Inquiry and Word Count 2015’s Positive emotion dictionary and Language Assessment by Mechanical Turk) can yield estimates of county well-being inversely correlated with survey estimates, due to regional cultural and socioeconomic differences in language use. Some of the most frequent misleading words can be removed to improve the accuracy of these word-level methods. Researchers and policy makers worldwide are interested in measuring the subjective well-being of populations. When users post on social media, they leave behind digital traces that reflect their thoughts and feelings. Aggregation of such digital traces may make it possible to monitor well-being at large scale. However, social media-based methods need to be robust to regional effects if they are to produce reliable estimates. Using a sample of 1.53 billion geotagged English tweets, we provide a systematic evaluation of word-level and data-driven methods for text analysis for generating well-being estimates for 1,208 US counties. We compared Twitter-based county-level estimates with well-being measurements provided by the Gallup-Sharecare Well-Being Index survey through 1.73 million phone surveys. We find that word-level methods (e.g., Linguistic Inquiry and Word Count [LIWC] 2015 and Language Assessment by Mechanical Turk [LabMT]) yielded inconsistent county-level well-being measurements due to regional, cultural, and socioeconomic differences in language use. However, removing as few as three of the most frequent words led to notable improvements in well-being prediction. Data-driven methods provided robust estimates, approximating the Gallup data at up to r = 0.64. We show that the findings generalized to county socioeconomic and health outcomes and were robust when poststratifying the samples to be more representative of the general US population. Regional well-being estimation from social media data seems to be robust when supervised data-driven methods are used.","",""
