Cites,Authors,Title,Year,Source,Publisher,ArticleURL,CitesURL,GSRank,QueryDate,Type,DOI,ISSN,CitationURL,Volume,Issue,StartPage,EndPage,ECC,CitesPerYear,CitesPerAuthor,AuthorCount,Age,Abstract,FullTextURL,RelatedURL
26,"Yuji Roh, Kangwook Lee, S. E. Whang, Changho Suh","FR-Train: A mutual information-based approach to fair and robust training",2020,"","","","",84,"2022-07-13 09:40:19","","","","",,,,,26,13.00,7,4,2,"Trustworthy AI is a critical issue in machine learning where, in addition to training a model that is accurate, one must consider both fair and robust training in the presence of data bias and poisoning. However, the existing model fairness techniques mistakenly view poisoned data as an additional bias to be fixed, resulting in severe performance degradation. To address this problem, we propose FR-Train, which holistically performs fair and robust model training. We provide a mutual information-based interpretation of an existing adversarial training-based fairness-only method, and apply this idea to architect an additional discriminator that can identify poisoned data using a clean validation set and reduce its influence. In our experiments, FR-Train shows almost no decrease in fairness and accuracy in the presence of data poisoning by both mitigating the bias and defending against poisoning. We also demonstrate how to construct clean validation sets using crowdsourcing, and release new benchmark datasets.","",""
26,"Mohammad Saidur Rahman, M. Imani, Nate Mathews, M. Wright","Mockingbird: Defending Against Deep-Learning-Based Website Fingerprinting Attacks With Adversarial Traces",2019,"","","","",85,"2022-07-13 09:40:19","","10.1109/TIFS.2020.3039691","","",,,,,26,8.67,7,4,3,"Website Fingerprinting (WF) is a type of traffic analysis attack that enables a local passive eavesdropper to infer the victim’s activity, even when the traffic is protected by a VPN or an anonymity system like Tor. Leveraging a deep-learning classifier, a WF attacker can gain over 98% accuracy on Tor traffic. In this paper, we explore a novel defense, Mockingbird, based on the idea of adversarial examples that have been shown to undermine machine-learning classifiers in other domains. Since the attacker gets to design and train his attack classifier based on the defense, we first demonstrate that at a straightforward technique for generating adversarial-example based traces fails to protect against an attacker using adversarial training for robust classification. We then propose Mockingbird, a technique for generating traces that resists adversarial training by moving randomly in the space of viable traces and not following more predictable gradients. The technique drops the accuracy of the state-of-the-art attack hardened with adversarial training from 98% to 42–58% while incurring only 58% bandwidth overhead. The attack accuracy is generally lower than state-of-the-art defenses, and much lower when considering Top-2 accuracy, while incurring lower bandwidth overheads.","",""
62,"S. S. Bukhari, T. Breuel, Abedelkadir Asi, Jihad El-Sana","Layout Analysis for Arabic Historical Document Images Using Machine Learning",2012,"","","","",86,"2022-07-13 09:40:19","","10.1109/ICFHR.2012.227","","",,,,,62,6.20,16,4,10,"Page layout analysis is a fundamental step of any document image understanding system. We introduce an approach that segments text appearing in page margins (a.k.a side-notes text) from manuscripts with complex layout format. Simple and discriminative features are extracted in a connected-component level and subsequently robust feature vectors are generated. Multilayer perception classifier is exploited to classify connected components to the relevant class of text. A voting scheme is then applied to refine the resulting segmentation and produce the final classification. In contrast to state-of-the-art segmentation approaches, this method is independent of block segmentation, as well as pixel level analysis. The proposed method has been trained and tested on a dataset that contains a variety of complex side-notes layout formats, achieving a segmentation accuracy of about 95%.","",""
28,"E. Dobriban, Hamed Hassani, D. Hong, Alexander Robey","Provable tradeoffs in adversarially robust classification",2020,"","","","",87,"2022-07-13 09:40:19","","","","",,,,,28,14.00,7,4,2,"It is well known that machine learning methods can be vulnerable to adversarially-chosen perturbations of their inputs. Despite significant progress in the area, foundational open problems remain. Here we address several of these key questions. We derive exact and approximate Bayes-optimal robust classifiers for the important setting of two- and three-class Gaussian classification problems with arbitrary imbalance, for $\ell_2$ and $\ell_\infty$ adversaries. In contrast to classical Bayes-optimal classifiers, decisions here cannot be made pointwise and new theoretical approaches are needed. We develop and leverage new tools, including recent breakthroughs from probability theory on robust isoperimetry (Cianci et al, 2011, Mossel and Neeman 2015), which, to our knowledge, have not yet been used in the area. Our results reveal tradeoffs between standard and robust accuracy that grow when data is imbalanced. We also show further foundational results, including an analysis of the loss landscape, classification calibration for convex losses in certain models, and finite sample rates for the robust risk.","",""
33,"B. Nukala, N. Shibuya, Amanda Rodriguez, J. Tsay, Jerry Lopez, Tam Q. Nguyen, S. Zupancic, D. Lie","An Efficient and Robust Fall Detection System Using Wireless Gait Analysis Sensor with Artificial Neural Network (ANN) and Support Vector Machine (SVM) Algorithms",2014,"","","","",88,"2022-07-13 09:40:19","","10.4236/OJAB.2014.34004","","",,,,,33,4.13,4,8,8,"In this work, a total of 322 tests were taken on young volunteers by performing 10 different falls, 6 different Activities of Daily Living (ADL) and 7 Dynamic Gait Index (DGI) tests using a custom-designed Wireless Gait Analysis Sensor (WGAS). In order to perform automatic fall detection, we used Back Propagation Artificial Neural Network (BP-ANN) and Support Vector Machine (SVM) based on the 6 features extracted from the raw data. The WGAS, which includes a tri-axial accelerometer, 2 gyroscopes, and a MSP430 microcontroller, is worn by the subjects at either T4 (at back) or as a belt-clip in front of the waist during the various tests. The raw data is wirelessly transmitted from the WGAS to a near-by PC for real-time fall classification. The BP ANN is optimized by varying the training, testing and validation data sets and training the network with different learning schemes. SVM is optimized by using three different kernels and selecting the kernel for best classification rate. The overall accuracy of BP ANN is obtained as 98.20% with LM and RPROP training from the T4 data, while from the data taken at the belt, we achieved 98.70% with LM and SCG learning. The overall accuracy using SVM was 98.80% and 98.71% with RBF kernel from the T4 and belt position data, respectively.","",""
58,"Rakesh M. Verma, K. Dyer","On the Character of Phishing URLs: Accurate and Robust Statistical Learning Classifiers",2015,"","","","",89,"2022-07-13 09:40:19","","10.1145/2699026.2699115","","",,,,,58,8.29,29,2,7,"Phishing attacks resulted in an estimated $3.2 billion dollars worth of stolen property in 2007, and the success rate for phishing attacks is increasing each year [17]. Phishing attacks are becoming harder to detect and more elusive by using short time windows to launch attacks. In order to combat the increasing effectiveness of phishing attacks, we propose that combining statistical analysis of website URLs with machine learning techniques will give a more accurate classification of phishing URLs. Using a two-sample Kolmogorov-Smirnov test along with other features we were able to accurately classify 99.3% of our dataset, with a false positive rate of less than 0.4%. Thus, accuracy of phishing URL classification can be greatly increased through the use of these statistical measures.","",""
22,"M. Chiesa, Giada Maioli, G. Colombo, L. Piacentini","GARS: Genetic Algorithm for the identification of a Robust Subset of features in high-dimensional datasets",2020,"","","","",90,"2022-07-13 09:40:19","","10.1186/s12859-020-3400-6","","",,,,,22,11.00,6,4,2,"","",""
106,"Valentin Radu, P. Katsikouli, R. Sarkar, M. Marina","A semi-supervised learning approach for robust indoor-outdoor detection with smartphones",2014,"","","","",91,"2022-07-13 09:40:19","","10.1145/2668332.2668347","","",,,,,106,13.25,27,4,8,"The environmental context of a mobile device determines how it is used and how the device can optimize operations for greater efficiency and usability. We consider the problem of detecting if a device is indoor or outdoor. Towards this end, we present a general method employing semi-supervised machine learning and using only the lightweight sensors on a smartphone. We find that a particular semi-supervised learning method called co-training, when suitably engineered, is most effective. It is able to automatically learn characteristics of new environments and devices, and thereby provides a detection accuracy exceeding 90% even in unfamiliar circumstances. It can learn and adapt online, in real time, at modest computational costs. Thus the method is suitable for on-device learning. Implementation of the indoor-outdoor detection service based on our method is lightweight in energy use -- it can sleep when not in use and does not need to track the device state continuously. It is shown to outperform existing indoor-outdoor detection techniques that rely on static algorithms or GPS, in terms of both accuracy and energy-efficiency.","",""
92,"Christopher Briggs, Zhong Fan, P. András","Federated learning with hierarchical clustering of local updates to improve training on non-IID data",2020,"","","","",92,"2022-07-13 09:40:19","","10.1109/IJCNN48605.2020.9207469","","",,,,,92,46.00,31,3,2,"Federated learning (FL) is a well established method for performing machine learning tasks over massively distributed data. However in settings where data is distributed in a non-iid (not independent and identically distributed) fashion - as is typical in real world situations - the joint model produced by FL suffers in terms of test set accuracy and/or communication costs compared to training on iid data. We show that learning a single joint model is often not optimal in the presence of certain types of non-iid data. In this work we present a modification to FL by introducing a hierarchical clustering step (FL+HC) to separate clusters of clients by the similarity of their local updates to the global joint model. Once separated, the clusters are trained independently and in parallel on specialised models. We present a robust empirical analysis of the hyperparameters for FL+HC for several iid and non-iid settings. We show how FL+HC allows model training to converge in fewer communication rounds (significantly so under some non-iid settings) compared to FL without clustering. Additionally, FL+HC allows for a greater percentage of clients to reach a target accuracy compared to standard FL. Finally we make suggestions for good default hyperparameters to promote superior performing specialised models without modifying the the underlying federated learning communication protocol.","",""
180,"A. Sironi, M. Brambilla, Nicolas Bourdis, Xavier Lagorce, R. Benosman","HATS: Histograms of Averaged Time Surfaces for Robust Event-Based Object Classification",2018,"","","","",93,"2022-07-13 09:40:19","","10.1109/CVPR.2018.00186","","",,,,,180,45.00,36,5,4,"Event-based cameras have recently drawn the attention of the Computer Vision community thanks to their advantages in terms of high temporal resolution, low power consumption and high dynamic range, compared to traditional frame-based cameras. These properties make event-based cameras an ideal choice for autonomous vehicles, robot navigation or UAV vision, among others. However, the accuracy of event-based object classification algorithms, which is of crucial importance for any reliable system working in real-world conditions, is still far behind their frame-based counterparts. Two main reasons for this performance gap are: 1. The lack of effective low-level representations and architectures for event-based object classification and 2. The absence of large real-world event-based datasets. In this paper we address both problems. First, we introduce a novel event-based feature representation together with a new machine learning architecture. Compared to previous approaches, we use local memory units to efficiently leverage past temporal information and build a robust event-based representation. Second, we release the first large real-world event-based dataset for object classification. We compare our method to the state-of-the-art with extensive experiments, showing better classification performance and real-time computation.","",""
124,"H. Chan, Ravi K. Samala, L. Hadjiiski, Chuan Zhou","Deep Learning in Medical Image Analysis.",2017,"","","","",94,"2022-07-13 09:40:19","","10.1007/978-3-030-33128-3_1","","",,,,,124,24.80,31,4,5,"","",""
13,"G. Szabó, János Szüle, Z. Turányi, G. Pongrácz","Multi-level Machine Learning Traffic Classification System",2012,"","","","",95,"2022-07-13 09:40:19","","","","",,,,,13,1.30,3,4,10,"In this paper, we propose a novel framework for traffic classification that employs machine learning techniques and uses only packet header information. The framework consists of a number of key components. First, we use an efficient combination of clustering and classification algorithms to make the identification system robust in various network conditions. Second, we introduce traffic granularity levels and propagate information between the levels to increase accuracy and accelerate classification. Third, we use customized constraints based on connection patterns to efficiently utilize state-of-theart clustering algorithms. The components of the framework are evaluated step-by-step to examine their contribution to the performance of the whole system. Keywords-traffic classification; machine learning; packet header","",""
28,"Zhutian Yang, Wei Qiu, Hongjian Sun, A. Nallanathan","Robust Radar Emitter Recognition Based on the Three-Dimensional Distribution Feature and Transfer Learning",2016,"","","","",96,"2022-07-13 09:40:19","","10.3390/s16030289","","",,,,,28,4.67,7,4,6,"Due to the increasing complexity of electromagnetic signals, there exists a significant challenge for radar emitter signal recognition. To address this challenge, multi-component radar emitter recognition under a complicated noise environment is studied in this paper. A novel radar emitter recognition approach based on the three-dimensional distribution feature and transfer learning is proposed. The cubic feature for the time-frequency-energy distribution is proposed to describe the intra-pulse modulation information of radar emitters. Furthermore, the feature is reconstructed by using transfer learning in order to obtain the robust feature against signal noise rate (SNR) variation. Last, but not the least, the relevance vector machine is used to classify radar emitter signals. Simulations demonstrate that the approach proposed in this paper has better performances in accuracy and robustness than existing approaches.","",""
76,"Zhao Wang, Quande Liu, Q. Dou","Contrastive Cross-Site Learning With Redesigned Net for COVID-19 CT Classification",2020,"","","","",97,"2022-07-13 09:40:19","","10.1109/JBHI.2020.3023246","","",,,,,76,38.00,25,3,2,"The pandemic of coronavirus disease 2019 (COVID-19) has lead to a global public health crisis spreading hundreds of countries. With the continuous growth of new infections, developing automated tools for COVID-19 identification with CT image is highly desired to assist the clinical diagnosis and reduce the tedious workload of image interpretation. To enlarge the datasets for developing machine learning methods, it is essentially helpful to aggregate the cases from different medical systems for learning robust and generalizable models. This paper proposes a novel joint learning framework to perform accurate COVID-19 identification by effectively learning with heterogeneous datasets with distribution discrepancy. We build a powerful backbone by redesigning the recently proposed COVID-Net in aspects of network architecture and learning strategy to improve the prediction accuracy and learning efficiency. On top of our improved backbone, we further explicitly tackle the cross-site domain shift by conducting separate feature normalization in latent space. Moreover, we propose to use a contrastive training objective to enhance the domain invariance of semantic embeddings for boosting the classification performance on each dataset. We develop and evaluate our method with two public large-scale COVID-19 diagnosis datasets made up of CT images. Extensive experiments show that our approach consistently improves the performanceson both datasets, outperforming the original COVID-Net trained on each dataset by 12.16% and 14.23% in AUC respectively, also exceeding existing state-of-the-art multi-site learning methods.","",""
54,"Yujun Zeng, Xin Xu, Yuqiang Fang, Kun Zhao","Traffic Sign Recognition Using Deep Convolutional Networks and Extreme Learning Machine",2015,"","","","",98,"2022-07-13 09:40:19","","10.1007/978-3-319-23989-7_28","","",,,,,54,7.71,14,4,7,"","",""
130,"Jinkwon Kim, Hangsik Shin, Kwangsoo Shin, Myoungho Lee","Robust algorithm for arrhythmia classification in ECG using extreme learning machine",2009,"","","","",99,"2022-07-13 09:40:19","","10.1186/1475-925X-8-31","","",,,,,130,10.00,33,4,13,"","",""
65,"Jing wei Tan, Siow-Wee Chang, S. Abdul-Kareem, H. J. Yap, K. Yong","Deep Learning for Plant Species Classification Using Leaf Vein Morphometric",2020,"","","","",100,"2022-07-13 09:40:19","","10.1109/TCBB.2018.2848653","","",,,,,65,32.50,13,5,2,"An automated plant species identification system could help botanists and layman in identifying plant species rapidly. Deep learning is robust for feature extraction as it is superior in providing deeper information of images. In this research, a new CNN-based method named D-Leaf was proposed. The leaf images were pre-processed and the features were extracted by using three different Convolutional Neural Network (CNN) models namely pre-trained AlexNet, fine-tuned AlexNet, and D-Leaf. These features were then classified by using five machine learning techniques, namely, Support Vector Machine (SVM), Artificial Neural Network (ANN), k-Nearest-Neighbor (k-NN), Naïve-Bayes (NB), and CNN. A conventional morphometric method computed the morphological measurements based on the Sobel segmented veins was employed for benchmarking purposes. The D-Leaf model achieved a comparable testing accuracy of 94.88 percent as compared to AlexNet (93.26 percent) and fine-tuned AlexNet (95.54 percent) models. In addition, CNN models performed better than the traditional morphometric measurements (66.55 percent). The features extracted from the CNN are found to be fitted well with the ANN classifier. D-Leaf can be an effective automated system for plant species identification as shown by the experimental results.","",""
10,"C. Pappas, Dimitris Chatzopoulos, S. Lalis, M. Vavalis","IPLS: A Framework for Decentralized Federated Learning",2021,"","","","",101,"2022-07-13 09:40:19","","10.23919/ifipnetworking52078.2021.9472790","","",,,,,10,10.00,3,4,1,"The proliferation of resourceful mobile devices that store rich, multidimensional and privacy-sensitive user data motivate federated learning, a paradigm that enables mobile devices to produce a machine-learning model without sharing their data. However, the majority of the existing federated frameworks follow a centralized approach. In this work, we introduce IPLS, a fully decentralized federated learning framework that is partially based on the interplanetary file system (IPFS). By using IPLS and connecting into the corresponding private IPFS network, any party can initiate the training process of a machine-learning model or join an ongoing training process that has been started by another party. IPLS scales with the number of participants, is robust against intermittent connectivity and dynamic participant departures/arrivals, requires minimal resources and guarantees that the accuracy of the trained model quickly converges to that of a centralized federated learning framework with a negligible accuracy drop of less than 1‰.","",""
36,"Siyang Zhou, Zhendong Yin, Zhilu Wu, Yunfei Chen, Nan Zhao, Zhutian Yang","A robust modulation classification method using convolutional neural networks",2019,"","","","",102,"2022-07-13 09:40:19","","10.1186/s13634-019-0616-6","","",,,,,36,12.00,6,6,3,"","",""
28,"Kengo Sato, Manato Akiyama, Y. Sakakibara","RNA secondary structure prediction using deep learning with thermodynamic integration",2020,"","","","",103,"2022-07-13 09:40:19","","10.1038/s41467-021-21194-4","","",,,,,28,14.00,9,3,2,"","",""
693,"Y. Miché, A. Sorjamaa, P. Bas, O. Simula, C. Jutten, A. Lendasse","OP-ELM: Optimally Pruned Extreme Learning Machine",2010,"","","","",104,"2022-07-13 09:40:19","","10.1109/TNN.2009.2036259","","",,,,,693,57.75,116,6,12,"In this brief, the optimally pruned extreme learning machine (OP-ELM) methodology is presented. It is based on the original extreme learning machine (ELM) algorithm with additional steps to make it more robust and generic. The whole methodology is presented in detail and then applied to several regression and classification problems. Results for both computational time and accuracy (mean square error) are compared to the original ELM and to three other widely used methodologies: multilayer perceptron (MLP), support vector machine (SVM), and Gaussian process (GP). As the experiments for both regression and classification illustrate, the proposed OP-ELM methodology performs several orders of magnitude faster than the other algorithms used in this brief, except the original ELM. Despite the simplicity and fast performance, the OP-ELM is still able to maintain an accuracy that is comparable to the performance of the SVM. A toolbox for the OP-ELM is publicly available online.","",""
114,"Jun-Hai Zhai, Hong-Yu Xu, Xizhao Wang","Dynamic ensemble extreme learning machine based on sample entropy",2012,"","","","",105,"2022-07-13 09:40:19","","10.1007/s00500-012-0824-6","","",,,,,114,11.40,38,3,10,"","",""
20,"Rui Zhao, K. Mao","Semi-Random Projection for Dimensionality Reduction and Extreme Learning Machine in High-Dimensional Space",2015,"","","","",106,"2022-07-13 09:40:19","","10.1109/MCI.2015.2437316","","",,,,,20,2.86,10,2,7,"Random Projection (RP) is a popular technique for dimensionality reduction because of its high computational efficiency. However, RP may not yield highly discriminative low-dimensional space to produce best pattern classification performance since the random transformation matrix of RP is independent of data. In this paper, we propose a Semi-Random Projection (SRP) framework, which takes the merit of random feature sampling of RP, but employs learning mechanism in the determination of the transformation matrix. One advantage of SRP is that it achieves a good balance between computational complexity and classification accuracy. Another advantage of SRP is that multiple SRP modules can be stacked to form a deep learning architecture for compact and robust feature learning. In addition, based on the insight on the relationship between RP and Extreme Learning Machine (ELM), the SRP is applied to ELM to derive Partially Connected ELM (PC-ELM). The hidden nodes of PC-ELM are more discriminative and hence a smaller number of nodes are needed. Experiments on two real-world text corpus, i.e., 20 Newsgroups and Farms Ads., verify the effectiveness and efficiency of the proposed SRP. Experimental results also show that PC-ELM outperforms ELM for high-dimensional data.","",""
42,"Weihong Cai, Jie Yang, Yidan Yu, Youyi Song, Teng Zhou, J. Qin","PSO-ELM: A Hybrid Learning Model for Short-Term Traffic Flow Forecasting",2020,"","","","",107,"2022-07-13 09:40:19","","10.1109/ACCESS.2019.2963784","","",,,,,42,21.00,7,6,2,"Accurate and reliable traffic flow forecasting is of importance for urban planning and mitigation of traffic congestion, and it is also the basis for the deployment of intelligent traffic management systems. However, constructing a reasonable and robust forecasting model is a challenging task due to the uncertainties and nonlinear characteristics of traffic flow. Aiming at the nonlinear relationship affecting traffic flow forecasting effect, a PSO-ELM model based on particle swarm optimization is proposed for short-term traffic flow forecasting, which takes the advantages of particle swarm optimization to search global optimal solution and extreme learning machine to fast deal with the nonlinear relationship. The proposed model improves the accuracy of traffic flow forecasting. The traffic flow data from highways A1, A2, A4, A8 connecting to Amsterdam’s ring road are employed for the case study. The RMSEs of PSO-ELM model are respectively 252.61, 173.75, 200.24, 146.05, while the MAPEs of PSO-ELM model are respectively 11.86%, 10.10%, 10.74%, 11.60%. The experimental results show that the performance of the proposal is significantly better than the performance of state-of-the-art models.","",""
