Cites,Authors,Title,Year,Source,Publisher,ArticleURL,CitesURL,GSRank,QueryDate,Type,DOI,ISSN,CitationURL,Volume,Issue,StartPage,EndPage,ECC,CitesPerYear,CitesPerAuthor,AuthorCount,Age,Abstract,FullTextURL,RelatedURL
103,"Yunchao Liu, Srinivasan Arunachalam, K. Temme","A rigorous and robust quantum speed-up in supervised machine learning",2020,"","","","",1,"2022-07-13 09:40:19","","10.1038/s41567-021-01287-z","","",,,,,103,51.50,34,3,2,"","",""
15,"Ezekiel O. Soremekun, Sakshi Udeshi, Sudipta Chattopadhyay, A. Zeller","Exposing Backdoors in Robust Machine Learning Models",2020,"","","","",2,"2022-07-13 09:40:19","","","","",,,,,15,7.50,4,4,2,"The introduction of robust optimisation has pushed the state-of-the-art in defending against adversarial attacks. However, the behaviour of such optimisation has not been studied in the light of a fundamentally different class of attacks called backdoors. In this paper, we demonstrate that adversarially robust models are susceptible to backdoor attacks. Subsequently, we observe that backdoors are reflected in the feature representation of such models. Then, this observation is leveraged to detect backdoor-infected models via a detection technique called AEGIS. Specifically, AEGIS uses feature clustering to effectively detect backdoor-infected robust Deep Neural Networks (DNNs).  In our evaluation of major classification tasks using CIFAR-10, MNIST and FMNIST datasets, AEGIS effectively detects robust DNNs infected with backdoors. Overall, AEGIS has 97% (70/72) detection accuracy and 0.3% (2/648) false positive rate, for all configurations. Our investigation reveals that salient features of adversarially robust DNNs break the stealthy nature of backdoor attacks.","",""
30,"G. Fanourgakis, K. Gkagkas, E. Tylianakis, E. Klontzas, G. Froudakis","A Robust Machine Learning Algorithm for the Prediction of Methane Adsorption in Nanoporous Materials.",2019,"","","","",3,"2022-07-13 09:40:19","","10.1021/acs.jpca.9b03290","","",,,,,30,10.00,6,5,3,"In the present study, we propose a new set of descriptors that, along with a few structural features of nanoporous materials, can be used by machine learning algorithms for accurate predictions of the gas uptake capacities of these materials. All new descriptors closely resemble the helium atom void fraction of the material framework. However, instead of a helium atom, a particle with an appropriately defined van der Waals radius is used. The set of void fractions of a small number of these particles is found to be sufficient to characterize uniquely the structure of each material and to account for the most important topological features. We assess the accuracy of our approach by examining the predictions of the random forest algorithm in the relative small dataset of the computation-ready, experimental (CoRE) MOFs (∼4700 structures) that have been experimentally synthesized and whose geometrical/structural features have been accurately calculated before. We first performed grand canonical Monte Carlo simulations to accurately determine their methane uptake capacities at two different temperatures (280 and 298 K) and three different pressures (1, 5.8, and 65 bar). Despite the high chemical and structural diversity of the CoRE MOFs, it was found that the use of the proposed descriptors significantly improves the accuracy of the machine learning algorithm, particularly at low pressures, compared to the predictions made based solely on the rest structural features. More importantly, the algorithm can be easily adapted for other types of nanoporous materials beyond MOFs. Convergence of the predictions was reached even for small training set sizes compared to what was found in previous works using the hypothetical MOF database.","",""
27,"Anastasios Petropoulos, Vasilis Siakoulis, Evaggelos Stavroulakis, A. Klamargias","A robust machine learning approach for credit risk analysis of large loan level datasets using deep learning and extreme gradient boosting",2019,"","","","",4,"2022-07-13 09:40:19","","","","",,,,,27,9.00,7,4,3,"In the aftermath of global financial crisis of 2007–2008, central banks have put forward data statistics initiatives in order to boost their supervisory and monetary policy functions which will lead to central banks possessing big databases increasing the need for robust data mining processes and financial statistical modelling to support more informed decision making. Conventional econometric methods fail to capture efficiently the information contained in the full spectrum of the datasets. To address these challenges, in this work we investigate the analysis of a corporate credit loans big dataset using cutting edge machine learning techniques and deep learning neural networks. The novelty of our approach lies in the combination of a data mining algorithms that aim to reduce dimensionality in the data and increase accuracy in predicting the future behaviour of corporate loans, to facilitate a more effective micro and macro supervision of credit risk in the Greek banking system. Our analysis is based on a large dataset of loan level data, spanning a 10 year period of the Greek economy with the purpose of performing obligor credit quality classification and quantification of Probability of Default under a through the cycle setup. We perform extensive comparisons of the classification and forecasting accuracy of the proposed methods, using a 3-years’ period out-of-time sample. Our experimental results are benchmarked against other traditional methods, like logistic regression and discriminant analysis methods, yielding significantly superior performance. In the final stage of our analysis, a robust through the cycle financial credit rating is developed which can offer a proactive monitoring mechanism of the credit risk dynamics in a financial system. Finally the methodological framework introduced can support a more in depth analysis of database initiatives like ECB AnaCredit.","",""
34,"Muhammad Abdullah Hanif, Faiq Khalid, Rachmad Vidya Wicaksana Putra, Semeen Rehman, M. Shafique","Robust Machine Learning Systems: Reliability and Security for Deep Neural Networks",2018,"","","","",5,"2022-07-13 09:40:19","","10.1109/IOLTS.2018.8474192","","",,,,,34,8.50,7,5,4,"Machine learning is commonly being used in almost all the areas that involve advanced data analytics and intelligent control. From applications like Natural Language Processing (NLP) to autonomous driving are based upon machine learning algorithms. An increasing trend is observed in the use of Deep Neural Networks (DNNs) for such applications. While the slight inaccuracy in applications like NLP does not have any severe consequences, it is not the same for other safety-critical applications, like autonomous driving and smart healthcare, where a small error can lead to catastrophic effects. Apart from high-accuracy DNN algorithms, there is a significant need for robust machine learning systems and hardware architectures that can generate reliable and trustworthy results in the presence of hardware-level faults while also preserving security and privacy. This paper provides an overview of the challenges being faced in ensuring reliable and secure execution of DNNs. To address the challenges, we present several techniques for analyzing and mitigating the reliability and security threats in machine learning systems.","",""
18,"Haosheng Xu, A. Angrisano, S. Gaglione, L. Hsu","Machine learning based LOS/NLOS classifier and robust estimator for GNSS shadow matching",2020,"","","","",6,"2022-07-13 09:40:19","","10.1186/s43020-020-00016-w","","",,,,,18,9.00,5,4,2,"","",""
55,"Georgios Damaskinos, El-Mahdi El-Mhamdi, R. Guerraoui, Arsany Guirguis, Sébastien Rouault","AGGREGATHOR: Byzantine Machine Learning via Robust Gradient Aggregation",2019,"","","","",7,"2022-07-13 09:40:19","","","","",,,,,55,18.33,11,5,3,"We present AGGREGATHOR, a framework that implements state-of-the-art robust (Byzantine-resilient) distributed stochastic gradient descent. Following the standard parameter server model, we assume that a minority of worker machines can be controlled by an adversary and behave arbitrarily. Such a setting has been theoretically studied with several of the existing approaches using a robust aggregation of the workers’ gradient estimations. Yet, the question is whether a Byzantine-resilient aggregation can leverage more workers to speedup learning. We answer this theoretical question, and implement these state-of-the-art theoretical approaches on AGGREGATHOR, to assess their practical costs. We built AGGREGATHOR around TensorFlow and introduce modifications for vanilla TensorFlow towards making it usable in an actual Byzantine setting. AGGREGATHOR also permits the use of unreliable gradient transfer over UDP to provide further speed-up (without losing the accuracy) over the native communication protocols (TCP-based) of TensorFlow in saturated networks. We quantify the overhead of Byzantine resilience of AGGREGATHOR to 19% and 43% (to ensure weak and strong Byzantine resilience respectively) compared to vanilla TensorFlow.","",""
19,"A. Aravkin, Damek Davis","A SMART Stochastic Algorithm for Nonconvex Optimization with Applications to Robust Machine Learning",2016,"","","","",8,"2022-07-13 09:40:19","","","","",,,,,19,3.17,10,2,6,"In this paper, we show how to transform any optimization problem that arises from fitting a machine learning model into one that (1) detects and removes contaminated data from the training set while (2) simultaneously fitting the trimmed model on the uncontaminated data that remains. To solve the resulting nonconvex optimization problem, we introduce a fast stochastic proximal-gradient algorithm that incorporates prior knowledge through nonsmooth regularization. For datasets of size $n$, our approach requires $O(n^{2/3}/\varepsilon)$ gradient evaluations to reach $\varepsilon$-accuracy and, when a certain error bound holds, the complexity improves to $O(\kappa n^{2/3}\log(1/\varepsilon))$. These rates are $n^{1/3}$ times better than those achieved by typical, full gradient methods.","",""
12,"Atik Mahabub","A robust voting approach for diabetes prediction using traditional machine learning techniques",2019,"","","","",9,"2022-07-13 09:40:19","","10.1007/s42452-019-1759-7","","",,,,,12,4.00,12,1,3,"","",""
33,"B. Mortazavi, M. Silani, E. Podryabinkin, T. Rabczuk, X. Zhuang, A. Shapeev","First‐Principles Multiscale Modeling of Mechanical Properties in Graphene/Borophene Heterostructures Empowered by Machine‐Learning Interatomic Potentials",2021,"","","","",10,"2022-07-13 09:40:19","","10.1002/adma.202102807","","",,,,,33,33.00,6,6,1,"Density functional theory calculations are robust tools to explore the mechanical properties of pristine structures at their ground state but become exceedingly expensive for large systems at finite temperatures. Classical molecular dynamics (CMD) simulations offer the possibility to study larger systems at elevated temperatures, but they require accurate interatomic potentials. Herein the authors propose the concept of first‐principles multiscale modeling of mechanical properties, where ab initio level of accuracy is hierarchically bridged to explore the mechanical/failure response of macroscopic systems. It is demonstrated that machine‐learning interatomic potentials (MLIPs) fitted to ab initio datasets play a pivotal role in achieving this goal. To practically illustrate this novel possibility, the mechanical/failure response of graphene/borophene coplanar heterostructures is examined. It is shown that MLIPs conveniently outperform popular CMD models for graphene and borophene and they can evaluate the mechanical properties of pristine and heterostructure phases at room temperature. Based on the information provided by the MLIP‐based CMD, continuum models of heterostructures using the finite element method can be constructed. The study highlights that MLIPs were the missing block for conducting first‐principles multiscale modeling, and their employment empowers a straightforward route to bridge ab initio level accuracy and flexibility to explore the mechanical/failure response of nanostructures at continuum scale.","",""
14,"Hao Peng, X. Bai","Comparative evaluation of three machine learning algorithms on improving orbit prediction accuracy",2019,"","","","",11,"2022-07-13 09:40:19","","10.1007/S42064-018-0055-4","","",,,,,14,4.67,7,2,3,"","",""
15,"P. Parvathy, K. Subramaniam, G. P. Prasanna Venkatesan, P. Karthikaikumar, Justin Varghese, T. Jayasankar","Development of hand gesture recognition system using machine learning",2020,"","","","",12,"2022-07-13 09:40:19","","10.1007/s12652-020-02314-2","","",,,,,15,7.50,3,6,2,"","",""
16,"Yun Zhang, Xiaojie Xu","Machine learning glass transition temperature of polyacrylamides using quantum chemical descriptors",2021,"","","","",13,"2022-07-13 09:40:19","","10.1039/D0PY01581D","","",,,,,16,16.00,8,2,1,"Glass transition temperature, Tg, is an important thermophysical property of polyacrylamides, which can be difficult to determine experimentally and resource-intensive to calculate. Data-driven modeling approaches provide alternative methods to predict Tg in a rapid and robust way. We develop the Gaussian process regression model to predict the glass transition temperature of polyacrylamides based on quantum chemical descriptors. The modeling approach shows a high degree of stability and accuracy, which contributes to fast and low-cost glass transition temperature estimations.","",""
14,"M. Ahsan, Rahul Gomes, M. Chowdhury, K. Nygard","Enhancing Machine Learning Prediction in Cybersecurity Using Dynamic Feature Selector",2021,"","","","",14,"2022-07-13 09:40:19","","10.3390/JCP1010011","","",,,,,14,14.00,4,4,1,"Machine learning algorithms are becoming very efficient in intrusion detection systems with their real time response and adaptive learning process. A robust machine learning model can be deployed for anomaly detection by using a comprehensive dataset with multiple attack types. Nowadays datasets contain many attributes. Such high dimensionality of datasets poses a significant challenge to information extraction in terms of time and space complexity. Moreover, having so many attributes may be a hindrance towards creation of a decision boundary due to noise in the dataset. Large scale data with redundant or insignificant features increases the computational time and often decreases goodness of fit which is a critical issue in cybersecurity. In this research, we have proposed and implemented an efficient feature selection algorithm to filter insignificant variables. Our proposed Dynamic Feature Selector (DFS) uses statistical analysis and feature importance tests to reduce model complexity and improve prediction accuracy. To evaluate DFS, we conducted experiments on two datasets used for cybersecurity research namely Network Security Laboratory (NSL-KDD) and University of New South Wales (UNSW-NB15). In the meta-learning stage, four algorithms were compared namely Bidirectional Long Short-Term Memory (Bi-LSTM), Gated Recurrent Units, Random Forest and a proposed Convolutional Neural Network and Long Short-Term Memory (CNN-LSTM) for accuracy estimation. For NSL-KDD, experiments revealed an increment in accuracy from 99.54% to 99.64% while reducing feature size of one-hot encoded features from 123 to 50. In UNSW-NB15 we observed an increase in accuracy from 90.98% to 92.46% while reducing feature size from 196 to 47. The proposed approach is thus able to achieve higher accuracy while significantly lowering number of features required for processing.","",""
19,"D. Gupta, B. B. Hazarika, M. Berlin","Robust regularized extreme learning machine with asymmetric Huber loss function",2020,"","","","",15,"2022-07-13 09:40:19","","10.1007/s00521-020-04741-w","","",,,,,19,9.50,6,3,2,"","",""
94,"Jiangpeng Wu, Pengyi Zhang, Liting Zhang, W. Meng, Junfeng Li, C. Tong, Yonghong Li, Jing Cai, Zengwei Yang, Jinhong Zhu, M. Zhao, Huirong Huang, Xiaodong Xie, Shuyan Li","Rapid and accurate identification of COVID-19 infection through machine learning based on clinical available blood test results",2020,"","","","",16,"2022-07-13 09:40:19","","10.1101/2020.04.02.20051136","","",,,,,94,47.00,9,14,2,"Since the sudden outbreak of coronavirus disease 2019 (COVID-19), it has rapidly evolved into a momentous global health concern. Due to the lack of constructive information on the pathogenesis of COVID-19 and specific treatment, it highlights the importance of early diagnosis and timely treatment. In this study, 11 key blood indices were extracted through random forest algorithm to build the final assistant discrimination tool from 49 clinical available blood test data which were derived by commercial blood test equipments. The method presented robust outcome to accurately identify COVID-19 from a variety of suspected patients with similar CT information or similar symptoms, with accuracy of 0.9795 and 0.9697 for the cross-validation set and test set, respectively. The tool also demonstrated its outstanding performance on an external validation set that was completely independent of the modeling process, with sensitivity, specificity, and overall accuracy of 0.9512, 0.9697, and 0.9595, respectively. Besides, 24 samples from overseas infected patients with COVID-19 were used to make an in-depth clinical assessment with accuracy of 0.9167. After multiple verification, the reliability and repeatability of the tool has been fully evaluated, and it has the potential to develop into an emerging technology to identify COVID-19 and lower the burden of global public health. The proposed tool is well-suited to carry out preliminary assessment of suspected patients and help them to get timely treatment and quarantine suggestion. The assistant tool is now available online at http://lishuyan.lzu.edu.cn/COVID2019_2/.","",""
12,"Xiong Luo, Ying Li, Weiping Wang, X. Ban, Jenq-Haur Wang, Wenbing Zhao","A robust multilayer extreme learning machine using kernel risk-sensitive loss criterion",2020,"","","","",17,"2022-07-13 09:40:19","","10.1007/s13042-019-00967-w","","",,,,,12,6.00,2,6,2,"","",""
41,"M. Ladds, Adam P. Thompson, Julianna P Kadar, D. Slip, D. Hocking, R. Harcourt","Super machine learning: improving accuracy and reducing variance of behaviour classification from accelerometry",2017,"","","","",18,"2022-07-13 09:40:19","","10.1186/s40317-017-0123-1","","",,,,,41,8.20,7,6,5,"","",""
122,"Daniel R. Schrider, A. Kern","S/HIC: Robust Identification of Soft and Hard Sweeps Using Machine Learning",2015,"","","","",19,"2022-07-13 09:40:19","","10.1371/journal.pgen.1005928","","",,,,,122,17.43,61,2,7,"Detecting the targets of adaptive natural selection from whole genome sequencing data is a central problem for population genetics. However, to date most methods have shown sub-optimal performance under realistic demographic scenarios. Moreover, over the past decade there has been a renewed interest in determining the importance of selection from standing variation in adaptation of natural populations, yet very few methods for inferring this model of adaptation at the genome scale have been introduced. Here we introduce a new method, S/HIC, which uses supervised machine learning to precisely infer the location of both hard and soft selective sweeps. We show that S/HIC has unrivaled accuracy for detecting sweeps under demographic histories that are relevant to human populations, and distinguishing sweeps from linked as well as neutrally evolving regions. Moreover we show that S/HIC is uniquely robust among its competitors to model misspecification. Thus even if the true demographic model of a population differs catastrophically from that specified by the user, S/HIC still retains impressive discriminatory power. Finally we apply S/HIC to the case of resequencing data from human chromosome 18 in a European population sample and demonstrate that we can reliably recover selective sweeps that have been identified earlier using less specific and sensitive methods.","",""
41,"Sirui Lu, L. Duan, D. Deng","Quantum Adversarial Machine Learning",2019,"","","","",20,"2022-07-13 09:40:19","","10.1103/PHYSREVRESEARCH.2.033212","","",,,,,41,13.67,14,3,3,"Adversarial machine learning is an emerging field that focuses on studying vulnerabilities of machine learning approaches in adversarial settings and developing techniques accordingly to make learning robust to adversarial manipulations. It plays a vital role in various machine learning applications and has attracted tremendous attention across different communities recently. In this paper, we explore different adversarial scenarios in the context of quantum machine learning. We find that, similar to traditional classifiers based on classical neural networks, quantum learning systems are likewise vulnerable to crafted adversarial examples, independent of whether the input data is classical or quantum. In particular, we find that a quantum classifier that achieves nearly the state-of-the-art accuracy can be conclusively deceived by adversarial examples obtained via adding imperceptible perturbations to the original legitimate samples. This is explicitly demonstrated with quantum adversarial learning in different scenarios, including classifying real-life images (e.g., handwritten digit images in the dataset MNIST), learning phases of matter (such as, ferromagnetic/paramagnetic orders and symmetry protected topological phases), and classifying quantum data. Furthermore, we show that based on the information of the adversarial examples at hand, practical defense strategies can be designed to fight against a number of different attacks. Our results uncover the notable vulnerability of quantum machine learning systems to adversarial perturbations, which not only reveals a novel perspective in bridging machine learning and quantum physics in theory but also provides valuable guidance for practical applications of quantum classifiers based on both near-term and future quantum technologies.","",""
26,"A. Michel, A. Morrison, Victoria L. Preston, Charles T. Marx, Beckett C. Colson, H. K. White","Rapid Identification of Marine Plastic Debris via Spectroscopic Techniques and Machine Learning Classifiers.",2020,"","","","",21,"2022-07-13 09:40:19","","10.1021/acs.est.0c02099","","",,,,,26,13.00,4,6,2,"To advance our understanding of the environmental fate and transport of macro- and micro-plastic debris, robust and reproducible methods, technologies, and analytical approaches are necessary for in situ plastic-type identification and characterization. This investigation compares four spectroscopic techniques: attenuated total reflectance - Fourier transform infrared spectroscopy (ATR-FTIR), near-infrared (NIR) reflectance spectroscopy, laser-induced breakdown spectroscopy (LIBS), and X-ray fluorescence (XRF) spectroscopy, coupled to seven classification methods, including machine learning classifiers, to determine accuracy for identifying type of both consumer plastics and marine plastic debris. With machine learning classifiers, consumer plastic types were identified with 99%, 91%, 97%, and 70% success rates for ATR-FTIR, NIR reflectance spectroscopy, LIBS, and XRF respectively. The classification of marine plastic debris had similar or lower success rates likely arising from alterations to the plastic from environmental weathering processes with success rates of 99%, 81%, 76%, and 66% for ATR-FTIR, NIR reflectance spectroscopy, LIBS, and XRF respectively. Success rates of 76% and higher indicate that ATR-FTIR, NIR reflectance spectroscopy, and LIBS coupled to machine learning classifiers can be used to robustly identify both consumer and environmental plastic samples.","",""
25,"Faranak Abri, Sima Siami‐Namini, Mahdi Adl Khanghah, Fahimeh Mirza Soltani, A. Namin","Can Machine/Deep Learning Classifiers Detect Zero-Day Malware with High Accuracy?",2019,"","","","",22,"2022-07-13 09:40:19","","10.1109/BigData47090.2019.9006514","","",,,,,25,8.33,5,5,3,"The detection of zero-day attacks and vulnerabilities is a challenging problem. It is of utmost importance for network administrators to identify them with high accuracy. The higher the accuracy is, the more robust the defense mechanism will be. In an ideal scenario (i.e., 100% accuracy) the system can detect zero-day malware without being concerned about mistakenly tagging benign files as malware or enabling disruptive malicious code running as none-malicious ones. This paper investigates different machine learning algorithms to find out how well they can detect zero-day malware. Through the examination of 34 machine/deep learning classifiers, we found that the random forest classifier offered the best accuracy. The paper poses several research questions regarding the performance of machine and deep learning algorithms when detecting zero-day malware with zero rates for false positive and false negative.","",""
