Cites,Authors,Title,Year,Source,Publisher,ArticleURL,CitesURL,GSRank,QueryDate,Type,DOI,ISSN,CitationURL,Volume,Issue,StartPage,EndPage,ECC,CitesPerYear,CitesPerAuthor,AuthorCount,Age,Abstract,FullTextURL,RelatedURL
1,"E. Bollt","Regularized Kernel Machine Learning for Data Driven Forecasting of Chaos",2020,"","","","",147,"2022-07-13 10:06:04","","","","",,,,,1,0.50,1,1,2,"Forecasting outcomes from initial states continues to be an essential task in dynamical systems theory as applied across the sciences and engineering. The data-driven philosophy has become prevalent across the community. While geometric methods founded in time series to rebuild the underlying geometry based on Taken’s embedding theorem have been popular and successful in previous decades, they are complex, computationally expensive, and parametrically intensive. The wave of machine learning methods have come to reveal that a black box oriented approach has a great deal to offer the fundamental problem of forecasting the future. Modelling the flow operator as a linear combination of nonlinear basis functions in terms of regression least squares fitting in a data-driven manner is straight forward to pose. However, there are two major obstacles to overcome. First, model complexity may lead to either underfitting or overfitting, but these can be mitigated by Tikohonov regularization. Another serious issue regards computational complexity, which can be overcome by the kernel trick, so that all necessary inner products in a high dimensional feature (basis function) space are computed implicitly as low-dimensional kernel operations. In particular kernel methods from the broader theory of support vector machines is founded in the functional analytic theory of Mercer’s theorem and also reproducing kernel Hilbert spaces (RKHS), but practically this fundamental concept in machine learning has become central to many efficient algorithms. Putting these concepts together, the efficiency of kernel methods, and the robustness of regularized regression are both possible within an approach called kernelized ridge regression. We show here that these allow for an especially useful way to carry forward time-series forecasting problems, as a simple to use and computationally efficient methodology. We demonstrate the utility of these concepts in terms of a progression of examples from low dimensional where direct analysis is possible, to high-dimensional and spatiotemporally chaotic, and then an experimental data set from physiology of heart rate and breathing interactions.","",""
17,"Yoonha Choi, T. Liu, D. Pankratz, T. Colby, N. Barth, D. Lynch, P. Walsh, G. Raghu, G. Kennedy, Jing Huang","Identification of usual interstitial pneumonia pattern using RNA-Seq and machine learning: challenges and solutions",2018,"","","","",148,"2022-07-13 10:06:04","","10.1186/s12864-018-4467-6","","",,,,,17,4.25,2,10,4,"","",""
21,"Daniyal Amir Awan, R. L. Cavalcante, M. Yukawa, S. Stańczak","Detection for 5G-NOMA: An Online Adaptive Machine Learning Approach",2017,"","","","",149,"2022-07-13 10:06:04","","10.1109/ICC.2018.8422449","","",,,,,21,4.20,5,4,5,"Non-orthogonal multiple access (NOMA) has emerged as a promising radio access technique for enabling the performance enhancements promised by the fifth-generation (5G) networks in terms of connectivity, latency, and spectrum efficiency. In the NOMA uplink, detection based on successive interference cancellation (SIC) with device clustering has been suggested. If the receivers are equipped with multiple antennas, SIC can be combined with minimum mean-squared error (MMSE) beamforming. However, there exists a tradeoff between the NOMA cluster size and the incurred SIC error. Larger clusters lead to larger errors but they are desirable from the spectrum efficiency and connectivity point of view. To enable the deployment of large clusters, we propose a novel online learning detection method for the NOMA uplink. We design an online adaptive filter in the sum space of linear and Gaussian reproducing kernel Hilbert spaces (RKHSs). Such a sum space design is robust against variations of a dynamic wireless network that can deteriorate the performance of a purely nonlinear adaptive filter. We demonstrate by simulations that the proposed method outperforms (symbol level) MMSE-SIC based detection for large cluster sizes.","",""
0,"Z. N. Ghaziani, Jesse Sun, R. Chan, H. Rakowski, M. Maron, E. Rowin, Bo Wang, W. Tsang","Abstract 16082: Machine Learning to Improve Left Ventricular Scar Quantification in Hypertrophic Cardiomyopathy Patients",2020,"","","","",150,"2022-07-13 10:06:04","","10.1161/CIRC.142.SUPPL_3.16082","","",,,,,0,0.00,0,8,2,"  Introduction:  Accurate and reproducible scar quantification of late gadolinium enhancement (LGE) images from cardiac magnetic resonance imaging (CMR) is important in risk stratifying hypertrophic cardiomyopathy (HCM) patients. Previous machine learning algorithms for CMR LGE quantification deployed three-dimensional convolutional neural network (CNN) architecture, which required image cropping and custom graphic processing units (GPUs) to function, thus limiting their general applicability. We aim to develop a deep two-dimensional (2D) CNN model that contours the left ventricle (LV) endo- and epicardial borders and quantifies LGE.      Hypothesis:  We hypothesize that a deep 2D CNN model, which uses commercially available GPUs, could be used to efficiently and accurately contour LV endo- and epicardial borders and quantify CMR LGE in HCM patients.      Methods:  We retrospectively studied 296 HCM patients (2423 images) from the University Health Network (Toronto, Canada) and Tufts Medical Center (Boston, USA). LGE images were manually segmented by an expert reader. Scar was defined as 5 standard deviations higher than the mean of the annotated normal region pixels. A 2D U-net CNN variant was used to train a model on 80% of the datasets. Testing was performed on the remaining 20%. We applied a 5-folds cross validation algorithm for training to improve model robustness. Model performance was assessed using the Dice Similarity Coefficient (DSC).      Results:  We were able to develop a deep learning model that could successfully perform both LV segmentation and scar quantification using a generally available GPU card. Our algorithm did not require image cropping and processed one image every 60 milliseconds. DSC scores averaged across the 5-folds was excellent at 0.89+0.22 for the endocardium and 0.81+0.17 for the epicardium, and good at 0.57+0.31 for scar.      Conclusions:  Using novel 2D CNN methods, we have successfully developed an automatic algorithm that rapidly provides LV endo- and epicardial contours and scar quantification on LGE CMR images that is superior to previously published studies. Unlike previous algorithms, our program does not require the use of custom CPUs or image cropping, potentially allowing it to be integrated into routine clinical practice. ","",""
0,"Jin Wook Kim, D. Moon","Optimizing Aging Male Symptom Questionnaire Through Genetic Algorithms Based Machine Learning Techniques",2020,"","","","",151,"2022-07-13 10:06:04","","10.5534/wjmh.190077","","",,,,,0,0.00,0,2,2,"Purpose Genetic algorithm (GA) is a machine learning optimization strategy where sample strategies compete for fitness to evolve an optimum solution. This study evolves the Aging Male Symptoms (AMS) with GA to better identify late onset hypogonadism (LOH) with serum testosterone. Materials and Methods GA was trained on a training set of standard AMS questionnaire on a nationwide LOH epidemiology study. Random matrices of selectors for particular items were generated. Each generation of was evolved through a fitness function determined by sensitivity. Threshold to determine positive serum testosterone level for LOH was randomized for each competing strategy. After 2,000 runs, with each run producing the best result out of a set of 3,000 randomly generated sets evolved through 300 generations, the best AMS selection matrix was then applied to a separately enrolled validation set to compare outcomes. Results Predictability for serum testosterone levels dropped markedly above 3.5 ng/mL during pilot training. Limiting the training to testosterone thresholds between 2.5 and 3.5 ng/mL the GA 93 different strategies. Only a selection of 5 items, determining for a threshold of 20 points and determining for a serum testosterone level of 3.16 ng/mL, showed robust reproducibility within the internal validation set. Applying these conditions to the independent validation set showed sensitivity improved from 0.66 to 0.77, with a specificity of 0.07 to 0.19, respectively. Conclusions GA method of selecting questionnaires improved AMS questionnaire significantly. This method can be easily applied to other questionnaires that do not correlate with physiological markers.","",""
0,"Bradley Drumheller, M. Amgad, A. Aljudi, Elliott B. Burdette, Leila Kutob, Cameron Neely, Adam J. Perricone, C. Shebelut, D. Jaye","Early Development of a Machine Learning Approach to Quantify MYC Immunohistochemical Staining in Lymphoma",2020,"","","","",152,"2022-07-13 10:06:04","","10.1093/ajcp/aqaa137.034","","",,,,,0,0.00,0,9,2,"  Newer data suggest that double expression of MYC and BCL2 proteins (DE) evaluated by quantitative immunohistochemistry (qIHC) may be a powerful marker of worse prognosis in diffuse large B cell lymphoma (DLBCL). Testing for DE status, defined as >40% MYC+ and >50% BCL2+ tumor cells, is recommended in the WHO 2016 classification and clinical trials are using DE scoring to assign therapy arms. However, other data suggest that significant variability in manual DE scoring diminishes the predictive value. Error sources include high interobserver variability (IOV) associated with field choice, discrimination of tumor immunoreactivity from adjacent non-neoplastic cells, cell-to-cell variability in staining intensity, crush artifacts and necrosis. Thus, there is a need for standardized, reproducible approaches for DE scoring by qIHC. To address this need, we have begun developing a novel machine-learning approach to analyze IHC digital pathology whole-slide images, focusing initially on MYC IHC.  Digital whole-slide images (400x) of 22 DLBCL cases were uploaded to a web-based annotation platform. Using all cases, one annotator created 138 regions of interest (ROIs) containing approximately 200 nucleated cells and representing a variety of tissue types. Eight pathologists were assigned the same 10 ROIs in which to annotate all nuclei from which ground-truth seed nucleus labels (location, classification) were created for a validation set. Nuclei were classified as “tumor-positive”, “tumor-negative”, “non-tumor-positive”, “non-tumor-negative”, or “unknown”. This generated a set of 15,792 annotations with 1974 +/- 272 (Avg+/-STD) labels/annotator. Agglomerative hierarchical clustering afforded the creation of 2299 ground-truth seed locations. A maximum diameter of 3 mm/cluster was set by visual inspection of annotations. Of these seed locations, 1041 (45%) were detected by 8/8 annotators and, on average, 6/8 agreed on class. 302 +/- 72 (Avg+/-STD) “tumor positive” labels per annotator generated 382 seeds locations, 178 (47%) of which were detected by 8/8 annotators, with an average of 7.5/8 agreeing on class. 286 +/- 168 (Avg+/-STD) “tumor-negative” labels per annotator generated 336 seeds, 195 (58%) of which were detected by 8/8 annotators, with an average of 5/8 agreeing on class. Among all classes, the “tumor-positive” label displayed best overall label agreement whereas the “tumor-negative“ label yielded similar localization rate, but lower class agreement. These promising early findings provide a novel basis for quantifying IOV and utilizing multi-observer agreement to create a ground-truth validation set for a supervised machine learning approach to qIHC. Future efforts will make use of these data to optimize the validation set by rationally determining the number of additional annotations required, optimizing the number of annotators per ROI required, devising an adaptive approach to nuclear clustering based on nuclear density, and utilizing the additional 31,422 annotations in hand from all annotators as a robust algorithm training set.","",""
12,"N. Khoa, M. M. Alamdari, T. Rakotoarivelo, Ali Anaissi, Yang Wang","Structural Health Monitoring Using Machine Learning Techniques and Domain Knowledge Based Features",2018,"","","","",153,"2022-07-13 10:06:04","","10.1007/978-3-319-90403-0_20","","",,,,,12,3.00,2,5,4,"","",""
4,"Jungang Lou, Yunliang Jiang, Qing Shen, Ruiqin Wang, Zechao Li","Probabilistic Regularized Extreme Learning for Robust Modeling of Traffic Flow Forecasting.",2020,"","","","",154,"2022-07-13 10:06:04","","10.1109/TNNLS.2020.3027822","","",,,,,4,2.00,1,5,2,"The adaptive neurofuzzy inference system (ANFIS) is a structured multioutput learning machine that has been successfully adopted in learning problems without noise or outliers. However, it does not work well for learning problems with noise or outliers. High-accuracy real-time forecasting of traffic flow is extremely difficult due to the effect of noise or outliers from complex traffic conditions. In this study, a novel probabilistic learning system, probabilistic regularized extreme learning machine combined with ANFIS (probabilistic R-ELANFIS), is proposed to capture the correlations among traffic flow data and, thereby, improve the accuracy of traffic flow forecasting. The new learning system adopts a fantastic objective function that minimizes both the mean and the variance of the model bias. The results from an experiment based on real-world traffic flow data showed that, compared with some kernel-based approaches, neural network approaches, and conventional ANFIS learning systems, the proposed probabilistic R-ELANFIS achieves competitive performance in terms of forecasting ability and generalizability.","",""
80,"Xiaoqin Zhang, Mingyu Fan, Di Wang, Peng Zhou, D. Tao","Top-k Feature Selection Framework Using Robust 0–1 Integer Programming",2020,"","","","",155,"2022-07-13 10:06:04","","10.1109/TNNLS.2020.3009209","","",,,,,80,40.00,16,5,2,"Feature selection (FS), which identifies the relevant features in a data set to facilitate subsequent data analysis, is a fundamental problem in machine learning and has been widely studied in recent years. Most FS methods rank the features in order of their scores based on a specific criterion and then select the <inline-formula> <tex-math notation=""LaTeX"">$k$ </tex-math></inline-formula> top-ranked features, where <inline-formula> <tex-math notation=""LaTeX"">$k$ </tex-math></inline-formula> is the number of desired features. However, these features are usually not the top-<inline-formula> <tex-math notation=""LaTeX"">$k$ </tex-math></inline-formula> features and may present a suboptimal choice. To address this issue, we propose a novel FS framework in this article to select the exact top-<inline-formula> <tex-math notation=""LaTeX"">$k$ </tex-math></inline-formula> features in the unsupervised, semisupervised, and supervised scenarios. The new framework utilizes the <inline-formula> <tex-math notation=""LaTeX"">$\ell _{0,2}$ </tex-math></inline-formula>-norm as the matrix sparsity constraint rather than its relaxations, such as the <inline-formula> <tex-math notation=""LaTeX"">$\ell _{1,2}$ </tex-math></inline-formula>-norm. Since the <inline-formula> <tex-math notation=""LaTeX"">$\ell _{0,2}$ </tex-math></inline-formula>-norm constrained problem is difficult to solve, we transform the discrete <inline-formula> <tex-math notation=""LaTeX"">$\ell _{0,2}$ </tex-math></inline-formula>-norm-based constraint into an equivalent 0–1 integer constraint and replace the 0–1 integer constraint with two continuous constraints. The obtained top-<inline-formula> <tex-math notation=""LaTeX"">$k$ </tex-math></inline-formula> FS framework with two continuous constraints is theoretically equivalent to the <inline-formula> <tex-math notation=""LaTeX"">$\ell _{0,2}$ </tex-math></inline-formula>-norm constrained problem and can be optimized by the alternating direction method of multipliers (ADMM). Unsupervised and semisupervised FS methods are developed based on the proposed framework, and extensive experiments on real-world data sets are conducted to demonstrate the effectiveness of the proposed FS framework.","",""
5,"Sindhu Ghanta, Sriram Ganapathi Subramanian, S. Sundararaman, L. Khermosh, Vinay Sridhar, D. Arteaga, Q. Luo, Dhananjoy Das, Nisha Talagala","Interpretability and Reproducability in Production Machine Learning Applications",2018,"","","","",156,"2022-07-13 10:06:04","","10.1109/ICMLA.2018.00105","","",,,,,5,1.25,1,9,4,"Explainability/Interpretability in machine learning applications is becoming critical, with legal and industry requirements demanding human understandable machine learning results. We describe the additional complexities that occur when a known interpretability technique (canary models) is applied to a real production scenario. We furthermore argue that reproducibility is a key feature in practical usages of such interpretability techniques in production scenarios. With this motivation, we present a production ML reproducibility solution, namely a comprehensive time ordered event sequence for machine learning applications. We demonstrate how our approach can bring this known common interpretability technique into production viability. We further present the system design and early performance characteristics of our reproducibility solution.","",""
8,"Xiaoxuan Lu, Yushen Long, Han Zou, Chengpu Yu, Lihua Xie","Robust extreme learning machine for regression problems with its application to wifi based indoor positioning system",2014,"","","","",157,"2022-07-13 10:06:04","","10.1109/MLSP.2014.6958903","","",,,,,8,1.00,2,5,8,"We propose two kinds of robust extreme learning machines (RELMs) based on the close-to-mean constraint and the small-residual constraint respectively to solve the problem of noisy measurements in indoor positioning systems (IPSs). We formulate both RELMs as second order cone programming problems. The fact that feature mapping in ELM is known to users is exploited to give the needed information for robust constraints. Real-world indoor localization experimental results show that, the proposed algorithms can not only improve the accuracy and repeatability, but also reduce the deviations and worst case errors of IPSs compared with basic ELM and OPT-ELM based IPSs.","",""
12,"Zhongyang Zhang, Haoxiang Cheng, X. Hong, A. D. Narzo, O. Franzén, Shouneng Peng, A. Ruusalepp, J. Kovacic, J. Bjorkegren, Xiaobin Wang, K. Hao","EnsembleCNV: an ensemble machine learning algorithm to identify and genotype copy number variation using SNP array data",2018,"","","","",158,"2022-07-13 10:06:04","","10.1101/356667","","",,,,,12,3.00,1,11,4,"The associations between diseases/traits and copy number variants (CNVs) have not been systematically investigated in genome-wide association studies (GWASs), primarily due to a lack of robust and accurate tools for CNV genotyping. Herein, we propose a novel ensemble learning framework, ensembleCNV, to detect and genotype CNVs using single nucleotide polymorphism (SNP) array data. EnsembleCNV a) identifies and eliminates batch effects at raw data level; b) assembles individual CNV calls into CNV regions (CNVRs) from multiple existing callers with complementary strengths by a heuristic algorithm; c) re-genotypes each CNVR with local likelihood model adjusted by global information across multiple CNVRs; d) refines CNVR boundaries by local correlation structure in copy number intensities; e) provides direct CNV genotyping accompanied with confidence score, directly accessible for downstream quality control and association analysis. Benchmarked on two large datasets, ensembleCNV outperformed competing methods and achieved a high call rate (93.3%) and reproducibility (98.6%), while concurrently achieving high sensitivity by capturing 85% of common CNVs documented in the 1000 Genomes Project. Given this CNV call rate and accuracy, which are comparable to SNP genotyping, we suggest ensembleCNV holds significant promise for performing genome-wide CNV association studies and investigating how CNVs predispose to human diseases.","",""
1,"S. Valverde, Llucia Coll, Liliana Valencia, Albert Clérigues, A. Oliver, J. Vilanova, L. Ramió-Torrentá, À. Rovira, X. Lladó","Assessing the Accuracy and Reproducibility of PARIETAL: A Deep Learning Brain Extraction Algorithm.",2021,"","","","",159,"2022-07-13 10:06:04","","10.1002/jmri.27776","","",,,,,1,1.00,0,9,1,"BACKGROUND Manual brain extraction from magnetic resonance (MR) images is time-consuming and prone to intra- and inter-rater variability. Several automated approaches have been developed to alleviate these constraints, including deep learning pipelines. However, these methods tend to reduce their performance in unseen magnetic resonance imaging (MRI) scanner vendors and different imaging protocols.   PURPOSE To present and evaluate for clinical use PARIETAL, a pre-trained deep learning brain extraction method. We compare its reproducibility in a scan/rescan analysis and its robustness among scanners of different manufacturers.   STUDY TYPE Retrospective.   POPULATION Twenty-one subjects (12 women) with age range 22-48 years acquired using three different MRI scanner machines including scan/rescan in each of them.   FIELD STRENGTH/SEQUENCE T1-weighted images acquired in a 3-T Siemens with magnetization prepared rapid gradient-echo sequence and two 1.5 T scanners, Philips and GE, with spin-echo and spoiled gradient-recalled (SPGR) sequences, respectively.   ASSESSMENT Analysis of the intracranial cavity volumes obtained for each subject on the three different scanners and the scan/rescan acquisitions.   STATISTICAL TESTS Parametric permutation tests of the differences in volumes to rank and statistically evaluate the performance of PARIETAL compared to state-of-the-art methods.   RESULTS The mean absolute intracranial volume differences obtained by PARIETAL in the scan/rescan analysis were 1.88 mL, 3.91 mL, and 4.71 mL for Siemens, GE, and Philips scanners, respectively. PARIETAL was the best-ranked method on Siemens and GE scanners, while decreasing to Rank 2 on the Philips images. Intracranial differences for the same subject between scanners were 5.46 mL, 27.16 mL, and 30.44 mL for GE/Philips, Siemens/Philips, and Siemens/GE comparison, respectively. The permutation tests revealed that PARIETAL was always in Rank 1, obtaining the most similar volumetric results between scanners.   DATA CONCLUSION PARIETAL accurately segments the brain and it generalizes to images acquired at different sites without the need of training or fine-tuning it again. PARIETAL is publicly available.   LEVEL OF EVIDENCE 2 TECHNICAL EFFICACY STAGE: 2.","",""
217,"Ian J. Goodfellow, Nicolas Papernot, P. Mcdaniel","Cleverhans V0.1: an Adversarial Machine Learning Library",2016,"","","","",160,"2022-07-13 10:06:04","","","","",,,,,217,36.17,72,3,6,"cleverhans is a software library that provides standardized reference implementations of adversarial example construction techniques and adversarial training. The library may be used to develop more robust machine learning models and to provide standardized benchmarks of models’ performance in the adversarial setting. Benchmarks constructed without a standardized implementation of adversarial example construction are not comparable to each other, because a good result may indicate a robust model or it may merely indicate a weak implementation of the adversarial example construction procedure. This technical report is structured as follows. Section 1 provides an overview of adversarial examples in machine learning and of the cleverhans software. Section 2 presents the core functionalities of the library: namely the attacks based on adversarial examples and defenses to improve the robustness of machine learning models to these attacks. Section 3 describes how to report benchmark results using the library. Section 4 describes the versioning system.","",""
