Cites,Authors,Title,Year,Source,Publisher,ArticleURL,CitesURL,GSRank,QueryDate,Type,DOI,ISSN,CitationURL,Volume,Issue,StartPage,EndPage,ECC,CitesPerYear,CitesPerAuthor,AuthorCount,Age,Abstract,FullTextURL,RelatedURL
74,"G. Chand, D. Dwyer, G. Erus, A. Sotiras, E. Varol, D. Srinivasan, J. Doshi, Raymond Pomponio, A. Pigoni, P. Dazzan, R. Kahn, H. Schnack, M. Zanetti, E. Meisenzahl, G. Busatto, B. Crespo-Facorro, C. Pantelis, S. Wood, C. Zhuo, R. Shinohara, H. Shou, Yong Fan, R. Gur, R. Gur, T. Satterthwaite, N. Koutsouleris, D. Wolf, C. Davatzikos","Two distinct neuroanatomical subtypes of schizophrenia revealed using machine learning.",2020,"","","","",117,"2022-07-13 10:06:04","","10.1093/brain/awaa025","","",,,,,74,37.00,7,28,2,"Neurobiological heterogeneity in schizophrenia is poorly understood and confounds current analyses. We investigated neuroanatomical subtypes in a multi-institutional multi-ethnic cohort, using novel semi-supervised machine learning methods designed to discover patterns associated with disease rather than normal anatomical variation. Structural MRI and clinical measures in established schizophrenia (n = 307) and healthy controls (n = 364) were analysed across three sites of PHENOM (Psychosis Heterogeneity Evaluated via Dimensional Neuroimaging) consortium. Regional volumetric measures of grey matter, white matter, and CSF were used to identify distinct and reproducible neuroanatomical subtypes of schizophrenia. Two distinct neuroanatomical subtypes were found. Subtype 1 showed widespread lower grey matter volumes, most prominent in thalamus, nucleus accumbens, medial temporal, medial prefrontal/frontal and insular cortices. Subtype 2 showed increased volume in the basal ganglia and internal capsule, and otherwise normal brain volumes. Grey matter volume correlated negatively with illness duration in Subtype 1 (r = -0.201, P = 0.016) but not in Subtype 2 (r = -0.045, P = 0.652), potentially indicating different underlying neuropathological processes. The subtypes did not differ in age (t = -1.603, d.f. = 305, P = 0.109), sex (chi-square = 0.013, d.f. = 1, P = 0.910), illness duration (t = -0.167, d.f. = 277, P = 0.868), antipsychotic dose (t = -0.439, d.f. = 210, P = 0.521), age of illness onset (t = -1.355, d.f. = 277, P = 0.177), positive symptoms (t = 0.249, d.f. = 289, P = 0.803), negative symptoms (t = 0.151, d.f. = 289, P = 0.879), or antipsychotic type (chi-square = 6.670, df = 3, P = 0.083). Subtype 1 had lower educational attainment than Subtype 2 (chi-square = 6.389, d.f. = 2, P = 0.041). In conclusion, we discovered two distinct and highly reproducible neuroanatomical subtypes. Subtype 1 displayed widespread volume reduction correlating with illness duration, and worse premorbid functioning. Subtype 2 had normal and stable anatomy, except for larger basal ganglia and internal capsule, not explained by antipsychotic dose. These subtypes challenge the notion that brain volume loss is a general feature of schizophrenia and suggest differential aetiologies. They can facilitate strategies for clinical trial enrichment and stratification, and precision diagnostics.","",""
74,"Kai Fukami, K. Fukagata, K. Taira","Machine-learning-based spatio-temporal super resolution reconstruction of turbulent flows",2020,"","","","",118,"2022-07-13 10:06:04","","10.1017/jfm.2020.948","","",,,,,74,37.00,25,3,2,"Abstract We present a new data reconstruction method with supervised machine learning techniques inspired by super resolution and inbetweening to recover high-resolution turbulent flows from grossly coarse flow data in space and time. For the present machine-learning-based data reconstruction, we use the downsampled skip-connection/multiscale model based on a convolutional neural network, incorporating the multiscale nature of fluid flows into its network structure. As an initial example, the model is applied to the two-dimensional cylinder wake at $Re_D = 100$. The reconstructed flow fields by the present method show great agreement with the reference data obtained by direct numerical simulation. Next, we apply the current model to a two-dimensional decaying homogeneous isotropic turbulence. The machine-learned model is able to track the decaying evolution from spatial and temporal coarse input data. The proposed concept is further applied to a complex turbulent channel flow over a three-dimensional domain at $Re_{\tau }=180$. The present model reconstructs high-resolved turbulent flows from very coarse input data in space, and also reproduces the temporal evolution for appropriately chosen time interval. The dependence on the number of training snapshots and duration between the first and last frames based on a temporal two-point correlation coefficient are also assessed to reveal the capability and robustness of spatio-temporal super resolution reconstruction. These results suggest that the present method can perform a range of flow reconstructions in support of computational and experimental efforts.","",""
0,"Muhammad Abdullah Hanif, R. Hafiz, M. Javed, Semeen Rehman, M. Shafique","Energy-Efficient Design of Advanced Machine Learning Hardware",2019,"","","","",119,"2022-07-13 10:06:04","","10.1007/978-3-030-04666-8_21","","",,,,,0,0.00,0,5,3,"","",""
4,"Mahender Singh, K. Singh","A Review of Publicly Available Automatic Brain Segmentation Methodologies, Machine Learning Models, Recent Advancements, and Their Comparison",2021,"","","","",120,"2022-07-13 10:06:04","","10.1177/0972753121990175","","",,,,,4,4.00,2,2,1,"Background: The noninvasive study of the structure and functions of the brain using neuroimaging techniques is increasingly being used for its clinical and research perspective. The morphological and volumetric changes in several regions and structures of brains are associated with the prognosis of neurological disorders such as Alzheimer’s disease, epilepsy, schizophrenia, etc. and the early identification of such changes can have huge clinical significance. The accurate segmentation of three-dimensional brain magnetic resonance images into tissue types (i.e., grey matter, white matter, cerebrospinal fluid) and brain structures, thus, has huge importance as they can act as early biomarkers. The manual segmentation though considered the “gold standard” is time-consuming, subjective, and not suitable for bigger neuroimaging studies. Several automatic segmentation tools and algorithms have been developed over the years; the machine learning models particularly those using deep convolutional neural network (CNN) architecture are increasingly being applied to improve the accuracy of automatic methods. Purpose: The purpose of the study is to understand the current and emerging state of automatic segmentation tools, their comparison, machine learning models, their reliability, and shortcomings with an intent to focus on the development of improved methods and algorithms. Methods: The study focuses on the review of publicly available neuroimaging tools, their comparison, and emerging machine learning models particularly those based on CNN architecture developed and published during the last five years. Conclusion: Several software tools developed by various research groups and made publicly available for automatic segmentation of the brain show variability in their results in several comparison studies and have not attained the level of reliability required for clinical studies. The machine learning models particularly three dimensional fully convolutional network models can provide a robust and efficient alternative with relation to publicly available tools but perform poorly on unseen datasets. The challenges related to training, computation cost, reproducibility, and validation across distinct scanning modalities for machine learning models need to be addressed.","",""
4,"I. Scott","Demystifying machine learning: a primer for physicians",2021,"","","","",121,"2022-07-13 10:06:04","","10.1111/imj.15200","","",,,,,4,4.00,4,1,1,"Machine learning is a tool for analysing digitised data sets and formulating predictions that can optimise clinical decision‐making. It aims to identify complex patterns in large data sets and encode them into models that can then classify new unseen cases or make predictions on new data. Machine learning methods take several forms and individual models can be of many different types. More than 50 models have been approved for use in routine healthcare, and the numbers continue to grow exponentially. The reliability and robustness of any model depends on multiple factors, including the quality and quantity of the data used to develop the models, and the selection of features in the data considered most important to maximising accuracy. In ensuring models are safe, effective and reproducible in routine care, physicians need to have some understanding of how these models are developed and evaluated, and to collaborate with data and computer scientists in their design and validation. This narrative review introduces principles, methods and examples of machine learning in a way that does not require mastery of highly complex statistical and computational concepts.","",""
29,"Yuhui Zheng, Le Sun, Shunfeng Wang, Jianwei Zhang, J. Ning","Spatially Regularized Structural Support Vector Machine for Robust Visual Tracking",2019,"","","","",122,"2022-07-13 10:06:04","","10.1109/TNNLS.2018.2855686","","",,,,,29,9.67,6,5,3,"Structural support vector machine (SSVM) is popular in the visual tracking field as it provides a consistent target representation for both learning and detection. However, the spatial distribution of feature is not considered in standard SSVM-based trackers, therefore leading to limited performance. To obtain a robust discriminative classifier, this paper proposes a novel tracking framework that spatially regularizes SSVM, which yields a new spatially regularized SSVM (SRSSVM). We utilize the spatial regularization prior to penalize the learning classifier with the same size as the target region. The location of classifier spatially located far from the center of region is assigned large weight and vice versa. Then, it is introduced into the SSVM model as a regularization factor to learn the robust discriminative model. Furthermore, an optimizing algorithm with dual coordination descent is presented to efficiently solve the SRSSVM tracking model. Our proposed SRSSVM tracking method has low computational cost like the traditional linear SSVM tracker while can significantly improve the robustness of the discriminative classifier. The experimental results on three popular tracking benchmark data sets show that the proposed SRSSVM tracking method performs favorably against the state-of-the-art trackers.","",""
20,"Hiroshi Kuwajima, Hirotoshi Yasuoka, Toshihiro Nakae","Engineering problems in machine learning systems",2019,"","","","",123,"2022-07-13 10:06:04","","10.1007/s10994-020-05872-w","","",,,,,20,6.67,7,3,3,"","",""
0,"Hsiao-Chi Li, Chang-Yu Cheng, Chia Chou, Chien-Chang Hsu, Meng-Lin Chang, Y. Chiu, J. Chai","Multi-Class Brain Age Discrimination Using Machine Learning Algorithm",2019,"","","","",124,"2022-07-13 10:06:04","","10.1109/ICMLC48188.2019.8949317","","",,,,,0,0.00,0,7,3,"Resting-state functional connectivity analyses have revealed a significant effect on the inter-regional interactions in brain. The brain age prediction based on resting-state functional magnetic resonance imaging has been proved as biomarkers to characterize the typical brain development and neuropsychiatric disorders. The brain age prediction model based on functional connectivity measurements derived from resting-state functional magnetic resonance imaging has received a lots of interest in recent years due to its great success in age prediction. However, some of the recent studies rely on experienced neuroscientist experts to select appropriate connectivity features in order to build a robust model for prediction while the others just selected the features based on trial-and-error test. Besides, the subjects used in this studies omitted some subjects that can be divided into two groups with less similarity which may confused the prediction model. In this study, we proposed a multi-class age categories discrimination method with the connectivity features selected via K-means clustering with no prior knowledge provided. The experimental results show that with K-means selected features the proposed model better discriminate multi-class age categories.","",""
0,"Yuya Jeremy Ong, Tomoki Takasawa","Efficiency Characterization of the Kepler Exoplanet Discovery Pipeline Using Machine Learning",2019,"","","","",125,"2022-07-13 10:06:04","","","","",,,,,0,0.00,0,2,3,"The Kepler mission, launched by NASA has been used to discover the possibilities for the existence of exoplanets beyond our solar system, providing massive amounts of data that we can use to speculate such candidates. However, to collect the massive amounts of data to identify new and potentially interesting planet candidates, researchers have developed several different methods, heuristics, and data pipelines to facilitate the discovery of new exoplanets. In this work, we characterize the efficiency of the Kepler missionâĂŹs Transiting Planet Search (TPS) system known as Robovetter, using the Robovetter’s simulated light-curve pipeline data and provide insights towards building robust automated pipelines for detecting potentially new and interesting stellar objects and identify potential potential false positives within the samples. Furthermore, to facilitate the research and discovery process of this work, we also develop and propose a data-driven research pipeline specifically for our modeling purposes to provide an efficient workflow for researchers to easily design reproducible machine learning-based experimental workflows that both enables automation and flexibility in modeling approaches.","",""
141,"F. Thabtah","Machine learning in autistic spectrum disorder behavioral research: A review and ways forward",2019,"","","","",126,"2022-07-13 10:06:04","","10.1080/17538157.2017.1399132","","",,,,,141,47.00,141,1,3,"ABSTRACT Autistic Spectrum Disorder (ASD) is a mental disorder that retards acquisition of linguistic, communication, cognitive, and social skills and abilities. Despite being diagnosed with ASD, some individuals exhibit outstanding scholastic, non-academic, and artistic capabilities, in such cases posing a challenging task for scientists to provide answers. In the last few years, ASD has been investigated by social and computational intelligence scientists utilizing advanced technologies such as machine learning to improve diagnostic timing, precision, and quality. Machine learning is a multidisciplinary research topic that employs intelligent techniques to discover useful concealed patterns, which are utilized in prediction to improve decision making. Machine learning techniques such as support vector machines, decision trees, logistic regressions, and others, have been applied to datasets related to autism in order to construct predictive models. These models claim to enhance the ability of clinicians to provide robust diagnoses and prognoses of ASD. However, studies concerning the use of machine learning in ASD diagnosis and treatment suffer from conceptual, implementation, and data issues such as the way diagnostic codes are used, the type of feature selection employed, the evaluation measures chosen, and class imbalances in data among others. A more serious claim in recent studies is the development of a new method for ASD diagnoses based on machine learning. This article critically analyses these recent investigative studies on autism, not only articulating the aforementioned issues in these studies but also recommending paths forward that enhance machine learning use in ASD with respect to conceptualization, implementation, and data. Future studies concerning machine learning in autism research are greatly benefitted by such proposals.","",""
0,"J. Figuerêdo, V. T. Sarinho, R. Calumby","Low-Cost Machine Learning for Effective and Efficient Bad Smells Detection",2021,"","","","",127,"2022-07-13 10:06:04","","10.5753/kdmile.2021.17468","","",,,,,0,0.00,0,3,1,"Bad smells are characteristics of software that indicate a code or design problem which can make information system hard to understand, evolve, and maintain. To address this problem, different approaches, manual and automated, have been proposed over the years, including more recently machine learning alternatives. However, despite the advances achieved, some machine learning techniques have not yet been effectively explored, such as the use of feature selection techniques. Moreover, it is not clear to what extent the use of numerous source-code features are necessary for reasonable bad smell detection success. Therefore, in this work we propose an approach using low-cost machine learning for effective and efficient detection of bad smells, through explicit feature selection. Our results showed that the selection allowed to statistically improve the effectiveness of the models. For some cases, the models achieved statistical equivalence, but relying on a highly reduced set of features. Indeed, by using explicit feature selection, simpler models such as Naive Bayes became statistically equivalent to robust models such as Random Forest. Therefore, the selection of features allowed keeping competitive or even superior effectiveness while also improving the efficiency of the models, demanding less computational resources for source-code preprocessing, model training and bad smell detection.","",""
0,"Maria Sailer, F. Schiller, Thorsten Falk, A. Jud, Sven Arke Lang, J. Ruf, M. Mix","Prediction of the histopathological tumor type of newly diagnosed liver lesions from standard abdominal computer tomography with a machine-learning classifier based on convolutional neural networks",2021,"","","","",128,"2022-07-13 10:06:04","","10.1515/cdbme-2021-1032","","",,,,,0,0.00,0,7,1,"Abstract Background and objectives: Liver lesions are a relatively common incidental finding in computer tomography (CT) of the abdomen. The current gold standard is liver biopsy, which has the downside of respecting only a small part of the total lesion volume. Furthermore, this invasive method carries interventional risks like bleeding or infection. Therefore, an image-based biomarker would be highly desirable. Conventional “radiomics” methods have often been utilized for similar problems, but the results are often not reproducible. This is mainly due to sampling errors and interobserver variability, but also the seemingly complex nature of the problem. We present a new approach that implements cutting-edge research in machine learning which is nevertheless cheap and easily applicable in a routine clinical setting. To achieve this, we use convolutional neural networks (CNN) to predict the histopathological findings from liver lesions from preoperative liver CT. Methods: After splitting the study population into a training and test set we trained a CNN to predict the histopathological tumor type from CT data. Results: The developed CNN workflow is able to predict liver tumor histology from routine CT images. We also evaluated in how far transfer learning and data augmentation can help in solving this problem and implemented the developed workflow in a clinical routine setting. Conclusion: We propose a robust semiautomatic end-to-end classification workflow for the prediction of the histopathological type of tumor lesions based on abdominal CT and a deep convolutional neural network model. In our cohort, the model shows reliable and accurate results even with limited computational resources.","",""
0,"W. Zong, Yang-Wai Chow, W. Susilo","Visual Analysis of Adversarial Examples in Machine Learning",2021,"","","","",129,"2022-07-13 10:06:04","","10.1007/978-981-33-6726-5_4","","",,,,,0,0.00,0,3,1,"","",""
0,"Cameron Fen, Samir S Undavia","Improving External Validity of Machine Learning, Reduced Form, and Structural Macroeconomic Models using Panel Data",2021,"","","","",130,"2022-07-13 10:06:04","","10.2139/ssrn.3839863","","",,,,,0,0.00,0,2,1,"We show that adding countries as a panel dimension to macroeconomic data can statistically significantly improve the generalization ability of structural and reduced-form models, as well as allow machine learning methods to outperform these and other macroeconomic forecasting models. Using GDP forecasts for evaluation, this procedure reduces root mean squared error (RMSE) by 12% across horizons and models for certain reduced-form models and by 24% across horizons for structural DSGE models. Removing US data from the training set and forecasting out-of-sample country-wise, we show that both reduced form and structural models become more policy invariant, and outperform a baseline model that uses US data only. Finally, given the comparative advantage of ""nonparametric"" machine learning forecasting models in a data-rich regime, we demonstrate that our recurrent neural network (RNN) model and automated machine learning (AutoML) approach outperforms all baseline economic models in this regime. Robustness checks indicate that machine learning outperformance is reproducible, numerically stable, and generalizes across models.","",""
