Cites,Authors,Title,Year,Source,Publisher,ArticleURL,CitesURL,GSRank,QueryDate,Type,DOI,ISSN,CitationURL,Volume,Issue,StartPage,EndPage,ECC,CitesPerYear,CitesPerAuthor,AuthorCount,Age,Abstract,FullTextURL,RelatedURL
106,"Joelle Pineau, Philippe Vincent-Lamarre, Koustuv Sinha, V. Larivière, A. Beygelzimer, Florence d'Alché-Buc, E. Fox, H. Larochelle","Improving Reproducibility in Machine Learning Research (A Report from the NeurIPS 2019 Reproducibility Program)",2020,"","","","",1,"2022-07-13 10:06:04","","","","",,,,,106,53.00,13,8,2,"One of the challenges in machine learning research is to ensure that presented and published results are sound and reliable. Reproducibility, that is obtaining similar results as presented in a paper or talk, using the same code and data (when available), is a necessary step to verify the reliability of research findings. Reproducibility is also an important step to promote open and accessible research, thereby allowing the scientific community to quickly integrate new findings and convert ideas to practice. Reproducibility also promotes the use of robust experimental workflows, which potentially reduce unintentional errors. In 2019, the Neural Information Processing Systems (NeurIPS) conference, the premier international conference for research in machine learning, introduced a reproducibility program, designed to improve the standards across the community for how we conduct, communicate, and evaluate machine learning research. The program contained three components: a code submission policy, a community-wide reproducibility challenge, and the inclusion of the Machine Learning Reproducibility checklist as part of the paper submission process. In this paper, we describe each of these components, how it was deployed, as well as what we were able to learn from this initiative.","",""
8,"K. Ambrosen, Martin W. Skjerbæk, Jonathan Foldager, Martin C. Axelsen, N. Bak, L. Arvastson, S. Christensen, L. B. Johansen, J. Raghava, B. Oranje, E. Rostrup, M. Nielsen, M. Osler, B. Fagerlund, C. Pantelis, B. Kinon, B. Glenthøj, L. K. Hansen, B. Ebdrup","A machine-learning framework for robust and reliable prediction of short- and long-term treatment response in initially antipsychotic-naïve schizophrenia patients based on multimodal neuropsychiatric data",2020,"","","","",2,"2022-07-13 10:06:04","","10.1038/s41398-020-00962-8","","",,,,,8,4.00,1,19,2,"","",""
92,"Martin Rozycki, T. Satterthwaite, N. Koutsouleris, G. Erus, J. Doshi, D. Wolf, Yong Fan, R. Gur, R. Gur, E. Meisenzahl, C. Zhuo, Hong Yin, Hao Yan, W. Yue, Dai Zhang, C. Davatzikos","Multisite Machine Learning Analysis Provides a Robust Structural Imaging Signature of Schizophrenia Detectable Across Diverse Patient Populations and Within Individuals",2018,"","","","",3,"2022-07-13 10:06:04","","10.1093/schbul/sbx137","","",,,,,92,23.00,9,16,4,"Past work on relatively small, single-site studies using regional volumetry, and more recently machine learning methods, has shown that widespread structural brain abnormalities are prominent in schizophrenia. However, to be clinically useful, structural imaging biomarkers must integrate high-dimensional data and provide reproducible results across clinical populations and on an individual person basis. Using advanced multi-variate analysis tools and pooled data from case-control imaging studies conducted at 5 sites (941 adult participants, including 440 patients with schizophrenia), a neuroanatomical signature of patients with schizophrenia was found, and its robustness and reproducibility across sites, populations, and scanners, was established for single-patient classification. Analyses were conducted at multiple scales, including regional volumes, voxelwise measures, and complex distributed patterns. Single-subject classification was tested for single-site, pooled-site, and leave-site-out generalizability. Regional and voxelwise analyses revealed a pattern of widespread reduced regional gray matter volume, particularly in the medial prefrontal, temporolimbic and peri-Sylvian cortex, along with ventricular and pallidum enlargement. Multivariate classification using pooled data achieved a cross-validated prediction accuracy of 76% (AUC = 0.84). Critically, the leave-site-out validation of the detected schizophrenia signature showed accuracy/AUC range of 72-77%/0.73-0.91, suggesting a robust generalizability across sites and patient cohorts. Finally, individualized patient classifications displayed significant correlations with clinical measures of negative, but not positive, symptoms. Taken together, these results emphasize the potential for structural neuroimaging data to provide a robust and reproducible imaging signature of schizophrenia. A web-accessible portal is offered to allow the community to obtain individualized classifications of magnetic resonance imaging scans using the methods described herein.","",""
0,"S. Al-Zaiti, Alaa A. Alghwiri, Xiao Hu, G. Clermont, A. Peace, P. Macfarlane, R. Bond","A clinician’s guide to understanding and critically appraising machine learning studies: a checklist for Ruling Out Bias Using Standard Tools in Machine Learning (ROBUST-ML)",2022,"","","","",4,"2022-07-13 10:06:04","","10.1093/ehjdh/ztac016","","",,,,,0,0.00,0,7,1,"  Developing functional machine learning (ML)-based models to address unmet clinical needs requires unique considerations for optimal clinical utility. Recent debates about the rigours, transparency, explainability, and reproducibility of ML models, terms which are defined in this article, have raised concerns about their clinical utility and suitability for integration in current evidence-based practice paradigms. This featured article focuses on increasing the literacy of ML among clinicians by providing them with the knowledge and tools needed to understand and critically appraise clinical studies focused on ML. A checklist is provided for evaluating the rigour and reproducibility of the four ML building blocks: data curation, feature engineering, model development, and clinical deployment. Checklists like this are important for quality assurance and to ensure that ML studies are rigourously and confidently reviewed by clinicians and are guided by domain knowledge of the setting in which the findings will be applied. Bridging the gap between clinicians, healthcare scientists, and ML engineers can address many shortcomings and pitfalls of ML-based solutions and their potential deployment at the bedside.","",""
0,"F. Moiseev, Artem Lukoianov, N. Durasov","Machine Learning Course, Project 2 Unsupervised Object Segmentation by Redrawing: reproducibility challenge",2019,"","","","",5,"2022-07-13 10:06:04","","","","",,,,,0,0.00,0,3,3,"Semantic Segmentation is one of the core tasks in the area of Computer Vision and in most cases, it’s solved in a supervised manner. This approach demands huge datasets of pixellevel labeled data consisted of image-mask pairs which often are unavailable. In this work we provide an ablation study for the ReDO paper [1] where authors use GAN based segmentation model for Unsupervised Semantic Segmentation task: after prediction of object mask input image is redrawn by generator guided by predicted mask, then generated images are fed to discriminator to align them to the original dataset. However, the proposed approach has one significant shortcoming – the network collapses in ∼ 35% cases. We suggest a modification of this approach based on mask regularization which shows the same performance but is more robust. In the final part, we study the ability of the network to produce meaningful embeddings and show that it contains enough information to be used in semi-supervised classification problems.","",""
20,"L. Pan, Caixia Cheng, U. Haberkorn, A. Dimitrakopoulou-Strauss","Machine learning-based kinetic modeling: a robust and reproducible solution for quantitative analysis of dynamic PET data.",2017,"","","","",6,"2022-07-13 10:06:04","","10.1088/1361-6560/aa6244","","",,,,,20,4.00,5,4,5,"A variety of compartment models are used for the quantitative analysis of dynamic positron emission tomography (PET) data. Traditionally, these models use an iterative fitting (IF) method to find the least squares between the measured and calculated values over time, which may encounter some problems such as the overfitting of model parameters and a lack of reproducibility, especially when handling noisy data or error data. In this paper, a machine learning (ML) based kinetic modeling method is introduced, which can fully utilize a historical reference database to build a moderate kinetic model directly dealing with noisy data but not trying to smooth the noise in the image. Also, due to the database, the presented method is capable of automatically adjusting the models using a multi-thread grid parameter searching technique. Furthermore, a candidate competition concept is proposed to combine the advantages of the ML and IF modeling methods, which could find a balance between fitting to historical data and to the unseen target curve. The machine learning based method provides a robust and reproducible solution that is user-independent for VOI-based and pixel-wise quantitative analysis of dynamic PET data.","",""
29,"Ajay-Vikram Singh, Daniel Rosenkranz, M. Ansari, Rishabh Singh, Anurag Kanase, Shubham Pratap Singh, Blair Johnston, J. Tentschert, P. Laux, A. Luch","Artificial Intelligence and Machine Learning Empower Advanced Biomedical Material Design to Toxicity Prediction",2020,"","","","",7,"2022-07-13 10:06:04","","10.1002/aisy.202000084","","",,,,,29,14.50,3,10,2,"Materials at the nanoscale exhibit specific physicochemical interactions with their environment. Therefore, evaluating their toxic potential is a primary requirement for regulatory purposes and for the safer development of nanomedicines. In this review, to aid the understanding of nano–bio interactions from environmental and health and safety perspectives, the potential, reality, challenges, and future advances that artificial intelligence (AI) and machine learning (ML) present are described. Herein, AI and ML algorithms that assist in the reporting of the minimum information required for biomaterial characterization and aid in the development and establishment of standard operating procedures are focused. ML tools and ab initio simulations adopted to improve the reproducibility of data for robust quantitative comparisons and to facilitate in silico modeling and meta‐analyses leading to a substantial contribution to safe‐by‐design development in nanotoxicology/nanomedicine are mainly focused. In addition, future opportunities and challenges in the application of ML in nanoinformatics, which is particularly well‐suited for the clinical translation of nanotherapeutics, are highlighted. This comprehensive review is believed that it will promote an unprecedented involvement of AI research in improvements in the field of nanotoxicology and nanomedicine.","",""
0,"Ziyu Ning, Shuang Yu, Yanqiao Zhao, Xiaoming Sun, Haibin Wu, Xiaoyang Yu","Identification of miRNA-Mediated Subpathways as Prostate Cancer Biomarkers Based on Topological Inference in a Machine Learning Process Using Integrated Gene and miRNA Expression Data",2021,"","","","",8,"2022-07-13 10:06:04","","10.3389/fgene.2021.656526","","",,,,,0,0.00,0,6,1,"Accurately identifying classification biomarkers for distinguishing between normal and cancer samples is challenging. Additionally, the reproducibility of single-molecule biomarkers is limited by the existence of heterogeneous patient subgroups and differences in the sequencing techniques used to collect patient data. In this study, we developed a method to identify robust biomarkers (i.e., miRNA-mediated subpathways) associated with prostate cancer based on normal prostate samples and cancer samples from a dataset from The Cancer Genome Atlas (TCGA; n = 546) and datasets from the Gene Expression Omnibus (GEO) database (n = 139 and n = 90, with the latter being a cell line dataset). We also obtained 10 other cancer datasets to evaluate the performance of the method. We propose a multi-omics data integration strategy for identifying classification biomarkers using a machine learning method that involves reassigning topological weights to the genes using a directed random walk (DRW)-based method. A global directed pathway network (GDPN) was constructed based on the significantly differentially expressed target genes of the significantly differentially expressed miRNAs, which allowed us to identify the robust biomarkers in the form of miRNA-mediated subpathways (miRNAs). The activity value of each miRNA-mediated subpathway was calculated by integrating multiple types of data, which included the expression of the miRNA and the miRNAs’ target genes and GDPN topological information. Finally, we identified the high-frequency miRNA-mediated subpathways involved in prostate cancer using a support vector machine (SVM) model. The results demonstrated that we obtained robust biomarkers of prostate cancer, which could classify prostate cancer and normal samples. Our method outperformed seven other methods, and many of the identified biomarkers were associated with known clinical treatments.","",""
10,"Alan Le Goallec, B. Tierney, Jacob M. Luber, Evan M. Cofer, A. Kostic, C. Patel","A systematic machine learning and data type comparison yields metagenomic predictors of infant age, sex, breastfeeding, antibiotic usage, country of origin, and delivery type",2020,"","","","",9,"2022-07-13 10:06:04","","10.1371/journal.pcbi.1007895","","",,,,,10,5.00,2,6,2,"The microbiome is a new frontier for building predictors of human phenotypes. However, machine learning in the microbiome is fraught with issues of reproducibility, driven in large part by the wide range of analytic models and metagenomic data types available. We aimed to build robust metagenomic predictors of host phenotype by comparing prediction performances and biological interpretation across 8 machine learning methods and 4 different types of metagenomic data. Using 1,570 samples from 300 infants, we fit 7,865 models for 6 host phenotypes. We demonstrate the dependence of accuracy on algorithm choice and feature definition in microbiome data and propose a framework for building microbiome-derived indicators of host phenotype. We additionally identify biological features predictive of age, sex, breastfeeding status, historical antibiotic usage, country of origin, and delivery type. Our complete results can be viewed at http://apps.chiragjpgroup.org/ubiome_predictions/.","",""
1,"M. Hoeren, D. Zontar, A. Tavakolian, M. Berger, S. Ehret, Temirlan Mussagaliyev, C. Brecher","Performance comparison between model-based and machine learning approaches for the automated active alignment of FAC-lenses",2020,"","","","",10,"2022-07-13 10:06:04","","10.1117/12.2546607","","",,,,,1,0.50,0,7,2,"Due to their short focal lengths, FAC lenses significantly influence the performance of high-power diode laser systems. In addition to the shape, coating and surface quality, high demands are placed on the assembly accuracy for these microoptical components. In order to optimally align and position the lenses despite varying properties (e.g. focal length), active alignment strategies are used. The automation of the active alignment process for production offers enormous potential. Compared to manual processes, the reproducibility and accuracy of the alignment is increased. For the automation of the active alignment process, a deep understanding of the system behaviour is necessary. To control a diversity of variants cost-effectively and robust, new approaches must be taken into account. Concepts of AI or machine learning are great for this kind of generalization and adoption and they have many advantages for the active alignment of systems like DOEs or free-form-optics, with a complex system behaviour. In this publication, we want to compare the performance of a classically model-based algorithm and a machine learning approach for the automated active alignment of FAC-lenses. The model-based algorithm uses a physical model of the metrology system (including the FAC to be aligned) to estimate a misalignment in 4-DOF. The machine learning algorithm consist of a deep neuronal network which was trained with image data.","",""
23,"P. Mondal, Xue Liu, T. Fatoyinbo, D. Lagomasino","Evaluating Combinations of Sentinel-2 Data and Machine-Learning Algorithms for Mangrove Mapping in West Africa",2019,"","","","",11,"2022-07-13 10:06:04","","10.3390/rs11242928","","",,,,,23,7.67,6,4,3,"Creating a national baseline for natural resources, such as mangrove forests, and monitoring them regularly often requires a consistent and robust methodology. With freely available satellite data archives and cloud computing resources, it is now more accessible to conduct such large-scale monitoring and assessment. Yet, few studies examine the reproducibility of such mangrove monitoring frameworks, especially in terms of generating consistent spatial extent. Our objective was to evaluate a combination of image processing approaches to classify mangrove forests along the coast of Senegal and The Gambia. We used freely available global satellite data (Sentinel-2), and cloud computing platform (Google Earth Engine) to run two machine learning algorithms, random forest (RF), and classification and regression trees (CART). We calibrated and validated the algorithms using 800 reference points collected using high-resolution images. We further re-ran 10 iterations for each algorithm, utilizing unique subsets of the initial training data. While all iterations resulted in thematic mangrove maps with over 90% accuracy, the mangrove extent ranges between 827–2807 km2 for Senegal and 245–1271 km2 for The Gambia with one outlier for each country. We further report “Places of Agreement” (PoA) to identify areas where all iterations for both methods agree (506.6 km2 and 129.6 km2 for Senegal and The Gambia, respectively), thus have a high confidence in predicting mangrove extent. While we acknowledge the timeand cost-effectiveness of such methods for the landscape managers, we recommend utilizing them with utmost caution, as well as post-classification on-the-ground checks, especially for decision making.","",""
0,"","Machine learning based alignment of mass spectrometry data for improved clinical biomarker discovery",2022,"","","","",12,"2022-07-13 10:06:04","","","","",,,,,0,0.00,0,0,1,"Challenges: To date, although few algorithms have been proposed to do so, there does not exist any generic methodological framework allowing for the alignment of several samples, in order to subsequently provide a robust identification transfer between samples. An innovation in this direction will therefore strongly impact the reproducibility of MS-based molecular profiling, and subsequently, clinical research tools.","",""
2,"Chris Emmery, Ákos Kádár, Travis J. Wiltshire, Andrew T. Hendrickson","Towards Replication in Computational Cognitive Modeling: a Machine Learning Perspective",2019,"","","","",13,"2022-07-13 10:06:04","","10.1007/S42113-019-00055-W","","",,,,,2,0.67,1,4,3,"","",""
0,"Samuel J Bell, Onno P. Kampman, Jesse Dodge, Neil D. Lawrence","Modeling the Machine Learning Multiverse",2022,"","","","",14,"2022-07-13 10:06:04","","10.48550/arXiv.2206.05985","","",,,,,0,0.00,0,4,1,"Amid mounting concern about the reliability and credibility of machine learning research, we present a principled framework for making robust and generalizable claims: the Multiverse Analysis. Our framework builds upon the Multiverse Analysis [1] introduced in response to psychology’s own reproducibility crisis. To efficiently explore high-dimensional and often continuous ML search spaces, we model the multiverse with a Gaussian Process surrogate and apply Bayesian experimental design. Our framework is designed to facilitate drawing robust scientific conclusions about model performance, and thus our approach focuses on exploration rather than conventional optimization. In the first of two case studies, we investigate disputed claims about the relative merit of adaptive optimizers. Second, we synthesize conflicting research on the effect of learning rate on the large batch training generalization gap. For the machine learning community, the Multiverse Analysis is a simple and effective technique for identifying robust claims, for increasing transparency, and a step toward improved reproducibility.","",""
0,"Prabhant Singh","Reproducibility Report : Synthesizing Robust Adversarial Examples ∗",2018,"","","","",15,"2022-07-13 10:06:04","","","","",,,,,0,0.00,0,1,4,"Neural network-based classifiers parallel or exceed human-level accuracy on many common tasks and are used in practical systems. Yet, neural networks are susceptible to adversarial examples, carefully perturbed inputs that cause networks to misbehave in arbitrarily chosen ways[11]. An adversarial example is a sample of input data which has been modified very slightly in a way that is intended to cause a machine learning classifier to misclassify it. In many cases, these modifications can be so subtle that a human observer does not even notice the modification at all, yet the classifier still makes a mistake. Adversarial examples pose security concerns because they could be used to perform an attack on machine learning systems, even if the adversary has no access to the underlying model[? ]. Adversarial examples generated using standard techniques like Fast Gradient sign method[3] require complete control over the direct input to the neural network, this is not the case in real world scenarios.[4] For example, standard adversarial examples are not robust under rotation, cropping and various image transformation methods. Expectation over transformation: In this paper[1], the authors introduced a new algorithm, Expectation over transformation to generate robust adversarial examples.","",""
17,"Khimya Khetarpal, Zafarali Ahmed, Andre Cianflone, Riashat Islam, Joelle Pineau","RE-EVALUATE: Reproducibility in Evaluating Reinforcement Learning Algorithms",2018,"","","","",16,"2022-07-13 10:06:04","","","","",,,,,17,4.25,3,5,4,"Reinforcement learning (RL) has recently achieved tremendous success in solving complex tasks. Careful considerations are made towards reproducible research in machine learning. Reproducibility in RL often becomes more difficult, due to the lack of standard evaluation method and detailed methodology for algorithms and comparisons with existing work. In this work, we highlight key differences in evaluation in RL compared to supervised learning, and discuss specific issues that are often non-intuitive for newcomers. We study the importance of reproducibility in evaluation in RL, and propose an evaluation pipeline that can be decoupled from the algorithm code. We hope such an evaluation pipeline can be standardized, as a step towards robust and reproducible research in RL.","",""
0,"Tianhan Zhang, Yuxiao Yi, Yifan Xu, Z. X. Chen, Yaoyu Zhang, E. Weinan, Zhi-Qin John Xu","A multi-scale sampling method for accurate and robust deep neural network to predict combustion chemical kinetics",2022,"","","","",17,"2022-07-13 10:06:04","","","","",,,,,0,0.00,0,7,1,"Machine learning has long been considered as a black box for predicting combustion chemical kinetics due to the extremely large number of parameters and the lack of evaluation standards and reproducibility. The current work aims to understand two basic questions regarding the deep neural network (DNN) method: what data the DNN needs and how general the DNN method can be. Sampling and preprocessing determine the DNN training dataset, further affect DNN prediction ability. The current work proposes using Box-Cox transformation (BCT) to preprocess the combustion data. In addition, this work compares different sampling methods with or without preprocessing, including the Monte Carlo method, ∗Corresponding authors. January 12, 2022 ar X iv :2 20 1. 03 54 9v 1 [ ph ys ic s. ch em -p h] 9 J an 2 02 2 manifold sampling, generative neural network method (cycle-GAN), and newlyproposed multi-scale sampling. Our results reveal that the DNN trained by the manifold data can capture the chemical kinetics in limited configurations but cannot remain robust toward perturbation, which is inevitable for the DNN coupled with the flow field. The Monte Carlo and cycle-GAN samplings can cover a wider phase space but fail to capture small-scale intermediate species, producing poor prediction results. A three-hidden-layer DNN, based on the multi-scale method without specific flame simulation data, allows predicting chemical kinetics in various scenarios and being stable during the temporal evolutions. This single DNN is readily implemented with several CFD codes and validated in various combustors, including (1). zero-dimensional autoignition, (2). one-dimensional freely propagating flame, (3). two-dimensional jet flame with triple-flame structure, and (4). three-dimensional turbulent lifted flames. The ignition delay time, laminar flame speed, lifted flame height, and contours of physical quantities demonstrate the satisfying accuracy and generalization ability of the pre-trained DNN. The Fortran and Python versions of DNN and example code are attached in the supplementary for reproducibility.","",""
