Cites,Authors,Title,Year,Source,Publisher,ArticleURL,CitesURL,GSRank,QueryDate,Type,DOI,ISSN,CitationURL,Volume,Issue,StartPage,EndPage,ECC,CitesPerYear,CitesPerAuthor,AuthorCount,Age,Abstract,FullTextURL,RelatedURL
0,"N. Kirlic, E. Akeman, Danielle C DeVille, Hung-wen Yeh, K. Cosgrove, Timothy McDermott, James Touthang, A. Clausen, M. Paulus, R. Aupperle","A machine learning analysis of risk and protective factors of suicidal thoughts and behaviors in college students.",2021,"","","","",70,"2022-07-13 10:06:04","","10.1080/07448481.2021.1947841","","",,,,,0,0.00,0,10,1,"OBJECTIVE To identify robust and reproducible factors associated with suicidal thoughts and behaviors (STBs) in college students.   METHODS 356 first-year university students completed a large battery of demographic and clinically-relevant self-report measures during the first semester of college and end-of-year (n = 228). Suicide Behaviors Questionnaire-Revised (SBQ-R) assessed STBs. A machine learning (ML) pipeline using stacking and nested cross-validation examined correlates of SBQ-R scores.   RESULTS 9.6% of students were identified at significant STBs risk by the SBQ-R. The ML algorithm explained 28.3% of variance (95%CI: 28-28.5%) in baseline SBQ-R scores, with depression severity, social isolation, meaning and purpose in life, and positive affect among the most important factors. There was a significant reduction in STBs at end-of-year with only 1.8% of students identified at significant risk.   CONCLUSION Analyses replicated known factors associated with STBs during the first semester of college and identified novel, potentially modifiable factors including positive affect and social connectedness.","",""
0,"Olga Gorodetskaya, Yana L. Gobareva, M. Koroteev","A Machine Learning Pipeline for Forecasting Time Series in the Banking Sector",2021,"","","","",71,"2022-07-13 10:06:04","","10.3390/economies9040205","","",,,,,0,0.00,0,3,1,"The problem of forecasting time series is very widely debated. In recent years, machine learning algorithms have been very prolific in this area. This paper describes a systematic approach to building a machine learning predictive model for solving optimization problems in the banking sector. A literature analysis on applying such methods in this particular area is presented. As a direct result of the described research, a universal scenario for forecasting various non-stationary time series in automatic mode was developed. The developed scenario for solving specific banking tasks to improve business efficiency, including optimizing demand for ATMs, forecasting the load on the call center and cash center, is considered. A machine learning methodology in economics that can yield robust and reproducible results and can be reused in solving other similar tasks is described. The methodology described in the article was tested on three cases and showed the ability to generate models that are superior in accuracy to similar predictive models described in the literature by at least three percentage points. This article will be helpful to specialists dealing with the problem of forecasting economic time series and students and researchers due to a large number of links to systematic literature reviews on this topic.","",""
0,"Yinyihong Liu","Airbnb Pricing Based on Statistical Machine Learning Models",2021,"","","","",72,"2022-07-13 10:06:04","","10.1109/CONF-SPML54095.2021.00042","","",,,,,0,0.00,0,1,1,"Being one of the largest online accommodation booking platforms, Airbnb has many hosts who are seeking for more proper prices to increase their booking rate. To develop a good pricing prediction model, this paper has employed machine learning models including KNN, MLR, LASSO regression, Ridge regression, Random Forest, Gradient Boosting and XGBoost etc. While past studies on Airbnb pricing have applied quantitative pricing, some face the problems that the models are not robust enough and some face the problem of not training the model plentily. To fill this gap, we give careful consideration in exploratory data analysis to make the dataset more reasonable, apply many robust models ranging from regularized regression to ensemble models and use cross validation and random search to tune each parameter in each model. In this way, we not only select XGBoost as the best model for price prediction with R2 score 0.6321, but also uncover the features which have statistical significance with the target price.","",""
0,"Uma Gunasilan","Debate as a learning activity for teaching programming: a case in the subject of machine learning",2021,"","","","",73,"2022-07-13 10:06:04","","10.1108/heswbl-01-2021-0006","","",,,,,0,0.00,0,1,1,"PurposeDebates are well known to encompass a variety of skills we would like higher education candidates to embody when they graduate.Design/methodology/approachDebates in a classroom with computer science as the main subject has been popular in high schools particularly with emerging issues around the area, however it does not have as an extensive similar documented outreach in tertiary education, particularly in the area of hard computer sciences and more recent concentrations of computer science, such as machine learning, artificial intelligence and cloud computing.FindingsTo explore further, the debate dataset had more methodologies applied and was split into training and testing sets, whose results were then compared by a standardized measure: Root Mean Square Error (RMSE) which is currently standard in the industry. The rationale of the approach is to quantify that debate activities have an immensely positive impact towards both the teaching and learning in technical subjects and needs to be more often and robustly used within higher education.Originality/valueThe rationale of the approach is that classroom debate activities equip students with verbal and social learning styles and an opportunity to engage with content in a way that is more comfortable than working with traditional lecture-and-laboratory style learning.","",""
0,"Yan Zhou, Murat Kantarcioglu, B. Xi","A Game Theoretic Perspective on Adversarial Machine Learning and Related Cybersecurity Applications",2021,"","","","",74,"2022-07-13 10:06:04","","10.1002/9781119723950.ch13","","",,,,,0,0.00,0,3,1,"In cybersecurity applications where machine learning algorithms are increasingly used to detect vulnerabilities, a somewhat unique challenge arises as exploits targeting machine learning models are constantly devised by the attackers. Traditional machine learning models are no longer robust and reliable when they are under attack. The action and reaction between machine learning systems and the adversary can be modeled as a game between two or more players. Under well‐defined attack models, game theory can provide robustness guarantee for machine learning models that are otherwise vulnerable to application‐time data corruption. We review two cases of game theory‐based machine learning techniques: in one case, players play a zero sum game by following a minimax strategy, while in the other case, players play a sequential game with one player as the leader and the rest as the followers. Experimental results on e‐mail spam and web spam datasets are presented. In the zero sum game, we demonstrate that an adversarial SVM model built upon the minimax strategy is much more resilient to adversarial attacks than standard SVM and one‐class SVM models. We also show that optimal learning strategies derived to counter overly pessimistic attack models can produce unsatisfactory results when the real attacks are much weaker. In the sequential game, we demonstrate that the mixed strategy, allowing a player to randomize over available strategies, is the best solution in general without knowing what types of adversaries machine learning applications are facing in the wild. We also discuss scenarios where players' behavior may derail rational decision making and models that consider such decision risks.","",""
26,"A. Michel, A. Morrison, Victoria L. Preston, Charles T. Marx, Beckett C. Colson, H. K. White","Rapid Identification of Marine Plastic Debris via Spectroscopic Techniques and Machine Learning Classifiers.",2020,"","","","",75,"2022-07-13 10:06:04","","10.1021/acs.est.0c02099","","",,,,,26,13.00,4,6,2,"To advance our understanding of the environmental fate and transport of macro- and micro-plastic debris, robust and reproducible methods, technologies, and analytical approaches are necessary for in situ plastic-type identification and characterization. This investigation compares four spectroscopic techniques: attenuated total reflectance - Fourier transform infrared spectroscopy (ATR-FTIR), near-infrared (NIR) reflectance spectroscopy, laser-induced breakdown spectroscopy (LIBS), and X-ray fluorescence (XRF) spectroscopy, coupled to seven classification methods, including machine learning classifiers, to determine accuracy for identifying type of both consumer plastics and marine plastic debris. With machine learning classifiers, consumer plastic types were identified with 99%, 91%, 97%, and 70% success rates for ATR-FTIR, NIR reflectance spectroscopy, LIBS, and XRF respectively. The classification of marine plastic debris had similar or lower success rates likely arising from alterations to the plastic from environmental weathering processes with success rates of 99%, 81%, 76%, and 66% for ATR-FTIR, NIR reflectance spectroscopy, LIBS, and XRF respectively. Success rates of 76% and higher indicate that ATR-FTIR, NIR reflectance spectroscopy, and LIBS coupled to machine learning classifiers can be used to robustly identify both consumer and environmental plastic samples.","",""
0,"Farzad Hasani, S. Shabanlou","Outlier robust extreme learning machine to simulate discharge coefficient of side slots",2022,"","","","",76,"2022-07-13 10:06:04","","10.1007/s13201-022-01687-3","","",,,,,0,0.00,0,2,1,"","",""
3,"Dohoon Lee, Youngjune Park, Sun Kim","Towards multi-omics characterization of tumor heterogeneity: a comprehensive review of statistical and machine learning approaches",2020,"","","","",77,"2022-07-13 10:06:04","","10.1093/bib/bbaa188","","",,,,,3,1.50,1,3,2,"The multi-omics molecular characterization of cancer opened a new horizon for our understanding of cancer biology and therapeutic strategies. However, a tumor biopsy comprises diverse types of cells limited not only to cancerous cells but also to tumor microenvironmental cells and adjacent normal cells. This heterogeneity is a major confounding factor that hampers a robust and reproducible bioinformatic analysis for biomarker identification using multi-omics profiles. Besides, the heterogeneity itself has been recognized over the years for its significant prognostic values in some cancer types, thus offering another promising avenue for therapeutic intervention. A number of computational approaches to unravel such heterogeneity from high-throughput molecular profiles of a tumor sample have been proposed, but most of them rely on the data from an individual omics layer. Since the heterogeneity of cells is widely distributed across multi-omics layers, methods based on an individual layer can only partially characterize the heterogeneous admixture of cells. To help facilitate further development of the methodologies that synchronously account for several multi-omics profiles, we wrote a comprehensive review of diverse approaches to characterize tumor heterogeneity based on three different omics layers: genome, epigenome and transcriptome. As a result, this review can be useful for the analysis of multi-omics profiles produced by many large-scale consortia. Contact:sunkim.bioinfo@snu.ac.kr.","",""
3,"Dohoon Lee, Youngjune Park, Sun Kim","Towards multi-omics characterization of tumor heterogeneity: a comprehensive review of statistical and machine learning approaches.",2021,"","","","",78,"2022-07-13 10:06:04","","10.1093/bib/bbaa188","","",,,,,3,3.00,1,3,1,"The multi-omics molecular characterization of cancer opened a new horizon for our understanding of cancer biology and therapeutic strategies. However, a tumor biopsy comprises diverse types of cells limited not only to cancerous cells but also to tumor microenvironmental cells and adjacent normal cells. This heterogeneity is a major confounding factor that hampers a robust and reproducible bioinformatic analysis for biomarker identification using multi-omics profiles. Besides, the heterogeneity itself has been recognized over the years for its significant prognostic values in some cancer types, thus offering another promising avenue for therapeutic intervention. A number of computational approaches to unravel such heterogeneity from high-throughput molecular profiles of a tumor sample have been proposed, but most of them rely on the data from an individual omics layer. Since the heterogeneity of cells is widely distributed across multi-omics layers, methods based on an individual layer can only partially characterize the heterogeneous admixture of cells. To help facilitate further development of the methodologies that synchronously account for several multi-omics profiles, we wrote a comprehensive review of diverse approaches to characterize tumor heterogeneity based on three different omics layers: genome, epigenome and transcriptome. As a result, this review can be useful for the analysis of multi-omics profiles produced by many large-scale consortia. Contact:sunkim.bioinfo@snu.ac.kr.","",""
0,"T. Martin, S. Areibi, G. Grewal","Effective Machine-Learning Models for Predicting Routability During FPGA Placement",2021,"","","","",79,"2022-07-13 10:06:04","","10.1109/MLCAD52597.2021.9531243","","",,,,,0,0.00,0,3,1,"The ability to efficiently and accurately predict placement routability, while avoiding the large computational cost of performing routing, is an asset when seeking to reduce total placement and routing runtime. In this paper, we present a series of simple ML models and ensembles to predict the routability of a placement solution. Ensembles based on Bagging, Boosting and Stack of classifiers are introduced to produce more accurate and robust solutions than single/simple models. Our results show an improvement in prediction accuracy and runtime compared to the best published results in the literature.","",""
14,"L. Claude, J. Houenou, E. Duchesnay, P. Favre","Will machine learning applied to neuroimaging in bipolar disorder help the clinician? A critical review and methodological suggestions",2020,"","","","",80,"2022-07-13 10:06:04","","10.1111/bdi.12895","","",,,,,14,7.00,4,4,2,"The existence of anatomofunctional brain abnormalities in bipolar disorder (BD) is now well established by magnetic resonance imaging (MRI) studies. To create diagnostic and prognostic tools, as well as identifying biologically valid subtypes of BD, research has recently turned towards the use of machine learning (ML) techniques. We assessed both supervised ML and unsupervised ML studies in BD to evaluate their robustness, reproducibility and the potential need for improvement.","",""
21,"Aaron M. Smith, J. Walsh, John J Long, Craig B Davis, Peter V. Henstock, M. Hodge, M. Maciejewski, X. Mu, Stephen Ra, Shanrong Zhao, D. Ziemek, Charles K. Fisher","Standard machine learning approaches outperform deep representation learning on phenotype prediction from transcriptomics data",2020,"","","","",81,"2022-07-13 10:06:04","","10.1186/s12859-020-3427-8","","",,,,,21,10.50,2,12,2,"","",""
13,"Jinlong Liu, Christopher J. Ulishney, C. Dumitrescu","Random Forest Machine Learning Model for Predicting Combustion Feedback Information of a Natural Gas Spark Ignition Engine",2020,"","","","",82,"2022-07-13 10:06:04","","10.1115/1.4047761","","",,,,,13,6.50,4,3,2,"  Engine calibration requires detailed feedback information that can reflect the combustion process as the optimized objective. Indicated mean effective pressure (IMEP) is such an indicator describing an engine’s capacity to do work under different combinations of control variables. In this context, it is of interest to find cost-effective solutions that will reduce the number of experimental tests. This paper proposes a random forest machine learning model as a cost-effective tool for optimizing engine performance. Specifically, the model estimated IMEP for a natural gas spark ignited engine obtained from a converted diesel engine. The goal was to develop an economical and robust tool that can help reduce the large number of experiments usually required throughout the design and development of internal combustion engines. The data used for building such correlative model came from engine experiments that varied the spark advance, fuel-air ratio, and engine speed. The inlet conditions and the coolant/oil temperature were maintained constant. As a result, the model inputs were the key engine operation variables that affect engine performance. The trained model was shown to be able to predict the combustion-related feedback information with good accuracy (R2 ≈ 0.9 and MSE ≈ 0). In addition, the model accurately reproduced the effect of control variables on IMEP, which would help narrow the choice of operating conditions for future designs of experiment. Overall, the machine learning approach presented here can provide new chances for cost-efficient engine analysis and diagnostics work.","",""
12,"Liangyuan Hu, Bian Liu, J. Ji, Yan Li","Tree‐Based Machine Learning to Identify and Understand Major Determinants for Stroke at the Neighborhood Level",2020,"","","","",83,"2022-07-13 10:06:04","","10.1161/JAHA.120.016745","","",,,,,12,6.00,3,4,2,"Background Stroke is a major cardiovascular disease that causes significant health and economic burden in the United States. Neighborhood community‐based interventions have been shown to be both effective and cost‐effective in preventing cardiovascular disease. There is a dearth of robust studies identifying the key determinants of cardiovascular disease and the underlying effect mechanisms at the neighborhood level. We aim to contribute to the evidence base for neighborhood cardiovascular health research. Methods and Results We created a new neighborhood health data set at the census tract level by integrating 4 types of potential predictors, including unhealthy behaviors, prevention measures, sociodemographic factors, and environmental measures from multiple data sources. We used 4 tree‐based machine learning techniques to identify the most critical neighborhood‐level factors in predicting the neighborhood‐level prevalence of stroke, and compared their predictive performance for variable selection. We further quantified the effects of the identified determinants on stroke prevalence using a Bayesian linear regression model. Of the 5 most important predictors identified by our method, higher prevalence of low physical activity, larger share of older adults, higher percentage of non‐Hispanic Black people, and higher ozone levels were associated with higher prevalence of stroke at the neighborhood level. Higher median household income was linked to lower prevalence. The most important interaction term showed an exacerbated adverse effect of aging and low physical activity on the neighborhood‐level prevalence of stroke. Conclusions Tree‐based machine learning provides insights into underlying drivers of neighborhood cardiovascular health by discovering the most important determinants from a wide range of factors in an agnostic, data‐driven, and reproducible way. The identified major determinants and the interactive mechanism can be used to prioritize and allocate resources to optimize community‐level interventions for stroke prevention.","",""
85,"P. Graff, F. Feroz, M. Hobson, A. Lasenby","SKYNET: an efficient and robust neural network training tool for machine learning in astronomy",2013,"","","","",84,"2022-07-13 10:06:04","","10.1093/mnras/stu642","","",,,,,85,9.44,21,4,9,"We present the first public release of our generic neural network training algorithm, called SKYNET. This efficient and robust machine-learning tool is able to train large and deep feedforward neural networks, including autoencoders, for use in a wide range of supervised and unsupervised learning applications, such as regression, classification, density estimation, clustering and dimensionality reduction. SKYNET uses a powerful ‘pre-training’ method, to obtain a set of network parameters close to the true global maximum of the training objective function, followed by further optimisation using an automatically-regularised variant of Newton’s method; the latter uses second-order derivative information to improve convergence, but without the need to evaluate or store the full Hessian matrix, by using a fast approximate method to calculate Hessian-vector products. This combination of methods allows for the training of complicated networks that are difficult to optimise using standard backpropagation techniques. SKYNET employs convergence criteria that naturally prevent overfitting, and also includes a fast algorithm for estimating the accuracy of network outputs. The utility and flexibility of SKYNET are demonstrated by application to a number of toy problems, and to astronomical problems focusing on the recovery of structure from blurred and noisy images, the identification of gamma-ray bursters, and the compression and denoising of galaxy images. The SKYNET software, which is implemented in standard ANSI C and fully parallelised using MPI, is available at http://www.mrao.cam.ac.uk/software/skynet/.","",""
11,"H. Jo, Javier E. Santos, M. Pyrcz","Conditioning well data to rule-based lobe model by machine learning with a generative adversarial network",2020,"","","","",85,"2022-07-13 10:06:04","","10.1177/0144598720937524","","",,,,,11,5.50,4,3,2,"Rule-based reservoir modeling methods integrate geological depositional process concepts to generate reservoir models that capture realistic geologic features for improved subsurface predictions and uncertainty models to support development decision making. However, the robust and direct conditioning of these models to subsurface data, such as well logs, core descriptions, and seismic inversions and interpretations, remains as an obstacle for the broad application as a standard subsurface modeling technology. We implement a machine learning-based method for fast and flexible data conditioning of rule-based models. This study builds on a rule-based modeling method for deep-water lobe reservoirs. The model has three geological inputs: (1) the depositional element geometry, (2) the compositional exponent for element stacking pattern, and (3) the distribution of petrophysical properties with hierarchical trends conformable to the surfaces. A deep learning-based workflow is proposed for robust and non-iterative data conditioning. First, a generative adversarial network learns salient geometric features from the ensemble of the training rule-based models. Then, a new rule-based model is generated and a mask is applied to remove the model near local data along the well trajectories. Last, semantic image inpainting restores the mask with the optimum generative adversarial network realization that is consistent with both local data and the surrounding model. For the deep-water lobe example, the generative adversarial network learns the primary geological spatial features to generate reservoir realizations that reproduce hierarchical trend as well as the surface geometries and stacking pattern. Moreover, the trained generative adversarial network explores the latent reservoir manifold and identifies the ensemble of models to represent an uncertainty model. Semantic image inpainting determines the optimum replacement for the near-data mask that is consistent with the local data and the rest of the model. This work results in subsurface models that accurately reproduce reservoir heterogeneity, continuity, and spatial distribution of petrophysical parameters while honoring the local well data constraints.","",""
