Cites,Authors,Title,Year,Source,Publisher,ArticleURL,CitesURL,GSRank,QueryDate,Type,DOI,ISSN,CitationURL,Volume,Issue,StartPage,EndPage,ECC,CitesPerYear,CitesPerAuthor,AuthorCount,Age,Abstract,FullTextURL,RelatedURL
2,"Lei Gu, R. Wu","Robust Cortical Criticality and Diverse Neural Network Dynamics Resulting from Functional Specification",2020,"","","","",1,"2022-07-13 10:07:43","","10.1101/2020.10.23.352849","","",,,,,2,1.00,1,2,2,"Despite recognized layered structure and increasing evidence for criticality in the cortex, how the specification of input, output and computational layers affects the self-organized criticality has been surprisingly neglected. By constructing heterogeneous structures with a well-accepted model of leaky neurons, we found that the specification can lead to robust criticality almost insensitive to the strength of external stimuli. This naturally unifies the adaptation to strong inputs without extra synaptic plasticity mechanisms. Presence of output neurons constitutes an alternative explanation to subcriticality other than the high frequency inputs. Degree of recurrence is proposed as a network metric to account for the signal termination due to output neurons. Unlike fully recurrent networks where external stimuli always render subcriticality, the dynamics of networks with sufficient feed-forward connections can be driven to criticality and supercriticality. These findings indicate that functional and structural specification and their interplay with external stimuli are of crucial importance for the network dynamics. The robust criticality puts forward networks of the leaky neurons as a promising platform for realizing artificial neural networks that work in the vicinity of critical points.","",""
22,"Zifan Wang, Yilin Yang, Ankit Shrivastava, Varun Rawal, Zihao Ding","Towards Frequency-Based Explanation for Robust CNN",2020,"","","","",2,"2022-07-13 10:07:43","","","","",,,,,22,11.00,4,5,2,"Current explanation techniques towards a transparent Convolutional Neural Network (CNN) mainly focuses on building connections between the human-understandable input features with models' prediction, overlooking an alternative representation of the input, the frequency components decomposition. In this work, we present an analysis of the connection between the distribution of frequency components in the input dataset and the reasoning process the model learns from the data. We further provide quantification analysis about the contribution of different frequency components toward the model's prediction. We show that the vulnerability of the model against tiny distortions is a result of the model is relying on the high-frequency features, the target features of the adversarial (black and white-box) attackers, to make the prediction. We further show that if the model develops stronger association between the low-frequency component with true labels, the model is more robust, which is the explanation of why adversarially trained models are more robust against tiny distortions.","",""
0,"Hongwei Zhang, Can Wang, Yuanqing Xia, Tijin Yan","Information Fusion of Topological Structure and Node Features in Graph Neural Network",2021,"","","","",3,"2022-07-13 10:07:43","","10.23919/CCC52363.2021.9550081","","",,,,,0,0.00,0,4,1,"Graph neural networks(GNNs) have shown great popularity and achieved promising performance on various graph-based tasks in the past years. However, there is little work that explores the information fusion mechanism, which plays an import role in GNNs. Besides, datasets in the real world often have noises, which make the information fusion difficult. In this paper, we give an information-theoretic explanation. Specifically, we focus on how the information from topological structures and node features fuses and how different information contributes to the downstream task. Furthermore, we propose a general framework named M-GCN to express the fusion process in GNNs. Graph embeddings and feature graph are introduced to extract the information from topological structure and node features separately in M-GCN. Extensive experiments are conducted on several benchmark datasets and experimental results show that our proposed models are more robust and outperform state-of-the-art methods.","",""
1,"David Morales, Estefanía Talavera, Beatriz Remeseiro","Playing to distraction: towards a robust training of CNN classifiers through visual explanation techniques",2020,"","","","",4,"2022-07-13 10:07:43","","10.1007/s00521-021-06282-2","","",,,,,1,0.50,0,3,2,"","",""
7,"Laura Rieger, L. K. Hansen","Aggregating explanation methods for stable and robust explainability.",2019,"","","","",5,"2022-07-13 10:07:43","","","","",,,,,7,2.33,4,2,3,"Despite a growing literature on explaining neural networks, no consensus has been reached on how to explain a neural network decision or how to evaluate an explanation. Our contributions in this paper are twofold. First, we investigate schemes to combine explanation methods and reduce model uncertainty to obtain a single aggregated explanation. We provide evidence that the aggregation is better at identifying important features, than on individual methods. Adversarial attacks on explanations is a recent active research topic. As our second contribution, we present evidence that aggregate explanations are much more robust to attacks than individual explanation methods.","",""
0,"Junho Kim, Seong-Tae Kim, Seong Tae Kim, Y. Ro","Robust Perturbation for Visual Explanation: Cross-Checking Mask Optimization to Avoid Class Distortion",2021,"","","","",6,"2022-07-13 10:07:43","","10.1109/TIP.2021.3130526","","",,,,,0,0.00,0,4,1,"Along with the outstanding performance of the deep neural networks (DNNs), considerable research efforts have been devoted to finding ways to understand the decision of DNNs structures. In the computer vision domain, visualizing the attribution map is one of the most intuitive and understandable ways to achieve human-level interpretation. Among them, perturbation-based visualization can explain the “black box” property of the given network by optimizing perturbation masks that alter the network prediction of the target class the most. However, existing perturbation methods could make unexpected changes to network predictions after applying a perturbation mask to the input image, resulting in a loss of robustness and fidelity of the perturbation mechanisms. In this paper, we define class distortion as the unexpected changes of the network prediction during the perturbation process. To handle that, we propose a novel visual interpretation framework, Robust Perturbation, which shows robustness against the unexpected class distortion during the mask optimization. With a new cross-checking mask optimization strategy, our proposed framework perturbs the target prediction of the network while upholding the non-target predictions, providing more reliable and accurate visual explanations. We evaluate our framework on three different public datasets through extensive experiments. Furthermore, we propose a new metric for class distortion evaluation. In both quantitative and qualitative experiments, tackling the class distortion problem turns out to enhance the quality and fidelity of the visual explanation in comparison with the existing perturbation-based methods.","",""
0,"","AGGREGATING EXPLANATION METHODS FOR NEURAL NETWORKS STABILIZES EXPLANATIONS",2019,"","","","",7,"2022-07-13 10:07:43","","","","",,,,,0,0.00,0,0,3,"Despite a growing literature on explaining neural networks, no consensus has been reached on how to explain a neural network decision or how to evaluate an explanation. Our contributions in this paper are twofold. First, we investigate schemes to combine explanation methods and reduce model uncertainty to obtain a single aggregated explanation. The aggregation is more robust and aligns better with the neural network than any single explanation method.. Second, we propose a new approach to evaluating explanation methods that circumvents the need for manual evaluation and is not reliant on the alignment of neural networks and humans decision processes.","",""
0,"Gu Xiao, Huibin Wang, Jie Shen, Zhe Chen, Zhen Zhang","An Adaptive Hierarchical Concatenated Network With A Robust Loss Function For Image Denoising",2022,"","","","",8,"2022-07-13 10:07:43","","10.1007/s10723-022-09601-6","","",,,,,0,0.00,0,5,1,"","",""
7,"Emanuele La Malfa, A. Zbrzezny, Rhiannon Michelmore, Nicola Paoletti, M. Kwiatkowska","On Guaranteed Optimal Robust Explanations for NLP Models",2021,"","","","",9,"2022-07-13 10:07:43","","10.24963/366","","",,,,,7,7.00,1,5,1,"We build on abduction-based explanations for machine learning and develop a method for computing local explanations for neural network models in natural language processing (NLP). Our explanations comprise a subset of the words of the input text that satisfies two key features: optimality w.r.t. a user-defined cost function, such as the length of explanation, and robustness, in that they ensure prediction invariance for any bounded perturbation in the embedding space of the left-out words. We present two solution algorithms, respectively based on implicit hitting sets and maximum universal subsets, introducing a number of algorithmic improvements to speed up convergence of hard instances. We show how our method can be configured with different perturbation sets in the embedded space and used to detect bias in predictions by enforcing include/exclude constraints on biased terms, as well as to enhance existing heuristic-based NLP explanation frameworks such as Anchors. We evaluate our framework on three widely used sentiment analysis tasks and texts of up to 100 words from SST, Twitter and IMDB datasets, demonstrating the effectiveness of the derived explanations.","",""
4,"Jay Roberts, Theodoros Tsiligkaridis","Controllably Sparse Perturbations of Robust Classifiers for Explaining Predictions and Probing Learned Concepts",2021,"","","","",10,"2022-07-13 10:07:43","","","","",,,,,4,4.00,2,2,1,"Explaining the predictions of a deep neural network (DNN) in image classification is an active area of research. Many methods focus on localizing pixels, or groups of pixels, which maximize a relevance metric for the prediction. Others aim at creating local ""proxy"" explainers which aim to account for an individual prediction of a model. We aim to explore ""why"" a model made a prediction by perturbing inputs to robust classifiers and interpreting the semantically meaningful results. For such an explanation to be useful for humans it is desirable for it to be sparse; however, generating sparse perturbations can computationally expensive and infeasible on high resolution data. Here we introduce controllably sparse explanations that can be efficiently generated on higher resolution data to provide improved counter-factual explanations. Further we use these controllably sparse explanations to probe what the robust classifier has learned. These explanations could provide insight for model developers as well as assist in detecting dataset bias. CCS Concepts • Computing methodologies → Machine learning; Artificial intelligence;","",""
1,"Yuchai Wan, Zhongshu Zheng, Ran Liu, Zheng Zhu, Hongen Zhou, Xun Zhang, Said Boumaraf","A Multi-Scale and Multi-Level Fusion Approach for Deep Learning-Based Liver Lesion Diagnosis in Magnetic Resonance Images with Visual Explanation",2021,"","","","",11,"2022-07-13 10:07:43","","10.3390/life11060582","","",,,,,1,1.00,0,7,1,"Many computer-aided diagnosis methods, especially ones with deep learning strategies, of liver cancers based on medical images have been proposed. However, most of such methods analyze the images under only one scale, and the deep learning models are always unexplainable. In this paper, we propose a deep learning-based multi-scale and multi-level fusing approach of CNNs for liver lesion diagnosis on magnetic resonance images, termed as MMF-CNN. We introduce a multi-scale representation strategy to encode both the local and semi-local complementary information of the images. To take advantage of the complementary information of multi-scale representations, we propose a multi-level fusion method to combine the information of both the feature level and the decision level hierarchically and generate a robust diagnostic classifier based on deep learning. We further explore the explanation of the diagnosis decision of the deep neural network through visualizing the areas of interest of the network. A new scoring method is designed to evaluate whether the attention maps can highlight the relevant radiological features. The explanation and visualization make the decision-making process of the deep neural network transparent for the clinicians. We apply our proposed approach to various state-of-the-art deep learning architectures. The experimental results demonstrate the effectiveness of our approach.","",""
1,"R. Vardhan, Ninghao Liu, Phakpoom Chinprutthiwong, Weijie Fu, Zhen Hu, Xia Hu, G. Gu","ExAD: An Ensemble Approach for Explanation-based Adversarial Detection",2021,"","","","",12,"2022-07-13 10:07:43","","","","",,,,,1,1.00,0,7,1,"Recent research has shown Deep Neural Networks (DNNs) to be vulnerable to adversarial examples that induce desired misclassifications in the models. Such risks impede the application of machine learning in security-sensitive domains. Several defense methods have been proposed against adversarial attacks to detect adversarial examples at test time or to make machine learning models more robust. However, while existing methods are quite effective under blackbox threat model, where the attacker is not aware of the defense, they are relatively ineffective under whitebox threat model, where the attacker has full knowledge of the defense. In this paper, we propose ExAD, a framework to detect adversarial examples using an ensemble of explanation techniques. Each explanation technique in ExAD produces an explanation map identifying the relevance of input variables for the model’s classification. For every class in a dataset, the system includes a detector network, corresponding to each explanation technique, which is trained to distinguish between normal and abnormal explanation maps. At test time, if the explanation map of an input is detected as abnormal by any detector model of the classified class, then we consider the input to be an adversarial example. We evaluate our approach using six state-of-the-art adversarial attacks on three image datasets. Our extensive evaluation shows that our mechanism can effectively detect these attacks under blackbox threat model with limited false-positives. Furthermore, we find that our approach achieves promising results in limiting the success rate of whitebox attacks.","",""
7,"Thorben Funke, Megha Khosla, Avishek Anand","Zorro: Valid, Sparse, and Stable Explanations in Graph Neural Networks",2021,"","","","",13,"2022-07-13 10:07:43","","","","",,,,,7,7.00,2,3,1,"With the ever-increasing popularity and applications of graph neural networks, several proposals have been made to explain and understand the decisions of a graph neural network. Explanations for graph neural networks differ in principle from other input settings. It is important to attribute the decision to input features and other related instances connected by the graph structure. We find that the previous explanation generation approaches that maximize the mutual information between the label distribution produced by the model and the explanation to be restrictive. Specifically, existing approaches do not enforce explanations to be valid, sparse, or robust to input perturbations. In this paper, we lay down some of the fundamental principles that an explanation method for graph neural networks should follow and introduce a metric RDT-Fidelity as a measure of the explanation’s effectiveness. We propose a novel approach Zorro based on the principles from rate-distortion theory that uses a simple combinatorial procedure to optimize for RDT-Fidelity. Extensive experiments on real and synthetic datasets reveal that Zorro produces sparser, stable, and more faithful explanations than existing graph neural network explanation approaches.","",""
8,"Simón C. Smith, S. Ramamoorthy","Counterfactual Explanation and Causal Inference In Service of Robustness in Robot Control",2020,"","","","",14,"2022-07-13 10:07:43","","10.1109/ICDL-EpiRob48136.2020.9278061","","",,,,,8,4.00,4,2,2,"We propose an architecture for training generative models of counterfactual conditionals of the form, ‘can we modify event A to cause B instead of C?’, motivated by applications in robot control. Using an ‘adversarial training’ paradigm, an image-based deep neural network model is trained to produce small and realistic modifications to an original image in order to cause user-defined effects. These modifications can be used in the design process of image-based robust control - to determine the ability of the controller to return to a working regime by modifications in the input space, rather than by adaptation. In contrast to conventional control design approaches, where robustness is quantified in terms of the ability to reject noise, we explore the space of counterfactuals that might cause a certain requirement to be violated, thus proposing an alternative model that might be more expressive in certain robotics applications. So, we propose the generation of counterfactuals as an approach to explanation of black-box models and the envisioning of potential movement paths in autonomous robotic control. Firstly, we demonstrate this approach in a set of classification tasks, using the well known MNIST and CelebFaces Attributes datasets. Then, addressing multi-dimensional regression, we demonstrate our approach in a reaching task with a physical robot, and in a navigation task with a robot in a digital twin simulation.","",""
0,"Simón C. Smith, S. Ramamoorthy","Counterfactual Explanation and Causal in Service of Robustness in Robot Control",2020,"","","","",15,"2022-07-13 10:07:43","","","","",,,,,0,0.00,0,2,2,"We propose an architecture for training generative models of counterfactual conditionals of the form, ‘can we modify event A to cause B instead of C?’, motivated by applications in robot control. Using an ‘adversarial training’ paradigm, an image-based deep neural network model is trained to produce small and realistic modifications to an original image in order to cause user-defined effects. These modifications can be used in the design process of image-based robust control to determine the ability of the controller to return to a working regime by modifications in the input space, rather than by adaptation. In contrast to conventional control design approaches, where robustness is quantified in terms of the ability to reject noise, we explore the space of counterfactuals that might cause a certain requirement to be violated, thus proposing an alternative model that might be more expressive in certain robotics applications. So, we propose the generation of counterfactuals as an approach to explanation of black-box models and the envisioning of potential movement paths in autonomous robotic control. Firstly, we demonstrate this approach in a set of classification tasks, using the well known MNIST and CelebFaces Attributes datasets. Then, addressing multi-dimensional regression, we demonstrate our approach in a reaching task with a physical robot, and in a navigation task with a robot in a digital twin simulation.","",""
0,"Junhee Lee, Hyeonseong Cho, Yun Jang Pyun, Suk‐Ju Kang, H. Nam","Heatmap Assisted Accuracy Score Evaluation Method for Machine-Centric Explainable Deep Neural Networks",2022,"","","","",16,"2022-07-13 10:07:43","","10.1109/access.2022.3184453","","",,,,,0,0.00,0,5,1,"There have existed many studies about the explainable artificial intelligence (XAI) that explains the logic behind the complex deep neural network called a black box. At the same time, researchers have tried to evaluate the explainability performance of various XAIs. However, most previous evaluation methods are human-centric, that is, subjective, where they rely on how much the results of explanation are similar to what people’s decision is based on rather than what features actually affect the decision in the model. Their XAI selections are also dependent of datasets. Furthermore, they are focusing only on the output variation of a target class. On the other hand, this paper proposes a robust heatmap assisted accuracy score (HAAS) scheme over datasets that helps selecting machine-centric explanation algorithms to show what actually leads to the decision of a given classification network. The proposed method modifies the input image with the heatmap scores obtained by a given explanation algorithm and then puts the resultant heatmap assisted (HA) images into the network to estimate the accuracy change. The resultant metric (<inline-formula> <tex-math notation=""LaTeX"">$HAAS$ </tex-math></inline-formula>) is computed as a ratio of accuracies of the given network over HA and original images. The proposed evaluation scheme is verified in the image classification models of LeNet-5 for MNIST and VGG-16 for CIFAR-10, STL-10, and ILSVRC2012 over totally 11 XAI algorithms of saliency map, deconvolution, and 9 layer-wise relevance propagation (LRP) configurations. Consequently, for LRP1 and LRP3, MINST showed largest <inline-formula> <tex-math notation=""LaTeX"">$HAAS$ </tex-math></inline-formula> values of 1.0088 and 1.0079, CIFAR-10 achieved 1.1160 and 1.1254, STL-10 had 1.0906 and 1.0918, and ILSVRC2012 got 1.3207 and 1.3469. While LRP1 consists of <inline-formula> <tex-math notation=""LaTeX"">$\epsilon $ </tex-math></inline-formula>-rules for input, convolutional, and fully-connected layers, LRP3 adopts a bounded-rule for an input layer and the same <inline-formula> <tex-math notation=""LaTeX"">$\epsilon $ </tex-math></inline-formula>-rules for other layers as LRP1. The consistency of evaluation results of HAAS and AOPC has been compared by means of Kullback-Leibler divergence, ensuring that HAAS is the more robust evaluation method than AOPC independently of datasets since HAAS has much lower average divergence of 0.0251 than AOPC of 0.3048. In addition, the validity of the proposed HAAS scheme is further investigated through the inverted HA test that employs inverted HA images made up with inverted heatmap scores and estimates the accuracy degradation caused by applying them to the network. The XAI algorithms with largest <inline-formula> <tex-math notation=""LaTeX"">$HAAS$ </tex-math></inline-formula> results experience biggest accuracy degradation in the inverted HA test.","",""
0,"Nuno Calaim, F. Dehmelt, P. J. Gonçalves, Christian K. Machens","The geometry of robustness in spiking neural networks.",2022,"","","","",17,"2022-07-13 10:07:43","","10.7554/eLife.73276","","",,,,,0,0.00,0,4,1,"Neural systems are remarkably robust against various perturbations, a phenomenon that still requires a clear explanation. Here, we graphically illustrate howneural networks can become robust. We study spiking networks that generate low-dimensional representations, and we show that the neurons; subthreshold voltages are confined to a convex region in a lower-dimensional voltage subspace, which we call a 'bounding box'. Any changes in network parameters (such as number of neurons, dimensionality of inputs, firing thresholds, synapticweights, or transmission delays) can all be understood as deformations of this bounding box. Using these insights, we showthat functionality is preserved as long as perturbations do not destroy the integrity of the bounding box. We suggest that the principles underlying robustness in these networks-low-dimensional representations, heterogeneity of tuning, and precise negative feedback-may be key to understanding the robustness of neural systems at the circuit level.","",""
7,"Laura Rieger, L. K. Hansen","Aggregating explainability methods for neural networks stabilizes explanations",2019,"","","","",18,"2022-07-13 10:07:43","","","","",,,,,7,2.33,4,2,3,"Despite a growing literature on explaining neural networks, no consensus has been reached on how to explain a neural network decision or how to evaluate an explanation. In fact, most works rely on manually assessing the explanation to evaluate the quality of a method. This injects uncertainty in the explanation process along several dimensions: Which explanation method to apply? Who should we ask to evaluate it and which criteria should be used for the evaluation? Our contributions in this paper are twofold. First, we investigate schemes to combine explanation methods and reduce model uncertainty to obtain a single aggregated explanation. Our findings show that the aggregation is more robust, well-aligned with human explanations and can attribute relevance to a broader set of features (completeness). Second, we propose a novel way of evaluating explanation methods that circumvents the need for manual evaluation and is not reliant on the alignment of neural networks and humans decision processes.","",""
