Cites,Authors,Title,Year,Source,Publisher,ArticleURL,CitesURL,GSRank,QueryDate,Type,DOI,ISSN,CitationURL,Volume,Issue,StartPage,EndPage,ECC,CitesPerYear,CitesPerAuthor,AuthorCount,Age,Abstract,FullTextURL,RelatedURL
93,"W. Yeh","New Parameter-Free Simplified Swarm Optimization for Artificial Neural Network Training and its Application in the Prediction of Time Series",2013,"","","","",142,"2022-07-13 10:07:43","","10.1109/TNNLS.2012.2232678","","",,,,,93,10.33,93,1,9,"A new soft computing method called the parameter-free simplified swarm optimization (SSO)-based artificial neural network (ANN), or improved SSO for short, is proposed to adjust the weights in ANNs. The method is a modification of the SSO, and seeks to overcome some of the drawbacks of SSO. In the experiments, the iSSO is compared with five other famous soft computing methods, including the backpropagation algorithm, the genetic algorithm, the particle swarm optimization (PSO) algorithm, cooperative random learning PSO, and the SSO, and its performance is tested on five famous time-series benchmark data to adjust the weights of two ANN models (multilayer perceptron and single multiplicative neuron model). The experimental results demonstrate that iSSO is robust and more efficient than the other five algorithms.","",""
0,"Fei Wang","The Evaluation of Public Opinion in the Internet Using Optimized Neural Network and Genetic Algorithm",2016,"","","","",143,"2022-07-13 10:07:43","","10.14257/ASTL.2016.121.11","","",,,,,0,0.00,0,1,6,"Over the past era of time, with the bursting interaction and propagation of the Internet information, collecting emerging plenty of internet information and fining out the hot topic of network public opinion becomes a hotspot research branch. In the paper, we propose a novel model and prototype aiming at evaluating internet public opinions based on neural network (NN). Firstly, a novel evaluation indicator system is proposed and designed based on the characteristics analysis of internet public opinions. Later, we propose a novel evaluation model for the public opinion analysis, the detailed steps are discussed. Finally, we conduct experiment to test the robustness and effectiveness of our proposed methodology with detailed explanation.","",""
65,"S. Thrun, Tom Michael Mitchell","Integrating Inductive Neural Network Learning and Explanation-Based Learning",1993,"","","","",144,"2022-07-13 10:07:43","","","","",,,,,65,2.24,33,2,29,"Many researchers have noted the importance of combining inductive and analytical learning, yet we still lack combined learning methods that are effective in practice. We present here a learning method that combines explanation-based learning from a previously learned approximate domain theory, together with inductive learning from observations. This method, called explanation-based neural network learning (EBNN), is based on a neural network representation of domain knowledge. Explanations are constructed by chaining together inferences from multiple neural networks. In contrast with symbolic approaches to explanation-based learning which extract weakest preconditions from the explanation, EBNN extracts the derivatives of the target concept with respect to the training example features. These derivatives summarize the dependencies within the explanation, and are used to bias the inductive learning of the target concept. Experimental results on a simulated robot control task show that EBNN requires significantly fewer training examples than standard inductive learning. Furthermore, the method is shown to be robust to errors in the domain theory, operating effectively over a broad spectrum from very strong to very weak domain theories.","",""
32,"R. Eberhart","The role of genetic algorithms in neural network query-based learning and explanation facilities",1992,"","","","",145,"2022-07-13 10:07:43","","10.1109/COGANN.1992.273940","","",,,,,32,1.07,32,1,30,"Genetic algorithms are used as a means of achieving neural network inversion. Neural network inversion allows a user to find one or more neural network input patterns which yield a specific output. The input patterns obtained from the genetic algorithm can use in training partially-trained networks, as well as in the building of neural network system explanation facilities.<<ETX>>","",""
33,"S. Pierce, Y. Ben-Haim, K. Worden, G. Manson","Evaluation of Neural Network Robust Reliability Using Information-Gap Theory",2006,"","","","",146,"2022-07-13 10:07:43","","10.1109/TNN.2006.880363","","",,,,,33,2.06,8,4,16,"A novel technique for the evaluation of neural network robustness against uncertainty using a nonprobabilistic approach is presented. Conventional optimization techniques were employed to train multilayer perceptron (MLP) networks, which were then probed with an uncertainty analysis using an information-gap model to quantify the network response to uncertainty in the input data. It is demonstrated that the best performing network on data with low uncertainty is not in general the optimal network on data with a higher degree of input uncertainty. Using the concepts of information-gap theory, this paper develops a theoretical framework for information-gap uncertainty applied to neural networks, and explores the practical application of the procedure to three sample cases. The first consists of a simple two-dimensional (2-D) classification network operating on a known Gaussian distribution, the second a nine-lass vibration classification problem from an aircraft wing, and the third a two-class example from a database of breast cancer incidence","",""
52,"Zhixia Ding, Z. Zeng, Leimin Wang","Robust Finite-Time Stabilization of Fractional-Order Neural Networks With Discontinuous and Continuous Activation Functions Under Uncertainty",2018,"","","","",147,"2022-07-13 10:07:43","","10.1109/TNNLS.2017.2675442","","",,,,,52,13.00,17,3,4,"This paper is concerned with robust finite-time stabilization for a class of fractional-order neural networks (FNNs) with two types of activation functions (i.e., discontinuous and continuous activation function) under uncertainty. It is worth noting that there exist few results about FNNs with discontinuous activation functions, which is mainly because classical solutions and theories of differential equations cannot be applied in this case. Especially, there is no relevant finite-time stabilization research for such system, and this paper makes up for the gap. The existence of global solution under the framework of Filippov for such system is guaranteed by limiting discontinuous activation functions. According to set-valued analysis and Kakutani’s fixed point theorem, we obtain the existence of equilibrium point. In particular, based on differential inclusion theory and fractional Lyapunov stability theory, several new sufficient conditions are given to ensure finite-time stabilization via a novel discontinuous controller, and the upper bound of the settling time for stabilization is estimated. In addition, we analyze the finite-time stabilization of FNNs with Lipschitz-continuous activation functions under uncertainty. The results of this paper improve corresponding ones of integer-order neural networks with discontinuous and continuous activation functions. Finally, three numerical examples are given to show the effectiveness of the theoretical results.","",""
33,"G. Rovithakis","Robust redesign of a neural network controller in the presence of unmodeled dynamics",2004,"","","","",148,"2022-07-13 10:07:43","","10.1109/TNN.2004.837782","","",,,,,33,1.83,33,1,18,"This work presents a neural network control redesign, which achieves robust stabilization in the presence of unmodeled dynamics restricted to be input to output practically stable (IOpS), without requiring any prior knowledge on any bounding function. Moreover, the state of the unmodeled dynamics is permitted to go unbounded provided that the nominal system state and/or the control input also go unbounded. The neural network controller is equipped with a resetting strategy to deal with the problem of possible division by zero, which may appear since we consider unknown input vector fields with unknown signs. The uniform ultimate boundedness of the system output to an arbitrarily small set, plus the boundedness of all other signals in the closed-loop is guaranteed.","",""
15,"J. Hopfield","Understanding Emergent Dynamics: Using a Collective Activity Coordinate of a Neural Network to Recognize Time-Varying Patterns",2015,"","","","",149,"2022-07-13 10:07:43","","10.1162/NECO_a_00768","","",,,,,15,2.14,15,1,7,"Abstract In higher animals, complex and robust behaviors are produced by the microscopic details of large structured ensembles of neurons. I describe how the emergent computational dynamics of a biologically based neural network generates a robust natural solution to the problem of categorizing time-varying stimulus patterns such as spoken words or animal stereotypical behaviors. The recognition of these patterns is made difficult by their substantial variation in cadence and duration. The neural circuit behaviors used are similar to those associated with brain neural integrators. In the larger context described here, this kind of circuit becomes a building block of an entirely different computational algorithm for solving complex problems. While the network behavior is simulated in detail, a collective view is essential to understanding the results. A closed equation of motion for the collective variable describes an algorithm that quantitatively accounts for many aspects of the emergent network computation. The feedback connections and ongoing activity in the network shape the collective dynamics onto a reduced dimensionality manifold of activity space, which defines the algorithm and computation actually performed. The external inputs are weak and are not the dominant drivers of network activity.","",""
7,"Guangyao Chen, Peixi Peng, Li Ma, Jia Li, Lin Du, Yonghong Tian","Amplitude-Phase Recombination: Rethinking Robustness of Convolutional Neural Networks in Frequency Domain",2021,"","","","",150,"2022-07-13 10:07:43","","10.1109/iccv48922.2021.00051","","",,,,,7,7.00,1,6,1,"Recently, the generalization behavior of Convolutional Neural Networks (CNN) is gradually transparent through explanation techniques with the frequency components decomposition. However, the importance of the phase spectrum of the image for a robust vision system is still ignored. In this paper, we notice that the CNN tends to converge at the local optimum which is closely related to the high-frequency components of the training images, while the amplitude spectrum is easily disturbed such as noises or common corruptions. In contrast, more empirical studies found that humans rely on more phase components to achieve robust recognition. This observation leads to more explanations of the CNN’s generalization behaviors in both robustness to common perturbations and out-of-distribution detection, and motivates a new perspective on data augmentation designed by re-combing the phase spectrum of the current image and the amplitude spectrum of the distracter image. That is, the generated samples force the CNN to pay more attention to the structured information from phase components and keep robust to the variation of the amplitude. Experiments on several image datasets indicate that the proposed method achieves state-of-the-art performances on multiple generalizations and calibration tasks, including adaptability for common corruptions and surface variations, out-of-distribution detection, and adversarial attack. The code is released on github/iCGY96/APR.","",""
41,"M. Matsugu, Katsuhiko Mori, Mie Ishii, Y. Mitarai","Convolutional spiking neural network model for robust face detection",2002,"","","","",151,"2022-07-13 10:07:43","","10.1109/ICONIP.2002.1198140","","",,,,,41,2.05,10,4,20,"We propose a convolutional spiking neural network (CSNN) model with population coding for robust face detection. The basic structure of the network includes hierarchically alternating layers for feature detection and feature pooling. The proposed model implements hierarchical template matching by temporal integration of structured pulse packet. The packet signal represents some intermediate or complex visual feature (e.g., a pair of line segments, corners, eye, nose, etc.) that constitutes a face model. The output pulse of a feature pooling neuron represents some local feature (e.g., line segments). Introducing a population coding scheme in the CSNN architecture, we show how the biologically inspired model attains invariance to changes in size and position of face and ensures the efficiency of face detection.","",""
37,"Weiwei Zhang, Y. Murphey, Tianyu Wang, Q. Xu","Driver yawning detection based on deep convolutional neural learning and robust nose tracking",2015,"","","","",152,"2022-07-13 10:07:43","","10.1109/IJCNN.2015.7280566","","",,,,,37,5.29,9,4,7,"Driver yawning detection is one of the key technologies used in driver fatigue monitoring systems. Real-time driver yawning detection is a very challenging problem due to the dynamics in driver's movements and lighting conditions. In this paper, we present a yawning detection system that consists of a face detector, a nose detector, a nose tracker and a yawning detector. Deep learning algorithms are developed for detecting driver face area and nose location. A nose tracking algorithm that combines Kalman filter with a dedicated open-source TLD (Track-Learning-Detection) tracker is developed to generate robust tracking results under dynamic driving conditions. Finally a neural network is developed for yawning detection based on the features including nose tracking confidence value, gradient features around corners of mouth and face motion features. Experiments are conducted on real-world driving data, and results show that the deep convolutional networks can generate a satisfactory classification result for detecting driver's face and nose when compared with other pattern classification methods, and the proposed yawning detection system is effective in real-time detection of driver's yawning states.","",""
158,"A. Vemuri, M. Polycarpou","Neural-network-based robust fault diagnosis in robotic systems",1997,"","","","",153,"2022-07-13 10:07:43","","10.1109/72.641464","","",,,,,158,6.32,79,2,25,"Fault diagnosis plays an important role in the operation of modern robotic systems. A number of researchers have proposed fault diagnosis architectures for robotic manipulators using the model-based analytical redundancy approach. One of the key issues in the design of such fault diagnosis schemes is the effect of modeling uncertainties on their performance. This paper investigates the problem of fault diagnosis in rigid-link robotic manipulators with modeling uncertainties. A learning architecture with sigmoidal neural networks is used to monitor the robotic system for any off-nominal behavior due to faults. The robustness and stability properties of the fault diagnosis scheme are rigorously established. Simulation examples are presented to illustrate the ability of the neural-network-based robust fault diagnosis scheme to detect and accommodate faults in a two-link robotic manipulator.","",""
60,"Z. Man, X. Yu, K. Eshraghian, M. Palaniswami","A robust adaptive sliding mode tracking control using an RBF neural network for robotic manipulators",1995,"","","","",154,"2022-07-13 10:07:43","","10.1109/ICNN.1995.487738","","",,,,,60,2.22,15,4,27,"A new robust adaptive sliding mode tracking control scheme using an RBF neural network is proposed for rigid robotic manipulators to achieve robustness and asymptotic error convergence. A key feature of this scheme is that the prior knowledge of the upper bound of the system uncertainties is not required. An adaptive RBF neural network is used to learn the upper bound of system uncertainties. The output of the neural network is then used as a compensator parameter in the sense that the effects of the system uncertainties can be eliminated and asymptotic error convergence can be obtained for the closed loop robotic control system.","",""
92,"N. Punn, Sonali Agarwal","Automated diagnosis of COVID-19 with limited posteroanterior chest X-ray images using fine-tuned deep neural networks",2020,"","","","",155,"2022-07-13 10:07:43","","10.1007/s10489-020-01900-3","","",,,,,92,46.00,46,2,2,"","",""
24,"T. Chuah, B. Sharif, O. Hinton","Robust CDMA multiuser detection using a neural-network approach",2002,"","","","",156,"2022-07-13 10:07:43","","10.1109/TNN.2002.804310","","",,,,,24,1.20,8,3,20,"Abstract-Recently, a robust version of the linear decorrelating detector (LDD) based on the Huber's M-estimation technique has been proposed. In this paper, we first demonstrate the use of a three-layer recurrent neural network (RNN) to implement the LDD without requiring matrix inversion. The key idea is based on minimizing an appropriate computational energy function iteratively. Second, it will be shown that the M-decorrelating detector (MDD) can be implemented by simply incorporating sigmoidal neurons in the first layer of the RNN. A proof of the redundancy of the matrix inversion process is provided and the computational saving in realistic network is highlighted. Third, we illustrate how further performance gain could be achieved for the subspace-based blind MDD by using robust estimates of the signal subspace components in the initial stage. The impulsive noise is modeled using non-Gaussian alpha-stable distributions, which do not include a Gaussian component but facilitate the use of the recently proposed geometric signal-to-noise ratio (G-SNR). The characteristics and performance of the proposed neural-network detectors are investigated by computer simulation.","",""
20,"Ke-wei Ding, N. Huang","Global Robust Exponential Stability of Interval General BAM Neural Network with Delays",2006,"","","","",157,"2022-07-13 10:07:43","","10.1007/s11063-005-5090-5","","",,,,,20,1.25,10,2,16,"","",""
149,"Songwu Lu, T. Başar","Robust nonlinear system identification using neural-network models",1998,"","","","",158,"2022-07-13 10:07:43","","10.1109/72.668883","","",,,,,149,6.21,75,2,24,"We study the problem of identification for nonlinear systems in the presence of unknown driving noise, using both feedforward multilayer neural network and radial basis function network models. Our objective is to resolve the difficulty associated with the persistency of excitation condition inherent to the standard schemes in the neural identification literature. This difficulty is circumvented here by a novel formulation and by using a new class of identification algorithms recently obtained by Didinsky et al. We show how these algorithms can be exploited to successfully identify the nonlinearity in the system using neural-network models. By embedding the original problem in one with noise-perturbed state measurements, we present a class of identifiers (under L1 and L2 cost criteria) which secure a good approximant for the system nonlinearity provided that some global optimization technique is used. In this respect, many available learning algorithms in the current neural-network literature, e.g., the backpropagation scheme and the genetic algorithms-based scheme, with slight modifications, can ensure the identification of the system nonlinearity. Subsequently, we address the same problem under a third, worst case L(infinity) criterion for an RBF modeling. We present a neural-network version of an H(infinity)-based identification algorithm from Didinsky et al and show how, along with an appropriate choice of control input to enhance excitation, under both full-state-derivative information (FSDI) and noise-perturbed full-state-information (NPFSI), it leads to satisfaction of a relevant persistency of excitation condition, and thereby to robust identification of the nonlinearity. Results from several simulation studies have been included to demonstrate the effectiveness of these algorithms.","",""
490,"M. Matsugu, Katsuhiko Mori, Y. Mitari, Yuji Kaneda","Subject independent facial expression recognition with robust face detection using a convolutional neural network",2003,"","","","",159,"2022-07-13 10:07:43","","10.1016/S0893-6080(03)00115-1","","",,,,,490,25.79,123,4,19,"","",""
147,"K. Liano","Robust error measure for supervised neural network learning with outliers",1996,"","","","",160,"2022-07-13 10:07:43","","10.1109/72.478411","","",,,,,147,5.65,147,1,26,"Most supervised neural networks (NNs) are trained by minimizing the mean squared error (MSE) of the training set. In the presence of outliers, the resulting NN model can differ significantly from the underlying system that generates the data. Two different approaches are used to study the mechanism by which outliers affect the resulting models: influence function and maximum likelihood. The mean log squared error (MLSE) is proposed as the error criteria that can be easily adapted by most supervised learning algorithms. Simulation results indicate that the proposed method is robust against outliers.","",""
112,"Zheng Yan, Jun Wang","Robust Model Predictive Control of Nonlinear Systems With Unmodeled Dynamics and Bounded Uncertainties Based on Neural Networks",2014,"","","","",161,"2022-07-13 10:07:43","","10.1109/TNNLS.2013.2275948","","",,,,,112,14.00,56,2,8,"This paper presents a neural network approach to robust model predictive control (MPC) for constrained discrete-time nonlinear systems with unmodeled dynamics affected by bounded uncertainties. The exact nonlinear model of underlying process is not precisely known, but a partially known nominal model is available. This partially known nonlinear model is first decomposed to an affine term plus an unknown high-order term via Jacobian linearization. The linearization residue combined with unmodeled dynamics is then modeled using an extreme learning machine via supervised learning. The minimax methodology is exploited to deal with bounded uncertainties. The minimax optimization problem is reformulated as a convex minimization problem and is iteratively solved by a two-layer recurrent neural network. The proposed neurodynamic approach to nonlinear MPC improves the computational efficiency and sheds a light for real-time implementability of MPC technology. Simulation results are provided to substantiate the effectiveness and characteristics of the proposed approach.","",""
12,"E. Voudouri-Maniati, L. Kurz, J. Kowalski","A neural-network approach to nonparametric and robust classification procedures",1997,"","","","",162,"2022-07-13 10:07:43","","10.1109/72.557667","","",,,,,12,0.48,4,3,25,"In this paper algorithms of neural-network type are introduced for solving estimation and classification problems when assumptions about independence, Gaussianity, and stationarity of the observation samples are no longer valid. Specifically, the asymptotic normality of several nonparametric classification tests is demonstrated and their implementation using a neural-network approach is presented. Initially, the neural nets train themselves via learning samples for nominal noise and alternative hypotheses distributions resulting in near optimum performance in a particular stochastic environment. In other than the nominal environments, however, high efficiency is maintained by adapting the optimum nonlinearities to changing conditions during operation via parallel networks, without disturbing the classification process. Furthermore, the superiority in performance of the proposed networks over more traditional neural nets is demonstrated in an application involving pattern recognition.","",""
54,"M. Pezeshki, Sekouba Kaba, Y. Bengio, Aaron C. Courville, Doina Precup, Guillaume Lajoie","Gradient Starvation: A Learning Proclivity in Neural Networks",2020,"","","","",163,"2022-07-13 10:07:43","","","","",,,,,54,27.00,9,6,2,"We identify and formalize a fundamental gradient descent phenomenon resulting in a learning proclivity in over-parameterized neural networks. Gradient Starvation arises when cross-entropy loss is minimized by capturing only a subset of features relevant for the task, despite the presence of other predictive features that fail to be discovered. This work provides a theoretical explanation for the emergence of such feature imbalance in neural networks. Using tools from Dynamical Systems theory, we identify simple properties of learning dynamics during gradient descent that lead to this imbalance, and prove that such a situation can be expected given certain statistical structure in training data. Based on our proposed formalism, we develop guarantees for a novel regularization method aimed at decoupling feature learning dynamics, improving accuracy and robustness in cases hindered by gradient starvation. We illustrate our findings with simple and real-world out-of-distribution (OOD) generalization experiments.","",""
