Cites,Authors,Title,Year,Source,Publisher,ArticleURL,CitesURL,GSRank,QueryDate,Type,DOI,ISSN,CitationURL,Volume,Issue,StartPage,EndPage,ECC,CitesPerYear,CitesPerAuthor,AuthorCount,Age,Abstract,FullTextURL,RelatedURL
6,"R. Nayak","GYAN: A methodology for rule extraction from artificial neural networks",1999,"","","","",38,"2022-07-13 10:07:43","","","","",,,,,6,0.26,6,1,23,"Artificial neural network (ANN) learning methods provide a robust and non-linear approach to approximating the target function for many classification, regression and clustering problems. ANNs have demonstrated good predictive performance in a wide variety of practical problems. However, there are strong arguments as to why ANNs are not sufficient for the general representation of knowledge. The arguments are the poor comprehensibility of the learned ANN, and the inability to represent explanation structures.    The overall objective of this thesis is to address these issues by: (1) explanation of the decision process in ANNs in the form of symbolic rules (predicate rules with variables); and (2) provision of explanatory capability by mapping the general conceptual knowledge that is learned by the neural networks into a knowledge base to be used in a rule-based reasoning system.    A multi-stage methodology GYAN is developed and evaluated for the task of extracting knowledge from the trained ANNs. The extracted knowledge is represented in the form of restricted first-order logic rules, and subsequently allows user interaction by interfacing with a knowledge based reasoner. The performance of GYAN is demonstrated using a number of real world and artificial data sets. The empirical results demonstrate that: (1) an equivalent symbolic interpretation is derived describing the overall behaviour of the ANN with high accuracy and fidelity, and (2) a concise explanation is given (in terms of rules, facts and predicates activated in a reasoning episode) as to why a particular instance is being classified into a certain category.","",""
0,"S. Sahu, Rakesh Tripathi, Sanjay Kumar","Fundamental Techniques of Soft Computing",2017,"","","","",39,"2022-07-13 10:07:43","","","","",,,,,0,0.00,0,3,5,"This Book deals with basics and fundamental concepts and techniques of Soft Computing under the heading of Artificial Neural Network (ANN), Fuzzy Logic (FL) and Genetic Algorithms (GA) or Evolutionary Computing (EC). The subject covers the tools and methods to deal with the problems under uncertainty, imprecision, partial or incomplete information and offers the approximation to achieve the robust, low cost and optimal solution.The major objective of these components are learning or training of pattern, to work with inaccurate and partial truth information for the development of control system and to achieve the optimized solution. The salient features of the book are: i. Soft Computing fundamentals and concepts. ii. Explanation and Study of on various Neural Networks models and algorithms. iii. Description of Fuzzy Sets and Fuzzy Systems. iv. Overview of Genetic Algorithms and its applications. v. Discussions on problems for ANNs, FL and GAs.","",""
0,"A. Chella, R. Pirrone","A multilayer feedforward network for model estimation from range data",2002,"","","","",40,"2022-07-13 10:07:43","","10.1109/IJCNN.2002.1007692","","",,,,,0,0.00,0,2,20,"A novel neural architecture aimed to estimate superquadrics parameters form range data is presented. The network topology is designed to model and compute the inside-outside function of an undeformed superquadric in whatever attitude, starting from the (x,y,z) data triples. The network has been trained using backpropagation, and the weights arrangement, after training, represents a robust estimate of the superquadric parameters. The architectural approach is general, it can be extended to other geometric primitives for part-based object recognition, and performs faster than classical model fitting techniques. Detailed explanation of the theoretical approach, along with some experiments with real data, are reported.","",""
0,"D. Ingole, K. Kulat, M. D. Ingole","Application of Wavelet Analysis in Detection of Fault Diagnosis of Heart",2009,"","","","",41,"2022-07-13 10:07:43","","","","",,,,,0,0.00,0,3,13,"The ECG waveform is a non-stationary signal, and its variation can contain indicators of current disease or warnings about impending cardiac diseases. In this paper, we have evaluated wavelet transform (WT) based detector of ECG. Dyadic wavelet transform (DyWT) was used as prototype wavelet, which is robust to time varying & noise. It includes noise purification, sample design of digital ECG. This method can implement ECG report in real time and provide exact explanation for diagnostic decision obtained. We exemplify the performance of the DyWT based PQRST detector by considering problematic ECG signal from MIT-BIH database. From the results we observed that DyWT based detector exhibited superior performance compared to standard techniques. The paper deals with the classification of cardiac rhythms using an artificial neural network (ANN) for the use of fault diagnosis of heart..","",""
5,"G. Szirtes, Z. Palotai, A. Lorincz","Emergence of scale-free properties in Hebbian networks",2003,"","","","",42,"2022-07-13 10:07:43","","","","",,,,,5,0.26,2,3,19,"The fundamental `plasticity' of the nervous system (i.e high adaptability at different structural levels) is primarily based on Hebbian learning mechanisms that modify the synaptic connections. The modifications rely on neural activity and assign a special dynamic behavior to the neural networks. Another striking feature of the nervous system is that spike based information transmission, which is supposed to be robust against noise, is noisy in itself: the variance of the spiking of the individual neurons is surprisingly large which may deteriorate the adequate functioning of the Hebbian mechanisms. In this paper we focus on networks in which Hebbian-like adaptation is induced only by external random noise and study spike-timing dependent synaptic plasticity. We show that such `HebbNets' are able to develop a broad range of network structures, including scale-free small-world networks. The development of such network structures may provide an explanation of the role of noise and its interplay with Hebbian plasticity. We also argue that this model can be seen as a unification of the famous Watts-Strogatz and preferential attachment models of small-world nets.","",""
63,"Nina Pörner, Hinrich Schütze, Benjamin Roth","Evaluating neural network explanation methods using hybrid documents and morphosyntactic agreement",2018,"","","","",43,"2022-07-13 10:07:43","","10.18653/v1/P18-1032","","",,,,,63,15.75,21,3,4,"The behavior of deep neural networks (DNNs) is hard to understand. This makes it necessary to explore post hoc explanation methods. We conduct the first comprehensive evaluation of explanation methods for NLP. To this end, we design two novel evaluation paradigms that cover two important classes of NLP problems: small context and large context problems. Both paradigms require no manual annotation and are therefore broadly applicable. We also introduce LIMSSE, an explanation method inspired by LIME that is designed for NLP. We show empirically that LIMSSE, LRP and DeepLIFT are the most effective explanation methods and recommend them for explaining DNNs in NLP.","",""
16,"Ce Zhang, Young-Keun Kim, A. Eskandarian","EEG-inception: an accurate and robust end-to-end neural network for EEG-based motor imagery classification",2021,"","","","",44,"2022-07-13 10:07:43","","10.1088/1741-2552/abed81","","",,,,,16,16.00,5,3,1,"Objective. Classification of electroencephalography (EEG)-based motor imagery (MI) is a crucial non-invasive application in brain–computer interface (BCI) research. This paper proposes a novel convolutional neural network (CNN) architecture for accurate and robust EEG-based MI classification that outperforms the state-of-the-art methods. Approach. The proposed CNN model, namely EEG-inception, is built on the backbone of the inception-time network, which has showed to be highly efficient and accurate for time-series classification. Also, the proposed network is an end-to-end classification, as it takes the raw EEG signals as the input and does not require complex EEG signal-preprocessing. Furthermore, this paper proposes a novel data augmentation method for EEG signals to enhance the accuracy, at least by 3%, and reduce overfitting with limited BCI datasets. Main results. The proposed model outperforms all state-of-the-art methods by achieving the average accuracy of 88.4% and 88.6% on the 2008 BCI Competition IV 2a (four-classes) and 2b datasets (binary-classes), respectively. Furthermore, it takes less than 0.025 s to test a sample suitable for real-time processing. Moreover, the classification standard deviation for nine different subjects achieves the lowest value of 5.5 for the 2b dataset and 7.1 for the 2a dataset, which validates that the proposed method is highly robust. Significance. From the experiment results, it can be inferred that the EEG-inception network exhibits a strong potential as a subject-independent classifier for EEG-based MI tasks.","",""
22,"Hantao Huang, Jingye Zhou, Qingxun Di, Jiawei Zhou, Jiawang Li","Robust neural network–based tracking control and stabilization of a wheeled mobile robot with input saturation",2018,"","","","",45,"2022-07-13 10:07:43","","10.1002/rnc.4396","","",,,,,22,5.50,4,5,4,"This paper presents a robust neural network–based control scheme to deal with the problem of tracking and stabilization simultaneously for a wheeled mobile robot subject to parametric uncertainties, external disturbances, and input saturation. At first, a new error‐state transformation scheme is designed by introducing some auxiliary variables as an additional virtual control signals to reduce the adverse effect caused by the underactuation. These variables can change their structures for different desired trajectories to be tracked. Then, a robust control law is proposed combining with a kinematic controller and a dynamic controller, while a three‐layer neural network system is applied to approximate model uncertainties. Stability analysis via the Lyapunov theory shows that the proposed controller can make tracking errors converge to bounded neighborhoods of the origin. Finally, some simulation results are illustrated to verify the effectiveness of the proposed control strategy.","",""
84,"E. Saad, D. Wunsch","Neural network explanation using inversion",2007,"","","","",46,"2022-07-13 10:07:43","","10.1016/j.neunet.2006.07.005","","",,,,,84,5.60,42,2,15,"","",""
18,"R. Eberhart, R. W. Dobbins","Designing neural network explanation facilities using genetic algorithms",1991,"","","","",47,"2022-07-13 10:07:43","","10.1109/IJCNN.1991.170682","","",,,,,18,0.58,9,2,31,"The authors describe the use of genetic algorithms to provide components of explanation facilities for neural network applications. The genetic algorithm implementation, Genesis, uses a trained backpropagation neural network weight matrix as the genetic algorithm fitness function. Using different combinations of Genesis' run-time options, codebook vectors and decision surfaces are defined for the trained neural network. These vectors and surfaces can then be used as components of a facility that explains how the network is trained, and how it differentiates between classes. Two examples of this methodology are presented and briefly discussed. The first is a network trained to solve the XOR problem. The second is a network trained to diagnose appendicitis.<<ETX>>","",""
11,"H. Suleman, A. Maulud, Z. Man","Reconciliation of outliers in CO2-alkanolamine-H2O datasets by robust neural network winsorization",2017,"","","","",48,"2022-07-13 10:07:43","","10.1007/s00521-016-2213-z","","",,,,,11,2.20,4,3,5,"","",""
40,"Ding Wang, Derong Liu, C. Mu, Yun Zhang","Neural Network Learning and Robust Stabilization of Nonlinear Systems With Dynamic Uncertainties",2018,"","","","",49,"2022-07-13 10:07:43","","10.1109/TNNLS.2017.2749641","","",,,,,40,10.00,10,4,4,"Due to the existence of dynamical uncertainties, it is important to pay attention to the robustness of nonlinear control systems, especially when designing adaptive critic control strategies. In this paper, based on the neural network learning component, the robust stabilization scheme of nonlinear systems with general uncertainties is developed. Through system transformation and employing adaptive critic technique, the approximate optimal controller of the nominal plant can be applied to accomplish robust stabilization for the original uncertain dynamics. The neural network weight vector is very convenient to initialize by virtue of the improved critic learning formulation. Under the action of the approximate optimal control law, the stability issues for the closed-loop form of nominal and uncertain plants are analyzed, respectively. Simulation illustrations via a typical nonlinear system and a practical power system are included to verify the control performance.","",""
40,"Lei Liu, Zhanshan Wang, Huaguang Zhang","Neural-Network-Based Robust Optimal Tracking Control for MIMO Discrete-Time Systems With Unknown Uncertainty Using Adaptive Critic Design",2018,"","","","",50,"2022-07-13 10:07:43","","10.1109/TNNLS.2017.2660070","","",,,,,40,10.00,13,3,4,"This paper is concerned with the robust optimal tracking control strategy for a class of nonlinear multi-input multi-output discrete-time systems with unknown uncertainty via adaptive critic design (ACD) scheme. The main purpose is to establish an adaptive actor-critic control method, so that the cost function in the procedure of dealing with uncertainty is minimum and the closed-loop system is stable. Based on the neural network approximator, an action network is applied to generate the optimal control signal and a critic network is used to approximate the cost function, respectively. In contrast to the previous methods, the main features of this paper are: 1) the ACD scheme is integrated into the controllers to cope with the uncertainty and 2) a novel cost function, which is not in quadric form, is proposed so that the total cost in the design procedure is reduced. It is proved that the optimal control signals and the tracking errors are uniformly ultimately bounded even when the uncertainty exists. Finally, a numerical simulation is developed to show the effectiveness of the present approach.","",""
24,"G. Rajchakit, R. Sriraman","Robust Passivity and Stability Analysis of Uncertain Complex-Valued Impulsive Neural Networks with Time-Varying Delays",2021,"","","","",51,"2022-07-13 10:07:43","","10.1007/s11063-020-10401-w","","",,,,,24,24.00,12,2,1,"","",""
18,"M. Witczak, M. Mrugalski, J. Korbicz","Towards Robust Neural-Network-Based Sensor and Actuator Fault Diagnosis: Application to a Tunnel Furnace",2015,"","","","",52,"2022-07-13 10:07:43","","10.1007/s11063-014-9387-0","","",,,,,18,2.57,6,3,7,"","",""
30,"Ding Wang, Derong Liu, Yun Zhang, Hongyi Li","Neural network robust tracking control with adaptive critic framework for uncertain nonlinear systems",2018,"","","","",53,"2022-07-13 10:07:43","","10.1016/j.neunet.2017.09.005","","",,,,,30,7.50,8,4,4,"","",""
14,"Hui Zhao, Lixiang Li, Haipeng Peng, J. Kurths, Jinghua Xiao, Yixian Yang","Finite-Time Robust Synchronization of Memrisive Neural Network with Perturbation",2017,"","","","",54,"2022-07-13 10:07:43","","10.1007/s11063-017-9664-9","","",,,,,14,2.80,2,6,5,"","",""
13,"K. Sim, Y. Qian, G. Mantena, Lahiru Samarakoon, Souvik Kundu, T. Tan","Adaptation of Deep Neural Network Acoustic Models for Robust Automatic Speech Recognition",2017,"","","","",55,"2022-07-13 10:07:43","","10.1007/978-3-319-64680-0_9","","",,,,,13,2.60,2,6,5,"","",""
24,"S. Tortora, S. Ghidoni, C. Chisari, S. Micera, F. Artoni","Deep learning-based BCI for gait decoding from EEG with LSTM recurrent neural network.",2020,"","","","",56,"2022-07-13 10:07:43","","10.1088/1741-2552/ab9842","","",,,,,24,12.00,5,5,2,"OBJECTIVE Mobile Brain/Body Imaging (MoBI) frameworks allowed the research community to find evidence of cortical involvement at walking initiation and during locomotion. However, the decoding of gait patterns from brain signals remains an open challenge. The aim of this work is to propose and validate a deep learning model to decode gait phases from Electroenchephalography (EEG).   APPROACH A Long-Short Term Memory (LSTM) deep neural network has been trained to deal with time-dependent information within brain signals during locomotion. The EEG signals have been preprocessed by means of Artifacts Subspace Reconstruction (ASR) and Reliable Independent Component Analysis (RELICA) to ensure that classification performance was not affected by movement-related artifacts.   MAIN RESULT The network was evaluated on the dataset of 11 healthy subjects walking on a treadmill. The proposed decoding approach shows a robust reconstruction (AUC>90%) of gait patterns (i.e., swing and stance states) of both legs together, or of each leg independently.   SIGNIFICANCE Our results support for the first time the use of a memory-based deep learning classifier to decode walking activity from non-invasive brain recordings. We suggest that this classifier, exploited in real time, can be a more effective input for devices restoring locomotion in impaired people.","",""
28,"U. Oparaji, R. Sheu, M. Bankhead, J. Austin, E. Patelli","Robust artificial neural network for reliability and sensitivity analyses of complex non-linear systems",2017,"","","","",57,"2022-07-13 10:07:43","","10.1016/j.neunet.2017.09.003","","",,,,,28,5.60,6,5,5,"","",""
36,"T. Roshni, M. Jha, J. Drisya","Neural network modeling for groundwater-level forecasting in coastal aquifers",2020,"","","","",58,"2022-07-13 10:07:43","","10.1007/s00521-020-04722-z","","",,,,,36,18.00,12,3,2,"","",""
37,"C. Pham, Yaonan Wang","Adaptive trajectory tracking neural network control with robust compensator for robot manipulators",2016,"","","","",59,"2022-07-13 10:07:43","","10.1007/s00521-015-1873-4","","",,,,,37,6.17,19,2,6,"","",""
36,"Lin Sun, Jiucheng Xu, Shangwang Liu, Shiguang Zhang, Yuan Li, Chang'an Shen","A robust image watermarking scheme using Arnold transform and BP neural network",2018,"","","","",60,"2022-07-13 10:07:43","","10.1007/s00521-016-2788-4","","",,,,,36,9.00,6,6,4,"","",""
68,"Qiang Yu, Rui Yan, Huajin Tang, K. Tan, Haizhou Li","A Spiking Neural Network System for Robust Sequence Recognition",2016,"","","","",61,"2022-07-13 10:07:43","","10.1109/TNNLS.2015.2416771","","",,,,,68,11.33,14,5,6,"This paper proposes a biologically plausible network architecture with spiking neurons for sequence recognition. This architecture is a unified and consistent system with functional parts of sensory encoding, learning, and decoding. This is the first systematic model attempting to reveal the neural mechanisms considering both the upstream and the downstream neurons together. The whole system is a consistent temporal framework, where the precise timing of spikes is employed for information processing and cognitive computing. Experimental results show that the system is competent to perform the sequence recognition, being robust to noisy sensory inputs and invariant to changes in the intervals between input stimuli within a certain range. The classification ability of the temporal learning rule used in the system is investigated through two benchmark tasks that outperform the other two widely used learning rules for classification. The results also demonstrate the computational power of spiking neurons over perceptrons for processing spatiotemporal patterns. In summary, the system provides a general way with spiking neurons to encode external stimuli into spatiotemporal spikes, to learn the encoded spike patterns with temporal learning rules, and to decode the sequence order with downstream neurons. The system structure would be beneficial for developments in both hardware and software.","",""
75,"Qinmin Yang, S. Jagannathan, Youxian Sun","Robust Integral of Neural Network and Error Sign Control of MIMO Nonlinear Systems",2015,"","","","",62,"2022-07-13 10:07:43","","10.1109/TNNLS.2015.2470175","","",,,,,75,10.71,25,3,7,"This paper presents a novel state-feedback control scheme for the tracking control of a class of multi-input multioutput continuous-time nonlinear systems with unknown dynamics and bounded disturbances. First, the control law consisting of the robust integral of a neural network (NN) output plus sign of the tracking error feedback multiplied with an adaptive gain is introduced. The NN in the control law learns the system dynamics in an online manner, while the NN residual reconstruction errors and the bounded disturbances are overcome by the error sign signal. Since both of the NN output and the error sign signal are included in the integral, the continuity of the control input is ensured. The controller structure and the NN weight update law are novel in contrast with the previous effort, and the semiglobal asymptotic tracking performance is still guaranteed by using the Lyapunov analysis. In addition, the NN weights and all other signals are proved to be bounded simultaneously. The proposed approach also relaxes the need for the upper bounds of certain terms, which are usually required in the previous designs. Finally, the theoretical results are substantiated with simulations.","",""
61,"Zhijun Li, Yuanqing Xia, C. Su, Jun Deng, Jun Fu, W. He","Missile Guidance Law Based on Robust Model Predictive Control Using Neural-Network Optimization",2015,"","","","",63,"2022-07-13 10:07:43","","10.1109/TNNLS.2014.2345734","","",,,,,61,8.71,10,6,7,"In this brief, the utilization of robust model-based predictive control is investigated for the problem of missile interception. Treating the target acceleration as a bounded disturbance, novel guidance law using model predictive control is developed by incorporating missile inside constraints. The combined model predictive approach could be transformed as a constrained quadratic programming (QP) problem, which may be solved using a linear variational inequality-based primal-dual neural network over a finite receding horizon. Online solutions to multiple parametric QP problems are used so that constrained optimal control decisions can be made in real time. Simulation studies are conducted to illustrate the effectiveness and performance of the proposed guidance control law for missile interception.","",""
25,"Guoyang Liu, Weidong Zhou, Minxing Geng","Automatic Seizure Detection Based on S-Transform and Deep Convolutional Neural Network",2020,"","","","",64,"2022-07-13 10:07:43","","10.1142/S0129065719500242","","",,,,,25,12.50,8,3,2,"Automatic seizure detection is significant for the diagnosis of epilepsy and reducing the massive workload of reviewing continuous EEGs. In this work, a novel approach, combining Stockwell transform (S-transform) with deep Convolutional Neural Networks (CNN), is proposed to detect seizure onsets in long-term intracranial EEG recordings. Primarily, raw EEG data is filtered with wavelet decomposition. Then, S-transform is used to obtain a proper time-frequency representation of each EEG segment. After that, a 15-layer deep CNN using dropout and batch normalization serves as a robust feature extractor and classifier. Finally, smoothing and collar technique are applied to the outputs of CNN to improve the detection accuracy and reduce the false detection rate (FDR). The segment-based and event-based evaluation assessments and receiver operating characteristic (ROC) curves are employed for the performance evaluation on a public EEG database containing 21 patients. A segment-based sensitivity of 97.01% and a specificity of 98.12% are yielded. For the event-based assessment, this method achieves a sensitivity of 95.45% with an FDR of 0.36/h.","",""
48,"P. D. Cuong, W. Nan","Adaptive trajectory tracking neural network control with robust compensator for robot manipulators",2016,"","","","",65,"2022-07-13 10:07:43","","10.1007/s00521-015-1873-4","","",,,,,48,8.00,24,2,6,"","",""
