Cites,Authors,Title,Year,Source,Publisher,ArticleURL,CitesURL,GSRank,QueryDate,Type,DOI,ISSN,CitationURL,Volume,Issue,StartPage,EndPage,ECC,CitesPerYear,CitesPerAuthor,AuthorCount,Age,Abstract,FullTextURL,RelatedURL
5,"Hongjun Wang, Guangrun Wang, Guanbin Li, Liang Lin","CamDrop: A New Explanation of Dropout and A Guided Regularization Method for Deep Neural Networks",2019,"","","","",87,"2022-07-13 10:07:43","","10.1145/3357384.3357999","","",,,,,5,1.67,1,4,3,"To force convolutional networks to explore more discriminative evidence throughout spatial regions, this paper presents a novel CamDrop to improve the conventional dropout in two aspects. First, by considering the intensity of class activation mapping (CAM) all around, CamDrop selectively abandons some specific spatial regions in predominating visual patterns at each iteration. In many classification tasks, CamDrop demonstrates its effectiveness and achieves considerable improvements on robust predictions for adversarial examples. Second, although dropout is a widely adopted technique that has been applied to regularize large models, the improvement in performance always attributes to better preventing DNN from overfitting. Here we give a new explanation of dropout from the perspective of optimization that it makes the upper bound of the magnitude of gradients much tighter, which leads to a more stable behavior of the gradients and effectively avoids neurons falling into the saturation region of the nonlinear activation, even when using high learning rates. Extensive experiments have been performed to prove the above two strengths of CamDrop.","",""
94,"C. Kwan, F. Lewis, D. Dawson","Robust neural-network control of rigid-link electrically driven robots",1998,"","","","",88,"2022-07-13 10:07:43","","10.1109/72.701172","","",,,,,94,3.92,31,3,24,"A robust neural-network (NN) controller is proposed for the motion control of rigid-link electrically driven (RLED) robots. Two-layer NN's are used to approximate two very complicated nonlinear functions. The main advantage of our approach is that the NN weights are tuned on-line, with no off-line learning phase required. Most importantly, we can guarantee the uniformly ultimately bounded (UUB) stability of tracking errors and NN weights. When compared with standard adaptive robot controllers, we do not require lengthy and tedious preliminary analysis to determine a regression matrix. The controller can be regarded as a universal reusable controller because the same controller can be applied to any type of RLED robots without any modifications.","",""
36,"Wei He, Yongkun Sun, Zichen Yan, Chenguang Yang, Zhijun Li, O. Kaynak","Disturbance Observer-Based Neural Network Control of Cooperative Multiple Manipulators With Input Saturation",2020,"","","","",89,"2022-07-13 10:07:43","","10.1109/TNNLS.2019.2923241","","",,,,,36,18.00,6,6,2,"In this paper, the complex problems of internal forces and position control are studied simultaneously and a disturbance observer-based radial basis function neural network (RBFNN) control scheme is proposed to: 1) estimate the unknown parameters accurately; 2) approximate the disturbance experienced by the system due to input saturation; and 3) simultaneously improve the robustness of the system. More specifically, the proposed scheme utilizes disturbance observers, neural network (NN) collaborative control with an adaptive law, and full state feedback. Utilizing Lyapunov stability principles, it is shown that semiglobally uniformly bounded stability is guaranteed for all controlled signals of the closed-loop system. The effectiveness of the proposed controller as predicted by the theoretical analysis is verified by comparative experimental studies.","",""
0,"Pau","Neural network signal understanding for instrumentation",2019,"","","","",90,"2022-07-13 10:07:43","","","","",,,,,0,0.00,0,1,3,"This paper reports on the use of neural signal interpretation theory and techniques for the purpose of classifying the shapes of a set of instrumentation signals, in order to calibrate devices, diagnose anomalies, generate tuning/settings, and interpret the measurement results. Neural signal understanding research is surveyed, and the selected implementation is described with its performance in terms of correct classification rates and robustness to noise. Formal results on neural net training time and sensitivity to weights are given. A theory for neural control is given using functional link nets and an explanation technique is designed to help neural signal understanding. The results of this are compared to those of a knowledge-based signal interpretation system within the context of the same specific instrument and data. Keywords-Neural understanding, calibration, signal understanding, control theory, neural control, training time, sensitivity to noise, explanation facilities, knowledge-based signal interpretation, instrumentation, analytical instrumentation.","",""
15,"F. Ham, Sungjin Park","A robust neural network classifier for infrasound events using multiple array data",2002,"","","","",91,"2022-07-13 10:07:43","","10.1109/IJCNN.2002.1007556","","",,,,,15,0.75,8,2,20,"An integral part of the Comprehensive Nuclear-Test-Ban Treaty International Monitoring System is an infrasound monitoring network. This network has the capability to detect and verify infrasonic signals-of-interest, e.g., nuclear explosions, from other unwanted infrasound noise sources. The paper presents classification results of infrasonic events using a robust neural network.","",""
92,"Xiaojian Li, Guanghong Yang","Neural-Network-Based Adaptive Decentralized Fault-Tolerant Control for a Class of Interconnected Nonlinear Systems",2018,"","","","",92,"2022-07-13 10:07:43","","10.1109/TNNLS.2016.2616906","","",,,,,92,23.00,46,2,4,"This paper is concerned with the adaptive decentralized fault-tolerant tracking control problem for a class of uncertain interconnected nonlinear systems with unknown strong interconnections. An algebraic graph theory result is introduced to address the considered interconnections. In addition, to achieve the desirable tracking performance, a neural-network-based robust adaptive decentralized fault-tolerant control (FTC) scheme is given to compensate the actuator faults and system uncertainties. Furthermore, via the Lyapunov analysis method, it is proven that all the signals of the resulting closed-loop system are semiglobally bounded, and the tracking errors of each subsystem exponentially converge to a compact set, whose radius is adjustable by choosing different controller design parameters. Finally, the effectiveness and advantages of the proposed FTC approach are illustrated with two simulated examples.","",""
356,"M. Mirman, Timon Gehr, Martin T. Vechev","Differentiable Abstract Interpretation for Provably Robust Neural Networks",2018,"","","","",93,"2022-07-13 10:07:43","","","","",,,,,356,89.00,119,3,4,"We introduce a scalable method for training robust neural networks based on abstract interpretation. We present several abstract transformers which balance efficiency with precision and show these can be used to train large neural networks that are certifiably robust to adversarial perturbations.","",""
10,"Xiaotong Wang, Chih-Chen Chang, Fang Du","Achieving a More Robust Neural Network Model for Control of a MR Damper by Signal Sensitivity Analysis",2002,"","","","",94,"2022-07-13 10:07:43","","10.1007/s005210200005","","",,,,,10,0.50,3,3,20,"","",""
0,"D. Bzdok, J. Ioannidis","Deep ] neural networks are elaborate regression methods aimed solely at prediction , not estimation or explanation",2019,"","","","",95,"2022-07-13 10:07:43","","","","",,,,,0,0.00,0,2,3,"The last decades saw dramatic progress in brain research. These advances were often buttressed by probing single variables to make circumscribed discoveries, typically through null hypothesis significance testing. New ways for generating massive data fueled tension between the traditional methodology, used to infer statistically relevant effects in carefully-chosen variables, and pattern-learning algorithms, used to identify predictive signatures by searching through abundant information. In this article, we detail the antagonistic philosophies behind two quantitative approaches: certifying robust effects in understandable variables, and evaluating how accurately a built model can forecast future outcomes. We discourage choosing analysis tools via categories like ‘statistics’ or ‘machine learning’. Rather, to establish reproducible knowledge about the brain, we advocate prioritizing tools in view of the core motivation of each quantitative analysis: aiming towards mechanistic insight, or optimizing predictive accuracy.","",""
16,"Peng Xu, A. Chan","Fast and robust neural network based wheel bearing fault detection with optimal wavelet features",2002,"","","","",96,"2022-07-13 10:07:43","","10.1109/IJCNN.2002.1007461","","",,,,,16,0.80,8,2,20,"We propose a new design of a neural network based system to detect faulty bearings using acoustic signals in a noisy wayside environment. Statistical features are generated from discrete wavelet transform coefficients, and a genetic algorithm is used to select the optimal features. The false negative rate for detecting a condemnable bearing is as low as 0.1% regardless of the speed, load condition, and bearing type.","",""
14,"Chih-Min Lin, A. Ting, Ming-Chia Li, Te-Yu Chen","Neural-network-based robust adaptive control for a class of nonlinear systems",2011,"","","","",97,"2022-07-13 10:07:43","","10.1007/s00521-011-0561-2","","",,,,,14,1.27,4,4,11,"","",""
12,"Zheng Yan, Jun Wang","Robust model predictive control of nonlinear affine systems based on a two-layer recurrent neural network",2011,"","","","",98,"2022-07-13 10:07:43","","10.1109/IJCNN.2011.6033195","","",,,,,12,1.09,6,2,11,"A robust model predictive control (MPC) method is proposed for nonlinear affine systems with bounded disturbances. The robust MPC technique requires on-line solution of a minimax optimal control problem. The minimax strategy means that worst-case performance with respect to uncertainties is optimized. The minimax optimization problem involved in robust MPC is reformulated to a minimization problem and then is solved by using a two-layer recurrent neural network. Simulation examples are included to illustrate the effectiveness of the proposed method.","",""
619,"Mou Chen, S. Ge, B. How","Robust Adaptive Neural Network Control for a Class of Uncertain MIMO Nonlinear Systems With Input Nonlinearities",2010,"","","","",99,"2022-07-13 10:07:43","","10.1109/TNN.2010.2042611","","",,,,,619,51.58,206,3,12,"In this paper, robust adaptive neural network (NN) control is investigated for a general class of uncertain multiple-input-multiple-output (MIMO) nonlinear systems with unknown control coefficient matrices and input nonlinearities. For nonsymmetric input nonlinearities of saturation and deadzone, variable structure control (VSC) in combination with backstepping and Lyapunov synthesis is proposed for adaptive NN control design with guaranteed stability. In the proposed adaptive NN control, the usual assumption on nonsingularity of NN approximation for unknown control coefficient matrices and boundary assumption between NN approximation error and control input have been eliminated. Command filters are presented to implement physical constraints on the virtual control laws, then the tedious analytic computations of time derivatives of virtual control laws are canceled. It is proved that the proposed robust backstepping control is able to guarantee semiglobal uniform ultimate boundedness of all signals in the closed-loop system. Finally, simulation results are presented to illustrate the effectiveness of the proposed adaptive NN control.","",""
15,"Tianyu Guo, Chang Xu, Shiyi He, Boxin Shi, Chao Xu, D. Tao","Robust Student Network Learning",2018,"","","","",100,"2022-07-13 10:07:43","","10.1109/TNNLS.2019.2929114","","",,,,,15,3.75,3,6,4,"Deep neural networks bring in impressive accuracy in various applications, but the success often relies on heavy network architectures. Taking well-trained heavy networks as teachers, classical teacher–student learning paradigm aims to learn a student network that is lightweight yet accurate. In this way, a portable student network with significantly fewer parameters can achieve considerable accuracy, which is comparable to that of a teacher network. However, beyond accuracy, the robustness of the learned student network against perturbation is also essential for practical uses. Existing teacher-student learning frameworks mainly focus on accuracy and compression ratios, but ignore the robustness. In this paper, we make the student network produce more confident predictions with the help of the teacher network, and analyze the lower bound of the perturbation that will destroy the confidence of the student network. Two important objectives regarding prediction scores and gradients of examples are developed to maximize this lower bound, to enhance the robustness of the student network without sacrificing the performance. Experiments on benchmark data sets demonstrate the efficiency of the proposed approach to learning robust student networks that have satisfying accuracy and compact sizes.","",""
27,"Sheng Zhang, W. Zheng","Recursive Adaptive Sparse Exponential Functional Link Neural Network for Nonlinear AEC in Impulsive Noise Environment",2018,"","","","",101,"2022-07-13 10:07:43","","10.1109/TNNLS.2017.2761259","","",,,,,27,6.75,14,2,4,"Recently, an adaptive exponential trigonometric functional link neural network (AETFLN) architecture has been introduced to enhance the nonlinear processing capability of the trigonometric functional link neural network (TFLN). However, it suffers from slow convergence speed, heavy computational burden, and poor robustness to noise in nonlinear acoustic echo cancellation, especially in the double-talk scenario. To reduce its computational complexity and improve its robustness against impulsive noise, this paper develops a recursive adaptive sparse exponential TFLN (RASETFLN). Based on sparse representations of functional links, the robust proportionate adaptive algorithm is deduced from the robust cost function over the RASETFLN in impulsive noise environments. Theoretical analysis shows that the proposed RASETFLN is stable under certain conditions. Finally, computer simulations illustrate that the proposed RASETFLN achieves much improved performance over the AETFLN in several nonlinear scenarios in terms of convergence rate, steady-state error, and robustness against noise.","",""
29,"S. A. Taqvi, L. Tufa, H. Zabiri, A. Maulud, F. Uddin","Fault detection in distillation column using NARX neural network",2018,"","","","",102,"2022-07-13 10:07:43","","10.1007/s00521-018-3658-z","","",,,,,29,7.25,6,5,4,"","",""
76,"Yong Xu, Qiuqiang Kong, Qiang Huang, Wenwu Wang, Mark D. Plumbley","Convolutional gated recurrent neural network incorporating spatial features for audio tagging",2017,"","","","",103,"2022-07-13 10:07:43","","10.1109/IJCNN.2017.7966291","","",,,,,76,15.20,15,5,5,"Environmental audio tagging is a newly proposed task to predict the presence or absence of a specific audio event in a chunk. Deep neural network (DNN) based methods have been successfully adopted for predicting the audio tags in the domestic audio scene. In this paper, we propose to use a convolutional neural network (CNN) to extract robust features from mel-filter banks (MFBs), spectrograms or even raw waveforms for audio tagging. Gated recurrent unit (GRU) based recurrent neural networks (RNNs) are then cascaded to model the long-term temporal structure of the audio signal. To complement the input information, an auxiliary CNN is designed to learn on the spatial features of stereo recordings. We evaluate our proposed methods on Task 4 (audio tagging) of the Detection and Classification of Acoustic Scenes and Events 2016 (DCASE 2016) challenge. Compared with our recent DNN-based method, the proposed structure can reduce the equal error rate (EER) from 0.13 to 0.11 on the development set. The spatial features can further reduce the EER to 0.10. The performance of the end-to-end learning on raw waveforms is also comparable. Finally, on the evaluation set, we get the state-of-the-art performance with 0.12 EER while the performance of the best existing system is 0.15 EER.","",""
66,"Dechao Chen, Yunong Zhang","Robust Zeroing Neural-Dynamics and Its Time-Varying Disturbances Suppression Model Applied to Mobile Robot Manipulators",2018,"","","","",104,"2022-07-13 10:07:43","","10.1109/TNNLS.2017.2764529","","",,,,,66,16.50,33,2,4,"This paper proposes a novel robust zeroing neural-dynamics (RZND) approach as well as its associated model for solving the inverse kinematics problem of mobile robot manipulators. Unlike existing works based on the assumption that neural network models are free of external disturbances, four common forms of time-varying disturbances suppressed by the proposed RZND model are investigated in this paper. In addition, theoretical analyses on the antidisturbance performance are presented in detail to prove the effectiveness and robustness of the proposed RZND model with time-varying disturbances suppressed for solving the inverse kinematics problem of mobile robot manipulators. That is, the RZND model converges toward the exact solution of the inverse kinematics problem of mobile robot manipulators with bounded or zero-oriented steady-state position error. Moreover, simulation studies and comprehensive comparisons with existing neural network models, e.g., the conventional Zhang neural network model and the gradient-based recurrent neural network model, together with extensive tests with four common forms of time-varying disturbances substantiate the efficacy, robustness, and superiority of the proposed RZND approach as well as its time-varying disturbances suppression model for solving the inverse kinematics problem of mobile robot manipulators.","",""
47,"K. Shojaei","Three-dimensional neural network tracking control of a moving target by underactuated autonomous underwater vehicles",2019,"","","","",105,"2022-07-13 10:07:43","","10.1007/s00521-017-3085-6","","",,,,,47,15.67,47,1,3,"","",""
12,"H. Ninomiya","An Improved Online quasi-Newton method for robust training and its application to microwave neural network models",2010,"","","","",106,"2022-07-13 10:07:43","","10.1109/IJCNN.2010.5596655","","",,,,,12,1.00,12,1,12,"This paper describes a new technique for robust training of feedforward neural networks. The proposed algorithm is employed for the robust neural network training purpose. The quasi-Newton method was studied as one of the most efficient optimization algorithms based on the gradient descent and used as the batch training method of neural networks. On the other hand, the stochastic (online) quasi-Newton method was developed as an algorithm for the machine learning. In this paper the stochastic quasi-Newton training algorithm is improved for robust neural network training. Neural network training for some benchmark problems is presented to demonstrate the proposed algorithm. Furthermore, neural network training for microwave circuit modeling, such as the waveguide and the microstrip examples is presented, demonstrating that the proposed algorithm achieves more accurate models than both the batch and the stochastic quasi-Newton methods.","",""
83,"Juyeon Heo, Sunghwan Joo, Taesup Moon","Fooling Neural Network Interpretations via Adversarial Model Manipulation",2019,"","","","",107,"2022-07-13 10:07:43","","","","",,,,,83,27.67,28,3,3,"We ask whether the neural network interpretation methods can be fooled via adversarial model manipulation, which is defined as a model fine-tuning step that aims to radically alter the explanations without hurting the accuracy of the original models, e.g., VGG19, ResNet50, and DenseNet121. By incorporating the interpretation results directly in the penalty term of the objective function for fine-tuning, we show that the state-of-the-art saliency map based interpreters, e.g., LRP, Grad-CAM, and SimpleGrad, can be easily fooled with our model manipulation. We propose two types of fooling, Passive and Active, and demonstrate such foolings generalize well to the entire validation set as well as transfer to other interpretation methods. Our results are validated by both visually showing the fooled explanations and reporting quantitative metrics that measure the deviations from the original explanations. We claim that the stability of neural network interpretation method with respect to our adversarial model manipulation is an important criterion to check for developing robust and reliable neural network interpretation method.","",""
56,"Xinqiao Zhao, Hongmiao Zhang, Guilin Zhu, Fengxiang You, S. Kuang, Lining Sun","A Multi-Branch 3D Convolutional Neural Network for EEG-Based Motor Imagery Classification",2019,"","","","",108,"2022-07-13 10:07:43","","10.1109/TNSRE.2019.2938295","","",,,,,56,18.67,9,6,3,"One of the challenges in motor imagery (MI) classification tasks is finding an easy-handled electroencephalogram (EEG) representation method which can preserve not only temporal features but also spatial ones. To fully utilize the features on various dimensions of EEG, a novel MI classification framework is first introduced in this paper, including a new 3D representation of EEG, a multi-branch 3D convolutional neural network (3D CNN) and the corresponding classification strategy. The 3D representation is generated by transforming EEG signals into a sequence of 2D array which preserves spatial distribution of sampling electrodes. The multi-branch 3D CNN and classification strategy are designed accordingly for the 3D representation. Experimental evaluation reveals that the proposed framework reaches state-of-the-art classification kappa value level and significantly outperforms other algorithms by 50% decrease in standard deviation of different subjects, which shows good performance and excellent robustness on different subjects. The framework also shows great performance with only nine sampling electrodes, which can significantly enhance its practicality. Moreover, the multi-branch structure exhibits its low latency and a strong ability in mitigating overfitting issues which often occur in MI classification because of the small training dataset.","",""
27,"Mai Viet Thuan, D. C. Huong, Duong Thi Hong","New Results on Robust Finite-Time Passivity for Fractional-Order Neural Networks with Uncertainties",2018,"","","","",109,"2022-07-13 10:07:43","","10.1007/s11063-018-9902-9","","",,,,,27,6.75,9,3,4,"","",""
0,"Pau","Neural network signal understanding for instrumentation",2018,"","","","",110,"2022-07-13 10:07:43","","","","",,,,,0,0.00,0,1,4,"This paper reports on the use of neural signal interpretation theory and techniques for the purpose of classifying the shapes of a set of instrumentation signals, in order to calibrate devices, diagnose anomalies, generate tuning/settings, and interpret the measurement results. Neural signal understanding research is surveyed, and the selected implementation is described with its performance in terms of correct classification rates and robustness to noise. Formal results on neural net training time and sensitivity to weights are given. A theory for neural control is given using functional link nets and an explanation technique is designed to help neural signal understanding. The results of this are compared to those of a knowledge-based signal interpretation system within the context of the same specific instrument and data. Keywords-Neural understanding, calibration, signal understanding, control theory, neural control, training time, sensitivity to noise, explanation facilities, knowledge-based signal interpretation, instrumentation, analytical instrumentation.","",""
0,"Pau","Neural network signal understanding for instrumentation",2018,"","","","",111,"2022-07-13 10:07:43","","","","",,,,,0,0.00,0,1,4,"This paper reports on the use of neural signal interpretation theory and techniques for the purpose of classifying the shapes of a set of instrumentation signals, in order to calibrate devices, diagnose anomalies, generate tuning/settings, and interpret the measurement results. Neural signal understanding research is surveyed, and the selected implementation is described with its performance in terms of correct classification rates and robustness to noise. Formal results on neural net training time and sensitivity to weights are given. A theory for neural control is given using functional link nets and an explanation technique is designed to help neural signal understanding. The results of this are compared to those of a knowledge-based signal interpretation system within the context of the same specific instrument and data. Keywords-Neural understanding, calibration, signal understanding, control theory, neural control, training time, sensitivity to noise, explanation facilities, knowledge-based signal interpretation, instrumentation, analytical instrumentation.","",""
