Cites,Authors,Title,Year,Source,Publisher,ArticleURL,CitesURL,GSRank,QueryDate,Type,DOI,ISSN,CitationURL,Volume,Issue,StartPage,EndPage,ECC,CitesPerYear,CitesPerAuthor,AuthorCount,Age,Abstract,FullTextURL,RelatedURL
0,"James Henderson","Estimating a Probabilistic Grammar Using a Neural Network",2000,"","","","",60,"2022-07-13 10:08:47","","","","",,,,,0,0.00,0,1,22,"Previous work has demonstrated the viability of a particular neural network archi tecture, Simple Synchrony Networks (SSNs), for syntactic parsing (Henderson & Lane, 1998), (Henderson, 2000). However the output was interpreted as a score, only interpretable in a heuristic way relative to other scores of the same type. In this paper we discuss a SSN parser trained using a method that allows us to interpret the output as probability estimates. T hese estimates are then used in a chart parser to find the most probable complete parse. This syst em compares favorably to one where the probability estimates are calculated from head bi gram counts, and to a simple Probabilistic Context Free Grammar. We argue that this is due to the weaker independence assumptions necessary for training the SSN relative to statisti cal models based on frequency counts. If so, then such neural network architectures are a potential a lternative to statistical smoothing techniques for developing robust statistical parsers .","",""
2,"R. Silva, T. Ludermir","Neural network methods for rule induction",1999,"","","","",61,"2022-07-13 10:08:47","","10.1109/IJCNN.1999.830845","","",,,,,2,0.09,1,2,23,"Local basis function networks are a useful category of classifiers, with known variations developed in neural networks, machine learning and statistics communities. The localized range of activation of the hidden units have many similarities with rule-based representations. Neurofuzzy systems are a common example of a framework that explicitly integrates these approaches. Following this concept, we study alternatives for the development of hybrid rule-neural systems with the purpose of inducing robust and interpretable classifiers. Local fitting of parameters is done by a gradient descent optimization that modifies the covering produced by a rule induction algorithm. Two tasks are accomplished: how to select a small number of rules and how to improve precision. The use of this architecture is better suited when one wants to achieve a good compromise between classification performance and simplicity.","",""
869,"E. Chichilnisky","A simple white noise analysis of neuronal light responses",2001,"","","","",62,"2022-07-13 10:08:47","","10.1080/net.12.2.199.213","","",,,,,869,41.38,869,1,21,"A white noise technique is presented for estimating the response properties of spiking visual system neurons. The technique is simple, robust, efficient and well suited to simultaneous recordings from multiple neurons. It provides a complete and easily interpretable model of light responses even for neurons that display a common form of response nonlinearity that precludes classical linear systems analysis. A theoretical justification of the technique is presented that relies only on elementary linear algebra and statistics. Implementation is described with examples. The technique and the underlying model of neural responses are validated using recordings from retinal ganglion cells, and in principle are applicable to other neurons. Advantages and disadvantages of the technique relative to classical approaches are discussed.","",""
23,"Lizhi Wang, Chen Sun, Maoqing Zhang, Ying Fu, Hua Huang","DNU: Deep Non-Local Unrolling for Computational Spectral Imaging",2020,"","","","",63,"2022-07-13 10:08:47","","10.1109/cvpr42600.2020.00173","","",,,,,23,11.50,5,5,2,"Computational spectral imaging has been striving to capture the spectral information of the dynamic world in the last few decades. In this paper, we propose an interpretable neural network for computational spectral imaging. First, we introduce a novel data-driven prior that can adaptively exploit both the local and non-local correlations among the spectral image. Our data-driven prior is integrated as a regularizer into the reconstruction problem. Then, we propose to unroll the reconstruction problem into an optimization-inspired deep neural network. The architecture of the network has high interpretability by explicitly characterizing the image correlation and the system imaging model. Finally, we learn the complete parameters in the network through end-to-end training, enabling robust performance with high spatial-spectral fidelity. Extensive simulation and hardware experiments validate the superior performance of our method over state-of-the-art methods.","",""
3,"Sahil Singla, Surbhi Singla, S. Feizi","Improved deterministic l2 robustness on CIFAR-10 and CIFAR-100",2021,"","","","",64,"2022-07-13 10:08:47","","","","",,,,,3,3.00,1,3,1,"Training convolutional neural networks (CNNs) with a strict Lipschitz constraint under the l2 norm is useful for provable adversarial robustness, interpretable gradients and stable training. While 1-Lipschitz CNNs can be designed by enforcing a 1-Lipschitz constraint on each layer, training such networks requires each layer to have an orthogonal Jacobian matrix (for all inputs) to prevent the gradients from vanishing during backpropagation. A layer with this property is said to be Gradient Norm Preserving (GNP). In this work, we introduce a procedure to certify the robustness of 1-Lipschitz CNNs by relaxing the orthogonalization of the last linear layer of the network that significantly advances the state of the art for both standard and provable robust accuracies on CIFAR-100 (gains of 4.80% and 4.71%, respectively). We further boost their robustness by introducing (i) a novel Gradient Norm preserving activation function called the Householder activation function (that includes every GroupSort activation) and (ii) a certificate regularization. On CIFAR-10, we achieve significant improvements over prior works in provable robust accuracy (5.81%) with only a minor drop in standard accuracy (−0.29%). Code for reproducing all experiments in the paper is available at https://github.com/singlasahil14/SOC.","",""
1,"R. Cosentino, Anirvan M. Sengupta, S. Avestimehr, M. Soltanolkotabi, Antonio Ortega, Ted L. Willke, Mariano Tepper","Toward a Geometrical Understanding of Self-supervised Contrastive Learning",2022,"","","","",65,"2022-07-13 10:08:47","","10.48550/arXiv.2205.06926","","",,,,,1,1.00,0,7,1,"Self-supervised learning (SSL) is currently one of the premier techniques to create data representations that are actionable for transfer learning in the absence of human annotations. Despite their success, the underlying geometry of these representations remains elusive, which obfuscates the quest for more robust, trustworthy, and interpretable models. In particular, mainstream SSL techniques rely on a speciﬁc deep neural network architecture with two cascaded neural networks: the encoder and the projector. When used for transfer learning, the projector is discarded since empirical results show that its representation gen-eralizes more poorly than the encoder’s. In this paper, we investigate this curious phenomenon and analyze how the strength of the data augmentation policies affects the data embedding. We discover a non-trivial relation between the encoder, the projector, and the data augmentation strength: with increasingly larger augmentation policies, the projector, rather than the encoder, is more strongly driven to become invariant to the augmentations. It does so by eliminating crucial information about the data by learning to project it into a low-dimensional space, a noisy estimate of the data manifold tangent plane in the encoder representation. This analysis is substantiated through a geometrical perspective with theoretical and empirical results. by using the representation extracted in the encoder space . Large, moderate, and small augmentations refer to the strength of the data augmentation applied to the input samples (see Table 2 for each conﬁguration). The smaller the strength of the data augmentation policy, the less the projector suffers from dimensional collapse. However, when the projector is affected by a substantial dimensional collapse, the encoder representation becomes suitable for the downstream task. In this work, we demys-tify this intriguing relationship between augmentation strengths, encoder embedding, and projector geometry.","",""
1,"S. Chao, M. Brenner, N. Hacohen","Identifying Cell Type-Specific Chemokine Correlates with Hierarchical Signal Extraction from Single-Cell Transcriptomes.",2021,"","","","",66,"2022-07-13 10:08:47","","10.1142/9789811250477_0024","","",,,,,1,1.00,0,3,1,"Biological data is inherently heterogeneous and high-dimensional. Single-cell sequencing of transcripts in a tissue sample generates data for thousands of cells, each of which is characterized by upwards of tens of thousands of genes. How to identify the subsets of cells and genes that are associated with a label of interest remains an open question. In this paper, we integrate a signal-extractive neural network architecture with axiomatic feature attribution to classify tissue samples based on single-cell gene expression profiles. This approach is not only interpretable but also robust to noise, requiring just 5% of genes and 23% of cells in an in silico tissue sample to encode signal in order to distinguish signal from noise with greater than 70% accuracy. We demonstrate its applicability in two real-world settings for discovering cell type-specific chemokine correlates: predicting response to immune checkpoint inhibitors in multiple tissue types and classifying DNA mismatch repair status in colorectal cancer. Our approach not only significantly outperforms traditional machine learning classifiers but also presents actionable biological hypotheses of chemokinemediated tumor immunogenicity.","",""
1,"Ginevra Carbone, G. Sanguinetti, L. Bortolussi","Resilience of Bayesian Layer-Wise Explanations under Adversarial Attacks",2021,"","","","",67,"2022-07-13 10:08:47","","","","",,,,,1,1.00,0,3,1,"—We consider the problem of the stability of saliency- based explanations of Neural Network predictions under adversarial attacks in a classiﬁcation task. Saliency interpretations of deterministic Neural Networks are remarkably brittle even when the attacks fail, i.e. for attacks that do not change the classiﬁcation label. We empirically show that interpretations provided by Bayesian Neural Networks are considerably more stable under adversarial perturbations of the inputs and even under direct attacks to the explanations. By leveraging recent results, we also provide a theoretical explanation of this result in terms of the geometry of the data manifold. Additionally, we discuss the stability of the interpretations of high level representations of the inputs in the internal layers of a Network. Our results demonstrate that Bayesian methods, in addition to being more robust to adversarial attacks, have the potential to provide more stable and interpretable assessments of Neural Network predictions.","",""
0,"Yazan Qarout, Yordan P. Raykov, M. Little","Few-shot time series segmentation using prototype-defined infinite hidden Markov models",2021,"","","","",68,"2022-07-13 10:08:47","","","","",,,,,0,0.00,0,3,1,"We propose a robust framework for interpretable, few-shot analysis of non-stationary sequential data based on flexible graphical models to express the structured distribution of sequential events, using prototype radial basis function (RBF) neural network emissions. A motivational link is demonstrated between prototypical neural network architectures for few-shot learning and the proposed RBF network infinite hidden Markov model (RBF-iHMM). We show that RBF networks can be efficiently specified via prototypes allowing us to express complex nonstationary patterns, while hidden Markov models are used to infer principled high-level Markov dynamics. The utility of the framework is demonstrated on biomedical signal processing applications such as automated seizure detection from EEG data where RBF networks achieve state-of-the-art performance using a fraction of the data needed to train long-short-term memory variational autoencoders.","",""
0,"Henry Eigen, Amir Sadovnik","TopKConv: Increased Adversarial Robustness Through Deeper Interpretability",2021,"","","","",69,"2022-07-13 10:08:47","","10.1109/ICMLA52953.2021.00011","","",,,,,0,0.00,0,2,1,"Vulnerability to adversarial inputs remains an issue for deep neural networks. Attackers can slightly modify inputs in order to cause adverse behavior in otherwise highly accurate networks. In addition to making these networks less secure for real world applications, this also emphasizes a misalignment between the features the network uses to make decisions and the ones humans use. In this work we propose that more interpretable networks should yield more robust ones since they are able to rely on features that are more understandable to humans. More specifically, we take inspiration from interpretability based approaches to adversarial robustness, and propose a sparsity based defense to counter the impact of overparameterization on adversarial vulnerability. Building off of the work of the Dynamic-K algorithm, which introduces dynamic routing to fully connected layers in order to encourage sparse, interpretable predictions, we propose TopKConv, a novel method of reducing the number of activation channels used to construct each convolutional feature map. The incorporation of TopKConv alongside Dynamic-k results in a significant increase in adversarial accuracy at no cost to benign accuracy. Further, this is achieved with no fine tuning of or adversarial training.","",""
35,"A. Malinin","Uncertainty estimation in deep learning with application to spoken language assessment",2019,"","","","",70,"2022-07-13 10:08:47","","10.17863/CAM.45912","","",,,,,35,11.67,35,1,3,"Since convolutional neural networks (CNNs) achieved top performance on the ImageNet task in 2012, deep learning has become the preferred approach to addressing computer vision, natural language processing, speech recognition and bio-informatics tasks. However, despite impressive performance, neural networks tend to make over-confident predictions. Thus, it is necessary to investigate robust, interpretable and tractable estimates of uncertainty in a model’s predictions in order to construct safer Machine Learning systems. This is crucial to applications where the cost of an error is high, such as in autonomous vehicle control, high-stakes automatic proficiency assessment and in the medical, financial and legal fields. In the first part of this thesis uncertainty estimation via ensemble and single-model approaches is discussed in detail and a new class of models for uncertainty estimation, called Prior Networks, is proposed. Prior Networks are able to emulate an ensemble of models using a single deterministic neural network, which allows sources of uncertainty to be determined within the same probabilistic framework as in ensemble-based approaches, but with the computational simplicity and ease of training of single-model approaches. Thus, Prior Networks combine the advantages of ensemble and single-model approaches to estimating uncertainty. In this thesis Prior Networks are evaluated on a range classification datasets, where they are shown to outperform baseline approaches, such as Monte-Carlo dropout, on the task of detecting out-of-distribution inputs. In the second part of this thesis deep learning and uncertainty estimation approaches are applied to the area of automatic assessment of non-native spoken language proficiency. Specifically deep-learning based graders and spoken response relevance assessment systems are constructed using data from the BULATS and LinguaSkill exams, provided by Cambridge English Language Assessment. Baseline approaches for uncertainty estimation discussed and evaluated in the first half of the thesis are then applied to these models and assessed on the task of rejecting predictions to be graded by human examiners and detecting misclassifications.","",""
7,"K. Koneripalli, Suhas Lohit, Rushil Anirudh, P. Turaga","Rate-Invariant Autoencoding of Time-Series",2020,"","","","",71,"2022-07-13 10:08:47","","10.1109/ICASSP40776.2020.9053983","","",,,,,7,3.50,2,4,2,"For time-series classification and retrieval applications, an important requirement is to develop representations/metrics that are robust to re-parametrization of the time-axis. Temporal re-parametrization as a model can account for variability in the underlying generative process, sampling rate variations, or plain temporal mis-alignment. In this paper, we extend prior work in disentangling latent spaces of autoencoding models, to design a novel architecture to learn rate-invariant latent codes in a completely unsupervised fashion. Unlike conventional neural network architectures, this method allows to explicitly disentangle temporal parameters in the form of order-preserving diffeomorphisms with respect to a learnable template. This makes the latent space more easily interpretable. We show the efficacy of our approach on a synthetic dataset and a real dataset for hand action-recognition.","",""
7,"Jiankai Sun, Haowei Sun, Tian Han, Bolei Zhou","Neuro-Symbolic Program Search for Autonomous Driving Decision Module Design",2020,"","","","",72,"2022-07-13 10:08:47","","","","",,,,,7,3.50,2,4,2,"As a promising topic in cognitive robotics, neuro-symbolic modeling integrates symbolic reasoning and neural representation altogether. However, previous neuro-symbolic models usually wire their structures and the connections manually, making the underlying parameters sub-optimal. In this work, we propose the Neuro-Symbolic Program Search (NSPS) to improve the autonomous driving system design. NSPS is a novel automated search method that synthesizes the Neuro-Symbolic Programs. It can produce robust and expressive Neuro-Symbolic Programs and automatically tune the hyper-parameters. We validate NSPS in the CARLA driving simulation environment. The resulting Neuro-Symbolic Decision Programs successfully handle multiple traffic scenarios. Compared with previous neural-network-based driving and rule-based methods, our neuro-symbolic driving pipeline achieves more stable and safer behaviors in complex driving scenarios while maintaining an interpretable symbolic decision-making process.","",""
5,"Tianchen Ji, S. Vuppala, Girish Chowdhary, K. Driggs-Campbell","Multi-Modal Anomaly Detection for Unstructured and Uncertain Environments",2020,"","","","",73,"2022-07-13 10:08:47","","","","",,,,,5,2.50,1,4,2,"To achieve high-levels of autonomy, modern robots require the ability to detect and recover from anomalies and failures with minimal human supervision. Multi-modal sensor signals could provide more information for such anomaly detection tasks; however, the fusion of high-dimensional and heterogeneous sensor modalities remains a challenging problem. We propose a deep learning neural network: supervised variational autoencoder (SVAE), for failure identification in unstructured and uncertain environments. Our model leverages the representational power of VAE to extract robust features from high-dimensional inputs for supervised learning tasks. The training objective unifies the generative model and the discriminative model, thus making the learning a one-stage procedure. Our experiments on real field robot data demonstrate superior failure identification performance than baseline methods, and that our model learns interpretable representations. Videos of our results are available on our website: this https URL .","",""
5,"Blake Ruprecht, Wenlong Wu, M. Islam, Derek T. Anderson, James M. Keller, G. Scott, Curt Davis, F. Petry, P. Elmore, Kristen Nock, Elizabeth Gilmour","Possibilistic Clustering Enabled Neuro Fuzzy Logic",2020,"","","","",74,"2022-07-13 10:08:47","","10.1109/FUZZ48607.2020.9177593","","",,,,,5,2.50,1,11,2,"Artificial neural networks are a dominant force in our modern era of data-driven artificial intelligence. The adaptive neuro fuzzy inference system (ANFIS) is a neural network based on fuzzy logic versus a more traditional premise like convolution. Advantages of ANFIS include the ability to encode and potentially understand machine learned neural information in the pursuit of explainable, interpretable, and ultimately trustworthy artificial intelligence. However, real-world data is almost always imperfect, e.g., incomplete or noisy, and ANFIS is not naturally robust. Specifically, ANFIS is susceptible to over inflated uncertainty, poor antecedent (fuzzy set) data alignment, degenerate optimization conditions, and hard to interpret logic, to name a few factors. Herein, we explore the use of possibilistic clustering to identify outliers, specifically typicality degrees, to increase the robustness of ANFIS; or any fuzzy logic neuron/network. Experiments are presented that demonstrate the need and quality of the proposed solutions in the pursuit of robust interpretable machine learned neuro fuzzy logic solutions.","",""
3,"Chen Wang, Chengyuan Deng, Vladimir A. Ivanov","SAG-VAE: End-to-end Joint Inference of Data Representations and Feature Relations",2019,"","","","",75,"2022-07-13 10:08:47","","10.1109/IJCNN48605.2020.9207154","","",,,,,3,1.00,1,3,3,"The ability to capture relations within data can provide the much needed inductive bias for robust and interpretable Machine Learning algorithms. Variational Autoencoder (VAE) is a promising candidate for such purpose thanks to their power in data representation inference, but its vanilla form and common variations cannot process feature relations. In this paper, inspired by recent advances in relational learning with graph neural networks, we propose the Self-Attention Graph Variational AutoEncoder (SAG-VAE) model which can simultaneously learn feature relations and data representations in an end-to-end manner. The SAG-VAE is trained by jointly inferring the posterior distribution of two types of latent variables, which respectively represent the data and the feature relations. The feature relations are represented as a graph structure, and the presence of each edge is determined by a Gumbel-Softmax distribution. The generative model is accordingly parameterized by a graph neural network with a special attention mechanism we introduced in the paper. Therefore, the SAG-VAE model can generate via graph convolution and be trained via backpropagation. Experiments based on graphs show that SAG-VAE is capable of approximately retrieving edges and links between vertices based entirely on feature observations. Furthermore, experiments on image data illustrate that the learned feature relations can provide the SAG-VAE robustness against perturbations in image reconstruction and sampling. The learned feature relations as graph adjacency matrices are observed to be structured, which provides intuitive interpretability of the models.","",""
1,"Arindam Mitra, Sanjay Narayana, Chitta Baral","Deeply Embedded Knowledge Representation & Reasoning For Natural Language Question Answering: A Practitioner’s Perspective",2020,"","","","",76,"2022-07-13 10:08:47","","10.18653/v1/2020.spnlp-1.12","","",,,,,1,0.50,0,3,2,"Successful application of Knowledge Representation and Reasoning (KR) in Natural Language Understanding (NLU) is largely limited by the availability of a robust and general purpose natural language parser. Even though several projects have been launched in the pursuit of developing a universal meaning representation language, the existence of an accurate universal parser is far from reality. This has severely limited the application of knowledge representation and reasoning (KR) in the field of NLP and also prevented a proper evaluation of KR based NLU systems. Our goal is to build KR based systems for Natural Language Understanding without relying on a parser. Towards this we propose a method named Deeply Embedded Knowledge Representation & Reasoning (DeepEKR) where we replace the parser by a neural network, soften the symbolic representation so that a deterministic mapping exists between the parser neural network and the interpretable logical form, and finally replace the symbolic solver by an equivalent neural network, so the model can be trained end-to-end. We evaluate our method with respect to the task of Qualitative Word Problem Solving on the two available datasets (QuaRTz and QuaRel). Our system achieves same accuracy as that of the state-of-the-art accuracy on QuaRTz, outperforms the state-of-the-art on QuaRel and severely outperforms a traditional KR based system. The results show that the bias introduced by a KR solution does not prevent it from doing a better job at the end task. Moreover, our method is interpretable due to the bias introduced by the KR approach.","",""
