Cites,Authors,Title,Year,Source,Publisher,ArticleURL,CitesURL,GSRank,QueryDate,Type,DOI,ISSN,CitationURL,Volume,Issue,StartPage,EndPage,ECC,CitesPerYear,CitesPerAuthor,AuthorCount,Age,Abstract,FullTextURL,RelatedURL
1,"Peng Lu, Yang Gao, Hao Xi, Yabin Zhang, Chao Gao, Bing Zhou, Hongpo Zhang, Liwei Chen, Xiaobo Mao","KecNet: A Light Neural Network for Arrhythmia Classification Based on Knowledge Reinforcement",2021,"","","","",144,"2022-07-13 10:08:47","","10.1155/2021/6684954","","",,,,,1,1.00,0,9,1,"Acquiring electrocardiographic (ECG) signals and performing arrhythmia classification in mobile device scenarios have the advantages of short response time, almost no network bandwidth consumption, and human resource savings. In recent years, deep neural networks have become a popular method to efficiently and accurately simulate nonlinear patterns of ECG data in a data-driven manner but require more resources. Therefore, it is crucial to design deep learning (DL) algorithms that are more suitable for resource-constrained mobile devices. In this paper, KecNet, a lightweight neural network construction scheme based on domain knowledge, is proposed to model ECG data by effectively leveraging signal analysis and medical knowledge. To evaluate the performance of KecNet, we use the Association for the Advancement of Medical Instrumentation (AAMI) protocol and the MIT-BIH arrhythmia database to classify five arrhythmia categories. The result shows that the ACC, SEN, and PRE achieve 99.31%, 99.45%, and 98.78%, respectively. In addition, it also possesses high robustness to noisy environments, low memory usage, and physical interpretability advantages. Benefiting from these advantages, KecNet can be applied in practice, especially wearable and lightweight mobile devices for arrhythmia classification.","",""
2,"S. Barland, Franccois Gustave","Convolutional neural network for self-mixing interferometric displacement sensing.",2021,"","","","",145,"2022-07-13 10:08:47","","10.1364/OE.419844","","",,,,,2,2.00,1,2,1,"Self-mixing interferometry is a well established interferometric measurement technique. In spite of the robustness and simplicity of the concept, interpreting the self-mixing signal is often complicated in practice, which is detrimental to measurement availability. Here we discuss the use of a convolutional neural network to reconstruct the displacement of a target from the self-mixing signal in a semiconductor laser. The network, once trained on periodic displacement patterns, can reconstruct arbitrarily complex displacement in different alignment conditions and setups. The approach validated here is amenable to generalization to modulated schemes or even to totally different self-mixing sensing tasks.","",""
1,"Yanghuan Xu, Dong-cheng Wang, Bo Duan, Hua-xin Yu, Hongmin Liu","Copper Strip Surface Defect Detection Model Based on Deep Convolutional Neural Network",2021,"","","","",146,"2022-07-13 10:08:47","","10.3390/app11198945","","",,,,,1,1.00,0,5,1,"Surface defect automatic detection has great significance for copper strip production. The traditional machine vision for surface defect automatic detection of copper strip needs artificial feature design, which has a long cycle, and poor ability of versatility and robustness. However, deep learning can effectively solve these problems. Therefore, based on the deep convolution neural network and the transfer learning strategy, an intelligent recognition model of surface defects of copper strip is established in this paper. Firstly, the defects were classified in accordance with the mechanism and morphology, and the surface defect dataset of copper strip was established by comprehensively adopting image acquisition and image augmentation. Then, a two-class discrimination model was established to achieve the accurate discrimination of perfect and defect images. On this basis, four CNN models were adopted for the recognition of defect images. Among these models, the EfficientNet model through transfer learning strategy had the best comprehensive performance with a recognition accuracy rate of 93.05%. Finally, the interpretability and deficiency of the model were analysed by the class activation map and confusion matrix, which point toward the direction of further optimization for future research.","",""
0,"Ethan Harris, Daniela Mihai, Jonathon S. Hare","How Convolutional Neural Network Architecture Biases Learned Opponency and Color Tuning",2021,"","","","",147,"2022-07-13 10:08:47","","10.1162/neco_a_01356","","",,,,,0,0.00,0,3,1,"Recent work suggests that changing convolutional neural network (CNN) architecture by introducing a bottleneck in the second layer can yield changes in learned function. To understand this relationship fully requires a way of quantitatively comparing trained networks. The fields of electrophysiology and psychophysics have developed a wealth of methods for characterizing visual systems that permit such comparisons. Inspired by these methods, we propose an approach to obtaining spatial and color tuning curves for convolutional neurons that can be used to classify cells in terms of their spatial and color opponency. We perform these classifications for a range of CNNs with different depths and bottleneck widths. Our key finding is that networks with a bottleneck show a strong functional organization: almost all cells in the bottleneck layer become both spatially and color opponent, and cells in the layer following the bottleneck become nonopponent. The color tuning data can further be used to form a rich understanding of how color a network encodes color. As a concrete demonstration, we show that shallower networks without a bottleneck learn a complex nonlinear color system, whereas deeper networks with tight bottlenecks learn a simple channel opponent code in the bottleneck layer. We develop a method of obtaining a hue sensitivity curve for a trained CNN that enables high-level insights that complement the low-level findings from the color tuning data. We go on to train a series of networks under different conditions to ascertain the robustness of the discussed results. Ultimately our methods and findings coalesce with prior art, strengthening our ability to interpret trained CNNs and furthering our understanding of the connection between architecture and learned representation. Trained models and code for all experiments are available at https://github.com/ecs-vlc/opponency.","",""
14,"T. Briegel, Volker Tresp","Robust Neural Network Regression for Offline and Online Learning",1999,"","","","",148,"2022-07-13 10:08:47","","","","",,,,,14,0.61,7,2,23,"We replace the commonly used Gaussian noise model in nonlinear regression by a more flexible noise model based on the Student-t- distribution. The degrees of freedom of the t-distribution can be chosen such that as special cases either the Gaussian distribution or the Cauchy distribution are realized. The latter is commonly used in robust regression. Since the t-distribution can be interpreted as being an infinite mixture of Gaussians, parameters and hyperparameters such as the degrees of freedom of the t-distribution can be learned from the data based on an EM-learning algorithm. We show that modeling using the t-distribution leads to improved predictors on real world data sets. In particular, if outliers are present, the t-distribution is superior to the Gaussian noise model. In effect, by adapting the degrees of freedom, the system can ""learn"" to distinguish between outliers and non-outliers. Especially for online learning tasks, one is interested in avoiding inappropriate weight changes due to measurement outliers to maintain stable online learning capability. We show experimentally that using the t-distribution as a noise model leads to stable online learning algorithms and outperforms state-of-the art online learning methods like the extended Kalman filter algorithm.","",""
9,"Darius Afchar, Romain Hennequin","Making Neural Networks Interpretable with Attribution: Application to Implicit Signals Prediction",2020,"","","","",149,"2022-07-13 10:08:47","","10.1145/3383313.3412253","","",,,,,9,4.50,5,2,2,"Explaining recommendations enables users to understand whether recommended items are relevant to their needs and has been shown to increase their trust in the system. More generally, if designing explainable machine learning models is key to check the sanity and robustness of a decision process and improve their efficiency, it however remains a challenge for complex architectures, especially deep neural networks that are often deemed ”black-box”. In this paper, we propose a novel formulation of interpretable deep neural networks for the attribution task. Differently to popular post-hoc methods, our approach is interpretable by design. Using masked weights, hidden features can be deeply attributed, split into several input-restricted sub-networks and trained as a boosted mixture of experts. Experimental results on synthetic data and real-world recommendation tasks demonstrate that our method enables to build models achieving close predictive performances to their non-interpretable counterparts, while providing informative attribution interpretations.","",""
356,"M. Mirman, Timon Gehr, Martin T. Vechev","Differentiable Abstract Interpretation for Provably Robust Neural Networks",2018,"","","","",150,"2022-07-13 10:08:47","","","","",,,,,356,89.00,119,3,4,"We introduce a scalable method for training robust neural networks based on abstract interpretation. We present several abstract transformers which balance efficiency with precision and show these can be used to train large neural networks that are certifiably robust to adversarial perturbations.","",""
40,"J. Hao, Youngsoon Kim, Tae-Kyung Kim, Mingon Kang","PASNet: pathway-associated sparse deep neural network for prognosis prediction from high-throughput data",2018,"","","","",151,"2022-07-13 10:08:47","","10.1186/s12859-018-2500-z","","",,,,,40,10.00,10,4,4,"","",""
44,"Minh Nguyen Nhat To, Q. Vu, B. Turkbey, P. Choyke, J. T. Kwak","Deep dense multi-path neural network for prostate segmentation in magnetic resonance imaging",2018,"","","","",152,"2022-07-13 10:08:47","","10.1007/s11548-018-1841-4","","",,,,,44,11.00,9,5,4,"","",""
5,"J. Günther, Elias Reichensdorfer, P. Pilarski, K. Diepold","Interpretable PID parameter tuning for control engineering using general dynamic neural networks: An extensive comparison",2019,"","","","",153,"2022-07-13 10:08:47","","10.1371/journal.pone.0243320","","",,,,,5,1.67,1,4,3,"Modern automation systems largely rely on closed loop control, wherein a controller interacts with a controlled process via actions, based on observations. These systems are increasingly complex, yet most deployed controllers are linear Proportional-Integral-Derivative (PID) controllers. PID controllers perform well on linear and near-linear systems but their simplicity is at odds with the robustness required to reliably control complex processes. Modern machine learning techniques offer a way to extend PID controllers beyond their linear control capabilities by using neural networks. However, such an extension comes at the cost of losing stability guarantees and controller interpretability. In this paper, we examine the utility of extending PID controllers with recurrent neural networks—–namely, General Dynamic Neural Networks (GDNN); we show that GDNN (neural) PID controllers perform well on a range of complex control systems and highlight how they can be a scalable and interpretable option for modern control systems. To do so, we provide an extensive study using four benchmark systems that represent the most common control engineering benchmarks. All control environments are evaluated with and without noise as well as with and without disturbances. The neural PID controller performs better than standard PID control in 15 of 16 tasks and better than model-based control in 13 of 16 tasks. As a second contribution, we address the lack of interpretability that prevents neural networks from being used in real-world control processes. We use bounded-input bounded-output stability analysis to evaluate the parameters suggested by the neural network, making them understandable for engineers. This combination of rigorous evaluation paired with better interpretability is an important step towards the acceptance of neural-network-based control approaches for real-world systems. It is furthermore an important step towards interpretable and safely applied artificial intelligence.","",""
3,"Artur Petrosyan, M. Sinkin, M. Lebedev, A. Ossadtchi","Decoding and interpreting cortical signals with a compact convolutional neural network",2021,"","","","",154,"2022-07-13 10:08:47","","10.1088/1741-2552/abe20e","","",,,,,3,3.00,1,4,1,"Objective. Brain–computer interfaces (BCIs) decode information from neural activity and send it to external devices. The use of Deep Learning approaches for decoding allows for automatic feature engineering within the specific decoding task. Physiologically plausible interpretation of the network parameters ensures the robustness of the learned decision rules and opens the exciting opportunity for automatic knowledge discovery. Approach. We describe a compact convolutional network-based architecture for adaptive decoding of electrocorticographic (ECoG) data into finger kinematics. We also propose a novel theoretically justified approach to interpreting the spatial and temporal weights in the architectures that combine adaptation in both space and time. The obtained spatial and frequency patterns characterizing the neuronal populations pivotal to the specific decoding task can then be interpreted by fitting appropriate spatial and dynamical models. Main results. We first tested our solution using realistic Monte-Carlo simulations. Then, when applied to the ECoG data from Berlin BCI competition IV dataset, our architecture performed comparably to the competition winners without requiring explicit feature engineering. Using the proposed approach to the network weights interpretation we could unravel the spatial and the spectral patterns of the neuronal processes underlying the successful decoding of finger kinematics from an ECoG dataset. Finally we have also applied the entire pipeline to the analysis of a 32-channel EEG motor-imagery dataset and observed physiologically plausible patterns specific to the task. Significance. We described a compact and interpretable CNN architecture derived from the basic principles and encompassing the knowledge in the field of neural electrophysiology. For the first time in the context of such multibranch architectures with factorized spatial and temporal processing we presented theoretically justified weights interpretation rules. We verified our recipes using simulations and real data and demonstrated that the proposed solution offers a good decoder and a tool for investigating motor control neural mechanisms.","",""
1,"Michael Yeung, L. Rundo, Yang Nan, E. Sala, C. Schönlieb, Guang Yang","Calibrating the Dice loss to handle neural network overconfidence for biomedical image segmentation",2021,"","","","",155,"2022-07-13 10:08:47","","","","",,,,,1,1.00,0,6,1,"The Dice similarity coefficient (DSC) is both a widely used metric and loss function for biomedical image segmentation due to its robustness to class imbalance. However, it is well known that the DSC loss is poorly calibrated, resulting in overconfident predictions that cannot be usefully interpreted in biomedical and clinical practice. Performance is often the only metric used to evaluate segmentations produced by deep neural networks, and calibration is often neglected. However, calibration is important for translation into biomedical and clinical practice, providing crucial contextual information to model predictions for interpretation by scientists and clinicians. In this study, we identify poor calibration as an emerging challenge of deep learning based biomedical image segmentation. We provide a simple yet effective extension of the DSC loss, named the DSC++ loss, that selectively modulates the penalty associated with overconfident, incorrect predictions. As a standalone loss function, the DSC++ loss achieves significantly improved calibration over the conventional DSC loss across five well-validated open-source biomedical imaging datasets. Similarly, we observe significantly improved when integrating the DSC++ loss into four DSC-based loss functions. Finally, we use softmax thresholding to illustrate that well calibrated outputs enable tailoring of precision-recall bias, an important post-processing technique to adapt the model predictions to suit the biomedical or clinical task. The DSC++ loss overcomes the major limitation of the DSC, providing a suitable loss function for training deep learning segmentation models for use in biomedical and clinical practice.","",""
619,"Mou Chen, S. Ge, B. How","Robust Adaptive Neural Network Control for a Class of Uncertain MIMO Nonlinear Systems With Input Nonlinearities",2010,"","","","",156,"2022-07-13 10:08:47","","10.1109/TNN.2010.2042611","","",,,,,619,51.58,206,3,12,"In this paper, robust adaptive neural network (NN) control is investigated for a general class of uncertain multiple-input-multiple-output (MIMO) nonlinear systems with unknown control coefficient matrices and input nonlinearities. For nonsymmetric input nonlinearities of saturation and deadzone, variable structure control (VSC) in combination with backstepping and Lyapunov synthesis is proposed for adaptive NN control design with guaranteed stability. In the proposed adaptive NN control, the usual assumption on nonsingularity of NN approximation for unknown control coefficient matrices and boundary assumption between NN approximation error and control input have been eliminated. Command filters are presented to implement physical constraints on the virtual control laws, then the tedious analytic computations of time derivatives of virtual control laws are canceled. It is proved that the proposed robust backstepping control is able to guarantee semiglobal uniform ultimate boundedness of all signals in the closed-loop system. Finally, simulation results are presented to illustrate the effectiveness of the proposed adaptive NN control.","",""
2,"A. Petrosino, Giuseppe Salvi","A Robust Neural Network Based Object Recognition System and Its SIMD Implementation",1999,"","","","",157,"2022-07-13 10:08:47","","10.1007/3-540-48311-X_135","","",,,,,2,0.09,1,2,23,"","",""
8,"Zicheng Hu, A. Tang, Jaiveer Singh, S. Bhattacharya, A. Butte","A robust and interpretable end-to-end deep learning model for cytometry data",2020,"","","","",158,"2022-07-13 10:08:47","","10.1073/pnas.2003026117","","",,,,,8,4.00,2,5,2,"Significance Cytometry technologies are able to profile immune cells at single-cell resolution. They are widely used for both clinical diagnosis and biological research. We developed a deep learning model for analyzing cytometry data. We demonstrated that the deep learning model accurately diagnoses the latent cytomegalovirus (CMV) in healthy individuals. In addition, we developed a method for interpreting the deep learning model, allowing us to identify biomarkers associated with latent CMV infection. The deep learning model is widely applicable to other cytometry data related to human diseases. Cytometry technologies are essential tools for immunology research, providing high-throughput measurements of the immune cells at the single-cell level. Existing approaches in interpreting and using cytometry measurements include manual or automated gating to identify cell subsets from the cytometry data, providing highly intuitive results but may lead to significant information loss, in that additional details in measured or correlated cell signals might be missed. In this study, we propose and test a deep convolutional neural network for analyzing cytometry data in an end-to-end fashion, allowing a direct association between raw cytometry data and the clinical outcome of interest. Using nine large cytometry by time-of-flight mass spectrometry or mass cytometry (CyTOF) studies from the open-access ImmPort database, we demonstrated that the deep convolutional neural network model can accurately diagnose the latent cytomegalovirus (CMV) in healthy individuals, even when using highly heterogeneous data from different studies. In addition, we developed a permutation-based method for interpreting the deep convolutional neural network model. We were able to identify a CD27- CD94+ CD8+ T cell population significantly associated with latent CMV infection, confirming the findings in previous studies. Finally, we provide a tutorial for creating, training, and interpreting the tailored deep learning model for cytometry data using Keras and TensorFlow (https://github.com/hzc363/DeepLearningCyTOF).","",""
5,"Shaeke Salman, S. N. Payrovnaziri, Xiuwen Liu, Pablo A Rengifo-Moreno, Zhe He","DeepConsensus: Consensus-based Interpretable Deep Neural Networks with Application to Mortality Prediction",2019,"","","","",159,"2022-07-13 10:08:47","","10.1109/IJCNN48605.2020.9206678","","",,,,,5,1.67,1,5,3,"Deep neural networks have achieved remarkable success in various challenging tasks. However, the black-box nature of such networks is not acceptable to critical applications, such as healthcare. In particular, the existence of adversarial examples and their overgeneralization to irrelevant, out-ofdistribution inputs with high confidence makes it difficult, if not impossible, to explain decisions by such networks. In this paper, we analyze the underlying mechanism of generalization of deep neural networks and propose an (n, k) consensus algorithm which is insensitive to adversarial examples and can reliably reject out- of-distribution samples. Furthermore, the consensus algorithm is able to improve classification accuracy by using multiple trained deep neural networks. To handle the complexity of deep neural networks, we cluster linear approximations of individual models and identify highly correlated clusters among different models to capture feature importance robustly, resulting in improved interpretability. Motivated by the importance of building accurate and interpretable prediction models for healthcare, our experimental results on an ICU dataset show the effectiveness of our algorithm in enhancing both the prediction accuracy and the interpretability of deep neural network models on one-year patient mortality prediction. In particular, while the proposed method maintains similar interpretability as conventional shallow models such as logistic regression, it improves the prediction accuracy significantly.","",""
8,"S. Candemir, Richard D. White, M. Demirer, Vikash Gupta, M. Bigelow, L. Prevedello, B. Erdal","Automated coronary artery atherosclerosis detection and weakly supervised localization on coronary CT angiography with a deep 3-dimensional convolutional neural network",2019,"","","","",160,"2022-07-13 10:08:47","","","","",,,,,8,2.67,1,7,3,"We propose a fully automated algorithm based on a deep learning framework enabling screening of a Coronary Computed Tomography Angiography (CCTA) examination for confident detection of the presence or absence of coronary artery atherosclerosis. The system starts with extracting the coronary arteries and their branches from CCTA datasets and representing them with multi-planar reformatted volumes; pre-processing and augmentation techniques are then applied to increase the robustness and generalization ability of the system. A 3-Dimensional Convolutional Neural Network (3D CNN) is utilized to model pathological changes (e.g., atherosclerotic plaques) in coronary vessels. The system learns the discriminatory features between vessels with and without atherosclerosis. The discriminative features at the final convolutional layer are visualized with a saliency map approach to provide visual clues related to atherosclerosis likelihood and location. We have evaluated the system on a reference dataset representing 247 patients with atherosclerosis and 246 patients free of atherosclerosis. With 5-fold cross-validation, an Accuracy = 90:9%, Positive Predictive Value = 58:8%, Sensitivity = 68:9%, Specificity of 93:6%, and Negative Predictive Value (NPV) = 96:1% are achieved at the artery/branch level with threshold 0.5. The average area under the receiver operating characteristic curve is 0.91. The system indicates a high NPV, which may be potentially useful for assisting interpreting physicians in excluding coronary atherosclerosis in patients with acute chest pain.","",""
