Cites,Authors,Title,Year,Source,Publisher,ArticleURL,CitesURL,GSRank,QueryDate,Type,DOI,ISSN,CitationURL,Volume,Issue,StartPage,EndPage,ECC,CitesPerYear,CitesPerAuthor,AuthorCount,Age,Abstract,FullTextURL,RelatedURL
0,"K. Supekar, S. Ryali, R. Yuan, D. Kumar, C. de los Angeles, V. Menon","Identification of robust and interpretable brain signatures of autism and clinical symptom severity using a dynamic time-series deep neural network",2021,"","","","",1,"2022-07-13 10:08:47","","10.1192/j.eurpsy.2021.397","","",,,,,0,0.00,0,6,1,"Introduction Autism spectrum disorder (ASD) is among the most common and pervasive neurodevelopmental disorders. Yet, despite decades of research, the neurobiology of ASD is still poorly understood, as inconsistent findings preclude the identification of robust and interpretable neurobiological markers and predictors of clinical symptoms. Objectives Identify robust and interpretable dynamic brain markers that distinguish children with ASD from typically-developing (TD) children and predict clinical symptom severity. Methods We leverage multiple functional brain imaging cohorts (ABIDE, Stanford; N = 1004) and exciting recent advances in explainable artificial intelligence (xAI), to develop a novel multivariate time series deep neural network model that extracts informative brain dynamics features that accurately distinguish between ASD and TD children, and predict clinical symptom severity. Results Our model achieved consistently high classification accuracies in cross-validation analysis of data from the ABIDE cohort. Crucially, despite the differences in symptom profiles, age, and data acquisition protocols, our model also accurately classified data from an independent Stanford cohort without additional training. xAI analyses revealed that brain features associated with the default mode network, and the human voice/face processing and communication systems, most clearly distinguished ASD from TD children in both cohorts. Furthermore, the posterior cingulate cortex emerged as robust predictor of the severity of social and communication deficits in ASD in both cohorts. Conclusions Our findings, replicated across two independent cohorts, reveal robust and neurobiologically interpretable brain features that detect ASD and predict core phenotypic features of ASD, and have the potential to transform our understanding of the etiology and treatment of the disorder. Disclosure No significant relationships.","",""
7,"Yuzhe Li, Shiyi Cheng, Yujia Xue, L. Tian","Displacement-agnostic coherent imaging through scatter with an interpretable deep neural network.",2020,"","","","",2,"2022-07-13 10:08:47","","10.1364/oe.411291","","",,,,,7,3.50,2,4,2,"Coherent imaging through scatter is a challenging task. Both model-based and data-driven approaches have been explored to solve the inverse scattering problem. In our previous work, we have shown that a deep learning approach can make high-quality and highly generalizable predictions through unseen diffusers. Here, we propose a new deep neural network model that is agnostic to a broader class of perturbations including scatterer change, displacements, and system defocus up to 10× depth of field. In addition, we develop a new analysis framework for interpreting the mechanism of our deep learning model and visualizing its generalizability based on an unsupervised dimension reduction technique. We show that our model can unmix the scattering-specific information and extract the object-specific information and achieve generalization under different scattering conditions. Our work paves the way to a robust and interpretable deep learning approach to imaging through scattering media.","",""
4,"Jacob M. Springer, M. Mitchell, Garrett T. Kenyon","Adversarial Perturbations Are Not So Weird: Entanglement of Robust and Non-Robust Features in Neural Network Classifiers",2021,"","","","",3,"2022-07-13 10:08:47","","10.2172/1823733","","",,,,,4,4.00,1,3,1,"Neural networks trained on visual data are wellknown to be vulnerable to often imperceptible adversarial perturbations. The reasons for this vulnerability are still being debated in the literature. Recently Ilyas et al. (2019) showed that this vulnerability arises, in part, because neural network classifiers rely on highly predictive but brittle “non-robust” features. In this paper we extend the work of Ilyas et al. by investigating the nature of the input patterns that give rise to these features. In particular, we hypothesize that in a neural network trained in a standard way, non-robust features respond to small, “non-semantic” patterns that are typically entangled with larger, robust patterns, known to be more human-interpretable, as opposed to solely responding to statistical artifacts in a dataset. Thus, adversarial examples can be formed via minimal perturbations to these small, entangled patterns. In addition, we demonstrate a corollary of our hypothesis: robust classifiers are more effective than standard (non-robust) ones as a source for generating transferable adversarial examples in both the untargeted and targeted settings. The results we present in this paper provide new insight into the nature of the non-robust features responsible for adversarial vulnerability of neural network classifiers.","",""
41,"Sreyas Mohan, Zahra Kadkhodaie, Eero P. Simoncelli, C. Fernandez-Granda","Robust and interpretable blind image denoising via bias-free convolutional neural networks",2019,"","","","",4,"2022-07-13 10:08:47","","","","",,,,,41,13.67,10,4,3,"Deep convolutional networks often append additive constant (""bias"") terms to their convolution operations, enabling a richer repertoire of functional mappings. Biases are also used to facilitate training, by subtracting mean response over batches of training images (a component of ""batch normalization""). Recent state-of-the-art blind denoising methods (e.g., DnCNN) seem to require these terms for their success. Here, however, we show that these networks systematically overfit the noise levels for which they are trained: when deployed at noise levels outside the training range, performance degrades dramatically. In contrast, a bias-free architecture -- obtained by removing the constant terms in every layer of the network, including those used for batch normalization-- generalizes robustly across noise levels, while preserving state-of-the-art performance within the training range. Locally, the bias-free network acts linearly on the noisy image, enabling direct analysis of network behavior via standard linear-algebraic tools. These analyses provide interpretations of network functionality in terms of nonlinear adaptive filtering, and projection onto a union of low-dimensional subspaces, connecting the learning-based method to more traditional denoising methodology.","",""
2,"Gurpreet Singh, Soumyajit Gupta, Matt Lease, Clint N. Dawson","TIME: A Transparent, Interpretable, Model-Adaptive and Explainable Neural Network for Dynamic Physical Processes",2020,"","","","",5,"2022-07-13 10:08:47","","","","",,,,,2,1.00,1,4,2,"Partial Differential Equations are infinite dimensional encoded representations of physical processes. However, imbibing multiple observation data towards a coupled representation presents significant challenges. We present a fully convolutional architecture that captures the invariant structure of the domain to reconstruct the observable system. The proposed architecture is significantly low-weight compared to other networks for such problems. Our intent is to learn coupled dynamic processes interpreted as deviations from true kernels representing isolated processes for model-adaptivity. Experimental analysis shows that our architecture is robust and transparent in capturing process kernels and system anomalies. We also show that high weights representation is not only redundant but also impacts network interpretability. Our design is guided by domain knowledge, with isolated process representations serving as ground truths for verification. These allow us to identify redundant kernels and their manifestations in activation maps to guide better designs that are both interpretable and explainable unlike traditional deep-nets.","",""
4,"Taeheon Lee, Jeonghwan Hwang, Honggu Lee","TRIER: Template-Guided Neural Networks for Robust and Interpretable Sleep Stage Identification from EEG Recordings",2020,"","","","",6,"2022-07-13 10:08:47","","","","",,,,,4,2.00,1,3,2,"Neural networks often obtain sub-optimal representations during training, which degrade robustness as well as classification performances. This is a severe problem in applying deep learning to bio-medical domains, since models are vulnerable to being harmed by irregularities and scarcities in data. In this study, we propose a pre-training technique that handles this challenge in sleep staging tasks. Inspired by conventional methods that experienced physicians have used to classify sleep states from the existence of characteristic waveform shapes, or template patterns, our method introduces a cosine similarity based convolutional neural network to extract representative waveforms from training data. Afterwards, these features guide a model to construct representations based on template patterns. Through extensive experiments, we demonstrated that guiding a neural network with template patterns is an effective approach for sleep staging, since (1) classification performances are significantly enhanced and (2) robustness in several aspects are improved. Last but not least, interpretations on models showed that notable features exploited by trained experts are correctly addressed during prediction in the proposed method.","",""
1,"Huijun Wu, Chen Wang, R. Nock, Wei Wang, Jie Yin, Kai Lu, Liming Zhu","SMINT: Toward Interpretable and Robust Model Sharing for Deep Neural Networks",2020,"","","","",7,"2022-07-13 10:08:47","","10.1145/3381833","","",,,,,1,0.50,0,7,2,"Sharing a pre-trained machine learning model, particularly a deep neural network via prediction APIs, is becoming a common practice on machine learning as a service (MLaaS) platforms nowadays. Although deep neural networks (DNN) have shown remarkable successes in many tasks, they are also criticized for the lack of interpretability and transparency. Interpreting a shared DNN model faces two additional challenges compared with interpreting a general model. (1) Limited training data can be disclosed to users. (2) The internal structure of the models may not be available. These two challenges impede the application of most existing interpretability approaches, such as saliency maps or influence functions, for DNN models. Case-based reasoning methods have been used for interpreting decisions; however, how to select and organize the data points under the constraints of shared DNN models is not discussed. Moreover, simply providing cases as explanations may not be sufficient for supporting instance level interpretability. Meanwhile, existing interpretation methods for DNN models generally lack the means to evaluate the reliability of the interpretation. In this article, we propose a framework named Shared Model INTerpreter (SMINT) to address the above limitations. We propose a new data structure called a boundary graph to organize training points to mimic the predictions of DNN models. We integrate local features, such as saliency maps and interpretable input masks, into the data structure to help users to infer the model decision boundaries. We show that the boundary graph is able to address the reliability issues in many local interpretation methods. We further design an algorithm named hidden-layer aware p-test to measure the reliability of the interpretations. Our experiments show that SMINT is able to achieve above 99% fidelity to corresponding DNN models on both MNIST and ImageNet by sharing only a tiny fraction of training data to make these models interpretable. The human pilot study demonstrates that SMINT provides better interpretability compared with existing methods. Moreover, we demonstrate that SMINT is able to assist model tuning for better performance on different user data.","",""
0,"Zahra Kadkhodaie, Sreyas Mohan, Eero P. Simoncelli, C. Fernandez-Granda","Interpretable and robust blind image denoising with bias-free convolutional neural networks",2019,"","","","",8,"2022-07-13 10:08:47","","","","",,,,,0,0.00,0,4,3,"Deep convolutional networks often append additive constant (""bias"") terms to their convolution operations, enabling a richer repertoire of functional mappings. Biases are also used to facilitate training, by subtracting mean response over batches of training images (a component of ""batch normalization""). Recent state-of-the-art blind denoising methods seem to require these terms for their success. Here, however, we show that bias terms used in most CNNs (additive constants, including those used for batch normalization) interfere with the interpretability of these networks, do not help performance, and in fact prevent generalization of performance to noise levels not including in the training data. In particular, bias-free CNNs (BF-CNNs) are locally linear, and hence amenable to direct analysis with linear-algebraic tools. These analyses provide interpretations of network functionality in terms of projection onto a union of low-dimensional subspaces, connecting the learning-based method to more traditional denoising methodology. Additionally, BF-CNNs generalize robustly, achieving near-state-of-the-art performance at noise levels well beyond the range over which they have been trained.","",""
1,"Y. Lu, Ilgiz Murzakhanov, Spyros Chatzivasileiadis","Neural network interpretability for forecasting of aggregated renewable generation",2021,"","","","",9,"2022-07-13 10:08:47","","10.1109/SmartGridComm51999.2021.9631993","","",,,,,1,1.00,0,3,1,"With the rapid growth of renewable energy, lots of small photovoltaic (PV) prosumers emerge. Due to the uncertainty of solar power generation, there is a need for aggregated prosumers to predict solar power generation and whether solar power generation will be larger than load. This paper presents two interpretable neural networks to solve the problem: one binary classification neural network and one regression neural network. The neural networks are built using TensorFlow. The global feature importance and local feature contributions are examined by three gradient-based methods: Integrated Gradients, Expected Gradients, and DeepLIFT. Moreover, we detect abnormal cases when predictions might fail by estimating the prediction uncertainty using Bayesian neural networks. Neural networks, which are interpreted by the gradient-based methods and complemented with uncertainty estimation, provide robust and explainable forecasting for decision-makers.","",""
0,"Nikola Janjusevic, Amirhossein Khalilian-Gourtani, Yao Wang","CDLNet: Robust and Interpretable Denoising Through Deep Convolutional Dictionary Learning",2021,"","","","",10,"2022-07-13 10:08:47","","","","",,,,,0,0.00,0,3,1,"Deep learning based methods hold state-of-the-art results in image denoising, but remain difficult to interpret due to their construction from poorly understood building blocks such as batch-normalization, residual learning, and feature domain processing. Unrolled optimization networks propose an interpretable alternative to constructing deep neural networks by deriving their architecture from classical iterative optimization methods, without use of tricks from the standard deep learning tool-box. So far, such methods have demonstrated performance close to that of state-of-the-art models while using their interpretable construction to achieve a comparably low learned parameter count. In this work, we propose an unrolled convolutional dictionary learning network (CDLNet) and demonstrate its competitive denoising performance in both low and high parameter count regimes. Specifically, we show that the proposed model outperforms the state-of-the-art denoising models when scaled to similar parameter count. In addition, we leverage the model’s interpretable construction to propose an augmentation of the network’s thresholds that enables state-of-the-art blind denoising performance and near-perfect generalization on noiselevels unseen during training.","",""
6,"D. Raimondi, J. Simm, A. Arany, P. Fariselli, I. Cleynen, Y. Moreau","An interpretable low-complexity machine learning framework for robust exome-based in-silico diagnosis of Crohn’s disease patients",2020,"","","","",11,"2022-07-13 10:08:47","","10.1093/nargab/lqaa011","","",,,,,6,3.00,1,6,2,"Abstract Whole exome sequencing (WES) data are allowing researchers to pinpoint the causes of many Mendelian disorders. In time, sequencing data will be crucial to solve the genome interpretation puzzle, which aims at uncovering the genotype-to-phenotype relationship, but for the moment many conceptual and technical problems need to be addressed. In particular, very few attempts at the in-silico diagnosis of oligo-to-polygenic disorders have been made so far, due to the complexity of the challenge, the relative scarcity of the data and issues such as batch effects and data heterogeneity, which are confounder factors for machine learning (ML) methods. Here, we propose a method for the exome-based in-silico diagnosis of Crohn’s disease (CD) patients which addresses many of the current methodological issues. First, we devise a rational ML-friendly feature representation for WES data based on the gene mutational burden concept, which is suitable for small sample sizes datasets. Second, we propose a Neural Network (NN) with parameter tying and heavy regularization, in order to limit its complexity and thus the risk of over-fitting. We trained and tested our NN on 3 CD case-controls datasets, comparing the performance with the participants of previous CAGI challenges. We show that, notwithstanding the limited NN complexity, it outperforms the previous approaches. Moreover, we interpret the NN predictions by analyzing the learned patterns at the variant and gene level and investigating the decision process leading to each prediction.","",""
4,"S. Yu, Yulei Niu, Shuohang Wang, Jing Jiang, Qianru Sun","Counterfactual Variable Control for Robust and Interpretable Question Answering",2020,"","","","",12,"2022-07-13 10:08:47","","","","",,,,,4,2.00,1,5,2,"Deep neural network based question answering (QA) models are neither robust nor explainable in many cases. For example, a multiple-choice QA model, tested without any input of question, is surprisingly ""capable"" to predict the most of correct options. In this paper, we inspect such spurious ""capability"" of QA models using causal inference. We find the crux is the shortcut correlation, e.g., unrobust word alignment between passage and options learned by the models. We propose a novel approach called Counterfactual Variable Control (CVC) that explicitly mitigates any shortcut correlation and preserves the comprehensive reasoning for robust QA. Specifically, we leverage multi-branch architecture that allows us to disentangle robust and shortcut correlations in the training process of QA. We then conduct two novel CVC inference methods (on trained models) to capture the effect of comprehensive reasoning as the final prediction. For evaluation, we conduct extensive experiments using two BERT backbones on both multi-choice and span-extraction QA benchmarks. The results show that our CVC achieves high robustness against a variety of adversarial attacks in QA while maintaining good interpretation ability.","",""
1,"Zhucheng Zhan, Noshad Hossenei, Olivier B. Poirion, M. Westerhoff, Eun-Young Choi, T. Ching, L. Garmire","Two-stage Neural-network based Prognosis Models using Pathological Image and Transcriptomic Data: An Application in Hepatocellular Carcinoma Patient Survival Prediction",2020,"","","","",13,"2022-07-13 10:08:47","","10.1101/2020.01.25.20016832","","",,,,,1,0.50,0,7,2,"Pathological images are easily accessible data type with potential as prognostic biomarkers. Here we extend Cox-nnet, a neural network based prognosis method previously used for transcriptomics data, to predict patient survival using hepatocellular carcinoma (HCC) pathological images. Cox-nnet based imaging predictions are more robust and accurate than Cox-PH. Moreover, using a novel two-stage Cox-nnet complex model, we are able to combine pathology image and transcriptomics RNA-Seq data to make impressively accurate prognosis predictions, with C-index close to 0.90 and log-ranked p-value of 4e-21 in the testing dataset. This work provides a new, biologically relevant and relatively interpretable solution to the challenge of integrating multi-modal and multiple types of data, particularly for survival prediction.","",""
1,"Ying L. Becker, Lingfeng Guo, Odilbek Nurmamatov","Assessing Asset Tail Risk with Artificial Intelligence: The Application of Artificial Neural Network",2020,"","","","",14,"2022-07-13 10:08:47","","10.1108/s2514-465020200000008002","","",,,,,1,0.50,0,3,2,"Value at risk (VaR) and expected shortfall (ES) are popular market risk measurements. The former is not coherent but robust, whereas the latter is coherent but less interpretable, only conditionally backtestable and less robust. In this chapter, we compare an innovative artificial neural network (ANN) model with a time series model in the context of forecasting VaR and ES of the univariate time series of four asset classes: US large capitalization equity index, European large cap equity index, US bond index, and US dollar versus euro exchange rate price index for the period of January 4, 1999, to December 31, 2018. In general, the ANN model has more favorable backtesting results as compared to the autoregressive moving average, generalized autoregressive conditional heteroscedasticity (ARMA-GARCH) time series model. In terms of forecasting accuracy, the ANN model has much fewer in-sample and out-of-sample exceptions than those of the ARMA-GARCH model.","",""
5,"Tsung-Yen Yang, Karthik Narasimham","Robust and Interpretable Grounding of Spatial References with Relation Networks",2020,"","","","",15,"2022-07-13 10:08:47","","10.18653/v1/2020.findings-emnlp.172","","",,,,,5,2.50,3,2,2,"Learning representations of spatial references in natural language is a key challenge in tasks like autonomous navigation and robotic manipulation. Recent work has investigated various neural architectures for learning multi-modal representations for spatial concepts. However, the lack of explicit reasoning over entities makes such approaches vulnerable to noise in input text or state observations. In this paper, we develop effective models for understanding spatial references in text that are robust and interpretable, without sacrificing performance. We design a text-conditioned relation network whose parameters are dynamically computed with a cross-modal attention module to capture fine-grained spatial relations between entities. This design choice provides interpretability of learned intermediate outputs. Experiments across three tasks demonstrate that our model achieves superior performance, with a 17% improvement in predicting goal locations and a 15% improvement in robustness compared to state-of-the-art systems.","",""
5,"Zicheng Hu, A. Tang, Jaiveer Singh, Sanchita Bhattacharya, A. Butte","A robust and interpretable, end-to-end deep learning model for cytometry data",2020,"","","","",16,"2022-07-13 10:08:47","","10.1101/2020.02.05.934521","","",,,,,5,2.50,1,5,2,"Cytometry technologies are essential tools for immunology research, providing high-throughput measurements of the immune cells at the single-cell level. Traditional approaches in interpreting and using cytometry measurements include manual or automated gating to identify cell subsets from the cytometry data, providing highly intuitive results but may lead to significant information loss, in that additional details in measured or correlated cell signals might be missed. In this study, we propose and test a deep convolutional neural network for analyzing cytometry data in an end-to-end fashion, allowing a direct association between raw cytometry data and the clinical outcome of interest. Using nine large CyTOF studies from the open-access ImmPort database, we demonstrated that the deep convolutional neural network model can accurately diagnose the latent cytomegalovirus (CMV) in healthy individuals, even when using highly heterogeneous data from different studies. In addition, we developed a permutation-based method for interpreting the deep convolutional neural network model and identified a CD27-CD94+ CD8+ T cell population significantly associated with latent CMV infection. Finally, we provide a tutorial for creating, training and interpreting the tailored deep learning model for cytometry data using Keras and TensorFlow (github.com/hzc363/DeepLearningCyTOF).","",""
1,"André Ferreira, S. Madeira, M. Gromicho, M. Carvalho, S. Vinga, Alexandra M. Carvalho","Predictive Medicine Using Interpretable Recurrent Neural Networks",2020,"","","","",17,"2022-07-13 10:08:47","","10.1007/978-3-030-68763-2_14","","",,,,,1,0.50,0,6,2,"","",""
