Cites,Authors,Title,Year,Source,Publisher,ArticleURL,CitesURL,GSRank,QueryDate,Type,DOI,ISSN,CitationURL,Volume,Issue,StartPage,EndPage,ECC,CitesPerYear,CitesPerAuthor,AuthorCount,Age,Abstract,FullTextURL,RelatedURL
6,"Souvik Kundu, K. Sim, M. Gales","Incorporating a Generative Front-End Layer to Deep Neural Network for Noise Robust Automatic Speech Recognition",2016,"","","","",111,"2022-07-13 10:08:47","","10.21437/Interspeech.2016-760","","",,,,,6,1.00,2,3,6,"It is difficult to apply well-formulated model-based noise adaptation approaches to Deep Neural Network (DNN) due to the lack of interpretability of the model parameters. In this paper, we propose incorporating a generative front-end layer (GFL), which is parameterised by Gaussian Mixture Model (GMM), into the DNN. A GFL can be easily adapted to different noise conditions by applying the model-based Vector Taylor Series (VTS) to the underlying GMM. We show that incorporating a GFL to DNN yields 12.1% relative improvement over a baseline multi-condition DNN. We also show that the proposed system performs significantly better than the noise aware training method, where the per-utterance estimated noise parameters are appended to the acoustic features.","",""
4,"Praveenram Balachandar, K. Michmizos","A Spiking Neural Network Emulating the Structure of the Oculomotor System Requires No Learning to Control a Biomimetic Robotic Head",2020,"","","","",112,"2022-07-13 10:08:47","","10.1109/BioRob49111.2020.9224303","","",,,,,4,2.00,2,2,2,"Robotic vision introduces requirements for real-time processing of fast-varying, noisy information in a continuously changing environment. In a real-world environment, convenient assumptions, such as static camera systems and deep learning algorithms devouring high volumes of ideally slightlyvarying data are hard to survive. Leveraging on recent studies on the neural connectome associated with eye movements, we designed a neuromorphic oculomotor controller and placed it at the heart of our in-house biomimetic robotic head prototype. The controller is unique in the sense that (1) all data are encoded and processed by a spiking neural network (SNN), and (2) by mimicking the associated brain areas’ topology, the SNN is biologically interpretable and requires no training to operate. Here, we report the robot’s target tracking ability, demonstrate that its eye kinematics are similar to those reported in human eye studies and show that a biologically-constrained learning, although not required for the SNN’s function, can be used to further refine its performance. This work aligns with our ongoing effort to develop energy-efficient neuromorphic SNNs and harness their emerging intelligence to control biomimetic robots with versatility and robustness.","",""
8,"D. Valeriani, K. Simonyan","A microstructural neural network biomarker for dystonia diagnosis identified by a DystoniaNet deep learning platform",2020,"","","","",113,"2022-07-13 10:08:47","","10.1073/pnas.2009165117","","",,,,,8,4.00,4,2,2,"Significance This research identified a microstructural neural network biomarker for objective and accurate diagnosis of isolated dystonia based on the disorder pathophysiology using an advanced deep learning algorithm, DystoniaNet, and raw structural brain images of large cohorts of patients with isolated focal dystonia and healthy controls. DystoniaNet significantly outperformed shallow machine-learning pipelines and substantially exceeded the current agreement rates between clinicians, reaching an overall accuracy of 98.8% in diagnosing different forms of isolated focal dystonia. These results suggest that DystoniaNet could serve as an objective, robust, and generalizable algorithmic platform of dystonia diagnosis for enhanced clinical decision-making. Implementation of the identified biomarker for objective and accurate diagnosis of dystonia may be transformative for clinical management of this disorder. Isolated dystonia is a neurological disorder of heterogeneous pathophysiology, which causes involuntary muscle contractions leading to abnormal movements and postures. Its diagnosis is remarkably challenging due to the absence of a biomarker or gold standard diagnostic test. This leads to a low agreement between clinicians, with up to 50% of cases being misdiagnosed and diagnostic delays extending up to 10.1 y. We developed a deep learning algorithmic platform, DystoniaNet, to automatically identify and validate a microstructural neural network biomarker for dystonia diagnosis from raw structural brain MRIs of 612 subjects, including 392 patients with three different forms of isolated focal dystonia and 220 healthy controls. DystoniaNet identified clusters in corpus callosum, anterior and posterior thalamic radiations, inferior fronto-occipital fasciculus, and inferior temporal and superior orbital gyri as the biomarker components. These regions are known to contribute to abnormal interhemispheric information transfer, heteromodal sensorimotor processing, and executive control of motor commands in dystonia pathophysiology. The DystoniaNet-based biomarker showed an overall accuracy of 98.8% in diagnosing dystonia, with a referral of 3.5% of cases due to diagnostic uncertainty. The diagnostic decision by DystoniaNet was computed in 0.36 s per subject. DystoniaNet significantly outperformed shallow machine-learning algorithms in benchmark comparisons, showing nearly a 20% increase in its diagnostic performance. Importantly, the microstructural neural network biomarker and its DystoniaNet platform showed substantial improvement over the current 34% agreement on dystonia diagnosis between clinicians. The translational potential of this biomarker is in its highly accurate, interpretable, and generalizable performance for enhanced clinical decision-making.","",""
2,"Patrick McClure, D. Moraczewski, K. Lam, Adam Thomas, Francisco Pereira","Evaluating Adversarial Robustness for Deep Neural Network Interpretability using fMRI Decoding",2020,"","","","",114,"2022-07-13 10:08:47","","","","",,,,,2,1.00,0,5,2,"While deep neural networks (DNNs) are being increasingly used to make predictions from high-dimensional, complex data, they are widely seen as uninterpretable ""black boxes"", since it can be difficult to discover what input information is used to make predictions. This ability is particularly important for applications in cognitive neuroscience and neuroinformatics. A saliency map is a common approach for producing interpretable visualizations of the relative importance of input features for a prediction. However, many methods for creating these maps fail due to focusing too much on the input or being extremely sensitive to small input noise. It is also challenging to quantitatively evaluate how well saliency maps correspond to the truly relevant input information. In this paper, we develop two quantitative evaluation procedures for saliency methods, using the fact that the Human Connectome Project (HCP) dataset contains functional magnetic resonance imaging (fMRI) data from multiple tasks per subject to create ground truth saliency maps. We then introduce an adversarial training method that makes DNNs robust to small input noise, and demonstrate that it measurably improves interpretability.","",""
2,"G. Baudat, John B. Hayes","A star-test wavefront sensor using neural network analysis",2020,"","","","",115,"2022-07-13 10:08:47","","10.1117/12.2568018","","",,,,,2,1.00,1,2,2,"We describe a new, simple wavefront sensing method that uses a single measurement of a defocused star and a neural network to determine low-order wavefront components. The neural net is trained on computed diffracted star image data at 640 nm to output annular Zernike terms for an obscured circular aperture over a discrete range of all values. In the context of an actual star, the neural-net also provides the Fried’s parameter as an estimation of atmospheric turbulence. It is shown that the neural-net can produce a robust, high accuracy solution of the wavefront based on a single measurement. The method can also be used to simultaneously determine both on-axis and fielddependent wavefront performance from a single measurement of stars throughout the field. The prototype system can run at a rate of about 1 Hz with Python interpreted code, but higher speeds, up to video rates, are possible with compilation, proper hardware and optimization. This technique is particularly useful for low-order active-optics control and for optical alignment. A key advantage of this new method is that it only requires a single camera making it a simple cost-effective solution that can take advantage of an existing camera that may already be in an optical system. Results for this method are compared to high-precision interferometric data taken with a 4D Technology, PhaseCam interferometer and with an Innovations Foresight StarWave Shack Hartmann sensor from ALCOR SYSTEM under well-controlled conditions to validate performance. We also look at how the system has been implemented to use starlight for aligning multiple mirror telescopes in the presence of atmospheric seeing.","",""
0,"Amit Sahu, Noelia V'allez, Rosana Rodr'iguez-Bobada, Mohamad Alhaddad, Omar Moured, G. Neugschwandtner","Application of the Neural Network Dependability Kit in Real-World Environments",2020,"","","","",116,"2022-07-13 10:08:47","","","","",,,,,0,0.00,0,6,2,"In this paper, we provide a guideline for using the Neural Network Dependability Kit (NNDK) during the development process of NN models, and show how the algorithm is applied in two image classification use cases. The case studies demonstrate the usage of the dependability kit to obtain insights about the NN model and how they informed the development process of the neural network model. After interpreting neural networks via the different metrics available in the NNDK, the developers were able to increase the NNs' accuracy, trust the developed networks, and make them more robust. In addition, we obtained a novel application-oriented technique to provide supporting evidence for an NN's classification result to the user. In the medical image classification use case, it was used to retrieve case images from the training dataset that were similar to the current patient's image and could therefore act as a support for the NN model's decision and aid doctors in interpreting the results.","",""
1,"Adam D. Cobb, Brian Jalaian, Nathaniel D. Bastian, Stephen Russell","Robust Decision-Making in the Internet of Battlefield Things Using Bayesian Neural Networks",2021,"","","","",117,"2022-07-13 10:08:47","","10.1109/WSC52266.2021.9715532","","",,,,,1,1.00,0,4,1,"The Internet of Battlefield Things (IoBT) is a dynamically composed network of intelligent sensors and actuators that operate as a command and control, communications, computers, and intelligence complex-system with the aim to enable multi-domain operations. The use of artificial intelligence can help transform the IoBT data into actionable insight to create information and decision advantage on the battlefield. In this work, we focus on how accounting for uncertainty in IoBT systems can result in more robust and safer systems. Human trust in these systems requires the ability to understand and interpret how machines make decisions. Most real-world applications currently use deterministic machine learning techniques that cannot incorporate uncertainty. In this work, we focus on the machine learning task of classifying vehicles from their audio recordings, comparing deterministic convolutional neural networks (CNNs) with Bayesian CNNs to show that correctly estimating the uncertainty can help lead to robust decision-making in IoBT.","",""
0,"G. Henter, S. Ronanki, O. Watts, M. Wester, Zhizheng Wu, Simon King","Robust text-to-speech duration modelling with a deep neural network",2016,"","","","",118,"2022-07-13 10:08:47","","10.1121/1.4969147","","",,,,,0,0.00,0,6,6,"Accurate modeling and prediction of speech-sound durations is important for generating more natural synthetic speech. Deep neural networks (DNNs) offer powerful models, and large, found corpora of natural speech are easily acquired for training them. Unfortunately, poor quality control (e.g., transcription errors) and phenomena such as reductions and filled pauses complicate duration modelling from found speech data. To mitigate issues caused by these idiosyncrasies, we propose to incorporate methods from robust statistics into speech synthesis. Robust methods can disregard ill-fitting training-data points—errors or other outliers—to describe the typical case better. For instance, parameter estimation can be made robust by replacing maximum likelihood with a robust estimation criterion based on the density power divergence (a.k.a. the β-divergence). Alternatively, a standard approximation for output generation with mixture density networks (MDNs) can be interpreted as a robust output generation heuristic....","",""
0,"William Knauth","The Self-Simplifying Machine: Exploiting the Structure of Piecewise Linear Neural Networks to Create Interpretable Models",2020,"","","","",119,"2022-07-13 10:08:47","","","","",,,,,0,0.00,0,1,2,"Today, it is more important than ever before for users to have trust in the models they use. As Machine Learning models fall under increased regulatory scrutiny and begin to see more applications in high-stakes situations, it becomes critical to explain our models. Piecewise Linear Neural Networks (PLNN) with the ReLU activation function have quickly become extremely popular models due to many appealing properties; however, they still present many challenges in the areas of robustness and interpretation. To this end, we introduce novel methodology toward simplification and increased interpretability of Piecewise Linear Neural Networks for classification tasks. Our methods include the use of a trained, deep network to produce a well-performing, single-hidden-layer network without further stochastic training, in addition to an algorithm to reduce flat networks to a smaller, more interpretable size with minimal loss in performance. On these methods, we conduct preliminary studies of model performance, as well as a case study on Wells Fargo's Home Lending dataset, together with visual model interpretation.","",""
0,"Justin A. Goodwin, Olivia M. Brown, Victoria Helus","Fast Training of Deep Neural Networks Robust to Adversarial Perturbations",2020,"","","","",120,"2022-07-13 10:08:47","","10.1109/HPEC43674.2020.9286256","","",,,,,0,0.00,0,3,2,"Despite their promising performance, deep neural networks have shown sensitivities to perturbations of their inputs (e.g., adversarial examples) and their learned feature representations are often difficult to interpret, raising concerns about their true capability and trustworthiness. Recent work in adversarial training, a form of robust optimization in which the model is optimized against adversarial examples, demonstrates the ability to improve performance sensitivities to perturbations and yield feature representations that are more interpretable. Adversarial training, however, comes with an increased computational cost over that of standard (i.e., nonrobust) training, rendering it impractical for use in large-scale problems. Recent work suggests that a fast approximation to adversarial training shows promise for reducing training time and maintaining robustness in the presence of perturbations bounded by the infinity norm. In this work, we demonstrate that this approach extends to the Euclidean norm and preserves the human-aligned feature representations that are common for robust models. Additionally, we show that using a distributed training scheme can further reduce the time to train robust deep networks. Fast adversarial training is a promising approach that will provide increased security and explainability in machine learning applications for which robust optimization was previously thought to be impractical.","",""
327,"Nicolas Papernot, P. Mcdaniel","Deep k-Nearest Neighbors: Towards Confident, Interpretable and Robust Deep Learning",2018,"","","","",121,"2022-07-13 10:08:47","","","","",,,,,327,81.75,164,2,4,"Deep neural networks (DNNs) enable innovative applications of machine learning like image recognition, machine translation, or malware detection. However, deep learning is often criticized for its lack of robustness in adversarial settings (e.g., vulnerability to adversarial inputs) and general inability to rationalize its predictions. In this work, we exploit the structure of deep learning to enable new learning-based inference and decision strategies that achieve desirable properties such as robustness and interpretability. We take a first step in this direction and introduce the Deep k-Nearest Neighbors (DkNN). This hybrid classifier combines the k-nearest neighbors algorithm with representations of the data learned by each layer of the DNN: a test input is compared to its neighboring training points according to the distance that separates them in the representations. We show the labels of these neighboring points afford confidence estimates for inputs outside the model's training manifold, including on malicious inputs like adversarial examples--and therein provides protections against inputs that are outside the models understanding. This is because the nearest neighbors can be used to estimate the nonconformity of, i.e., the lack of support for, a prediction in the training data. The neighbors also constitute human-interpretable explanations of predictions. We evaluate the DkNN algorithm on several datasets, and show the confidence estimates accurately identify inputs outside the model, and that the explanations provided by nearest neighbors are intuitive and useful in understanding model failures.","",""
64,"H. C. Liaw, B. Shirinzadeh, Julian Smith","Robust Neural Network Motion Tracking Control of Piezoelectric Actuation Systems for Micro/Nanomanipulation",2009,"","","","",122,"2022-07-13 10:08:47","","10.1109/TNN.2008.2004406","","",,,,,64,4.92,21,3,13,"This paper presents a robust neural network motion tracking control methodology for piezoelectric actuation systems employed in micro/nanomanipulation. This control methodology is proposed for tracking of desired motion trajectories in the presence of unknown system parameters, nonlinearities including the hysteresis effect and external disturbances in the control systems. In this paper, the related control issues are investigated, and a control methodology is established including the neural networks and a sliding control scheme. In particular, the radial basis function (RBF) neural networks are chosen for function approximations. The stability of the closed-loop system, as well as the convergence of the position and velocity tracking errors to zero, is assured by the control methodology in the presence of the aforementioned conditions. An offline learning procedure is also proposed for the improvement of the motion tracking performance. Precise tracking results of the proposed control methodology for a desired motion trajectory are demonstrated in the experimental study. With such a motion tracking capability, the proposed control methodology promises the realization of high-performance piezoelectric actuated micro/nanomanipulation systems.","",""
5,"Jan Rudy, Weiguang Ding, Daniel Jiwoong Im, Graham W. Taylor","Neural Network Regularization via Robust Weight Factorization",2014,"","","","",123,"2022-07-13 10:08:47","","","","",,,,,5,0.63,1,4,8,"Regularization is essential when training large neural networks. As deep neural networks can be mathematically interpreted as universal function approximators, they are effective at memorizing sampling noise in the training data. This results in poor generalization to unseen data. Therefore, it is no surprise that a new regularization technique, Dropout, was partially responsible for the now-ubiquitous winning entry to ImageNet 2012 by the University of Toronto. Currently, Dropout (and related methods such as DropConnect) are the most effective means of regularizing large neural networks. These amount to efficiently visiting a large number of related models at training time, while aggregating them to a single predictor at test time. The proposed FaMe model aims to apply a similar strategy, yet learns a factorization of each weight matrix such that the factors are robust to noise.","",""
11,"Ming Jin, Heng Chang, Wenwu Zhu, S. Sojoudi","Power up! Robust Graph Convolutional Network via Graph Powering",2019,"","","","",124,"2022-07-13 10:08:47","","","","",,,,,11,3.67,3,4,3,"Graph convolutional networks (GCNs) are powerful tools for graph-structured data. However, they have been recently shown to be vulnerable to topological attacks. To enhance adversarial robustness, we go beyond spectral graph theory to robust graph theory. By challenging the classical graph Laplacian, we propose a new convolution operator that is provably robust in the spectral domain and is incorporated in the GCN architecture to improve expressivity and interpretability. By extending the original graph to a sequence of graphs, we also propose a robust training paradigm that encourages transferability across graphs that span a range of spatial and spectral characteristics. The proposed approaches are demonstrated in extensive experiments to simultaneously improve performance in both benign and adversarial situations. Introduction Graph convolutional networks (GCNs) are powerful extensions of convolutional neural networks (CNN) to graphstructured data. Recently, GCNs and variants have been applied to a wide range of domains, achieving state-of-the-art performances in social networks (Kipf and Welling 2017), traffic prediction (Rahimi, Cohn, and Baldwin 2018), recommendation systems (Ying et al. 2018), applied chemistry and biology (Kearnes et al. 2016; Fout et al. 2017), and natural language processing (Atwood and Towsley 2016; Hamilton, Ying, and Leskovec 2017; Bastings et al. 2017; Marcheggiani and Titov 2017), just to name a few (Zhou et al. 2018; Wu et al. 2019). GCNs belong to a family of spectral methods that deal with spectral representations of graphs (Zhou et al. 2018; Wu et al. 2019). A fundamental ingredient of GCNs is the graph convolution operation defined by the graph Laplacian in the Fourier domain: gθ ? x := ĝθ(L)x, (1) where x ∈ R is the graph signal on the set of vertices V and ĝθ is a spectral function applied to the graph Laplacian L := D − A (where D and A are the degree matrix and *The two first authors made equal contributions. This work was conducted during Heng Chang’s visit to Professor Somayeh Sojoudi’s group at UC Berkeley. Copyright © 2021, Association for the Advancement of Artificial Intelligence (www.aaai.org). All rights reserved. the adjacency matrix, respectively). Because this operation is computational intensive for large graphs and non-spatially localized (Bruna et al. 2014), early attempts relied on a parameterization with smooth coefficients (Henaff, Bruna, and LeCun 2015) or a truncated expansion in terms of of Chebyshev polynomials (Hammond, Vandergheynst, and Gribonval 2011). By further restricting the Chebyshev polynomial order by 2, the approach in (Kipf and Welling 2017) referred henceforth as the vanilla GCN pushed the state-of-the-art performance of semi-supervised learning. The network has the following layer-wise update rule: H := ψ ( AHW (l) ) , (2) where H is the l-th layer hidden state (with H := X as nodal features),W (l) is the l-th layer weight matrix, ψ is the usual point-wise activation function, and A is the convolution operator chosen to be the degree weighted Laplacian with some slight modifications (Kipf and Welling 2017). Subsequent GCN variants have different architectures, but they all share the use of the Laplacian matrix as the convolution operator (Zhou et al. 2018; Wu et al. 2019). Why Not Graph Laplacian? Undoubtedly, the Laplacian operator (and its variants, e.g., normalized/powered Laplacian) plays a central role in spectral theory, and is a natural choice for a variety of spectral algorithms such as principal component analysis, clustering and linear embeddings (Chung and Graham 1997; Belkin and Niyogi 2002). So what can be problematic? From a spatial perspective, GCNs with d layers cannot acquire nodal information beyond its d-distance neighbors; hence, it severely limits its scope of data fusion. Recent works (Lee et al. 2018; Abu-El-Haija et al. 2018, 2019; Wu et al. 2019) alleviated this issue by directly powering the graph Laplacian. From a spectral perspective, one could demand better spectral properties, given that GCN is fundamentally a particular (yet effective) approximation of the spectral convolution (1). A key desirable property for generic spectral methods is known as “spectral separation,” namely the spectrum should comprise a few dominant eigenvalues whose associated eigenvectors reveal the sought structure in the graph. A well-known prototype is the Ramanujan property, for which the second The Thirty-Fifth AAAI Conference on Artificial Intelligence (AAAI-21)","",""
