Cites,Authors,Title,Year,Source,Publisher,ArticleURL,CitesURL,GSRank,QueryDate,Type,DOI,ISSN,CitationURL,Volume,Issue,StartPage,EndPage,ECC,CitesPerYear,CitesPerAuthor,AuthorCount,Age,Abstract,FullTextURL,RelatedURL
1,"Y. Lu, Ilgiz Murzakhanov, Spyros Chatzivasileiadis","Neural network interpretability for forecasting of aggregated renewable generation",2021,"","","","",1,"2022-07-13 10:10:07","","10.1109/SmartGridComm51999.2021.9631993","","",,,,,1,1.00,0,3,1,"With the rapid growth of renewable energy, lots of small photovoltaic (PV) prosumers emerge. Due to the uncertainty of solar power generation, there is a need for aggregated prosumers to predict solar power generation and whether solar power generation will be larger than load. This paper presents two interpretable neural networks to solve the problem: one binary classification neural network and one regression neural network. The neural networks are built using TensorFlow. The global feature importance and local feature contributions are examined by three gradient-based methods: Integrated Gradients, Expected Gradients, and DeepLIFT. Moreover, we detect abnormal cases when predictions might fail by estimating the prediction uncertainty using Bayesian neural networks. Neural networks, which are interpreted by the gradient-based methods and complemented with uncertainty estimation, provide robust and explainable forecasting for decision-makers.","",""
0,"Lech Szymanski, B. McCane, C. Atkinson","Switched linear projections and inactive state sensitivity for deep neural network interpretability",2019,"","","","",2,"2022-07-13 10:10:07","","","","",,,,,0,0.00,0,3,3,"We introduce switched linear projections for expressing the activity of a neuron in a ReLU-based deep neural network in terms of a single linear projection in the input space. The method works by isolating the active subnetwork, a series of linear transformations, that completely determine the entire computation of the deep network for a given input instance. We also propose that for interpretability it is more instructive and meaningful to focus on the patterns that deactive the neurons in the network, which are ignored by the exisiting methods that implicitly track only the active aspect of the network's computation. We introduce a novel interpretability method for the inactive state sensitivity (Insens). Comparison against existing methods shows that Insens is more robust (in the presence of noise), more complete (in terms of patterns that affect the computation) and a very effective interpretability method for deep neural networks.","",""
5,"Hui Guo, Shu Hu, Xin Wang, Ming-Ching Chang, Siwei Lyu","Robust Attentive Deep Neural Network for Exposing GAN-generated Faces",2021,"","","","",3,"2022-07-13 10:10:07","","","","",,,,,5,5.00,1,5,1,"GAN-based techniques that generate and synthesize realistic faces have caused severe social concerns and security problems. Existing methods for detecting GAN-generated faces can perform well on limited public datasets. However, images from existing public datasets do not represent real-world scenarios well enough in terms of view variations and data distributions (where real faces largely outnumber synthetic faces). The stateof-the-art methods do not generalize well in real-world problems and lack the interpretability of detection results. Performance of existing GAN-face detection models degrades significantly when facing imbalanced data distributions. To address these shortcomings, we propose a robust, attentive, end-to-end network that can spot GAN-generated faces by analyzing their eye inconsistencies. Specifically, our model learns to identify inconsistent eye components by localizing and comparing the iris artifacts between the two eyes automatically. Our deep network addresses the imbalance learning issues by considering the AUC loss and the traditional cross-entropy loss jointly. Comprehensive evaluations of the FFHQ dataset in terms of both balanced and imbalanced scenarios demonstrate the superiority of the proposed method.","",""
9,"Adam Noack, Isaac Ahern, D. Dou, Boyang Li","An Empirical Study on the Relation Between Network Interpretability and Adversarial Robustness",2020,"","","","",4,"2022-07-13 10:10:07","","10.1007/s42979-020-00390-x","","",,,,,9,4.50,2,4,2,"","",""
17,"Yi-Shan Lin, Wen-Chuan Lee, Z. B. Celik","What Do You See?: Evaluation of Explainable Artificial Intelligence (XAI) Interpretability through Neural Backdoors",2020,"","","","",5,"2022-07-13 10:10:07","","10.1145/3447548.3467213","","",,,,,17,8.50,6,3,2,"EXplainable AI (XAI) methods have been proposed to interpret how a deep neural network predicts inputs through model saliency explanations that highlight the input parts deemed important to arrive at a decision for a specific target. However, it remains challenging to quantify the correctness of their interpretability as current evaluation approaches either require subjective input from humans or incur high computation cost with automated evaluation. In this paper, we propose backdoor trigger patterns--hidden malicious functionalities that cause misclassification--to automate the evaluation of saliency explanations. Our key observation is that triggers provide ground truth for inputs to evaluate whether the regions identified by an XAI method are truly relevant to its output. Since backdoor triggers are the most important features that cause deliberate misclassification, a robust XAI method should reveal their presence at inference time. We introduce three complementary metrics for the systematic evaluation of explanations that an XAI method generates. We evaluate seven state-of-the-art model-free and model-specific post-hoc methods through 36 models trojaned with specifically crafted triggers using color, shape, texture, location, and size. We found six methods that use local explanation and feature relevance fail to completely highlight trigger regions, and only a model-free approach can uncover the entire trigger region. We made our code available at https://github.com/yslin013/evalxai.","",""
22,"Akhilan Boopathy, Sijia Liu, Gaoyuan Zhang, Cynthia Liu, Pin-Yu Chen, Shiyu Chang, L. Daniel","Proper Network Interpretability Helps Adversarial Robustness in Classification",2020,"","","","",6,"2022-07-13 10:10:07","","","","",,,,,22,11.00,3,7,2,"Recent works have empirically shown that there exist adversarial examples that can be hidden from neural network interpretability (namely, making network interpretation maps visually similar), or interpretability is itself susceptible to adversarial attacks. In this paper, we theoretically show that with a proper measurement of interpretation, it is actually difficult to prevent prediction-evasion adversarial attacks from causing interpretation discrepancy, as confirmed by experiments on MNIST, CIFAR-10 and Restricted ImageNet. Spurred by that, we develop an interpretability-aware defensive scheme built only on promoting robust interpretation (without the need for resorting to adversarial loss minimization). We show that our defense achieves both robust classification and robust interpretation, outperforming state-of-the-art adversarial training methods against attacks of large perturbation in particular.","",""
6,"Souvik Kundu, K. Sim, M. Gales","Incorporating a Generative Front-End Layer to Deep Neural Network for Noise Robust Automatic Speech Recognition",2016,"","","","",7,"2022-07-13 10:10:07","","10.21437/Interspeech.2016-760","","",,,,,6,1.00,2,3,6,"It is difficult to apply well-formulated model-based noise adaptation approaches to Deep Neural Network (DNN) due to the lack of interpretability of the model parameters. In this paper, we propose incorporating a generative front-end layer (GFL), which is parameterised by Gaussian Mixture Model (GMM), into the DNN. A GFL can be easily adapted to different noise conditions by applying the model-based Vector Taylor Series (VTS) to the underlying GMM. We show that incorporating a GFL to DNN yields 12.1% relative improvement over a baseline multi-condition DNN. We also show that the proposed system performs significantly better than the noise aware training method, where the per-utterance estimated noise parameters are appended to the acoustic features.","",""
2,"Gurpreet Singh, Soumyajit Gupta, Matt Lease, Clint N. Dawson","TIME: A Transparent, Interpretable, Model-Adaptive and Explainable Neural Network for Dynamic Physical Processes",2020,"","","","",8,"2022-07-13 10:10:07","","","","",,,,,2,1.00,1,4,2,"Partial Differential Equations are infinite dimensional encoded representations of physical processes. However, imbibing multiple observation data towards a coupled representation presents significant challenges. We present a fully convolutional architecture that captures the invariant structure of the domain to reconstruct the observable system. The proposed architecture is significantly low-weight compared to other networks for such problems. Our intent is to learn coupled dynamic processes interpreted as deviations from true kernels representing isolated processes for model-adaptivity. Experimental analysis shows that our architecture is robust and transparent in capturing process kernels and system anomalies. We also show that high weights representation is not only redundant but also impacts network interpretability. Our design is guided by domain knowledge, with isolated process representations serving as ground truths for verification. These allow us to identify redundant kernels and their manifestations in activation maps to guide better designs that are both interpretable and explainable unlike traditional deep-nets.","",""
28,"Nicholas Carlini","Is AmI (Attacks Meet Interpretability) Robust to Adversarial Examples?",2019,"","","","",9,"2022-07-13 10:10:07","","","","",,,,,28,9.33,28,1,3,"No. I. ATTACKING “ATTACKS MEET INTERPRETABILITY” AmI (Attacks meet Interpretability) is an “attribute-steered” defense [3] to detect [1] adversarial examples [2] on facerecognition models. By applying interpretability techniques to a pre-trained neural network, AmI identifies “important” neurons. It then creates a second augmented neural network with the same parameters but increases the weight activations of important neurons. AmI rejects inputs where the original and augmented neural network disagree. We find that this defense (presented at at NeurIPS 2018 as a spotlight paper—the top 3% of submissions) is completely ineffective, and even defense-oblivious1 attacks reduce the detection rate to 0% on untargeted attacks. That is, AmI is no more robust to untargeted attacks than the undefended original network. Figure 1 shows selected adversarial examples that fool the AmI defense. We are incredibly grateful to the authors for releasing their source code2 which we build on3. We hope that future work will continue to release source code by publication time to accelerate progress in this field.","",""
1,"Huijun Wu, Chen Wang, R. Nock, Wei Wang, Jie Yin, Kai Lu, Liming Zhu","SMINT: Toward Interpretable and Robust Model Sharing for Deep Neural Networks",2020,"","","","",10,"2022-07-13 10:10:07","","10.1145/3381833","","",,,,,1,0.50,0,7,2,"Sharing a pre-trained machine learning model, particularly a deep neural network via prediction APIs, is becoming a common practice on machine learning as a service (MLaaS) platforms nowadays. Although deep neural networks (DNN) have shown remarkable successes in many tasks, they are also criticized for the lack of interpretability and transparency. Interpreting a shared DNN model faces two additional challenges compared with interpreting a general model. (1) Limited training data can be disclosed to users. (2) The internal structure of the models may not be available. These two challenges impede the application of most existing interpretability approaches, such as saliency maps or influence functions, for DNN models. Case-based reasoning methods have been used for interpreting decisions; however, how to select and organize the data points under the constraints of shared DNN models is not discussed. Moreover, simply providing cases as explanations may not be sufficient for supporting instance level interpretability. Meanwhile, existing interpretation methods for DNN models generally lack the means to evaluate the reliability of the interpretation. In this article, we propose a framework named Shared Model INTerpreter (SMINT) to address the above limitations. We propose a new data structure called a boundary graph to organize training points to mimic the predictions of DNN models. We integrate local features, such as saliency maps and interpretable input masks, into the data structure to help users to infer the model decision boundaries. We show that the boundary graph is able to address the reliability issues in many local interpretation methods. We further design an algorithm named hidden-layer aware p-test to measure the reliability of the interpretations. Our experiments show that SMINT is able to achieve above 99% fidelity to corresponding DNN models on both MNIST and ImageNet by sharing only a tiny fraction of training data to make these models interpretable. The human pilot study demonstrates that SMINT provides better interpretability compared with existing methods. Moreover, we demonstrate that SMINT is able to assist model tuning for better performance on different user data.","",""
11,"Ming Jin, Heng Chang, Wenwu Zhu, S. Sojoudi","Power up! Robust Graph Convolutional Network via Graph Powering",2019,"","","","",11,"2022-07-13 10:10:07","","","","",,,,,11,3.67,3,4,3,"Graph convolutional networks (GCNs) are powerful tools for graph-structured data. However, they have been recently shown to be vulnerable to topological attacks. To enhance adversarial robustness, we go beyond spectral graph theory to robust graph theory. By challenging the classical graph Laplacian, we propose a new convolution operator that is provably robust in the spectral domain and is incorporated in the GCN architecture to improve expressivity and interpretability. By extending the original graph to a sequence of graphs, we also propose a robust training paradigm that encourages transferability across graphs that span a range of spatial and spectral characteristics. The proposed approaches are demonstrated in extensive experiments to simultaneously improve performance in both benign and adversarial situations. Introduction Graph convolutional networks (GCNs) are powerful extensions of convolutional neural networks (CNN) to graphstructured data. Recently, GCNs and variants have been applied to a wide range of domains, achieving state-of-the-art performances in social networks (Kipf and Welling 2017), traffic prediction (Rahimi, Cohn, and Baldwin 2018), recommendation systems (Ying et al. 2018), applied chemistry and biology (Kearnes et al. 2016; Fout et al. 2017), and natural language processing (Atwood and Towsley 2016; Hamilton, Ying, and Leskovec 2017; Bastings et al. 2017; Marcheggiani and Titov 2017), just to name a few (Zhou et al. 2018; Wu et al. 2019). GCNs belong to a family of spectral methods that deal with spectral representations of graphs (Zhou et al. 2018; Wu et al. 2019). A fundamental ingredient of GCNs is the graph convolution operation defined by the graph Laplacian in the Fourier domain: gθ ? x := ĝθ(L)x, (1) where x ∈ R is the graph signal on the set of vertices V and ĝθ is a spectral function applied to the graph Laplacian L := D − A (where D and A are the degree matrix and *The two first authors made equal contributions. This work was conducted during Heng Chang’s visit to Professor Somayeh Sojoudi’s group at UC Berkeley. Copyright © 2021, Association for the Advancement of Artificial Intelligence (www.aaai.org). All rights reserved. the adjacency matrix, respectively). Because this operation is computational intensive for large graphs and non-spatially localized (Bruna et al. 2014), early attempts relied on a parameterization with smooth coefficients (Henaff, Bruna, and LeCun 2015) or a truncated expansion in terms of of Chebyshev polynomials (Hammond, Vandergheynst, and Gribonval 2011). By further restricting the Chebyshev polynomial order by 2, the approach in (Kipf and Welling 2017) referred henceforth as the vanilla GCN pushed the state-of-the-art performance of semi-supervised learning. The network has the following layer-wise update rule: H := ψ ( AHW (l) ) , (2) where H is the l-th layer hidden state (with H := X as nodal features),W (l) is the l-th layer weight matrix, ψ is the usual point-wise activation function, and A is the convolution operator chosen to be the degree weighted Laplacian with some slight modifications (Kipf and Welling 2017). Subsequent GCN variants have different architectures, but they all share the use of the Laplacian matrix as the convolution operator (Zhou et al. 2018; Wu et al. 2019). Why Not Graph Laplacian? Undoubtedly, the Laplacian operator (and its variants, e.g., normalized/powered Laplacian) plays a central role in spectral theory, and is a natural choice for a variety of spectral algorithms such as principal component analysis, clustering and linear embeddings (Chung and Graham 1997; Belkin and Niyogi 2002). So what can be problematic? From a spatial perspective, GCNs with d layers cannot acquire nodal information beyond its d-distance neighbors; hence, it severely limits its scope of data fusion. Recent works (Lee et al. 2018; Abu-El-Haija et al. 2018, 2019; Wu et al. 2019) alleviated this issue by directly powering the graph Laplacian. From a spectral perspective, one could demand better spectral properties, given that GCN is fundamentally a particular (yet effective) approximation of the spectral convolution (1). A key desirable property for generic spectral methods is known as “spectral separation,” namely the spectrum should comprise a few dominant eigenvalues whose associated eigenvectors reveal the sought structure in the graph. A well-known prototype is the Ramanujan property, for which the second The Thirty-Fifth AAAI Conference on Artificial Intelligence (AAAI-21)","",""
40,"J. Hao, Youngsoon Kim, Tae-Kyung Kim, Mingon Kang","PASNet: pathway-associated sparse deep neural network for prognosis prediction from high-throughput data",2018,"","","","",12,"2022-07-13 10:10:07","","10.1186/s12859-018-2500-z","","",,,,,40,10.00,10,4,4,"","",""
13,"S. Saralajew, Lars Holdijk, Maike Rees, T. Villmann","Prototype-based Neural Network Layers: Incorporating Vector Quantization",2018,"","","","",13,"2022-07-13 10:10:07","","","","",,,,,13,3.25,3,4,4,"Neural networks currently dominate the machine learning community and they do so for good reasons. Their accuracy on complex tasks such as image classification is unrivaled at the moment and with recent improvements they are reasonably easy to train. Nevertheless, neural networks are lacking robustness and interpretability. Prototype-based vector quantization methods on the other hand are known for being robust and interpretable. For this reason, we propose techniques and strategies to merge both approaches. This contribution will particularly highlight the similarities between them and outline how to construct a prototype-based classification layer for multilayer networks. Additionally, we provide an alternative, prototype-based, approach to the classical convolution operation. Numerical results are not part of this report, instead the focus lays on establishing a strong theoretical framework. By publishing our framework and the respective theoretical considerations and justifications before finalizing our numerical experiments we hope to jump-start the incorporation of prototype-based learning in neural networks and vice versa.","",""
0,"Zahra Kadkhodaie, Sreyas Mohan, Eero P. Simoncelli, C. Fernandez-Granda","Interpretable and robust blind image denoising with bias-free convolutional neural networks",2019,"","","","",14,"2022-07-13 10:10:07","","","","",,,,,0,0.00,0,4,3,"Deep convolutional networks often append additive constant (""bias"") terms to their convolution operations, enabling a richer repertoire of functional mappings. Biases are also used to facilitate training, by subtracting mean response over batches of training images (a component of ""batch normalization""). Recent state-of-the-art blind denoising methods seem to require these terms for their success. Here, however, we show that bias terms used in most CNNs (additive constants, including those used for batch normalization) interfere with the interpretability of these networks, do not help performance, and in fact prevent generalization of performance to noise levels not including in the training data. In particular, bias-free CNNs (BF-CNNs) are locally linear, and hence amenable to direct analysis with linear-algebraic tools. These analyses provide interpretations of network functionality in terms of projection onto a union of low-dimensional subspaces, connecting the learning-based method to more traditional denoising methodology. Additionally, BF-CNNs generalize robustly, achieving near-state-of-the-art performance at noise levels well beyond the range over which they have been trained.","",""
0,"Henry Eigen, Amir Sadovnik","TopKConv: Increased Adversarial Robustness Through Deeper Interpretability",2021,"","","","",15,"2022-07-13 10:10:07","","10.1109/ICMLA52953.2021.00011","","",,,,,0,0.00,0,2,1,"Vulnerability to adversarial inputs remains an issue for deep neural networks. Attackers can slightly modify inputs in order to cause adverse behavior in otherwise highly accurate networks. In addition to making these networks less secure for real world applications, this also emphasizes a misalignment between the features the network uses to make decisions and the ones humans use. In this work we propose that more interpretable networks should yield more robust ones since they are able to rely on features that are more understandable to humans. More specifically, we take inspiration from interpretability based approaches to adversarial robustness, and propose a sparsity based defense to counter the impact of overparameterization on adversarial vulnerability. Building off of the work of the Dynamic-K algorithm, which introduces dynamic routing to fully connected layers in order to encourage sparse, interpretable predictions, we propose TopKConv, a novel method of reducing the number of activation channels used to construct each convolutional feature map. The incorporation of TopKConv alongside Dynamic-k results in a significant increase in adversarial accuracy at no cost to benign accuracy. Further, this is achieved with no fine tuning of or adversarial training.","",""
3,"O. Intrator, N. Intrator","Robust Interpretation of Neural-Network Models",1997,"","","","",16,"2022-07-13 10:10:07","","","","",,,,,3,0.12,2,2,25,"Na than Intrator Tel-Aviv University and Brown University nin©cns.brown.edu Artificial Neural Network seem very promising for regression and classification, especially for large covariate spaces. These methods represent a non-linear function as a composition of low dimensional ridge functions and therefore appear to be less sensitive to the dimensionality of the covariate space. However, due to non uniqueness of a global minimum and the existence of (possibly) many local minima, the model revealed by the network is non stable. We introduce a method to interpret neural network results which uses novel robustification techniques. This results in a robust interpretation of the model employed by the network. Simulated data from known models is used to demonstrate the interpretability results and to demonstrate the effects of different regularization methods on the robustness of the model. Graphical methods are introduced to present the interpretation results. We further demonstrate how interaction between covariates can be revealed. From this study we conclude that the interpretation method works well, but that NN models may sometimes be misinterpreted, especially if the approximations to the true model are less robust.","",""
9,"Jingyuan Wang, Yufan Wu, Mingxuan Li, Xin Lin, Junjie Wu, Chao Li","Interpretability is a Kind of Safety: An Interpreter-based Ensemble for Adversary Defense",2020,"","","","",17,"2022-07-13 10:10:07","","10.1145/3394486.3403044","","",,,,,9,4.50,2,6,2,"While having achieved great success in rich real-life applications, deep neural network (DNN) models have long been criticized for their vulnerability to adversarial attacks. Tremendous research efforts have been dedicated to mitigating the threats of adversarial attacks, but the essential trait of adversarial examples is not yet clear, and most existing methods are yet vulnerable to hybrid attacks and suffer from counterattacks. In light of this, in this paper, we first reveal a gradient-based correlation between sensitivity analysis-based DNN interpreters and the generation process of adversarial examples, which indicates the Achilles's heel of adversarial attacks and sheds light on linking together the two long-standing challenges of DNN: fragility and unexplainability. We then propose an interpreter-based ensemble framework called X-Ensemble for robust adversary defense. X-Ensemble adopts a novel detection-rectification process and features in building multiple sub-detectors and a rectifier upon various types of interpretation information toward target classifiers. Moreover, X-Ensemble employs the Random Forests (RF) model to combine sub-detectors into an ensemble detector for adversarial hybrid attacks defense. The non-differentiable property of RF further makes it a precious choice against the counterattack of adversaries. Extensive experiments under various types of state-of-the-art attacks and diverse attack scenarios demonstrate the advantages of X-Ensemble to competitive baseline methods.","",""
