Cites,Authors,Title,Year,Source,Publisher,ArticleURL,CitesURL,GSRank,QueryDate,Type,DOI,ISSN,CitationURL,Volume,Issue,StartPage,EndPage,ECC,CitesPerYear,CitesPerAuthor,AuthorCount,Age,Abstract,FullTextURL,RelatedURL
12,"Diego Manzanas Lopez, Patrick Musau, Hoang-Dung Tran, Taylor T. Johnson","Verification of Closed-loop Systems with Neural Network Controllers",2019,"","","","",135,"2022-07-13 10:10:07","","10.29007/btv1","","",,,,,12,4.00,3,4,3,"This benchmark suite presents a detailed description of a series of closed-loop control systems with artificial neural network controllers. In many applications, feed-forward neural networks are heavily involved in the implementation of controllers by learning and representing control laws through several methods such as model predictive control (MPC) and reinforcement learning (RL). The type of networks that we consider in this manuscript are feed-forward neural networks consisting of multiple hidden layers with ReLU activation functions and a linear activation function in the output layer. While neural network controllers have been able to achieve desirable performance in many contexts, they also present a unique challenge in that it is difficult to provide any guarantees about the correctness of their behavior or reason about the stability a system that employs their use. Thus, from a controls perspective, it is necessary to verify them in conjunction with their corresponding plants in closed-loop. While there have been a handful of works proposed towards the verification of closed-loop systems with feed-forward neural network controllers, this area still lacks attention and a unified set of benchmark examples on which verification techniques can be evaluated and compared. Thus, to this end, we present a range of closed-loop control systems ranging from two to six state variables, and a range of controllers with sizes in the range of eleven neurons to a few hundred neurons in more complex systems. Category: Academic Difficulty: High Acknowledgement The material presented in this paper is based upon work supported by the National Science Foundation (NSF) under grant number SHF 1736323, the Air Force Office of Scientific Research (AFOSR) through contract numbers FA9550-15-1-0258, FA9550-16-10246, and FA9550-18-1-0122, and the Defense Advanced Research Projects Agency (DARPA) through contract number FA8750-18-C-0089. The U.S. Government is authorized to reproduce and distribute reprints for Government purposes notwithstanding any copyright notation thereon. The views and conclusions contained herein are those of the authors and should not be interpreted as necessarily representing the official policies or endorsements, either expressed or implied, of AFOSR, DARPA, or NSF G. Frehse and M. Althoff (eds.), ARCH19 (EPiC Series in Computing, vol. 61), pp. 201–210 Closed-loop Systems with Neural Network Controllers Manzanas Lopez, Musau, Tran and Johnson 1 Context and Origins. In recent years, advances in Artficial Intelligence (AI) have enabled a diverse range of technologies that are directly impacting people’s everyday lives [16]. Particularly, within this space, machine learning methods such as Deep Learning (DL) have achieved levels of accuracy and performance that are competitive or better than humans for tasks such as pattern and image recognition [12], natural language processing [7], and knowledge representation and reasoning [15,22]. Despite these achievements, there have been reservations about incorporating them into safety critical systems [11] due to their susceptibility to unexpected and errant behavior from a slight perturbation in their inputs [18]. Furthermore, neural networks are often viewed as ""black boxes"" since the underlying operation of the neuron activations is often indiscernible [22]. In light of these challenges, there has been significant work towards the creation of methods and verification tools that can formally reason about the behavior of neural networks [22]. However, the vast majority of these techniques have only been able to deal with feed-forward neural networks with piecewise-linear activation functions [4]. Additionally, the bulk of these methods have primarily considered the verification of input-output properties of neural networks in isolation [22], and there are only a handful of works that have explicitly addressed the verification of closed-loop control systems with neural network controllers [5, 8, 19–21]. One of the central challenges in verifying neural network control systems is that applying existing methodology to these systems is not straightforward [9], and a simple combination of verification tools for non-linear ordinary differential equations along with a neural network reachability tool suffers from severe overestimation errors [5]. Still, the verification of closed loop neural network systems is deeply important as they naturally arise in safety critical systems [5] such as autonomous vehicles, and complex control systems that make use of model predictive control and reinforcement learning [16]. Thus, there is a compelling need for methods and advanced software tools that can effectively deal with the complexities exhibited by these systems [5]. Inspired by a shortage of verification methods for closed-loop neural network control systems in the research literature, the central contribution of this paper is the provision of a set of executable benchmarks that have been synthesized using methods such as reinforcement learning [17], and model predictive control [14]. The problems elucidated in the paper are modeled using Simulink/Stateflow (SLSF) and are available at the following github repository1. We aim to provide a thorough problem description to which the numerous tools and approaches for non-linear systems and neural network verification present in the research community can be evaluated and compared [22]. If the research community is able to devise acceptable solutions to the aformentioned challenges they will stimulate the development of robust and intelligent systems with the potential to bring unparalleled benefits to numerous application domains. 2 Description of benchmarks. In this manuscript, we present a set of linear and non-linear closed-loop systems with continuoustime plants and feedforward neural networks controllers trained using different controls schemes such as reinforcement learning or model predictive control (MPC). A typical architecture describing the structure of these systems is displayed in Figure 2.1. All the neural networks 1https://github.com/verivital/ARCH-2019","",""
27,"Fuxun Yu, Zhuwei Qin, Chenchen Liu, Liang Zhao, Yanzhi Wang, Xiang Chen","Interpreting and Evaluating Neural Network Robustness",2019,"","","","",136,"2022-07-13 10:10:07","","10.24963/ijcai.2019/583","","",,,,,27,9.00,5,6,3,"Recently, adversarial deception becomes one of the most considerable threats to deep neural networks. However, compared to extensive research in new designs of various adversarial attacks and defenses, the neural networks' intrinsic robustness property is still lack of thorough investigation. This work aims to qualitatively interpret the adversarial attack and defense mechanisms through loss visualization, and establish a quantitative metric to evaluate the model's intrinsic robustness. The proposed robustness metric identifies the upper bound of a model's prediction divergence in the given domain and thus indicates whether the model can maintain a stable prediction. With extensive experiments, our metric demonstrates several advantages over conventional testing accuracy based robustness estimation: (1) it provides a uniformed evaluation to models with different structures and parameter scales; (2) it over-performs conventional accuracy based robustness evaluation and provides a more reliable evaluation that is invariant to different test settings; (3) it can be fast generated without considerable testing cost.","",""
10,"Sampo Kuutti, R. Bowden, Harita Joshi, Robert de Temple, Saber Fallah","Safe Deep Neural Network-Driven Autonomous Vehicles Using Software Safety Cages",2019,"","","","",137,"2022-07-13 10:10:07","","10.1007/978-3-030-33617-2_17","","",,,,,10,3.33,2,5,3,"","",""
7,"D. Barić, P. Fumić, D. Horvatic, T. Lipić","Benchmarking Attention-Based Interpretability of Deep Learning in Multivariate Time Series Predictions",2021,"","","","",138,"2022-07-13 10:10:07","","10.3390/e23020143","","",,,,,7,7.00,2,4,1,"The adaptation of deep learning models within safety-critical systems cannot rely only on good prediction performance but needs to provide interpretable and robust explanations for their decisions. When modeling complex sequences, attention mechanisms are regarded as the established approach to support deep neural networks with intrinsic interpretability. This paper focuses on the emerging trend of specifically designing diagnostic datasets for understanding the inner workings of attention mechanism based deep learning models for multivariate forecasting tasks. We design a novel benchmark of synthetically designed datasets with the transparent underlying generating process of multiple time series interactions with increasing complexity. The benchmark enables empirical evaluation of the performance of attention based deep neural networks in three different aspects: (i) prediction performance score, (ii) interpretability correctness, (iii) sensitivity analysis. Our analysis shows that although most models have satisfying and stable prediction performance results, they often fail to give correct interpretability. The only model with both a satisfying performance score and correct interpretability is IMV-LSTM, capturing both autocorrelations and crosscorrelations between multiple time series. Interestingly, while evaluating IMV-LSTM on simulated data from statistical and mechanistic models, the correctness of interpretability increases with more complex datasets.","",""
0,"S. Wein, A. Schüller, Ana Maria Tom'e, W. M. Malloni, M. Greenlee, E. Lang","Forecasting Brain Activity Based on Models of Spatio-Temporal Brain Dynamics: A Comparison of Graph Neural Network Architectures",2021,"","","","",139,"2022-07-13 10:10:07","","10.1162/netn_a_00252","","",,,,,0,0.00,0,6,1,"  Comprehending the interplay between spatial and temporal characteristics of neural dynamics can contribute to our understanding of information processing in the human brain. Graph neural networks (GNNs) provide a new possibility to interpret graph structured signals like those observed in complex brain networks. In our study we compare different spatio-temporal GNN architectures and study their ability to model neural activity distributions obtained in functional MRI (fMRI) studies. We evaluate the performance of the GNN models on a variety of scenarios in MRI studies and also compare it to a VAR model, which is currently often used for directed functional connectivity analysis. We show that by learning localized functional interactions on the anatomical substrate, GNN based approaches are able to robustly scale to large network studies, even when available data are scarce. By including anatomical connectivity as the physical substrate for information propagation, such GNNs also provide a multi-modal perspective on directed connectivity analysis, offering a novel possibility to investigate the spatio-temporal dynamics in brain networks.","",""
7,"Yongbing Zhang, Yangzhe Liu, Xiu Li, Shaowei Jiang, Krishna Dixit, Xinfeng Zhang, Xiangyang Ji","PgNN: Physics-guided Neural Network for Fourier Ptychographic Microscopy",2019,"","","","",140,"2022-07-13 10:10:07","","","","",,,,,7,2.33,1,7,3,"Fourier ptychography (FP) is a newly developed computational imaging approach that achieves both high resolution and wide field of view by stitching a series of low-resolution images captured under angle-varied illumination. So far, many supervised data-driven models have been applied to solve inverse imaging problems. These models need massive amounts of data to train, and are limited by the dataset characteristics. In FP problems, generic datasets are always scarce, and the optical aberration varies greatly under different acquisition conditions. To address these dilemmas, we model the forward physical imaging process as an interpretable physics-guided neural network (PgNN), where the reconstructed image in the complex domain is considered as the learnable parameters of the neural network. Since the optimal parameters of the PgNN can be derived by minimizing the difference between the model-generated images and real captured angle-varied images corresponding to the same scene, the proposed PgNN can get rid of the problem of massive training data as in traditional supervised methods. Applying the alternate updating mechanism and the total variation regularization, PgNN can flexibly reconstruct images with improved performance. In addition, the Zernike mode is incorporated to compensate for optical aberrations to enhance the robustness of FP reconstructions. As a demonstration, we show our method can reconstruct images with smooth performance and detailed information in both simulated and experimental datasets. In particular, when validated in an extension of a high-defocus, high-exposure tissue section dataset, PgNN outperforms traditional FP methods with fewer artifacts and distinguishable structures.","",""
2,"F. Hu, Jiaxin Jiang, P. Yin","Interpretable Prediction of Protein-Ligand Interaction by Convolutional Neural Network",2019,"","","","",141,"2022-07-13 10:10:07","","10.1109/BIBM47256.2019.8982989","","",,,,,2,0.67,1,3,3,"Evaluation of protein-ligand interaction is a crucial step in the process of drug discovery. Recently, several methods based on deep learning have gained impressive binary classification performance on protein-ligand binding prediction. However, lack of three-dimensional complex data still limits the accuracy and robustness of evaluation of protein-ligand binding affinity, as well as the prediction of their binding sites. In this paper, we propose a novel convolutional neural network based method for estimating the binding affinity between protein and ligand using only 1D sequence data. Even with the same amount of sample size, this model outperforms other structure-dependent traditional and machine learning based methods in terms of both binary classification and regression task. Furthermore, we use this model to identify the key amino acid residues of protein that are vital for binding interaction, which provides biological interpretation.","",""
2,"Mingxing Xu, Wenrui Dai, Yangmei Shen, H. Xiong","MSGCNN: Multi-scale Graph Convolutional Neural Network for Point Cloud Segmentation",2019,"","","","",142,"2022-07-13 10:10:07","","10.1109/BigMM.2019.00-35","","",,,,,2,0.67,1,4,3,"Point cloud has emerged as a scalable and flexible geometric representation for 3D data. Graph convolutional neural networks (GCNNs) have shown superior performance and robustness in point cloud processing with structure-awareness and permutation invariance. However, naive graph convolution networks are limited in point cloud segmentation tasks especially in the border areas of multiple segmentation instances due to the lack of multi-scale feature extraction ability. In this paper, we propose a novel multi-scale graph convolutional neural network (MSGCNN) to allow multi-scale feature learning for fine-grained point cloud segmentation. The proposed geometrical interpretable multi-scale point cloud processing framework is able to considerately enlarge the graph filters receptive fields and exploit discriminative multi-scale structure-aware point features for the superior segmentation performance against naive graph convolution networks especially in border area. Experimental results for part segmentation task on ShapeNet datasets show that MSGCNN achieves competitive performance with state-of-the-arts. In comparison to naive graph convolution networks, MSGCNN is shown to obtain better visual quality in the border area. We further validate that our model is robust to data point missing and noise perturbation with the learned multi-scale structure-aware point features.","",""
1,"Noor D. Al-shakarchy, I. H. Ali","Abnormal head movement classification using deep neural network DNN",2019,"","","","",143,"2022-07-13 10:10:07","","10.1063/1.5123123","","",,,,,1,0.33,1,2,3,"Abnormal head movements play a crucial role in diagnoisis of varity diseases. Moreover, different studies considered with these type of information. In addition, the gestures based mainly on head movement which can be employed in many applications such as using head-nodding or shaking to feedback content-related feedback, detect and interpret the emotion, gaze orientation, focus of attention, driver assistance system and so on. In this paper, a new method proposed to detect and classify the flopping head movements as normal or abnormal based on Convolution Neural Network CNN in the term of special sense interaction and behavioral studies with this movement. The proposed system based on deep learning employing the Convolution Neural Network CNN as most promising approach to deal with lighting condition (illumination change) and distortion and noise. Normal Abnormal Head Movement Dataset (NAHM) static images dataset gathered and used in proposed system implementation. This dataset provided the various image conditions and subjects to prevent the overfitting and under fitting problem that appears with publically datasets. The proposed frame work presents robust learning ability based on accuracy and lose functions which achieved training loss: 0.0106, training accuracy: 0.9980, validation loss: 0.0968 and validation accuracy: 0.9831.Abnormal head movements play a crucial role in diagnoisis of varity diseases. Moreover, different studies considered with these type of information. In addition, the gestures based mainly on head movement which can be employed in many applications such as using head-nodding or shaking to feedback content-related feedback, detect and interpret the emotion, gaze orientation, focus of attention, driver assistance system and so on. In this paper, a new method proposed to detect and classify the flopping head movements as normal or abnormal based on Convolution Neural Network CNN in the term of special sense interaction and behavioral studies with this movement. The proposed system based on deep learning employing the Convolution Neural Network CNN as most promising approach to deal with lighting condition (illumination change) and distortion and noise. Normal Abnormal Head Movement Dataset (NAHM) static images dataset gathered and used in proposed system implementation. This dataset provided the various image...","",""
3,"S. Bersimis, Aggeliki Sgora, S. Psarakis","A robust meta‐method for interpreting the out‐of‐control signal of multivariate control charts using artificial neural networks",2021,"","","","",144,"2022-07-13 10:10:07","","10.1002/qre.2955","","",,,,,3,3.00,1,3,1,"Multivariate control charts are an effective mean to identify an out‐of‐control process in several (industrial or non‐industrial) fields, where the quality depends on many related variables. However, the main shortcoming of these charts is that they fail to indicate which measured variable or variables has or have shifted. In order to address this issue, several alternative analytical approaches that aim to diagnose the responsible variable or variables for the out‐of‐control signal and help identify aberrant variables have been proposed. However, there is no particular method that can be considered as panacea, since its performance depends on several parameters, such as the correlation among the variables, and so forth. In this paper, a meta‐method is proposed that combines the results of several well‐known analytical methods in order to identify robustly the out‐of‐control variables. The obtained results show that the proposed meta‐method achieves high performance and it is extremely robust under different scenarios of out‐of‐control processes.","",""
14,"P. V. C. Souza, L. Torres, A. J. Guimarães, Vanessa Souza Araújo","Pulsar Detection for Wavelets SODA and Regularized Fuzzy Neural Networks Based on Andneuron and Robust Activation Function",2019,"","","","",145,"2022-07-13 10:10:07","","10.1142/S0218213019500039","","",,,,,14,4.67,4,4,3,"The use of intelligent models may be slow because of the number of samples involved in the problem. The identification of pulsars (stars that emit Earth-catchable signals) involves collecting thousands of signals by professionals of astronomy and their identification may be hampered by the nature of the problem, which requires many dimensions and samples to be analyzed. This paper proposes the use of hybrid models based on concepts of regularized fuzzy neural networks that use the representativeness of input data to define the groupings that make up the neurons of the initial layers of the model. The andneurons are used to aggregate the neurons of the first layer and can create fuzzy rules. The training uses fast extreme learning machine concepts to generate the weights of neurons that use robust activation functions to perform pattern classification. To solve large-scale problems involving the nature of pulsar detection problems, the model proposes a fast and highly accurate approach to address complex issues. In the execution of the tests with the proposed model, experiments were conducted explanation in two databases of pulsars, and the results prove the viability of the fast and interpretable approach in identifying such involved stars.","",""
1,"Cedrique Rovile Njieutcheu Tassi","Bayesian Convolutional Neural Network: Robustly Quantify Uncertainty for Misclassifications Detection",2019,"","","","",146,"2022-07-13 10:10:07","","10.1007/978-3-030-37548-5_10","","",,,,,1,0.33,1,1,3,"","",""
16,"Fan Zhang, Fábio Duarte, Ruixian Ma, Dimitrios Milioris, Hui-Ching Lin, C. Ratti","Indoor Space Recognition using Deep Convolutional Neural Network: A Case Study at MIT Campus",2016,"","","","",147,"2022-07-13 10:10:07","","","","",,,,,16,2.67,3,6,6,"In this paper, we propose a robust and parsimonious approach using Deep Convolutional Neural Network (DCNN) to recognize and interpret interior space. DCNN has achieved incredible success in object and scene recognition. In this study we design and train a DCNN to classify a pre-zoning indoor space, and from a single phone photo to recognize the learned space features, with no need of additional assistive technology. We collect more than 600,000 images inside MIT campus buildings to train our DCNN model, and achieved 97.9% accuracy in validation dataset and 81.7% accuracy in test dataset based on spatial-scale fixed model. Furthermore, the recognition accuracy and spatial resolution can be potentially improved through multiscale classification model. We identify the discriminative image regions through Class Activating Mapping (CAM) technique, to observe the model's behavior in how to recognize space and interpret it in an abstract way. By evaluating the results with misclassification matrix, we investigate the visual spatial feature of interior space by looking into its visual similarity and visual distinctiveness, giving insights into interior design and human indoor perception and wayfinding research. The contribution of this paper is threefold. First, we propose a robust and parsimonious approach for indoor navigation using DCNN. Second, we demonstrate that DCNN also has a potential capability in space feature learning and recognition, even under severe appearance changes. Third, we introduce a DCNN based approach to look into the visual similarity and visual distinctiveness of interior space.","",""
1,"F. Santos, C. Zanchettin, L. Matos, P. Novais","On the Impact of Interpretability Methods in Active Image Augmentation Method",2021,"","","","",148,"2022-07-13 10:10:07","","10.1093/jigpal/jzab006","","",,,,,1,1.00,0,4,1,"Robustness is a significant constraint in machine learning models. The performance of the algorithms must not deteriorate when training and testing with slightly different data. Deep neural network models achieve awe-inspiring results in a wide range of applications of computer vision. Still, in the presence of noise or region occlusion, some models exhibit inaccurate performance even with data handled in training. Besides, some experiments suggest deep learning models sometimes use incorrect parts of the input information to perform inference. Activate Image Augmentation (ADA) is an augmentation method that uses interpretability methods to augment the training data and improve its robustness to face the described problems. Although ADA presented interesting results, its original version only used the Vanilla Backpropagation interpretability to train the U-Net model. In this work, we propose an extensive experimental analysis of the interpretability method’s impact on ADA. We use five interpretability methods: Vanilla Backpropagation, Guided Backpropagation, GradCam, Guided GradCam, and InputXGradient. The results show that all methods achieve similar performance at the ending of training, but when combining ADA with GradCam, the U-Net model presented an impressive fast convergence.","",""
