Cites,Authors,Title,Year,Source,Publisher,ArticleURL,CitesURL,GSRank,QueryDate,Type,DOI,ISSN,CitationURL,Volume,Issue,StartPage,EndPage,ECC,CitesPerYear,CitesPerAuthor,AuthorCount,Age,Abstract,FullTextURL,RelatedURL
0,"K. Supekar, S. Ryali, R. Yuan, D. Kumar, C. de los Angeles, V. Menon","Identification of robust and interpretable brain signatures of autism and clinical symptom severity using a dynamic time-series deep neural network",2021,"","","","",58,"2022-07-13 10:10:07","","10.1192/j.eurpsy.2021.397","","",,,,,0,0.00,0,6,1,"Introduction Autism spectrum disorder (ASD) is among the most common and pervasive neurodevelopmental disorders. Yet, despite decades of research, the neurobiology of ASD is still poorly understood, as inconsistent findings preclude the identification of robust and interpretable neurobiological markers and predictors of clinical symptoms. Objectives Identify robust and interpretable dynamic brain markers that distinguish children with ASD from typically-developing (TD) children and predict clinical symptom severity. Methods We leverage multiple functional brain imaging cohorts (ABIDE, Stanford; N = 1004) and exciting recent advances in explainable artificial intelligence (xAI), to develop a novel multivariate time series deep neural network model that extracts informative brain dynamics features that accurately distinguish between ASD and TD children, and predict clinical symptom severity. Results Our model achieved consistently high classification accuracies in cross-validation analysis of data from the ABIDE cohort. Crucially, despite the differences in symptom profiles, age, and data acquisition protocols, our model also accurately classified data from an independent Stanford cohort without additional training. xAI analyses revealed that brain features associated with the default mode network, and the human voice/face processing and communication systems, most clearly distinguished ASD from TD children in both cohorts. Furthermore, the posterior cingulate cortex emerged as robust predictor of the severity of social and communication deficits in ASD in both cohorts. Conclusions Our findings, replicated across two independent cohorts, reveal robust and neurobiologically interpretable brain features that detect ASD and predict core phenotypic features of ASD, and have the potential to transform our understanding of the etiology and treatment of the disorder. Disclosure No significant relationships.","",""
22,"Hantao Huang, Jingye Zhou, Qingxun Di, Jiawei Zhou, Jiawang Li","Robust neural network–based tracking control and stabilization of a wheeled mobile robot with input saturation",2018,"","","","",59,"2022-07-13 10:10:07","","10.1002/rnc.4396","","",,,,,22,5.50,4,5,4,"This paper presents a robust neural network–based control scheme to deal with the problem of tracking and stabilization simultaneously for a wheeled mobile robot subject to parametric uncertainties, external disturbances, and input saturation. At first, a new error‐state transformation scheme is designed by introducing some auxiliary variables as an additional virtual control signals to reduce the adverse effect caused by the underactuation. These variables can change their structures for different desired trajectories to be tracked. Then, a robust control law is proposed combining with a kinematic controller and a dynamic controller, while a three‐layer neural network system is applied to approximate model uncertainties. Stability analysis via the Lyapunov theory shows that the proposed controller can make tracking errors converge to bounded neighborhoods of the origin. Finally, some simulation results are illustrated to verify the effectiveness of the proposed control strategy.","",""
0,"Yipeng Du, Jian Liu","IENet: a robust convolutional neural network for EEG based brain-computer interfaces",2022,"","","","",60,"2022-07-13 10:10:07","","10.1088/1741-2552/ac7257","","",,,,,0,0.00,0,2,1,"Objective. Brain-computer interfaces (BCIs) based on electroencephalogram (EEG) develop into novel application areas with more complex scenarios, which put forward higher requirements for the robustness of EEG signal processing algorithms. Deep learning can automatically extract discriminative features and potential dependencies via deep structures, demonstrating strong analytical capabilities in numerous domains such as computer vision and natural language processing. Making full use of deep learning technology to design a robust algorithm that is capable of analyzing EEG across BCI paradigms is our main work in this paper. Approach. Inspired by InceptionV4 and InceptionTime architecture, we introduce a neural network ensemble named InceptionEEG-Net (IENet), where multi-scale convolutional layer and convolution of length 1 enable model to extract rich high-dimensional features with limited parameters. In addition, we propose the average receptive field (RF) gain for convolutional neural networks (CNNs), which optimizes IENet to detect long patterns at a smaller cost. We compare with the current state-of-the-art methods across five EEG-BCI paradigms: steady-state visual evoked potentials (VEPs), epilepsy EEG, overt attention P300 VEPs, covert attention P300 visual-EPs and movement-related cortical potentials. Main results. The classification results show that the generalizability of IENet is on par with the state-of-the-art paradigm-agnostic models on test datasets. Furthermore, the feature explainability analysis of IENet illustrates its capability to extract neurophysiologically interpretable features for different BCI paradigms, ensuring the reliability of algorithm. Significance. It can be seen from our results that IENet can generalize to different BCI paradigms. And it is essential for deep CNNs to increase the RF size using average RF gain.","",""
0,"Ben Zhang, Zhetong Dong, Junsong Zhang, Hongwei Lin","Functional Network: A Novel Framework for Interpretability of Deep Neural Networks",2022,"","","","",61,"2022-07-13 10:10:07","","10.48550/arXiv.2205.11702","","",,,,,0,0.00,0,4,1,"The layered structure of deep neural networks hinders the use of numerous analysis tools and thus the development of its interpretability. Inspired by the success of functional brain networks, we propose a novel framework for interpretability of deep neural networks, that is, the functional network. We construct the functional network of fully connected networks and explore its small-worldness. In our experiments, the mechanisms of regularization methods, namely, batch normalization and dropout, are revealed using graph theoretical analysis and topological data analysis. Our empirical analysis shows the following: (1) Batch normalization enhances model performance by increasing the global eﬃciency and the number of loops but reduces adversarial robustness by lowering the fault tolerance. (2) Dropout improves generalization and robustness of models by improving the functional specialization and fault tolerance. (3) The models with diﬀerent regularizations can be clustered correctly according to their functional topological diﬀerences, reﬂecting the great potential of the functional network and topological data analysis in interpretability.","",""
1,"Can Udomcharoenchaikit, P. Boonkwan, P. Vateekul","Adversarial Evaluation of Robust Neural Sequential Tagging Methods for Thai Language",2020,"","","","",62,"2022-07-13 10:10:07","","10.1145/3383201","","",,,,,1,0.50,0,3,2,"Sequential tagging tasks, such as Part-Of-Speech (POS) tagging and Named-Entity Recognition, are the building blocks of many natural language processing applications. Although prior works have reported promising results in standard settings, they often underperform on non-standard text, such as microblogs and social media. In this article, we introduce an adversarial evaluation scheme for the Thai language by creating adversarial examples based on known spelling errors. Furthermore, we propose novel methods including UNK masking, condition initialization with affixation embeddings, and untied-directional self-attention mechanism to enhance robustness and interpretability of the neural networks. We conducted experiments on two Thai corpora: BEST2010 and ORCHID. Our adversarial evaluation schemes reveal that bidirectional LSTM (BiLSTM) do not perform well on adversarial examples. Our best methods match the performance of the BiLSTM baseline model and outperform it on adversarial examples.","",""
24,"Tianyu Kang, W. Ding, Luoyan Zhang, D. Ziemek, Kourosh Zarringhalam","A biological network-based regularized artificial neural network model for robust phenotype prediction from gene expression data",2017,"","","","",63,"2022-07-13 10:10:07","","10.1186/s12859-017-1984-2","","",,,,,24,4.80,5,5,5,"","",""
367,"V. Lawhern, Amelia J. Solon, Nicholas R. Waytowich, S. Gordon, C. Hung, Brent Lance","EEGNet: A Compact Convolutional Neural Network for EEG-based Brain-Computer Interfaces",2021,"","","","",64,"2022-07-13 10:10:07","","","","",,,,,367,367.00,61,6,1,"Objective: Brain computer interfaces (BCI) enable direct communication with a computer, using neural activity as the control signal. This neural signal is generally chosen from a variety of well-studied electroencephalogram (EEG) signals. For a given BCI paradigm, feature extractors and classifiers are tailored to the distinct characteristics of its expected EEG control signal, limiting its application to that specific signal. Convolutional Neural Networks (CNNs), which have been used in computer vision and speech recognition to perform automatic feature extraction and classification, have successfully been applied to EEG-based BCIs; however, they have mainly been applied to single BCI paradigms and thus it remains unclear how these architectures generalize to other paradigms. Here, we ask if we can design a single CNN architecture to accurately classify EEG signals from different BCI paradigms, while simultaneously being as compact as possible (defined as the number of parameters in the model). Approach: In this work we introduce EEGNet, a compact convolutional neural network for EEG-based BCIs. We introduce the use of depthwise and separable convolutions to construct an EEG-specific model which encapsulates well-known EEG feature extraction concepts for BCI. We compare EEGNet, both for within-subject and cross-subject classification, to current state-of-the-art approaches across four BCI paradigms: P300 visual-evoked potentials, error-related negativity responses (ERN), movement-related cortical potentials (MRCP), and sensory motor rhythms (SMR). Results: We show that EEGNet generalizes across paradigms better than, and achieves comparably high performance to, the reference algorithms when only limited training data is available. We also show that EEGNet effectively generalizes to both ERP and oscillatory-based BCIs. In addition, we demonstrate three different approaches to visualize the contents of a trained EEGNet model to enable interpretation of the learned features. Significance: Our results suggest that EEGNet is robust enough to learn a wide variety of interpretable features over a range of BCI tasks, suggesting that the observed performances were not due to artifact or noise sources in the data. Our models can be found at: https://github.com/vlawhern/arl-eegmodels. 1 ar X iv :1 61 1. 08 02 4v 4 [ cs .L G ] 1 6 M ay 2 01 8","",""
7,"Yuzhe Li, Shiyi Cheng, Yujia Xue, L. Tian","Displacement-agnostic coherent imaging through scatter with an interpretable deep neural network.",2020,"","","","",65,"2022-07-13 10:10:07","","10.1364/oe.411291","","",,,,,7,3.50,2,4,2,"Coherent imaging through scatter is a challenging task. Both model-based and data-driven approaches have been explored to solve the inverse scattering problem. In our previous work, we have shown that a deep learning approach can make high-quality and highly generalizable predictions through unseen diffusers. Here, we propose a new deep neural network model that is agnostic to a broader class of perturbations including scatterer change, displacements, and system defocus up to 10× depth of field. In addition, we develop a new analysis framework for interpreting the mechanism of our deep learning model and visualizing its generalizability based on an unsupervised dimension reduction technique. We show that our model can unmix the scattering-specific information and extract the object-specific information and achieve generalization under different scattering conditions. Our work paves the way to a robust and interpretable deep learning approach to imaging through scattering media.","",""
3,"Tom Dupré la Tour, Mi Lu, Michael Eickenberg, J. Gallant","A finer mapping of convolutional neural network layers to the visual cortex",2021,"","","","",66,"2022-07-13 10:10:07","","","","",,,,,3,3.00,1,4,1,"There is increasing interest in understanding similarities and differences between convolutional neural networks (CNNs) and the visual cortex. A common approach is to use some specific layer of a pre-trained CNN as a source of features to predict brain activity recorded during a visual task. Associating each brain region to the best predicting CNN layer reveals a gradual change over the visual cortex. However, this winner-take-all mapping is non-robust, because consecutive CNN layers are strongly correlated and have similar prediction accuracies. Moreover, this mapping is usually performed on static stimuli, which ignores the temporal component of human vision. When the mapping is performed on video stimuli, the features are extracted frame-by-frame and downsampled using an anti-aliasing low-pass filter, which removes high temporal frequencies that could be informative. To address the first issue and improve the non-robust winner-take-all approach, we propose to fit a joint model on all layers simultaneously. The model is fit with banded ridge regression, where a separate regularization hyperparameter is learned for each layer. By performing a selection over layers, this model effectively removes non-predictive or redundant layers and disentangles the contributions of each layer. We show that using a joint model increases prediction accuracy and leads to finer mappings from CNN layers to the visual cortex. To address the second issue and preserve more high frequency information, we propose to filter the features with a set of band-pass filters. We show that using the envelopes of the filtered signals as additional features further increases prediction accuracy. Introduction Convolutional neural networks (CNNs) were inspired originally by the anatomy of the brain, and they have been remarkably successful in computer vision [1, 2]. However, these networks still fail in many tasks that humans can perform easily. Therefore, there is increasing interest in understanding the similarities and differences between CNNs and the brain. To investigate this issue, a common method is to use some specific layer of a pre-trained CNN as a source of features to fit a brain encoding model [3]. With this approach, many studies have shown that early CNN layers best predict brain activity in low-level visual areas, while late layers best predict brain activity in intermediate and higher-level visual areas, with gradual changes of layer mapping over the cortical surface [4, 5, 6, 7, 8, 9, 10, 11, 12, 13]. A similar approach has also been applied to speech [14, 15] and language tasks [16, 17]. One problem with this approach is that there are strong correlations between CNN activations from one layer to the next. This confound causes different layers to have similar predictive power in encoding models [8, 16, 17, 18]. It is thus hard to separate which part of the predictive power is specific to a layer and which part is shared with other layers. Most studies ignore this issue and select the best-predicting layer for each voxel [5, 6, 8, 9, 14, 19, 11], but this winner-take-all approach is not robust and it ignores potential complementarities between layers. Some studies use variance partitioning [20] or canonical component analysis [21] to disentangle the different layers, but these approaches cannot disentangle more than two or three layers. 3rd Workshop on Shared Visual Representations in Human and Machine Intelligence (SVRHM 2021) of the Neural Information Processing Systems (NeurIPS) conference, Virtual. To address this issue, we use banded ridge regression, which has been shown to disentangle contributions from correlated feature spaces in encoding models [22]. Specifically, we fit a predictive model using features from all layers at once, grouping the features by layers, and learning optimal regularization for each layer through cross-validation. We show empirically that this joint model performs a selection over layers, effectively removing non-predictive or redundant layers, and disentangling the contributions of each layer on each voxel. Using this joint model increases prediction accuracy, and leads to smoother cortical maps of layer mapping. A second problem of the conventional approach is that it oversimplifies the temporal aspect of visual processing. Indeed, most studies only use static image stimuli [5, 6, 7, 8, 11, 13], which entirely ignores the temporal component of human vision. Some studies use video stimuli [8, 9] and extract features frame by frame from an image-based CNN. Then, the features are downsampled to the brain imaging sampling frequency (typically 0.5 Hz), using an anti-aliasing low-pass filter [8, 9]. However, this low-pass filter is suboptimal, because it removes valuable high-frequency information contained in the CNN activations. Indeed, a video stimulus induces brain activity linked to movement, and this brain activity has been shown to be poorly predicted by low-pass filtered static features [23]. To address this issue, we first use video stimuli and extract features frame by frame from an imagebased CNN. Then, to preserve more high temporal frequency information, we filter the features with a set of band-pass filters, and extract the envelope of the filtered signals. The envelopes are then used as additional features which increase prediction accuracy of the model. Note that we specifically do not use a video-based CNN to be able to compare both approaches on the same CNN architecture. We expect further gain in prediction accuracy by using the set of band-pass filters on features extracted from a video-based CNN. These two methodological improvements pave the way for high-precision mappings between CNNs and human brains, which may help both designing and interpreting CNNs, and defining highresolution information pathways over the cortical surface. 1 Conventional approach The conventional approach for mapping CNN layers to brain regions [4, 5, 6, 7, 8, 9, 19, 11, 12, 13] follows the voxelwise encoding model framework [24, 25]. First, brain activity is recorded while subjects perceive a visual stimulus. Then, the same stimulus is presented to a pretrained CNN, activations are extracted from intermediate CNN layers and preprocessed into features (see below). Finally, a regression model is trained on each voxel to predict brain activity from the features. 1.1 Feature extraction To extract features, each image of the stimulus is first presented to a pretrained image-based CNN. Then, the activations of one convolutional or fully-connected layer are extracted (typically after ReLU and max-pooling layers). With a video stimulus, features are extracted frame by frame from an imagebased CNN, before being down-sampled to the brain imaging sampling frequency (typically 0.5 Hz). Next, a compressive nonlinearity x 7→ log(1 + x) is applied, and features are centered individually along the train set. Then, to account for the delay between the stimulus and the hemodynamic response, features are either convolved with a hemodynamic response function, or duplicated with multiple temporal delays. This process is repeated for each CNN layer. Limitations. With a video stimulus, the feature extraction process contains a down-sampling step to match the brain imaging sampling frequency (typically 0.5 Hz). This down-sampling is typically done with an anti-aliasing low-pass filter [8, 9]. However, this low-pass filter likely removes valuable information from the CNN activations. Indeed, a video stimulus induces brain activity linked to movement, and this activity has been shown to be poorly predicted by low-pass filtered features [23]. 1.2 Winner-take-all model In the conventional approach, a separate ridge regression [26] is fit to the features extracted from each layer of the CNN independently. Then, the best layer is selected for each voxel, based on cross-validated prediction accuracy. Finally, differences in terms of selected layers are analyzed across the brain. The approach thus produces a mapping from CNN layers to brain regions.","",""
0,"R. Ramos, Patr'icia Pereira, Helena Moniz, J. P. Carvalho, Bruno Martins","Retrieval Augmentation to Improve Robustness and Interpretability of Deep Neural Networks",2021,"","","","",67,"2022-07-13 10:10:07","","","","",,,,,0,0.00,0,5,1,"Deep neural network models have achieved state-ofthe-art results in various tasks related to vision and/or language. Despite the use of large training data, most models are trained by iterating over single input-output pairs, discarding the remaining examples for the current prediction. In this work, we actively exploit the training data to improve the robustness and interpretability of deep neural networks, using the information from nearest training examples to aid the prediction both during training and testing. Specifically, the proposed approach uses the target of the nearest input example to initialize the memory state of an LSTM model or to guide attention mechanisms. We apply this approach to image captioning and sentiment analysis, conducting experiments with both image and text retrieval. Results show the effectiveness of the proposed models for the two tasks, on the widely used Flickr8 and IMDB datasets, respectively. Our code is publicly available1.","",""
11,"Peter K. Koo, Sharon Qian, Gal Kaplun, Verena Volf, Dimitris Kalimeris","Robust Neural Networks are More Interpretable for Genomics",2019,"","","","",68,"2022-07-13 10:10:07","","10.1101/657437","","",,,,,11,3.67,2,5,3,"Deep neural networks (DNNs) have been applied to a variety of regulatory genomics tasks. For interpretability, attribution methods are employed to provide importance scores for each nucleotide in a given sequence. However, even with state-of-the-art DNNs, there is no guarantee that these methods can recover interpretable, biological representations. Here we perform systematic experiments on synthetic genomic data to raise awareness of this issue. We find that deeper networks have better generalization performance, but attribution methods recover less interpretable representations. Then, we show training methods promoting robustness – including regularization, injecting random noise into the data, and adversarial training – significantly improve interpretability of DNNs, especially for smaller datasets.","",""
0,"Patrick McClure, D. Moraczewski, K. Lam, Adam Thomas, Francisco Pereira","Improving the Interpretability of fMRI Decoding using Deep Neural Networks and Adversarial Robustness.",2020,"","","","",69,"2022-07-13 10:10:07","","","","",,,,,0,0.00,0,5,2,"Deep neural networks (DNNs) are being increasingly used to make predictions from functional magnetic resonance imaging (fMRI) data. However, they are widely seen as uninterpretable ""black boxes"", as it can be difficult to discover what input information is used by the DNN in the process, something important in both cognitive neuroscience and clinical applications. A saliency map is a common approach for producing interpretable visualizations of the relative importance of input features for a prediction. However, methods for creating maps often fail due to DNNs being sensitive to input noise, or by focusing too much on the input and too little on the model. It is also challenging to evaluate how well saliency maps correspond to the truly relevant input information, as ground truth is not always available. In this paper, we review a variety of methods for producing gradient-based saliency maps, and present a new adversarial training method we developed to make DNNs robust to input noise, with the goal of improving interpretability. We introduce two quantitative evaluation procedures for saliency map methods in fMRI, applicable whenever a DNN or linear model is being trained to decode some information from imaging data. We evaluate the procedures using a synthetic dataset where the complex activation structure is known, and on saliency maps produced for DNN and linear models for task decoding in the Human Connectome Project (HCP) dataset. Our key finding is that saliency maps produced with different methods vary widely in interpretability, in both in synthetic and HCP fMRI data. Strikingly, even when DNN and linear models decode at comparable levels of performance, DNN saliency maps score higher on interpretability than linear model saliency maps (derived via weights or gradient). Finally, saliency maps produced with our adversarial training method outperform those from other methods.","",""
