Cites,Authors,Title,Year,Source,Publisher,ArticleURL,CitesURL,GSRank,QueryDate,Type,DOI,ISSN,CitationURL,Volume,Issue,StartPage,EndPage,ECC,CitesPerYear,CitesPerAuthor,AuthorCount,Age,Abstract,FullTextURL,RelatedURL
1,"Peng Lu, Yang Gao, Hao Xi, Yabin Zhang, Chao Gao, Bing Zhou, Hongpo Zhang, Liwei Chen, Xiaobo Mao","KecNet: A Light Neural Network for Arrhythmia Classification Based on Knowledge Reinforcement",2021,"","","","",105,"2022-07-13 10:10:07","","10.1155/2021/6684954","","",,,,,1,1.00,0,9,1,"Acquiring electrocardiographic (ECG) signals and performing arrhythmia classification in mobile device scenarios have the advantages of short response time, almost no network bandwidth consumption, and human resource savings. In recent years, deep neural networks have become a popular method to efficiently and accurately simulate nonlinear patterns of ECG data in a data-driven manner but require more resources. Therefore, it is crucial to design deep learning (DL) algorithms that are more suitable for resource-constrained mobile devices. In this paper, KecNet, a lightweight neural network construction scheme based on domain knowledge, is proposed to model ECG data by effectively leveraging signal analysis and medical knowledge. To evaluate the performance of KecNet, we use the Association for the Advancement of Medical Instrumentation (AAMI) protocol and the MIT-BIH arrhythmia database to classify five arrhythmia categories. The result shows that the ACC, SEN, and PRE achieve 99.31%, 99.45%, and 98.78%, respectively. In addition, it also possesses high robustness to noisy environments, low memory usage, and physical interpretability advantages. Benefiting from these advantages, KecNet can be applied in practice, especially wearable and lightweight mobile devices for arrhythmia classification.","",""
2,"Zhifang Liao, Haihui Pan, Xiaoping Fan, Yan Zhang, Li Kuang","Multiple Wavelet Convolutional Neural Network for Short-Term Load Forecasting",2020,"","","","",106,"2022-07-13 10:10:07","","10.1109/JIOT.2020.3026733","","",,,,,2,1.00,0,5,2,"Although the accuracy of load forecasting has been studied by many works, the actual deployability of a model is rarely considered. In this work, we consider the actual deployability of a model from four aspects: 1) the prediction performance of the model; 2) the robustness of the model; 3) the dependence of the model on external data; and 4) the storage size of the model. From these four aspects, we propose a multiple wavelet convolutional neural network (MWCNN) for load forecasting. On two public data sets, we verified the performance and robustness of the MWCNN. The MWCNN only uses load data, and the storage size of the model is only 497 kB, which shows that MWCNN has good deployability. In addition, our MWCNN prediction results are interpretable. The experimental results show that the MWCNN can effectively capture the periodic characteristics of load data.","",""
2,"S. Barland, Franccois Gustave","Convolutional neural network for self-mixing interferometric displacement sensing.",2021,"","","","",107,"2022-07-13 10:10:07","","10.1364/OE.419844","","",,,,,2,2.00,1,2,1,"Self-mixing interferometry is a well established interferometric measurement technique. In spite of the robustness and simplicity of the concept, interpreting the self-mixing signal is often complicated in practice, which is detrimental to measurement availability. Here we discuss the use of a convolutional neural network to reconstruct the displacement of a target from the self-mixing signal in a semiconductor laser. The network, once trained on periodic displacement patterns, can reconstruct arbitrarily complex displacement in different alignment conditions and setups. The approach validated here is amenable to generalization to modulated schemes or even to totally different self-mixing sensing tasks.","",""
0,"Ethan Harris, Daniela Mihai, Jonathon S. Hare","How Convolutional Neural Network Architecture Biases Learned Opponency and Color Tuning",2021,"","","","",108,"2022-07-13 10:10:07","","10.1162/neco_a_01356","","",,,,,0,0.00,0,3,1,"Recent work suggests that changing convolutional neural network (CNN) architecture by introducing a bottleneck in the second layer can yield changes in learned function. To understand this relationship fully requires a way of quantitatively comparing trained networks. The fields of electrophysiology and psychophysics have developed a wealth of methods for characterizing visual systems that permit such comparisons. Inspired by these methods, we propose an approach to obtaining spatial and color tuning curves for convolutional neurons that can be used to classify cells in terms of their spatial and color opponency. We perform these classifications for a range of CNNs with different depths and bottleneck widths. Our key finding is that networks with a bottleneck show a strong functional organization: almost all cells in the bottleneck layer become both spatially and color opponent, and cells in the layer following the bottleneck become nonopponent. The color tuning data can further be used to form a rich understanding of how color a network encodes color. As a concrete demonstration, we show that shallower networks without a bottleneck learn a complex nonlinear color system, whereas deeper networks with tight bottlenecks learn a simple channel opponent code in the bottleneck layer. We develop a method of obtaining a hue sensitivity curve for a trained CNN that enables high-level insights that complement the low-level findings from the color tuning data. We go on to train a series of networks under different conditions to ascertain the robustness of the discussed results. Ultimately our methods and findings coalesce with prior art, strengthening our ability to interpret trained CNNs and furthering our understanding of the connection between architecture and learned representation. Trained models and code for all experiments are available at https://github.com/ecs-vlc/opponency.","",""
2,"S. Tan, Runpei Dong, Kaisheng Ma","Multi-Glimpse Network: A Robust and Efficient Classification Architecture based on Recurrent Downsampled Attention",2021,"","","","",109,"2022-07-13 10:10:07","","","","",,,,,2,2.00,1,3,1,"Most feedforward convolutional neural networks spend roughly the same efforts for each pixel. Yet human visual recognition is an interaction between eye movements and spatial attention, which we will have several glimpses of an object in different regions. Inspired by this observation, we propose an end-to-end trainable M ulti- G limpse N etwork ( MGNet ) which aims to tackle the challenges of high computation and the lack of robustness based on recurrent downsampled attention mechanism. Speciﬁcally, MGNet sequentially selects task-relevant regions of an image to focus on and then adaptively combines all collected information for the ﬁnal prediction. MGNet expresses higher resistance against adversarial attacks and common corruptions with less computation. Also, MGNet is inherently more interpretable as it explicitly informs us where it focuses during each iteration. Our experiments on ImageNet100 demonstrate the potential of recurrent downsampled attention mechanisms to improve a single feedforward manner. For example, MGNet improves 4.76% accuracy on average in common corruptions with only 36.9% computational cost. Moreover, while the baseline incurs an accuracy drop to 7.6%, MGNet manages to maintain 44.2% accuracy in the same PGD attack strength with ResNet-50 backbone. Our code is available at https: //github.com/siahuat0727/MGNet .","",""
14,"T. Briegel, Volker Tresp","Robust Neural Network Regression for Offline and Online Learning",1999,"","","","",110,"2022-07-13 10:10:07","","","","",,,,,14,0.61,7,2,23,"We replace the commonly used Gaussian noise model in nonlinear regression by a more flexible noise model based on the Student-t- distribution. The degrees of freedom of the t-distribution can be chosen such that as special cases either the Gaussian distribution or the Cauchy distribution are realized. The latter is commonly used in robust regression. Since the t-distribution can be interpreted as being an infinite mixture of Gaussians, parameters and hyperparameters such as the degrees of freedom of the t-distribution can be learned from the data based on an EM-learning algorithm. We show that modeling using the t-distribution leads to improved predictors on real world data sets. In particular, if outliers are present, the t-distribution is superior to the Gaussian noise model. In effect, by adapting the degrees of freedom, the system can ""learn"" to distinguish between outliers and non-outliers. Especially for online learning tasks, one is interested in avoiding inappropriate weight changes due to measurement outliers to maintain stable online learning capability. We show experimentally that using the t-distribution as a noise model leads to stable online learning algorithms and outperforms state-of-the art online learning methods like the extended Kalman filter algorithm.","",""
44,"Minh Nguyen Nhat To, Q. Vu, B. Turkbey, P. Choyke, J. T. Kwak","Deep dense multi-path neural network for prostate segmentation in magnetic resonance imaging",2018,"","","","",111,"2022-07-13 10:10:07","","10.1007/s11548-018-1841-4","","",,,,,44,11.00,9,5,4,"","",""
32,"Jiaming Shen, Zhihong Shen, Chenyan Xiong, Chi Wang, Kuansan Wang, Jiawei Han","TaxoExpan: Self-supervised Taxonomy Expansion with Position-Enhanced Graph Neural Network",2020,"","","","",112,"2022-07-13 10:10:07","","10.1145/3366423.3380132","","",,,,,32,16.00,5,6,2,"Taxonomies consist of machine-interpretable semantics and provide valuable knowledge for many web applications. For example, online retailers (e.g., Amazon and eBay) use taxonomies for product recommendation, and web search engines (e.g., Google and Bing) leverage taxonomies to enhance query understanding. Enormous efforts have been made on constructing taxonomies either manually or semi-automatically. However, with the fast-growing volume of web content, existing taxonomies will become outdated and fail to capture emerging knowledge. Therefore, in many applications, dynamic expansions of an existing taxonomy are in great demand. In this paper, we study how to expand an existing taxonomy by adding a set of new concepts. We propose a novel self-supervised framework, named TaxoExpan, which automatically generates a set of ⟨query concept, anchor concept⟩ pairs from the existing taxonomy as training data. Using such self-supervision data, TaxoExpan learns a model to predict whether a query concept is the direct hyponym of an anchor concept. We develop two innovative techniques in TaxoExpan: (1) a position-enhanced graph neural network that encodes the local structure of an anchor concept in the existing taxonomy, and (2) a noise-robust training objective that enables the learned model to be insensitive to the label noise in the self-supervision data. Extensive experiments on three large-scale datasets from different domains demonstrate both the effectiveness and the efficiency of TaxoExpan for taxonomy expansion.","",""
356,"M. Mirman, Timon Gehr, Martin T. Vechev","Differentiable Abstract Interpretation for Provably Robust Neural Networks",2018,"","","","",113,"2022-07-13 10:10:07","","","","",,,,,356,89.00,119,3,4,"We introduce a scalable method for training robust neural networks based on abstract interpretation. We present several abstract transformers which balance efficiency with precision and show these can be used to train large neural networks that are certifiably robust to adversarial perturbations.","",""
6,"Kaveri A. Thakoor, Sharath C. Koorathota, D. Hood, P. Sajda","Robust and Interpretable Convolutional Neural Networks to Detect Glaucoma in Optical Coherence Tomography Images",2020,"","","","",114,"2022-07-13 10:10:07","","10.1109/tbme.2020.3043215","","",,,,,6,3.00,2,4,2,"Recent studies suggest that deep learning systems can now achieve performance on par with medical experts in diagnosis of disease. A prime example is in the field of ophthalmology, where convolutional neural networks (CNNs) have been used to detect retinal and ocular diseases. However, this type of artificial intelligence (AI) has yet to be adopted clinically due to questions regarding robustness of the algorithms to datasets collected at new clinical sites and a lack of explainability of AI-based predictions, especially relative to those of human expert counterparts. In this work, we develop CNN architectures that demonstrate robust detection of glaucoma in optical coherence tomography (OCT) images and test with concept activation vectors (TCAVs) to infer what image concepts CNNs use to generate predictions. Furthermore, we compare TCAV results to eye fixations of clinicians, to identify common decision-making features used by both AI and human experts. We find that employing fine-tuned transfer learning and CNN ensemble learning create end-to-end deep learning models with superior robustness compared to previously reported hybrid deep-learning/machine-learning models, and TCAV/eye-fixation comparison suggests the importance of three OCT report sub-images that are consistent with areas of interest fixated upon by OCT experts to detect glaucoma. The pipeline described here for evaluating CNN robustness and validating interpretable image concepts used by CNNs with eye movements of experts has the potential to help standardize the acceptance of new AI tools for use in the clinic.","",""
3,"Artur Petrosyan, M. Sinkin, M. Lebedev, A. Ossadtchi","Decoding and interpreting cortical signals with a compact convolutional neural network",2021,"","","","",115,"2022-07-13 10:10:07","","10.1088/1741-2552/abe20e","","",,,,,3,3.00,1,4,1,"Objective. Brain–computer interfaces (BCIs) decode information from neural activity and send it to external devices. The use of Deep Learning approaches for decoding allows for automatic feature engineering within the specific decoding task. Physiologically plausible interpretation of the network parameters ensures the robustness of the learned decision rules and opens the exciting opportunity for automatic knowledge discovery. Approach. We describe a compact convolutional network-based architecture for adaptive decoding of electrocorticographic (ECoG) data into finger kinematics. We also propose a novel theoretically justified approach to interpreting the spatial and temporal weights in the architectures that combine adaptation in both space and time. The obtained spatial and frequency patterns characterizing the neuronal populations pivotal to the specific decoding task can then be interpreted by fitting appropriate spatial and dynamical models. Main results. We first tested our solution using realistic Monte-Carlo simulations. Then, when applied to the ECoG data from Berlin BCI competition IV dataset, our architecture performed comparably to the competition winners without requiring explicit feature engineering. Using the proposed approach to the network weights interpretation we could unravel the spatial and the spectral patterns of the neuronal processes underlying the successful decoding of finger kinematics from an ECoG dataset. Finally we have also applied the entire pipeline to the analysis of a 32-channel EEG motor-imagery dataset and observed physiologically plausible patterns specific to the task. Significance. We described a compact and interpretable CNN architecture derived from the basic principles and encompassing the knowledge in the field of neural electrophysiology. For the first time in the context of such multibranch architectures with factorized spatial and temporal processing we presented theoretically justified weights interpretation rules. We verified our recipes using simulations and real data and demonstrated that the proposed solution offers a good decoder and a tool for investigating motor control neural mechanisms.","",""
1,"Michael Yeung, L. Rundo, Yang Nan, E. Sala, C. Schönlieb, Guang Yang","Calibrating the Dice loss to handle neural network overconfidence for biomedical image segmentation",2021,"","","","",116,"2022-07-13 10:10:07","","","","",,,,,1,1.00,0,6,1,"The Dice similarity coefficient (DSC) is both a widely used metric and loss function for biomedical image segmentation due to its robustness to class imbalance. However, it is well known that the DSC loss is poorly calibrated, resulting in overconfident predictions that cannot be usefully interpreted in biomedical and clinical practice. Performance is often the only metric used to evaluate segmentations produced by deep neural networks, and calibration is often neglected. However, calibration is important for translation into biomedical and clinical practice, providing crucial contextual information to model predictions for interpretation by scientists and clinicians. In this study, we identify poor calibration as an emerging challenge of deep learning based biomedical image segmentation. We provide a simple yet effective extension of the DSC loss, named the DSC++ loss, that selectively modulates the penalty associated with overconfident, incorrect predictions. As a standalone loss function, the DSC++ loss achieves significantly improved calibration over the conventional DSC loss across five well-validated open-source biomedical imaging datasets. Similarly, we observe significantly improved when integrating the DSC++ loss into four DSC-based loss functions. Finally, we use softmax thresholding to illustrate that well calibrated outputs enable tailoring of precision-recall bias, an important post-processing technique to adapt the model predictions to suit the biomedical or clinical task. The DSC++ loss overcomes the major limitation of the DSC, providing a suitable loss function for training deep learning segmentation models for use in biomedical and clinical practice.","",""
5,"Dimitrios Sakkos, Kevin D. McCay, Claire Marcroft, N. Embleton, Samiran Chattopadhyay, Edmond S. L. Ho","Identification of Abnormal Movements in Infants: A Deep Neural Network for Body Part-Based Prediction of Cerebral Palsy",2021,"","","","",117,"2022-07-13 10:10:07","","10.1109/ACCESS.2021.3093469","","",,,,,5,5.00,1,6,1,"The early diagnosis of cerebral palsy is an area which has recently seen significant multi-disciplinary research. Diagnostic tools such as the General Movements Assessment (GMA), have produced some very promising results, however these manual methods can be laborious. The prospect of automating these processes is seen as key in advancing this field of study. In our previous works, we examined the viability of using pose-based features extracted from RGB video sequences to undertake classification of infant body movements based upon the GMA. In this paper, we propose a new deep learning framework for this classification task. We also propose a visualization framework which identifies body-parts with the greatest contribution towards a classification decision. The inclusion of a visualization framework is an important step towards automation as it helps make the decisions made by the machine learning framework interpretable. We directly compare the proposed framework’s classification with several other methods from the literature using two independent datasets. Our experimental results show that the proposed method performs more consistently and more robustly than our previous pose-based techniques as well as other features from related works in this setting. We also find that our visualization framework helps provide greater interpretability, enhancing the likelihood of the adoption of these technologies within the medical domain.","",""
619,"Mou Chen, S. Ge, B. How","Robust Adaptive Neural Network Control for a Class of Uncertain MIMO Nonlinear Systems With Input Nonlinearities",2010,"","","","",118,"2022-07-13 10:10:07","","10.1109/TNN.2010.2042611","","",,,,,619,51.58,206,3,12,"In this paper, robust adaptive neural network (NN) control is investigated for a general class of uncertain multiple-input-multiple-output (MIMO) nonlinear systems with unknown control coefficient matrices and input nonlinearities. For nonsymmetric input nonlinearities of saturation and deadzone, variable structure control (VSC) in combination with backstepping and Lyapunov synthesis is proposed for adaptive NN control design with guaranteed stability. In the proposed adaptive NN control, the usual assumption on nonsingularity of NN approximation for unknown control coefficient matrices and boundary assumption between NN approximation error and control input have been eliminated. Command filters are presented to implement physical constraints on the virtual control laws, then the tedious analytic computations of time derivatives of virtual control laws are canceled. It is proved that the proposed robust backstepping control is able to guarantee semiglobal uniform ultimate boundedness of all signals in the closed-loop system. Finally, simulation results are presented to illustrate the effectiveness of the proposed adaptive NN control.","",""
2,"A. Petrosino, Giuseppe Salvi","A Robust Neural Network Based Object Recognition System and Its SIMD Implementation",1999,"","","","",119,"2022-07-13 10:10:07","","10.1007/3-540-48311-X_135","","",,,,,2,0.09,1,2,23,"","",""
21,"G. Portwood, B. Nadiga, J. Saenz, D. Livescu","Interpreting neural network models of residual scalar flux",2020,"","","","",120,"2022-07-13 10:10:07","","10.1017/jfm.2020.861","","",,,,,21,10.50,5,4,2,"Abstract We show that, in addition to providing effective and competitive closures, when analysed in terms of the dynamics and physically relevant diagnostics, artificial neural networks (ANNs) can be both interpretable and provide useful insights into the on-going task of developing and improving turbulence closures. In the context of large-eddy simulations (LES) of a passive scalar in homogeneous isotropic turbulence, exact subfilter fluxes obtained by filtering direct numerical simulations are used both to train deep ANN models as a function of filtered variables, and to optimise the coefficients of a turbulent Prandtl number LES closure. A priori analysis of the subfilter scalar variance transfer rate demonstrates that learnt ANN models outperform optimised turbulent Prandtl number closures and Clark-type gradient models. Next, a posteriori solutions are obtained with each model over several integral time scales. These experiments reveal, with single- and multi-point diagnostics, that ANN models temporally track exact resolved scalar variance with greater accuracy compared to other subfilter flux models for a given filter length scale. Finally, we interpret the artificial neural networks statistically with differential sensitivity analysis to show that the ANN models feature a dynamics reminiscent of so-called ‘mixed models’, where mixed models are understood as comprising both a structural and functional component. Besides enabling enhanced-accuracy LES of passive scalars henceforth, we anticipate this work to contribute to utilising neural network models as a tool in interpretability, robustness and model discovery.","",""
8,"S. Candemir, Richard D. White, M. Demirer, Vikash Gupta, M. Bigelow, L. Prevedello, B. Erdal","Automated coronary artery atherosclerosis detection and weakly supervised localization on coronary CT angiography with a deep 3-dimensional convolutional neural network",2019,"","","","",121,"2022-07-13 10:10:07","","","","",,,,,8,2.67,1,7,3,"We propose a fully automated algorithm based on a deep learning framework enabling screening of a Coronary Computed Tomography Angiography (CCTA) examination for confident detection of the presence or absence of coronary artery atherosclerosis. The system starts with extracting the coronary arteries and their branches from CCTA datasets and representing them with multi-planar reformatted volumes; pre-processing and augmentation techniques are then applied to increase the robustness and generalization ability of the system. A 3-Dimensional Convolutional Neural Network (3D CNN) is utilized to model pathological changes (e.g., atherosclerotic plaques) in coronary vessels. The system learns the discriminatory features between vessels with and without atherosclerosis. The discriminative features at the final convolutional layer are visualized with a saliency map approach to provide visual clues related to atherosclerosis likelihood and location. We have evaluated the system on a reference dataset representing 247 patients with atherosclerosis and 246 patients free of atherosclerosis. With 5-fold cross-validation, an Accuracy = 90:9%, Positive Predictive Value = 58:8%, Sensitivity = 68:9%, Specificity of 93:6%, and Negative Predictive Value (NPV) = 96:1% are achieved at the artery/branch level with threshold 0.5. The average area under the receiver operating characteristic curve is 0.91. The system indicates a high NPV, which may be potentially useful for assisting interpreting physicians in excluding coronary atherosclerosis in patients with acute chest pain.","",""
