Cites,Authors,Title,Year,Source,Publisher,ArticleURL,CitesURL,GSRank,QueryDate,Type,DOI,ISSN,CitationURL,Volume,Issue,StartPage,EndPage,ECC,CitesPerYear,CitesPerAuthor,AuthorCount,Age,Abstract,FullTextURL,RelatedURL
14,"Gaolei Li, K. Ota, M. Dong, Jun Wu, Jianhua Li","DeSVig: Decentralized Swift Vigilance Against Adversarial Attacks in Industrial Artificial Intelligence Systems",2020,"","","","",53,"2022-07-13 09:21:18","","10.1109/TII.2019.2951766","","",,,,,14,7.00,3,5,2,"Individually reinforcing the robustness of a single deep learning model only gives limited security guarantees especially when facing adversarial examples. In this article, we propose DeSVig, a decentralized swift vigilance framework to identify adversarial attacks in an industrial artificial intelligence systems (IAISs), which enables IAISs to correct the mistake in a few seconds. The DeSVig is highly decentralized, which improves the effectiveness of recognizing abnormal inputs. We try to overcome the challenges on ultralow latency caused by dynamics in industries using peculiarly designated mobile edge computing and generative adversarial networks. The most important advantage of our work is that it can significantly reduce the failure risks of being deceived by adversarial examples, which is critical for safety-prioritized and delay-sensitive environments. In our experiments, adversarial examples of industrial electronic components are generated by several classical attacking models. Experimental results demonstrate that the DeSVig is more robust, efficient, and scalable than some state-of-art defenses.","",""
13,"Yuanbin Wang, P. Zheng, Tao Peng, Huayong Yang, J. Zou","Smart additive manufacturing: Current artificial intelligence-enabled methods and future perspectives",2020,"","","","",54,"2022-07-13 09:21:18","","10.1007/s11431-020-1581-2","","",,,,,13,6.50,3,5,2,"","",""
9,"M. Gorris, S. Hoogenboom, M. Wallace, J. V. van Hooft","Artificial intelligence for the management of pancreatic diseases",2020,"","","","",55,"2022-07-13 09:21:18","","10.1111/den.13875","","",,,,,9,4.50,2,4,2,"Novel artificial intelligence techniques are emerging in all fields of healthcare, including gastroenterology. The aim of this review is to give an overview of artificial intelligence applications in the management of pancreatic diseases. We performed a systematic literature search in PubMed and Medline up to May 2020 to identify relevant articles. Our results showed that the development of machine‐learning based applications is rapidly evolving in the management of pancreatic diseases, guiding precision medicine in clinical, endoscopic and radiologic settings. Before implementation into clinical practice, further research should focus on the external validation of novel techniques, clarifying the accuracy and robustness of these models.","",""
7,"Huma Fatima, Feroze U. Mahmood, Sankalp Sehgal, K. Belani, A. Sharkey, O. Chaudhary, Y. Baribeau, R. Matyal, K. Khabbaz","Artificial Intelligence for Dynamic Echocardiographic Tricuspid Valve Analysis: A New Tool in Echocardiography.",2020,"","","","",56,"2022-07-13 09:21:18","","10.1053/j.jvca.2020.04.056","","",,,,,7,3.50,1,9,2,"There has been a resurgence of interest in the structure and function of the tricuspid valve (TV) with the established prognostic impact of functional tricuspid regurgitation. Current 3-dimensional transesophageal echocardiography prototype software is limited to exploration of the mitral and aortic valves exclusively. Thus, newer analytical software is required for dynamic geometric analysis of the TV morphology for remodeling. This article presents a preliminary experience with novel artificial intelligence-based semiautomated software for TV analysis. The software offers high correlation to surgical inspection by its ability to analyze morphology and dynamics of the valve throughout the cardiac cycle. In addition, it allows higher reproducibility of data analysis and reduces interobserver variability with minimal need for manual intervention. Integration of interactivity through preprocedural placement of specific devices of different sizes and shapes in the mitral and aortic positions facilitates prognostic evaluation of surgical and interventional procedures.","",""
6,"N. Gahungu, Robert Trueick, S. Bhat, P. Sengupta, G. Dwivedi","Current Challenges and Recent Updates in Artificial Intelligence and Echocardiography",2020,"","","","",57,"2022-07-13 09:21:18","","10.1007/s12410-020-9529-x","","",,,,,6,3.00,1,5,2,"","",""
68,"Ilia Stepin, J. M. Alonso, Alejandro Catalá, Martin Pereira-Fariña","A Survey of Contrastive and Counterfactual Explanation Generation Methods for Explainable Artificial Intelligence",2021,"","","","",58,"2022-07-13 09:21:18","","10.1109/ACCESS.2021.3051315","","",,,,,68,68.00,17,4,1,"A number of algorithms in the field of artificial intelligence offer poorly interpretable decisions. To disclose the reasoning behind such algorithms, their output can be explained by means of so-called evidence-based (or factual) explanations. Alternatively, contrastive and counterfactual explanations justify why the output of the algorithms is not any different and how it could be changed, respectively. It is of crucial importance to bridge the gap between theoretical approaches to contrastive and counterfactual explanation and the corresponding computational frameworks. In this work we conduct a systematic literature review which provides readers with a thorough and reproducible analysis of the interdisciplinary research field under study. We first examine theoretical foundations of contrastive and counterfactual accounts of explanation. Then, we report the state-of-the-art computational frameworks for contrastive and counterfactual explanation generation. In addition, we analyze how grounded such frameworks are on the insights from the inspected theoretical approaches. As a result, we highlight a variety of properties of the approaches under study and reveal a number of shortcomings thereof. Moreover, we define a taxonomy regarding both theoretical and practical approaches to contrastive and counterfactual explanation.","",""
111,"Zhihan Lv, Yang Han, A. Singh, Gunasekaran Manogaran, Haibin Lv","Trustworthiness in Industrial IoT Systems Based on Artificial Intelligence",2021,"","","","",59,"2022-07-13 09:21:18","","10.1109/TII.2020.2994747","","",,,,,111,111.00,22,5,1,"The intelligent industrial environment developed with the support of the new generation network cyber-physical system (CPS) can realize the high concentration of information resources. In order to carry out the analysis and quantification for the reliability of CPS, an automatic online assessment method for the reliability of CPS is proposed in this article. It builds an evaluation framework based on the knowledge of machine learning, designs an online rank algorithm, and realizes the online analysis and assessment in real time. The preventive measures can be taken timely, and the system can operate normally and continuously. Its reliability has been greatly improved. Based on the credibility of the Internet and the Internet of Things, a typical CPS control model based on the spatiotemporal correlation detection model is analyzed to determine the comprehensive reliability model analysis strategy. Based on this, in this article, we propose a CPS trusted robust intelligent control strategy and a trusted intelligent prediction model. Through the simulation analysis, the influential factors of attack defense resources and the dynamic process of distributed cooperative control are obtained. CPS defenders in the distributed cooperative control mode can be guided and select the appropriate defense resource input according to the CPS attack and defense environment.","",""
5,"C. Kyrkou, A. Papachristodoulou, A. Kloukiniotis, A. Papandreou, A. Lalos, K. Moustakas, T. Theocharides","Towards Artificial-Intelligence-Based Cybersecurity for Robustifying Automated Driving Systems Against Camera Sensor Attacks",2020,"","","","",60,"2022-07-13 09:21:18","","10.1109/isvlsi49217.2020.00-11","","",,,,,5,2.50,1,7,2,"CARAMEL is a European project that aims amongst others to improve and extend cyberthreat detection and mitigation techniques for automotive driving systems. This paper highlights the important role that advanced artificial intelligence and machine learning techniques can have in proactively addressing modern autonomous vehicle cybersecurity challenges and on mitigating associated safety risks when dealing with targetted attacks on a vehicle's camera sensors. The cybersecurity solutions developed by CARAMEL are based on powerful AI tools and algorithms to combat security risks in automated driving systems and will be hosted on embedded processors and platforms. As such, it will be possible to have a specialized anti-hacking device that addresses newly introduced technological dimensions for increased robustness and cybersecurity in addition to industry needs for high speed, low latency, functional safety, light weight, low power consumption.","",""
5,"David Abele, Sara D’Onofrio","Artificial Intelligence – The Big Picture",2020,"","","","",61,"2022-07-13 09:21:18","","10.1007/978-3-658-27941-7_2","","",,,,,5,2.50,3,2,2,"","",""
54,"G. Collins, P. Dhiman, Constanza L. Andaur Navarro, Jie Ma, L. Hooft, J. Reitsma, P. Logullo, Andrew Beam, Lily Peng, B. van Calster, M. van Smeden, R. Riley, K. Moons","Protocol for development of a reporting guideline (TRIPOD-AI) and risk of bias tool (PROBAST-AI) for diagnostic and prognostic prediction model studies based on artificial intelligence",2021,"","","","",62,"2022-07-13 09:21:18","","10.1136/bmjopen-2020-048008","","",,,,,54,54.00,5,13,1,"Introduction The Transparent Reporting of a multivariable prediction model of Individual Prognosis Or Diagnosis (TRIPOD) statement and the Prediction model Risk Of Bias ASsessment Tool (PROBAST) were both published to improve the reporting and critical appraisal of prediction model studies for diagnosis and prognosis. This paper describes the processes and methods that will be used to develop an extension to the TRIPOD statement (TRIPOD-artificial intelligence, AI) and the PROBAST (PROBAST-AI) tool for prediction model studies that applied machine learning techniques. Methods and analysis TRIPOD-AI and PROBAST-AI will be developed following published guidance from the EQUATOR Network, and will comprise five stages. Stage 1 will comprise two systematic reviews (across all medical fields and specifically in oncology) to examine the quality of reporting in published machine-learning-based prediction model studies. In stage 2, we will consult a diverse group of key stakeholders using a Delphi process to identify items to be considered for inclusion in TRIPOD-AI and PROBAST-AI. Stage 3 will be virtual consensus meetings to consolidate and prioritise key items to be included in TRIPOD-AI and PROBAST-AI. Stage 4 will involve developing the TRIPOD-AI checklist and the PROBAST-AI tool, and writing the accompanying explanation and elaboration papers. In the final stage, stage 5, we will disseminate TRIPOD-AI and PROBAST-AI via journals, conferences, blogs, websites (including TRIPOD, PROBAST and EQUATOR Network) and social media. TRIPOD-AI will provide researchers working on prediction model studies based on machine learning with a reporting guideline that can help them report key details that readers need to evaluate the study quality and interpret its findings, potentially reducing research waste. We anticipate PROBAST-AI will help researchers, clinicians, systematic reviewers and policymakers critically appraise the design, conduct and analysis of machine learning based prediction model studies, with a robust standardised tool for bias evaluation. Ethics and dissemination Ethical approval has been granted by the Central University Research Ethics Committee, University of Oxford on 10-December-2020 (R73034/RE001). Findings from this study will be disseminated through peer-review publications. PROSPERO registration number CRD42019140361 and CRD42019161764.","",""
24,"Maxime Sermesant, H. Delingette, H. Cochet, P. Jaïs, N. Ayache","Applications of artificial intelligence in cardiovascular imaging",2021,"","","","",63,"2022-07-13 09:21:18","","10.1038/s41569-021-00527-2","","",,,,,24,24.00,5,5,1,"","",""
23,"V. Baxi, R. Edwards, M. Montalto, S. Saha","Digital pathology and artificial intelligence in translational medicine and clinical practice",2021,"","","","",64,"2022-07-13 09:21:18","","10.1038/s41379-021-00919-2","","",,,,,23,23.00,6,4,1,"","",""
21,"Adrien Bécue, Isabel Praça, J. Gama","Artificial intelligence, cyber-threats and Industry 4.0: challenges and opportunities",2021,"","","","",65,"2022-07-13 09:21:18","","10.1007/S10462-020-09942-2","","",,,,,21,21.00,7,3,1,"","",""
15,"S. Ebrahimian, Fatemeh Homayounieh, M. Rockenbach, Preetham Putha, T. Raj, I. Dayan, B. Bizzo, Varun Buch, Dufan Wu, Kyungsang Kim, Quanzheng Li, S. Digumarthy, M. Kalra","Artificial intelligence matches subjective severity assessment of pneumonia for prediction of patient outcome and need for mechanical ventilation: a cohort study",2021,"","","","",66,"2022-07-13 09:21:18","","10.1038/s41598-020-79470-0","","",,,,,15,15.00,2,13,1,"","",""
16,"A. Amritphale, Ranojoy Chatterjee, Suvo Chatterjee, N. Amritphale, Ali Rahnavard, G. Awan, B. Omar, G. Fonarow","Predictors of 30-Day Unplanned Readmission After Carotid Artery Stenting Using Artificial Intelligence",2021,"","","","",67,"2022-07-13 09:21:18","","10.1007/s12325-021-01709-7","","",,,,,16,16.00,2,8,1,"","",""
7,"Gonzague Henri, T. Levent, Avishai Halev, Réda Alami, Philippe Cordier","pymgrid: An Open-Source Python Microgrid Simulator for Applied Artificial Intelligence Research",2020,"","","","",68,"2022-07-13 09:21:18","","","","",,,,,7,3.50,1,5,2,"Microgrids, self contained electrical grids that are capable of disconnecting from the main grid, hold potential in both tackling climate change mitigation via reducing CO2 emissions and adaptation by increasing infrastructure resiliency. Due to their distributed nature, microgrids are often idiosyncratic; as a result, control of these systems is nontrivial. While microgrid simulators exist, many are limited in scope and in the variety of microgrids they can simulate. We propose pymgrid, an open-source Python package to generate and simulate a large number of microgrids, and the first open-source tool that can generate more than 600 different microgrids. pymgrid abstracts most of the domain expertise, allowing users to focus on control algorithms. In particular, pymgrid is built to be a reinforcement learning (RL) platform, and includes the ability to model microgrids as Markov decision processes. pymgrid also introduces two pre-computed list of microgrids, intended to allow for research reproducibility in the microgrid setting.","",""
17,"Qingchun Guo, Zhenfang He","Prediction of the confirmed cases and deaths of global COVID-19 using artificial intelligence",2021,"","","","",69,"2022-07-13 09:21:18","","10.1007/s11356-020-11930-6","","",,,,,17,17.00,9,2,1,"","",""
163,"Yun Liu, Timo Kohlberger, Mohammad Norouzi, George E. Dahl, Jenny L. Smith, Arash Mohtashamian, N. Olson, L. Peng, J. Hipp, Martin C. Stumpe","Artificial Intelligence-Based Breast Cancer Nodal Metastasis Detection: Insights Into the Black Box for Pathologists.",2018,"","","","",70,"2022-07-13 09:21:18","","10.5858/arpa.2018-0147-OA","","",,,,,163,40.75,16,10,4,"CONTEXT.— Nodal metastasis of a primary tumor influences therapy decisions for a variety of cancers. Histologic identification of tumor cells in lymph nodes can be laborious and error-prone, especially for small tumor foci.   OBJECTIVE.— To evaluate the application and clinical implementation of a state-of-the-art deep learning-based artificial intelligence algorithm (LYmph Node Assistant or LYNA) for detection of metastatic breast cancer in sentinel lymph node biopsies.   DESIGN.— Whole slide images were obtained from hematoxylin-eosin-stained lymph nodes from 399 patients (publicly available Camelyon16 challenge dataset). LYNA was developed by using 270 slides and evaluated on the remaining 129 slides. We compared the findings to those obtained from an independent laboratory (108 slides from 20 patients/86 blocks) using a different scanner to measure reproducibility.   RESULTS.— LYNA achieved a slide-level area under the receiver operating characteristic (AUC) of 99% and a tumor-level sensitivity of 91% at 1 false positive per patient on the Camelyon16 evaluation dataset. We also identified 2 ""normal"" slides that contained micrometastases. When applied to our second dataset, LYNA achieved an AUC of 99.6%. LYNA was not affected by common histology artifacts such as overfixation, poor staining, and air bubbles.   CONCLUSIONS.— Artificial intelligence algorithms can exhaustively evaluate every tissue patch on a slide, achieving higher tumor-level sensitivity than, and comparable slide-level performance to, pathologists. These techniques may improve the pathologist's productivity and reduce the number of false negatives associated with morphologic detection of tumor cells. We provide a framework to aid practicing pathologists in assessing such algorithms for adoption into their workflow (akin to how a pathologist assesses immunohistochemistry results).","",""
13,"F. Binczyk, Wojciech Prazuch, P. Bożek, J. Polańska","Radiomics and artificial intelligence in lung cancer screening.",2021,"","","","",71,"2022-07-13 09:21:18","","10.21037/tlcr-20-708","","",,,,,13,13.00,3,4,1,"Lung cancer is responsible for more fatalities than any other cancer worldwide, with 1.76 million associated deaths reported in 2018. The key issue in the fight against this disease is the detection and diagnosis of all pulmonary nodules at an early stage. Artificial intelligence (AI) algorithms play a vital role in the automated detection, segmentation, and computer-aided diagnosis of malignant lesions. Among the existing algorithms, radiomics and deep-learning-based types appear to show the most promise. Radiomics is a growing field related to the extraction of a set of features from an image, which allows for automated classification of medical images into a predefined group. The process comprises a series of consecutive steps including image acquisition and pre-processing, segmentation of the desired region of interest, calculation of defined features, feature engineering, and construction of the classification model. The features calculated in this process are mainly shape features, as well as first- and higher-order texture features. To date, more than 100 features have been defined, although this number varies depending on the application. The greatest challenge in radiomics is building a cross-validated model based on a selected set of calculated features known as the radiomic signature. Numerous radiomic signatures have successfully been developed; however, reproducibility and clinical validity of the results obtained constitutes a considerable challenge of modern radiomics. Deep learning algorithms are another rapidly evolving technique and are recognized as a valuable tool in the field of medical image analysis for the detection, characterization, and assessment of lesions. Such an approach involves the design of artificial neural network architecture while upholding the goal of high classification accuracy. This paper illuminates the evolution and current state of artificial intelligence methods in lung imaging and the detection and diagnosis of pulmonary nodules, with a particular emphasis on radiomics and deep learning methods.","",""
109,"Shilin Qiu, Qihe Liu, Shijie Zhou, Chunjiang Wu","Review of Artificial Intelligence Adversarial Attack and Defense Technologies",2019,"","","","",72,"2022-07-13 09:21:18","","10.3390/APP9050909","","",,,,,109,36.33,27,4,3,"In recent years, artificial intelligence technologies have been widely used in computer vision, natural language processing, automatic driving, and other fields. However, artificial intelligence systems are vulnerable to adversarial attacks, which limit the applications of artificial intelligence (AI) technologies in key security fields. Therefore, improving the robustness of AI systems against adversarial attacks has played an increasingly important role in the further development of AI. This paper aims to comprehensively summarize the latest research progress on adversarial attack and defense technologies in deep learning. According to the target model’s different stages where the adversarial attack occurred, this paper expounds the adversarial attack methods in the training stage and testing stage respectively. Then, we sort out the applications of adversarial attack technologies in computer vision, natural language processing, cyberspace security, and the physical world. Finally, we describe the existing adversarial defense methods respectively in three main categories, i.e., modifying data, modifying models and using auxiliary tools.","",""
19,"J. Mianroodi, Nima H Siboni, D. Raabe","Teaching solid mechanics to artificial intelligence—a fast solver for heterogeneous materials",2021,"","","","",73,"2022-07-13 09:21:18","","10.1038/s41524-021-00571-z","","",,,,,19,19.00,6,3,1,"","",""
15,"J. Janet, Chenru Duan, A. Nandy, Fang Liu, H. Kulik","Navigating Transition-Metal Chemical Space: Artificial Intelligence for First-Principles Design.",2021,"","","","",74,"2022-07-13 09:21:18","","10.1021/acs.accounts.0c00686","","",,,,,15,15.00,3,5,1,"ConspectusThe variability of chemical bonding in open-shell transition-metal complexes not only motivates their study as functional materials and catalysts but also challenges conventional computational modeling tools. Here, tailoring ligand chemistry can alter preferred spin or oxidation states as well as electronic structure properties and reactivity, creating vast regions of chemical space to explore when designing new materials atom by atom. Although first-principles density functional theory (DFT) remains the workhorse of computational chemistry in mechanism deduction and property prediction, it is of limited use here. DFT is both far too computationally costly for widespread exploration of transition-metal chemical space and also prone to inaccuracies that limit its predictive performance for localized d electrons in transition-metal complexes. These challenges starkly contrast with the well-trodden regions of small-organic-molecule chemical space, where the analytical forms of molecular mechanics force fields and semiempirical theories have for decades accelerated the discovery of new molecules, accurate DFT functional performance has been demonstrated, and gold-standard methods from correlated wavefunction theory can predict experimental results to chemical accuracy.The combined promise of transition-metal chemical space exploration and lack of established tools has mandated a distinct approach. In this Account, we outline the path we charted in exploration of transition-metal chemical space starting from the first machine learning (ML) models (i.e., artificial neural network and kernel ridge regression) and representations for the prediction of open-shell transition-metal complex properties. The distinct importance of the immediate coordination environment of the metal center as well as the lack of low-level methods to accurately predict structural properties in this coordination environment first motivated and then benefited from these ML models and representations. Once developed, the recipe for prediction of geometric, spin state, and redox potential properties was straightforwardly extended to a diverse range of other properties, including in catalysis, computational ""feasibility"", and the gas separation properties of periodic metal-organic frameworks. Interpretation of selected features most important for model prediction revealed new ways to encapsulate design rules and confirmed that models were robustly mapping essential structure-property relationships. Encountering the special challenge of ensuring that good model performance could generalize to new discovery targets motivated investigation of how to best carry out model uncertainty quantification. Distance-based approaches, whether in model latent space or in carefully engineered feature space, provided intuitive measures of the domain of applicability. With all of these pieces together, ML can be harnessed as an engine to tackle the large-scale exploration of transition-metal chemical space needed to satisfy multiple objectives using efficient global optimization methods. In practical terms, bringing these artificial intelligence tools to bear on the problems of transition-metal chemical space exploration has resulted in ML-model assessments of large, multimillion compound spaces in minutes and validated new design leads in weeks instead of decades.","",""
