Cites,Authors,Title,Year,Source,Publisher,ArticleURL,CitesURL,GSRank,QueryDate,Type,DOI,ISSN,CitationURL,Volume,Issue,StartPage,EndPage,ECC,CitesPerYear,CitesPerAuthor,AuthorCount,Age,Abstract,FullTextURL,RelatedURL
0,"J. Chapman, Dao Lam, B. Cai, Geoffrey D. Hugo","Robustness and reproducibility of an artificial intelligence-assisted online segmentation and adaptive planning process for online adaptive radiation therapy.",2022,"","","","",1,"2022-07-13 09:21:18","","10.1002/acm2.13702","","",,,,,0,0.00,0,4,1,"Clinical implementation of online adaptive radiation therapy requires initial and ongoing performance assessment of the underlying auto-segmentation and adaptive planning algorithms, although a straightforward and efficient process for this in phantom is lacking. The purpose of this work was to investigate robustness and repeatability of the artificial intelligence-assisted online segmentation and adaptive planning process on the Varian Ethos adaptive platform, and to develop an end-to-end test strategy for online adaptive radiation therapy. Five synthetic deformations were generated and applied to a computed tomography image of an anthropomorphic pelvis phantom, and reference treatment plans were generated from each of the resulting deformed images. The undeformed phantom was repeatedly imaged, and the online adaptive process was performed including auto-segmentation, review and manual correction of contours, and adaptive plan creation. One adaptive fractions in five different deformation scenarios were performed. The manually corrected contours had a high degree of consistency (> 93% Dice similarity coefficient and < 1.0 mm mean surface distance) across repeated fractions, with no significant variation across the synthetic deformation instance except for bowel (p = 0.026, one-way ANOVA). Adaptive treatment plans also resulted in highly consistent dose-volume values for targets and organs at risk. A straightforward and efficient process was developed and used to quantify a set of organ specific contouring and dosimetric action levels to help establish uncertainty bounds for an end-to-end test on the Varian Ethos system.","",""
15,"Qingxia Yang, Yun-Xia Wang, Fengcheng Li, Song-zhao Zhang, Yongchao Luo, Yi Li, Jing Tang, Bo Li, Yu‐Zong Chen, Weiwei Xue, Feng Zhu","Identification of the gene signature reflecting schizophrenia’s etiology by constructing artificial intelligence‐based method of enhanced reproducibility",2019,"","","","",2,"2022-07-13 09:21:18","","10.1111/cns.13196","","",,,,,15,5.00,2,11,3,"As one of the most fundamental questions in modern science, “what causes schizophrenia (SZ)” remains a profound mystery due to the absence of objective gene markers. The reproducibility of the gene signatures identified by independent studies is found to be extremely low due to the incapability of available feature selection methods and the lack of measurement on validating signatures’ robustness. These irreproducible results have significantly limited our understanding of the etiology of SZ.","",""
7,"Vinicius M. Alves, S. Auerbach, N. Kleinstreuer, J. Rooney, E. Muratov, I. Rusyn, A. Tropsha, Charles Schmitt","Curated Data In — Trustworthy In Silico Models Out: The Impact of Data Quality on the Reliability of Artificial Intelligence Models as Alternatives to Animal Testing",2021,"","","","",3,"2022-07-13 09:21:18","","10.1177/02611929211029635","","",,,,,7,7.00,1,8,1,"New Approach Methodologies (NAMs) that employ artificial intelligence (AI) for predicting adverse effects of chemicals have generated optimistic expectations as alternatives to animal testing. However, the major underappreciated challenge in developing robust and predictive AI models is the impact of the quality of the input data on the model accuracy. Indeed, poor data reproducibility and quality have been frequently cited as factors contributing to the crisis in biomedical research, as well as similar shortcomings in the fields of toxicology and chemistry. In this article, we review the most recent efforts to improve confidence in the robustness of toxicological data and investigate the impact that data curation has on the confidence in model predictions. We also present two case studies demonstrating the effect of data curation on the performance of AI models for predicting skin sensitisation and skin irritation. We show that, whereas models generated with uncurated data had a 7–24% higher correct classification rate (CCR), the perceived performance was, in fact, inflated owing to the high number of duplicates in the training set. We assert that data curation is a critical step in building computational models, to help ensure that reliable predictions of chemical toxicity are achieved through use of the models.","",""
5,"M. E. Laino, Angela Ammirabile, A. Posa, Pierandrea Cancian, Sherif Shalaby, V. Savevski, E. Neri","The Applications of Artificial Intelligence in Chest Imaging of COVID-19 Patients: A Literature Review",2021,"","","","",4,"2022-07-13 09:21:18","","10.3390/diagnostics11081317","","",,,,,5,5.00,1,7,1,"Diagnostic imaging is regarded as fundamental in the clinical work-up of patients with a suspected or confirmed COVID-19 infection. Recent progress has been made in diagnostic imaging with the integration of artificial intelligence (AI) and machine learning (ML) algorisms leading to an increase in the accuracy of exam interpretation and to the extraction of prognostic information useful in the decision-making process. Considering the ever expanding imaging data generated amid this pandemic, COVID-19 has catalyzed the rapid expansion in the application of AI to combat disease. In this context, many recent studies have explored the role of AI in each of the presumed applications for COVID-19 infection chest imaging, suggesting that implementing AI applications for chest imaging can be a great asset for fast and precise disease screening, identification and characterization. However, various biases should be overcome in the development of further ML-based algorithms to give them sufficient robustness and reproducibility for their integration into clinical practice. As a result, in this literature review, we will focus on the application of AI in chest imaging, in particular, deep learning, radiomics and advanced imaging as quantitative CT.","",""
1,"M. Tamal","A Phantom Study to Investigate Robustness and Reproducibility of Grey Level Co-Occurrence Matrix (GLCM)-Based Radiomics Features for PET",2021,"","","","",5,"2022-07-13 09:21:18","","10.3390/APP11020535","","",,,,,1,1.00,1,1,1,"Quantification and classification of heterogeneous radiotracer uptake in Positron Emission Tomography (PET) using textural features (termed as radiomics) and artificial intelligence (AI) has the potential to be used as a biomarker of diagnosis and prognosis. However, textural features have been predicted to be strongly correlated with volume, segmentation and quantization, while the impact of image contrast and noise has not been assessed systematically. Further continuous investigations are required to update the existing standardization initiatives. This study aimed to investigate the relationships between textural features and these factors with 18F filled torso NEMA phantom to yield different contrasts and reconstructed with different durations to represent varying levels of noise. The phantom was also scanned with heterogeneous spherical inserts fabricated with 3D printing technology. All spheres were delineated using: (1) the exact boundaries based on their known diameters; (2) 40% fixed; and (3) adaptive threshold. Six textural features were derived from the gray level co-occurrence matrix (GLCM) using different quantization levels. The results indicate that homogeneity and dissimilarity are the most suitable for measuring PET tumor heterogeneity with quantization 64 provided that the segmentation method is robust to noise and contrast variations. To use these textural features as prognostic biomarkers, changes in textural features between baseline and treatment scans should always be reported along with the changes in volumes.","",""
0,"Svitlana Volkova, Dustin L. Arendt, Emily Saldanha, M. Glenski, Ellyn Ayton, Joseph A. Cottam, Sinan G. Aksoy, Brett Jefferson, Karthnik Shrivaram","Explaining and predicting human behavior and social dynamics in simulated virtual worlds: reproducibility, generalizability, and robustness of causal discovery methods",2021,"","","","",6,"2022-07-13 09:21:18","","10.1007/s10588-021-09351-y","","",,,,,0,0.00,0,9,1,"","",""
0,"A. Curiale, M. Calandrelli, Lucca Dellazoppa, Mariano Trevisán, Jorge Luis Boci'An, Juan Pablo Bonifacio, G. Mato","Automatic Quantification of Volumes and Biventricular Function in Cardiac Resonance. Validation of a New Artificial Intelligence Approach",2022,"","","","",7,"2022-07-13 09:21:18","","10.7775/rac.v89.i4.20427","","",,,,,0,0.00,0,7,1,"Background: Artificial intelligence techniques have shown great potential in cardiology, especially in quantifying cardiac biventri- cular function, volume, mass, and ejection fraction (EF). However, its use in clinical practice is not straightforward due to its poor reproducibility with cases from daily practice, among other reasons. Objectives: To validate a new artificial intelligence tool in order to quantify the cardiac biventricular function (volume, mass, and EF). To analyze its robustness in the clinical area, and the computational times compared with conventional methods. Methods: A total of 189 patients were analyzed: 89 from a regional center and 100 from a public center. The method proposes two convolutional networks that include anatomical information of the heart to reduce classification errors. Results: A high concordance (Pearson coefficient) was observed between manual quantification and the proposed quantification of cardiac function (0.98, 0.92, 0.96 and 0.8 for volumes and biventricular EF) in about 5 seconds per study. Conclusions: This method quantifies biventricular function and volumes in seconds with an accuracy equivalent to that of a specialist. hyperten-sive cardiomyopathy), normal function, health Bariloche (SSC). used ejection fraction end-diastolic and end-systolic the linear correlation between the proposed method and manual quantification was analyzed, and Pearson's correlation coefficient was calculated. Systematic errors and degree of concordance were assessed with a Bland and Alt-man analysis.","",""
0,"O. Rouvière, R. Souchon, C. Lartizien, Adeline Mansuy, L. Magaud, Matthieu Colom, Marine Dubreuil-Chambardel, Sabine Debeer, Tristan Jaouen, Audrey Duran, P. Rippert, B. Riche, C. Monini, V. Vlaeminck-Guillem, J. Haesebaert, M. Rabilloud, S. Crouzet","Detection of ISUP ≥2 prostate cancers using multiparametric MRI: prospective multicentre assessment of the non-inferiority of an artificial intelligence system as compared to the PI-RADS V.2.1 score (CHANGE study)",2022,"","","","",8,"2022-07-13 09:21:18","","10.1136/bmjopen-2021-051274","","",,,,,0,0.00,0,17,1,"Introduction Prostate multiparametric MRI (mpMRI) has shown good sensitivity in detecting cancers with an International Society of Urological Pathology (ISUP) grade of ≥2. However, it lacks specificity, and its inter-reader reproducibility remains moderate. Biomarkers, such as the Prostate Health Index (PHI), may help select patients for prostate biopsy. Computer-aided diagnosis/detection (CAD) systems may also improve mpMRI interpretation. Different prototypes of CAD systems are currently developed under the Recherche Hospitalo-Universitaire en Santé / Personalized Focused Ultrasound Surgery of Localized Prostate Cancer (RHU PERFUSE) research programme, tackling challenging issues such as robustness across imaging protocols and magnetic resonance (MR) vendors, and ability to characterise cancer aggressiveness. The study primary objective is to evaluate the non-inferiority of the area under the receiver operating characteristic curve of the final CAD system as compared with the Prostate Imaging-Reporting and Data System V.2.1 (PI-RADS V.2.1) in predicting the presence of ISUP ≥2 prostate cancer in patients undergoing prostate biopsy. Methods This prospective, multicentre, non-inferiority trial will include 420 men with suspected prostate cancer, a prostate-specific antigen level of ≤30 ng/mL and a clinical stage ≤T2 c. Included men will undergo prostate mpMRI that will be interpreted using the PI-RADS V.2.1 score. Then, they will undergo systematic and targeted biopsy. PHI will be assessed before biopsy. At the end of patient inclusion, MR images will be assessed by the final version of the CAD system developed under the RHU PERFUSE programme. Key secondary outcomes include the prediction of ISUP grade ≥2 prostate cancer during a 3-year follow-up, and the number of biopsy procedures saved and ISUP grade ≥2 cancers missed by several diagnostic pathways combining PHI and MRI findings. Ethics and dissemination Ethical approval was obtained from the Comité de Protection des Personnes Nord Ouest III (ID-RCB: 2020-A02785-34). After publication of the results, access to MR images will be possible for testing other CAD systems. Trial registration number NCT04732156.","",""
7,"Tom Ward, Andrew Bolt, Nik Hemmings, Simon Carter, Manuel Sanchez, Ricardo Barreira, Seb Noury, Keith Anderson, Jay Lemmon, J. Coe, Piotr Trochim, T. Handley, A. Bolton","Using Unity to Help Solve Intelligence",2020,"","","","",9,"2022-07-13 09:21:18","","","","",,,,,7,3.50,1,13,2,"In the pursuit of artificial general intelligence, our most significant measurement of progress is an agent's ability to achieve goals in a wide range of environments. Existing platforms for constructing such environments are typically constrained by the technologies they are founded on, and are therefore only able to provide a subset of scenarios necessary to evaluate progress. To overcome these shortcomings, we present our use of Unity, a widely recognized and comprehensive game engine, to create more diverse, complex, virtual simulations. We describe the concepts and components developed to simplify the authoring of these environments, intended for use predominantly in the field of reinforcement learning. We also introduce a practical approach to packaging and re-distributing environments in a way that attempts to improve the robustness and reproducibility of experiment results. To illustrate the versatility of our use of Unity compared to other solutions, we highlight environments already created using our approach from published papers. We hope that others can draw inspiration from how we adapted Unity to our needs, and anticipate increasingly varied and complex environments to emerge from our approach as familiarity grows.","",""
30,"A. Bizzego, Nicole Bussola, M. Chierici, V. Maggio, Margherita Francescatto, L. Cima, M. Cristoforetti, Giuseppe Jurman, C. Furlanello","Evaluating reproducibility of AI algorithms in digital pathology with DAPPER",2018,"","","","",10,"2022-07-13 09:21:18","","10.1101/340646","","",,,,,30,7.50,3,9,4,"Artificial Intelligence is exponentially increasing its impact on healthcare. As deep learning is mastering computer vision tasks, its application to digital pathology is natural, with the promise of aiding in routine reporting and standardizing results across trials. Deep learning features inferred from digital pathology scans can improve validity and robustness of current clinico-pathological features, up to identifying novel histological patterns, e.g. from tumor infiltrating lymphocytes. In this study, we examine the issue of evaluating accuracy of predictive models from deep learning features in digital pathology, as an hallmark of reproducibility. We introduce the DAPPER framework for validation based on a rigorous Data Analysis Plan derived from the FDA’s MAQC project, designed to analyse causes of variability in predictive biomarkers. We apply the framework on models that identify tissue of origin on 787 Whole Slide Images from the Genotype-Tissue Expression (GTEx) project. We test 3 different deep learning architectures (VGG, ResNet, Inception) as feature extractors and three classifiers (a fully connected multilayer, Support Vector Machine and Random Forests) and work with 4 datasets (5, 10, 20 or 30 classes), for a total 53000 tiles at 512 × 512 resolution. We analyze accuracy and feature stability of the machine learning classifiers, also demonstrating the need for random features and random labels diagnostic tests to identify selection bias and risks for reproducibility. Further, we use the deep features from the VGG model from GTEx on the KIMIA24 dataset for identification of slide of origin (24 classes) to train a classifier on 1060 annotated tiles and validated on 265 unseen ones. The DAPPER software, including its deep learning backbone pipeline and the HINT (Histological Imaging - Newsy Tiles) benchmark dataset derived from GTEx, is released as a basis for standardization and validation initiatives in AI for Digital Pathology. Author summary In this study, we examine the issue of evaluating accuracy of predictive models from deep learning features in digital pathology, as an hallmark of reproducibility. It is indeed a top priority that reproducibility-by-design gets adopted as standard practice in building and validating AI methods in the healthcare domain. Here we introduce DAPPER, a first framework to evaluate deep features and classifiers in digital pathology, based on a rigorous data analysis plan originally developed in the FDA’s MAQC initiative for predictive biomarkers from massive omics data. We apply DAPPER on models trained to identify tissue of origin from the HINT benchmark dataset of 53000 tiles from 787 Whole Slide Images in the Genotype-Tissue Expression (GTEx) project. We analyze accuracy and feature stability of different deep learning architectures (VGG, ResNet and Inception) as feature extractors and classifiers (a fully connected multilayer, SVMs and Random Forests) on up to 20 classes. Further, we use the deep features from the VGG model (trained on HINT) on the 1300 annotated tiles of the KIMIA24 dataset for identification of slide of origin (24 classes). The DAPPER software is available together with the HINT benchmark dataset.","",""
4,"Bo Li, Peng Qi, Bo Liu, Shuai Di, Jingen Liu, Jiquan Pei, Jinfeng Yi, Bowen Zhou","Trustworthy AI: From Principles to Practices",2021,"","","","",11,"2022-07-13 09:21:18","","","","",,,,,4,4.00,1,8,1,"The rapid development of Artificial Intelligence (AI) technology has enabled the deployment of various systems based on it. However, many current AI systems are found vulnerable to imperceptible attacks, biased against underrepresented groups, lacking in user privacy protection. These shortcomings degrade user experience and erode people’s trust in all AI systems. In this review, we provide AI practitioners with a comprehensive guide for building trustworthy AI systems. We first introduce the theoretical framework of important aspects of AI trustworthiness, including robustness, generalization, explainability, transparency, reproducibility, fairness, privacy preservation, and accountability. To unify currently available but fragmented approaches toward trustworthy AI, we organize them in a systematic approach that considers the entire lifecycle of AI systems, ranging from data acquisition to model development, to system development and deployment, finally to continuous monitoring and governance. In this framework, we offer concrete action items for practitioners and societal stakeholders (e.g., researchers, engineers, and regulators) to improve AI trustworthiness. Finally, we identify key opportunities and challenges for the future development of trustworthy AI systems, where we identify the need for a paradigm shift toward comprehensively trustworthy AI systems.","",""
4,"A. Thomas, Christopher Ré, R. Poldrack","Challenges for cognitive decoding using deep learning methods",2021,"","","","",12,"2022-07-13 09:21:18","","","","",,,,,4,4.00,1,3,1,"In cognitive decoding, researchers aim to characterize a brain region's representations by identifying the cognitive states (e.g., accepting/rejecting a gamble) that can be identified from the region's activity. Deep learning (DL) methods are highly promising for cognitive decoding, with their unmatched ability to learn versatile representations of complex data. Yet, their widespread application in cognitive decoding is hindered by their general lack of interpretability as well as difficulties in applying them to small datasets and in ensuring their reproducibility and robustness. We propose to approach these challenges by leveraging recent advances in explainable artificial intelligence and transfer learning, while also providing specific recommendations on how to improve the reproducibility and robustness of DL modeling results.","",""
21,"A. Chaudhari, Christopher M. Sandino, Elizabeth K. Cole, D. Larson, G. Gold, S. Vasanawala, M. Lungren, B. Hargreaves, C. Langlotz","Prospective Deployment of Deep Learning in MRI: A Framework for Important Considerations, Challenges, and Recommendations for Best Practices",2020,"","","","",13,"2022-07-13 09:21:18","","10.1002/jmri.27331","","",,,,,21,10.50,2,9,2,"Artificial intelligence algorithms based on principles of deep learning (DL) have made a large impact on the acquisition, reconstruction, and interpretation of MRI data. Despite the large number of retrospective studies using DL, there are fewer applications of DL in the clinic on a routine basis. To address this large translational gap, we review the recent publications to determine three major use cases that DL can have in MRI, namely, that of model‐free image synthesis, model‐based image reconstruction, and image or pixel‐level classification. For each of these three areas, we provide a framework for important considerations that consist of appropriate model training paradigms, evaluation of model robustness, downstream clinical utility, opportunities for future advances, as well recommendations for best current practices. We draw inspiration for this framework from advances in computer vision in natural imaging as well as additional healthcare fields. We further emphasize the need for reproducibility of research studies through the sharing of datasets and software.","",""
0,"P. Druzhinina, E. Kondrateva, M. Sharaev","The effect of skull-stripping on transfer learning for 3D MRI models: ADNI data",2022,"","","","",14,"2022-07-13 09:21:18","","","","",,,,,0,0.00,0,3,1,"In recent years, with the improvement of data collection and preprocessing, as well as the development of deep learning algorithms, there have been more opportunities for applying artificial intelligence to different areas, including neuroimaging. Various model learning pipelines are emerging to study the degree of cognitive impairment in diseases such as Alzheimer’s disease (AD). In this study, we explore knowledge transfer for the stability of the 3D computer vision models (CNN) for the classification of AD on ADNI data. To assess the model performance, and the quality of learned patterns and examine the ways of models overfitting we utilize conventional 3DCNN interpretation methods and swap tests. We imply that skull-stripping and knowledge transfer strategies can significantly impact the robustness and reproducibility of learned patterns, and suggest to apply swap tests to ensure the model stability.","",""
17,"R. Du, V. Lee, Hui Yuan, K. Lam, H. Pang, Yu Chen, E. Lam, P. Khong, A. Lee, D. Kwong, V. Vardhanabhuti","Radiomics Model to Predict Early Progression of Nonmetastatic Nasopharyngeal Carcinoma after Intensity Modulation Radiation Therapy: A Multicenter Study.",2019,"","","","",15,"2022-07-13 09:21:18","","10.1148/RYAI.2019180075","","",,,,,17,5.67,2,11,3,"Purpose To examine the prognostic value of a machine learning model trained with pretreatment MRI radiomic features in the assessment of patients with nonmetastatic nasopharyngeal carcinoma (NPC) who are at risk for 3-year disease progression after intensity-modulated radiation therapy and to explain the radiomics features in the model.   Materials and Methods A total of 277 patients with nonmetastatic NPC admitted between March 2008 and December 2014 at two imaging centers were retrospectively reviewed. Patients were allocated to a discovery or validation cohort based on where they underwent MRI (discovery cohort, n = 217; validation cohort, n = 60). A total of 525 radiomics features extracted from contrast material-enhanced T1- or T2-weighted MRI studies and five clinical features were subjected to radiomic machine learning modeling to predict 3-year disease progression. Feature selection was performed by analyzing robustness to resampling, reproducibility between observers, and redundancy. Features for the final model were selected with Kaplan-Meier analysis and the log-rank test. A support vector machine was used as the classifier for the model. To interpret the pattern learned from the model, Shapley additive explanations (SHAP) was applied.   Results The final model yielded an area under the receiver operating characteristic curve of 0.80 in both the discovery (95% bootstrap confidence interval: 0.80, 0.81) and independent validation (95% bootstrap confidence interval: 0.73, 0.89) cohorts. Analysis with SHAP revealed that tumor shape sphericity, first-order mean absolute deviation, T stage, and overall stage were important factors in 3-year disease progression.   Conclusion These results add to the growing evidence of the role of radiomics in the assessment of NPC. By using explanatory techniques, such as SHAP, the complex interaction of features learned by the model may be understood.© RSNA, 2019Supplemental material is available for this article.","",""
