Cites,Authors,Title,Year,Source,Publisher,ArticleURL,CitesURL,GSRank,QueryDate,Type,DOI,ISSN,CitationURL,Volume,Issue,StartPage,EndPage,ECC,CitesPerYear,CitesPerAuthor,AuthorCount,Age,Abstract,FullTextURL,RelatedURL
14,"M. Yazdani-Asrami, Mehran Taghipour-Gorjikolaie, Wenjuan Song, Min Zhang, W. Yuan","Prediction of Nonsinusoidal AC Loss of Superconducting Tapes Using Artificial Intelligence-Based Models",2020,"","","","",149,"2022-07-13 09:21:18","","10.1109/ACCESS.2020.3037685","","",,,,,14,7.00,3,5,2,"Current is no longer sinusoidal in modern electric networks because of widespread use of power electronic-based equipments and nonlinear loads. Usually AC loss is calculated for pure sinusoidal current, while it is no longer accurate when current is nonsinusoidal. On the other hand, efficiency of cooling system in large scale power devices is dependent on accurate estimation and prediction of the heat load caused by AC loss in design stage. Therefore, estimation of nonsinusoidal AC loss of high temperature superconducting (HTS) material would be of great interest for designers of large-scale superconducting devices. In this paper, at first nonsinusoidal AC loss of a typical HTS tape was calculated under distorted currents using H-formulation finite element method. Then, a range of artificial intelligence (AI) models were implemented to predict AC loss of a typical HTS tape. In order to find the best and more adaptive AI model for nonsinusoidal AC loss prediction, different regression models are evaluated using Support Vector Machine regression model, Generalized Linear regression model, Decision Tree regression model, Feed Forward Neural Network based model, Adaptive Neuro Fuzzy Inference System based model, and Radial Basis Function Neural Network (RBFNN) based model. In order to evaluate robustness of developed models cross-validation technique is implemented on experimental data. To compare the performance of different AI models, four prediction measures were used: Theil’s U coefficients (U_Accuracy and U_Quality), Root Mean Square Error (RMSE) and Regression value (R-value). Obtained results show that best performance belongs to RBFNN based model and then ANFIS based model. U coefficients and RMSE values are obtained less than 0.005 and R-Value is become close to one by using RBFNN based model for testing data, which indicates high accuracy prediction performance.","",""
14,"Claudia Gonzalez Viejo, S. Fuentes","Beer Aroma and Quality Traits Assessment Using Artificial Intelligence",2020,"","","","",150,"2022-07-13 09:21:18","","10.3390/fermentation6020056","","",,,,,14,7.00,7,2,2,"Increasing beer quality demands from consumers have put pressure on brewers to target specific steps within the beer-making process to modify beer styles and quality traits. However, this demands more robust methodologies to assess the final aroma profiles and physicochemical characteristics of beers. This research shows the construction of artificial intelligence (AI) models based on aroma profiles, chemometrics, and chemical fingerprinting using near-infrared spectroscopy (NIR) obtained from 20 commercial beers used as targets. Results showed that machine learning models obtained using NIR from beers as inputs were accurate and robust in the prediction of six important aromas for beer (Model 1; R = 0.91; b = 0.87) and chemometrics (Model 2; R = 0.93; b = 0.90). Additionally, two more accurate models were obtained from robotics (RoboBEER) to obtain the same aroma profiles (Model 3; R = 0.99; b = 1.00) and chemometrics (Model 4; R = 0.98; b = 1.00). Low-cost robotics and sensors coupled with computer vision and machine learning modeling could help brewers in the decision-making process to target specific consumer preferences and to secure higher consumer demands.","",""
14,"I. Tyukin, D. Higham, A. Gorban","On Adversarial Examples and Stealth Attacks in Artificial Intelligence Systems",2020,"","","","",151,"2022-07-13 09:21:18","","10.1109/IJCNN48605.2020.9207472","","",,,,,14,7.00,5,3,2,"In this work we present a formal theoretical framework for assessing and analyzing two classes of malevolent action towards generic Artificial Intelligence (AI) systems. Our results apply to general multi-class classifiers that map from an input space into a decision space, including artificial neural networks used in deep learning applications. Two classes of attacks are considered. The first class involves adversarial examples and concerns the introduction of small perturbations of the input data that cause misclassification. The second class, introduced here for the first time and named stealth attacks, involves small perturbations to the AI system itself. Here the perturbed system produces whatever output is desired by the attacker on a specific small data set, perhaps even a single input, but performs as normal on a validation set (which is unknown to the attacker).We show that in both cases, i.e., in the case of an attack based on adversarial examples and in the case of a stealth attack, the dimensionality of the AI’s decision-making space is a major contributor to the AI’s susceptibility. For attacks based on adversarial examples, a second crucial parameter is the absence of local concentrations in the data probability distribution, a property known as Smeared Absolute Continuity. According to our findings, robustness to adversarial examples requires either (a) the data distributions in the AI’s feature space to have concentrated probability density functions or (b) the dimensionality of the AI’s decision variables to be sufficiently small. We also show how to construct stealth attacks on high-dimensional AI systems that are hard to spot unless the validation set is made exponentially large.","",""
14,"A. Burlacu, Adrian Iftene, Daniel Jugrin, I. Popa, Paula Madalina Lupu, C. Vlad, A. Covic","Using Artificial Intelligence Resources in Dialysis and Kidney Transplant Patients: A Literature Review",2020,"","","","",152,"2022-07-13 09:21:18","","10.1155/2020/9867872","","",,,,,14,7.00,2,7,2,"Background The purpose of this review is to depict current research and impact of artificial intelligence/machine learning (AI/ML) algorithms on dialysis and kidney transplantation. Published studies were presented from two points of view: What medical aspects were covered? What AI/ML algorithms have been used? Methods We searched four electronic databases or studies that used AI/ML in hemodialysis (HD), peritoneal dialysis (PD), and kidney transplantation (KT). Sixty-nine studies were split into three categories: AI/ML and HD, PD, and KT, respectively. We identified 43 trials in the first group, 8 in the second, and 18 in the third. Then, studies were classified according to the type of algorithm. Results AI and HD trials covered: (a) dialysis service management, (b) dialysis procedure, (c) anemia management, (d) hormonal/dietary issues, and (e) arteriovenous fistula assessment. PD studies were divided into (a) peritoneal technique issues, (b) infections, and (c) cardiovascular event prediction. AI in transplantation studies were allocated into (a) management systems (ML used as pretransplant organ-matching tools), (b) predicting graft rejection, (c) tacrolimus therapy modulation, and (d) dietary issues. Conclusions Although guidelines are reluctant to recommend AI implementation in daily practice, there is plenty of evidence that AI/ML algorithms can predict better than nephrologists: volumes, Kt/V, and hypotension or cardiovascular events during dialysis. Altogether, these trials report a robust impact of AI/ML on quality of life and survival in G5D/T patients. In the coming years, one would probably witness the emergence of AI/ML devices that facilitate the management of dialysis patients, thus increasing the quality of life and survival.","",""
27,"Omar Alshorman, Muhammad Irfan, N. Saad, D. Zhen, Noman Haider, A. Głowacz, Ahmad M. Alshorman","A Review of Artificial Intelligence Methods for Condition Monitoring and Fault Diagnosis of Rolling Element Bearings for Induction Motor",2020,"","","","",153,"2022-07-13 09:21:18","","10.1155/2020/8843759","","",,,,,27,13.50,4,7,2,"The fault detection and diagnosis (FDD) along with condition monitoring (CM) and of rotating machinery (RM) have critical importance for early diagnosis to prevent severe damage of infrastructure in industrial environments. Importantly, valuable industrial equipment needs continuous monitoring to enhance the safety, reliability, and availability and to decrease the cost of maintenance of modern industrial systems and applications. However, induction motor (IM) has been extensively used in several industrial processes because it is cheap, reliable, and robust. Rolling bearings are considered to be the main component of IM. Undoubtedly, any failure of this basic component can lead to a serious breakdown of IM and for whole industrial system. Thus, many current methods based on different techniques are employed as a fault prognosis and diagnosis of rolling elements bearing of IM. Moreover, these techniques include signal/image processing, intelligent diagnostics, data fusion, data mining, and expert systems for time and frequency as well as time-frequency domains. Artificial intelligence (AI) techniques have proven their significance in every field of digital technology. Industrial machines, automation, and processes are the net frontiers of AI adaptation. There are quite developed literatures that have been approaching the issues using signals and data processing techniques. However, the key contribution of this work is to present an extensive review of CM and FDD of the IM, especially for rolling elements bearings, based on artificial intelligent (AI) methods. This study highlights the advantages and performance limitations of each method. Finally, challenges and future trends are also highlighted.","",""
23,"M. Alomar, M. Hameed, M. Alsaadi","Multi hours ahead prediction of surface ozone gas concentration: Robust artificial intelligence approach",2020,"","","","",154,"2022-07-13 09:21:18","","10.1016/j.apr.2020.06.024","","",,,,,23,11.50,8,3,2,"","",""
13,"Briana A. Santo, A. Rosenberg, P. Sarder","Artificial intelligence driven next-generation renal histomorphometry.",2020,"","","","",155,"2022-07-13 09:21:18","","10.1097/MNH.0000000000000598","","",,,,,13,6.50,4,3,2,"PURPOSE OF REVIEW Successful integration of artificial intelligence into extant clinical workflows is contingent upon a number of factors including clinician comprehension and interpretation of computer vision. This article discusses how image analysis and machine learning have enabled comprehensive characterization of kidney morphology for development of automated diagnostic and prognostic renal pathology applications.   RECENT FINDINGS The primordial digital pathology informatics work employed classical image analysis and machine learning to prognosticate renal disease. Although this classical approach demonstrated tremendous potential, subsequent advancements in hardware technology rendered artificial neural networks '(ANNs) the method of choice for machine vision in computational pathology'. Offering rapid and reproducible detection, characterization and classification of kidney morphology, ANNs have facilitated the development of diagnostic and prognostic applications. In addition, modern machine learning with ANNs has revealed novel biomarkers in kidney disease, demonstrating the potential for machine vision to elucidate novel pathologic mechanisms beyond extant clinical knowledge.   SUMMARY Despite the revolutionary developments potentiated by modern machine learning, several challenges remain, including data quality control and curation, image annotation and ontology, integration of multimodal data and interpretation of machine vision or 'opening the black box'. Resolution of these challenges will not only revolutionize diagnostic pathology but also pave the way for precision medicine and integration of artificial intelligence in the process of care.","",""
12,"Sophia Y. Wang, Suzann Pershing, Aaron Y. Lee","Big data requirements for artificial intelligence.",2020,"","","","",156,"2022-07-13 09:21:18","","10.1097/ICU.0000000000000676","","",,,,,12,6.00,4,3,2,"PURPOSE OF REVIEW To summarize how big data and artificial intelligence technologies have evolved, their current state, and next steps to enable future generations of artificial intelligence for ophthalmology.   RECENT FINDINGS Big data in health care is ever increasing in volume and variety, enabled by the widespread adoption of electronic health records (EHRs) and standards for health data information exchange, such as Digital Imaging and Communications in Medicine and Fast Healthcare Interoperability Resources. Simultaneously, the development of powerful cloud-based storage and computing architectures supports a fertile environment for big data and artificial intelligence in health care. The high volume and velocity of imaging and structured data in ophthalmology and is one of the reasons why ophthalmology is at the forefront of artificial intelligence research. Still needed are consensus labeling conventions for performing supervised learning on big data, promotion of data sharing and reuse, standards for sharing artificial intelligence model architectures, and access to artificial intelligence models through open application program interfaces (APIs).   SUMMARY Future requirements for big data and artificial intelligence include fostering reproducible science, continuing open innovation, and supporting the clinical use of artificial intelligence by promoting standards for data labels, data sharing, artificial intelligence model architecture sharing, and accessible code and APIs.","",""
12,"M. Pedersen, K. Verspoor, M. Jenkinson, M. Law, D. Abbott, G. Jackson","Artificial intelligence for clinical decision support in neurology",2020,"","","","",157,"2022-07-13 09:21:18","","10.1093/braincomms/fcaa096","","",,,,,12,6.00,2,6,2,"Abstract Artificial intelligence is one of the most exciting methodological shifts in our era. It holds the potential to transform healthcare as we know it, to a system where humans and machines work together to provide better treatment for our patients. It is now clear that cutting edge artificial intelligence models in conjunction with high-quality clinical data will lead to improved prognostic and diagnostic models in neurological disease, facilitating expert-level clinical decision tools across healthcare settings. Despite the clinical promise of artificial intelligence, machine and deep-learning algorithms are not a one-size-fits-all solution for all types of clinical data and questions. In this article, we provide an overview of the core concepts of artificial intelligence, particularly contemporary deep-learning methods, to give clinician and neuroscience researchers an appreciation of how artificial intelligence can be harnessed to support clinical decisions. We clarify and emphasize the data quality and the human expertise needed to build robust clinical artificial intelligence models in neurology. As artificial intelligence is a rapidly evolving field, we take the opportunity to iterate important ethical principles to guide the field of medicine is it moves into an artificial intelligence enhanced future.","",""
12,"L. Egevad, D. Swanberg, B. Delahunt, P. Ström, K. Kartasalo, H. Olsson, D. Berney, D. Bostwick, A. Evans, P. Humphrey, K. Iczkowski, J. Kench, G. Kristiansen, Katia R. M. Leite, J. McKenney, J. Oxley, C. Pan, H. Samaratunga, J. Srigley, Hiroyuki Takahashi, T. Tsuzuki, T. H. van der Kwast, M. Varma, M. Zhou, M. Clements, M. Eklund","Identification of areas of grading difficulties in prostate cancer and comparison with artificial intelligence assisted grading",2020,"","","","",158,"2022-07-13 09:21:18","","10.1007/s00428-020-02858-w","","",,,,,12,6.00,1,26,2,"","",""
486,"W. Bi, A. Hosny, M. Schabath, M. Giger, N. Birkbak, Alireza Mehrtash, T. Allison, O. Arnaout, C. Abbosh, I. Dunn, R. Mak, R. Tamimi, C. Tempany, C. Swanton, U. Hoffmann, L. Schwartz, R. Gillies, Raymond Y Huang, H. Aerts","Artificial intelligence in cancer imaging: Clinical challenges and applications",2019,"","","","",159,"2022-07-13 09:21:18","","10.3322/caac.21552","","",,,,,486,162.00,49,19,3,"Judgement, as one of the core tenets of medicine, relies upon the integration of multilayered data with nuanced decision making. Cancer offers a unique context for medical decisions given not only its variegated forms with evolution of disease but also the need to take into account the individual condition of patients, their ability to receive treatment, and their responses to treatment. Challenges remain in the accurate detection, characterization, and monitoring of cancers despite improved technologies. Radiographic assessment of disease most commonly relies upon visual evaluations, the interpretations of which may be augmented by advanced computational analyses. In particular, artificial intelligence (AI) promises to make great strides in the qualitative interpretation of cancer imaging by expert clinicians, including volumetric delineation of tumors over time, extrapolation of the tumor genotype and biological course from its radiographic phenotype, prediction of clinical outcome, and assessment of the impact of disease and treatment on adjacent organs. AI may automate processes in the initial interpretation of images and shift the clinical workflow of radiographic detection, management decisions on whether or not to administer an intervention, and subsequent observation to a yet to be envisioned paradigm. Here, the authors review the current state of AI as applied to medical imaging of cancer and describe advances in 4 tumor types (lung, brain, breast, and prostate) to illustrate how common clinical problems are being addressed. Although most studies evaluating AI applications in oncology to date have not been vigorously validated for reproducibility and generalizability, the results do highlight increasingly concerted efforts in pushing AI technology to clinical use and to impact future directions in cancer care.","",""
21,"A. Melina, Nhan Ngo Dinh, B. Tafuri, G. Schipani, S. Nisticò, C. Cosentino, F. Amato, D. Thiboutot, A. Cherubini","Artificial Intelligence for the Objective Evaluation of Acne Investigator Global Assessment.",2018,"","","","",160,"2022-07-13 09:21:18","","","","",,,,,21,5.25,2,9,4,"INTRODUCTION The evaluation of Acne using ordinal scales reflects the clinical perception of severity but has shown low reproducibility both intra- and inter-rater. In this study, we investigated if Artificial Intelligence trained on images of Acne patients could perform acne grading with high accuracy and reliabilities superior to those of expert physicians.   METHODS 479 patients with acne grading ranging from clear to severe and sampled from three ethnic groups participated in this study. Multi-polarization images of facial skin of each patient were acquired from five different angles using the visible spectrum. An Artificial Intelligence was trained using the acquired images to output automatically a measure of Acne severity in the 0-4 numerical range of the Investigator Global Assessment (IGA).   RESULTS The Artificial Intelligence recognized the IGA of a patient with an accuracy of 0.854 and a correlation between manual and automatized evaluation of r=0.958 (P less than .001).   DISCUSSION This is the first work where an Artificial Intelligence was able to directly classify acne patients according to an IGA ordinal scale with high accuracy, no human intervention and no need to count lesions. J Drugs Dermatol. 2018;17(9):1006-1009.","",""
11,"S. Goto, K. Mahara, L. Beussink-Nelson, H. Ikura, Y. Katsumata, J. Endo, H. Gaggin, S. J. Shah, Y. Itabashi, C. Macrae, R. Deo","Artificial Intelligence-Enabled, Fully Automated Detection of Cardiac Amyloidosis Using Electrocardiograms and Echocardiograms.",2020,"","","","",161,"2022-07-13 09:21:18","","10.1101/2020.07.02.20141028","","",,,,,11,5.50,1,11,2,"Although individually uncommon, rare diseases collectively affect over 350 million patients worldwide and are increasingly the target of therapeutic development efforts. Unfortunately, the pursuit and use of such therapies have been hindered by a common challenge: patients with specific rare diseases are difficult to identify, especially if the conditions resemble more prevalent disorders. Cardiac amyloidosis is one such rare disease, which is characterized by deposition of misfolded proteins within the heart muscle resulting in heart failure and death. In recent years, specific therapies have emerged for cardiac amyloidosis and several more are under investigation, but because cardiac amyloidosis is mistaken for common forms of heart failure, it is typically diagnosed late in its course. As a possible solution, artificial intelligence methods could enable automated detection of rare diseases, but model performance must address low disease prevalence. Here we present an automated multi-modality pipeline for cardiac amyloidosis detection using two neural-network models; one using electrocardiograms (ECG) and the second using echocardiographic videos as input. These models were trained and validated on 3 and 5 academic medical centers (AMC), respectively, in the United States and Japan. Both models had excellent accuracy for detecting cardiac amyloidosis with C-statistics of 0.85-0.92 and 0.91-1.00 for the ECG and echocardiography models, respectively, with the latter outperforming expert diagnosis. Simulating deployment on 13,906 and 7775 patients with ECG-echocardiography paired data for AMC2 and AMC3 indicated a positive predictive value (PPV) for the ECG model of 4% and 3% at 61% and 54% recall, respectively. Pre-screening with ECG enhanced the echocardiography model performance from PPV 23% and 20% to PPV 58% and 53% at 64% recall, respectively for AMC2 and AMC3. In conclusion, we have developed a robust pipeline to augment detection of cardiac amyloidosis, which should serve as a generalizable strategy for other rare and intermediate frequency cardiac diseases with established or emerging therapies.","",""
11,"K. Mudgal, Neelanjan Das","The ethical adoption of artificial intelligence in radiology",2019,"","","","",162,"2022-07-13 09:21:18","","10.1259/bjro.20190020","","",,,,,11,3.67,6,2,3,"Artificial intelligence (AI) is rapidly transforming healthcare—with radiology at the pioneering forefront. To be trustfully adopted, AI needs to be lawful, ethical and robust. This article covers the different aspects of a safe and sustainable deployment of AI in radiology during: training, integration and regulation. For training, data must be appropriately valued, and deals with AI companies must be centralized. Companies must clearly define anonymization and consent, and patients must be well-informed about their data usage. Data fed into algorithms must be made AI-ready by refining, purification, digitization and centralization. Finally, data must represent various demographics. AI needs to be safely integrated with radiologists-in-the-loop: guiding forming concepts of AI solutions and supervising training and feedback. To be well-regulated, AI systems must be approved by a health authority and agreements must be made upon liability for errors, roles of supervised and unsupervised AI and fair workforce distribution (between AI and radiologists), with a renewal of policy at regular intervals. Any errors made must have a root-cause analysis, with outcomes fedback to companies to close the loop—thus enabling a dynamic best prediction system. In the distant future, AI may act autonomously with little human supervision. Ethical training and integration can ensure a ""transparent"" technology that will allow insight: helping us reflect on our current understanding of imaging interpretation and fill knowledge gaps, eventually moulding radiological practice. This article proposes recommendations for ethical practise that can guide a nationalized framework to build a sustainable and transparent system.","",""
10,"Xiaohang Wu, Lixue Liu, Lanqin Zhao, Chong Guo, Ruiyang Li, Ting Wang, Xiaonan Yang, Peichen Xie, Yizhi Liu, Haotian Lin","Application of artificial intelligence in anterior segment ophthalmic diseases: diversity and standardization.",2020,"","","","",163,"2022-07-13 09:21:18","","10.21037/ATM-20-976","","",,,,,10,5.00,1,10,2,"Artificial intelligence (AI) based on machine learning (ML) and deep learning (DL) techniques has gained tremendous global interest in this era. Recent studies have demonstrated the potential of AI systems to provide improved capability in various tasks, especially in image recognition field. As an image-centric subspecialty, ophthalmology has become one of the frontiers of AI research. Trained on optical coherence tomography, slit-lamp images and even ordinary eye images, AI can achieve robust performance in the detection of glaucoma, corneal arcus and cataracts. Moreover, AI models based on other forms of data also performed satisfactorily. Nevertheless, several challenges with AI application in ophthalmology have also arisen, including standardization of data sets, validation and applicability of AI models, and ethical issues. In this review, we provided a summary of the state-of-the-art AI application in anterior segment ophthalmic diseases, potential challenges in clinical implementation and our prospects.","",""
