Cites,Authors,Title,Year,Source,Publisher,ArticleURL,CitesURL,GSRank,QueryDate,Type,DOI,ISSN,CitationURL,Volume,Issue,StartPage,EndPage,ECC,CitesPerYear,CitesPerAuthor,AuthorCount,Age,Abstract,FullTextURL,RelatedURL
5,"Y. Yoon, Sekeun Kim, Hyuk-Jae Chang","Artificial Intelligence and Echocardiography",2021,"","","","",113,"2022-07-13 09:21:18","","10.4250/jcvi.2021.0039","","",,,,,5,5.00,2,3,1,"Artificial intelligence (AI) is evolving in the field of diagnostic medical imaging, including echocardiography. Although the dynamic nature of echocardiography presents challenges beyond those of static images from X-ray, computed tomography, magnetic resonance, and radioisotope imaging, AI has influenced all steps of echocardiography, from image acquisition to automatic measurement and interpretation. Considering that echocardiography often is affected by inter-observer variability and shows a strong dependence on the level of experience, AI could be extremely advantageous in minimizing observer variation and providing reproducible measures, enabling accurate diagnosis. Currently, most reported AI applications in echocardiographic measurement have focused on improved image acquisition and automation of repetitive and tedious tasks; however, the role of AI applications should not be limited to conventional processes. Rather, AI could provide clinically important insights from subtle and non-specific data, such as changes in myocardial texture in patients with myocardial disease. Recent initiatives to develop large echocardiographic databases can facilitate development of AI applications. The ultimate goal of applying AI to echocardiography is automation of the entire process of echocardiogram analysis. Once automatic analysis becomes reliable, workflows in clinical echocardiographic will change radically. The human expert will remain the master controlling the overall diagnostic process, will not be replaced by AI, and will obtain significant support from AI systems to guide acquisition, perform measurements, and integrate and compare data on request.","",""
3,"M. Padmaja, S. Shitharth, K. Prasuna, Abhay Chaturvedi, P. Kshirsagar, A. Vani","Grow of Artificial Intelligence to Challenge Security in IoT Application",2021,"","","","",114,"2022-07-13 09:21:18","","10.1007/s11277-021-08725-4","","",,,,,3,3.00,1,6,1,"","",""
1,"V. Madai, David C. Higgins","Artificial Intelligence in Healthcare: Lost In Translation?",2021,"","","","",115,"2022-07-13 09:21:18","","","","",,,,,1,1.00,1,2,1,"Artificial intelligence (AI) in healthcare is a potentially revolutionary tool to achieve improved healthcare outcomes while reducing overall health costs. While many exploratory results hit the headlines in recent years there are only few certified and even fewer clinically validated products available in the clinical setting. This is a clear indication of failing translation due to shortcomings of the current approach to AI in healthcare. In this work, we highlight the major areas, where we observe current challenges for translation in AI in healthcare, namely precision medicine, reproducible science, data issues and algorithms, causality, and product development. For each field, we outline possible solutions for these challenges. Our work will lead to improved translation of AI in healthcare products into the clinical setting.","",""
29,"Brandon Malone, Boris Simovski, Clément Moliné, Jun Cheng, Marius Gheorghe, Hugues Fontenelle, Ioannis Vardaxis, Simen Tennøe, Jenny-Ann Malmberg, R. Stratford, T. Clancy","Artificial intelligence predicts the immunogenic landscape of SARS-CoV-2 leading to universal blueprints for vaccine designs",2020,"","","","",116,"2022-07-13 09:21:18","","10.1038/s41598-020-78758-5","","",,,,,29,14.50,3,11,2,"","",""
29,"Grayson W. Armstrong, A. Lorch","A(eye): A Review of Current Applications of Artificial Intelligence and Machine Learning in Ophthalmology",2019,"","","","",117,"2022-07-13 09:21:18","","10.1097/IIO.0000000000000298","","",,,,,29,9.67,15,2,3,"Artificial intelligence (AI) is a branch of computer science that aims to enable computers to perform human-like tasks. Although AI is a broad discipline, machine learning is a specific branch of AI that uses computer algorithms capable of “learning” through the simulation of human intelligence. Machine learning algorithms have been applied to the medical field since the 1970s,1 and since that time have proven useful in computerassisted diagnosis, screening, and prognostication of disease.2–7 Ophthalmology is uniquely capable of capitalizing on the promise of AI. Ophthalmologists, during routine clinical encounters, generate robust data sources capable of supporting machine learning algorithms including multimodal ophthalmic images and quantifiable metrics such as visual acuity (VA), intraocular pressure, and cup to disk ratio. To date, AI techniques have been applied to ophthalmology to screen for and diagnose diseases, such as diabetic retinopathy (DR), age-related macular degeneration (AMD), macular edema (ME), glaucoma, keratoconus, postlaserassisted in situ keratomileusis corneal ectasia, retinopathy of prematurity (ROP), and cataracts, as well as predict the prognosis of various ophthalmic diseases. Advances in ophthalmology-specific AI stand to increase patient access to clinical screening and diagnosis as well as decrease health care costs, especially when applied to high-risk populations, low-resource communities, or when combined with telemedicine initiatives. This review provides an introduction to AI andmachine learning, as well as an overview of current applications in the field of ophthalmology.","",""
20,"L. McCoy, Sujay Nagaraj, F. Morgado, V. Harish, Sunit Das, L. Celi","What do medical students actually need to know about artificial intelligence?",2020,"","","","",118,"2022-07-13 09:21:18","","10.1038/s41746-020-0294-7","","",,,,,20,10.00,3,6,2,"","",""
0,"Yanhui Zhang, I. Hoteit, K. Katterbauer, A. Marsala","Artificial Intelligence Aided Proxy Model for Water Front Tracking in Fractured Carbonate Reservoirs",2021,"","","","",119,"2022-07-13 09:21:18","","10.2118/204604-ms","","",,,,,0,0.00,0,4,1,"  Saturation mapping in fractured carbonate reservoirs is a major challenge for oil and gas companies. The fracture channels within the reservoir are the primary water conductors that shape water front patterns and cause uneven sweep efficiency. Flow simulation for fractured reservoirs is typically time-consuming due to the inherent high nonlinearity. A data-driven approach to capture the main flow patterns is quintessential for efficient optimization of reservoir performance and uncertainty quantification.  We employ an artificial intelligence (AI) aided proxy modeling framework for waterfront tracking in complex fractured carbonate reservoirs. The framework utilizes deep neural networks and reduced-order modeling to achieve an efficient representation of the reservoir dynamics to track and determine the fluid flow patterns within the fracture network. The AI-proxy model is examined on a synthetic two-dimensional (2D) fractured carbonate reservoir model. Training dataset including saturation and pressure maps at a series of time steps is generated using a dual-porosity dual-permeability (DPDP) model. Experimental results indicate a robust performance of the AI-aided proxy model, which successfully reproduce the key flow patterns within the reservoir and achieve orders of shorter running time than the full-order reservoir simulation. This suggests the great potential of utilizing the AI-aided proxy model for heavy-simulation-based reservoir applications such as history matching, production optimization, and uncertainty assessment.","",""
0,"T. Piotrowski, J. Kazmierska, M. Mocydlarz-Adamcewicz, A. Ryczkowski","Ethical issues on artificial intelligence in radiology: how is it reported in research articles? The current state and future directions",2021,"","","","",120,"2022-07-13 09:21:18","","10.20883/medical.e513","","",,,,,0,0.00,0,4,1,"Background. This paper evaluates the status of reporting information related to the usage and ethical issues of artificial intelligence (AI) procedures in clinical trial (CT) papers focussed on radiology issues as well as other (non-trial) original radiology articles (OA). Material and Methods. The evaluation was performed by three independent observers who were, respectively physicist, physician and computer scientist. The analysis was performed for two groups of publications, i.e., for CT and OA. Each group included 30 papers published from 2018 to 2020, published before guidelines proposed by Liu et al. (Nat Med. 2020; 26:1364-1374). The set of items used to catalogue and to verify the ethical status of the AI reporting was developed using the above-mentioned guidelines. Results. Most of the reviewed studies, clearly stated their use of AI methods and more importantly, almost all tried to address relevant clinical questions. Although in most of the studies, patient inclusion and exclusion criteria were presented, the widespread lack of rigorous descriptions of the study design apart from a detailed explanation of the AI approach itself is noticeable. Few of the chosen studies provided information about anonymization of data and the process of secure data sharing. Only a few studies explore the patterns of incorrect predictions by the proposed AI tools and their possible reasons. Conclusion. Results of review support idea of implementation of uniform guidelines for designing and reporting studies with use of AI tools. Such guidelines help to design robust, transparent and reproducible tools for use in real life.","",""
0,"Abdulraqeb Alhammadi, Ayman A. El-Saleh, Ibraheem Shayea","MOS Prediction for Mobile Broadband Networks Using Bayesian Artificial Intelligence",2021,"","","","",121,"2022-07-13 09:21:18","","10.1109/ICAICST53116.2021.9497834","","",,,,,0,0.00,0,3,1,"Mobile broadband (MBB) networks are growing fast with supporting high-speed internet access. Fifth-generation networks promise an enhanced MBB that offers a high-speed data rate and video streaming with ultra-low latency. Thus, monitoring the level quality of these services supported by network providers becomes essential. Mobile network operators continuously optimize their network performance to provide a better quality of service and quality of experience. Moreover, artificial intelligence has been used considerably in optimizations to efficiently meet the requirements of future mobile networks. In this paper, we propose a Bayesian network model to predict the minimum opinion score (MOS), which contributes to evaluating the network performance of video streaming services. The proposed model depends on several input data, namely, bite rate, stalling load, and round-trip time. The predicted MOS depends on prior probability distributions to generate posterior probabilities. The predicted MOS depends on these input data. Results demonstrate that the proposed model achieves a high prediction accuracy of 86%, with a mean square error of 0.34. The proposed model also has a robust performance design through various testing methods.","",""
0,"Xiaohong W. Gao, B. Braden","Artificial intelligence in endoscopy: The challenges and future directions",2021,"","","","",122,"2022-07-13 09:21:18","","10.37126/aige.v2.i4.117","","",,,,,0,0.00,0,2,1,"Artificial intelligence based approaches, in particular deep learning, have achieved state-of-the-art performance in medical fields with increasing number of software systems being approved by both Europe and United States. This paper reviews their applications to early detection of oesophageal cancers with a focus on their advantages and pitfalls. The paper concludes with future recommendations towards the development of a real-time, clinical implementable, interpretable and robust diagnosis support systems.","",""
110,"Bin Yu, Karl Kumbier","Artificial intelligence and statistics",2017,"","","","",123,"2022-07-13 09:21:18","","10.1631/FITEE.1700813","","",,,,,110,22.00,55,2,5,"Artificial intelligence (AI) is intrinsically data-driven. It calls for the application of statistical concepts through human-machine collaboration during the generation of data, the development of algorithms, and the evaluation of results. This paper discusses how such human-machine collaboration can be approached through the statistical concepts of population, question of interest, representativeness of training data, and scrutiny of results (PQRS). The PQRS workflow provides a conceptual framework for integrating statistical ideas with human input into AI products and researches. These ideas include experimental design principles of randomization and local control as well as the principle of stability to gain reproducibility and interpretability of algorithms and data results. We discuss the use of these principles in the contexts of self-driving cars, automated medical diagnoses, and examples from the authors’ collaborative research.","",""
28,"H. Alami, L. Rivard, P. Lehoux, S. Hoffman, Stephanie B. M. Cadeddu, Mathilde Savoldelli, M. A. Samri, M. A. Ag Ahmed, R. Fleet, J. Fortin","Artificial intelligence in health care: laying the Foundation for Responsible, sustainable, and inclusive innovation in low- and middle-income countries",2020,"","","","",124,"2022-07-13 09:21:18","","10.1186/s12992-020-00584-1","","",,,,,28,14.00,3,10,2,"","",""
23,"M. Rohaim, E. Clayton, I. Sahin, J. Vilela, M. Khalifa, M. Al-Natour, M. Bayoumi, A. Poirier, M. Branavan, M. Tharmakulasingam, N. S. Chaudhry, R. Sodi, A. Brown, P. Burkhart, W. Hacking, J. Botham, J. Boyce, H. Wilkinson, Craig Williams, Jayde Whittingham-Dowd, E. Shaw, Matt D. Hodges, L. Butler, M. Bates, R. L. La Ragione, W. Balachandran, A. Fernando, M. Munir","Artificial Intelligence-Assisted Loop Mediated Isothermal Amplification (AI-LAMP) for Rapid Detection of SARS-CoV-2",2020,"","","","",125,"2022-07-13 09:21:18","","10.3390/v12090972","","",,,,,23,11.50,2,28,2,"Until vaccines and effective therapeutics become available, the practical solution to transit safely out of the current coronavirus disease 19 (CoVID-19) lockdown may include the implementation of an effective testing, tracing and tracking system. However, this requires a reliable and clinically validated diagnostic platform for the sensitive and specific identification of SARS-CoV-2. Here, we report on the development of a de novo, high-resolution and comparative genomics guided reverse-transcribed loop-mediated isothermal amplification (LAMP) assay. To further enhance the assay performance and to remove any subjectivity associated with operator interpretation of results, we engineered a novel hand-held smart diagnostic device. The robust diagnostic device was further furnished with automated image acquisition and processing algorithms and the collated data was processed through artificial intelligence (AI) pipelines to further reduce the assay run time and the subjectivity of the colorimetric LAMP detection. This advanced AI algorithm-implemented LAMP (ai-LAMP) assay, targeting the RNA-dependent RNA polymerase gene, showed high analytical sensitivity and specificity for SARS-CoV-2. A total of ~200 coronavirus disease (CoVID-19)-suspected NHS patient samples were tested using the platform and it was shown to be reliable, highly specific and significantly more sensitive than the current gold standard qRT-PCR. Therefore, this system could provide an efficient and cost-effective platform to detect SARS-CoV-2 in resource-limited laboratories.","",""
24,"P. Iftikhar, Marcela Kuijpers, Azadeh Khayyat, Aqsa Iftikhar, Maribel DeGouvia De Sa","Artificial Intelligence: A New Paradigm in Obstetrics and Gynecology Research and Clinical Practice",2020,"","","","",126,"2022-07-13 09:21:18","","10.7759/cureus.7124","","",,,,,24,12.00,5,5,2,"Artificial intelligence (AI) is growing exponentially in various fields, including medicine. This paper reviews the pertinent aspects of AI in obstetrics and gynecology (OB/GYN) and how these can be applied to improve patient outcomes and reduce the healthcare costs and workload for clinicians. Herein, we will address current AI uses in OB/GYN, and the use of AI as a tool to interpret fetal heart rate (FHR) and cardiotocography (CTG) to aid in the detection of preterm labor, pregnancy complications, and review discrepancies in its interpretation between clinicians to reduce maternal and infant morbidity and mortality. AI systems can be used as tools to create algorithms identifying asymptomatic women with short cervical length who are at risk of preterm birth. Additionally, the benefits of using the vast data capacity of AI storage can assist in determining the risk factors for preterm labor using multiomics and extensive genomic data. In the field of gynecological surgery, the use of augmented reality helps surgeons detect vital structures, thus decreasing complications, reducing operative time, and helping surgeons in training to practice in a realistic setting. Using three-dimensional (3D) printers can provide materials that mimic real tissues and also helps trainees to practice on a realistic model. Furthermore, 3D imaging allows better depth perception than its two-dimensional (2D) counterpart, allowing the surgeon to create preoperative plans according to tissue depth and dimensions. Although AI has some limitations, this new technology can improve the prognosis and management of patients, reduce healthcare costs, and help OB/GYN practitioners to reduce their workload and increase their efficiency and accuracy by incorporating AI systems into their daily practice. AI has the potential to guide practitioners in decision-making, reaching a diagnosis, and improving case management. It can reduce healthcare costs by decreasing medical errors and providing more dependable predictions. AI systems can accurately provide information on the large array of patients in clinical settings, although more robust data is required.","",""
25,"D. Schiff","Out of the laboratory and into the classroom: the future of artificial intelligence in education",2020,"","","","",127,"2022-07-13 09:21:18","","10.1007/s00146-020-01033-8","","",,,,,25,12.50,25,1,2,"","",""
27,"I. Stafford, M. Kellermann, E. Mossotto, R. M. Beattie, B. MacArthur, S. Ennis","A systematic review of the applications of artificial intelligence and machine learning in autoimmune diseases",2020,"","","","",128,"2022-07-13 09:21:18","","10.1038/s41746-020-0229-3","","",,,,,27,13.50,5,6,2,"","",""
9,"J. Chen, Jen-Ting Chang","Route Choice Behaviour Modeling using IoT Integrated Artificial Intelligence",2021,"","","","",129,"2022-07-13 09:21:18","","10.36548/JAICN.2020.4.006","","",,,,,9,9.00,5,2,1,"Automatic Vehicle Identification (AVI) data is used to identify the location of a particular vehicle in and can also be used for route choice behaviour modelling. But the use of AVI doesn’t provide accurate information on OD pair and the particular route that is chosen. This problem is addressed in this paper using a semi-supervised learning method which can be used to identify the route on prior training. As the first step, the AVI trace is segregated into observation pairs using the Maximum Likelihood Estimation and then it is further joined with GPS co-ordinates to tackle the sparse issues. As the next step, the heterogeneity and correlation between the various pairs are determined using Mixed Logit model. As the final step, a relationship between the likelihood function and route choice model is established using Maximum to log-likelihood function. Based on the observations, the results are recorded and the proposed work shows significant improvement in the accuracy in route determination. The evaluation scenario shows that the proposed work could be expanded to a larger area. Moreover, the robustness of the system is illustrated using sensitivity analysis. This work uses AVI data with respect to its behaviour in routes through high penetration.","",""
77,"M. Hutson","Has artificial intelligence become alchemy?",2018,"","","","",130,"2022-07-13 09:21:18","","10.1126/science.360.6388.478","","",,,,,77,19.25,77,1,4,"Ali Rahimi, a researcher in artificial intelligence (AI) at Google in San Francisco, California, has charged that machine learning algorithms, in which computers learn through trial and error, have become a form of ""alchemy."" Researchers, he says, do not know why some algorithms work and others don9t, nor do they have rigorous criteria for choosing one AI architecture over another. Now, in a paper presented on 30 April at the International Conference on Learning Representations in Vancouver, Canada, Rahimi and his collaborators document examples of what they see as the alchemy problem and offer prescriptions for bolstering AI9s rigor. The issue is distinct from AI9s reproducibility problem, in which researchers can9t replicate each other9s results because of inconsistent experimental and publication practices. It also differs from the ""black box"" or ""interpretability"" problem in machine learning: the difficulty of explaining how a particular AI has come to its conclusions.","",""
75,"Qing Sun, Min Zhang, A. Mujumdar","Recent developments of artificial intelligence in drying of fresh food: A review",2019,"","","","",131,"2022-07-13 09:21:18","","10.1080/10408398.2018.1446900","","",,,,,75,25.00,25,3,3,"ABSTRACT Intellectualization is an important direction of drying development and artificial intelligence (AI) technologies have been widely used to solve problems of nonlinear function approximation, pattern detection, data interpretation, optimization, simulation, diagnosis, control, data sorting, clustering, and noise reduction in different food drying technologies due to the advantages of self-learning ability, adaptive ability, strong fault tolerance and high degree robustness to map the nonlinear structures of arbitrarily complex and dynamic phenomena. This article presents a comprehensive review on intelligent drying technologies and their applications. The paper starts with the introduction of basic theoretical knowledge of ANN, fuzzy logic and expert system. Then, we summarize the AI application of modeling, predicting, and optimization of heat and mass transfer, thermodynamic performance parameters, and quality indicators as well as physiochemical properties of dried products in artificial biomimetic technology (electronic nose, computer vision) and different conventional drying technologies. Furthermore, opportunities and limitations of AI technique in drying are also outlined to provide more ideas for researchers in this area.","",""
59,"S. Gandhi, W. Mosleh, Joshua Shen, C. Chow","Automation, machine learning, and artificial intelligence in echocardiography: A brave new world",2018,"","","","",132,"2022-07-13 09:21:18","","10.1111/echo.14086","","",,,,,59,14.75,15,4,4,"Automation, machine learning, and artificial intelligence (AI) are changing the landscape of echocardiography providing complimentary tools to physicians to enhance patient care. Multiple vendor software programs have incorporated automation to improve accuracy and efficiency of manual tracings. Automation with longitudinal strain and 3D echocardiography has shown great accuracy and reproducibility allowing the incorporation of these techniques into daily workflow. This will give further experience to nonexpert readers and allow the integration of these essential tools into more echocardiography laboratories. The potential for machine learning in cardiovascular imaging is still being discovered as algorithms are being created, with training on large data sets beyond what traditional statistical reasoning can handle. Deep learning when applied to large image repositories will recognize complex relationships and patterns integrating all properties of the image, which will unlock further connections about the natural history and prognosis of cardiac disease states. The purpose of this review article was to describe the role and current use of automation, machine learning, and AI in echocardiography and discuss potential limitations and challenges of in the future.","",""
