Cites,Authors,Title,Year,Source,Publisher,ArticleURL,CitesURL,GSRank,QueryDate,Type,DOI,ISSN,CitationURL,Volume,Issue,StartPage,EndPage,ECC,CitesPerYear,CitesPerAuthor,AuthorCount,Age,Abstract,FullTextURL,RelatedURL
1,"M. Amini, Ahmed Imteaj, J. Mohammadi","Distributed Machine Learning for Resilient Operation of Electric Systems",2020,"","","","",147,"2022-07-13 09:22:24","","10.1109/SEST48500.2020.9203368","","",,,,,1,0.50,0,3,2,"Power system resilience is crucial to ensure secure energy delivery to electricity consumers. Power system outages lead to economical and societal burdens for the society and industries. To mitigate the socio-economical impacts of a power outage, we need to develop efficient algorithms to ensure resilient operation of the power system. In this paper, we first explain the notion of data-driven resilience. Then, we present a pathway of leveraging edge intelligence to improve resilience. To this end, we propose a novel distributed machine learning paradigm. Our proposed structure relies on local Resilience Management Systems (RMS) that serve as intelligent decision-making entities in each area, e.g. an autonomous micro-grid or a smart home can act as RMS. The RMS agents, which are available in different areas, can share their local data (i.e., a microgrid's operational data) with their neighboring RMS to coordinate their decisions in a distributed fashion. This will provide two major advantages: 1) distributed intelligence replaces centralized decision-making leading to robust decision-making and enhanced resilience; 2) since local data are locally shared among all entities within an RMS, if one of the RMS agents fails to communicate with the rest of network, we still can maintain a feasible solution (which is not necessarily optimal). Finally, we presents different scenarios in the simulation results section that showcases the system performance for two buildings under various outage scenarios.","",""
1,"Zheren Ma, E. Davani, Xiaodan Ma, Hanna Lee, I. Arslan, Xiang Zhai, H. Darabi, D. Castineira","Finding a Trend Out of Chaos, A Machine Learning Approach for Well Spacing Optimization",2020,"","","","",148,"2022-07-13 09:22:24","","10.2118/201698-ms","","",,,,,1,0.50,0,8,2,"  Data-driven decisions powered by machine-learning methods are increasing in popularity when it comes to optimizing field development in unconventional reservoirs. However, since well performance is impacted by many factors (e.g., geological characteristics, completion design, well design, etc.), the challenge is uncovering trends from all the noise.  By leveraging basin-level knowledge captured by big data sculpting, integrating private and public data with the use of uncertainty quantification, Augmented AI (a combination of expert-based knowledge and advanced AI frameworks) can provide quick and science-based answers for well spacing and fracking optimization and assess the full potential of an asset in unconventional reservoirs.  Augmented AI is artificial intelligence powered by engineering wisdom. The Augmented AI workflow starts with data sculpting, which includes information retrieval, data cleaning and standardization, and finally a smart, deep and systematic data QC. Feature engineering generates all the relevant parameters going into the machine learning model—over 50 features have been generated for this work and categorized. The final step is to perform model tuning and ensemble, evaluating the model robustness, generating model explanation and uncertainty quantification. Augmented AI adopts an iterative machine learning modeling approach. This approach combines new and innovative engineering and G&G workflows with data-driven models so that a deep understanding of the field behavior can be developed. Loops from feature selection to model tuning are used until good model results are achieved. The loop is automated using Bayesians optimization. All machine learning models have different strengths and weaknesses for prediction. Instead of manually determining which machine learning model to use, this approach uses an adaptive ensemble machine learning approach that is a stacking algorithm that combines multiple regression models via a second level machine learning model. It smartly aggregates opinions from different models with reduced variance and better robustness.  Augmented AI has been applied in unconventional reservoirs with great results. A case study in Midland Basin is presented in this paper. Domain-induced feature engineering was performed to obtain important features for predicting well performance, and initial feature selection was conducted using feature correlation analysis. A trusted and explainable ML model was built and enhanced with uncertainty quantification. After running several sensitivity analyses, Augmented AI optimized the attributes of interest, then vetted the outcome, generating a report and visualizing the results.  In addition, further information about the direct impact of well spacing on EUR was deconvoluted from other parameters using an ML explanation technique for Wolfcamp Formation in Permian Basin and subsequently well spacing optimization was presented for the case study in Midland Basin.  An innovative model was created using Augmented AI to optimize well spacing, leveraging big data sculpting, domain and physics-induced feature engineering, and machine learning. The learning was transferred from the basin model to the specific region of interest. Augmented AI provides efficient and systematic private data organization, an explainable machine learning model, robust production forecast with quantified uncertainty and well spacing and frac parameters optimization.  Augmented AI models are already built for major basins such as Midland and Delaware basins. The learning and knowledge of the model can be transferred to any region in a basin and can be refined using more accurate private data. This allows conclusions to be drawn even with a limited number of wells.","",""
14,"Hongfeng Li, Hong-Qin Zhao, Hong Li","Neural-Response-Based Extreme Learning Machine for Image Classification",2019,"","","","",149,"2022-07-13 09:22:24","","10.1109/TNNLS.2018.2845857","","",,,,,14,4.67,5,3,3,"This paper proposes a novel and simple multilayer feature learning method for image classification by employing the extreme learning machine (ELM). The proposed algorithm is composed of two stages: the multilayer ELM (ML-ELM) feature mapping stage and the ELM learning stage. The ML-ELM feature mapping stage is recursively built by alternating between feature map construction and maximum pooling operation. In particular, the input weights for constructing feature maps are randomly generated and hence need not be trained or tuned, which makes the algorithm highly efficient. Moreover, the maximum pooling operation enables the algorithm to be invariant to certain transformations. During the ELM learning stage, elastic-net regularization is proposed to learn the output weight. Elastic-net regularization helps to learn more compact and meaningful output weight. In addition, we preprocess the input data with the dense scale-invariant feature transform operation to improve both the robustness and invariance of the algorithm. To evaluate the effectiveness of the proposed method, several experiments are conducted on three challenging databases. Compared with the conventional deep learning methods and other related ones, the proposed method achieves the best classification results with high computational efficiency.","",""
0,"Gabriel D. Patrón, D. León, Edwin Lopez, G. Hernández","An Interpretable Automated Machine Learning Credit Risk Model",2020,"","","","",150,"2022-07-13 09:22:24","","10.1007/978-3-030-61834-6_2","","",,,,,0,0.00,0,4,2,"","",""
0,"G. Montavon, W. Samek","Statistics meets Machine Learning 5 Abstracts Explaining the decisions of deep neural networks and beyond",2020,"","","","",151,"2022-07-13 09:22:24","","","","",,,,,0,0.00,0,2,2,"Explaining the decisions of deep neural networks and beyond Grégoire Montavon and Wojciech Samek (joint work with Klaus-Robert Müller, Sebastian Lapuschkin, Alexander Binder, Jacob Kauffmann) Machine learning models have become increasingly complex and this complexity has allowed them to reach high prediction accuracy on challenging datasets. In some cases, improved predictivity has come at the expense of interpretability, in particular, complex models tend to be perceived as black-boxes. A lack of interpretability is problematic, not only because interpretability is desirable in itself (e.g. to extract useful insights from a model or from the modeled data), but also because common measurements of prediction accuracy can become strongly unreliable when certain assumptions about the training data are not met. Real-world datasets are typically not representative of all possible cases and the truly relevant variables may correlate with other irrelevant variables. In such circumstances, one would need to ensure that the machine learning model does not rely on these irrelevant variables. An assessment based purely on test set accuracy would be oblivious to the exact decision strategy and could overestimate the true prediction performance. This phenomenon has been referred to as the ‘Clever Hans’ effect [9]. Only an extension of the dataset with specific test cases, or an inspection of the model, e.g. via interpretability techniques [3, 16, 12], is capable of highlighting the improper decision structure. In this talk, we look at the question of explaining the predictions of deep neural networks, a successful machine learning approach that has been used increasingly in real-world applications. A challenge for getting these explanations is the complexity of the decision function, which makes it hard to apply simple explanation methods developed in the context of linear models, e.g. based on first-order Taylor expansions. In particular, DNN decision functions are highly nonlinear and multiscale, with a gradient that is highly varying or ‘shattered’ [4]. Also, local searches in the input space easily result in ‘adversarial examples’ [13] where the prediction no longer corresponds to the observed pattern in the input. Layer-wise relevance propagation (LRP) [3] is a technique that was proposed to robustly explain the neural network decision in terms of input features. It was shown to work on numerous models in a wide range of applications [14, 5, 15]. LRP departs from the neural network’s function representation to consider instead its graph structure. Specifically, the LRP algorithm performs an iterative redistribution of the neural network output to the lower layers. Redistribution from each layer to the layer below is achieved by means of propagation rules that satisfy a conservation property analogous to Kirchoff’s conservation laws in electrical circuits. The LRP algorithm terminates once the input layer has been reached. The LRP algorithm can be motivated as decomposing a complex problem 6 Oberwolfach Report 4/2020 (analyzing a highly nonlinear function) into a collection of simpler subproblems (treating each neuron individually). Furthermore, it was shown that the LRP algorithm can be interpreted as a collection of Taylor expansions performed at each layer and neuron of the neural network [11]. Specifically, the ‘relevance’ received by a given neuron is approximately the product of the neuron activation and a locally constant term. In turn, the LRP redistribution step can be interpreted as (1) identifying the linear terms of a Taylor expansion of the relevance expressed as a function of activations in the lower layer, and (2) propagating to the lower layer accordingly. A connection can be made between different proposed LRP propagation rules and the choice of reference point at which the Taylor expansion is performed [11, 10]. This Taylor-based view on the LRP algorithm allows in particular to verify that the corresponding reference points are meaningful, for example, that they satisfy domain membership constraints. This interpretation of LRP as a collection of Taylor expansions is referred to as “deep Taylor decomposition” [11]. The LRP algorithm has been successfully applied to various data types and problems, ranging from computer vision and natural language processing tasks such as classification of concepts in images [3], age prediction [8] or categorization of text documents [2], over reinforcement learning tasks such as playing computer games [9], to various medical data analysis tasks, e.g., decoding of fMRI signals [14] or therapy outcome prediction [15]. In these diverse applications, LRP explanations provide additional insights into the decision strategies used by the model, which not only help to better understand the data, including its biases and artifacts [8, 9], but also help to analyze the learning processes and model’s decision strategies [9]. In the second part of the talk, two recent advances that broaden the usefulness of explanation methods are discussed. First, Spectral Relevance Analysis (SpRAy) [9], a dataset-wide analysis of individual explanations that summarizes the overall decision structure of the model into a finite and easily interpretable set of prototypical decision strategies. This analysis allows to systematically investigate complex models on large datasets. It has unveiled in commonly used datasets, artifacts, that tend to systematically induce flaws into the decision structure of ML models trained on them. For example, a website logo was found in some images of the class ‘truck’ of the ImageNet dataset, which the state-of-the-art VGG-16 neural network would then use for its predictions [1]. Another advance brings successful explanation techniques to non-neural network architectures such as kernel-based models. The approach that we term ‘neuralization’ [6] finds for these non-neural network architectures a functionally equivalent neural network so that state-of-the-art explanation techniques such as LRP can be applied. The approach was successfully applied to various unsupervised models, in particular, kernel one-class SVMs [7] and various k-means clustering models [6], thereby shedding light into what input features make a data point anomalous or member of a given cluster. Statistics meets Machine Learning 7 Although significant progress has been made to improve the transparency of ML models such as deep neural networks, numerous challenges still need to be addressed both on the methods and theory side. In particular, there is a need for standardized and unbiased evaluation benchmarks for assessing the quality and usefulness of an explanation. Furthermore, an important future work will be to adopt a more holistic view on the problem of explanation, that considers how to make best use of the user’s interpretation and feedback capabilities, and that also integrates the end goal of the explanation method, for example, achieving better and more informed decisions, or systematically improving and robustifying a machine learning model.","",""
0,"Yufang Jin, Bin Chen, B. Lampinen, P. Brown","Yield Determinants and Prediction for California’s Almond Orchards Based on Machine Learning Analytics",2020,"","","","",152,"2022-07-13 09:22:24","","10.5194/egusphere-egu2020-10687","","",,,,,0,0.00,0,4,2,"Agricultural productivity is subject to various stressors, including abiotic and biotic threats, many of which are exacerbated by a changing climate. The productivity of tree crops, such as almond orchards, is particularly complex. Moreover, the State of California has implemented legislatively mandated nitrogen (N) management strategies of all growers statewide to minimize nitrogen losses to the environment, and almond growers must now apply N in accordance with the estimated yield in early spring. To understand and mitigate these threats requires a collection of multi-layer large data sets, and advanced analytics is also critical to integrate these highly heterogeneous datasets to generate insights about the key constraints on the yields at tree and field scales. Here we used machine learning approaches to predict orchard-level yield and examine the determinants of almond yield variation in California’s almond orchards, based on a unique 10-year dataset of field measurements of light interception, remote sensing metrics, and almond yield, along with meteorological data. We found that overall the maximum almond yield was highly dependent on light interception, e.g., with each one percent increase in light interception resulting in an increase of 57.9 lbs/acre in the potential yield. Light interception was highest for mature sites with higher long term mean spring incoming solar radiation, and lowest for younger orchards and when March maximum temperature was lower than 19 o C. However, at any given level of light interception, actual yield often falls significantly below full yield potential, driven mostly by tree age, temperature profiles in June and winter, and summer maximum vapor pressure deficit (VPDmax). The full random forest model was found to explain 82% (±1%) of yield variation, with a RMSE of 480±9 lbs/acre. When excluding light interception from the predictors, overall orchard characteristics (such as age, location and tree density) and key meteorological variables could still explain 78% of yield variation. The model analysis also showed that warmer winter conditions often limited mature orchards from reaching maximum yield potential and higher summer VPDmax significantly limited the yield. Our findings through the machine learning approach improved our understanding of the complex interaction between climate, canopy light interception, and almond nut production. The demonstrated relatively robust predictability of almond yield, driven by “big data”, also provides quantitative information and guidance to make informed orchard nutrient management decisions, allocate resources, determine almond price targets, and improve market planning.","",""
0,"Carolina Natel de Moura, J. Seibert, Miriam Rita Moro Mine, Ricardo Carvalho de Almeida","Are Machine Learning methods robust enough for hydrological modeling under changing conditions?",2020,"","","","",153,"2022-07-13 09:22:24","","10.5194/egusphere-egu2020-690","","",,,,,0,0.00,0,4,2,"  <p>The advancement of big data and increased computational power have contributed to an increased use of Machine Learning (ML) approaches in hydrological modelling. These approaches are powerful tools for modeling non-linear systems. However, the applicability of ML in non-stationary conditions needs to be studied further. As climate change will change hydrological patterns, testing ML approaches for non-stationary conditions is essential. Here, we used the Differential Split-Sample Test (DSST) to test the climate transposability of ML approaches (e.g., calibrating in a wet period and validating in a dry one, and vice-versa).&#160; We applied five ML approaches using daily precipitation and temperature as input for the prediction of the daily discharge in six snow-dominated Swiss catchments. Lower and upper benchmarks were used to evaluate performances through a relative performance measure. The lower benchmark is the average of the bucket-type HBV model runs from 1000 random parameter sets. The upper benchmark is the automatically calibrated HBV model. In comparison with the stationary condition, the models performed slightly poorer in the non-stationary condition. The performance of simple ML approaches was poor for non-stationary conditions with an underestimation of peak flows, as well as a poor representation of the snow-melting period. On the other hand, a more complex ML approach (deep learning), the Long Short -Term Memory (LSTM), showed a good performance when compared with the lower and upper benchmarks. This might be explained by the fact that the so-called memory cell allowed to simulate the storage effects.&#160;</p> ","",""
0,"Kanan Mukhtarli","Machine learning for homogeneous grouping of pavements",2020,"","","","",154,"2022-07-13 09:22:24","","","","",,,,,0,0.00,0,1,2,"Abstract    Machine learning for homogeneous grouping of pavements.  Kanan Mukhtarli    Rapid pavement deterioration is a major problem in areas with harsh weather conditions or high traffic loading. Despite many studies focused on the pavement management systems, there is not, to the date, a robust method explaining how to process large amounts of pavement data to create homogeneous groups for rehabilitation-related decision making. This thesis employs machine learning to develop an approach capable of partitioning pavement data with a close response to casual factors like traffic and weather conditions and considering its performance through international roughness index and deflections. Two different methods: K-means and Self Organizing Maps (SOM) clustering techniques were tested to understand the correlation between daily factors and pavements deterioration. The goodness of clustering was tested using extrinsic and intrinsic evaluation methods. It was concluded from the results that SOM clustering provided better results as it relies on a soft clustering method where one point can represent two clusters at the same time. Moreover, it became obvious from the methodology that including the previous year’s data has very little to no effect on homogeneous groups. Techniques discussed and developed in this study can help road asset managers with decision making for the maintenance and rehabilitation of pavement. Moreover, future researchers can use the results of this study to further develop the idea of building decision support systems for pavement rehabilitation.","",""
0,"Dhilsath Fathima.M, S. Samuel, R. Haran","AN EFFICIENT MACHINE LEARNING MODEL FOR PREDICTION OF ACUTE MYOCARDIAL INFARCTION",2020,"","","","",155,"2022-07-13 09:22:24","","10.2174/2666255813666200325104317","","",,,,,0,0.00,0,3,2,"   This proposed work is used to develop an improved and robust machine learning model for predicting Myocardial Infarction (MI) could have substantial clinical impact.     This paper explains how to build machine learning based computer-aided analysis system for an early and accurate prediction of Myocardial Infarction (MI) which utilizes framingham heart study dataset for validation and evaluation. This proposed computer-aided analysis model will support medical professionals to predict myocardial infarction proficiently.     The proposed model utilize the mean imputation to remove the missing values from the data set, then applied principal component analysis to extract the optimal features from the data set to enhance the performance of the classifiers. After PCA, the reduced features are partitioned into training dataset and testing dataset where 70% of the training dataset are given as an input to the four well-liked classifiers as support vector machine, k-nearest neighbor, logistic regression and decision tree to train the classifiers and 30% of test dataset is used to evaluate an output of machine learning model using performance metrics as confusion matrix, classifier accuracy, precision, sensitivity, F1-score, AUC-ROC curve.    Output of the classifiers are evaluated using performance measures and we observed that logistic regression provides high accuracy than K-NN, SVM, decision tree classifiers and PCA performs sound as a good feature extraction method to enhance the performance of proposed model. From these analyses, we conclude that logistic regression having good mean accuracy level and standard deviation accuracy compared with the other three algorithms. AUC-ROC curve of the proposed classifiers is analyzed from the output figure.4, figure.5 that logistic regression exhibits good AUC-ROC score, i.e. around 70% compared to k-NN and decision tree algorithm.     From the result analysis, we infer that this proposed machine learning model will act as an optimal decision making system to predict the acute myocardial infarction at an early stage than an existing machine learning based prediction models and it is capable to predict the presence of an acute myocardial Infarction with human using the heart disease risk factors, in order to decide when to start lifestyle modification and medical treatment to prevent the heart disease. ","",""
