Cites,Authors,Title,Year,Source,Publisher,ArticleURL,CitesURL,GSRank,QueryDate,Type,DOI,ISSN,CitationURL,Volume,Issue,StartPage,EndPage,ECC,CitesPerYear,CitesPerAuthor,AuthorCount,Age,Abstract,FullTextURL,RelatedURL
1,"Anupam Datta, Matt Fredrikson, Klas Leino, Kaiji Lu, S. Sen, Zifan Wang","Machine Learning Explainability and Robustness: Connected at the Hip",2021,"","","","",1,"2022-07-13 09:22:24","","10.1145/3447548.3470806","","",,,,,1,1.00,0,6,1,"This tutorial examines the synergistic relationship between explainability methods for machine learning and a significant problem related to model quality: robustness against adversarial perturbations. We begin with a broad overview of approaches to explainable AI, before narrowing our focus to post-hoc explanation methods for predictive models. We discuss perspectives on what constitutes a ""good'' explanation in various settings, with an emphasis on axiomatic justifications for various explanation methods. In doing so, we will highlight the importance of an explanation method's faithfulness to the target model, as this property allows one to distinguish between explanations that are unintelligible because of the method used to produce them, and cases where a seemingly poor explanation points to model quality issues. Next, we introduce concepts surrounding adversarial robustness, including adversarial attacks as well as a range of corresponding state-of-the-art defenses. Finally, building on the knowledge presented thus far, we present key insights from the recent literature on the connections between explainability and robustness, showing that many commonly-perceived explainability issues may be caused by non-robust model behavior. Accordingly, a careful study of adversarial examples and robustness can lead to models whose explanations better appeal to human intuition and domain knowledge.","",""
4,"Guillaume Vidot, Christophe Gabreau, I. Ober, Iulian Ober","Certification of embedded systems based on Machine Learning: A survey",2021,"","","","",2,"2022-07-13 09:22:24","","","","",,,,,4,4.00,1,4,1,"Advances in machine learning (ML) open the way to innovating functions in the avionic domain, such as navigation/surveillance assistance (e.g. vision-based navigation, obstacle sensing, virtual sensing), speechto-text applications, autonomous flight, predictive maintenance or cockpit assistance. Current certification standards and practices, which were defined and refined decades over decades with classical programming in mind, do not however support this new development paradigm. This article provides an overview of the main challenges raised by the use ML in the demonstration of compliance with regulation requirements, and a survey of literature relevant to these challenges, with particular focus on the issues of robustness and explainability of ML results.","",""
1,"M. Staron, Helena Odenstedt Herg'es, S. Naredi, L. Block, Ali El-Merhi, Richard Vithal, M. Elam","Robust Machine Learning in Critical Care — Software Engineering and Medical Perspectives",2021,"","","","",3,"2022-07-13 09:22:24","","10.1109/WAIN52551.2021.00016","","",,,,,1,1.00,0,7,1,"Using machine learning in clinical practice poses hard requirements on explainability, reliability, replicability and robustness of these systems. Therefore, developing reliable software for monitoring critically ill patients requires close collaboration between physicians and software engineers. However, these two different disciplines need to find own research perspectives in order to contribute to both the medical and the software engineering domain. In this paper, we address the problem of how to establish a collaboration where software engineering and medicine meets to design robust machine learning systems to be used in patient care. We describe how we designed software systems for monitoring patients under carotid endarterectomy, in particular focusing on the process of knowledge building in the research team. Our results show what to consider when setting up such a collaboration, how it develops over time and what kind of systems can be constructed based on it. We conclude that the main challenge is to find a good research team, where different competences are committed to a common goal.","",""
2,"S. Meister, Mahdieu A. M. Wermes, J. Stüve, R. Groves","Explainability of deep learning classifier decisions for optical detection of manufacturing defects in the automated fiber placement process",2021,"","","","",4,"2022-07-13 09:22:24","","10.1117/12.2592584","","",,,,,2,2.00,1,4,1,"Automated fibre layup techniques are commonly used composite manufacturing processes in the aviation sector and require a manual visual inspection. Neural Network classification of defects has the potential to automate this visual inspection, however, the machine decision-making processes are hard to verify. Thus, we present an approach for visualising Convolutional Neural Network (CNN) based classifications of manufacturing defects and quantifying its robustness suitably. Our investigations have shown that especially Smoothed Integrated Gradients and DeepSHAP are particularly well suited for the visualisation of CNN classifications. The Smoothed Integrated Gradients technique also reveals advantages in robustness when evaluating degraded input images.","",""
9,"E. Ates, Burak Aksar, V. Leung, A. Coskun","Counterfactual Explanations for Machine Learning on Multivariate Time Series Data",2020,"","","","",5,"2022-07-13 09:22:24","","10.1109/ICAPAI49758.2021.9462056","","",,,,,9,4.50,2,4,2,"Applying machine learning (ML) on multivariate time series data has growing popularity in many application domains, including in computer system management. For example, recent high performance computing (HPC) research proposes a variety of ML frameworks that use system telemetry data in the form of multivariate time series so as to detect performance variations, perform intelligent scheduling or node allocation, and improve system security. Common barriers for adoption for these ML frameworks include the lack of user trust and the difficulty of debugging. These barriers need to be overcome to enable the widespread adoption of ML frameworks in production systems. To address this challenge, this paper proposes a novel explainability technique for providing counterfactual explanations for supervised ML frameworks that use multivariate time series data. The proposed method outperforms state-of-the-art explainability methods on several different ML frameworks and data sets in metrics such as faithfulness and robustness. The paper also demonstrates how the proposed method can be used to debug ML frameworks and gain a better understanding of HPC system telemetry data.","",""
11,"Alexander Hartl, Maximilian Bachl, J. Fabini, T. Zseby","Explainability and Adversarial Robustness for RNNs",2019,"","","","",6,"2022-07-13 09:22:24","","10.1109/BigDataService49289.2020.00030","","",,,,,11,3.67,3,4,3,"Recurrent Neural Networks (RNNs) yield attractive properties for constructing Intrusion Detection Systems (IDSs) for network data. With the rise of ubiquitous Machine Learning (ML) systems, malicious actors have been catching up quickly to find new ways to exploit ML vulnerabilities for profit. Recently developed adversarial ML techniques focus on computer vision and their applicability to network traffic is not straightforward: Network packets expose fewer features than an image, are sequential and impose several constraints on their features. We show that despite these completely different characteristics, adversarial samples can be generated reliably for RNNs. To understand a classifier's potential for misclassification, we extend existing explainability techniques and propose new ones, suitable particularly for sequential data. Applying them shows that already the first packets of a communication flow are of crucial importance and are likely to be targeted by attackers. Feature importance methods show that even relatively unimportant features can be effectively abused to generate adversarial samples. We thus introduce the concept of feature sensitivity which quantifies how much potential a feature has to cause misclassification. Since traditional evaluation metrics such as accuracy are not sufficient for quantifying the adversarial threat, we propose the Adversarial Robustness Score (ARS) for comparing IDSs and show that an adversarial training procedure can significantly and successfully reduce the attack surface.","",""
5,"P. Santhanam","Quality Management of Machine Learning Systems",2020,"","","","",7,"2022-07-13 09:22:24","","10.1007/978-3-030-62144-5_1","","",,,,,5,2.50,5,1,2,"","",""
0,"E. Ates, Burak Aksar, V. Leung, A. Coskun","Explainable Machine Learning Frameworks for Managing HPC Systems.",2020,"","","","",8,"2022-07-13 09:22:24","","10.2172/1829224","","",,,,,0,0.00,0,4,2,"Recent research on supercomputing proposes a variety of machine learning frameworks that are able to detect performance variations, find optimum application configurations, perform intelligent scheduling or node allocation, and improve system security. Although these goals align well with HPC systems’ needs, barriers such as the lack of user trust or the difficulty of debugging need to be overcome to enable the widespread adoption of such frameworks in production systems. This paper evaluates a new counterfactual time series explainability method and compares it against state-of-the-art explainability methods for supervised machine learning frameworks that use multivariate HPC system telemetry data. The counterfactual time series explainability method outperforms existing methods in terms of comprehensibility and robustness. We also show how explainability techniques can be used to debug machine learning frameworks and gain a better understanding of HPC system telemetry data.","",""
0,"J. Filipe, Ashish Ghosh, R. Prates, O. Shehory, E. Farchi, Guy Barash","Engineering Dependable and Secure Machine Learning Systems: Third International Workshop, EDSMLS 2020, New York City, NY, USA, February 7, 2020, Revised Selected Papers",2020,"","","","",9,"2022-07-13 09:22:24","","10.1007/978-3-030-62144-5","","",,,,,0,0.00,0,6,2,"","",""
5,"Florian Tambon, G. Laberge, Le An, Amin Nikanjam, Paulina Stevia Nouwou Mindom, Yann Pequignot, F. Khomh, G. Antoniol, E. Merlo, Franccois Laviolette","How to Certify Machine Learning Based Safety-critical Systems? A Systematic Literature Review",2021,"","","","",10,"2022-07-13 09:22:24","","10.1007/s10515-022-00337-x","","",,,,,5,5.00,1,10,1,"","",""
0,"Shuai Zhao, Yingzhou Peng, Yi Zhang, Huai Wang","Physics-informed Machine Learning for Parameter Estimation of DC-DC Converter",2022,"","","","",11,"2022-07-13 09:22:24","","10.1109/APEC43599.2022.9773482","","",,,,,0,0.00,0,4,1,"Although various machine learning-based methods have been proposed for condition monitoring in power elec-tronics, they are challenging to be implemented in practice due to the accuracy, data availability, computation burden, explainability, etc. Physics-informed machine learning (PIML) has been emerging as a promising direction where the above challenges can be mitigated by incorporating domain knowledge. In this paper, we propose a PIML- based parameter estimation method for a DC-DC Buck converter, as an exemplary application of PIML in power electronics. By seamlessly integrating a deep neural network and the converter physical model, it can estimate multiple component parameters simultaneously with high accuracy and robustness, while based on a limited dataset. It expects to provide a new perspective to tailor existing ML tools for power electronic applications.","",""
0,"B. Krishnamurthy, S. Shiva","Scalable Hindsight Experience Replay based Q-learning Framework with Explainability for Big Data Applications in Fog Computing",2022,"","","","",12,"2022-07-13 09:22:24","","10.1109/CCWC54503.2022.9720835","","",,,,,0,0.00,0,2,1,"Nowadays Internet of Things (IoT) applications are proliferating with explosive growth and their computational load is very high. Fog computing is an important structure used for processing the IoT devices data at cloud proximity. Big data applications demand scalable computing with stringent performance requirement. The currently available machine learning models do not match the growing scale of big data applications and lack explainability. In this paper an explainable Q-learning framework with hindsight experience replay (Q-HER) is developed to provide holistic scalability solution for big data applications using minimum number of fog nodes. The reward engineering process is streamlined and each episode with original goal and subset of other goals is repeated to yield high quality scalability policies. The mathematical modeling reveals that the generated scalability decisions satisfy the quality assurance parameters like correctness, robustness, model relevance, and ∊ -Differential Data privacy. The performance of the proposed Q-HER is found to be good towards the performance metrics like accuracy, latency, cost, and average resource wastage under two different scenarios of limited and unlimited processor fog nodes.","",""
11,"Y. Nishi, Satoshi Masuda, H. Ogawa, Keiji Uetsuki","A Test Architecture for Machine Learning Product",2018,"","","","",13,"2022-07-13 09:22:24","","10.1109/ICSTW.2018.00060","","",,,,,11,2.75,3,4,4,"As machine learning (ML) technology continues to spread by rapid evolution, the system or service using Machine Learning technology, called ML product, makes big impact on our life, society and economy. Meanwhile, Quality Assurance (QA) for ML product is quite more difficult than hardware, non-ML software and service because performance of ML technology is much better than non-ML technology in exchange for the characteristics of ML product, e.g. low explainability. We must keep rapid evolution and reduce quality risk of ML product simultaneously. In this paper, we show a Quality Assurance Framework for Machine Learning product. Scope of QA in this paper is limited to product evaluation. First, a policy of QA for ML Product is proposed. General principles of product evaluation is introduced and applied to ML product evaluation as a part of the policy. They are composed of A-ARAI: Allowability, Achievability, Robustness, Avoidability and Improvability. A strategy of ML Product Evaluation is constructed as another part of the policy. Quality Integrity Level for ML product is also modelled. Second, we propose a test architecture of ML product testing. It consists of test levels and fundamental test types of ML product testing, including snapshot testing, learning testing and confrontation testing. Finally, we defines QA activity levels for ML product.","",""
34,"Shubham Sharma, Jette Henderson, J. Ghosh","CERTIFAI: A Common Framework to Provide Explanations and Analyse the Fairness and Robustness of Black-box Models",2020,"","","","",14,"2022-07-13 09:22:24","","10.1145/3375627.3375812","","",,,,,34,17.00,11,3,2,"Concerns within the machine learning community and external pressures from regulators over the vulnerabilities of machine learning algorithms have spurred on the fields of explainability, robustness, and fairness. Often, issues in explainability, robustness, and fairness are confined to their specific sub-fields and few tools exist for model developers to use to simultaneously build their modeling pipelines in a transparent, accountable, and fair way. This can lead to a bottleneck on the model developer's side as they must juggle multiple methods to evaluate their algorithms. In this paper, we present a single framework for analyzing the robustness, fairness, and explainability of a classifier. The framework, which is based on the generation of counterfactual explanations through a custom genetic algorithm, is flexible, model-agnostic, and does not require access to model internals. The framework allows the user to calculate robustness and fairness scores for individual models and generate explanations for individual predictions which provide a means for actionable recourse (changes to an input to help get a desired outcome). This is the first time that a unified tool has been developed to address three key issues pertaining towards building a responsible artificial intelligence system.","",""
0,"Bernat Coma-Puig, J. Carmona","A Human-in-the-Loop Approach based on Explainability to Improve NTL Detection",2020,"","","","",15,"2022-07-13 09:22:24","","10.1109/ICDMW53433.2021.00123","","",,,,,0,0.00,0,2,2,"Implementing systems based on Machine Learning to detect fraud and other Non-Technical Losses (NTL) is challenging: the data available is biased, and the algorithms currently used are black-boxes that cannot be either easily trusted or understood by stakeholders. This work explains our human-in-the-loop approach to mitigate these problems in a real system that uses a supervised model to detect Non-Technical Losses (NTL) for an international utility company from Spain. This approach exploits human knowledge (e.g. from the data scientists or the company’s stakeholders) and the information provided by explanatory methods to guide the system during the training process. This simple, efficient method that can be easily implemented in other industrial projects is tested in a real dataset and the results show that the derived prediction model is better in terms of accuracy, interpretability, robustness and flexibility.","",""
1,"Ahmed M. A. Salih, I. Galazzo, Z. Raisi-Estabragh, S. Petersen, Polyxeni Gkontra, K. Lekadir, G. Menegaz, P. Radeva","A new scheme for the assessment of the robustness of Explainable Methods Applied to Brain Age estimation",2021,"","","","",16,"2022-07-13 09:22:24","","10.1109/CBMS52027.2021.00098","","",,,,,1,1.00,0,8,1,"Deep learning methods show great promise in a range of settings including the biomedical field. Explainability of these models is important in these fields for building end-user trust and to facilitate their confident deployment. Although several Machine Learning Interpretability tools have been proposed so far, there is currently no recognized evaluation standard to transfer the explainability results into a quantitative score. Several measures have been proposed as proxies for quantitative assessment of explainability methods. However, the robustness of the list of significant features provided by the explainability methods has not been addressed. In this work, we propose a new proxy for assessing the robustness of the list of significant features provided by two explainability methods. Our validation is defined at functionality-grounded level based on the ranked correlation statistical index and demonstrates its successful application in the framework of brain aging estimation. We assessed our proxy to estimate brain age using neuroscience data. Our results indicate small variability and high robustness in the considered explainability methods using this new proxy.","",""
7,"Sean Saito, Eugene Chua, Nicholas Capel, Rocco Hu","Improving LIME Robustness with Smarter Locality Sampling",2020,"","","","",17,"2022-07-13 09:22:24","","","","",,,,,7,3.50,2,4,2,"Explainability algorithms such as LIME have enabled machine learning systems to adopt transparency and fairness, which are important qualities in commercial use cases. However, recent work has shown that LIME's naive sampling strategy can be exploited by an adversary to conceal biased, harmful behavior. We propose to make LIME more robust by training a generative adversarial network to sample more realistic synthetic data which the explainer uses to generate explanations. Our experiments demonstrate that our proposed method demonstrates an increase in accuracy across three real-world datasets in detecting biased, adversarial behavior compared to vanilla LIME. This is achieved while maintaining comparable explanation quality, with up to 99.94\% in top-1 accuracy in some cases.","",""
0,"Sebastian A. Schober, Y. Bahri, Cecilia Carbonelli, R. Wille","Neural Network Robustness Analysis Using Sensor Simulations for a Graphene-Based Semiconductor Gas Sensor",2022,"","","","",18,"2022-07-13 09:22:24","","10.3390/chemosensors10050152","","",,,,,0,0.00,0,4,1,"Despite their advantages regarding production costs and flexibility, chemiresistive gas sensors often show drawbacks in reproducibility, signal drift and ageing. As pattern recognition algorithms, such as neural networks, are operating on top of raw sensor signals, assessing the impact of these technological drawbacks on the prediction performance is essential for ensuring a suitable measuring accuracy. In this work, we propose a characterization scheme to analyze the robustness of different machine learning models for a chemiresistive gas sensor based on a sensor simulation model. Our investigations are structured into four separate studies: in three studies, the impact of different sensor instabilities on the concentration prediction performance of the algorithms is investigated, including sensor-to-sensor variations, sensor drift and sensor ageing. In a further study, the explainability of the machine learning models is analyzed by applying a state-of-the-art feature ranking method called SHAP. Our results show the feasibility of model-based algorithm testing and substantiate the need for the thorough characterization of chemiresistive sensor algorithms before sensor deployment in order to ensure robust measurement performance.","",""
0,"Mark H. Meng, Guangdong Bai, S. Teo, Zhe Hou, Yan Xiao, Yun Lin, Jin Song Dong","Adversarial Robustness of Deep Neural Networks: A Survey from a Formal Verification Perspective",2022,"","","","",19,"2022-07-13 09:22:24","","10.1109/TDSC.2022.3179131","","",,,,,0,0.00,0,7,1,"—Neural networks have been widely applied in security applications such as spam and phishing detection, intrusion prevention, and malware detection. This black-box method, however, often has uncertainty and poor explainability in applications. Furthermore, neural networks themselves are often vulnerable to adversarial attacks. For those reasons, there is a high demand for trustworthy and rigorous methods to verify the robustness of neural network models. Adversarial robustness, which concerns the reliability of a neural network when dealing with maliciously manipulated inputs, is one of the hottest topics in security and machine learning. In this work, we survey existing literature in adversarial robustness veriﬁcation for neural networks and collect 39 diversiﬁed research works across machine learning, security, and software engineering domains. We systematically analyze their approaches, including how robustness is formulated, what veriﬁcation techniques are used, and the strengths and limitations of each technique. We provide a taxonomy from a formal veriﬁcation perspective for a comprehensive understanding of this topic. We classify the existing techniques based on property speciﬁcation, problem reduction, and reasoning strategies. We also demonstrate representative techniques that have been applied in existing studies with a sample model. Finally, we discuss open questions for future research.","",""
0,"Erick Galinkin","Robustness and Usefulness in AI Explanation Methods",2022,"","","","",20,"2022-07-13 09:22:24","","10.48550/arXiv.2203.03729","","",,,,,0,0.00,0,1,1,"Explainability in machine learning has become incredibly important as machine learning-powered systems become ubiquitous and both regulation and public sentiment begin to demand an understanding of how these systems make decisions. As a result, a number of explanation methods have begun to receive widespread adoption. This work summarizes, compares, and contrasts three popular explanation methods: LIME, SmoothGrad, and SHAP. We evaluate these methods with respect to: robustness, in the sense of sample complexity and stability; understandability, in the sense that provided explanations are consistent with user expectations; and usability, in the sense that the explanations allow for the model to be modified based on the output. This work concludes that current explanation methods are insufficient; that putting faith in and adopting these methods may actually be worse than simply not using them.","",""
0,"L. Oneto, Nicolò Navarin, B. Biggio, Federico Errica, A. Micheli, F. Scarselli, M. Bianchini, A. Sperduti","Complex Data: Learning Trustworthily, Automatically, and with Guarantees",2021,"","","","",21,"2022-07-13 09:22:24","","10.14428/esann/2021.es2021-6","","",,,,,0,0.00,0,8,1,". Machine Learning (ML) achievements enabled automatic extraction of actionable information from data in a wide range of decision-making scenarios. This demands for improving both ML technical aspects (e.g., design and automation) and human-related metrics (e.g., fairness, robustness, privacy, and explainability), with performance guarantees at both levels. The aforementioned scenario posed three main challenges: (i) Learning from Complex Data (i.e., sequence, tree, and graph data), (ii) Learning Trustworthily, and (iii) Learning Automatically with Guarantees. The focus of this special session is on addressing one or more of these challenges with the ﬁnal goal of Learning Trustworthily, Automatically, and with Guarantees from Complex Data.","",""
