Cites,Authors,Title,Year,Source,Publisher,ArticleURL,CitesURL,GSRank,QueryDate,Type,DOI,ISSN,CitationURL,Volume,Issue,StartPage,EndPage,ECC,CitesPerYear,CitesPerAuthor,AuthorCount,Age,Abstract,FullTextURL,RelatedURL
1,"Dorota Toczydlowska","Machine learning developments in dependency modelling and feature extraction",2020,"","","","",68,"2022-07-13 09:22:24","","","","",,,,,1,0.50,1,1,2,"Three complementary feature extraction approaches are developed in this thesis which addresses the challenge of dimensionality reduction in the presence of multivariate heavy-tailed and asymmetric distributions. First, we demonstrate how to improve the robustness of the standard Probabilistic Principal Component Analysis by adapting the concept of robust mean and covariance estimation within the standard framework. We then introduce feature extraction methods that extend the standard Principal Component Analysis by exploring distribution-based robustification. This is achieved via Probabilistic Principal Component Analysis (PPCA), in which new, statistically robust variants are derived, also treating missing data. We propose a novel generalisation to the t-Student Probabilistic Principal Component methodology which (1) accounts for asymmetric distribution of the observation data, (2) is a framework for grouped and generalised multiple-degree-of-freedom structures, which provides a more flexible framework to model groups of marginal tail dependence in the observation data, and (3) separates the tail effect of the error terms and factors. The new feature extraction methods are derived in an incomplete data setting to efficiently handle the presence of missing values in the observation vector. We discuss statistical properties of their robustness. In the next part of this thesis, we demonstrate the applicability of feature extraction methods to the statistical analysis of multidimensional dynamics. We introduce the class of Hybrid Factor models that combines classical state-space model formulations with incorporation of exogenous factors. We show how to utilize the information obtained from features extracted using introduced robust PPCA in a modelling framework in a meaningful and parsimonious manner. In the first application study, we show the applicability of robust feature extraction methods in the real data environment of financial markets and combine the obtained results with a stochastic multi-factor panel regression-based state-space model in order to model the dynamic of yield curves, whilst incorporating regression factors. We embed the rank-reduced feature extractions into a stochastic representation of state-space models for yield curve dynamics and compare the results to classical multi-factor dynamic Nelson-Siegel state-space models. This leads to important new representations of yield curve models that can have practical importance for addressing questions of financial stress testing and monetary policy interventions which can efficiently incorporate financial big data. We illustrate our results on various financial and macroeconomic data sets from the Euro Zone and international markets. In the second study, we develop a multi-factor extension of the family of Lee-Carter stochastic mortality models. We build upon the time, period and cohort stochastic model structure to include exogenous observable demographic features that can be used as additional factors to improve model fit and forecasting accuracy. We develop a framework in which (a) we employ projection-based techniques of dimensionality reduction that are amenable to different structures of demographic data; (b) we analyse demographic data sets from the patterns of missingness and the impact of such missingness on the feature extraction; (c) we introduce a class of multi-factor stochastic mortality models incorporating time, period, cohort and demographic features, which we develop within a Bayesian state-space estimation framework. Finally (d) we develop an efficient combined Markov chain and filtering framework for sampling the posterior and forecasting. We undertake a detailed case study on the Human Mortality Database demographic data from European countries and we use the extracted features to better explain the term structure of mortality in the UK over time for male and female populations. This is compared to a pure Lee-Carter stochastic mortality model, demonstrating that our feature extraction framework and consequent multi-factor mortality model improves both in-sample fit and, importantly, out-of-sample mortality forecasts by a non-trivial gain in performance.","",""
2,"Chiara Giola, Piero Danti, S. Magnani","Learning Curves: A Novel Approach for Robustness Improvement of Load Forecasting",2021,"","","","",69,"2022-07-13 09:22:24","","10.3390/ENGPROC2021005038","","",,,,,2,2.00,1,3,1,"In the age of AI, companies strive to extract benefits from data. In the first steps of data analysis, an arduous dilemma scientists have to cope with is the definition of the ’right’ quantity of data needed for a certain task. In particular, when dealing with energy management, one of the most thriving application of AI is the consumption’s optimization of energy plant generators. When designing a strategy to improve the generators’ schedule, a piece of essential information is the future energy load requested by the plant. This topic, in the literature it is referred to as load forecasting, has lately gained great popularity; in this paper authors underline the problem of estimating the correct size of data to train prediction algorithms and propose a suitable methodology. The main characters of this methodology are the Learning Curves, a powerful tool to track algorithms performance whilst data training-set size varies. At first, a brief review of the state of the art and a shallow analysis of eligible machine learning techniques are offered. Furthermore, the hypothesis and constraints of the work are explained, presenting the dataset and the goal of the analysis. Finally, the methodology is elucidated and the results are discussed.","",""
81,"Vaishak Belle, I. Papantonis","Principles and Practice of Explainable Machine Learning",2020,"","","","",70,"2022-07-13 09:22:24","","10.3389/fdata.2021.688969","","",,,,,81,40.50,41,2,2,"Artificial intelligence (AI) provides many opportunities to improve private and public life. Discovering patterns and structures in large troves of data in an automated manner is a core component of data science, and currently drives applications in diverse areas such as computational biology, law and finance. However, such a highly positive impact is coupled with a significant challenge: how do we understand the decisions suggested by these systems in order that we can trust them? In this report, we focus specifically on data-driven methods—machine learning (ML) and pattern recognition models in particular—so as to survey and distill the results and observations from the literature. The purpose of this report can be especially appreciated by noting that ML models are increasingly deployed in a wide range of businesses. However, with the increasing prevalence and complexity of methods, business stakeholders in the very least have a growing number of concerns about the drawbacks of models, data-specific biases, and so on. Analogously, data science practitioners are often not aware about approaches emerging from the academic literature or may struggle to appreciate the differences between different methods, so end up using industry standards such as SHAP. Here, we have undertaken a survey to help industry practitioners (but also data scientists more broadly) understand the field of explainable machine learning better and apply the right tools. Our latter sections build a narrative around a putative data scientist, and discuss how she might go about explaining her models by asking the right questions. From an organization viewpoint, after motivating the area broadly, we discuss the main developments, including the principles that allow us to study transparent models vs. opaque models, as well as model-specific or model-agnostic post-hoc explainability approaches. We also briefly reflect on deep learning models, and conclude with a discussion about future research directions.","",""
0,"S. Al-Zaiti, Alaa A. Alghwiri, Xiao Hu, G. Clermont, A. Peace, P. Macfarlane, R. Bond","A clinician’s guide to understanding and critically appraising machine learning studies: a checklist for Ruling Out Bias Using Standard Tools in Machine Learning (ROBUST-ML)",2022,"","","","",71,"2022-07-13 09:22:24","","10.1093/ehjdh/ztac016","","",,,,,0,0.00,0,7,1,"  Developing functional machine learning (ML)-based models to address unmet clinical needs requires unique considerations for optimal clinical utility. Recent debates about the rigours, transparency, explainability, and reproducibility of ML models, terms which are defined in this article, have raised concerns about their clinical utility and suitability for integration in current evidence-based practice paradigms. This featured article focuses on increasing the literacy of ML among clinicians by providing them with the knowledge and tools needed to understand and critically appraise clinical studies focused on ML. A checklist is provided for evaluating the rigour and reproducibility of the four ML building blocks: data curation, feature engineering, model development, and clinical deployment. Checklists like this are important for quality assurance and to ensure that ML studies are rigourously and confidently reviewed by clinicians and are guided by domain knowledge of the setting in which the findings will be applied. Bridging the gap between clinicians, healthcare scientists, and ML engineers can address many shortcomings and pitfalls of ML-based solutions and their potential deployment at the bedside.","",""
0,"Alireza Rezazadeh, Yasamin Jafarian, A. Kord","Explainable Ensemble Machine Learning for Breast Cancer Diagnosis based on Ultrasound Image Texture Features",2022,"","","","",72,"2022-07-13 09:22:24","","10.3390/forecast4010015","","",,,,,0,0.00,0,3,1,"Image classification is widely used to build predictive models for breast cancer diagnosis. Most existing approaches overwhelmingly rely on deep convolutional networks to build such diagnosis pipelines. These model architectures, although remarkable in performance, are black-box systems that provide minimal insight into the inner logic behind their predictions. This is a major drawback as the explainability of prediction is vital for applications such as cancer diagnosis. In this paper, we address this issue by proposing an explainable machine learning pipeline for breast cancer diagnosis based on ultrasound images. We extract first- and second-order texture features of the ultrasound images and use them to build a probabilistic ensemble of decision tree classifiers. Each decision tree learns to classify the input ultrasound image by learning a set of robust decision thresholds for texture features of the image. The decision path of the model predictions can then be interpreted by decomposing the learned decision trees. Our results show that our proposed framework achieves high predictive performance while being explainable.","",""
0,"David Melching, Tobias Strohmann, Guillermo Requena, E. Breitbarth","Explainable machine learning for precise fatigue crack tip detection",2022,"","","","",73,"2022-07-13 09:22:24","","10.1038/s41598-022-13275-1","","",,,,,0,0.00,0,4,1,"","",""
0,"Tyler Cody, Justin Kauffman, J. Krometis, Daniel Sobien, Laura J. Freeman","Combinatorial coverage framework for machine learning in multi-domain operations",2022,"","","","",74,"2022-07-13 09:22:24","","10.1117/12.2617117","","",,,,,0,0.00,0,5,1,"Multi-domain operations (MDO) are characterized by simultaneous and sequential operations; rapid and continuous integration; and surprise. Machine learning (ML) for MDO is no different. Translated into ML, MDO requires highly assured yet rapid data and model fusion. Assurance demands robustness, reliability, and explain-ability, while speed demands computational efficiency and sample efficiency. Combinatorial interaction testing offers explainable and rigorous techniques to ML for fusing data and models with runtime guarantees. But such methods are underexplored in the literature. Combinatorial coverage has been applied to neuron- and layer-levels of neural networks, but only recently to ML in general. There are also ongoing debates of efficacy in the literature, but these debates are scoped to explainable deep learning. This work presents a framework for using combinatorial coverage for multi-domain operations. We discuss how coverage metrics can incorporate multi-modal meta-data and mission context into fusion processes, how coverage is oriented towards identifying gaps in and between sets of data, and how coverage can identify cases where performance is expected to be difficult. We conclude that combinatorial coverage should be considered a core capability for supporting ML in MDO.","",""
34,"A. Binder, M. Bockmayr, M. Hägele, S. Wienert, D. Heim, Katharina Hellweg, M. Ishii, A. Stenzinger, A. Hocke, C. Denkert, K. Müller, F. Klauschen","Morphological and molecular breast cancer profiling through explainable machine learning",2021,"","","","",75,"2022-07-13 09:22:24","","10.1038/S42256-021-00303-4","","",,,,,34,34.00,3,12,1,"","",""
3,"F. Lécué, B. Abeloos, Jonathan Anctil, Manuel Bergeron, Damien Dalla-Rosa, Simon Corbeil-Letourneau, Florian Martet, Tanguy Pommellet, L. Salvan, Simon Veilleux, M. Ziaeefard","Thales XAI Platform: Adaptable Explanation of Machine Learning Systems - A Knowledge Graphs Perspective",2019,"","","","",76,"2022-07-13 09:22:24","","","","",,,,,3,1.00,0,11,3,"Explanation in Machine Learning systems has been identified to be the main asset to have for large scale deployment of Artificial Intelligence (AI) in critical systems. Explanations could be example-, features-, semantics-based or even counterfactual to potentially action on an AI system; they could be represented in many different ways e.g., textual, graphical, or visual. All representations serve different means, purpose and operators. We built the first-of-its-kind XAI (eXplainable AI) platform for critical systems i.e., Thales XAI Platform which aims at serving explanations through various forms. This paper emphasizes on the semantics-based explanations for Machine Learning systems. 1 Explainable AI in Critical Systems Motivation: The current hype of Artificial Intelligence (AI) mostly refers to the success of Machine Learning (ML) and its sub-domain of deep learning. However industries operating with critical systems are either highly regulated, or require high level of certification and robustness. Therefore, such industry constraints do limit the adoption of non deterministic and ML systems. Answers to the question of explainability will be intrinsically connected to the adoption of AI in industry at scale. Indeed explanation, which could be used for debugging intelligent systems or deciding to follow a recommendation in real-time, will increase acceptance and (business) user trust. Explainable AI (XAI) is now referring to the core backup for industry to apply AI in products at scale, particularly for industries operating with critical systems. Focus: Thales XAI Platform is designed to provide explanation for a ML task (classification, regression, object detection, segmentation). Although Thales XAI Platform does provide different levels of explanation e.g., example-based, featuresbased, counterfactual using textual and visual representations, we emphasis only on the semantics-based explanation through knowledge graphs. ? Copyright c © 2019 for this paper by its authors. Use permitted under Creative Commons License Attribution 4.0 International (CC BY 4.0). Critical Applications: From adapting a plane trajectory, stopping a train, refitting a boat to reconfiguring a satellite, all are examples of critical situations where explanation is a must-to-have to follow an AI system decision. 2 Why Knowledge Graphs for Explainable AI? State-of-the-Art Limitations: Most approaches limits explanation of ML systems to features involved in the data and model, or at best to examples, prototypes or counterfactuals. Explanation should go beyond correlation (features importance) and numerical similarity (local explanation). Opportunity: By expanding and linking initial (training, validation and test) data with entities in knowledge graphs, (i) context is encoded, (ii) connections and relations are exposed, and (iii) inference and causation are natively supported. Knowledge graphs are used for encoding better representation of data, structuring a ML model in a more interpretable way, and adopt a semantic similarity for local (instance-based) and global (model-based) explanation. 3 Thales XAI Platform: A Knowledge Graph Perspective (Semantic) Perspective: The platform is combining ML and reasoning functionalities to expose a human-like rational as explanation when (i) recognizing an object (in a raw image) of any class in a knowledge graph, (ii) predicting a link in a knowledge graph. Thales XAI Platform is using state-of-the-art Semantic Web tools for enriching input, output (class) data with DBpedia (4, 233, 000 resources) and domain-specific knowledge graphs, usually enterprise knowledge graphs. This is a crucial step for contextualizing training, validation, test data. Explainable ML Classifications: Starting from raw images, as unstructured data, but with class labels augmented with a domain knowledge graph, Thales XAI Platform relies on existing neural network architectures to build the most appropriate models. All confidence scores of output classes on any input image are updated based on the semantic description of the output classes. For instance, an input classified as a car will have a higher overall confidence score in case some properties of car in the knowledge graph are retrieved e.g., having wheels, being on a road. In addition the platform is embedding naturally explanation i.e., properties of the objects retrieved in both the raw data and knowledge graph. Explainable Relational Learning: Starting from relational data, structured as graph, and augmented with a domain knowledge graph, Thales XAI Platform relies on existing knowledge graph embeddings frameworks to build the most appropriate models. Explanation of any link prediction is retrieved by identifying representative hotspots in the knowledge graph i.e., connected parts of the graphs that negatively impact prediction accuracy when removed.","",""
2,"Sahar Daraeizadeh, S. Premaratne, Xiaoyu Song, M. Perkowski, A. Matsuura","Machine-learning based three-qubit gate for realization of a Toffoli gate with cQED-based transmon systems",2019,"","","","",77,"2022-07-13 09:22:24","","10.1103/PHYSREVA.102.012601","","",,,,,2,0.67,0,5,3,"We use machine learning techniques to design a 50 ns three-qubit flux-tunable controlled-controlled-phase gate with fidelity of >99.99% for nearest-neighbor coupled transmons in circuit quantum electrodynamics architectures. We explain our gate design procedure where we enforce realistic constraints, and analyze the new gate's robustness under decoherence, distortion, and random noise. Our controlled-controlled-phase gate in combination with two single-qubit gates realizes a Toffoli gate which is widely used in quantum circuits, logic synthesis, quantum error correction, and quantum games.","",""
1,"Quico Spaen","Applications and Advances in Similarity-based Machine Learning",2019,"","","","",78,"2022-07-13 09:22:24","","","","",,,,,1,0.33,1,1,3,"Author(s): Spaen, Quico Pepijn | Advisor(s): Hochbaum, Dorit S | Abstract: Similarity-based machine learning methods differ from traditional machine learning methods in that they also use pairwise similarity relations between objects to infer the labels of unlabeled objects. A recent comparative study for classification problems by Baumann et al. [2019] demonstrated that similarity-based techniques have superior performance and robustness when compared to well-established machine learning techniques. Similarity-based machine learning methods benefit from two advantages that could explain superior their performance: They can make use of the pairwise relations between unlabeled objects, and they are robust due to the transitive property of pairwise similarities. A challenge for similarity-based machine learning methods on large datasets is that the number of pairwise similarity grows quadratically in the size of the dataset. For large datasets, it thus becomes practically impossible to compute all possible pairwise similarities. In 2016, Hochbaum and Baumann proposed the technique of sparse computation to address this growth by computing only those pairwise similarities that are relevant. Their proposed implementation of sparse computation is still difficult to scale to millions objects. This dissertation focuses on advancing the practical implementations of sparse computation to larger datasets and on two applications for which similarity-based machine learning was particularly effective. The applications that are studied here are cell identification in calcium-imaging movies and detecting aberrant linking behavior in directed networks. For sparse computation we present faster, geometric algorithms and a technique, named sparse-reduced computation, that combines sparse computation with compression. The geometric algorithms compute the exact same output as the original implementation of sparse computation, but identify the relevant pairwise similarities faster by using the concept of data shifting for identifying objects in the same or neighboring blocks. Empirical results on datasets with up to 10 million objects show a significant reduction in running time. Sparse-reduced computation combines sparse computation with a technique for compressing highly-similar or identical objects, enabling the use of similarity-based machine learning on massively-large datasets. The computational results demonstrate that sparse-reduced computation provides a significant reduction in running time with a minute loss in accuracy.A major problem facing neuroscientists today is cell identification in calcium-imaging movies. These movies are in-vivo recordings of thousands of neurons at cellular resolution. There is a great need for automated approaches to extract the activity of single neurons from these movies since manual post-processing takes tens of hours per dataset. We present the HNCcorr algorithm for cell identification in calcium-imaging movies. The name HNCcorr is derived from its use of the similarity-based Hochbaum's Normalized Cut (HNC) model with pairwise similarities derived from correlation. In HNCcorr, the task of cell detection is approached as a clustering problem. HNCcorr utilizes HNC to detect cells in these movies as coherent clusters of pixels that are highly distinct from the remaining pixels. HNCcorr guarantees, unlike existing methodologies for cell identification, a globally optimal solution to the underlying optimization problem. Of independent interest is a novel method, named similarity-squared, that we devised for measuring similarity between pixels. We provide an experimental study and demonstrate that HNCcorr is a top performer on the Neurofinder cell identification benchmark and that it improves over algorithms based on matrix factorization.The second application is detecting aberrant agents, such as fake news sources or spam websites, based on their link behavior in networks. Across contexts, a distinguishing characteristic between normal and aberrant agents is that normal agents rarely link to aberrant ones. We refer to this phenomenon as aberrant linking behavior. We present an Markov Random Fields (MRF) formulation, with links as the pairwise similarities, that detects aberrant agents based on aberrant linking behavior and any prior information (if given). This MRF formulation is solved optimally and in polynomial time. We compare the optimal solution for the MRF formulation to well-known algorithms based on random walks. In our empirical experiment with twenty-three different datasets, the MRF method outperforms the other detection algorithms. This work represents the first use of optimization methods for detecting aberrant agents as well as the first time that MRF is applied to directed graphs.","",""
1,"Sicheng Jiang, Sirui Lu, D. Deng","Adversarial Machine Learning Phases of Matter",2019,"","","","",79,"2022-07-13 09:22:24","","","","",,,,,1,0.33,0,3,3,"We study the robustness of machine learning approaches to adversarial perturbations, with a focus on supervised learning scenarios. We find that typical phase classifiers based on deep neural networks are extremely vulnerable to adversarial perturbations: adding a tiny amount of carefully crafted noises into the original legitimate examples will cause the classifiers to make incorrect predictions at a notably high confidence level. Through the lens of activation maps, we find that some important underlying physical principles and symmetries remain to be adequately captured for classifiers with even near-perfect performance. This explains why adversarial perturbations exist for fooling these classifiers. In addition, we find that, after adversarial training the classifiers will become more consistent with physical laws and consequently more robust to certain kinds of adversarial perturbations. Our results provide valuable guidance for both theoretical and experimental future studies on applying machine learning techniques to condensed matter physics.","",""
