Cites,Authors,Title,Year,Source,Publisher,ArticleURL,CitesURL,GSRank,QueryDate,Type,DOI,ISSN,CitationURL,Volume,Issue,StartPage,EndPage,ECC,CitesPerYear,CitesPerAuthor,AuthorCount,Age,Abstract,FullTextURL,RelatedURL
2,"A. Ayobi, Katarzyna Stawarz, Dmitri S. Katz, P. Marshall, Taku Yamagata, Raúl Santos-Rodríguez, Peter A. Flach, A. O'Kane","Machine Learning Explanations as Boundary Objects: How AI Researchers Explain and Non-Experts Perceive Machine Learning",2021,"","","","",110,"2022-07-13 09:22:24","","","","",,,,,2,2.00,0,8,1,"Understanding artificial intelligence (AI) and machine learning (ML) approaches is becoming increasingly important for people with a wide range of professional backgrounds. However, it is unclear how ML concepts can be effectively explained as part of human-centred and multidisciplinary design processes. We provide a qualitative account of how AI researchers explained and non-experts perceived ML concepts as part of a co-design project that aimed to inform the design of ML applications for diabetes self-care. We identify benefits and challenges of explaining ML concepts with analogical narratives, information visualisations, and publicly available videos. Co-design participants reported not only gaining an improved understanding of ML concepts but also highlighted challenges of understanding ML explanations, including misalignments between scientific models and their lived self-care experiences and individual information needs. We frame our findings through the lens of Stars and Griesemer’s concept of boundary objects to discuss how the presentation of user-centred ML explanations could strike a balance between being plastic and robust enough to support design objectives and people’s individual information needs.","",""
21,"Cheng-Yu Hsieh, Chih-Kuan Yeh, Xuanqing Liu, Pradeep Ravikumar, Seungyeon Kim, Sanjiv Kumar, Cho-Jui Hsieh","Evaluations and Methods for Explanation through Robustness Analysis",2019,"","","","",111,"2022-07-13 09:22:24","","","","",,,,,21,7.00,3,7,3,"Among multiple ways of interpreting a machine learning model, measuring the importance of a set of features tied to a prediction is probably one of the most intuitive ways to explain a model. In this paper, we establish the link between a set of features to a prediction with a new evaluation criterion, robustness analysis, which measures the minimum distortion distance of adversarial perturbation. By measuring the tolerance level for an adversarial attack, we can extract a set of features that provides the most robust support for a prediction, and also can extract a set of features that contrasts the current prediction to a target class by setting a targeted adversarial attack. By applying this methodology to various prediction tasks across multiple domains, we observe the derived explanations are indeed capturing the significant feature set qualitatively and quantitatively.","",""
0,"I. Olier, Oghenejokpeme I. Orhobor, T. Dash, Andy M. Davis, L. Soldatova, J. Vanschoren, R. King","Transformational machine learning: Learning how to learn from many related scientific problems",2021,"","","","",112,"2022-07-13 09:22:24","","10.1073/pnas.2108013118","","",,,,,0,0.00,0,7,1,"Significance Machine learning (ML) is the branch of artificial intelligence (AI) that develops computational systems that learn from experience. In supervised ML, the ML system generalizes from labelled examples to learn a model that can predict the labels of unseen examples. Examples are generally represented using features that directly describe the examples. For instance, in drug design, ML uses features that describe molecular shape and so on. In cases where there are multiple related ML problems, it is possible to use a different type of feature: predictions made about the examples by ML models learned on other problems. We call this transformational ML. We show that this results in better predictions and improved understanding when applied to scientific problems. Almost all machine learning (ML) is based on representing examples using intrinsic features. When there are multiple related ML problems (tasks), it is possible to transform these features into extrinsic features by first training ML models on other tasks and letting them each make predictions for each example of the new task, yielding a novel representation. We call this transformational ML (TML). TML is very closely related to, and synergistic with, transfer learning, multitask learning, and stacking. TML is applicable to improving any nonlinear ML method. We tested TML using the most important classes of nonlinear ML: random forests, gradient boosting machines, support vector machines, k-nearest neighbors, and neural networks. To ensure the generality and robustness of the evaluation, we utilized thousands of ML problems from three scientific domains: drug design, predicting gene expression, and ML algorithm selection. We found that TML significantly improved the predictive performance of all the ML methods in all the domains (4 to 50% average improvements) and that TML features generally outperformed intrinsic features. Use of TML also enhances scientific understanding through explainable ML. In drug design, we found that TML provided insight into drug target specificity, the relationships between drugs, and the relationships between target proteins. TML leads to an ecosystem-based approach to ML, where new tasks, examples, predictions, and so on synergistically interact to improve performance. To contribute to this ecosystem, all our data, code, and our ∼50,000 ML models have been fully annotated with metadata, linked, and openly published using Findability, Accessibility, Interoperability, and Reusability principles (∼100 Gbytes).","",""
0,"Jaehun Kim","Increasing trust in complex machine learning systems",2021,"","","","",113,"2022-07-13 09:22:24","","10.1145/3476415.3476435","","",,,,,0,0.00,0,1,1,"Machine learning (ML) has become a core technology for many real-world applications. Modern ML models are applied to unprecedentedly complex and difficult challenges, including very large and subjective problems. For instance, applications towards multimedia understanding have been advanced substantially. Here, it is already prevalent that cultural/artistic objects such as music and videos are analyzed and served to users according to their preference, enabled through ML techniques. One of the most recent breakthroughs in ML is Deep Learning (DL), which has been immensely adopted to tackle such complex problems. DL allows for higher learning capacity, making end-to-end learning possible, which reduces the need for substantial engineering effort, while achieving high effectiveness. At the same time, this also makes DL models more complex than conventional ML models. Reports in several domains indicate that such more complex ML models may have potentially critical hidden problems: various biases embedded in the training data can emerge in the prediction, extremely sensitive models can make unaccountable mistakes. Furthermore, the black-box nature of the DL models hinders the interpretation of the mechanisms behind them. Such unexpected drawbacks result in a significant impact on the trustworthiness of the systems in which the ML models are equipped as the core apparatus. In this thesis, a series of studies investigates aspects of trustworthiness for complex ML applications, namely the reliability and explainability. Specifically, we focus on music as the primary domain of interest, considering its complexity and subjectivity. Due to this nature of music, ML models for music are necessarily complex for achieving meaningful effectiveness. As such, the reliability and explainability of music ML models are crucial in the field. The first main chapter of the thesis investigates the transferability of the neural network in the Music Information Retrieval (MIR) context. Transfer learning, where the pre-trained ML models are used as off-the-shelf modules for the task at hand, has become one of the major ML practices. It is helpful since a substantial amount of the information is already encoded in the pre-trained models, which allows the model to achieve high effectiveness even when the amount of the dataset for the current task is scarce. However, this may not always be true if the ""source"" task which pre-trained the model shares little commonality with the ""target"" task at hand. An experiment including multiple ""source"" tasks and ""target"" tasks was conducted to examine the conditions which have a positive effect on the transferability. The result of the experiment suggests that the number of source tasks is a major factor of transferability. Simultaneously, it is less evident that there is a single source task that is universally effective on multiple target tasks. Overall, we conclude that considering multiple pre-trained models or pre-training a model employing heterogeneous source tasks can increase the chance for successful transfer learning. The second major work investigates the robustness of the DL models in the transfer learning context. The hypothesis is that the DL models can be susceptible to imperceptible noise on the input. This may drastically shift the analysis of similarity among inputs, which is undesirable for tasks such as information retrieval. Several DL models pre-trained in MIR tasks are examined for a set of plausible perturbations in a real-world setup. Based on a proposed sensitivity measure, the experimental results indicate that all the DL models were substantially vulnerable to perturbations, compared to a traditional feature encoder. They also suggest that the experimental framework can be used to test the pre-trained DL models for measuring robustness. In the final main chapter, the explainability of black-box ML models is discussed. In particular, the chapter focuses on the evaluation of the explanation derived from model-agnostic explanation methods. With black-box ML models having become common practice, model-agnostic explanation methods have been developed to explain a prediction. However, the evaluation of such explanations is still an open problem. The work introduces an evaluation framework that measures the quality of the explanations employing fidelity and complexity. Fidelity refers to the explained mechanism's coherence to the black-box model, while complexity is the length of the explanation. Throughout the thesis, we gave special attention to the experimental design, such that robust conclusions can be reached. Furthermore, we focused on delivering machine learning framework and evaluation frameworks. This is crucial, as we intend that the experimental design and results will be reusable in general ML practice. As it implies, we also aim our findings to be applicable beyond the music applications such as computer vision or natural language processing. Trustworthiness in ML is not a domain-specific problem. Thus, it is vital for both researchers and practitioners from diverse problem spaces to increase awareness of complex ML systems' trustworthiness. We believe the research reported in this thesis provides meaningful stepping stones towards the trustworthiness of ML.","",""
0,"Wenxiu Xie, Christine Ji, Tianyong Hao, Chi-Yin Chow","Predicting the Easiness and Complexity of English Health Materials for International Tertiary Students With Linguistically Enhanced Machine Learning Algorithms: Development and Validation Study (Preprint)",2021,"","","","",114,"2022-07-13 09:22:24","","10.2196/preprints.25110","","",,,,,0,0.00,0,4,1,"  BACKGROUND  There is an increasing body of research on the development of machine learning algorithms in the evaluation of online health educational resources for specific readerships. Machine learning algorithms are known for their lack of interpretability compared with statistics. Given their high predictive precision, improving the interpretability of these algorithms can help increase their applicability and replicability in health educational research and applied linguistics, as well as in the development and review of new health education resources for effective and accessible health education.      OBJECTIVE  Our study aimed to develop a linguistically enriched machine learning model to predict binary outcomes of online English health educational resources in terms of their easiness and complexity for international tertiary students.      METHODS  Logistic regression emerged as the best performing algorithm compared with support vector machine (SVM) (linear), SVM (radial basis function), random forest, and extreme gradient boosting on the transformed data set using L2 normalization. We applied recursive feature elimination with SVM to perform automatic feature selection. The automatically selected features (n=67) were then further streamlined through expert review. The finalized feature set of 22 semantic features achieved a similar area under the curve, sensitivity, specificity, and accuracy compared with the initial (n=115) and automatically selected feature sets (n=67). Logistic regression with the linguistically enhanced feature set (n=22) exhibited important stability and robustness on the training data of different sizes (20%, 40%, 60%, and 80%), and showed consistently high performance when compared with the other 4 algorithms (SVM [linear], SVM [radial basis function], random forest, and extreme gradient boosting).      RESULTS  We identified semantic features (with positive regression coefficients) contributing to the prediction of easy-to-understand online health texts and semantic features (with negative regression coefficients) contributing to the prediction of hard-to-understand health materials for readers with nonnative English backgrounds. Language complexity was explained by lexical difficulty (rarity and medical terminology), verbs typical of medical discourse, and syntactic complexity. Language easiness of online health materials was associated with features such as common speech act verbs, personal pronouns, and familiar reasoning verbs. Successive permutation of features illustrated the interaction between these features and their impact on key performance indicators of the machine learning algorithms.      CONCLUSIONS  The new logistic regression model developed exhibited consistency, scalability, and, more importantly, interpretability based on existing health and linguistic research. It was found that low and high linguistic accessibilities of online health materials were explained by 2 sets of distinct semantic features. This revealed the inherent complexity of effective health communication beyond current readability analyses, which were limited to syntactic complexity and lexical difficulty. ","",""
0,"Elizaveta Felsche, R. Ludwig","Applying machine learning for drought prediction using a large ensemble of climate simulations",2021,"","","","",115,"2022-07-13 09:22:24","","10.5194/EGUSPHERE-EGU21-1305","","",,,,,0,0.00,0,2,1,"<p>There is strong scientific and social interest to understand the factors leading to extreme events in order to improve the management of risks associated with hazards like droughts. Recent events like the summer 2018 drought in Germany already had severe und unexpected impacts, e.g. forest fires and crop failures; in order to increase preparedness robust prediction tools are &#160;urgently required. In this study, machine learning methods are applied to predict the occurrence of a drought with lead times of one to three months. The approach takes into account a list of thirty atmospheric and soil variables<strong> </strong>as predictor input parameters from a single regional climate model initial condition large ensemble (CRCM5-LE). The data was produced the context of the ClimEx project by Ouranos with the Canadian Regional Climate Model (CRCM5) driven by 50 members of the Canadian Earth System Model (CanESM2) for the Bavarian and Quebec domains.</p><p>Drought occurrence was defined using the Standardized Precipitation Index. The training and test datasets were chosen from the current climatology (1955-2005) for the Munich and Lisbon subdomain within the CRCM5-LE. The best performing machine learning algorithms managed to obtain a correct classification of drought or no drought for a lead time of one month for around 60 % of the events of each class for the both domains. Explainable AI methods like feature importance and shapley values were applied to gain a better understanding of the trained algorithms. Physical variables like the North Atlantic Oscillation Index and air pressure one month before the event proved to be of high importance for the prediction. The study showed that better accuracies can be obtained for the Lisbon domain, due to the stronger influence of the North Atlantic Oscillation Index on Portugal&#8217;s climate.</p>","",""
0,"A. Nair, F. Yu, P. C. Jost, P. DeMott, E. Levin, J. Jimenez, J. Peischl, I. Pollack, C. Fredrickson, A. Beyersdorf, B. Nault, Minsu Park, S. Yum, B. Palm, Lu Xu, I. Bourgeois, B. Anderson, A. Nenes, L. Ziemba, R. Moore, Taehyoung Lee, T. Park, C. Thompson, F. Flocke, L. Huey, Michelle J. Kim, Q. Peng","Machine learning uncovers aerosol size information from chemistry and meteorology to quantify potential cloud-forming particles",2021,"","","","",116,"2022-07-13 09:22:24","","10.21203/rs.3.rs-244416/v1","","",,,,,0,0.00,0,27,1,"  Cloud condensation nuclei (CCN) are mediators of aerosol–cloud interactions, which contribute to the largest uncertainty in climate change prediction. Here, we present a machine learning/artificial intelligence model that quantifies CCN from variables of aerosol composition, atmospheric trace gases, and meteorology. Comprehensive multi-campaign airborne measurements, covering varied physicochemical regimes in the troposphere, confirm the validity of and help probe the inner workings of this machine learning model: revealing for the first time that different ranges of atmospheric aerosol composition and mass correspond to distinct aerosol number size distributions. Machine learning extracts this information, important for accurate quantification of CCN, additionally from both chemistry and meteorology. This can provide a physicochemically explainable, computationally efficient, robust machine learning pathway in global climate models that only resolve aerosol composition; potentially mitigating the uncertainty of effective radiative forcing due to aerosol–cloud interactions (ERFaci) and improving confidence in assessment of anthropogenic contributions and climate change projections.","",""
0,"G. Truda","Quantified Sleep: Machine learning techniques for observational n-of-1 studies",2021,"","","","",117,"2022-07-13 09:22:24","","","","",,,,,0,0.00,0,1,1,"This paper applies statistical learning techniques to an observational Quantified-Self (QS) study to build a descriptive model of sleep quality. A total of 472 days of my sleep data was collected with an Oura ring. This was combined with a variety of lifestyle, environmental, and psychological data, harvested from multiple sensors and manual logs. Such n-of-1 QS projects pose a number of specific challenges: heterogeneous data sources with many missing values; few observations and many features; dynamic feedback loops; and human biases. This paper directly addresses these challenges with an end-to-end QS pipeline for observational studies that combines techniques from statistics and machine learning to produce robust descriptive models. Sleep quality is one of the most difficult modelling targets in QS research, due to high noise and a large number of weakly-contributing factors. Sleep quality was selected so that approaches from this paper would generalise to most other n-of-1 QS projects. Techniques are presented for combining and engineering features for the different classes of data types, sample frequencies, and schema. This includes manually-tracked event logs and automatically-sampled weather and geo-spatial data. Relevant statistical analyses for outliers, normality, (auto)correlation, stationarity, and missing data are detailed, along with a proposed method for hierarchical clustering to identify correlated groups of features. The missing data was overcome using a combination of knowledge-based and statistical techniques, including several multivariate imputation algorithms. “Markov unfolding” is presented for collapsing the time series into a collection of independent observations, whilst incorporating historical information. The final model was interpreted in two key ways: by inspecting the internal β-parameters, and using the SHAP framework, which can explain any “black box” model. These two interpretation techniques were combined to produce a list of the 16 most-predictive features, demonstrating that an observational study can greatly narrow down the number of features that need to be considered when designing interventional QS studies.","",""
0,"Safa Omri, C. Sinz","Machine Learning Techniques for Software Quality Assurance: A Survey",2021,"","","","",118,"2022-07-13 09:22:24","","","","",,,,,0,0.00,0,2,1,"Over the last years, machine learning techniques have been applied to more and more application domains, including software engineering and, especially, software quality assurance. Important application domains have been, e.g., software defect prediction or test case selection and prioritization. The ability to predict which components in a large software system are most likely to contain the largest numbers of faults in the next release helps to better manage projects, including early estimation of possible release delays, and affordably guide corrective actions to improve the quality of the software. However, developing robust fault prediction models is a challenging task and many techniques have been proposed in the literature. Closely related to estimating defect-prone parts of a software system is the question of how to select and prioritize test cases, and indeed test case prioritization has been extensively researched as a means for reducing the time taken to discover regressions in software. In this survey, we discuss various approaches in both fault prediction and test case prioritization, also explaining how in recent studies deep learning algorithms for fault prediction help to bridge the gap between programs’ semantics and fault prediction features. We also review recently proposed machine learning methods for test case prioritization (TCP), and their ability to reduce the cost of regression testing without negatively affecting fault detection capabilities.","",""
0,"Bernhard Kühn, Marc H. Taylor, A. Kempf","Using machine learning to link spatiotemporal information to biological processes in the ocean: a case study for North Sea cod recruitment",2021,"","","","",119,"2022-07-13 09:22:24","","10.3354/MEPS13689","","",,,,,0,0.00,0,3,1,"Marine organisms are subject to environmental variability on various temporal and spatial scales, which affect processes related to growth and mortality of different life stages. Marine scientists are often faced with the challenge of identifying environmental variables that best explain these processes, which, given the complexity of the interactions, can be like searching for a needle in the proverbial haystack. Even after initial hypothesisbased variable selection, a large number of potential candidate variables can remain if different lagged and seasonal influences are considered. To tackle this problem, we propose a machine learning framework that incorporates important steps in model building, ranging from environmental signal extraction to automated variable selection and model validation. Its modular structure allows for the inclusion of both parametric and machine learning models, like random forest. Unsupervised feature extractions via empirical orthogonal functions (EOFs) or self-organising maps (SOMs) are demonstrated as a way to summarize spatiotemporal fields for inclusion in predictive models. The proposed framework offers a robust way to reduce model complexity through a multi-objective genetic algorithm (NSGAII) combined with rigorous cross-validation. We ap plied the framework to recruitment of the North Sea cod stock and investigated the effects of sea surface temperature (SST), salinity and currents on the stock via a modified version of random forest. The best model (5-fold CV r2 = 0.69) incorporated spawning stock biomass and EOF-derived time series of SST and salinity anomalies acting through different seasons, likely relating to differing environmental effects on specific life-history stages during the recruitment year. OPEN ACCESS Linking spatiotemporal information to North Sea cod recruitment via machine learning. Image: B. Kühn, M. Taylor; Gears from https:// commons. wikimedia.org/wiki/File:Gear_7.svg (CC-BY-SA license)","",""
