Cites,Authors,Title,Year,Source,Publisher,ArticleURL,CitesURL,GSRank,QueryDate,Type,DOI,ISSN,CitationURL,Volume,Issue,StartPage,EndPage,ECC,CitesPerYear,CitesPerAuthor,AuthorCount,Age,Abstract,FullTextURL,RelatedURL
142,"Kaihua Zhang, Lei Zhang, Ming-Hsuan Yang, David Zhang","Fast Tracking via Spatio-Temporal Context Learning",2013,"","","","",46,"2022-07-13 09:23:47","","","","",,,,,142,15.78,36,4,9,"In this paper, we present a simple yet fast and robust algorithm which exploits the spatio-temporal context for visual tracking. Our approach formulates the spatio-temporal relationships between the object of interest and its local context based on a Bayesian framework, which models the statistical correlation between the low-level features (i.e., image intensity and position) from the target and its surrounding regions. The tracking problem is posed by computing a confidence map, and obtaining the best target location by maximizing an object location likelihood function. The Fast Fourier Transform is adopted for fast learning and detection in this work. Implemented in MATLAB without code optimization, the proposed tracker runs at 350 frames per second on an i7 machine. Extensive experimental results show that the proposed algorithm performs favorably against state-of-the-art methods in terms of efficiency, accuracy and robustness.","",""
0,"Iwao Maeda","Importance of Uncertainty Estimation in Deep Learning",2019,"","","","",47,"2022-07-13 09:23:47","","","","",,,,,0,0.00,0,1,3,"In recent years, predictions by machine learning and deep learning methods are utilized in various scenes of society. A model trained with deep learning methods can predict the target with high accuracy, but can not consider the predictive confidence sufficiently, and may predict high confident for extrapolated data which is hard to predict. In this study, we applied ordinary deep learning methods and methods considering predictive uncertainty, proposed in recent years, to an image classification task, and verified the robustness of trained models against extrapolated data. Models trained with the ordinary deep learning methods predicted high confidence values for data having characteristics not existing in the training data, but models trained with the methods considering uncertainty predicted low confidence values for such data. By using methods considering uncertainty, it is possible to avoid mispredictions for extrapolated data. Experimental results suggest the importance of uncertainty estimation in deep learning.","",""
6,"C. Billovits","Hitting Depth : Investigating Robustness to Adversarial Examples in Deep Convolutional Neural Networks",2016,"","","","",48,"2022-07-13 09:23:47","","","","",,,,,6,1.00,6,1,6,"Machine learning models, including Convolutional Neural Networks (CNN) are susceptible to adversarial examples input images that have been perturbed to deliberately fool a model into an incorrect, high-confidence prediction without a visually perceptible change. Previous work shows that high-dimensional linearities cause these adversarial pockets of space. We first validate assumptions about the generalization of gradient-based and pattern-based adversarial examples using VGGNet. We show a process for visualizing and identifying changes in activations between adversarial images and their regular counterparts. Finally, we leverage information from these two approaches in a novel Bayesian framework to increase l2 robustness to adversarial examples. Using this framework, we successfully improve the prediction accuracy on adversarial examples.","",""
28,"Qinglong Wang, Wenbo Guo, Kaixuan Zhang, Alexander Ororbia, Xinyu Xing, C. Lee Giles, Xue Liu","Learning Adversary-Resistant Deep Neural Networks",2016,"","","","",49,"2022-07-13 09:23:47","","","","",,,,,28,4.67,4,7,6,"Deep neural networks (DNNs) have proven to be quite effective in a vast array of machine learning tasks, with recent examples in cyber security and autonomous vehicles. Despite the superior performance of DNNs in these applications, it has been recently shown that these models are susceptible to a particular type of attack that exploits a fundamental flaw in their design. This attack consists of generating particular synthetic examples referred to as adversarial samples. These samples are constructed by slightly manipulating real data-points in order to ""fool"" the original DNN model, forcing it to mis-classify previously correctly classified samples with high confidence. Addressing this flaw in the model is essential if DNNs are to be used in critical applications such as those in cyber security.  Previous work has provided various learning algorithms to enhance the robustness of DNN models, and they all fall into the tactic of ""security through obscurity"". This means security can be guaranteed only if one can obscure the learning algorithms from adversaries. Once the learning technique is disclosed, DNNs protected by these defense mechanisms are still susceptible to adversarial samples. In this work, we investigate this issue shared across previous research work and propose a generic approach to escalate a DNN's resistance to adversarial samples. More specifically, our approach integrates a data transformation module with a DNN, making it robust even if we reveal the underlying learning algorithm. To demonstrate the generality of our proposed approach and its potential for handling cyber security applications, we evaluate our method and several other existing solutions on datasets publicly available. Our results indicate that our approach typically provides superior classification performance and resistance in comparison with state-of-art solutions.","",""
357,"K. Crammer, Alex Kulesza, Mark Dredze","Adaptive regularization of weight vectors",2009,"","","","",50,"2022-07-13 09:23:47","","10.1007/s10994-013-5327-x","","",,,,,357,27.46,119,3,13,"","",""
3,"Zhanbo Chen, Xiaojun Sun, Li Shen","An Effective Tumor Classification With Deep Forest and Self-Training",2021,"","","","",51,"2022-07-13 09:23:47","","10.1109/ACCESS.2021.3096241","","",,,,,3,3.00,1,3,1,"In recent years, tumor classification based on the gene expression omnibus has become a continuous attention field in the area of bioinformatics. Integration machine learning techniques are an efficient methods to solve these problems. Generally, in order to obtain good performance in the supervised learning tasks, a large number of labelled samples will be required. However, in many cases, only a few labelled samples and abundant unlabelled samples exist in the training database. The process of labelling these unlabelled samples manually is difficult and expensive. Therefore, semi-supervised learning approaches have been proposed to utilize unlabelled samples to improve the performance of a model. However, noisy samples decrease the robustness of model in semi-supervised learning. We wish training style that samples can be implemented to train by from high- to low-confidence, self-training can meet this requirement, and the deep forest approach with the hyper-parameter settings used in this work can obtain good accuracy. Therefore, in this paper, we present a novel semi-supervised learning approach with a deep forest model to increase the performance of tumor classification, which employs unlabelled samples and minimizes the cost; that is, a updated unlabelled sample mechanism is investigated to expand the number of high-confidence pseudo-labelled samples. Multiple real-world experiments indicate that our proposed approach can obtain results up 0.96 accuracy and F1-Score, and 0.9798 AUCs.","",""
2,"Domen Vrevs, Marko Robnik vSikonja","Better sampling in explanation methods can prevent dieselgate-like deception",2021,"","","","",52,"2022-07-13 09:23:47","","","","",,,,,2,2.00,1,2,1,"Machine learning models are used in many sensitive areas where, besides predictive accuracy, their comprehensibility is also important. Interpretability of prediction models is necessary to determine their biases and causes of errors and is a prerequisite for users’ confidence. For complex state-of-the-art black-box models, post-hoc model-independent explanation techniques are an established solution. Popular and effective techniques, such as IME, LIME, and SHAP, use perturbation of instance features to explain individual predictions. Recently, Slack et al. (2020) put their robustness into question by showing that their outcomes can be manipulated due to poor perturbation sampling employed. This weakness would allow dieselgate type cheating of owners of sensitive models who could deceive inspection and hide potentially unethical or illegal biases existing in their predictive models. This could undermine public trust in machine learning models and give rise to legal restrictions on their use. We show that better sampling in these explanation methods prevents malicious manipulations. The proposed sampling uses data generators that learn the training set distribution and generate new perturbation instances much more similar to the training set. We show that the improved sampling increases the LIME and SHAP’s robustness, while the previously untested method IME is already the most robust of all.","",""
7,"Min-You Chen, Xuemin Tan, Li Zhang","An iterative self-training support vector machine algorithm in brain-computer interfaces",2016,"","","","",53,"2022-07-13 09:23:47","","10.3233/IDA-150794","","",,,,,7,1.17,2,3,6,"In this paper, an iterative self-training Support Vector Machine (SVM) algorithm combined feature re-extraction is proposed for semi-supervised learning, which only needs a small set of labeled samples to train classifier and is thus very useful in Brain-Computer Interface (BCI) design. Two methods, the model selection based self-training and the confidence criterion, respectively, is also proposed for searching the best parameter pair of SVM and selecting the most useful unlabeled data to expand the labeled training data set. The Dataset IVa of BCI Competition III, is presented to demonstrate the validity of our algorithm with statistical significance test. As an iterative algorithm, experimental results of the proposed algorithm show the validity of re-extracting feature and the robustness of the feature to the noise. In addition, the convergence of the proposed algorithm and the validity of the method measuring the consistency of the feature are also demonstrated in experiments.","",""
1,"ChiChun Zhou, Yizhou Gu, Guanwen Fang, Zesen Lin","Automatic Morphological Classification of Galaxies: Convolutional Autoencoder and Bagging-based Multiclustering Model",2021,"","","","",54,"2022-07-13 09:23:47","","10.3847/1538-3881/ac4245","","",,,,,1,1.00,0,4,1,"In order to obtain morphological information of unlabeled galaxies, we present an unsupervised machine-learning (UML) method for morphological classification of galaxies, which can be summarized as two aspects: (1) the methodology of convolutional autoencoder (CAE) is used to reduce the dimensions and extract features from the imaging data; (2) the bagging-based multiclustering model is proposed to obtain the classifications with high confidence at the cost of rejecting the disputed sources that are inconsistently voted. We apply this method on the sample of galaxies with H < 24.5 in CANDELS. Galaxies are clustered into 100 groups, each contains galaxies with analogous characteristics. To explore the robustness of the morphological classifications, we merge 100 groups into five categories by visual verification, including spheroid, early-type disk, late-type disk, irregular, and unclassifiable. After eliminating the unclassifiable category and the sources with inconsistent voting, the purity of the remaining four subclasses are significantly improved. Massive galaxies (M * > 1010 M ⊙) are selected to investigate the connection with other physical properties. The classification scheme separates galaxies well in the U − V and V − J color space and Gini–M 20 space. The gradual tendency of Sérsic indexes and effective radii is shown from the spheroid subclass to the irregular subclass. It suggests that the combination of CAE and multiclustering strategy is an effective method to cluster galaxies with similar features and can yield high-quality morphological classifications. Our study demonstrates the feasibility of UML in morphological analysis that would develop and serve the future observations made with China Space Station telescope.","",""
1,"M. Vowels, S. Akbari, Jalal Etesami, N. C. Camgoz, R. Bowden","A Free Lunch with Influence Functions? Improving Neural Network Estimates with Concepts from Semiparametric Statistics",2022,"","","","",55,"2022-07-13 09:23:47","","","","",,,,,1,1.00,0,5,1,"Parameter estimation in the empirical fields is usually undertaken using parametric models, and such models are convenient because they readily facilitate statistical inference. Unfortunately, they are unlikely to have a sufficiently flexible functional form to be able to adequately model realworld phenomena, and their usage may therefore result in biased estimates and invalid inference. Unfortunately, whilst non-parametric machine learning models may provide the needed flexibility to adapt to the complexity of realworld phenomena, they do not readily facilitate statistical inference, and may still exhibit residual bias. We explore the potential for semiparametric theory (in particular, the Influence Function) to be used to improve neural networks and machine learning algorithms in terms of (a) improving initial estimates without needing more data (b) increasing the robustness of our models, and (c) yielding confidence intervals for statistical inference. We propose a new neural network method ‘MultiNet’, which seeks the flexibility and diversity of an ensemble using a single architecture. Results on causal inference tasks indicate that MultiNet yields better performance than other approaches, and that all considered methods are amenable to improvement from semiparametric techniques under certain conditions. In other words, with these techniques we show that we can improve existing neural networks for ‘free’, without needing more data, and without needing to retrain them. Finally, we provide the expression for deriving influence functions for estimands from a general graph, and the code to do so automatically.","",""
1,"A. Avati, Martin G. Seneviratne, Emily Xue, Zhen Xu, Balaji Lakshminarayanan, Andrew M. Dai","BEDS-Bench: Behavior of EHR-models under Distributional Shift-A Benchmark",2021,"","","","",56,"2022-07-13 09:23:47","","","","",,,,,1,1.00,0,6,1,"Machine learning (ML) has recently demonstrated impressive progress in predictive accuracy across a wide array of tasks. Most ML approaches focus on generalization performance on unseen data that are “similar” to the training data (a.k.a. In-Distribution, or IND). However, real world applications and deployments of ML rarely enjoy the comfort of encountering examples that are always IND. In such situations, most ML models commonly display erratic behavior on Out-of-Distribution (OOD) examples, such as assigning high confidence to wrong predictions, or vice-versa. Implications of such unusual model behavior are further exacerbated in the healthcare setting, where patient health can potentially be put at risk. It is crucial to study the behavior and robustness properties of models under distributional shift, understand common failure modes, and take mitigation steps before the model is deployed. Having a benchmark that shines light upon these aspects of a model is a first and necessary step in addressing the issue. Recent work and interest in increasing model robustness in OOD settings have focused more on image modality, both in terms of methods as well as benchmarks, while the Electronic Health Record (EHR) modality is still largely under-explored. We aim to bridge this gap by releasing BEDS-Bench, a benchmark for quantifying the behavior of ML models over EHR data under OOD settings. We use two open access, de-identified EHR datasets to construct several OOD data settings to run tests on. The benchmark exercises several clinical prediction tasks, OOD data settings, and measures relevant metrics that characterize crucial aspects of a model’s OOD behavior. We evaluate several learning algorithms under BEDS-Bench and find that all of them show poor generalization performance under distributional shift in general. Our results highlight the need and the potential to improve robustness of EHR models under distributional shift, and BEDS-Bench provides one way to measure progress towards that goal. Code to reproduce the results in this paper and evaluate new algorithms against BEDS-Bench is made available at https://github.com/Google-Health/records-research/tree/master/beds-bench. ar X iv :2 10 7. 08 18 9v 1 [ cs .L G ] 1 7 Ju l 2 02 1","",""
0,"Jie Zhao, Lei Wang, H. Ji, Shuangyue Chen, Danping Li","Fuzzy locality preserving projection twin support vector machine for classification",2017,"","","","",57,"2022-07-13 09:23:47","","10.1109/CAC.2017.8243831","","",,,,,0,0.00,0,5,5,"Recursive projection twin support vector machine (PTSVM) and Locality preserving projection twin support vector machine (LPPTSVM) are two extensions of traditional support vector machine (SVM). However, they may lead to a weak classifier in the application where some data points may not be fully assigned to one class. In this paper, we introduce the basic idea of fuzzy membership into LPPTSVM and propose a fuzzy LPPTSVM (FLPPTSVM) algorithm. Through fuzzy weighting technique, input points with different confidence degrees can make different contributions to the learning of decision surface. In this way, FLPPTSVM not only maintains the advantages of LPPTSVM which considers the local geometrical structure of the data and enhances the generalization ability of the algorithm, but also decreases the influence of outliers and noises. We construct experiments on artificial and UCI benchmark datasets and the results show the effectiveness and robustness of the proposed FLPPTSVM method.","",""
0,"Yenan Liu, Xiangqian Zhou, Feng Zhang, Li Zhao, Mengyang Zhang","Optimized Radial Basis Function Network Based on Beetle Antenna Search for Indoor Localization Algorithm",2021,"","","","",58,"2022-07-13 09:23:47","","10.1109/icicn52636.2021.9673902","","",,,,,0,0.00,0,5,1,"In order to improve the accuracy and robustness of Bluetooth indoor localization, an improved fusion hybrid filter and radial basis function neural network (RBFNN) indoor localization method is proposed, which effectively improves the accuracy of received signal strength (RSS) by combining various filtering algorithms, and introduces a radial basis neural network in machine learning algorithm to map the nonlinear relationship between RSS and anchor node to signal receiver localization. RBFNN is optimized using the algorithm of beetle antenna search to further improve the stability of localization. An experimental platform based on NRF52810 and a smart phone is built to verify the proposed method. Theoretical analysis and experimental results show that the average positioning error of the proposed method is 0. 63m, the confidence probability of less than lm is 75%, and the confidence probability of less than 2m is 96%. It can effectively reduce the positioning error and improve the positioning accuracy, and is easy deploy, which has high application value.","",""
0,"Ziyu Yao, Jiaquan Gao","Adversarial Example Defense Based on the Supervision",2021,"","","","",59,"2022-07-13 09:23:47","","10.1109/IJCNN52387.2021.9533561","","",,,,,0,0.00,0,2,1,"In recent years, deep learning has developed rapidly and has shown great performance on many challenging machine learning tasks, such as image classification, natural language processing, and speech recognition. However, researchers have recently discovered that deep learning models have security risks and are easily affected by adversarial examples. The adversarial example is a sample formed by deliberately adding subtle perturbation that is invisible to the human in the dataset. It can make the classification classify incorrectly with a high degree of confidence, which poses more challenges for deep learning research. In this paper, we propose a defense model based on the supervision mechanism. The model adds supervision layers to the original convolutional neural network and improves the robustness and defense ability of the model by improving the loss function. The LeNet-5 and VGG networks are used as the original network models. The experimental results on MNIST and CIFAR-10 confirm that the method proposed in this paper will effectively increase the difficulty of the attackers.","",""
0,"Weizhong Yan, Zhaoyuan Yang, Jianwei Qiu","On Adversarial Vulnerability of PHM algorithms: An Initial Study",2021,"","","","",60,"2022-07-13 09:23:47","","10.36001/phmconf.2021.v13i1.3057","","",,,,,0,0.00,0,3,1,"In almost all PHM applications, driving highest possible performance (prediction accuracy and robustness) of PHM models (fault detection, fault diagnosis and prognostics) has been the top development priority, since PHM models’ performance directly impacts how much business value the PHM models can bring. However, recent research work in other domains, e.g., computer vision (CV), has shown that machine learning (ML) models, especially deep learning models, are vulnerable to adversarial attacks; that is, small deliberately-designed perturbations to the original samples can cause the model to make false predictions with high confidence. In fact, adversarial machine learning (AML) targeting security of ML algorithms against adversaries, has become an emerging ML topic and has attracted tremendous research attention in CV and NLP.     Yet, in the PHM community, not much attention has been paid to adversarial vulnerability or security of PHM models. We contend that the economic impact of adversarial attacks to a PHM model might be even bigger than that to hard perceptual problems and thus securing PHM models from adversarial attacks is as important as the PHM models themselves. Also, PHM models, since the data used by the models are primarily time-series sensor measurements, have their own unique characteristics and deserve special attention in securing them.       In this paper we attempt to explore the adversarial vulnerability of PHM models by conducting an initial case study. More specifically, we consider several unique characteristics associated with streaming time-series sensor measurements data in developing attack strategies for attacking PHM models. We hope our initial study here can shed some light on and stimulate more research interests in the area of PHM models’ security.","",""
0,"Tianyu Pang, Huishuai Zhang, Di He, Yinpeng Dong, Hang Su, Wei Chen, Jun Zhu, Tie-Yan Liu","Two Coupled Rejection Metrics Can Tell Adversarial Examples Apart",2021,"","","","",61,"2022-07-13 09:23:47","","","","",,,,,0,0.00,0,8,1,"Correctly classifying adversarial examples is an essential but challenging requirement for safely deploying machine learning models. As reported in RobustBench, even the state-of-the-art adversarially trained models struggle to exceed 67% robust test accuracy on CIFAR-10, which is far from practical. A complementary way towards robustness is to introduce a rejection option, allowing the model to not return predictions on uncertain inputs, where conﬁdence is a commonly used certainty proxy. Along with this routine, we ﬁnd that conﬁdence and a rectiﬁed conﬁdence (R-Con) can form two coupled rejection metrics, which could provably distinguish wrongly classiﬁed inputs from correctly classiﬁed ones. This intriguing property sheds light on using coupling strategies to better detect and reject adversarial examples. We evaluate our rectiﬁed rejection (RR) module on CIFAR-10, CIFAR-10-C, and CIFAR-100 under several attacks including adaptive ones, and demonstrate that the RR module is compatible with different adversarial training frameworks on improving robustness, with little extra computation.","",""
0,"Erick Galinkin","Who's Afraid of Thomas Bayes?",2021,"","","","",62,"2022-07-13 09:23:47","","","","",,,,,0,0.00,0,1,1,"In many cases, neural networks perform well on test data, but tend to overestimate their confidence on out-of-distribution data. This has led to adoption of Bayesian neural networks, which better capture uncertainty and therefore more accurately reflect the model’s confidence. For machine learning security researchers, this raises the natural question of how making a model Bayesian affects the security of the model. In this work, we explore the interplay between Bayesianism and two measures of security: model privacy and adversarial robustness. We demonstrate that Bayesian neural networks are more vulnerable to membership inference attacks in general, but are at least as robust as their non-Bayesian counterparts to adversarial examples.","",""
