Cites,Authors,Title,Year,Source,Publisher,ArticleURL,CitesURL,GSRank,QueryDate,Type,DOI,ISSN,CitationURL,Volume,Issue,StartPage,EndPage,ECC,CitesPerYear,CitesPerAuthor,AuthorCount,Age,Abstract,FullTextURL,RelatedURL
3,"F. Lécué, B. Abeloos, Jonathan Anctil, Manuel Bergeron, Damien Dalla-Rosa, Simon Corbeil-Letourneau, Florian Martet, Tanguy Pommellet, L. Salvan, Simon Veilleux, M. Ziaeefard","Thales XAI Platform: Adaptable Explanation of Machine Learning Systems - A Knowledge Graphs Perspective",2019,"","","","",148,"2022-07-13 09:23:47","","","","",,,,,3,1.00,0,11,3,"Explanation in Machine Learning systems has been identified to be the main asset to have for large scale deployment of Artificial Intelligence (AI) in critical systems. Explanations could be example-, features-, semantics-based or even counterfactual to potentially action on an AI system; they could be represented in many different ways e.g., textual, graphical, or visual. All representations serve different means, purpose and operators. We built the first-of-its-kind XAI (eXplainable AI) platform for critical systems i.e., Thales XAI Platform which aims at serving explanations through various forms. This paper emphasizes on the semantics-based explanations for Machine Learning systems. 1 Explainable AI in Critical Systems Motivation: The current hype of Artificial Intelligence (AI) mostly refers to the success of Machine Learning (ML) and its sub-domain of deep learning. However industries operating with critical systems are either highly regulated, or require high level of certification and robustness. Therefore, such industry constraints do limit the adoption of non deterministic and ML systems. Answers to the question of explainability will be intrinsically connected to the adoption of AI in industry at scale. Indeed explanation, which could be used for debugging intelligent systems or deciding to follow a recommendation in real-time, will increase acceptance and (business) user trust. Explainable AI (XAI) is now referring to the core backup for industry to apply AI in products at scale, particularly for industries operating with critical systems. Focus: Thales XAI Platform is designed to provide explanation for a ML task (classification, regression, object detection, segmentation). Although Thales XAI Platform does provide different levels of explanation e.g., example-based, featuresbased, counterfactual using textual and visual representations, we emphasis only on the semantics-based explanation through knowledge graphs. ? Copyright c © 2019 for this paper by its authors. Use permitted under Creative Commons License Attribution 4.0 International (CC BY 4.0). Critical Applications: From adapting a plane trajectory, stopping a train, refitting a boat to reconfiguring a satellite, all are examples of critical situations where explanation is a must-to-have to follow an AI system decision. 2 Why Knowledge Graphs for Explainable AI? State-of-the-Art Limitations: Most approaches limits explanation of ML systems to features involved in the data and model, or at best to examples, prototypes or counterfactuals. Explanation should go beyond correlation (features importance) and numerical similarity (local explanation). Opportunity: By expanding and linking initial (training, validation and test) data with entities in knowledge graphs, (i) context is encoded, (ii) connections and relations are exposed, and (iii) inference and causation are natively supported. Knowledge graphs are used for encoding better representation of data, structuring a ML model in a more interpretable way, and adopt a semantic similarity for local (instance-based) and global (model-based) explanation. 3 Thales XAI Platform: A Knowledge Graph Perspective (Semantic) Perspective: The platform is combining ML and reasoning functionalities to expose a human-like rational as explanation when (i) recognizing an object (in a raw image) of any class in a knowledge graph, (ii) predicting a link in a knowledge graph. Thales XAI Platform is using state-of-the-art Semantic Web tools for enriching input, output (class) data with DBpedia (4, 233, 000 resources) and domain-specific knowledge graphs, usually enterprise knowledge graphs. This is a crucial step for contextualizing training, validation, test data. Explainable ML Classifications: Starting from raw images, as unstructured data, but with class labels augmented with a domain knowledge graph, Thales XAI Platform relies on existing neural network architectures to build the most appropriate models. All confidence scores of output classes on any input image are updated based on the semantic description of the output classes. For instance, an input classified as a car will have a higher overall confidence score in case some properties of car in the knowledge graph are retrieved e.g., having wheels, being on a road. In addition the platform is embedding naturally explanation i.e., properties of the objects retrieved in both the raw data and knowledge graph. Explainable Relational Learning: Starting from relational data, structured as graph, and augmented with a domain knowledge graph, Thales XAI Platform relies on existing knowledge graph embeddings frameworks to build the most appropriate models. Explanation of any link prediction is retrieved by identifying representative hotspots in the knowledge graph i.e., connected parts of the graphs that negatively impact prediction accuracy when removed.","",""
3,"Yuanyuan Pu, D. Apel, Jie Chen, Chong Wei","A Gaussian process machine learning model for cemented rockfill strength prediction at a diamond mine",2019,"","","","",149,"2022-07-13 09:23:47","","10.1007/s00521-019-04517-x","","",,,,,3,1.00,1,4,3,"","",""
3,"Haoyu Yang, Wen Chen, P. Pathak, Frank Gennari, Ya-Chieh Lai, Bei Yu","Automatic Layout Generation with Applications in Machine Learning Engine Evaluation",2019,"","","","",150,"2022-07-13 09:23:47","","10.1109/MLCAD48534.2019.9142121","","",,,,,3,1.00,1,6,3,"Machine learning-based lithography hotspot detection has been deeply studied recently, from varies feature extraction techniques to efficient learning models. It has been observed that such machine learning-based frameworks are providing satisfactory metal layer hotspot prediction results on known public metal layer benchmarks. In this work, we seek to evaluate how these machine learning-based hotspot detectors generalize to complicated patterns. We first introduce a automatic layout generation tool that can synthesize varies layout patterns given a set of design rules. The tool currently supports both metal layer and via layer generation. As a case study, we conduct hotspot detection on the generated via layer layouts with representative machine learning-based hotspot detectors, which shows that continuous study on model robustness and generality is necessary to prototype and integrate the learning engines in DFM flows. The source code of the layout generation tool will be available at https://github.com/phdyang007/layout-generation.","",""
6,"A. Soni, Dharamvir Dharmacharya, A. Pal, V. Srivastava, R. Shaw, Ankush Ghosh","Design of a Machine Learning-Based Self-driving Car",2021,"","","","",151,"2022-07-13 09:23:47","","10.1007/978-981-16-0598-7_11","","",,,,,6,6.00,1,6,1,"","",""
879,"Tyler Martin","Interpretable Machine Learning",2019,"","","","",152,"2022-07-13 09:23:47","","","","",,,,,879,293.00,879,1,3,"Interpretable machine learning has become a popular research direction as deep neural networks (DNNs) have become more powerful and their applications more mainstream, yet DNNs remain difficult to understand. Testing with Concept Activation Vectors, TCAV, (Kim et al. 2017) is an approach to interpreting DNNs in a human-friendly way and has recently received significant attention in the machine learning community. The TCAV algorithm achieves a degree of global interpretability for DNNs through human-defined concepts as explanations. This project introduces Robust TCAV, which builds on TCAV and experimentally determines best practices for this method. The objectives for Robust TCAV are 1) Making TCAV more consistent by reducing variance in the TCAV score distribution and 2) Increasing CAV and TCAV score resistance to perturbations. A difference of means method for CAV generation was determined to be the best practice to achieve both objectives. Many areas of the TCAV process are explored including CAV visualization in low dimensions, negative class selection, and activation perturbation in the direction of a CAV. Finally, a thresholding technique is considered to remove noise in TCAV scores. This project is a step in the direction of making TCAV, an already impactful algorithm in interpretability, more reliable and useful for practitioners.","",""
0,"M. Little","Nonparametric Bayesian machine learning and signal processing",2019,"","","","",153,"2022-07-13 09:23:47","","10.1093/oso/9780198714934.003.0010","","",,,,,0,0.00,0,1,3,"We have seen that stochastic processes play an important foundational role in a wide range of methods in DSP. For example, we treat a discrete-time signal as a Gaussian process, and thereby obtain many mathematically simplified algorithms, particularly based on the power spectral density. At the same time, in machine learning, it has generally been observed that nonparametric methods outperform parametric methods in terms of predictive accuracy since they can adapt to data with arbitrary complexity. However, these techniques are not Bayesian so we are unable to do important inferential procedures such as draw samples from the underlying probabilistic model or compute posterior confidence intervals. But, Bayesian models are often only mathematically tractable if parametric, with the corresponding loss of predictive accuracy. An alternative, discussed in this section, is to extend the mathematical tractability of stochastic processes to Bayesian methods. This leads to so-called Bayesian nonparametrics exemplified by techniques such as Gaussian process regression and Dirichlet process mixture modelling that have been shown to be extremely useful in practical DSP and machine learning applications.","",""
3,"R. Brummelhuis, Zhongmin Luo","Bank Net Interest Margin Forecasting and Capital Adequacy Stress Testing by Machine Learning Techniques",2019,"","","","",154,"2022-07-13 09:23:47","","10.2139/ssrn.3282408","","",,,,,3,1.00,2,2,3,"The 2007-09 financial crisis revealed that the investors in the financial market were more concerned about the future as opposed to the current capital adequacy for banks. Stress testing promises to complement the regulatory capital adequacy regimes, which assess a bank's current capital adequacy, with the ability to assess its future capital adequacy based on the projected asset-losses and incomes from the forecasting models from regulators and banks. The effectiveness of stress-test rests on its ability to inform the financial market, which depends on whether or not the market has confidence in the model-projected asset-losses and incomes for banks. Post-crisis studies found that the stress-test results are uninformative and receive insignificant market reactions; others question its validity on the grounds of the poor forecast accuracy using linear regression models which forecast the banking-industry incomes measured by Aggregate Net Interest Margin. Instead, our study focuses on NIM forecasting at an individual bank's level and employs both linear regression and non-linear Machine Learning techniques. First, we present both the linear and non-linear Machine Learning regression techniques used in our study. Then, based on out-of-sample tests and literature-recommended forecasting techniques, we compare the NIM forecast accuracy by 162 models based on 11 different regression techniques, finding that some Machine Learning techniques as well as some linear ones can achieve significantly higher accuracy than the random-walk benchmark, which invalidates the grounds used by the literature to challenge the validity of stress-test. Last, our results from forecast accuracy comparisons are either consistent with or complement those from existing forecasting literature. We believe that the paper is the first systematic study on forecasting bank-specific NIM by Machine Learning Techniques; also, it is a first systematic study on forecast accuracy comparison including both linear and non-linear Machine Learning techniques using financial data for a critical real-world problem; it is a multi-step forecasting example involving iterative forecasting, rolling-origins, recalibration with forecast accuracy measure being scale-independent; robust regression proved to be beneficial for forecasting in presence of outliers. It concludes with policy suggestions and future research directions.","",""
3,"D. Priyanka, J. Nayak","Empirical Analysis of Absenteeism at Work Place Using Machine Learning",2019,"","","","",155,"2022-07-13 09:23:47","","10.1007/978-3-030-30271-9_15","","",,,,,3,1.00,2,2,3,"","",""
4,"Alexandra Renouard, A. Maggi, M. Grunberg, C. Doubre, C. Hibert","Toward False Event Detection and Quarry Blast versus Earthquake Discrimination in an Operational Setting Using Semiautomated Machine Learning",2021,"","","","",156,"2022-07-13 09:23:47","","10.1785/0220200305","","",,,,,4,4.00,1,5,1,"  Small-magnitude earthquakes shed light on the spatial and magnitude distribution of natural seismicity, as well as its rate and occurrence, especially in stable continental regions where natural seismicity remains difficult to explain under slow strain-rate conditions. However, capturing them in catalogs is strongly hindered by signal-to-noise ratio issues, resulting in high rates of false and man-made events also being detected. Accurate and robust discrimination of these events is critical for optimally detecting small earthquakes. This requires uncovering recurrent salient features that can rapidly distinguish first false events from real events, then earthquakes from man-made events (mainly quarry blasts), despite high signal variability and noise content. In this study, we combined the complementary strengths of human and interpretable rule-based machine-learning algorithms for solving this classification problem. We used human expert knowledge to co-create two reliable machine-learning classifiers through human-assisted selection of classification features and review of events with uncertain classifier predictions. The two classifiers are integrated into the SeisComP3 operational monitoring system. The first one discards false events from the set of events obtained with a low short-term average/long-term average threshold; the second one labels the remaining events as either earthquakes or quarry blasts. When run in an operational setting, the first classifier correctly detected more than 99% of false events and just over 93% of earthquakes; the second classifier correctly labeled 95% of quarry blasts and 96% of earthquakes. After a manual review of the second classifier low-confidence outputs, the final catalog contained fewer than 2% of misclassified events. These results confirm that machine learning strengthens the quality of earthquake catalogs and that the performance of machine-learning classifiers can be improved through human expertise. Our study promotes a broader implication of hybrid intelligence monitoring within seismological observatories.","",""
4,"Tonghua Liu, Shuo Cao, Sixuan Zhang, Xiaolong Gong, Wuzheng Guo, C. Zheng","Revisiting the cosmic distance duality relation with machine learning reconstruction methods: the combination of HII galaxies and ultra-compact radio quasars",2021,"","","","",157,"2022-07-13 09:23:47","","10.1140/epjc/s10052-021-09713-5","","",,,,,4,4.00,1,6,1,"","",""
20,"Hiroshi Kuwajima, Hirotoshi Yasuoka, Toshihiro Nakae","Engineering problems in machine learning systems",2019,"","","","",158,"2022-07-13 09:23:47","","10.1007/s10994-020-05872-w","","",,,,,20,6.67,7,3,3,"","",""
2,"Somayah Albaradei, Mahmut Uludag, Maha A. Thafar, T. Gojobori, M. Essack, Xin Gao","Predicting Bone Metastasis Using Gene Expression-Based Machine Learning Models",2021,"","","","",159,"2022-07-13 09:23:47","","10.3389/fgene.2021.771092","","",,,,,2,2.00,0,6,1,"Bone is the most common site of distant metastasis from malignant tumors, with the highest prevalence observed in breast and prostate cancers. Such bone metastases (BM) cause many painful skeletal-related events, such as severe bone pain, pathological fractures, spinal cord compression, and hypercalcemia, with adverse effects on life quality. Many bone-targeting agents developed based on the current understanding of BM onset’s molecular mechanisms dull these adverse effects. However, only a few studies investigated potential predictors of high risk for developing BM, despite such knowledge being critical for early interventions to prevent or delay BM. This work proposes a computational network-based pipeline that incorporates a ML/DL component to predict BM development. Based on the proposed pipeline we constructed several machine learning models. The deep neural network (DNN) model exhibited the highest prediction accuracy (AUC of 92.11%) using the top 34 featured genes ranked by betweenness centrality scores. We further used an entirely separate, “external” TCGA dataset to evaluate the robustness of this DNN model and achieved sensitivity of 85%, specificity of 80%, positive predictive value of 78.10%, negative predictive value of 80%, and AUC of 85.78%. The result shows the models’ way of learning allowed it to zoom in on the featured genes that provide the added benefit of the model displaying generic capabilities, that is, to predict BM for samples from different primary sites. Furthermore, existing experimental evidence provides confidence that about 50% of the 34 hub genes have BM-related functionality, which suggests that these common genetic markers provide vital insight about BM drivers. These findings may prompt the transformation of such a method into an artificial intelligence (AI) diagnostic tool and direct us towards mechanisms that underlie metastasis to bone events.","",""
1,"T. Schmid","Batch-like Online Learning for More Robust Hybrid Artificial Intelligence: Deconstruction as a Machine Learning Process",2021,"","","","",160,"2022-07-13 09:23:47","","","","",,,,,1,1.00,1,1,1,"Continuous streams of data are a common, yet challenging phenomenon of modern information processing. Traditional approaches to adopt machine learning techniques to this setting, like offline and online learning, have demonstrated several critical drawbacks. In order to avoid known disadvantages of both approaches, we propose to combine their complementary advantages in a novel machine learning process called deconstruction. Similar to supervised and unsupervised learning, this novel process provides a fundamental learning functionality modeled after human learning. This functionality integrates mechanisms for partitioning training data, managing learned knowledge representations and integrating newly acquired knowledge with previously learned knowledge representations. A prerequisite for this concept is that learning data can be partitioned and that resulting knowledge partitions may be accessed by formal means. In the proposed approach, this is achieved by the recently introduced Constructivist Machine Learning framework, which allows to create, exploit and maintain a knowledge base. In this work, we highlight the design concepts for the implementation of such a deconstruction process. In particular, we describe required subprocesses and how they can be combined.","",""
1,"Yue Gao, Kassem Fawaz","Scale-Adv: A Joint Attack on Image-Scaling and Machine Learning Classifiers",2021,"","","","",161,"2022-07-13 09:23:47","","","","",,,,,1,1.00,1,2,1,"As real-world images come in varying sizes, the machine learning model is part of a larger system that includes an upstream image scaling algorithm. In this system, the model and the scaling algorithm have become attractive targets for numerous attacks, such as adversarial examples and the recent imagescaling attack. In response to these attacks, researchers have developed defense approaches that are tailored to attacks at each processing stage. As these defenses are developed in isolation, their underlying assumptions become questionable when viewing them from the perspective of an end-to-end machine learning system. In this paper, we investigate whether defenses against scaling attacks and adversarial examples are still robust when an adversary targets the entire machine learning system. In particular, we propose Scale-Adv, a novel attack framework that jointly targets the image-scaling and classification stages. This framework packs several novel techniques, including novel representations of the scaling defenses. It also defines two integrations that allow for attacking the machine learning system pipeline in the white-box and black-box settings. Based on this framework, we evaluate cutting-edge defenses at each processing stage. For scaling attacks, we show that Scale-Adv can evade four out of five state-of-the-art defenses by incorporating adversarial examples. For classification, we show that Scale-Adv can significantly improve the performance of machine learning attacks by leveraging weaknesses in the scaling algorithm. We empirically observe that Scale-Adv can produce adversarial examples with less perturbation and higher confidence than vanilla black-box and white-box attacks. We further demonstrate the transferability of Scale-Adv on a commercial online API.","",""
1,"F. Damen, David Newton, G. Lin, C. Goergen","Machine Learning Driven Contouring of High-Frequency Four-Dimensional Cardiac Ultrasound Data",2020,"","","","",162,"2022-07-13 09:23:47","","10.3390/app11041690","","",,,,,1,0.50,0,4,2,"Automatic boundary detection of 4D ultrasound (4DUS) cardiac data is a promising yet challenging application at the intersection of machine learning and medicine. Using recently developed murine 4DUS cardiac imaging data, we demonstrate here a set of three machine learning models that predict left ventricular wall kinematics along both the endo- and epi-cardial boundaries. Each model is fundamentally built on three key features: (1) the projection of raw US data to a lower dimensional subspace, (2) a smoothing spline basis across time, and (3) a strategic parameterization of the left ventricular boundaries. Model 1 is constructed such that boundary predictions are based on individual short-axis images, regardless of their relative position in the ventricle. Model 2 simultaneously incorporates parallel short-axis image data into their predictions. Model 3 builds on the multi-slice approach of model 2, but assists predictions with a single ground-truth position at end-diastole. To assess the performance of each model, Monte Carlo cross validation was used to assess the performance of each model on unseen data. For predicting the radial distance of the endocardium, models 1, 2, and 3 yielded average R2 values of 0.41, 0.49, and 0.71, respectively. Monte Carlo simulations of the endocardial wall showed significantly closer predictions when using model 2 versus model 1 at a rate of 48.67%, and using model 3 versus model 2 at a rate of 83.50%. These finding suggest that a machine learning approach where multi-slice data are simultaneously used as input and predictions are aided by a single user input yields the most robust performance. Subsequently, we explore the how metrics of cardiac kinematics compare between ground-truth contours and predicted boundaries. We observed negligible deviations from ground-truth when using predicted boundaries alone, except in the case of early diastolic strain rate, providing confidence for the use of such machine learning models for rapid and reliable assessments of murine cardiac function. To our knowledge, this is the first application of machine learning to murine left ventricular 4DUS data. Future work will be needed to strengthen both model performance and applicability to different cardiac disease models.","",""
