Cites,Authors,Title,Year,Source,Publisher,ArticleURL,CitesURL,GSRank,QueryDate,Type,DOI,ISSN,CitationURL,Volume,Issue,StartPage,EndPage,ECC,CitesPerYear,CitesPerAuthor,AuthorCount,Age,Abstract,FullTextURL,RelatedURL
19,"J. Mallick, S. AlQadhi, Swapan Talukdar, Majed Alsubih, Mohd. Ahmed, R. A. Khan, N. Kahla, Saud M. Abutayeh","Risk Assessment of Resources Exposed to Rainfall Induced Landslide with the Development of GIS and RS Based Ensemble Metaheuristic Machine Learning Algorithms",2021,"","","","",48,"2022-07-13 09:25:44","","10.3390/SU13020457","","",,,,,19,19.00,2,8,1,"Disastrous natural hazards, such as landslides, floods, and forest fires cause a serious threat to natural resources, assets and human lives. Consequently, landslide risk assessment has become requisite for managing the resources in future. This study was designed to develop four ensemble metaheuristic machine learning algorithms, such as grey wolf optimized based artificial neural network (GW-ANN), grey wolf optimized based random forest (GW-RF), particle swarm optimization optimized based ANN (PSO-ANN), and PSO optimized based RF for modeling rainfall-induced landslide susceptibility (LS) in Aqabat Al-Sulbat, Asir region, Saudi Arabia, which observes landslide frequently. To obtain very high precision and robust prediction from machine learning algorithms, the grey wolf and PSO optimization algorithms were integrated to develop new ensemble machine learning techniques. Subsequently, LS maps produced by training dataset were validated using the receiver operating characteristics (ROC) curve based on the testing dataset. Based on the area under curve (AUC) value of ROC curve, the best method for LS modeling was selected. We developed ROC curve-based sensitivity analysis to investigate the influence of the parameters for LS modeling. The Gumble extreme value distribution was employed to estimate the rainfall at 2, 5, 10, 20, 50, and 100 year return periods. Then, the landslide hazard maps were prepared at different return periods by integrating the best LS model and estimated rainfall at different return periods. The theory of danger pixels was employed to prepare a final risk assessment of the resources, which have been exposed to the landslide. The results showed that 27–42 and 6–15 km2 were predicted as the very high and high LS zones using four ensemble metaheuristic machine learning algorithms. Based on the area under curve (AUC) of ROC, GR-ANN (AUC-0.905) appeared as the best model for LS modeling. The areas under high and very high landslide hazard were gradually increased over the progression of time (26 km2 at the 2 year return period and 40 km2 at the 100 year return period for the high landslide hazard zone, and 6 km2 at the 2 year return period and 20 km2 at the 100 year return period for the very high landslide hazard zone). Similarly, the areas of danger pixel also increased gradually from the 2 to 100 year return periods (37 km2 to 62 km2). Various natural resources, such as scrubland, built up, and sparse vegetation, were identified under risk zone due to landslide hazards. In addition, these resources would be exposed extensively to landslides over the advancement of return periods. Therefore, the outcome of the present study will help planners and scientists to propose high precision management plans for protecting natural resources, which have been exposed to landslides.","",""
10,"Alan Le Goallec, B. Tierney, Jacob M. Luber, Evan M. Cofer, A. Kostic, C. Patel","A systematic machine learning and data type comparison yields metagenomic predictors of infant age, sex, breastfeeding, antibiotic usage, country of origin, and delivery type",2020,"","","","",49,"2022-07-13 09:25:44","","10.1371/journal.pcbi.1007895","","",,,,,10,5.00,2,6,2,"The microbiome is a new frontier for building predictors of human phenotypes. However, machine learning in the microbiome is fraught with issues of reproducibility, driven in large part by the wide range of analytic models and metagenomic data types available. We aimed to build robust metagenomic predictors of host phenotype by comparing prediction performances and biological interpretation across 8 machine learning methods and 4 different types of metagenomic data. Using 1,570 samples from 300 infants, we fit 7,865 models for 6 host phenotypes. We demonstrate the dependence of accuracy on algorithm choice and feature definition in microbiome data and propose a framework for building microbiome-derived indicators of host phenotype. We additionally identify biological features predictive of age, sex, breastfeeding status, historical antibiotic usage, country of origin, and delivery type. Our complete results can be viewed at http://apps.chiragjpgroup.org/ubiome_predictions/.","",""
10,"T. Mizoguchi, S. Kiyohara","Machine learning approaches for ELNES/XANES.",2020,"","","","",50,"2022-07-13 09:25:44","","10.1093/jmicro/dfz109","","",,,,,10,5.00,5,2,2,"Materials characterization is indispensable for materials development. In particular, spectroscopy provides atomic configuration, chemical bonding and vibrational information, which are crucial for understanding the mechanism underlying the functions of a material. Despite its importance, the interpretation of spectra using human-driven methods, such as manual comparison of experimental spectra with reference/simulated spectra, is becoming difficult owing to the rapid increase in experimental spectral data. To overcome the limitations of such methods, we develop new data-driven approaches based on machine learning. Specifically, we use hierarchical clustering, a decision tree and a feedforward neural network to investigate the electron energy loss near edge structures (ELNES) spectrum, which is identical to the X-ray absorption near edge structure (XANES) spectrum. Hierarchical clustering and the decision tree are used to interpret and predict ELNES/XANES, while the feedforward neural network is used to obtain hidden information about the material structure and properties from the spectra. Further, we construct a prediction model that is robust against noise by data augmentation. Finally, we apply our method to noisy spectra and predict six properties accurately. In summary, the proposed approaches can pave the way for fast and accurate spectrum interpretation/prediction as well as local measurement of material functions.","",""
10,"Krupal P. Jethava, Jonathan A Fine, Yingqi Chen, Ahad Hossain, G. Chopra","Accelerated Reactivity Mechanism and Interpretable Machine Learning Model of N-Sulfonylimines toward Fast Multicomponent Reactions.",2020,"","","","",51,"2022-07-13 09:25:44","","10.26434/chemrxiv.12116163.v1","","",,,,,10,5.00,2,5,2,"We introduce chemical reactivity flowcharts to help chemists interpret reaction outcomes using statistically robust machine learning models trained on a small number of reactions. We developed fast N-sulfonylimine multicomponent reactions for understanding reactivity and to generate training data. Accelerated reactivity mechanisms were investigated using density functional theory. Intuitive chemical features learned by the model accurately predicted heterogeneous reactivity of N-sulfonylimine with different carboxylic acids. Validation of the predictions shows that reaction outcome interpretation is useful for human chemists.","",""
17,"Xuesi Ma, Baohang Xi, Yi Zhang, Lijuan Zhu, Xin Sui, Geng Tian, Jialiang Yang","A Machine Learning-based Diagnosis of Thyroid Cancer Using Thyroid Nodules Ultrasound Images",2020,"","","","",52,"2022-07-13 09:25:44","","10.2174/1574893614666191017091959","","",,,,,17,8.50,2,7,2,"  Ultrasound test is one of the routine tests for the diagnosis of thyroid cancer. The diagnosis accuracy depends largely on the correct interpretation of ultrasound images of thyroid nodules. However, human eye-based image recognition is usually subjective and sometimes error-prone especially for less experienced doctors, which presents a need for computeraided diagnostic systems.    To our best knowledge, there is no well-maintained ultrasound image database for the Chinese population. In addition, though there are several computational methods for image-based thyroid cancer detection, a comparison among them is missing. Finally, the effects of features like the choice of distance measures have not been assessed. The study aims to give the improvement of these limitations and proposes a highly accurate image-based thyroid cancer diagnosis system, which can better assist doctors in the diagnosis of thyroid cancer.    We first establish a novel thyroid nodule ultrasound image database consisting of 508 images collected from the Third Hospital of Hebei Medical University in China. The clinical information for the patients is also collected from the hospital, where 415 patients are diagnosed to be benign and 93 are malignant by doctors following a standard diagnosis procedure. We develop and apply five machine learning methods to the dataset including deep neural network, support vector machine, the center clustering method, k-nearest neighbor, and logistic regression.    Experimental results show that deep neural network outperforms other diagnosis methods with an average cross-validation accuracy of 0.87 in 10 runs. Meanwhile, we also explore the performance of four image distance measures including the Euclidean distance, the Manhattan distance, the Chebyshev distance, and the Minkowski distance, among which the Chebyshev distance is the best. The resource can be directly used to aid doctors in thyroid cancer diagnosis and treatment.    The paper establishes a novel thyroid nodule ultrasound image database and develops a high accurate image-based thyroid cancer diagnosis system which can better assist doctors in the diagnosis of thyroid cancer. ","",""
506,"W. James Murdoch, Chandan Singh, Karl Kumbier, R. Abbasi-Asl, Bin Yu","Definitions, methods, and applications in interpretable machine learning",2019,"","","","",53,"2022-07-13 09:25:44","","10.1073/pnas.1900654116","","",,,,,506,168.67,101,5,3,"Significance The recent surge in interpretability research has led to confusion on numerous fronts. In particular, it is unclear what it means to be interpretable and how to select, evaluate, or even discuss methods for producing interpretations of machine-learning models. We aim to clarify these concerns by defining interpretable machine learning and constructing a unifying framework for existing methods which highlights the underappreciated role played by human audiences. Within this framework, methods are organized into 2 classes: model based and post hoc. To provide guidance in selecting and evaluating interpretation methods, we introduce 3 desiderata: predictive accuracy, descriptive accuracy, and relevancy. Using our framework, we review existing work, grounded in real-world studies which exemplify our desiderata, and suggest directions for future work. Machine-learning models have demonstrated great success in learning complex patterns that enable them to make predictions about unobserved data. In addition to using models for prediction, the ability to interpret what a model has learned is receiving an increasing amount of attention. However, this increased focus has led to considerable confusion about the notion of interpretability. In particular, it is unclear how the wide array of proposed interpretation methods are related and what common concepts can be used to evaluate them. We aim to address these concerns by defining interpretability in the context of machine learning and introducing the predictive, descriptive, relevant (PDR) framework for discussing interpretations. The PDR framework provides 3 overarching desiderata for evaluation: predictive accuracy, descriptive accuracy, and relevancy, with relevancy judged relative to a human audience. Moreover, to help manage the deluge of interpretation methods, we introduce a categorization of existing techniques into model-based and post hoc categories, with subgroups including sparsity, modularity, and simulatability. To demonstrate how practitioners can use the PDR framework to evaluate and understand interpretations, we provide numerous real-world examples. These examples highlight the often underappreciated role played by human audiences in discussions of interpretability. Finally, based on our framework, we discuss limitations of existing methods and directions for future work. We hope that this work will provide a common vocabulary that will make it easier for both practitioners and researchers to discuss and choose from the full range of interpretation methods.","",""
24,"Bethany Signal, B. Gloss, M. Dinger, T. Mercer","Machine learning annotation of human branchpoints",2018,"","","","",54,"2022-07-13 09:25:44","","10.1093/bioinformatics/btx688","","",,,,,24,6.00,6,4,4,"Motivation: The branchpoint element is required for the first lariat‐forming reaction in splicing. However current catalogues of human branchpoints remain incomplete due to the difficulty in experimentally identifying these splicing elements. To address this limitation, we have developed a machine‐learning algorithm—branchpointer—to identify branchpoint elements solely from gene annotations and genomic sequence. Results: Using branchpointer, we annotate branchpoint elements in 85% of human gene introns with sensitivity (61.8%) and specificity (97.8%). In addition to annotation, branchpointer can evaluate the impact of SNPs on branchpoint architecture to inform functional interpretation of genetic variants. Branchpointer identifies all published deleterious branchpoint mutations annotated in clinical variant databases, and finds thousands of additional clinical and common genetic variants with similar predicted effects. This genome‐wide annotation of branchpoints provides a reference for the genetic analysis of splicing, and the interpretation of noncoding variation. Availability and implementation: Branchpointer is written and implemented in the statistical programming language R and is freely available under a BSD license as a package through Bioconductor. Contact: b.signal@garvan.org.au or t.mercer@garvan.org Supplementary information: Supplementary data are available at Bioinformatics online.","",""
0,"Jia Qi Lim, N. Alias, F. Johar","Supervised Classification of Normal and Tumorous Brain MR Images Using Machine Learning Schemes",2020,"","","","",55,"2022-07-13 09:25:44","","10.20944/preprints202007.0688.v1","","",,,,,0,0.00,0,3,2,"Manual interpretation of these huge amounts of image volumes are susceptible to inter-reader variability and human error. Thus, accurate automated CAD scheme is highly desirable in clinical pathological diagnosis. In this research, plethora of machine learning paradigms (e.g. feature extraction, dimensionality reduction and supervised classification methods) were explored, evaluated, compared and analyzed to identify the optimal pathway for brain MR images (normal vs neoplastic) binary classification task. External validation dataset was used to test the generalizability of the optimal predictive models implemented. Relevant and informative features were selected to construct cross-validated decision tree and eventually simple rule set was built based on the decision tree. The experimental results show that almost all pattern recognition paradigms achieve high accuracy with careful selection of number of attributes. LDA+ELM with 55 features are the optimal pipelines which achieve perfect classification when training and test data are of same source; and achieving (accuracy=97.5%, AUC=0.989, sensitivity=95% and specificity=100%) under balanced test dataset; (accuracy=99.5%, AUC=0.988, sensitivity=95% and specificity=100%). Cross-validated decision tree model also shows comparable performance: accuracy=98.8%, AUC=99.1%, sensitivity=99.6% and specificity=98.2%. Three highly relevant and robust attributes are visualized and selected for construction of decision tree models and finally a rule sets are read directly off the decision tree. This rule sets can potentially serve as fast and accurate classification algorithm.","",""
0,"T. Mizoguchi, S. Kiyohara","Chapter 17. Machine Learning for Core-loss Spectrum",2020,"","","","",56,"2022-07-13 09:25:44","","10.1039/9781839160233-00424","","",,,,,0,0.00,0,2,2,"Characterization is indispensable for developing functional materials and molecules. In particular, spectroscopy provides atomic configuration, chemical bonding, and vibrational information, which are crucial for understanding the mechanism underlying the functions of a material and molecule. Despite its importance, the interpretation of spectra using “human-driven” methods, such as manual comparison of experimental spectra with reference/simulated spectra, is becoming difficult owing to the increase in experimental data. To overcome the limitations of “human-driven” methods, new data-driven approaches based on machine learning were developed. In this chapter, we review our machine learning method for spectral analysis. Hierarchical clustering, a decision tree, and a feedforward neural network were combined to investigate the core loss spectroscopy, namely electron energy loss near edge structures (ELNES) spectrum, which is identical to the X-ray absorption near edge structure (XANES) spectrum. Hierarchical clustering and the decision tree are used to interpret and predict ELNES/XANES, while the feedforward neural network is used to obtain hidden information about the material structure and properties from the spectra. Further, we construct a prediction model that is robust against noise by data augmentation. Finally, we apply our method to noisy spectra and predict six properties accurately. In summary, the proposed approaches can pave the way for fast and accurate spectrum interpretation/prediction as well as the local measurement of material functions.","",""
0,"David A. Hindin","Artificial Intelligence and Machine Learning: Implications for Surgery",2020,"","","","",57,"2022-07-13 09:25:44","","10.1007/978-3-030-49100-0_23","","",,,,,0,0.00,0,1,2,"","",""
0,"Adhideb Ghosh, A. Navarini","Biological function polarity prediction of missense variants using machine learning",2020,"","","","",58,"2022-07-13 09:25:44","","10.1101/2020.04.03.023440","","",,,,,0,0.00,0,2,2,"Functional interpretation is crucial when facing on average 20,000 missense variants per human exome, as the great majority are not associated with any underlying disease. In silico bioinformatics tools can predict the deleteriousness of variants or assess their functional impact by assigning scores, but they cannot predict whether the variant in question results in gain or loss of function at the protein level. Here, we show that machine learning can effectively predict this biological function polarity of missense variants. The new method adapts weighted gradient boosting machine approach on a set of damaging variants (1,288 loss of function and 218 gain of function variants) as annotated by the tools SIFT, PolyPhen2 and CADD. Area under the ROC curve of 0.85 illustrates high discriminative power of the classifier. Predictive performance of the classifier remains consistent against an independent set of damaging variants as highlighted by the area under the ROC curve of 0.83. This new approach may help to guide biological experiments on the clinical relevance of damaging genetic variants. Author summary Missense variant occurs when a single genetic alteration in DNA takes place and as a result a new amino acid is translated into the protein. This amino acid change can inactivate the existing protein function causing loss-of-function or produce a new function causing gain-of-function. Therefore, it is very important to interpret these functional consequences of missense variants as they often turn out to be disease causing. Each individual’s genome sequence has thousands of missense variants, out of which very few are actually associated with any underlying disease. Various computational tools have been developed to predict whether missense variants are damaging or not, but none of them can actually predict whether the damaging missense variants cause gain-of-function or loss-of-function. We have developed a new ensemble classifier to predict this biological function polarity at the protein level. The classifier combines the prediction scores of three existing bioinformatics tools and applies machine learning to make effective predictions. We have validated our classifier against an independent data set to show its high predictive power and robustness. The predictions made by our machine learning tool can be used as indicators of biological function polarity, but with further evidence on pathogenicity.","",""
4,"Barry McDermott, A. Elahi, A. Santorelli, M. O’halloran, J. Avery, E. Porter","Multi-frequency symmetry difference electrical impedance tomography with machine learning for human stroke diagnosis.",2020,"","","","",59,"2022-07-13 09:25:44","","10.1088/1361-6579/ab9e54","","",,,,,4,2.00,1,6,2,"OBJECTIVE Multi-Frequency Symmetry Difference Electrical Impedance Tomography (MFSD-EIT) can robustly detect and identify unilateral perturbations in symmetric scenes. Here, an investigation is performed to assess if the algorithm can be successfully applied to identify the aetiology of stroke with the aid of machine learning.   METHODS Anatomically realistic four-layer Finite Element Method models of the head based on stroke patient images are developed and used to generate EIT data over a 5 Hz - 100 Hz frequency range with and without bleed and clot lesions present. Reconstruction generates conductivity maps of each head at each frequency. Application of a quantitative metric assessing changes in symmetry across the sagittal plane of the reconstructed image and over the frequency range allows lesion detection and identification. The algorithm is applied to both simulated and human (n=34 subjects) data. A classification algorithm is applied to the metric value in order to differentiate between normal, haemorrhage and clot values.   RESULTS An average accuracy of 85% is achieved when MFSD-EIT with Support Vector Machines (SVM) classification is used to identify and differentiate bleed from clot in human data, with 77% accuracy when differentiating normal from stroke in human data.   CONCLUSION Applying a classification algorithm to metrics derived from MFSD-EIT images is a novel and promising technique for detection and identification of perturbations in static scenes.   SIGNIFICANCE The MFSD-EIT algorithm used with machine learning gives promising results of lesion detection and identification in challenging conditions like stroke. The results imply feasible translation to human patients.","",""
18,"M. A. Khan, Seifedine Kadry, P. Parwekar, Robertas Damaševičius, A. Mehmood, J. Khan, S. R. Naqvi","Human gait analysis for osteoarthritis prediction: a framework of deep learning and kernel extreme learning machine",2021,"","","","",60,"2022-07-13 09:25:44","","10.1007/S40747-020-00244-2","","",,,,,18,18.00,3,7,1,"","",""
33,"Megha Srivastava, Tatsunori B. Hashimoto, Percy Liang","Robustness to Spurious Correlations via Human Annotations",2020,"","","","",61,"2022-07-13 09:25:44","","","","",,,,,33,16.50,11,3,2,"The reliability of machine learning systems critically assumes that the associations between features and labels remain similar between training and test distributions. However, unmeasured variables, such as confounders, break this assumption---useful correlations between features and labels at training time can become useless or even harmful at test time. For example, high obesity is generally predictive for heart disease, but this relation may not hold for smokers who generally have lower rates of obesity and higher rates of heart disease. We present a framework for making models robust to spurious correlations by leveraging humans' common sense knowledge of causality. Specifically, we use human annotation to augment each training example with a potential unmeasured variable (i.e. an underweight patient with heart disease may be a smoker), reducing the problem to a covariate shift problem. We then introduce a new distributionally robust optimization objective over unmeasured variables (UV-DRO) to control the worst-case loss over possible test-time shifts. Empirically, we show improvements of 5-10% on a digit recognition task confounded by rotation, and 1.5-5% on the task of analyzing NYPD Police Stops confounded by location.","",""
