Cites,Authors,Title,Year,Source,Publisher,ArticleURL,CitesURL,GSRank,QueryDate,Type,DOI,ISSN,CitationURL,Volume,Issue,StartPage,EndPage,ECC,CitesPerYear,CitesPerAuthor,AuthorCount,Age,Abstract,FullTextURL,RelatedURL
51,"Zhen Wang, H. Di, M. Shafiq, Yazeed Alaudah, G. AlRegib","Successful leveraging of image processing and machine learning in seismic structural interpretation: A review",2018,"","","","",94,"2022-07-13 09:25:44","","10.1190/TLE37060451.1","","",,,,,51,12.75,10,5,4,"As a process that identifies geologic structures of interest such as faults, salt domes, or elements of petroleum systems in general, seismic structural interpretation depends heavily on the domain knowledge and experience of interpreters as well as visual cues of geologic structures, such as texture and geometry. With the dramatic increase in size of seismic data acquired for hydrocarbon exploration, structural interpretation has become more time consuming and labor intensive. By treating seismic data as images rather than signal traces, researchers have been able to utilize advanced image-processing and machine-learning techniques to assist interpretation directly. In this paper, we mainly focus on the interpretation of two important geologic structures, faults and salt domes, and summarize interpretation workflows based on typical or advanced image-processing and machine-learning algorithms. In recent years, increasing computational power and the massive amount of available data have led to the rise of deep learning. Deep-learning models that simulate the human brain's biological neural networks can achieve state-of-the-art accuracy and even exceed human-level performance on numerous applications. The convolutional neural network — a form of deep-learning model that is effective in analyzing visual imagery — has been applied in fault and salt dome interpretation. At the end of this review, we provide insight and discussion on the future of structural interpretation.","",""
29,"Md. Khayrul Bashar, Ishio Chiaki, Hiroaki Yoshida","Human identification from brain EEG signals using advanced machine learning method EEG-based biometrics",2016,"","","","",95,"2022-07-13 09:25:44","","10.1109/IECBES.2016.7843496","","",,,,,29,4.83,10,3,6,"EEG-based human recognition is increasingly becoming a popular modality for biometric authentication. Two important features of EEG signals are liveliness and the robustness against falsification. However, a comprehensive study on human authentication using EEG signal is still remains. On the other hand, low-cost wireless EEG recording devices are now growing in the market places. Although these devices have the potential to many applications, researches have yet to be done to find the feasibility of these devices. In this study, we propose a method for human identification using EEG signals obtained from such low-cost devices. EEG signal is first preprocessed to remove noise and artifacts using Bandpass FIR filter. These signals are then divided into disjoint segments. Three feature extraction methods, namely multiscale shape description (MSD), multiscale wavelet packet statistics (WPS) and multiscale wavelet packet energy statistics (WPES) are then applied. These features are finally used to train a supervised error-correcting output code multiclass model (ECOC) using support vector machine (SVM) classifier, which ultimately can recognize humans from test EEG signals. A preliminary experiment with 9 EEG records from 9 subjects shows the true positive rate of 94.44% of the proposed method.","",""
9,"Manuel B. Garcia, Shaneth C. Ambat, Rossana Adao","Tomayto, Tomahto: A Machine Learning Approach for Tomato Ripening Stage Identification Using Pixel-Based Color Image Classification",2019,"","","","",96,"2022-07-13 09:25:44","","10.1109/HNICEM48295.2019.9072892","","",,,,,9,3.00,3,3,3,"The main enterprise of the Philippine agriculture sector is crop cultivation where tomato is deliberated as one of the major crops in the country. With the abundance on tomato production, ripeness classification becomes fairly laborious and challenging, not to mention the subjective visual interpretation of human graders grounded from practical experience that is easily influenced by the environment and prone to error. Thus, this study proposes an automatic tomato ripeness identification using Support Vector Machine (SVM) classifier and CIELab color space via a machine learning approach. Dataset used for modeling and validation experiment in a 5-fold cross-validation strategy was composed of 900 images assembled from a farm and various image search engines. Divided into six classes that represent tomato ripening stages, experimental results showed that the proposed method was successful with 83.39% accuracy in ripeness classification detection. With this machine learning approach and combination of image processing techniques, the agriculture industry could benefit by automating the ripeness estimation which then could save tomatoes from damage.","",""
1,"T. Schmid","Batch-like Online Learning for More Robust Hybrid Artificial Intelligence: Deconstruction as a Machine Learning Process",2021,"","","","",97,"2022-07-13 09:25:44","","","","",,,,,1,1.00,1,1,1,"Continuous streams of data are a common, yet challenging phenomenon of modern information processing. Traditional approaches to adopt machine learning techniques to this setting, like offline and online learning, have demonstrated several critical drawbacks. In order to avoid known disadvantages of both approaches, we propose to combine their complementary advantages in a novel machine learning process called deconstruction. Similar to supervised and unsupervised learning, this novel process provides a fundamental learning functionality modeled after human learning. This functionality integrates mechanisms for partitioning training data, managing learned knowledge representations and integrating newly acquired knowledge with previously learned knowledge representations. A prerequisite for this concept is that learning data can be partitioned and that resulting knowledge partitions may be accessed by formal means. In the proposed approach, this is achieved by the recently introduced Constructivist Machine Learning framework, which allows to create, exploit and maintain a knowledge base. In this work, we highlight the design concepts for the implementation of such a deconstruction process. In particular, we describe required subprocesses and how they can be combined.","",""
879,"Tyler Martin","Interpretable Machine Learning",2019,"","","","",98,"2022-07-13 09:25:44","","","","",,,,,879,293.00,879,1,3,"Interpretable machine learning has become a popular research direction as deep neural networks (DNNs) have become more powerful and their applications more mainstream, yet DNNs remain difficult to understand. Testing with Concept Activation Vectors, TCAV, (Kim et al. 2017) is an approach to interpreting DNNs in a human-friendly way and has recently received significant attention in the machine learning community. The TCAV algorithm achieves a degree of global interpretability for DNNs through human-defined concepts as explanations. This project introduces Robust TCAV, which builds on TCAV and experimentally determines best practices for this method. The objectives for Robust TCAV are 1) Making TCAV more consistent by reducing variance in the TCAV score distribution and 2) Increasing CAV and TCAV score resistance to perturbations. A difference of means method for CAV generation was determined to be the best practice to achieve both objectives. Many areas of the TCAV process are explored including CAV visualization in low dimensions, negative class selection, and activation perturbation in the direction of a CAV. Finally, a thresholding technique is considered to remove noise in TCAV scores. This project is a step in the direction of making TCAV, an already impactful algorithm in interpretability, more reliable and useful for practitioners.","",""
29,"Grayson W. Armstrong, A. Lorch","A(eye): A Review of Current Applications of Artificial Intelligence and Machine Learning in Ophthalmology",2019,"","","","",99,"2022-07-13 09:25:44","","10.1097/IIO.0000000000000298","","",,,,,29,9.67,15,2,3,"Artificial intelligence (AI) is a branch of computer science that aims to enable computers to perform human-like tasks. Although AI is a broad discipline, machine learning is a specific branch of AI that uses computer algorithms capable of “learning” through the simulation of human intelligence. Machine learning algorithms have been applied to the medical field since the 1970s,1 and since that time have proven useful in computerassisted diagnosis, screening, and prognostication of disease.2–7 Ophthalmology is uniquely capable of capitalizing on the promise of AI. Ophthalmologists, during routine clinical encounters, generate robust data sources capable of supporting machine learning algorithms including multimodal ophthalmic images and quantifiable metrics such as visual acuity (VA), intraocular pressure, and cup to disk ratio. To date, AI techniques have been applied to ophthalmology to screen for and diagnose diseases, such as diabetic retinopathy (DR), age-related macular degeneration (AMD), macular edema (ME), glaucoma, keratoconus, postlaserassisted in situ keratomileusis corneal ectasia, retinopathy of prematurity (ROP), and cataracts, as well as predict the prognosis of various ophthalmic diseases. Advances in ophthalmology-specific AI stand to increase patient access to clinical screening and diagnosis as well as decrease health care costs, especially when applied to high-risk populations, low-resource communities, or when combined with telemedicine initiatives. This review provides an introduction to AI andmachine learning, as well as an overview of current applications in the field of ophthalmology.","",""
0,"G. Truda","Quantified Sleep: Machine learning techniques for observational n-of-1 studies",2021,"","","","",100,"2022-07-13 09:25:44","","","","",,,,,0,0.00,0,1,1,"This paper applies statistical learning techniques to an observational Quantified-Self (QS) study to build a descriptive model of sleep quality. A total of 472 days of my sleep data was collected with an Oura ring. This was combined with a variety of lifestyle, environmental, and psychological data, harvested from multiple sensors and manual logs. Such n-of-1 QS projects pose a number of specific challenges: heterogeneous data sources with many missing values; few observations and many features; dynamic feedback loops; and human biases. This paper directly addresses these challenges with an end-to-end QS pipeline for observational studies that combines techniques from statistics and machine learning to produce robust descriptive models. Sleep quality is one of the most difficult modelling targets in QS research, due to high noise and a large number of weakly-contributing factors. Sleep quality was selected so that approaches from this paper would generalise to most other n-of-1 QS projects. Techniques are presented for combining and engineering features for the different classes of data types, sample frequencies, and schema. This includes manually-tracked event logs and automatically-sampled weather and geo-spatial data. Relevant statistical analyses for outliers, normality, (auto)correlation, stationarity, and missing data are detailed, along with a proposed method for hierarchical clustering to identify correlated groups of features. The missing data was overcome using a combination of knowledge-based and statistical techniques, including several multivariate imputation algorithms. “Markov unfolding” is presented for collapsing the time series into a collection of independent observations, whilst incorporating historical information. The final model was interpreted in two key ways: by inspecting the internal β-parameters, and using the SHAP framework, which can explain any “black box” model. These two interpretation techniques were combined to produce a list of the 16 most-predictive features, demonstrating that an observational study can greatly narrow down the number of features that need to be considered when designing interventional QS studies.","",""
33,"A. Samarakoon, K. Barros, Y. Li, M. Eisenbach, Qiang Zhang, F. Ye, V. Sharma, Z. Dun, Haidong Zhou, S. A. Grigera, C. Batista, D. Tennant","Machine-learning-assisted insight into spin ice Dy2Ti2O7",2019,"","","","",101,"2022-07-13 09:25:44","","10.1038/s41467-020-14660-y","","",,,,,33,11.00,3,12,3,"","",""
26,"W. Gou, Chu-wen Ling, Yan He, Zengliang Jiang, Yuanqing Fu, Fengzhe Xu, Z. Miao, Ting-yu Sun, Jie-sheng Lin, Hui-lian Zhu, Hongwei Zhou, Yu-ming Chen, Ju-Sheng Zheng","Interpretable Machine Learning Framework Reveals Robust Gut Microbiome Features Associated With Type 2 Diabetes",2020,"","","","",102,"2022-07-13 09:25:44","","10.2337/dc20-1536","","",,,,,26,13.00,3,13,2,"OBJECTIVE To identify the core gut microbial features associated with type 2 diabetes risk and potential demographic, adiposity, and dietary factors associated with these features. RESEARCH DESIGN AND METHODS We used an interpretable machine learning framework to identify the type 2 diabetes–related gut microbiome features in the cross-sectional analyses of three Chinese cohorts: one discovery cohort (n = 1,832, 270 cases of type 2 diabetes) and two validation cohorts (cohort 1: n = 203, 48 cases; cohort 2: n = 7,009, 608 cases). We constructed a microbiome risk score (MRS) with the identified features. We examined the prospective association of the MRS with glucose increment in 249 participants without type 2 diabetes and assessed the correlation between the MRS and host blood metabolites (n = 1,016). We transferred human fecal samples with different MRS levels to germ-free mice to confirm the MRS–type 2 diabetes relationship. We then examined the prospective association of demographic, adiposity, and dietary factors with the MRS (n = 1,832). RESULTS The MRS (including 14 microbial features) consistently associated with type 2 diabetes, with risk ratio for per 1-unit change in MRS 1.28 (95% CI 1.23–1.33), 1.23 (1.13–1.34), and 1.12 (1.06–1.18) across three cohorts. The MRS was positively associated with future glucose increment (P < 0.05) and was correlated with a variety of gut microbiota–derived blood metabolites. Animal study further confirmed the MRS–type 2 diabetes relationship. Body fat distribution was found to be a key factor modulating the gut microbiome–type 2 diabetes relationship. CONCLUSIONS Our results reveal a core set of gut microbiome features associated with type 2 diabetes risk and future glucose increment.","",""
27,"I. Stafford, M. Kellermann, E. Mossotto, R. M. Beattie, B. MacArthur, S. Ennis","A systematic review of the applications of artificial intelligence and machine learning in autoimmune diseases",2020,"","","","",103,"2022-07-13 09:25:44","","10.1038/s41746-020-0229-3","","",,,,,27,13.50,5,6,2,"","",""
20,"Georgios Rizos, Björn Schuller","Average Jane, Where Art Thou? – Recent Avenues in Efficient Machine Learning Under Subjectivity Uncertainty",2020,"","","","",104,"2022-07-13 09:25:44","","10.1007/978-3-030-50146-4_4","","",,,,,20,10.00,10,2,2,"","",""
2,"E. Lughofer","Model Explanation and Interpretation Concepts for Stimulating Advanced Human-Machine Interaction with ""Expert-in-the-Loop""",2018,"","","","",105,"2022-07-13 09:25:44","","10.1007/978-3-319-90403-0_10","","",,,,,2,0.50,2,1,4,"","",""
19,"Johannes Burdack, Fabian Horst, Sven Giesselbach, Ibrahim Hassan, Sabrina Daffner, W. Schöllhorn","Systematic Comparison of the Influence of Different Data Preprocessing Methods on the Performance of Gait Classifications Using Machine Learning",2019,"","","","",106,"2022-07-13 09:25:44","","10.3389/fbioe.2020.00260","","",,,,,19,6.33,3,6,3,"Human movements are characterized by highly non-linear and multi-dimensional interactions within the motor system. Therefore, the future of human movement analysis requires procedures that enhance the classification of movement patterns into relevant groups and support practitioners in their decisions. In this regard, the use of data-driven techniques seems to be particularly suitable to generate classification models. Recently, an increasing emphasis on machine-learning applications has led to a significant contribution, e.g., in increasing the classification performance. In order to ensure the generalizability of the machine-learning models, different data preprocessing steps are usually carried out to process the measured raw data before the classifications. In the past, various methods have been used for each of these preprocessing steps. However, there are hardly any standard procedures or rather systematic comparisons of these different methods and their impact on the classification performance. Therefore, the aim of this analysis is to compare different combinations of commonly applied data preprocessing steps and test their effects on the classification performance of gait patterns. A publicly available dataset on intra-individual changes of gait patterns was used for this analysis. Forty-two healthy participants performed 6 sessions of 15 gait trials for 1 day. For each trial, two force plates recorded the three-dimensional ground reaction forces (GRFs). The data was preprocessed with the following steps: GRF filtering, time derivative, time normalization, data reduction, weight normalization and data scaling. Subsequently, combinations of all methods from each preprocessing step were analyzed by comparing their prediction performance in a six-session classification using Support Vector Machines, Random Forest Classifiers, Multi-Layer Perceptrons, and Convolutional Neural Networks. The results indicate that filtering GRF data and a supervised data reduction (e.g., using Principal Components Analysis) lead to increased prediction performance of the machine-learning classifiers. Interestingly, the weight normalization and the number of data points (above a certain minimum) in the time normalization does not have a substantial effect. In conclusion, the present results provide first domain-specific recommendations for commonly applied data preprocessing methods and might help to build more comparable and more robust classification models based on machine learning that are suitable for a practical application.","",""
19,"P. Mathur, S. Srivastava, Xiaowei Xu, J. Mehta","Artificial Intelligence, Machine Learning, and Cardiovascular Disease",2020,"","","","",107,"2022-07-13 09:25:44","","10.1177/1179546820927404","","",,,,,19,9.50,5,4,2,"Artificial intelligence (AI)-based applications have found widespread applications in many fields of science, technology, and medicine. The use of enhanced computing power of machines in clinical medicine and diagnostics has been under exploration since the 1960s. More recently, with the advent of advances in computing, algorithms enabling machine learning, especially deep learning networks that mimic the human brain in function, there has been renewed interest to use them in clinical medicine. In cardiovascular medicine, AI-based systems have found new applications in cardiovascular imaging, cardiovascular risk prediction, and newer drug targets. This article aims to describe different AI applications including machine learning and deep learning and their applications in cardiovascular medicine. AI-based applications have enhanced our understanding of different phenotypes of heart failure and congenital heart disease. These applications have led to newer treatment strategies for different types of cardiovascular diseases, newer approach to cardiovascular drug therapy and postmarketing survey of prescription drugs. However, there are several challenges in the clinical use of AI-based applications and interpretation of the results including data privacy, poorly selected/outdated data, selection bias, and unintentional continuance of historical biases/stereotypes in the data which can lead to erroneous conclusions. Still, AI is a transformative technology and has immense potential in health care.","",""
49,"Logan Engstrom, Andrew Ilyas, Shibani Santurkar, Dimitris Tsipras, Brandon Tran, A. Madry","Learning Perceptually-Aligned Representations via Adversarial Robustness",2019,"","","","",108,"2022-07-13 09:25:44","","","","",,,,,49,16.33,8,6,3,"Many applications of machine learning require models that are “human-aligned,” i.e., that make decisions based on human-meaningful information about the input. We identify the pervasive brittleness of deep networks’ learned representations as a fundamental barrier to attaining this goal. We then re-cast robust optimization as a tool for enforcing human priors on the features learned by deep neural networks. The resulting robust feature representations turn out to be significantly more aligned with human perception. We leverage these representations to perform input interpolation, feature manipulation, and sensitivity mapping, without any post-processing or human intervention after model training.1","",""
14,"Megha Srivastava, Besmira Nushi, Ece Kamar, S. Shah, E. Horvitz","An Empirical Analysis of Backward Compatibility in Machine Learning Systems",2020,"","","","",109,"2022-07-13 09:25:44","","10.1145/3394486.3403379","","",,,,,14,7.00,3,5,2,"In many applications of machine learning (ML), updates are performed with the goal of enhancing model performance. However, current practices for updating models rely solely on isolated, aggregate performance analyses, overlooking important dependencies, expectations, and needs in real-world deployments. We consider how updates, intended to improve ML models, can introduce new errors that can significantly affect downstream systems and users. For example, updates in models used in cloud-based classification services, such as image recognition, can cause unexpected erroneous behavior in systems that make calls to the services. Prior work has shown the importance of ""backward compatibility"" for maintaining human trust. We study challenges with backward compatibility across different ML architectures and datasets, focusing on common settings including data shifts with structured noise and ML employed in inferential pipelines. Our results show that (i) compatibility issues arise even without data shift due to optimization stochasticity, (ii) training on large-scale noisy datasets often results in significant decreases in backward compatibility even when model accuracy increases, and (iii) distributions of incompatible points align with noise bias, motivating the need for compatibility aware de-noising and robustness methods.","",""
43,"A. Abrol, Z. Fu, Mustafa S. Salman, Rogers F. Silva, Y. Du, S. Plis, V. Calhoun","Deep learning encodes robust discriminative neuroimaging representations to outperform standard machine learning",2021,"","","","",110,"2022-07-13 09:25:44","","10.1038/s41467-020-20655-6","","",,,,,43,43.00,6,7,1,"","",""
7,"Jonathan Fürst, Mauricio Fadel Argerich, Bin Cheng, E. Kovacs","Towards Knowledge Infusion for Robust and Transferable Machine Learning in IoT",2020,"","","","",111,"2022-07-13 09:25:44","","","","",,,,,7,3.50,2,4,2,"Machine learning (ML) applications in Internet of Things (IoT) scenarios face the issue that supervision signals, such as labeled data, are scarce and expensive to obtain. For example, it often requires a human to manually label events in a data stream by observing the same events in the real world. In addition, the performance of trained models usually depends on a specific context: (1) location, (2) time and (3) data quality. This context is not static in reality, making it hard to achieve robust and transferable machine learning for IoT systems in practice. In this paper, we address these challenges with an envisioned method that we name Knowledge Infusion. First, we present two past case studies in which we combined external knowledge with traditional data-driven machine learning in IoT scenarios to ease the supervision effort: (1) a weak-supervision approach for the IoT domain to auto-generate labels based on external knowledge (e.g., domain knowledge) encoded in simple labeling functions. Our evaluation for transport mode classification achieves a micro-F1 score of 80.2%, with only seven labeling functions, on par with a fully supervised model that relies on hand-labeled data. (2) We introduce guiding functions to Reinforcement Learning (RL) to guide the agents' decisions and experience. In initial experiments, our guided reinforcement learning achieves more than three times higher reward in the beginning of its training than an agent with no external knowledge. We use the lessons learned from these experiences to develop our vision of knowledge infusion. In knowledge infusion, we aim to automate the inclusion of knowledge from existing knowledge bases and domain experts to combine it with traditional data-driven machine learning techniques during setup/training phase, but also during the execution phase.","",""
