Cites,Authors,Title,Year,Source,Publisher,ArticleURL,CitesURL,GSRank,QueryDate,Type,DOI,ISSN,CitationURL,Volume,Issue,StartPage,EndPage,ECC,CitesPerYear,CitesPerAuthor,AuthorCount,Age,Abstract,FullTextURL,RelatedURL
4,"Ninghao Liu, Mengnan Du, Xia Hu","Adversarial Machine Learning: An Interpretation Perspective",2020,"","","","",1,"2022-07-13 09:25:44","","","","",,,,,4,2.00,1,3,2,"Recent years have witnessed the significant advances of machine learning in a wide spectrum of applications. However, machine learning models, especially deep neural networks, have been recently found to be vulnerable to carefully-crafted input called adversarial samples. The difference between normal and adversarial samples is almost imperceptible to human. Many work have been proposed to study adversarial attack and defense in different scenarios. An intriguing and crucial aspect among those work is to understand the essential cause of model vulnerability, which requires in-depth exploration of another concept in machine learning models, i.e., interpretability. Interpretable machine learning tries to extract human-understandable terms for the working mechanism of models, which also receives a lot of attention from both academia and industry. Recently, an increasing number of work start to incorporate interpretation into the exploration of adversarial robustness. Furthermore, we observe that many previous work of adversarial attacking, although did not mention it explicitly, can be regarded as natural extension of interpretation. In this paper, we review recent work on adversarial attack and defense, particularly, from the perspective of machine learning interpretation. We categorize interpretation into two types, according to whether it focuses on raw features or model components. For each type of interpretation, we elaborate on how it could be used in attacks, or defense against adversaries. After that, we briefly illustrate other possible correlations between the two domains. Finally, we discuss the challenges and future directions along tackling adversary issues with interpretation.","",""
13,"Xinlei Mi, Baiming Zou, F. Zou, J. Hu","Permutation-based identification of important biomarkers for complex diseases via machine learning models",2021,"","","","",2,"2022-07-13 09:25:44","","10.1038/s41467-021-22756-2","","",,,,,13,13.00,3,4,1,"","",""
0,"Jianbo Chen","Towards Interpretability and Robustness of Machine Learning Models",2019,"","","","",3,"2022-07-13 09:25:44","","","","",,,,,0,0.00,0,1,3,"Author(s): Chen, Jianbo | Advisor(s): Jordan, Michael I; Wainwright, Martin J | Abstract: Modern machine learning models can be difficult to probe and understand after they have been trained. This is a major problem for the field, with consequences for trustworthiness, diagnostics, debugging, robustness, and a range of other engineering and human interaction issues surrounding the deployment of a model. Another problem of modern machine learning models is their vulnerability to small adversarial perturbations to the input, which incurs a security risk when they are applied to critical areas.In this thesis, we develop systematic and efficient tools for interpreting machine learning models and evaluating their adversarial robustness. Part I focuses on model interpretation. We derive an efficient feature scoring method by exploiting the graph structure in data. We also develop a learning-based method under an information-based framework. As an attempt to leverage prior knowledge about what constitutes a satisfying interpretation in a given domain, we propose a systematic approach to exploiting syntactic constituency structure by leveraging a parse tree for interpretation of models in the setting of linguistic data. Part II focuses on the evaluation of adversarial robustness. We first propose a probabilistic framework for generating adversarial examples on discrete data, and develop two algorithms to implement it. We also introduce a novel attack method in the setting where the attacker has access to model decisions alone. We investigate the robustness of various machine learning models and existing defense mechanisms under the proposed attack method. In Part III, we build a connection between the two fields by developing a method for detecting adversarial examples via tools in model interpretation.","",""
3,"Linhai Ma, Liang Liang","Enhance CNN Robustness Against Noises for Classification of 12-Lead ECG with Variable Length",2020,"","","","",4,"2022-07-13 09:25:44","","10.1109/ICMLA51294.2020.00137","","",,,,,3,1.50,2,2,2,"Electrocardiogram (ECG) is the most widely used diagnostic tool to monitor the condition of the cardiovascular system. Deep neural networks (DNNs), have been developed in many research labs for automatic interpretation of ECG signals to identify potential abnormalities in patient hearts. Studies have shown that given a sufficiently large amount of data, the classification accuracy of DNNs could reach human-expert cardiologist level. However, despite of the excellent performance in classification accuracy, it has been shown that DNNs are highly vulnerable to adversarial noises which are subtle changes in input of a DNN and lead to a wrong class-label prediction with a high confidence. Thus, it is challenging and essential to improve robustness of DNNs against adversarial noises for ECG signal classification -a life-critical application. In this work, we designed a CNN for classification of 12-lead ECG signals with variable length, and we applied three defense methods to improve robustness of this CNN for this classification task. The ECG data in this study is very challenging because the sample size is limited, and the length of each ECG recording varies in a large range. The evaluation results show that our customized CNN reached satisfying F1 score and average accuracy, comparable to the top-6 entries in the CPSC2018 ECG classification challenge, and the defense methods enhanced robustness of our CNN against adversarial noises and white noises, with a minimal reduction in accuracy on clean data.","",""
3,"Hengtong Zhang, Jing Gao, Lu Su","Data Poisoning Attacks Against Outcome Interpretations of Predictive Models",2021,"","","","",5,"2022-07-13 09:25:44","","10.1145/3447548.3467405","","",,,,,3,3.00,1,3,1,"The past decades have witnessed significant progress towards improving the accuracy of predictions powered by complex machine learning models. Despite much success, the lack of model interpretability prevents the usage of these techniques in life-critical systems such as medical diagnosis and self-driving systems. Recently, the interpretability issue has received much attention, and one critical task is to explain why a predictive model makes a specific decision. We refer to this task as outcome interpretation. Many outcome interpretation methods have been developed to produce human-understandable interpretations by utilizing intermediate results of the machine learning models, such as gradients and model parameters. Although the effectiveness of outcome interpretation approaches has been shown in a benign environment, their robustness against data poisoning attacks (i.e., attacks at the training phase) has not been studied. As the first work towards this direction, we aim to answer an important question: Can training-phase adversarial samples manipulate the outcome interpretation of target samples? To answer this question, we propose a data poisoning attack framework named IMF (Interpretation Manipulation Framework), which can manipulate the interpretations of target samples produced by representative outcome interpretation methods. Extensive evaluations verify the effectiveness and efficiency of the proposed attack strategies on two real-world datasets.","",""
0,"Mutao Huang, Jinmeng Wang, Xiaojuan Li","Land Use Change Moritoring in Nature Reserves Base on GF-1/GF-2",2021,"","","","",6,"2022-07-13 09:25:44","","10.1109/ICPECA51329.2021.9362542","","",,,,,0,0.00,0,3,1,"Relying on the remote sensing image of GF-1,GF-2, DEM datas, GIS datas and other datas resources of nature reserve, this paper develops a dynamic monitoring system for nature reserves of B/S version, based on Web RS, Web GIS, machine learning, statistical analysis and big datas technology organically integrated. After a series of preprocessing and interpretation of multi-temporal remote sensing image datas of nature reserve, the system can show changes of land use, vegetation cover and human activity monitoring elements in nature reserve. It is concluded that the accuracy, reliability and robustness of remote sensing image classification are improved by making full use of different disciplines theories and technologies, so that the land classification information of nature reserves can be identified and extracted more quickly and accurately, which can be used for land use planning, land use structure adjustment and government decision-making of nature reserves, and provides a forward method for effectively solving the main scientific problems and key technical problems of land use management in nature reserves under changing environment.","",""
1,"Samir Rachid Zaim, C. Kenost, J. Berghout, Wesley Chiu, Liam Wilson, H. Zhang, Y. Lussier","binomialRF: interpretable combinatoric efficiency of random forests to identify biomarker interactions",2020,"","","","",7,"2022-07-13 09:25:44","","10.1186/s12859-020-03718-9","","",,,,,1,0.50,0,7,2,"","",""
0,"Xinlei Mi, Baiming Zou, F. Zou, J. Hu","Permutation-based Identification of Important Biomarkers for Complex Diseases via Black-box Models",2020,"","","","",8,"2022-07-13 09:25:44","","10.1101/2020.04.27.064170","","",,,,,0,0.00,0,4,2,"Study of human disease remains challenging due to convoluted disease etiologies and complex molecular mechanisms at genetic, genomic, and proteomic levels. Many machine learning-based methods, including deep learning and random forest, have been developed and widely used to alleviate some analytic challenges in complex human disease studies. While enjoying the modeling flexibility and robustness, these model frameworks suffer from non-transparency and difficulty in interpreting the role of each individual feature due to their intrinsic black-box natures. However, identifying important biomarkers associated with complex human diseases is a critical pursuit towards assisting researchers to establish novel hypotheses regarding prevention, diagnosis and treatment of complex human diseases. Herein, we propose a Permutation-based Feature Importance Test (PermFIT) for estimating and testing the feature importance, and for assisting interpretation of individual feature in various black-box frameworks, including deep neural networks, random forests, and support vector machines. PermFIT (available at https://github.com/SkadiEye/deepTL) is implemented in a computationally efficient manner, without model refitting for each permuted data. We conduct extensive numerical studies under various scenarios, and show that PermFIT not only yields valid statistical inference, but also helps to improve the prediction accuracy of black-box models with top selected features. With the application to the Cancer Genome Atlas (TCGA) kidney tumor data and the HITChip atlas BMI data, PermFIT clearly demonstrates its practical usage in identifying important biomarkers and boosting performance of black-box predictive models.","",""
2,"Samir Rachid Zaim, C. Kenost, J. Berghout, Wesley Chiu, Liam Wilson, H. Zhang, Y. Lussier","binomialRF: interpretable combinatoric efficiency of random forests to identify biomarker interactions",2019,"","","","",9,"2022-07-13 09:25:44","","10.1186/s12859-020-03718-9","","",,,,,2,0.67,0,7,3,"","",""
15,"C. Goldman, M. Allen, S. Zilberstein","Decentralized language learning through acting",2004,"","","","",10,"2022-07-13 09:25:44","","10.1109/AAMAS.2004.99","","",,,,,15,0.83,5,3,18,"This paper presents an algorithm for learning the meaning of messages communicated between agents that interact while acting optimally towards a cooperative goal. Our reinforcement-learning method is based on Bayesian filtering and has been adapted for a decentralized control process. Empirical results shed light on the complexity of the learning problem, and on factors affecting the speed of convergence. Designing intelligent agents able to adapt their mutual interpretation of messages exchanged, in order to improve overall task-oriented performance, introduces an essential cognitive capability that can upgrade the current state of the art in multi-agent and human-machine systems to the next level. Learning to communicate while acting will add to the robustness and flexibility of these systems and hence to a more efficient and productive performance.","",""
179,"S. Michie, James Thomas, M. Johnston, Pol Mac Aonghusa, J. Shawe-Taylor, M. Kelly, L. Deleris, Ailbhe N. Finnerty, M. Marques, E. Norris, A. O'Mara-Eves, R. West","The Human Behaviour-Change Project: harnessing the power of artificial intelligence and machine learning for evidence synthesis and interpretation",2017,"","","","",11,"2022-07-13 09:25:44","","10.1186/s13012-017-0641-5","","",,,,,179,35.80,18,12,5,"","",""
15,"Vivek Kumar, D. Recupero, Daniele Riboni, Rim Helaoui","Ensembling Classical Machine Learning and Deep Learning Approaches for Morbidity Identification From Clinical Notes",2021,"","","","",12,"2022-07-13 09:25:44","","10.1109/ACCESS.2020.3043221","","",,,,,15,15.00,4,4,1,"The past decade has seen an explosion of the amount of digital information generated within the healthcare domain. Digital data exist in the form of images, video, speech, transcripts, electronic health records, clinical records, and free-text. Analysis and interpretation of healthcare data is a daunting task, and it demands a great deal of time, resources, and human effort. In this paper, we focus on the problem of co-morbidity recognition from patient’s clinical records. To this aim, we employ both classical machine learning and deep learning approaches. We use word embeddings and bag-of-words representations, coupled with feature selection techniques. The goal of our work is to develop a classification system to identify whether a certain health condition occurs for a patient by studying his/her past clinical records. In more detail, we have used pre-trained word2vec, domain-trained, GloVe, fastText, and universal sentence encoder embeddings to tackle the classification of sixteen morbidity conditions within clinical records. We have compared the outcomes of classical machine learning and deep learning approaches with the employed feature representation methods and feature selection methods. We present a comprehensive discussion of the performances and behaviour of the employed classical machine learning and deep learning approaches. Finally, we have also used ensemble learning techniques over a large number of combinations of classifiers to improve the single model performance. For our experiments, we used the n2c2 natural language processing research dataset, released by Harvard Medical School. The dataset is in the form of clinical notes that contain patient discharge summaries. Given the unbalancedness of the data and their small size, the experimental results indicate the advantage of the ensemble learning technique with respect to single classifier models. In particular, the ensemble learning technique has slightly improved the performances of single classification models but has greatly reduced the variance of predictions stabilizing the accuracies (i.e., the lower standard deviation in comparison with single classifiers). In real-life scenarios, our work can be employed to identify with high accuracy morbidity conditions of patients by feeding our tool with their current clinical notes. Moreover, other domains where classification is a common problem might benefit from our approach as well.","",""
24,"V. Croce, G. Caroti, L. D. Luca, K. Jacquot, A. Piemonte, P. Véron","From the Semantic Point Cloud to Heritage-Building Information Modeling: A Semiautomatic Approach Exploiting Machine Learning",2021,"","","","",13,"2022-07-13 09:25:44","","10.3390/rs13030461","","",,,,,24,24.00,4,6,1,"This work presents a semi-automatic approach to the 3D reconstruction of HeritageBuilding Information Models from point clouds based on machine learning techniques. The use of digital information systems leveraging on three-dimensional (3D) representations in architectural heritage documentation and analysis is ever increasing. For the creation of such repositories, realitybased surveying techniques, such as photogrammetry and laser scanning, allow the fast collection of reliable digital replicas of the study objects in the form of point clouds. Besides, their output is raw and unstructured, and the transition to intelligible and semantic 3D representations is still a scarcely automated and time-consuming process requiring considerable human intervention. More refined methods for 3D data interpretation of heritage point clouds are therefore sought after. In tackling these issues, the proposed approach relies on (i) the application of machine learning techniques to semantically label 3D heritage data by identification of relevant geometric, radiometric and intensity features, and (ii) the use of the annotated data to streamline the construction of Heritage-Building Information Modeling (H-BIM) systems, where purely geometric information derived from surveying is associated with semantic descriptors on heritage documentation and management. The “GrandDucal Cloister” dataset, related to the emblematic case study of the Pisa Charterhouse, is discussed.","",""
13,"Tharindu Kaluarachchi, Andrew Reis, Suranga Nanayakkara","A Review of Recent Deep Learning Approaches in Human-Centered Machine Learning",2021,"","","","",14,"2022-07-13 09:25:44","","10.3390/s21072514","","",,,,,13,13.00,4,3,1,"After Deep Learning (DL) regained popularity recently, the Artificial Intelligence (AI) or Machine Learning (ML) field is undergoing rapid growth concerning research and real-world application development. Deep Learning has generated complexities in algorithms, and researchers and users have raised concerns regarding the usability and adoptability of Deep Learning systems. These concerns, coupled with the increasing human-AI interactions, have created the emerging field that is Human-Centered Machine Learning (HCML). We present this review paper as an overview and analysis of existing work in HCML related to DL. Firstly, we collaborated with field domain experts to develop a working definition for HCML. Secondly, through a systematic literature review, we analyze and classify 162 publications that fall within HCML. Our classification is based on aspects including contribution type, application area, and focused human categories. Finally, we analyze the topology of the HCML landscape by identifying research gaps, highlighting conflicting interpretations, addressing current challenges, and presenting future HCML research opportunities.","",""
27,"Dezhen Xiong, Daohui Zhang, Xingang Zhao, Yiwen Zhao","Deep Learning for EMG-based Human-Machine Interaction: A Review",2021,"","","","",15,"2022-07-13 09:25:44","","10.1109/JAS.2021.1003865","","",,,,,27,27.00,7,4,1,"Electromyography (EMG) has already been broadly used in human-machine interaction (HMI) applications. Determining how to decode the information inside EMG signals robustly and accurately is a key problem for which we urgently need a solution. Recently, many EMG pattern recognition tasks have been addressed using deep learning methods. In this paper, we analyze recent papers and present a literature review describing the role that deep learning plays in EMG-based HMI. An overview of typical network structures and processing schemes will be provided. Recent progress in typical tasks such as movement classification, joint angle prediction, and force/torque estimation will be introduced. New issues, including multimodal sensing, inter-subject/inter-session, and robustness toward disturbances will be discussed. We attempt to provide a comprehensive analysis of current research by discussing the advantages, challenges, and opportunities brought by deep learning. We hope that deep learning can aid in eliminating factors that hinder the development of EMG-based HMI systems. Furthermore, possible future directions will be presented to pave the way for future research.","",""
16,"Md. Mokhlesur Rahman, K. Paul, Md. Amjad Hossain, G. Ali, Md. Shahinoor Rahman, J. Thill","Machine Learning on the COVID-19 Pandemic, Human Mobility and Air Quality: A Review",2021,"","","","",16,"2022-07-13 09:25:44","","10.1109/ACCESS.2021.3079121","","",,,,,16,16.00,3,6,1,"The ongoing COVID-19 global pandemic is touching every facet of human lives (e.g., public health, education, economy, transportation, and the environment). This novel pandemic and non-pharmaceutical interventions of lockdown and confinement implemented citywide, regionally or nationally are affecting virus transmission, people’s travel patterns, and air quality. Many studies have been conducted to predict the diffusion of the COVID-19 disease, assess the impacts of the pandemic on human mobility and on air quality, and assess the impacts of lockdown measures on viral spread with a range of Machine Learning (ML) techniques. This literature review aims to analyze the results from past research to understand the interactions among the COVID-19 pandemic, lockdown measures, human mobility, and air quality. The critical review of prior studies indicates that urban form, people’s socioeconomic and physical conditions, social cohesion, and social distancing measures significantly affect human mobility and COVID-19 viral transmission. During the COVID-19 pandemic, many people are inclined to use private transportation for necessary travel to mitigate coronavirus-related health problems. This review study also noticed that COVID-19 related lockdown measures significantly improve air quality by reducing the concentration of air pollutants, which in turn improves the COVID-19 situation by reducing respiratory-related sickness and deaths. It is argued that ML is a powerful, effective, and robust analytic paradigm to handle complex and wicked problems such as a global pandemic. This study also explores the spatio-temporal aspects of lockdown and confinement measures on coronavirus diffusion, human mobility, and air quality. Additionally, we discuss policy implications, which will be helpful for policy makers to take prompt actions to moderate the severity of the pandemic and improve urban environments by adopting data-driven analytic methods.","",""
3,"Xubo Leng, Margot Wohl, Kenichi Ishii, Pavan Nayak, Kenta Asahina","Quantitative comparison of Drosophila behavior annotations by human observers and a machine learning algorithm",2020,"","","","",17,"2022-07-13 09:25:44","","10.1101/2020.06.16.153130","","",,,,,3,1.50,1,5,2,"Automated quantification of behavior is increasingly prevalent in neuroscience research. Human judgments can influence machine-learning-based behavior classification at multiple steps in the process, for both supervised and unsupervised approaches. Such steps include the design of the algorithm for machine learning, the methods used for animal tracking, the choice of training images, and the benchmarking of classification outcomes. However, how these design choices contribute to the interpretation of automated behavioral classifications has not been extensively characterized. Here, we quantify the effects of experimenter choices on the outputs of automated classifiers of Drosophila social behaviors. Drosophila behaviors contain a considerable degree of variability, which was reflected in the confidence levels associated with both human and computer classifications. We found that a diversity of sex combinations and tracking features was important for robust performance of the automated classifiers. In particular, features concerning the relative position of flies contained useful information for training a machine-learning algorithm. These observations shed light on the importance of human influence on tracking algorithms, the selection of training images, and the quality of annotated sample images used to benchmark the performance of a classifier (the ‘ground truth’). Evaluation of these factors is necessary for researchers to accurately interpret behavioral data quantified by a machine-learning algorithm and to further improve automated classifications. Significance Statement Accurate quantification of animal behaviors is fundamental to neuroscience. Here, we quantitatively assess how human choices influence the performance of automated classifiers trained by a machine-learning algorithm. We found that human decisions about the computational tracking method, the training images, and the images used for performance evaluation impact both the classifier outputs and how human observers interpret the results. These factors are sometimes overlooked but are critical, especially because animal behavior is itself inherently variable. Automated quantification of animal behavior is becoming increasingly prevalent: our results provide a model for bridging the gap between traditional human annotations and computer-based annotations. Systematic assessment of human choices is important for developing behavior classifiers that perform robustly in a variety of experimental conditions.","",""
