Cites,Authors,Title,Year,Source,Publisher,ArticleURL,CitesURL,GSRank,QueryDate,Type,DOI,ISSN,CitationURL,Volume,Issue,StartPage,EndPage,ECC,CitesPerYear,CitesPerAuthor,AuthorCount,Age,Abstract,FullTextURL,RelatedURL
103,"F. Granata, S. Papirio, G. Esposito, R. Gargano, G. D. Marinis","Machine Learning Algorithms for the Forecasting of Wastewater Quality Indicators",2017,"","","","",144,"2022-07-13 09:25:44","","10.3390/W9020105","","",,,,,103,20.60,21,5,5,"Stormwater runoff is often contaminated by human activities. Stormwater discharge into water bodies significantly contributes to environmental pollution. The choice of suitable treatment technologies is dependent on the pollutant concentrations. Wastewater quality indicators such as biochemical oxygen demand (BOD5), chemical oxygen demand (COD), total suspended solids (TSS), and total dissolved solids (TDS) give a measure of the main pollutants. The aim of this study is to provide an indirect methodology for the estimation of the main wastewater quality indicators, based on some characteristics of the drainage basin. The catchment is seen as a black box: the physical processes of accumulation, washing, and transport of pollutants are not mathematically described. Two models deriving from studies on artificial intelligence have been used in this research: Support Vector Regression (SVR) and Regression Trees (RT). Both the models showed robustness, reliability, and high generalization capability. However, with reference to coefficient of determination R2 and root‐mean square error, Support Vector Regression showed a better performance than Regression Tree in predicting TSS, TDS, and COD. As regards BOD5, the two models showed a comparable performance. Therefore, the considered machine learning algorithms may be useful for providing an estimation of the values to be considered for the sizing of the treatment units in absence of direct measures.","",""
15,"G. E. Jergensen, A. McGovern, Ryan Lagerquist, Travis M. Smith","Classifying Convective Storms Using Machine Learning",2019,"","","","",145,"2022-07-13 09:25:44","","10.1175/waf-d-19-0170.1","","",,,,,15,5.00,4,4,3,"  We demonstrate that machine learning (ML) can skillfully classify thunderstorms into three categories: supercell, part of a quasi-linear convective system, or disorganized. These classifications are based on radar data and environmental information obtained through a proximity sounding. We compare the performance of five ML algorithms: logistic regression with the elastic-net penalty, random forests, gradient-boosted forests, and support-vector machines with both a linear and nonlinear kernel. The gradient-boosted forest performs best, with an accuracy of 0.77 ± 0.02 and a Peirce score of 0.58 ± 0.04. The linear support-vector machine performs second best, with values of 0.70 ± 0.02 and 0.55 ± 0.05, respectively. We use two interpretation methods, permutation importance and sequential forward selection, to determine the most important predictors for the ML models. We also use partial-dependence plots to determine how these predictors influence the outcome. A main conclusion is that shape predictors, based on the outline of the storm, appear to be highly important across ML models. The training data, a storm-centered radar scan and modeled proximity sounding, are similar to real-time data. Thus, the models could be used operationally to aid human decision-making by reducing the cognitive load involved in manual storm-mode identification. Also, they could be run on historical data to perform climatological analyses, which could be valuable to both the research and operational communities.","",""
103,"Baibhab Chatterjee, D. Das, Shovan Maity, Shreyas Sen","RF-PUF: Enhancing IoT Security Through Authentication of Wireless Nodes Using In-Situ Machine Learning",2018,"","","","",146,"2022-07-13 09:25:44","","10.1109/JIOT.2018.2849324","","",,,,,103,25.75,26,4,4,"Traditional authentication in radio-frequency (RF) systems enable secure data communication within a network through techniques such as digital signatures and hash-based message authentication codes (HMAC), which suffer from key-recovery attacks. State-of-the-art Internet of Things networks such as Nest also use open authentication (OAuth 2.0) protocols that are vulnerable to cross-site-recovery forgery (CSRF), which shows that these techniques may not prevent an adversary from copying or modeling the secret IDs or encryption keys using invasive, side channel, learning or software attacks. Physical unclonable functions (PUFs), on the other hand, can exploit manufacturing process variations to uniquely identify silicon chips which makes a PUF-based system extremely robust and secure at low cost, as it is practically impossible to replicate the same silicon characteristics across dies. Taking inspiration from human communication, which utilizes inherent variations in the voice signatures to identify a certain speaker, we present RF-PUF: a deep neural network-based framework that allows real-time authentication of wireless nodes, using the effects of inherent process variation on RF properties of the wireless transmitters (Tx), detected through in-situ machine learning at the receiver (Rx) end. The proposed method utilizes the already-existing asymmetric RF communication framework and does not require any additional circuitry for PUF generation or feature extraction. The burden of device identification is completely shifted to the gateway Rx, similar to the operation of a human listener’s brain. Simulation results involving the process variations in a standard 65-nm technology node, and features such as local oscillator offset and  ${I}$ – ${Q}$  imbalance detected with a neural network having 50 neurons in the hidden layer indicate that the framework can distinguish up to 4800 Tx(s) with an accuracy of 99.9% [≈99% for 10000 Tx(s)] under varying channel conditions, and without the need for traditional preambles. The proposed scheme can be used as a stand-alone security feature, or as a part of traditional multifactor authentication.","",""
23,"J. Zhang, Kang Liu, Faiq Khalid, Muhammad Abdullah Hanif, Semeen Rehman, T. Theocharides, Alessandro Artussi, M. Shafique, S. Garg","Building Robust Machine Learning Systems: Current Progress, Research Challenges, and Opportunities",2019,"","","","",147,"2022-07-13 09:25:44","","10.1145/3316781.3323472","","",,,,,23,7.67,3,9,3,"Machine learning, in particular deep learning, is being used in almost all the aspects of life to facilitate humans, specifically in mobile and Internet of Things (IoT)-based applications. Due to its state-of-the-art performance, deep learning is also being employed in safety-critical applications, for instance, autonomous vehicles. Reliability and security are two of the key required characteristics for these applications because of the impact they can have on human's life. Towards this, in this paper, we highlight the current progress, challenges and research opportunities in the domain of robust systems for machine learning-based applications.","",""
12,"Kristoffer Hougaard Madsen, L. Krohne, Xin-Lu Cai, Yi Wang, R. Chan","Perspectives on Machine Learning for Classification of Schizotypy Using fMRI Data.",2018,"","","","",148,"2022-07-13 09:25:44","","10.1093/schbul/sby026","","",,,,,12,3.00,2,5,4,"Functional magnetic resonance imaging is capable of estimating functional activation and connectivity in the human brain, and lately there has been increased interest in the use of these functional modalities combined with machine learning for identification of psychiatric traits. While these methods bear great potential for early diagnosis and better understanding of disease processes, there are wide ranges of processing choices and pitfalls that may severely hamper interpretation and generalization performance unless carefully considered. In this perspective article, we aim to motivate the use of machine learning schizotypy research. To this end, we describe common data processing steps while commenting on best practices and procedures. First, we introduce the important role of schizotypy to motivate the importance of reliable classification, and summarize existing machine learning literature on schizotypy. Then, we describe procedures for extraction of features based on fMRI data, including statistical parametric mapping, parcellation, complex network analysis, and decomposition methods, as well as classification with a special focus on support vector classification and deep learning. We provide more detailed descriptions and software as supplementary material. Finally, we present current challenges in machine learning for classification of schizotypy and comment on future trends and perspectives.","",""
45,"Geir Thore Berge, Ole-Christoffer Granmo, T. Tveit, Morten Goodwin, Lei Jiao, B. Matheussen","Using the Tsetlin Machine to Learn Human-Interpretable Rules for High-Accuracy Text Categorization With Medical Applications",2018,"","","","",149,"2022-07-13 09:25:44","","10.1109/ACCESS.2019.2935416","","",,,,,45,11.25,8,6,4,"Medical applications challenge today’s text categorization techniques by demanding both high accuracy and ease-of-interpretation. Although deep learning has provided a leap forward in regard to accuracy, this leap comes at the sacrifice of interpretability. In this paper, we introduce a text categorization approach that leverages the recently introduced Tsetlin Machine to address this accuracy-interpretability challenge. Briefly, we represent the terms of a text as propositional variables. From these variables, we capture categories using simple propositional formulae, such as: IF “rash” AND “reaction” AND “penicillin” THEN Allergy. The Tsetlin Machine learns these formulae from labeled text, utilizing conjunctive clauses to represent the particular facets of each category. Therefore, also the absence of terms (negated features) can be used for categorization purposes. Our empirical comparisons with Naïve Bayes classifiers, decision trees, linear support vector machines (SVMs), random forest, long short-term memory (LSTM) neural networks, and other techniques, are quite conclusive. Using relatively simple propositional formulae, the accuracy of the Tsetlin Machine either outperforms or performs approximately on par with the best evaluated methods on both the 20 Newsgroups and IMDb datasets, as well as on a clinical dataset containing authentic electronic health records (EHRs). On average, the Tsetlin Machine delivers the best recall and precision scores across the datasets. The main merit of the proposed approach is thus its capacity for producing human-interpretable rules, while at the same time achieving acceptable accuracy. We believe that our novel approach can have a significant impact on a wide range of text analysis applications, providing a promising starting point for deeper natural language understanding with the Tsetlin Machine.","",""
6,"Tanya Tiwari, Tanuj Tiwari, Sanjay Tiwari","How Artificial Intelligence, Machine Learning and Deep Learning are Radically Different?",2018,"","","","",150,"2022-07-13 09:25:44","","10.23956/IJARCSSE.V8I2.569","","",,,,,6,1.50,2,3,4,"There is a lot of confusion these days about Artificial Intelligence (AI), Machine Learning (ML) and Deep Learning (DL). A computer system able to perform tasks that normally require human intelligence, such as visual perception, speech recognition, decision-making, and translation between languages. Artificial Intelligence has made it possible. Deep learning is a subset of machine learning, and machine learning is a subset of AI, which is an umbrella term for any computer program that does something smart. In other words, all machine learning is AI, but not all AI is machine learning, and so forth. Machine Learning represents a key evolution in the fields of computer science, data analysis, software engineering, and artificial intelligence. Machine learning (ML)is a vibrant field of research, with a range of exciting areas for further development across different methods and applications. These areas include algorithmic interpretability, robustness, privacy, fairness, inference of causality, human-machine interaction, and security. The goal of ML is never to make “perfect” guesses, because ML deals in domains where there is no such thing. The goal is to make guesses that are good enough to be useful. Deep learning is a particular kind of machine learning that achieves great power and flexibility by learning to represent the world as nested hierarchy of concepts, with each concept defined in relation to simpler concepts, and more abstract representations computed in terms of less abstract ones. This paper gives an overview of artificial intelligence, machine learning & deep learning techniques and compare these techniques.","",""
16,"Phil Legg, Jim E. Smith, A. Downing","Visual analytics for collaborative human-machine confidence in human-centric active learning tasks",2019,"","","","",151,"2022-07-13 09:25:44","","10.1186/s13673-019-0167-8","","",,,,,16,5.33,5,3,3,"","",""
8,"Ruichuan Zhang, N. El-Gohary","A Machine Learning Approach for Compliance Checking-Specific Semantic Role Labeling of Building Code Sentences",2018,"","","","",152,"2022-07-13 09:25:44","","10.1007/978-3-030-00220-6_67","","",,,,,8,2.00,4,2,4,"","",""
31,"Amirata Ghorbani, David Ouyang, Abubakar Abid, B. He, Jonathan H. Chen, R. Harrington, D. Liang, E. Ashley, James Y. Zou","Deep learning interpretation of echocardiograms",2020,"","","","",153,"2022-07-13 09:25:44","","10.1038/s41746-019-0216-8","","",,,,,31,15.50,3,9,2,"","",""
7,"M. Asiedu, Anish K. Simhal, Christopher T Lam, Jenna L. Mueller, Usamah N. Chaudhary, J. W. Schmitt, G. Sapiro, N. Ramanujam","Image processing and machine learning techniques to automate diagnosis of Lugol's iodine cervigrams for a low-cost point-of-care digital colposcope",2018,"","","","",154,"2022-07-13 09:25:44","","10.1117/12.2282792","","",,,,,7,1.75,1,8,4,"The world health organization recommends visual inspection with acetic acid (VIA) and/or Lugol’s Iodine (VILI) for cervical cancer screening in low-resource settings. Human interpretation of diagnostic indicators for visual inspection is qualitative, subjective, and has high inter-observer discordance, which could lead both to adverse outcomes for the patient and unnecessary follow-ups. In this work, we a simple method for automatic feature extraction and classification for Lugol’s Iodine cervigrams acquired with a low-cost, miniature, digital colposcope. Algorithms to preprocess expert physician-labelled cervigrams and to extract simple but powerful color-based features are introduced. The features are used to train a support vector machine model to classify cervigrams based on expert physician labels. The selected framework achieved a sensitivity, specificity, and accuracy of 89.2%, 66.7% and 80.6% with majority diagnosis of the expert physicians in discriminating cervical intraepithelial neoplasia (CIN +) relative to normal tissues. The proposed classifier also achieved an area under the curve of 84 when trained with majority diagnosis of the expert physicians. The results suggest that utilizing simple color-based features may enable unbiased automation of VILI cervigrams, opening the door to a full system of low-cost data acquisition complemented with automatic interpretation.","",""
11,"J. Halotel, V. Demyanov, A. Gardiner","Value of Geologically Derived Features in Machine Learning Facies Classification",2019,"","","","",155,"2022-07-13 09:25:44","","10.1007/s11004-019-09838-0","","",,,,,11,3.67,4,3,3,"","",""
78,"Peter Buhlmann","Invariance, Causality and Robustness",2018,"","","","",156,"2022-07-13 09:25:44","","10.1214/19-sts721","","",,,,,78,19.50,78,1,4,"We discuss recent work for causal inference and predictive robustness in a unifying way. The key idea relies on a notion of probabilistic invariance or stability: it opens up new insights for formulating causality as a certain risk minimization problem with a corresponding notion of robustness. The invariance itself can be estimated from general heterogeneous or perturbation data which frequently occur with nowadays data collection. The novel methodology is potentially useful in many applications, offering more robustness and better “causal-oriented” interpretation than machine learning or estimation in standard regression or classification frameworks.","",""
12,"Atik Mahabub","A robust voting approach for diabetes prediction using traditional machine learning techniques",2019,"","","","",157,"2022-07-13 09:25:44","","10.1007/s42452-019-1759-7","","",,,,,12,4.00,12,1,3,"","",""
12,"Andrew Pilny, Kelly G. McAninch, A. Slone, Kelsey P. Moore","Using Supervised Machine Learning in Automated Content Analysis: An Example Using Relational Uncertainty",2019,"","","","",158,"2022-07-13 09:25:44","","10.1080/19312458.2019.1650166","","",,,,,12,4.00,3,4,3,"ABSTRACT The goal of this research is to make progress towards using supervised machine learning for automated content analysis dealing with complex interpretations of text. For Step 1, two humans coded a sub-sample of online forum posts for relational uncertainty. For Step 2, we evaluated reliability, in which we trained three different classifiers to learn from those subjective human interpretations. Reliability was established when two different metrics of inter-coder reliability could not distinguish whether a human or a machine coded the text on a separate hold-out set. Finally, in Step 3 we assessed validity. To accomplish this, we administered a survey in which participants described their own relational uncertainty/certainty via text and completed a questionnaire. After classifying the text, the machine’s classifications of the participants’ text positively correlated with the subjects’ own self-reported relational uncertainty and relational satisfaction. We discuss our results in line with areas of computational communication science, content analysis, and interpersonal communication.","",""
21,"M. Yazdani, Bryn C. Taylor, Justine W. Debelius, Weizhong Li, R. Knight, L. Smarr","Using machine learning to identify major shifts in human gut microbiome protein family abundance in disease",2016,"","","","",159,"2022-07-13 09:25:44","","10.1109/BIGDATA.2016.7840731","","",,,,,21,3.50,4,6,6,"Inflammatory Bowel Disease (IBD) is an autoimmune condition that is observed to be associated with major alterations in the gut microbiome taxonomic composition. Here we classify major changes in microbiome protein family abundances between healthy subjects and IBD patients. We use machine learning to analyze results obtained previously from computing relative abundance of ∼10,000 KEGG orthologous protein families in the gut microbiome of a set of healthy individuals and IBD patients. We develop a machine learning pipeline, involving the Kolomogorv-Smirnov test, to identify the 100 most statistically significant entries in the KEGG database. Then we use these 100 as a training set for a Random Forest classifier to determine ∼5% the KEGGs which are best at separating disease and healthy states. Lastly, we developed a Natural Language Processing classifier of the KEGG description files to predict KEGG relative over-or under-abundance. As we expand our analysis from 10,000 KEGG protein families to one million proteins identified in the gut microbiome, scalable methods for quickly identifying such anomalies between health and disease states will be increasingly valuable for biological interpretation of sequence data.","",""
11,"P. Poudel, A. Illanes, E. Ataide, N. Esmaeili, Sathish Balakrishnan, M. Friebe","Thyroid Ultrasound Texture Classification Using Autoregressive Features in Conjunction With Machine Learning Approaches",2019,"","","","",160,"2022-07-13 09:25:44","","10.1109/ACCESS.2019.2923547","","",,,,,11,3.67,2,6,3,"The thyroid is one of the largest endocrine glands in the human body, which is involved in several body mechanisms like controlling protein synthesis, use of energy sources, and controlling the body’s sensitivity to other hormones. Thyroid segmentation and volume reconstruction are hence essential to diagnose thyroid related diseases as most of these diseases involve a change in the shape and size of the thyroid over time. Classification of thyroid texture is the first step toward the segmentation of the thyroid. The classification of texture in thyroid Ultrasound (US) images is not an easy task as it suffers from low image contrast, presence of speckle noise, and non-homogeneous texture distribution inside the thyroid region. Hence, a robust algorithmic approach is required to accurately classify thyroid texture. In this paper, we propose three machine learning based approaches: Support Vector Machine; Artificial Neural Network; and Random Forest Classifier to classify thyroid texture. The computation of features for training these classifiers is based on a novel approach recently proposed by our team, where autoregressive modeling was applied on a signal version of the 2D thyroid US images to compute 30 spectral energy-based features for classifying the thyroid and non-thyroid textures. Our approach differs from the methods proposed in the literature as they use image-based features to characterize thyroid tissues. We obtained an accuracy of around 90% with all the three methods.","",""
38,"G. Caravagna, Timon Heide, Marc J. Williams, L. Zapata, D. Nichol, K. Chkhaidze, W. Cross, G. Cresswell, B. Werner, A. Acar, L. Chesler, C. Barnes, G. Sanguinetti, T. Graham, A. Sottoriva","Subclonal reconstruction of tumors using machine learning and population genetics",2020,"","","","",161,"2022-07-13 09:25:44","","10.1038/s41588-020-0675-5","","",,,,,38,19.00,4,15,2,"","",""
9,"S. Aich, Sabyasachi Chakraborty, J. Sim, Dong-Jin Jang, Hee-Cheol Kim","The Design of an Automated System for the Analysis of the Activity and Emotional Patterns of Dogs with Wearable Sensors Using Machine Learning",2019,"","","","",162,"2022-07-13 09:25:44","","10.3390/app9224938","","",,,,,9,3.00,2,5,3,"The safety and welfare of companion animals such as dogs has become a large challenge in the last few years. To assess the well-being of a dog, it is very important for human beings to understand the activity pattern of the dog, and its emotional behavior. A wearable, sensor-based system is suitable for such ends, as it will be able to monitor the dogs in real-time. However, the question remains unanswered as to what kind of data should be used to detect the activity patterns and emotional patterns, as does another: what should be the location of the sensors for the collection of data and how should we automate the system? Yet these questions remain unanswered, because to date, there is no such system that can address the above-mentioned concerns. The main purpose of this study was (1) to develop a system that can detect the activities and emotions based on the accelerometer and gyroscope signals and (2) to automate the system with robust machine learning techniques for implementing it for real-time situations. Therefore, we propose a system which is based on the data collected from 10 dogs, including nine breeds of various sizes and ages, and both genders. We used machine learning classification techniques for automating the detection and evaluation process. The ground truth fetched for the evaluation process was carried out by taking video recording data in frame per second and the wearable sensors data were collected in parallel with the video recordings. Evaluation of the system was performed using an ANN (artificial neural network), random forest, SVM (support vector machine), KNN (k nearest neighbors), and a naïve Bayes classifier. The robustness of our system was evaluated by taking independent training and validation sets. We achieved an accuracy of 96.58% while detecting the activity and 92.87% while detecting emotional behavior, respectively. This system will help the owners of dogs to track their behavior and emotions in real-life situations for various breeds in different scenarios.","",""
