Cites,Authors,Title,Year,Source,Publisher,ArticleURL,CitesURL,GSRank,QueryDate,Type,DOI,ISSN,CitationURL,Volume,Issue,StartPage,EndPage,ECC,CitesPerYear,CitesPerAuthor,AuthorCount,Age,Abstract,FullTextURL,RelatedURL
11,"T. Tanprasert, C. Tanprasert, C. Lursinsap","Contour preserving classification for maximal reliability",1998,"","","","",148,"2022-07-13 09:28:33","","10.1109/IJCNN.1998.685930","","",,,,,11,0.46,4,3,24,"This paper demonstrates that the robustness and weight fault tolerance of a neural network trained to learn a linearly separable problem can be enhanced if the network classifies the problem nonlinearly. However, a multilayer perceptron type network trained by an existing learning algorithm can normally promote the linear separability of the problem, resulting in nonoptimal solution in terms of robustness and fault tolerance. In this paper, the technique for forcing the network to optimize its internal representation towards robustness and fault tolerance is presented. The technique introduces a concept of ""outpost"" vectors for hiding the unwanted linearly separable characteristics of problem. Since such a task is rather specific, the ""outpost"" vectors are deterministically determined rather than randomized.","",""
12,"Z. Sabir, M. Raja","Numeric treatment of nonlinear second order multi-point boundary value problems using ANN, GAs and sequential quadratic programming technique",2014,"","","","",149,"2022-07-13 09:28:33","","10.5267/J.IJIEC.2014.3.004","","",,,,,12,1.50,6,2,8,"In this paper, computational intelligence technique are presented for solving multi - point nonlinear boundary value problems based on artificial neural networks, evolutionary computing approach, and active-set technique. The neural network is to provide convenient methods for obtaining useful model based on unsupervised error for the differential equations. The motivation for presenting this work comes actually from the aim of introducing a reliable framework that combines the powerful features of ANN optimized with soft computing frameworks to cope with such challenging system. The applicability and reliability of such methods have been monitored thoroughly for various boundary value problems arises in science, engineering and biotechnology as well. Comprehensive numerical experimentations have been performed to validate the accuracy, convergence, and robustness of the designed scheme. Comparative studies have also been made with available standard solution to analyze the correctness of the proposed scheme.","",""
49,"K. Bichou, Michael G. H. Bell, A. Evans","Risk Management in Port Operations, Logistics and Supply Chain Security",2009,"","","","",150,"2022-07-13 09:28:33","","10.4324/9781315850504","","",,,,,49,3.77,16,3,13,"Part 1: Background Chapter 1. Marine Reporting and Maritime Security Mark Rowbotham Chapter 2. Global Trade System: Development Update Dean L. Kothmann Chapter 3. Developing and Implementing Global Interoperable Standards for Container Security Christoph Seidelmann Part 2: Systems For Enhancing Port Security and Operational Efficiency Chapter 4. Planning and Implementing RFID Technologies to Enhance Security in Port Operations Giovanni Luca Barletta and Khalid Bichou Chapter 5. Port Recovery from Security Incidents: A Simulation Approach Ghaith Rabadi, C. Ariel Pinto, Wayne Talley and Jean-Paul Arnaout Chapter 6. Security and Reliability of the Liner Container-Shipping Network: Analysis of Robustness Using a Complex Network Framework Panagiotis Angeloudis, Khalid Bichou and Michael G.H. Bell Chapter 7. Port Efficiency and the Stability of Container Liner Schedules Michael G.H. Bell, Khalid Bichou and Kevin Feldman Chapter 8. Predicting the Performance of Container Terminal Operations using Artificial Neural Network Richard Linn, Jiyin Liu, Yat-wah Wan and Chuqian Zhang Chapter 9. Container Terminal Operations under the Influence of Shipping Alliances Xiaoning Shi and Stefan Vos Part 3: Framework for Managing The Security of Global Trading and Supply Chain Systems Chapter 10. Voluntary Supply-Chain Security Programme Impacts: An Empirical Study with BASC Member Companies Ximena Gutierrez, Philippe Wieser and Juha Hintsa Chapter 11. Trade Disruption Insurance: An Effective Form of Risk Management in Supply-Chain Security? Risto Talas Chapter 12. The Co-Evolution of Safety Cultures and Crisis Management Capacitiesin Maritime Trading Systems Paul Barnes and Richard Oloruntoba Chapter 13. Maritime Container Security: A Cargo Interest Perspective Mary R. Brooks and Kenneth J. Button Chapter 14. Managing Maritime Security through Quality Management: A Case Study to Implement the 24-Hour Rule in a Liner Shipping Company Khalid Bichou, Kee-hung Lai, Y.H. Venus Lun and T.C. Edwin Cheng Chapter 15. Managing Supply Chain Security through Quality Standards: A Case Study to Implement ISO28000 in a Global Coffee House Francis D'Addario Part 4: Models For Analysing Security Risks and Policy Implications Chapter16. Maritime Security and Regulatory Risk-Based Models: Review and Critical Analysis Khalid Bichou and Andrew Evans Chapter 17. ISPS Code Implementation in Ports: Costs and Related Financing Hassiba Benamara and Regina Asariotis Chapter 18. Enhancing Port Security via the Enactment of EU Policies Athanasios A. Pallis and George K. Vaggelas Chapter 19. Strategic Risk Management in Ports S.N. Srikanth and Ramesh Venkataraman Chapter 20. Port Security and the Competitiveness of Short-Sea Shipping in Europe: Implications and Challenges Koi Yu Adolf Ng","",""
7,"Jie Zhang","Improved on-line process fault diagnosis using stacked neural networks",2002,"","","","",151,"2022-07-13 09:28:33","","10.1109/CCA.2002.1038684","","",,,,,7,0.35,7,1,20,"Since it is generally difficult, if not impossible, to develop a perfect neural network, a single neural network can lack reliability. Therefore a single neural network based fault diagnosis system may not give reliable fault diagnosis. Neural network model reliability or robustness can be improved by combining several non-perfect neural networks. Each individual network is trained on a bootstrap re-sample of the original training data. The outputs from the individual networks are averaged to give the final diagnosis results. Applications of the proposed method to a continuous stirred tank reactor demonstrate that a stacked neural network can give more reliable diagnosis than a single neural network.","",""
8,"Yu Tian, Yibing Li, Fang Ye","Multimodal medical image fusion based on nonsubsampled contourlet transform using improved PCNN",2016,"","","","",152,"2022-07-13 09:28:33","","10.1109/ICSP.2016.7877941","","",,,,,8,1.33,3,3,6,"Multimodal medical image fusion is an indispensable branch in the field of image fusion. In order to obtain a more complete and more reliable medical image, this paper presents a novel approach for multimodal medical image fusion using an improved pulse-coupled neural network (IPCNN) in nonsubsampled contourlet transform (NSCT) domain. First, the image is decomposed into sub-bands with different scales and different directions by NSP and NSDFB. Next, local area singular value is introduced to determine the structural information factor which will be the linking strength parameter of PCNN. After the fire process we can get the fire mapping images that can reflect the characteristics of single pixel and its neighborhood. Then, we extract the objects with salient features of the fire mapping images by compare-selection operator. Finally, we construct the fused image by inverse NSCT. Our proposed algorithm in multimodal medical image fusion is proved to perform better in robustness and reliability over the existing methods, meeting the requirement of human vision.","",""
7,"O. Kaynak, E. Grant, G. Honderd","Intelligent Systems: Safety, Reliability and Maintainability Issues",1993,"","","","",153,"2022-07-13 09:28:33","","10.1007/978-3-642-58021-5","","",,,,,7,0.24,2,3,29,"","",""
9,"A. Kamari, Farzaneh Moeini, Mohammad-Javad Shamsoddini-Moghadam, Seyedsajad Hosseini, A. Mohammadi, Abdolhossein Hemmati-Sarapardeh","Modeling the permeability of heterogeneous oil reservoirs using a robust method",2016,"","","","",154,"2022-07-13 09:28:33","","10.1007/s12303-015-0033-2","","",,,,,9,1.50,2,6,6,"","",""
3,"E. Kılıç, Osman Doğmuş, A. Gani, Sami Şit, Hasan Riza Özçalik","Simulation and Experimental Study of Vector Controlled Induction Motor Drive based on RBFNN-MRAC Controller",2017,"","","","",155,"2022-07-13 09:28:33","","","","",,,,,3,0.60,1,5,5,"This article presents implementation of model reference adaptive control (MRAC) based on radial basis function neural network (RBFNN) for vector controlled induction motor drive at real time. The widespread use of induction motors in today's industry is due to their robustness, high efficiency and operational reliability. However, great difficulties due to the very complex and non-linear structure are experienced in controlling this motor. The recent advances in areas of microprocessors and power electronics, along with the new control strategies based on artificial intelligence has led induction motors to be controlled more efficiently and reliably. Complex calculations such as coordinate transformations, field estimation algorithms and control algorithms used in the motor control can be easily done with digital signal processors which are powerful microcontrollers. In this study, a three-phase induction motor speed control system was designed using a microcontroller labeled as dsPIC30F6010A. The system consists of control board based on dsPIC30F6010A device, power module, three phase induction motor and DC generator that acts as a proper load. The rotor flux vector is estimated using the indirect field-oriented control technique, which is the most efficient scheme of vector control. The space vector pulse width modulation technique (SVPWM) is used in the switching of the three-phase inverter. The results show that the proposed RBFNN based MRAC scheme has better tracking performance than conventional PI controller for different references and loading conditions. The success and superiority of the proposed RBFNN based MRAC controller over the conventional PI controller was demonstrated by simulation and experimental studies.","",""
2,"N. P. Reddy, B. Rothschild","Hybrid fuzzy logic committee neural networks for classification in medical decision support systems",2002,"","","","",156,"2022-07-13 09:28:33","","10.1109/IEMBS.2002.1134372","","",,,,,2,0.10,1,2,20,"Recent emphasis on healthcare cost containment has created a growing need for developing automated diagnostic systems to aid the physician. Such systems should be reliable and robust. Neural networks have been used to provide advice to the physician. However, the reliability and robustness of a neural network depend on various factors such as the architecture, the initial weights used in training and the training data. In order to improve the reliability and robustness, we have developed hybrid intelligent systems with committee neural networks and fuzzy logic. Our concept of committee networks involves training and evaluating several networks and recruiting five networks into the committee based on initial testing. A majority opinion of the member networks of the committee is used to arrive at the final decision. The system reliability is improved since several networks in the committee are used in to make the decision. We have developed and evaluated hybrid intelligent systems with fuzzy logic and committee networks for distinguishing spondyloarthropathy of the knee from rheumatoid arthritis. Testing revealed that majority opinion of the committee well classified the arthritis.","",""
8,"K. Lout, R. Aggarwal","Current transients based phase selection and fault location in active distribution networks with spurs using artificial intelligence",2013,"","","","",157,"2022-07-13 09:28:33","","10.1109/PESMG.2013.6672428","","",,,,,8,0.89,4,2,9,"In electrical distribution networks, short-circuit faults are undesirable since they cause interruption of supply, affect system reliability and influence revenue for distribution companies. This paper investigates the use of current signals to determine the faulted phases during a fault and also proposes a novel approach to distinguish whether the fault lies on the feeder or one of the spurs. The distance of the fault from the substation is also evaluated using artificial neural network techniques and sensitivity tests further demonstrate the robustness of the proposed method.","",""
23,"M. Z. Al-Faiz, A. Ali, A. Miry","A k-nearest neighbor based algorithm for human arm movements recognition using EMG signals",2010,"","","","",158,"2022-07-13 09:28:33","","10.33762/EEEJ.2010.54888","","",,,,,23,1.92,8,3,12,"In a human-robot interface, the prediction of motion, which is based on context information of a task, has the potential to improve the robustness and reliability of motion classification to control human-assisting manipulators. The electromyography (EMG) signals can be used as a control source of artificial arm after it has been processed. The objective of this work is to achieve better classification with multiple parameters using K-Nearest Neighbor for different movements of a prosthetic arm. A K- Nearest Neighbor (K-NN) rule is one of the simplest and the most important methods in pattern recognition. The proposed structure is simulated using MATLAB Ver. R2009a, and satisfied results are obtained by comparing with conventional method of recognition using Artificial Neural Network(ANN), that explains the ability of the proposed structure to recognize the movements of human arm based EMG signals. Results show the proposed technique achieved a uniformly good performance with respect to ANN in term of time which is important in recognition systems, better accuracy in recognition when applied to lower SNR signal.","",""
17,"Hantao Liu, Junle Wang, J. Redi, P. Callet, I. Heynderickx","An efficient no-reference metric for perceived blur",2011,"","","","",159,"2022-07-13 09:28:33","","10.1109/EuVIP.2011.6045525","","",,,,,17,1.55,3,5,11,"This paper presents an efficient no-reference metric that quantifies perceived image quality induced by blur. Instead of explicitly simulating the human visual perception of blur, it calculates the local edge blur in a cost-effective way, and applies an adaptive neural network to empirically learn the highly nonlinear relationship between the local values and the overall image quality. Evaluation of the proposed metric using the LIVE blur database shows its high prediction accuracy at a largely reduced computational cost. To further validate the performance of the blur metric on its robustness against different image content, two additional quality perception experiments were conducted: one with highly textured natural images and one with images with an intentionally blurred background1. Experimental results demonstrate that the proposed blur metric is promising for real-world applications both in terms of computational efficiency and practical reliability.","",""
2,"DeyArijit, DasKunal, DeDebashis, DeMallika, DasSanjoy","Fan-out constraints in quantum dot cellular automata circuit design",2016,"","","","",160,"2022-07-13 09:28:33","","10.1680/JNAEN.15.00015","","",,,,,2,0.33,0,5,6,"In this paper, fan-out constraints are demonstrated for robust and reliable quantum dot cellular automata (QCA) device design. These QCA devices can be used to implement large and complex circuits without affecting the expected result. The tile-based QCA nanostructures are more robust and reliable. In this paper, the Hopfield artificial neural network (HANN) model is proposed to find out the robustness and the reliability of QCA nanostructure devices. This proposed HANN model demonstrates that the tile nanostructures of QCA devices are more robust and reliable for driving multiple fan-outs from a particular QCA device. The Kink energy was used in computing the polarity when considering multiple fan-outs. The tile three-input majority voter, the triple fan-out butterfly tile, the multiple fan-out tile structure and the five-input majority voter are the most robust and reliable structures for solving the fan-out problem in QCA and are described in this paper by the proposed HANN model.","",""
5,"A. Hosseini, S. Hussain, H. Gabbar","Simulation-Based Fault Propagation Analysis - Application on Hydrogen Production Plant",2013,"","","","",161,"2022-07-13 09:28:33","","10.1007/978-3-642-38577-3_45","","",,,,,5,0.56,2,3,9,"","",""
40,"S. P. Teeuwsen","Oscillatory Stability Assessment of Power Systems Using Computational Intelligence",2005,"","","","",162,"2022-07-13 09:28:33","","","","",,,,,40,2.35,40,1,17,"The main focus of this PhD Dissertation was the development of new assessment tools for Oscillatory Stability Assessment (OSA) of large power systems. Since the complete power system model is usually not available for analytical stability studies, the tools use Computational Intelligence (CI) applications such as neural networks, neuro-fuzzy, and decision trees. These CI methods are based only on a small set of data, which must represent the entire power system information. Therefore, feature selection is necessary.  Within this thesis, three methods for effective feature selection were developed. These selection methods apply the k-means cluster algorithm, the principal component analysis, decision trees, and genetic algorithms.  Changes in the network topology, the load situation, the operating point, and the influence of bad and missing data affect the quality and reliability of the proposed methods for OSA. The issues of robustness are discussed and methods for both bad data detection and restoration are developed. The bad data detection methods use similarity analysis, the principal component residuals, and time series analysis. The data restoration involves a neural network and non-linear sequential quadratic optimization.  Finally, in the case of a critical situation, the transmission system operator also would like to know how to prevent the system from collapse and which action will lead to a better-damped power system. Therefore, a new tool for counter measure computation is proposed. This tool implements the CI based OSA methods and provides the transmission system operator with information, which operator action will have a stability improving impact on the power system  Die Dissertation erscheint parallel im  Shaker Verlag, Aachen,2005. - ISBN 3-8322-4037-3","",""
48,"T. I. Liu, W. Chen, K. S. Anatharaman","INTELLIGENT DETECTION OF DRILL WEAR",1998,"","","","",163,"2022-07-13 09:28:33","","10.1006/MSSP.1998.0165","","",,,,,48,2.00,16,3,24,"Abstract Backpropagation neural networks (BPNs) were used for on-line detection of drill wear. The neural network consisted of three layers: input, hidden, and output. The input vector comprised drill size, feed rate, spindle speed, and eight features obtained by processing the thrust and torque signals. The output was the drill wear state which either usable or failure. Drilling experiments with various drill sizes, feed rates and spindle speeds were carried out. The learning process was performed effectively by utilising backpropagation with smoothing and an activation function slope. The on-line detection of drill wear states using BPNs achieved 100% reliability even when the drill size, feed rate and spindle speed were changed. In other words, the developed on-line drill wear detection systems have very high robustness and hence can be used in very complex production environments, such as flexible manufacturing systems.","",""
3,"Jiahui Xu, W. Ju, Zhongwen Hu","Object-oriented land cover classification of HJ-1B CCD image through multiple classifier fusion",2012,"","","","",164,"2022-07-13 09:28:33","","10.1109/Geoinformatics.2012.6270346","","",,,,,3,0.30,1,3,10,"Recently, classifier fusion has shown great potential to increase classification accuracy beyond the level reached by individual classifiers. In this work, we design a strategy to fuse several classifiers aim to improve the land cover classification accuracy effectively. Use the multi-spectral remote sensing image of HJ-1B CCD as the data source, the correlations of different raster bands are analyzed and different features are extracted for multi-resolution image segmentation and classification, such as the NDVI, NDWI. And then, several classifiers are adopted for object-oriented land cover classification, including multiple support vector machine (SVM) with the core of the radial based function (RBF), SVM with the core of linear function, Neural network (BP), decision tree of rough set, random forest, and K nearest neighbor. Finally, classification results from different classifiers are fused to improve the reliability and robustness of the results. A case study using HJ-1B multispectral images located in ShanXi province has proved the effectiveness of the proposed method.","",""
1,"M. Fatemi, F. Fadaei","Quantitative Structure Activity Relationship Prediction of Oral Bioavailabilities Using Support Vector Machine",2014,"","","","",165,"2022-07-13 09:28:33","","10.5012/JKCS.2014.58.6.543","","",,,,,1,0.13,1,2,8,"A quantitative structure activity relationship (QSAR) study is performed for modeling and prediction of oral bioavailabilities of 216 diverse set of drugs. After calculation and screening of molecular descriptors, linear and nonlinear models were developed by using multiple linear regression (MLR), artificial neural network (ANN), support vector machine (SVM) and random forest (RF) techniques. Comparison between statistical parameters of these models indicates the suitability of SVM over other models. The root mean square errors of SVM model were 5.933 and 4.934 for training and test sets, respectively. Robustness and reliability of the developed SVM model was evaluated by performing of leave many out cross validation test, which produces the statistic of QSVM 2 = 0.603 and SPRESS = 7.902. Moreover, the chemical applicability domains of model were determined via leverage approach. The results of this study revealed the applicability of QSAR approach by using SVM in prediction of oral bioavailability of drugs.","",""
1,"Shi Sheng-g","Triangle Algorithm Overview of Star Pattern Recognition",2014,"","","","",166,"2022-07-13 09:28:33","","","","",,,,,1,0.13,1,1,8,"In modern aerospace, according to star pattern distribution status obtained by star sensors, the atti-tudes of space vehicle are obtained. It has widely application for high reliability, confidentiality, accuracy and wide-ly suitable range. Firstly, traditional recognition algorithm is introduced. And then, improved algorithms referred inrecent years are summarized. And improved triangle, vector index, string index, parameter identification without cal-ibration and based on neural network and support vector machine algorithm are respectively introduced in detail.These methods in the area of recognition speed, success rate and real-time ability are improved to some extent. Atthe condition of low false alarm, the robustness of the algorithm is improved. Finally, the shortcomings of currentstar sensor identification methods are summarized and the development trends are forecasted.","",""
17,"G. Rao, G. R. Babu, G. Kumari, N. Chaitanya","Methodological Approach for Machine based Expression and Gender Classification",2009,"","","","",167,"2022-07-13 09:28:33","","10.1109/IADCC.2009.4809216","","",,,,,17,1.31,4,4,13,"Machine based Gender classification is one of the challenging problem to the computer science researchers. The effortless ability exhibited by a two year kid for the same needs immense computation power for the computing machines. Many people attempted this problem by using different psychological characteristics such as handwriting, speech recognition, query response etc. These computational intensive techniques are application based and classification efficiency is limited. Some of the face identification systems have used the pixel based information, Eigen faces and geometrical relations of the facial features. We present a neural network-based upright invariant frontal face detection system which can classify the Gender based on the facial information. In our approach we club the pixel based and geometric facial features to increase the reliability of classification process. The use of pi-sigma neural network and the Cyclic Shift Invariance Technique enhances the robustness of classification process.","",""
23,"S. Hoi, Michael R. Lyu","Robust face recognition using minimax probability machine",2004,"","","","",168,"2022-07-13 09:28:33","","10.1109/ICME.2004.1394428","","",,,,,23,1.28,12,2,18,"Face recognition has been widely explored. Many techniques have been applied in various applications. Robustness and reliability become more and more important for these applications especially, in security systems. A new face recognition approach is proposed based on a state-of-the-art classification technique called minimax probability machine (MPM). Engaging the binary MPM technique, we present a multi-class MPM classification for robust face recognition. In experiments, we compare our MPM-based face recognition algorithm with traditional techniques, including neural network and support vector machine. The experimental results show that the MPM-based face recognition technique is competitive and promising for robust face recognition","",""
