Cites,Authors,Title,Year,Source,Publisher,ArticleURL,CitesURL,GSRank,QueryDate,Type,DOI,ISSN,CitationURL,Volume,Issue,StartPage,EndPage,ECC,CitesPerYear,CitesPerAuthor,AuthorCount,Age,Abstract,FullTextURL,RelatedURL
3,"K. K. Halder, A. Rafiq","Vector Control of a Cost Effective FSTP Inverter Fed Synchronous Reluctance Motor Drive Based on Recurrent Neural Network",2011,"","","","",83,"2022-07-13 09:28:33","","","","",,,,,3,0.27,2,2,11,"This paper proposes a position sensorless vector control methodology for Synchronous Reluctance Motor (SynRM) drive. In this control scheme, instead of a conventional Six Switch Three Phase (SSTP) inverter a Four Switch Three Phase (FSTP) inverter is used. The reduction of the number of power switches from six to four improves the cost-effectiveness, volumecompactness and reliability of the three phase inverters. The control system estimates the motor stator flux and its position using a Recurrent Neural Network (RNN). A simulation model of the drive system is developed and analyzed in order to validate the proposed approach. The robustness of the drive system is tested for different operating conditions. Simulation results show that the proposed drive system provides a fast speed response and good disturbance rejection capability.","",""
2,"Zhang Neng","Position sensorless control of SRM using neural network",2011,"","","","",84,"2022-07-13 09:28:33","","","","",,,,,2,0.18,2,1,11,"As position sensor of switched reluctance motor(SRM) increases system cost and complexity,while reduces robustness and reliability,sensorless control of SRM based on DSP was proposed.A neural network of rotor position estimation for SRM sensorless drive was set up.On-line learning algorithms and training steps were also given.Neural network on-line training algorithm was achieved by TMS320F2812 DSP,and 15kW three-phase 12/8 pole sensorless SRD was set up.Experimental results show that the system has a good dynamic performance and high accuracy position detection with maximum error less than 2°.","",""
1,"Liu Yue-ting","Study on boiler temperature system PID control based on RBF neural network",2011,"","","","",85,"2022-07-13 09:28:33","","","","",,,,,1,0.09,1,1,11,"Aim To improve the reliability and security of the temperature control system of boiler in power plant and achieve precise control. Methods PID controller based on RBF(Radial Basis Function)neural network is proposed.Three neural network layers are created. Results Gradient information can be obtained through identification of the RBF neural network on line in the RBF-PID control process and then three PID parameters are set according to the gradient information on line,thus improving the quality of the control system. Conclusion Simulation results show that the RBF-PID control can achieve a stronger robustness,a better adaptability and control effect than traditional PID control.","",""
1,"D. Prince Winston, M. Saravanan, S. Arockia Edwin Xavier","Neural Network Based New Energy Conservation Scheme for Three Phase Induction Motor Operating under Varying Load Torques",2011,"","","","",86,"2022-07-13 09:28:33","","10.1109/PACC.2011.5978959","","",,,,,1,0.09,0,3,11,"Due to robustness, reliability, low price and maintenance free operation, induction motors are used in most of the industrial applications. The need for energy conservation is increasing nowadays due to continuous increase in energy demand. The influence of these motors in energy intensive industries is significant in total operational cost. This paper describes a new energy conservation scheme for three phase induction motor with the help of neural network. In this new energy conservation scheme voltage compensation was employed for the various load conditions. Here neural network is used to control the voltage level for the various load conditions. Matlab simulation is done for 5 Hp, 400V, 50Hz and 7.3A three phase squirrel cage induction motor employing the new energy conservation scheme with the help of neural network.","",""
1,"N. Koolen, I. Gligorijevic, S. Huffel","Reliability of Statistical Features Describing Neural Spike Trains in the Presence of Classification Errors",2012,"","","","",87,"2022-07-13 09:28:33","","10.5220/0003702501690173","","",,,,,1,0.10,0,3,10,"In order to investigate functioning of the brain processes, it is important to have reliable processing of neural activity. For precise tracking of local neural network processes, reliable clustering of single neurons’ action potentials (spikes) is necessary. So far, it was common to keep the signals of high quality and discard the others. This work examines the possibility of extracting reliable information from bad quality signals, in the presence of spike classification errors. We tested the robustness and information capacity of several statistical parameters used to describe firing patterns of spike trains using simulated signals mimicking most common cases in nature. Although complete reconstruction of firing patterns is not always possible, we show that the approximation of the mean firing frequency as well as the detection of bursting processes can still be quantified successfully, thereby paving the way for future applications.","",""
5,"Mengze Zheng, Qingyu Liu","Application of LVQ neural network to car license plate recognition",2010,"","","","",88,"2022-07-13 09:28:33","","10.1109/ISKE.2010.5680862","","",,,,,5,0.42,3,2,12,"This paper presents a method based on LVQ neural network license plates recognition technology. The LVQ network structure is simple; however, it has stronger robustness and effectiveness. Experiment proves that adopting this method of identifying license plate has high reliability and recognition ability.","",""
2,"Bryan Stefan Galani Pernambuco, Cristiano Rafael Steffens, Jefferson R. Pereira, Adriano Velasque Werhli, R. Zelir Azzolin, Emanuel da Silva Diaz Estrada","Online Sound Based Arc-Welding Defect Detection Using Artificial Neural Networks",2019,"","","","",89,"2022-07-13 09:28:33","","10.1109/LARS-SBR-WRE48964.2019.00053","","",,,,,2,0.67,0,6,3,"Heavy steel industries are constantly distressed with improving quality, reliability, and robustness of their product. Nevertheless, they are also concerned with reducing welding processes cost, men-power, and material waste. This leads to an interest in control techniques, automation, and robotization. Monitoring the welding process of continuously fed melting wire electrode is still an open problem, due to the instability caused by the electrical variables. We identify expressive gaps in the understanding of stability and quality of welding deposition. In this work, we introduce a low-cost system that monitors the stability of the weld bead and the transfer mode of the MIG/MAG welding process. We propose a non-intrusive solution that uses the sound signal produced by the electric arc to monitor and analyze the process in real-time. In this sense, we propose an Artificial Neural Network (ANN) based methodology to identify some types of discontinuities in the welding process. To support and foster the development of sound signal based neural network, we produce a sound signal dataset based on the experiments which recreate real situations in the welding industry. Processes with adequate conditions and welds with two types of discontinuities were executed to validate the methodology. The model performance is evaluated using both classification accuracy and confusion matrix. Results show to be possible to identify discontinuities in the welding process by looking only at the sound generated by the electric arc.","",""
9,"Jemaa Brahmi, L. Krichen, A. Ouali","Sensorless control of PMSG in WECS using artificial neural network",2009,"","","","",90,"2022-07-13 09:28:33","","10.1109/SSD.2009.4956689","","",,,,,9,0.69,3,3,13,"This paper presents an artificial neural network (ANN) observer for a speed sensorless permanent magnet synchronous generator (PMSG) in wind energy conversion system (WECS). In order to perform maximum power point tracking control of the wind generation system, it is necessary to drive wind turbine at an optimal rotor speed. From the aspect of reliability and increase in cost, wind velocity sensor is not preferred too. Wind and rotor speeds sensorless operating methods for wind generation system using observer are proposed only by measuring phase voltages and currents. Maximum wind energy extraction is achieved by running the wind turbine generator in variable-speed mode. The robustness of the ANN against stator resistance variation is studied.","",""
7,"Dongdong Gu, Xiaohuan Cao, S. Ma, Lei Chen, Guocai Liu, D. Shen, Z. Xue","Pair-Wise and Group-Wise Deformation Consistency in Deep Registration Network",2020,"","","","",91,"2022-07-13 09:28:33","","10.1007/978-3-030-59716-0_17","","",,,,,7,3.50,1,7,2,"","",""
25,"Paulo Chaves, T. Kojiri","Conceptual fuzzy neural network model for water quality simulation",2007,"","","","",92,"2022-07-13 09:28:33","","10.1002/HYP.6279","","",,,,,25,1.67,13,2,15,"Artificial neural networks (ANNs) have been applied successfully in various fields. However, ANN models depend on large sets of historical data, and are of limited use when only vague and uncertain information is available, which leads to difficulties in defining the model architecture and a low reliability of results. A conceptual fuzzy neural network (CFNN) is proposed and applied in a water quality model to simulate the Barra Bonita reservoir system, located in the southeast region of Brazil. The CFNN model consists of a rationally‐defined architecture based on accumulated expert knowledge about variables and processes included in the model. A genetic algorithm is used as the training method for finding the parameters of fuzzy inference and the connection weights. The proposed model may handle the uncertainties related to the system itself, model parameterization, complexity of concepts involved and scarcity and inaccuracy of data. The CFNN showed greater robustness and reliability when dealing with systems for which data are considered to be vague, uncertain or incomplete. The CFNN model structure is easier to understand and to define than other ANN‐based models. Moreover, it can help to understand the basic behaviour of the system as a whole, being a successful example of cooperation between human and machine. Copyright © 2006 John Wiley & Sons, Ltd.","",""
3,"Lin Lei, Houjun Wang, Chuanhua Dai","Fault Diagnosis for Wireless Sensor Network's Node Based on Hamming Neural Network and Rough Set",2008,"","","","",93,"2022-07-13 09:28:33","","10.1109/RAMECH.2008.4681504","","",,,,,3,0.21,1,3,14,"To accurately diagnose node fault in wireless sensor network (WSN) can improve long-distance service of nodes in WSN, assure reliability of information transfer and prolong lifetime of WSN. In this paper, a novel method of fault diagnosis for node of WSN was brought forward. First, attribute reduction for decision-making of fault diagnosis could be founded based discernibility matrix in rough set theory. Furthermore, a set of model for node's fault diagnosis in WSN could be built through classification algorithm based on attribute matching. Finally, a set of method for fault classification was founded by hamming network. The result of simulation shows that characteristics of this method are as follows: high veracity of diagnosis, a little expenditure of communication, low energy consumption and strong robustness.","",""
10,"Sin-Ho Lee, Jin Bae Park, Y. Choi","Terminal sliding mode control of nonlinear chaotic systems using self-recurrent wavelet neural network",2007,"","","","",94,"2022-07-13 09:28:33","","10.1109/ICCAS.2007.4406603","","",,,,,10,0.67,3,3,15,"In this paper, we design a self-recurrent wavelet neural network (SRWNN) based terminal sliding mode controller for nonlinear chaotic systems with uncertainties. The nonlinear chaotic systems are decomposed into a sum of a nominal nonlinear part and uncertainty term. The terminal sliding mode control (TSMC) method which has been used to control the system robustly can drive the tracking errors to zero in a finite time. In addition, the TSMC has the advantages such as improved performance, robustness, reliability and precision by contrast with the classical sliding mode control (CSMC). For the control of nonlinear chaotic system with various uncertainties, we employ the SRWNN which is used for the prediction of uncertainties. The weights of SRWNN are trained by adaptive laws based on Lyapunov stability theorem. Finally, we carry out simulations on two nonlinear chaotic systems such as Duffing system and Lorenz system to illustrate the effectiveness of the proposed control.","",""
10,"Austin P. Arechiga, Alan J. Michaels","The effect of weight errors on neural networks",2018,"","","","",95,"2022-07-13 09:28:33","","10.1109/CCWC.2018.8301749","","",,,,,10,2.50,5,2,4,"Neural networks have moved beyond theoretical equations and into real-world applications. In order for neural networks to be useful in real-world environments, their reliability in non-ideal computing conditions must be understood. Cyber and environmental threats can both affect the execution of neural network programs, but little is known about how well neural networks can withstand attack. This paper examines the robustness of Multilayer Perceptron (MLP) neural networks and Convolutional Neural Networks (CNNs) against weight errors. Specifically, Single Event Upset (SEU) style errors such as individual bit flips in memory are the focus. The classification accuracy of the networks is tested before and after bit flips to see if there's any correlation between neural network architecture and robustness to weight errors. The experimental results show that in general MLP networks are much more robust to weight errors than CNNs. For MLPs larger networks with more layers are more robust than smaller, shallower networks and for CNNs networks with larger kernels are more robust than networks with smaller kernels.","",""
4,"Yongwei Li, Shiqiang Hu, Peng Guo","Neural Network Based Visual Tracking with Multi-cue Adaptive Fusion",2007,"","","","",96,"2022-07-13 09:28:33","","10.1007/978-3-540-72395-0_116","","",,,,,4,0.27,1,3,15,"","",""
10,"Tao Ji, Qingle Pang, Xinyun Liu","Study on Fault Line Detection Based on Genetic Artificial Neural Network in Compensated Distribution System",2006,"","","","",97,"2022-07-13 09:28:33","","10.1109/ICIA.2006.305965","","",,,,,10,0.63,3,3,16,"The faulty line detection of single phase to earth fault in power system with neutral grounding via arc suppression coil has not been well solved. The commonly used single faulty line detection methods, such as wavelet transform method, the fifth harmonic current method and zero sequence current active components method, etc., can only process partial fault information, so their reliability of faulty line detection is not satisfied. By means of constructing both relative fault measurement function and confirmable fault measurement function the fault measurement function of each faulty line detection method is determined, then using genetic neural network the intelligent fusion of practical fault measurements of those faulty line detection methods is conducted, thereby the faulty line detection result with higher reliability can be obtained. Simulation results by EMTP show that the faulty line detection result by the proposed method is more precise and possesses stronger robustness","",""
2,"Xie Ke-ming","The Temperature Control of Cement Decomposing Furnace Based on Immune Neural Network",2007,"","","","",98,"2022-07-13 09:28:33","","","","",,,,,2,0.13,2,1,15,"This paper ensures the math model of gas temperature of cement decomposing furnace exit by analyzing its character.Establishes the control system with BP neural network,keeps the exit gas temperature in specified range by controlling the coal and wind quantity.To the convergence speed slowly and trapped in local optimal value which appears often in the common BP neural network weight value update,optimizes the weight value with modified immune algorithm.The simulation results show that the temperature control system is better than usual neural network PID with better reliability,adaptation and robustness.","",""
0,"X. Ying-cheng","Application of Fuzzy Neural-network Control System to Heating Process Furnace",2007,"","","","",99,"2022-07-13 09:28:33","","","","",,,,,0,0.00,0,1,15,"The paper introduces a control system of heating process furnace based on the fuzzy neural-network.The system has advantages of simple operation,strong robustness and good reliability.","",""
7,"S. H. Subri, H. Haron, R. Sallehuddin","Neural network corner detection of vertex chain code",2006,"","","","",100,"2022-07-13 09:28:33","","","","",,,,,7,0.44,2,3,16,"This paper presents a Neural Network Classifier to be implemented in corner detection of chain code series. The classifier directly uses chain code which is derived using Freeman chain code as training, testing and validation set. The steps of developing Neural Network Classifier are included in this paper. Comparison results between Neural Network Classifier corner detection and other computational corner detection are presented to show the reliability of the proposed classifier. This paper ends with the discussions on the implementation of proposed neural network in corner detection of chain code series. Experimental results have shown that the proposed network has good robustness and detection performance. This makes this method a great choice for machine vision.","",""
1,"R. G. D. Silva, D. Galeazzi, M. B. Schwedersky, Felippe Kalil Mendonça, Alberto Viviani Bonamigo, Cleber Marques","An adaptive orbital system based on laser vision sensor for pipeline GMAW welding",2021,"","","","",101,"2022-07-13 09:28:33","","10.1007/s40430-021-03081-7","","",,,,,1,1.00,0,6,1,"","",""
1,"Q. Gao, X. Wu, Junhui Guo, Hongqing Zhou, Wei Ruan","Machine-Learning-Based Intelligent Mechanical Fault Detection and Diagnosis of Wind Turbines",2021,"","","","",102,"2022-07-13 09:28:33","","10.1155/2021/9915084","","",,,,,1,1.00,0,5,1,"Wind power has gained wide popularity due to the increasingly serious energy and environmental crisis. However, the severe operational conditions often bring faults and failures in the wind turbines, which may significantly degrade the security and reliability of large-scale wind farms. In practice, accurate and efficient fault detection and diagnosis are crucial for safe and reliable system operation. This work develops an effective deep learning solution using a convolutional neural network to address the said problem. In addition, the linear discriminant criterion-based metric learning technique is adopted in the model training process of the proposed solution to improve the algorithmic robustness under noisy conditions. The proposed solution can efficiently extract the features of the mechanical faults. The proposed algorithmic solution is implemented and assessed through a range of experiments for different scenarios of faults. The numerical results demonstrated that the proposed solution can well detect and diagnose the multiple coexisting faults of the operating wind turbine gearbox.","",""
19,"G. Zhong, Mengfei Zi, Chuanlai Ren, Q. Xiao, Mingkai Tang, Liyu Wei, F. An, S. Xie, Jinbin Wang, X. Zhong, Mingqiang Huang, Jiangyu Li","Flexible electronic synapse enabled by ferroelectric field effect transistor for robust neuromorphic computing",2020,"","","","",103,"2022-07-13 09:28:33","","10.1063/5.0013638","","",,,,,19,9.50,2,12,2,"Neuromorphic computing has the potential to accelerate high performance parallel and low power in-memory computation, artificial intelligence, and adaptive learning. Despite emulating the basic functions of biological synapses well, the existing artificial electronic synaptic devices have yet to match the softness, robustness, and ultralow power consumption of the brain. Here, we demonstrate an all-inorganic flexible artificial synapse enabled by a ferroelectric field effect transistor based on mica. The device not only exhibits excellent electrical pulse modulated conductance updating for synaptic functions but also shows remarkable mechanical flexibility and high temperature reliability, making robust neuromorphic computation possible under external disturbances such as stress and heating. Based on its linear, repeatable, and stable long-term plasticity, we simulate an artificial neural network for the Modified National Institute of Standards and Technology handwritten digit recognition with an accuracy of 94.4%. This work provides a promising way to enable flexible, low-power, robust, and highly efficient neuromorphic computation that mimics the brain.","",""
6,"W. Godoy, I. D. da Silva, A. Goedtel, R. H. Palácios, G. H. Bazan, Daniel Morinigo-Sotelo","An application of artificial neural networks and PCA for stator fault diagnosis in inverter-fed induction motors",2016,"","","","",104,"2022-07-13 09:28:33","","10.1109/ICELMACH.2016.7732822","","",,,,,6,1.00,1,6,6,"This paper presents a method for fast classification of stator short-circuit faults in a inverter-fed induction motor operating at steady-state, under a wide range of speed and load conditions. Induction motors are widely used in several industrial applications due to its robustness, low cost and high reliability. Early detection and proper fault diagnosis reduce the maintenance cost and also increase process effectiveness. The amplitude of the stator current signal, in the time domain is presented as input to a multilayer perceptron (MLP) network for the classification of stator faults. After a proper discretization of the current signal, the technique of principal components analysis (PCA) is applied allowing a reduction of the classifier complexity. Results obtained from 750 experimental tests are provided and compared to validate this study. The obtained results indicate that this approach can be employed to classify stator short-circuit faults in inverter-fed induction motors.","",""
0,"Saeid Jorkesh, J. Poshtan, Hamideh Jafari","Intelligent Fault Diagnosis of an Induction motor in Electro-pump using Data Fusion",2021,"","","","",105,"2022-07-13 09:28:33","","","","",,,,,0,0.00,0,3,1,"In this paper, the performance of the neural network in diagnosing an induction motor situations (safe, bearing outer race, broken rotor bar and stator short circuit faults) has been evaluated using fusion ofthe pre-processed-current-and-voltagesignals information. Moreover, the robustness of the proposed approach is evaluated against the unbalanced power source and dry running of the electro-pump. Results indicate that the proposed neural data fusion has better reliability in this fault detection application, also provides more robust behavior.","",""
0,"Yujing Jiang, Xingjun Ma, S. Erfani, J. Bailey","Dual Head Adversarial Training",2021,"","","","",106,"2022-07-13 09:28:33","","10.1109/IJCNN52387.2021.9533363","","",,,,,0,0.00,0,4,1,"Deep neural networks (DNNs) are known to be vulnerable to adversarial examples/attacks, raising concerns about their reliability in safety-critical applications. A number of defense methods have been proposed to train robust DNNs resistant to adversarial attacks, among which adversarial training has so far demonstrated the most promising results. However, recent studies have shown that there exists an inherent tradeoff between accuracy and robustness in adversarially-trained DNNs. In this paper, we propose a novel technique Dual Head Adversarial Training (DH-AT) to further improve the robustness of existing adversarial training methods. Different from existing improved variants of adversarial training, DH-AT modifies both the architecture of the network and the training strategy to seek more robustness. Specifically, DH-AT first attaches a second network head (or branch) to one intermediate layer of the network, then uses a lightweight convolutional neural network (CNN) to aggregate the outputs of the two heads. The training strategy is also adapted to reflect the relative importance of the two heads. We empirically show, on multiple benchmark datasets, that DH-AT can bring notable robustness improvements to existing adversarial training methods. Compared with TRADES, one state-of-the-art adversarial training method, our DH-AT can improve the robustness by 3.4% against PGD40 and 2.3% against AutoAttack, and also improve the clean accuracy by 1.8%.","",""
3,"W. Zhaoyong, Li Luchuan, Zheng Hanrong, L. Jiajing, W. Xiao, Lu Bin, Ye Qing, Cai Haiwen, Qu Ronghui","Smart Distributed Acoustics/Vibration Sensing with Dual Path Network",2018,"","","","",107,"2022-07-13 09:28:33","","10.1364/OFS.2018.WF105","","",,,,,3,0.75,0,9,4,"A smart distributed acoustics/vibration sensing (DAVS) scheme with dual path network is proposed for complex applications in this manuscript. The dual path network has high parameter efficiency and strong generalization ability, which provides the reliability and the robustness. Novel spatial short-time frequency spectrum datasets are constructed and the distributed spatial features of disturbances are well utilized. To the best of our knowledge, it is the first time that such a hyper-deep neural network is applied into distributed fiber sensing field and the unique spatial dimension of DAVS is well exploited in datasets. Moreover, the scheme presented satisfying event-classification results in field tests of complicated railway safety monitoring as proof-of-concept. It provides a solution to high accuracy multi-event classification in complex and time-varying distributed safety monitoring applications.","",""
