Cites,Authors,Title,Year,Source,Publisher,ArticleURL,CitesURL,GSRank,QueryDate,Type,DOI,ISSN,CitationURL,Volume,Issue,StartPage,EndPage,ECC,CitesPerYear,CitesPerAuthor,AuthorCount,Age,Abstract,FullTextURL,RelatedURL
1,"Bingyang Luo, Shangjie Chi, M. Fang, Mengchao Li","Modeling and simulation of permanent magnet synchronous motor based on neural network control strategy",2017,"","","","",42,"2022-07-13 09:28:33","","10.1063/1.4977352","","",,,,,1,0.20,0,4,5,"Permanent magnet synchronous motor is used widely in industry, the performance requirements wouldn’t be met by adopting traditional PID control in some of the occasions with high requirements. In this paper, a hybrid control strategy - nonlinear neural network PID and traditional PID parallel control are adopted. The high stability and reliability of traditional PID was combined with the strong adaptive ability and robustness of neural network. The permanent magnet synchronous motor will get better control performance when switch different working modes according to different controlled object conditions. As the results showed, the speed response adopting the composite control strategy in this paper was faster than the single control strategy. And in the case of sudden disturbance, the recovery time adopting the composite control strategy designed in this paper was shorter, the recovery ability and the robustness were stronger.","",""
45,"M. Ahmadi","Developing a Robust Surrogate Model of Chemical Flooding Based on the Artificial Neural Network for Enhanced Oil Recovery Implications",2015,"","","","",43,"2022-07-13 09:28:33","","10.1155/2015/706897","","",,,,,45,6.43,45,1,7,"Application of chemical flooding in petroleum reservoirs turns into hot topic of the recent researches. Development strategies of the aforementioned technique are more robust and precise when we consider both economical points of view (net present value, NPV) and technical points of view (recovery factor, RF). In current study many attempts have been made to propose predictive model for estimation of efficiency of chemical flooding in oil reservoirs. To gain this end, a couple of swarm intelligence and artificial neural network (ANN) is employed. Also, lucrative and high precise chemical flooding data banks reported in previous attentions are utilized to test and validate proposed intelligent model. According to the mean square error (MSE), correlation coefficient, and average absolute relative deviation, the suggested swarm approach has acceptable reliability, integrity and robustness. Thus, the proposed intelligent model can be considered as an alternative model to predict the efficiency of chemical flooding in oil reservoir when the required experimental data are not available or accessible.","",""
16,"Jian Yang, Hangsheng Zhao, Xi Chen","Genetic algorithm optimized training for neural network spectrum prediction",2016,"","","","",44,"2022-07-13 09:28:33","","10.1109/COMPCOMM.2016.7925237","","",,,,,16,2.67,5,3,6,"Spectrum prediction forecasts future channel status based on history data, which partly solves the problem of robustness and reliability in spectrum sensing. A genetic algorithm optimized back propagation (GA-BP) training has been proposed to solve the problem that the neural network based spectrum prediction model always trapped in local optimal solution. Selection, crossover and mutation are performed to increase the randomness, which ensures the population converge to the set that contains the global optimal solution. Then the model continuously performs local searching with back propagation (BP) training. Simulation results show that the performance of GA-BP training outperforms BP training, and SU should choose training method according to his own requirements. The improvement of prediction accuracy will promote the application of spectrum prediction in cognitive radio networks, and maybe helpful to solve the problem in robustness and reliability of spectrum sensing.","",""
3,"Keunwoo Choi, György Fazekas, Kyunghyun Cho, M. Sandler","On the Robustness of Deep Convolutional Neural Networks for Music Classification",2017,"","","","",45,"2022-07-13 09:28:33","","","","",,,,,3,0.60,1,4,5,"Deep neural networks (DNN) have been successfully applied for music classification including music tagging. However, there are several open questions regarding generalisation and best practices in the choice of network architectures, hyperparameters and input representations. In this article, we investigate specific aspects of neural networks to deepen our understanding of their properties. We analyse and (re-)validate a large music tagging dataset to investigate the reliability of training and evaluation. We perform comprehensive experiments involving audio preprocessing using different time-frequency representations, logarithmic magnitude compression, frequency weighting and scaling. Using a trained network, we compute label vector similarities which is compared to groundtruth similarity. The results highlight several import aspects of music tagging and neural networks. We show that networks can be effective despite of relatively large error rates in groundtruth datasets. We subsequently show that many commonly used input preprocessing techniques are redundant except magnitude compression. Lastly, the analysis of our trained network provides valuable insight into the relationships between music tags. These results highlight the benefit of using data-driven methods to address automatic music tagging.","",""
4,"H. Ahmed, Kamel Mohamed","Neural-network-based speed controller for induction motors using inverse dynamics model",2016,"","","","",46,"2022-07-13 09:28:33","","10.1140/EPJP/I2016-16292-2","","",,,,,4,0.67,2,2,6,"","",""
13,"W. Yaici, E. Entchev, M. Longo, M. Brenna, F. Foiadelli","Artificial neural network modelling for performance prediction of solar energy system",2015,"","","","",47,"2022-07-13 09:28:33","","10.1109/ICRERA.2015.7418589","","",,,,,13,1.86,3,5,7,"This study sought to investigate the effect of the number of input variables on both the accuracy and the robustness of the artificial neural network (ANN) method for predicting the performance parameters of a solar energy system. Tests were conducted on a solar energy system in Ottawa, Canada during summer under different weather conditions. Three different ANN models, i.e., one each with nine, eight and seven input variables, were developed and compared to a baseline ANN model previously developed by the authors [14]. The experimental data were used for constructing the ANN models in order to assess their reliability. Each of the models was applied in an effort to predict several performance parameters of the system. The data revealed that the optimal algorithms and topologies were the Levenberg-Marquardt algorithm and the structure with 9/8/7 inputs, 20 hidden and 8 outputs, respectively. The simulation results demonstrated the efficiency of this approach and delivered a good measure of precision, even with models employing reduced input variables. However, it is likely true that the degree of model accuracy would gradually decrease with reduced inputs. Overall, the results of this contribution reveal that the ANN technique provides both high precision and strong robustness for predicting the performance of highly nonlinear energy systems.","",""
33,"S. Pierce, Y. Ben-Haim, K. Worden, G. Manson","Evaluation of Neural Network Robust Reliability Using Information-Gap Theory",2006,"","","","",48,"2022-07-13 09:28:33","","10.1109/TNN.2006.880363","","",,,,,33,2.06,8,4,16,"A novel technique for the evaluation of neural network robustness against uncertainty using a nonprobabilistic approach is presented. Conventional optimization techniques were employed to train multilayer perceptron (MLP) networks, which were then probed with an uncertainty analysis using an information-gap model to quantify the network response to uncertainty in the input data. It is demonstrated that the best performing network on data with low uncertainty is not in general the optimal network on data with a higher degree of input uncertainty. Using the concepts of information-gap theory, this paper develops a theoretical framework for information-gap uncertainty applied to neural networks, and explores the practical application of the procedure to three sample cases. The first consists of a simple two-dimensional (2-D) classification network operating on a known Gaussian distribution, the second a nine-lass vibration classification problem from an aircraft wing, and the third a two-class example from a database of breast cancer incidence","",""
3,"S. Pierce, K. Worden, G. Manson","Information-gap robustness of a neural network regression model",2004,"","","","",49,"2022-07-13 09:28:33","","","","",,,,,3,0.17,1,3,18,"As a result of their black-box nature, neural networks resist traditional methods of certification and therefore cannot be used in safety critical applications. This situation is undesirable as neural networks can provide an effective solution to many engineering problems. The object of the current paper is to explore the possibility of quantifying and qualifying the reliability of neural networks by a means outside the traditional framework. The approach used here will follow Ben-Haim’s information-gap theory of uncertainty. This is a non-probabilistic approach which may lend itself well to certification of black-box systems. The approach is demonstrated here on a neural network regression model of the process of pre-sliding friction between solids.","",""
6,"Jinyu Yang, Chunyuan Li, Weizhi An, Hehuan Ma, Yuzhi Guo, Yu Rong, P. Zhao, Junzhou Huang","Exploring Robustness of Unsupervised Domain Adaptation in Semantic Segmentation",2021,"","","","",50,"2022-07-13 09:28:33","","10.1109/iccv48922.2021.00906","","",,,,,6,6.00,1,8,1,"Recent studies imply that deep neural networks are vulnerable to adversarial examples, i.e., inputs with a slight but intentional perturbation are incorrectly classified by the network. Such vulnerability makes it risky for some security-related applications (e.g., semantic segmentation in autonomous cars) and triggers tremendous concerns on the model reliability. For the first time, we comprehensively evaluate the robustness of existing UDA methods and propose a robust UDA approach. It is rooted in two observations: i) the robustness of UDA methods in semantic segmentation remains unexplored, which poses a security concern in this field; and ii) although commonly used self-supervision (e.g., rotation and jigsaw) benefits model robustness in classification and recognition tasks, they fail to provide the critical supervision signals that are essential in semantic segmentation. These observations motivate us to propose adversarial self-supervision UDA (or ASSUDA) that maximizes the agreement between clean images and their adversarial examples by a contrastive loss in the output space. Extensive empirical studies on commonly used benchmarks demonstrate that ASSUDA is resistant to adversarial attacks.","",""
5,"Faisal Alamri, Sinan Kalkan, N. Pugeault","Transformer-Encoder Detector Module: Using Context to Improve Robustness to Adversarial Attacks on Object Detection",2020,"","","","",51,"2022-07-13 09:28:33","","10.1109/ICPR48806.2021.9413344","","",,,,,5,2.50,2,3,2,"Deep neural network approaches have demonstrated high performance in object recognition (CNN) and detection (Faster-RCNN) tasks, but experiments have shown that such architectures are vulnerable to adversarial attacks (FFF, UAP): low amplitude perturbations, barely perceptible by the human eye, can lead to a drastic reduction in labelling performance. This article proposes a new context module, called Transformer-Encoder Detector Module, that can be applied to an object detector to (i) improve the labelling of object instances; and (ii) improve the detector's robustness to adversarial attacks. The proposed model achieves higher mAP, F1 scores and AUC average score of up to 13% compared to the baseline Faster-RCNN detector, and an mAP score 8 points higher on images subjected to FFF or UAP attacks due to the inclusion of both contextual and visual features extracted from scene and encoded into the model. The result demonstrates that a simple ad-hoc context module can improve the reliability of object detectors significantly.","",""
1,"R. Hochman","Software reliability engineering: an evolutionary neural network approach",1998,"","","","",52,"2022-07-13 09:28:33","","","","",,,,,1,0.04,1,1,24,"Author: Robert Hochman Title: Software Reliability Engineering: An Evolutionary Neural Network Approach Institution: Florida Atlantic University Thesis Advisor: Dr. Taghi M. Khoshgoftaar Degree: Master of Science Year: 1997 This thesis presents the results of an empirical investigation of the applicability of genetic algorithms to a real{world problem in software reliability | the fault{prone module identi cation problem. The solution developed is an e ective hybrid of genetic algorithms and neural networks. This approach (ENNs) was found to be superior, in terms of time, e ort, and con dence in the optimality of results, to the common practice of searching manually for the best{performing net. Comparisons were made to discriminant analysis. On fault{prone, not{fault{prone, and overall classi cation, the lower error proportions for ENNs were found to be statistically signi cant. The robustness of ENNs follows from their superior performance over many data con gurations. Given these encouraging results, it is suggested that ENNs have potential value in other software reliability problem domains, where genetic algorithms have been largely ignored. For future research, several plans are outlined for enhancing ENNs with respect to accuracy and applicability. v To my father, 1904 { 1994 TABLE OF CONTENTS FIGURES : : : : : : : : : : : : : : : : : : : : : : : : : : : : : : : : : : : : ix TABLES : : : : : : : : : : : : : : : : : : : : : : : : : : : : : : : : : : : : : x Chapter","",""
2,"A. Rawicz, D. Girling","Neural-network enhancement for a reliability expert-system",1994,"","","","",53,"2022-07-13 09:28:33","","10.1109/RAMS.1994.291153","","",,,,,2,0.07,1,2,28,"An inexpensive diagnostic system called Ride Expert recognizing rough ride problems and their causes in heavy trucks has been designed and built using expert system architecture. Two sources of input information were utilized in this system: a multiprobe vibration analysis system (MVAS) and a driver and/or technician from truck services. It was soon apparent a classic expert system approach was impractical due to the enormous number of inference rules necessary to draw diagnostic conclusions. To reduce this requirement we added a neural network trained to analyze data acquired from MVAS. It greatly improved Ride Expert's robustness and reduced the number of necessary rules to about 1/3. This paper presents the Ride Expert development stages and what we have learned from this process.<<ETX>>","",""
3,"W. Weidon","Simulation of solar radiation in Lanzhou based on BP neural network",2014,"","","","",54,"2022-07-13 09:28:33","","","","",,,,,3,0.38,3,1,8,"A BP artificial neural network model was developed to predict monthly mean daily global solar radiation of Lanzhou by using the meteorological observation data.The model used the interpretation diagram method and connection weights method to compute the relative contribution of each input variable for estimating the importance to the output variable.Then,the redundant input variables can be eliminated.The measured meteorology values from 1971 to 1995 for Lanzhou station were used for the training of the network.Then we can predict the solar radiation from 1996 to 2000 with the simplified network.The measured values of monthly mean daily global solar radiation for Lanzhou station were analyzed to test the network model.The experimental results indicate that the method can increase the transparency of model and improve the reliability and robustness of the model.The model has the smaller error and the higher precision.The coefficient of determination is 0.987.Results have shown better agreement between the estimated and measured values of global solar radiation than other empirical models.Therefore,using the BP neural network model with the meteorological observation data is a very effective method to predict the solar radiation of some region which has no radiation observation sites.","",""
3,"E. Dianderas, K. Rojas, G. Kemper","Identification and cadastral registration of water bodies through multispectral image processing with multi-layer Perceptron Neural Network",2014,"","","","",55,"2022-07-13 09:28:33","","10.1109/STSIVA.2014.7010132","","",,,,,3,0.38,1,3,8,"In this article is developed a technique that allows to calculate the presence of vegetation, glaciers and water bodies through multispectral image processing employing a Multi-layer Perceptron Neural Netwok, giving the option to discriminate the presence of lakes to generate the cadastral registration of these. The supervised classification that was implemented has a high level of robustness and reliability, since the validation of the data obtained at a geolocation level have a 0% of error and the parameters of the area and perimeter an approximate error of 10%.","",""
4,"Lin Zhang, Baojie Xu, Kun-Li Wen, Yuanhui Li","The Study of Permanent Magnetic Synchronous Motor Control System Through the Combination of BP Neural Network and PID Control",2013,"","","","",56,"2022-07-13 09:28:33","","10.1007/978-1-4614-6747-2_38","","",,,,,4,0.44,1,4,9,"","",""
1,"J. Liu, G. Wang","The Optimization of Adaptive PID Control Algorithm Based on RBF Neural Network",2014,"","","","",57,"2022-07-13 09:28:33","","10.4028/WWW.SCIENTIFIC.NET/AMR.998-999.943","","",,,,,1,0.13,1,2,8,"As the earliest practical controller, PID controller has more than 50 years of history, and it is still the most widely used and most common industrial controllers. PID controller is simple to understand and use, without a prerequisite for an accurate model of the physical system, thus become the most popular, the most common controller. The reason why PID controller is the first developed one is that its simple algorithm, robustness and high reliability. It is widely used in process control and motion control, especially for accurate mathematical model that can be established deterministic control system. But the conventional PID controller tuning parameters are often poor performance, poor adaptability to the operating environment. The neural network has a strong nonlinear mapping ability, competence, self-learning ability of associative memory, and has a viable quantities of information processing methods and good fault tolerance.","",""
1,"K. Mendaz, H. Bounoua, B. Benazza","DIAGNOSTIC FAULT OF THE INDUCTION MACHINE WITH APPLICATION OF THE NEURAL NETWORK",2014,"","","","",58,"2022-07-13 09:28:33","","10.15546/AEEI-2014-0009","","",,,,,1,0.13,0,3,8,"Although the asynchronous machine is known by its qualities of robustness and low cost of construction, however, it happen that it has an electrical or mechanical fault. This article presented rotoric faults which are treated as part of the detection of broken bars, and the inverter faults (switch fault). This detection technique is based on neural network. The simulation was elaborated on Matlab/Simulink that show results used to assess the performance of the technique presented. Keyword: asynchronous machine, diagnostic, rotoric faults, broken bar, five Levels inverter, neural network. 1. I NTRODUCTION The induction machine is largely used in industry, mainly due to its reliability and relatively low cost. The control of the induction machine must take into account machine specificities: the high order of the model, the nonlinear functioning as well as the coupling between the different variables of control. The new industrial applications necessitate speed variations having high dynamic performances, a good precision in permanent regime, and high capacity of overload on all rang of speed and robustness to the different perturbation. The voltage source inverters construct a non controllable function in the power electronic; it is used in the variable application domains. The strategy obtaining by this technique is based on the study of variation speed in induction machine. The strong functional evolution was based, on one hand, the development of components for semi-conductor entirely commendable, ability, and robustness, the other hand, on the quasi generalized used of the technique pulse width modulation (PWM) (1) (2).The five levels inverter structural is more adapted in the ground power application, because the output voltage and current presented a reduction of the harmonic distortion.","",""
6,"L. Lazli, M. Boukadoum","Hidden Neural Network for Complex Pattern Recognition: A Comparison Study with Multi- Neural Network Based Approach",2013,"","","","",59,"2022-07-13 09:28:33","","10.5963/LSMR0306003","","",,,,,6,0.67,3,2,9,"When the feature space undergoes changes, owing to different operating and environmental conditions, multi-aspect classification is almost a necessity in order to maintain the performance of the pattern recognition system and improve robustness and reliability in decision making. This is an important issue being investigated in ANN research, in many cases, the problems can be solved more effectively by combining one or two other techniques rather than implementing ANN exclusively. New learning methods, especially multiple classifier systems, are now actively studied and applied in pattern recognition. So, the main goal of this paper is to propose two hybrid models and compare your performance in complex pattern recognition problem: speech recognition and biomedical diagnosis. This paper compare, the performance obtained with (1) Multi-network RBF/LVQ structure, we use involves Learning Vector Quantization (LVQ) as a competitive decision processor and Radial Basis Function (RBF) as a classifier. (2) Hybrid HMM/MLP model using a Multi Layer-Perceptron (MLP) to estimate the Hidden Markov Models (HMM) emission probabilities. For pre- classification, the k-means clustering algorithm is proposed to obtain optimum information for the biomedical and speech training data for the proposed hybrid models.","",""
2,"Fernando Parra, A. P. Lima, F. R. Chavarette, S. Silva, F. Souza","A RTMAP-Fuzzy Artificial Neural Network Applied to the Monitoring and Fault Identification in Structural",2013,"","","","",60,"2022-07-13 09:28:33","","","","",,,,,2,0.22,0,5,9,"Abstract. This paper presents an ARTMAP-Fuzzy artificial neural network for monitoring and fault diagnosis in mechanical structures. The goal is to use the ARTMAP-Fuzzy neural network in the identification and characterization of structural failure. This methodology can help professionals in the inspection of mechanical structures, identifying and characterizing faults, in order to perform preventative maintenance and decision-making. In order to validate the methodology we propose the modeling and simulation of signals from a numerical model using an aluminum beam. The results show the efficiency, robustness and accuracy of the methodology adopted. 1. Introduction Increasingly preventive maintenance has been used in industries, businesses, buildings, machinery monitoring, among others. Its use is justified by the need to reduce costs and increase reliability and safety of structures and equipment, preventing disasters from structural failures [5]. Structural failure can occur due to several factors, such as wear of a component, loosening of bolted joints, cracks or even the combination of these elements. Regardless of the origin and intensity, in most cases, structural failure causes an appreciable variation in the spatial parameters of structure, such as reduction in structural rigidity, slight reduction in mass and an increase in damping, which leads to a change of the dynamic behavior structure. Thus the spatial variation of the parameters affects the main dynamic parameters, response functions, resonance frequencies, damping ratio and eigenmodes of the structure [10]. There are some preventive maintenance techniques based on non-destructive testing (NDT) that are applied in oil analysis, magnetic particle, liquid penetrant, methods based on vibration analysis, etc.","",""
1,"Zhu Liuyan","An Evaluation Method of Sky Wave Over-the-horizon Radar Operational Effectiveness Based on Fuzzy Neural Network",2013,"","","","",61,"2022-07-13 09:28:33","","","","",,,,,1,0.11,1,1,9,"In order to overcome the limitation of the traditional operational effectiveness evaluation technology and improve the reliability of operational effectiveness evaluation,an estimate model is proposed based on fuzzy neural network using some intelligent technologies,such as neural network,expert system,and fuzzy logic. The model can deal with fuzzy knowledge and have selfstudy ability. The estimate model overcomes the subjective and random fuzzy influence,and has a good robustness. In the end,a simulation is given to validate the effectiveness and reliability of the estimate model. The result can give a reference to the decisionmaking of the development,improvement,optimized deployment and combat application of the radar.","",""
8,"Zuoyi Chen, Yanzhi Wang, Jun Wu, C. Deng, Kui Hu","Sensor data-driven structural damage detection based on deep convolutional neural networks and continuous wavelet transform",2021,"","","","",62,"2022-07-13 09:28:33","","10.1007/S10489-020-02092-6","","",,,,,8,8.00,2,5,1,"","",""
