Cites,Authors,Title,Year,Source,Publisher,ArticleURL,CitesURL,GSRank,QueryDate,Type,DOI,ISSN,CitationURL,Volume,Issue,StartPage,EndPage,ECC,CitesPerYear,CitesPerAuthor,AuthorCount,Age,Abstract,FullTextURL,RelatedURL
0,"Georges Matar, Jean-Marc Lina, Julie Carrier, Anna Riley, Georges Kaddoum, IEEE","Internet of Things in Sleep Monitoring: An Application for Posture Recognition Using Supervised Learning",2016,"2016 Ieee 18th International Conference On E-Health Networking, Applications And Services (Healthcom)","","","",77,"2022-07-14 15:55:48","Proceedings Paper","","","",,,283,288,0,0.00,0,6,6,"","",""
0,"Joseph Constantin, Andre Bigand, Ibtissam Constantin","Pooling Spike Neural Network for Acceleration of Global Illumination Rendering",2017,"Advances In Computational Intelligence, Iwann 2017, Pt I","","","",78,"2022-07-14 15:55:48","Proceedings Paper","10.1007/978-3-319-59153-7_18","0302-9743","",10305,,199,211,0,0.00,0,3,5,"","",""
0,"Rahul Mangharam, Houssam Abbas, Madhur Behl, Kuk Jang, Miroslav Pajic, Zhihao Jiang, IEEE","Three Challenges in Cyber-Physical Systems",2016,"2016 8th International Conference On Communication Systems And Networks (Comsnets)","","","",79,"2022-07-14 15:55:48","Proceedings Paper","","2155-2487","",,,,,0,0.00,0,7,6,"","",""
0,"M Rosenblum","Immune systems are not just for making you feel better: They are for controlling autonomous robots",2005,"Unmanned Ground Vehicle Technology Vii","","","",80,"2022-07-14 15:55:48","Proceedings Paper","10.1117/12.605468","0277-786X","",5804,,191,202,0,0.00,0,1,17,"","",""
0,"Riddhish Bhalodia, Shireen Elhabian, Ladislav Kavan, Ross Whitaker","Leveraging unsupervised image registration for discovery of landmark shape descriptor",2021,"Medical Image Analysis","","","",81,"2022-07-14 15:55:48","Article","10.1016/j.media.2021.102157","1361-8415","",73,,,,0,0.00,0,4,1,"","",""
0,"H Eghbalnia, A Assadi","Learning optimal wavelets from overcomplete representations",2000,"Wavelet Applications In Signal And Image Processing Viii Pts 1 And 2","","","",82,"2022-07-14 15:55:48","Proceedings Paper","","0277-786X","",4119,,286,293,0,0.00,0,2,22,"","",""
0,"Isabelle Rivals, Cedric Sautier, Guillaume Cognon, Vincent Cuzuel","Evaluation of distance-based approaches for forensic comparison: Application to hand odor evidence",2021,"Journal Of Forensic Sciences","","","",83,"2022-07-14 15:55:48","Article","10.1111/1556-4029.14818","0022-1198","",66,6,2208,2217,0,0.00,0,4,1,"","",""
0,"Jorge E. Zambrano, Daniel P. Benalcazar, Claudio A. Perez, Kevin W. Bowyer","Iris Recognition Using Low-Level CNN Layers Without Training and Single Matching",2022,"Ieee Access","","","",84,"2022-07-14 15:55:48","Article","10.1109/ACCESS.2022.3166910","2169-3536","",10,,41276,41286,0,0.00,0,4,1,"","",""
